Name, Link, Profit, Cost, Sell, ROI %
Belt of the Guardian, https://wotlkdb.com/?spell=36389, 14304.8, 694.7, 14999.5, 2159.1
Red Belt of Battle, https://wotlkdb.com/?spell=36390, 10349.1581, 267.05, 10616.2081, 3975.4
Sageblade, https://wotlkdb.com/?spell=27832, 10114.8612, 1385.1388, 11500, 830.2
Nightfall, https://wotlkdb.com/?spell=23653, 5606.6279, 1192.7862, 6799.4141, 570
Frostguard, https://wotlkdb.com/?spell=16992, 3774.8638, 2525.1362, 6300, 249.5
Sulfuron Hammer, https://wotlkdb.com/?spell=21161, 3307.136, 6692.864, 10000, 149.4
Heavy Copper Longsword, https://wotlkdb.com/?spell=43549, 3288.98, 11.02, 3300, 29945.6
Felsteel Longblade, https://wotlkdb.com/?spell=29692, 2731.0206, 2668.9794, 5400, 202.3
Flamebane Breastplate, https://wotlkdb.com/?spell=29617, 2663.4, 336.6, 3000, 891.3
Spiked Deathdealers, https://wotlkdb.com/?spell=63192, 2479.25, 3520.75, 6000, 170.4
Dark Iron Helm, https://wotlkdb.com/?spell=23636, 2468.0964, 31.9036, 2500, 7836.1
Dark Iron Reaver, https://wotlkdb.com/?spell=20890, 2413.04, 186.96, 2600, 1390.7
Belt of the Titans, https://wotlkdb.com/?spell=63187, 2178.25, 3520.75, 5699, 161.9
Treads of Destiny, https://wotlkdb.com/?spell=63190, 2034.25, 3520.75, 5555, 157.8
Annihilator, https://wotlkdb.com/?spell=16991, 2019.1628, 1980.8372, 4000, 201.9
Dark Iron Gauntlets, https://wotlkdb.com/?spell=23637, 1894.7923, 105.2077, 2000, 1901
Dark Iron Sunderer, https://wotlkdb.com/?spell=15294, 1844.8, 155.7, 2000.5, 1284.8
Enchanted Adamantite Belt, https://wotlkdb.com/?spell=29608, 1836.98, 163.02, 2000, 1226.8
Dark Iron Destroyer, https://wotlkdb.com/?spell=20897, 1798.0692, 201.9308, 2000, 990.4
Indestructible Plate Girdle, https://wotlkdb.com/?spell=63191, 1786.25, 3520.75, 5307, 150.7
Enchanted Adamantite Boots, https://wotlkdb.com/?spell=29611, 1775.96, 224.54, 2000.5, 890.9
Steelgrip Gauntlets, https://wotlkdb.com/?spell=29662, 1738.0105, 1260.9895, 2999, 237.8
Whitesoul Helm, https://wotlkdb.com/?spell=16724, 1699.7606, 300.2394, 2000, 666.1
Enchanted Adamantite Breastplate, https://wotlkdb.com/?spell=29610, 1662.94, 337.56, 2000.5, 592.6
Enchanted Adamantite Leggings, https://wotlkdb.com/?spell=29613, 1651.42, 349.08, 2000.5, 573.1
Helm of the Stalwart Defender, https://wotlkdb.com/?spell=29664, 1581.93, 917.07, 2499, 272.5
Battlelord's Plate Boots, https://wotlkdb.com/?spell=63188, 1478.25, 3520.75, 4999, 142
Titanium Razorplate, https://wotlkdb.com/?spell=67093, 1432.3092, 4476.6908, 5909, 132
Boots of Kingly Upheaval, https://wotlkdb.com/?spell=70568, 1112.2398, 4652.76, 5764.9998, 123.9
Pillars of Might, https://wotlkdb.com/?spell=70567, 1063.3999, 7236.6, 8299.9999, 114.7
Legplates of Painful Death, https://wotlkdb.com/?spell=70565, 1023, 7577, 8600, 113.5
Sunforged Breastplate, https://wotlkdb.com/?spell=67095, 973.2987, 4625.4992, 5598.7979, 121
Protectors of Life, https://wotlkdb.com/?spell=70563, 944.24, 4652.76, 5597, 120.3
Wicked Mithril Blade, https://wotlkdb.com/?spell=9997, 938.8704, 61.1296, 1000, 1635.9
Truesilver Gauntlets, https://wotlkdb.com/?spell=9954, 934.8809, 65.1091, 999.99, 1535.9
Dazzling Mithril Rapier, https://wotlkdb.com/?spell=10005, 911.3702, 64.6298, 976, 1510.1
Phantom Blade, https://wotlkdb.com/?spell=10007, 842.6809, 157.319, 999.9999, 635.7
Breastplate of the White Knight, https://wotlkdb.com/?spell=67091, 795.0008, 5204.9992, 6000, 115.3
Titansteel Destroyer, https://wotlkdb.com/?spell=55369, 778.6, 2306.4, 3085, 133.8
Hellfrozen Bonegrinders, https://wotlkdb.com/?spell=70566, 742.9999, 5055, 5797.9999, 114.7
Blazing Rapier, https://wotlkdb.com/?spell=16978, 675.7016, 164.2984, 840, 511.3
Dark Iron Mail, https://wotlkdb.com/?spell=15293, 606.3326, 60, 666.3326, 1110.6
Icebane Girdle, https://wotlkdb.com/?spell=61009, 557.3999, 292.6, 849.9999, 290.5
Saronite Swordbreakers, https://wotlkdb.com/?spell=67092, 535.0004, 3064.9996, 3600, 117.5
Icebane Chestguard, https://wotlkdb.com/?spell=61008, 529.1999, 389.8, 918.9999, 235.8
Titanium Spikeguards, https://wotlkdb.com/?spell=67094, 511.2504, 3303.7496, 3815, 115.5
Black Dragonscale Breastplate, https://wotlkdb.com/?spell=19085, 496.65, 53.35, 550, 1030.9
Titansteel Guardian, https://wotlkdb.com/?spell=55371, 480.1998, 1767.8, 2247.9998, 127.2
Plate Girdle of Righteousness, https://wotlkdb.com/?spell=63189, 478.25, 3520.75, 3999, 113.6
Ornate Mithril Gloves, https://wotlkdb.com/?spell=9950, 457.8671, 42.1329, 500, 1186.7
Ornate Mithril Pants, https://wotlkdb.com/?spell=9945, 450.8001, 49.1999, 500, 1016.3
Ornate Mithril Shoulder, https://wotlkdb.com/?spell=9952, 446.6901, 53.3099, 500, 937.9
Icebane Treads, https://wotlkdb.com/?spell=61010, 446.3999, 292.6, 738.9999, 252.6
Ornate Mithril Boots, https://wotlkdb.com/?spell=9979, 437.0402, 62.9598, 500, 794.2
Ornate Mithril Breastplate, https://wotlkdb.com/?spell=9972, 430.5006, 69.4994, 500, 719.4
Tempered Titansteel Helm, https://wotlkdb.com/?spell=55373, 403.875, 1153.2, 1557.075, 135
Breastplate of the White Knight, https://wotlkdb.com/?spell=67130, 395.0008, 5204.9992, 5600, 107.6
Dark Iron Pulverizer, https://wotlkdb.com/?spell=15292, 391.9, 108.1, 500, 462.5
Titanium Plating, https://wotlkdb.com/?spell=62202, 386, 300, 686, 228.7
Titansteel Spellblade, https://wotlkdb.com/?spell=63182, 350.4999, 1746.5, 2096.9999, 120.1
Spiked Titansteel Helm, https://wotlkdb.com/?spell=55372, 336.8, 1153.2, 1490, 129.2
Searing Golden Blade, https://wotlkdb.com/?spell=15973, 335.2799, 44.7198, 379.9997, 849.7
Green Iron Gauntlets, https://wotlkdb.com/?spell=3336, 328.03, 4.97, 333, 6700.2
Titansteel Shield Wall, https://wotlkdb.com/?spell=56400, 308.55, 889.45, 1198, 134.7
Honed Cobalt Cleaver, https://wotlkdb.com/?spell=55174, 232.5979, 58.2, 290.7979, 499.7
Iron Shield Spike, https://wotlkdb.com/?spell=7221, 219.72, 5.28, 225, 4261.4
Vengeance Bindings, https://wotlkdb.com/?spell=55298, 215.15, 134.6, 349.75, 259.8
Spiked Titansteel Treads, https://wotlkdb.com/?spell=55375, 210.55, 889.45, 1100, 123.7
Dark Iron Shoulders, https://wotlkdb.com/?spell=15295, 186.05, 35.95, 222, 617.5
Brilliant Saronite Legplates, https://wotlkdb.com/?spell=55055, 160.365, 38.635, 199, 515.1
Tempered Titansteel Treads, https://wotlkdb.com/?spell=55376, 156.55, 889.45, 1046, 117.6
Ornate Saronite Gauntlets, https://wotlkdb.com/?spell=56553, 153.4, 134.6, 288, 214
Imperial Plate Belt, https://wotlkdb.com/?spell=16647, 144.7, 84.3, 229, 271.6
Heavy Mithril Helm, https://wotlkdb.com/?spell=9970, 141.05, 57.95, 199, 343.4
Heavy Mithril Pants, https://wotlkdb.com/?spell=9933, 139, 40, 179, 447.5
Savage Cobalt Slicer, https://wotlkdb.com/?spell=55177, 138.7, 61.3, 200, 326.3
Shining Silver Breastplate, https://wotlkdb.com/?spell=2675, 138.5412, 61.4588, 200, 325.4
Flamebane Gloves, https://wotlkdb.com/?spell=29616, 133.4212, 212.06, 345.4812, 162.9
Saronite Protector, https://wotlkdb.com/?spell=55013, 132.243, 34.2, 166.443, 486.7
Imperial Plate Helm, https://wotlkdb.com/?spell=16658, 132.0001, 166.9999, 299, 179
Adamantite Plate Gloves, https://wotlkdb.com/?spell=29605, 131.27, 67.73, 199, 293.8
Imperial Plate Chest, https://wotlkdb.com/?spell=16663, 129, 150, 279, 186
Imperial Plate Shoulders, https://wotlkdb.com/?spell=16646, 128.7, 99.3, 228, 229.6
Brilliant Saronite Gauntlets, https://wotlkdb.com/?spell=55056, 128.35, 50.4, 178.75, 354.7
Smelt Hardened Khorium, https://wotlkdb.com/?spell=46353, 125, 425, 550, 129.4
Puresteel Legplates, https://wotlkdb.com/?spell=70562, 123, 7755, 7878, 101.6
Imperial Plate Leggings, https://wotlkdb.com/?spell=16730, 119, 180, 299, 166.1
Cudgel of Saronite Justice, https://wotlkdb.com/?spell=56280, 115.4364, 85.02, 200.4564, 235.8
Moonsteel Broadsword, https://wotlkdb.com/?spell=3496, 109.8468, 40.1532, 150, 373.6
Saronite Spellblade, https://wotlkdb.com/?spell=59442, 104.75, 95.25, 200, 210
Ebon Hand, https://wotlkdb.com/?spell=23650, 102.3976, 1397.6024, 1500, 107.3
Tempered Saronite Boots, https://wotlkdb.com/?spell=54552, 99.6, 50.4, 150, 297.6
Felsteel Shield Spike, https://wotlkdb.com/?spell=29657, 97.22, 201.78, 299, 148.2
Brilliant Saronite Pauldrons, https://wotlkdb.com/?spell=59440, 94.1499, 66.6, 160.7499, 241.4
Imperial Plate Boots, https://wotlkdb.com/?spell=16657, 94, 135, 229, 169.6
Ornate Saronite Walkers, https://wotlkdb.com/?spell=56552, 92.4, 87.6, 180, 205.5
Savage Saronite Walkers, https://wotlkdb.com/?spell=55308, 92.1499, 87.6, 179.7499, 205.2
Savage Saronite Pauldrons, https://wotlkdb.com/?spell=55306, 91.9063, 73.6, 165.5063, 224.9
Pearl-handled Dagger, https://wotlkdb.com/?spell=6517, 90.95, 8.04, 98.99, 1231.2
Truesilver Breastplate, https://wotlkdb.com/?spell=9974, 87.5014, 162.4986, 250, 153.8
Savage Saronite Waistguard, https://wotlkdb.com/?spell=55307, 87.15, 73.6, 160.75, 218.4
Adamantite Plate Bracers, https://wotlkdb.com/?spell=29603, 87.035, 41.59, 128.625, 309.3
Savage Saronite Gauntlets, https://wotlkdb.com/?spell=55309, 85.2888, 134.6, 219.8888, 163.4
Savage Saronite Bracers, https://wotlkdb.com/?spell=55305, 83.4997, 96.5, 179.9997, 186.5
Titansteel Shanker, https://wotlkdb.com/?spell=56234, 81.2, 1767.8, 1849, 104.6
Spiked Cobalt Helm, https://wotlkdb.com/?spell=54917, 76.9999, 14, 90.9999, 650
Tempered Saronite Belt, https://wotlkdb.com/?spell=54551, 75.525, 39.75, 115.275, 290
Repair the Blade of Heroes, https://wotlkdb.com/?spell=11923, 72.135, 27.865, 100, 358.9
Heavy Mithril Shoulder, https://wotlkdb.com/?spell=9926, 72.0006, 37.9994, 110, 289.5
Brilliant Saronite Helm, https://wotlkdb.com/?spell=59441, 71.415, 78.585, 150, 190.9
Ornate Saronite Bracers, https://wotlkdb.com/?spell=56549, 68.5, 96.5, 165, 171
Savage Saronite Hauberk, https://wotlkdb.com/?spell=55311, 68.3199, 81.68, 149.9999, 183.6
Savage Saronite Legplates, https://wotlkdb.com/?spell=55310, 67.3999, 107.6, 174.9999, 162.6
Adamantite Breastplate, https://wotlkdb.com/?spell=29606, 67.23, 81.77, 149, 182.2
Helm of Command, https://wotlkdb.com/?spell=55302, 66.3, 145.7, 212, 145.5
Saronite Ambusher, https://wotlkdb.com/?spell=55179, 63.33, 47.17, 110.5, 234.3
Stronghold Gauntlets, https://wotlkdb.com/?spell=16741, 62.4015, 1937.5985, 2000, 103.2
Savage Saronite Skullshield, https://wotlkdb.com/?spell=55312, 61.3, 98.7, 160, 162.1
Tempered Saronite Helm, https://wotlkdb.com/?spell=54555, 58.3765, 67.08, 125.4565, 187
Ornate Saronite Waistguard, https://wotlkdb.com/?spell=56551, 56.4, 73.6, 130, 176.6
Titanium Rod, https://wotlkdb.com/?spell=55732, 54.15, 65.1, 119.25, 183.2
Adamantite Cleaver, https://wotlkdb.com/?spell=29568, 52.25, 47.6, 99.85, 209.8
Tempered Saronite Legplates, https://wotlkdb.com/?spell=54554, 50.77, 38.23, 89, 232.8
Fel Iron Plate Pants, https://wotlkdb.com/?spell=29549, 50.16, 39.84, 90, 225.9
Arcanite Rod, https://wotlkdb.com/?spell=20201, 49.2311, 270.7689, 320, 118.2
Eternal Belt Buckle, https://wotlkdb.com/?spell=55656, 40.82, 54.18, 95, 175.3
Cobalt Helm, https://wotlkdb.com/?spell=52571, 40, 10, 50, 500
Eternium Rod, https://wotlkdb.com/?spell=32657, 38, 22, 60, 272.7
Saronite Defender, https://wotlkdb.com/?spell=54557, 35.8, 34.2, 70, 204.7
Jade Serpentblade, https://wotlkdb.com/?spell=3493, 34.3153, 20.6847, 55, 265.9
Adamantite Rod, https://wotlkdb.com/?spell=32656, 34.19, 59.5, 93.69, 157.5
Ornate Mithril Helm, https://wotlkdb.com/?spell=9980, 33.9901, 66.0098, 99.9999, 151.5
Tempered Saronite Shoulders, https://wotlkdb.com/?spell=54556, 30.4, 66.6, 97, 145.6
Cobalt Chestpiece, https://wotlkdb.com/?spell=52570, 27.8999, 12, 39.8999, 332.5
Righteous Gauntlets, https://wotlkdb.com/?spell=55300, 26.3999, 73.6, 99.9999, 135.9
Ornate Saronite Pauldrons, https://wotlkdb.com/?spell=56550, 26.3, 73.6, 99.9, 135.7
Spiked Cobalt Bracers, https://wotlkdb.com/?spell=54948, 26, 24, 50, 208.3
Titanium Weapon Chain, https://wotlkdb.com/?spell=55839, 24.8999, 65.1, 89.9999, 138.2
Spiked Cobalt Chestpiece, https://wotlkdb.com/?spell=54944, 23.9, 16, 39.9, 249.4
Saronite Bulwark, https://wotlkdb.com/?spell=55014, 22.2, 77.7, 99.9, 128.6
Copper Battle Axe, https://wotlkdb.com/?spell=3293, 20.7498, 17.2502, 38, 220.3
Fel Iron Rod, https://wotlkdb.com/?spell=32655, 20.0199, 29.88, 49.8999, 167
Adamantite Maul, https://wotlkdb.com/?spell=29566, 19.04, 47.6, 66.64, 140
Reinforced Cobalt Helm, https://wotlkdb.com/?spell=54979, 18.23, 17.77, 36, 202.6
Cobalt Shoulders, https://wotlkdb.com/?spell=52572, 16.8, 8, 24.8, 310
Green Iron Shoulders, https://wotlkdb.com/?spell=3504, 16.5075, 8.4925, 25, 294.4
Cobalt Triangle Shield, https://wotlkdb.com/?spell=54550, 16.375, 8, 24.375, 304.7
Furious Saronite Beatstick, https://wotlkdb.com/?spell=55182, 16.29, 84.21, 100.5, 119.3
Fel Iron Greatsword, https://wotlkdb.com/?spell=29565, 15.24, 59.76, 75, 125.5
Tempered Saronite Breastplate, https://wotlkdb.com/?spell=54553, 14.77, 40.23, 55, 136.7
Adamantite Sharpening Stone, https://wotlkdb.com/?spell=29656, 14.29, 7.93, 22.22, 280.2
Saronite Sharpening Stone, https://wotlkdb.com/?spell=56307, 14.29, 7.93, 22.22, 280.2
Deadly Bronze Poniard, https://wotlkdb.com/?spell=3295, 13.76, 20.68, 34.44, 166.5
Fel Iron Hatchet, https://wotlkdb.com/?spell=29557, 13.18, 44.82, 58, 129.4
Cobalt Legplates, https://wotlkdb.com/?spell=52567, 12.75, 10, 22.75, 227.5
Cobalt Bracers, https://wotlkdb.com/?spell=55834, 12, 8, 20, 250
Titanium Shield Spike, https://wotlkdb.com/?spell=56357, 11.9, 65.1, 77, 118.3
Cobalt Belt, https://wotlkdb.com/?spell=52568, 11.8, 8, 19.8, 247.5
Brilliant Saronite Bracers, https://wotlkdb.com/?spell=59438, 9.6, 50.4, 60, 119
Golden Scale Coif, https://wotlkdb.com/?spell=3503, 9.575, 38.425, 48, 124.9
Spiked Cobalt Belt, https://wotlkdb.com/?spell=54946, 9, 24, 33, 137.5
Spiked Cobalt Legplates, https://wotlkdb.com/?spell=54947, 8.8, 24, 32.8, 136.7
Bronze Greatsword, https://wotlkdb.com/?spell=9986, 8.4, 15.6, 24, 153.8
Forged Cobalt Claymore, https://wotlkdb.com/?spell=55203, 8, 20, 28, 140
Tempered Saronite Bracers, https://wotlkdb.com/?spell=55017, 7.85, 72.15, 80, 110.9
Silver Rod, https://wotlkdb.com/?spell=7818, 7.5139, 6.385, 13.8989, 217.7
Tempered Saronite Gauntlets, https://wotlkdb.com/?spell=55015, 7.3, 77.7, 85, 109.4
Cobalt Boots, https://wotlkdb.com/?spell=52569, 6.9999, 8, 14.9999, 187.5
Big Bronze Knife, https://wotlkdb.com/?spell=3491, 6.34, 8.66, 15, 173.2
Fel Iron Casing, https://wotlkdb.com/?spell=30304, 5.86, 14.94, 20.8, 139.2
Sure-fire Shuriken, https://wotlkdb.com/?spell=55202, 5.8, 14, 19.8, 141.4
Heavy Copper Broadsword, https://wotlkdb.com/?spell=3292, 5.76, 19.24, 25, 129.9
Fel Iron Plate Gloves, https://wotlkdb.com/?spell=29545, 5.08, 19.92, 25, 125.5
Fel Iron Chain Coif, https://wotlkdb.com/?spell=29551, 5.08, 19.92, 25, 125.5
Green Iron Boots, https://wotlkdb.com/?spell=3334, 5.01, 4.99, 10, 200.4
Truesilver Rod, https://wotlkdb.com/?spell=14380, 4.6676, 3.8324, 8.5, 221.8
Heavy Weightstone, https://wotlkdb.com/?spell=3117, 4.488, 1.012, 5.5, 543.5
Cobalt Gauntlets, https://wotlkdb.com/?spell=55835, 3, 10, 13, 130
Whirling Steel Axes, https://wotlkdb.com/?spell=34981, 2.7551, 27.2449, 30, 110.1
Iron Buckle, https://wotlkdb.com/?spell=8768, 2.7, 0.78, 3.48, 446.2
Heavy Copper Maul, https://wotlkdb.com/?spell=7408, 2.5998, 12.4002, 15, 121
Spiked Cobalt Gauntlets, https://wotlkdb.com/?spell=54945, 1.9999, 24, 25.9999, 108.3
Iron Counterweight, https://wotlkdb.com/?spell=7222, 1.5205, 3.4695, 4.99, 143.8
Notched Cobalt War Axe, https://wotlkdb.com/?spell=55204, 1.4565, 20, 21.4565, 107.3
Horned Cobalt Helm, https://wotlkdb.com/?spell=54949, 1.1048, 16, 17.1048, 106.9
Fel Iron Plate Belt, https://wotlkdb.com/?spell=29547, 1.08, 19.92, 21, 105.4
Golden Rod, https://wotlkdb.com/?spell=14379, 0.79, 1.21, 2, 165.3
Bronze Warhammer, https://wotlkdb.com/?spell=9985, 0.2, 9.8, 10, 102
Dense Sharpening Stone, https://wotlkdb.com/?spell=16641, 0.1625, 0.0375, 0.2, 533.3
Fel Iron Chain Bracers, https://wotlkdb.com/?spell=29553, 0.12, 29.88, 30, 100.4
Fel Iron Plate Boots, https://wotlkdb.com/?spell=29548, 0.06, 29.88, 29.94, 100.2
Coarse Grinding Stone, https://wotlkdb.com/?spell=3326, 0.0504, 0.0996, 0.15, 150.6
Solid Sharpening Stone, https://wotlkdb.com/?spell=9918, 0.0492, 0.1, 0.1492, 149.2
Rough Weightstone, https://wotlkdb.com/?spell=3115, 0.0329, 0.0159, 0.0488, 306.9
Heavy Grinding Stone, https://wotlkdb.com/?spell=3337, 0.0225, 3, 3.0225, 100.8
Cobalt Tenderizer, https://wotlkdb.com/?spell=55201, 0, 16, 16, 100
Rough Sharpening Stone, https://wotlkdb.com/?spell=2660, -0.0011, 0.0109, 0.0098, 89.9
Solid Grinding Stone, https://wotlkdb.com/?spell=9920, -0.01, 0.4, 0.39, 97.5
Rough Grinding Stone, https://wotlkdb.com/?spell=3320, -0.0168, 0.0218, 0.005, 22.9
Coarse Sharpening Stone, https://wotlkdb.com/?spell=2665, -0.0398, 0.0498, 0.01, 20.1
Coarse Weightstone, https://wotlkdb.com/?spell=3116, -0.0588, 0.0618, 0.003, 4.9
Solid Weightstone, https://wotlkdb.com/?spell=9921, -0.1309, 0.1349, 0.004, 3
Heavy Sharpening Stone, https://wotlkdb.com/?spell=2674, -0.5825, 1, 0.4175, 41.8
Sturdy Cobalt Quickblade, https://wotlkdb.com/?spell=55200, -1, 16, 15, 93.8
Fel Iron Chain Gloves, https://wotlkdb.com/?spell=29552, -1, 24.9, 23.9, 96
Copper Bracers, https://wotlkdb.com/?spell=2663, -1.6, 2, 0.4, 20
Brilliant Saronite Belt, https://wotlkdb.com/?spell=59436, -1.9, 39.75, 37.85, 95.2
Green Iron Helm, https://wotlkdb.com/?spell=3502, -1.9121, 12.37, 10.4579, 84.5
Green Iron Leggings, https://wotlkdb.com/?spell=3506, -2.2725, 9.2725, 7, 75.5
Runed Copper Gauntlets, https://wotlkdb.com/?spell=3323, -3.0101, 8.01, 4.9999, 62.4
Spiked Cobalt Shoulders, https://wotlkdb.com/?spell=54941, -3.1101, 14, 10.8899, 77.8
Green Iron Bracers, https://wotlkdb.com/?spell=3501, -3.2751, 4.69, 1.4149, 30.2
Rough Bronze Shoulders, https://wotlkdb.com/?spell=3328, -3.3042, 5.15, 1.8458, 35.8
Copper Chain Pants, https://wotlkdb.com/?spell=2662, -3.5, 4, 0.5, 12.5
Daunting Handguards, https://wotlkdb.com/?spell=55301, -3.58, 70.58, 67, 94.9
Golden Scale Boots, https://wotlkdb.com/?spell=3515, -3.93, 53.93, 50, 92.7
Rough Bronze Bracers, https://wotlkdb.com/?spell=2671, -3.9371, 4, 0.0629, 1.6
Rough Bronze Cuirass, https://wotlkdb.com/?spell=2670, -4, 7, 3, 42.9
Spiked Cobalt Boots, https://wotlkdb.com/?spell=54918, -4.0001, 14, 9.9999, 71.4
Runed Copper Bracers, https://wotlkdb.com/?spell=2664, -4.115, 10.015, 5.9, 58.9
Copper Chain Vest, https://wotlkdb.com/?spell=3321, -4.13, 8.01, 3.88, 48.4
Mithril Shield Spike, https://wotlkdb.com/?spell=9939, -4.1798, 19.1798, 15, 78.2
Patterned Bronze Bracers, https://wotlkdb.com/?spell=2672, -4.31, 5.3, 0.99, 18.7
Rough Bronze Leggings, https://wotlkdb.com/?spell=2668, -4.78, 6, 1.22, 20.3
Fel Sharpening Stone, https://wotlkdb.com/?spell=29654, -4.98, 5.97, 0.99, 16.6
Runed Copper Breastplate, https://wotlkdb.com/?spell=2667, -5, 13, 8, 61.5
Silvered Bronze Breastplate, https://wotlkdb.com/?spell=2673, -5.05, 23.05, 18, 78.1
Rough Bronze Boots, https://wotlkdb.com/?spell=7817, -5.13, 6.03, 0.9, 14.9
Greater Ward of Shielding, https://wotlkdb.com/?spell=29729, -5.375, 5.5, 0.125, 2.3
Thick Bronze Darts, https://wotlkdb.com/?spell=34979, -5.46, 7.61, 2.15, 28.3
Copper Chain Belt, https://wotlkdb.com/?spell=2661, -5.5, 6, 0.5, 8.3
Copper Shortsword, https://wotlkdb.com/?spell=2739, -5.52, 6.02, 0.5, 8.3
Bronze Mace, https://wotlkdb.com/?spell=2740, -5.64, 7.64, 2, 26.2
Gemmed Copper Gauntlets, https://wotlkdb.com/?spell=3325, -5.99, 11.43, 5.44, 47.6
Copper Axe, https://wotlkdb.com/?spell=2738, -6, 6.02, 0.02, 0.3
Copper Mace, https://wotlkdb.com/?spell=2737, -6.0094, 6.02, 0.0106, 0.2
Copper Dagger, https://wotlkdb.com/?spell=8880, -6.1857, 6.2051, 0.0194, 0.3
Adamantite Weightstone, https://wotlkdb.com/?spell=34608, -6.21, 6.31, 0.1, 1.6
Runed Copper Pants, https://wotlkdb.com/?spell=3324, -7.035, 8.035, 1, 12.4
Deadly Saronite Dirk, https://wotlkdb.com/?spell=55206, -7.1721, 44.97, 37.7979, 84.1
Bronze Battle Axe, https://wotlkdb.com/?spell=9987, -7.4, 17.4, 10, 57.5
Bronze Axe, https://wotlkdb.com/?spell=2741, -7.75, 8.64, 0.89, 10.3
Copper Chain Boots, https://wotlkdb.com/?spell=3319, -7.98, 8, 0.02, 0.3
Bronze Shortsword, https://wotlkdb.com/?spell=2742, -8.0001, 8.24, 0.2399, 2.9
Heavy Iron Knuckles, https://wotlkdb.com/?spell=25612, -8.2969, 8.865, 0.5681, 6.4
Runed Copper Belt, https://wotlkdb.com/?spell=2666, -9, 10, 1, 10
Copper Claymore, https://wotlkdb.com/?spell=9983, -9.2151, 10.2151, 1, 9.8
Heavy Mithril Axe, https://wotlkdb.com/?spell=9993, -9.2973, 58.3896, 49.0923, 84.1
Mighty Iron Hammer, https://wotlkdb.com/?spell=3297, -9.5363, 9.9915, 0.4552, 4.6
Silvered Bronze Boots, https://wotlkdb.com/?spell=3331, -9.675, 12.675, 3, 23.7
Righteous Greaves, https://wotlkdb.com/?spell=55304, -9.7, 84.7, 75, 88.5
Barbaric Iron Helm, https://wotlkdb.com/?spell=9814, -9.9143, 10.248, 0.3337, 3.3
Reinforced Cobalt Chestpiece, https://wotlkdb.com/?spell=54981, -10.2708, 17.77, 7.4992, 42.2
Glinting Steel Dagger, https://wotlkdb.com/?spell=15972, -10.4451, 51.4451, 41, 79.7
Reinforced Cobalt Legplates, https://wotlkdb.com/?spell=54980, -10.462, 17.77, 7.308, 41.1
Hardened Iron Shortsword, https://wotlkdb.com/?spell=3492, -10.6544, 11.2012, 0.5468, 4.9
Thick War Axe, https://wotlkdb.com/?spell=3294, -11.1602, 23.1602, 12, 51.8
Ironforge Gauntlets, https://wotlkdb.com/?spell=8368, -11.4555, 11.57, 0.1145, 1
Golden Scale Leggings, https://wotlkdb.com/?spell=3507, -12.2543, 12.6425, 0.3882, 3.1
Barbaric Iron Shoulders, https://wotlkdb.com/?spell=9811, -12.531, 12.781, 0.25, 2
Heavy Bronze Mace, https://wotlkdb.com/?spell=3296, -12.6299, 15.6299, 3, 19.2
Reinforced Cobalt Shoulders, https://wotlkdb.com/?spell=54978, -12.7064, 17.77, 5.0636, 28.5
Mithril Spurs, https://wotlkdb.com/?spell=9964, -13.17, 17.17, 4, 23.3
Silvered Bronze Gauntlets, https://wotlkdb.com/?spell=3333, -13.175, 14.675, 1.5, 10.2
Steel Plate Helm, https://wotlkdb.com/?spell=9935, -13.97, 56.87, 42.9, 75.4
Blood Tiger Breastplate, https://wotlkdb.com/?spell=24124, -15.3681, 18.05, 2.6819, 14.9
Daunting Legplates, https://wotlkdb.com/?spell=55303, -16.68, 81.68, 65, 79.6
Ironforge Chain, https://wotlkdb.com/?spell=8366, -16.8004, 16.85, 0.0496, 0.3
Ironvine Belt, https://wotlkdb.com/?spell=28463, -16.8663, 18.82, 1.9537, 10.4
Elemental Sharpening Stone, https://wotlkdb.com/?spell=22757, -17.7981, 17.9231, 0.125, 0.7
Ironforge Breastplate, https://wotlkdb.com/?spell=8367, -17.9479, 18.035, 0.0871, 0.5
Iridescent Hammer, https://wotlkdb.com/?spell=6518, -18.3206, 18.69, 0.3694, 2
Saronite Shiv, https://wotlkdb.com/?spell=55181, -18.54, 68.54, 50, 73
Golden Iron Destroyer, https://wotlkdb.com/?spell=3495, -19.1477, 19.9838, 0.8361, 4.2
Barbaric Iron Boots, https://wotlkdb.com/?spell=9818, -19.435, 19.805, 0.37, 1.9
Barbaric Iron Collar, https://wotlkdb.com/?spell=25498, -20.8348, 22.3348, 1.5, 6.7
Adamantite Rapier, https://wotlkdb.com/?spell=29571, -20.843, 71.4, 50.557, 70.8
Silvered Bronze Shoulders, https://wotlkdb.com/?spell=3330, -20.9216, 21.05, 0.1284, 0.6
Heavy Mithril Gauntlet, https://wotlkdb.com/?spell=9928, -21.782, 24.622, 2.84, 11.5
Massive Iron Axe, https://wotlkdb.com/?spell=3498, -21.88, 23.0048, 1.1248, 4.9
Barbaric Iron Gloves, https://wotlkdb.com/?spell=9820, -21.9164, 22.1875, 0.2711, 1.2
Mithril Scale Bracers, https://wotlkdb.com/?spell=9937, -22.05, 32, 9.95, 31.1
Golden Scale Bracers, https://wotlkdb.com/?spell=7223, -22.155, 25.145, 2.99, 11.9
Golden Scale Shoulders, https://wotlkdb.com/?spell=3505, -22.7625, 27.7625, 5, 18
Fel Iron Chain Tunic, https://wotlkdb.com/?spell=29556, -22.82, 44.82, 22, 49.1
Ironvine Gloves, https://wotlkdb.com/?spell=28462, -23.3334, 25.2799, 1.9465, 7.7
Adamantite Dagger, https://wotlkdb.com/?spell=29569, -23.65, 53.65, 30, 55.9
Brilliant Saronite Breastplate, https://wotlkdb.com/?spell=55058, -23.685, 78.585, 54.9, 69.9
Fel Iron Breastplate, https://wotlkdb.com/?spell=29550, -24.8, 49.8, 25, 50.2
Thorium Armor, https://wotlkdb.com/?spell=16642, -26, 135, 109, 80.7
Dark Iron Bracers, https://wotlkdb.com/?spell=20874, -26.8076, 29.0318, 2.2242, 7.7
Barbaric Iron Breastplate, https://wotlkdb.com/?spell=9813, -27.3569, 27.69, 0.3331, 1.2
Enchanted Thorium Blades, https://wotlkdb.com/?spell=34982, -27.51, 52.51, 25, 47.6
Ornate Saronite Legplates, https://wotlkdb.com/?spell=56554, -27.6, 107.6, 80, 74.3
Golden Scale Gauntlets, https://wotlkdb.com/?spell=11643, -27.93, 53.93, 26, 48.2
Solid Iron Maul, https://wotlkdb.com/?spell=3494, -28.1623, 37.1623, 9, 24.2
Golden Scale Cuirass, https://wotlkdb.com/?spell=3511, -28.75, 59.75, 31, 51.9
Brilliant Saronite Boots, https://wotlkdb.com/?spell=55057, -31.6, 66.6, 35, 52.6
Mithril Coif, https://wotlkdb.com/?spell=9961, -36.933, 40.933, 4, 9.8
Mithril Scale Gloves, https://wotlkdb.com/?spell=9942, -38.1767, 38.6214, 0.4447, 1.2
Volcanic Breastplate, https://wotlkdb.com/?spell=19076, -38.9625, 40.69, 1.7275, 4.2
Polished Steel Boots, https://wotlkdb.com/?spell=3513, -39.2608, 39.6545, 0.3937, 1
Fel Iron Hammer, https://wotlkdb.com/?spell=29558, -39.8, 49.8, 10, 20.1
Heavy Mithril Boots, https://wotlkdb.com/?spell=9968, -40, 59, 19, 32.2
Mithril Scale Pants, https://wotlkdb.com/?spell=9931, -40.45, 48, 7.55, 15.7
Steel Weapon Chain, https://wotlkdb.com/?spell=7224, -40.4546, 40.6046, 0.15, 0.4
Ironfeather Shoulders, https://wotlkdb.com/?spell=19062, -41.4562, 42.732, 1.2758, 3
Ornate Saronite Hauberk, https://wotlkdb.com/?spell=56555, -43.68, 81.68, 38, 46.5
Ornate Saronite Skullshield, https://wotlkdb.com/?spell=56556, -43.7, 98.7, 55, 55.7
Light Skyforged Axe, https://wotlkdb.com/?spell=36126, -47.486, 50.72, 3.234, 6.4
Light Earthforged Blade, https://wotlkdb.com/?spell=36125, -48.3778, 51.6, 3.2222, 6.2
Thorium Belt, https://wotlkdb.com/?spell=16643, -51.15, 60, 8.85, 14.8
Heavy Earthforged Breastplate, https://wotlkdb.com/?spell=36129, -51.4003, 56.56, 5.1597, 9.1
Heavy Mithril Breastplate, https://wotlkdb.com/?spell=9959, -52, 64, 12, 18.8
Ironfeather Breastplate, https://wotlkdb.com/?spell=19086, -56.017, 58.382, 2.365, 4.1
Orcish War Leggings, https://wotlkdb.com/?spell=9957, -56.1314, 56.9053, 0.7739, 1.4
