Name, Link, Profit, Cost, Sell, ROI %
Rituals of the New Moon, https://wotlkdb.com/?spell=64051, 3058.05, 131.95, 3190, 2417.6
Book of Stars, https://wotlkdb.com/?spell=59490, 382.5409, 18.4091, 400.95, 2178
Faces of Doom, https://wotlkdb.com/?spell=59498, 160.6568, 132.9, 293.5568, 220.9
Iron-bound Tome, https://wotlkdb.com/?spell=59497, 117.3318, 132.9, 250.2318, 188.3
Glyph of Enduring Victory, https://wotlkdb.com/?spell=58347, 91.5319, 8.1429, 99.6748, 1224.1
Glyph of Mind Control, https://wotlkdb.com/?spell=57191, 87.519, 12.45, 99.969, 803
Glyph of Snake Trap, https://wotlkdb.com/?spell=57010, 86.8898, 12.45, 99.3398, 797.9
Glyph of Typhoon, https://wotlkdb.com/?spell=56965, 83.35, 12.45, 95.8, 769.5
Glyph of Blade Flurry, https://wotlkdb.com/?spell=57115, 70.4398, 12.45, 82.8898, 665.8
Glyph of Fire Blast, https://wotlkdb.com/?spell=57719, 69.539, 12.45, 81.989, 658.5
Glyph of Mass Dispel, https://wotlkdb.com/?spell=57190, 67.0898, 12.45, 79.5398, 638.9
Twilight Tome, https://wotlkdb.com/?spell=64053, 53.25, 90.75, 144, 158.7
Glyph of Resonating Power, https://wotlkdb.com/?spell=57164, 41.05, 12.45, 53.5, 429.7
Glyph of Mana Tide Totem, https://wotlkdb.com/?spell=57247, 32.4498, 12.45, 44.8998, 360.6
Tome of the Dawn, https://wotlkdb.com/?spell=59475, 27.866, 12.134, 40, 329.7
Glyph of Hammer of Wrath, https://wotlkdb.com/?spell=57028, 27.1888, 12.45, 39.6388, 318.4
Glyph of Eternal Water, https://wotlkdb.com/?spell=71101, 25.3148, 8.1429, 33.4577, 410.9
Glyph of Water Mastery, https://wotlkdb.com/?spell=57251, 22.3248, 7.625, 29.9498, 392.8
Tome of Kings, https://wotlkdb.com/?spell=59484, 22.038, 32.962, 55, 166.9
Glyph of Soul Link, https://wotlkdb.com/?spell=64250, 17.1372, 4.2515, 21.3887, 503.1
Glyph of Possessed Strength, https://wotlkdb.com/?spell=58300, 16.6782, 4.5015, 21.1797, 470.5
Glyph of Mocking Blow, https://wotlkdb.com/?spell=58345, 16.1784, 4.2515, 20.4299, 480.5
Glyph of Unending Breath, https://wotlkdb.com/?spell=58336, 15.7379, 4.2515, 19.9894, 470.2
Glyph of Distract, https://wotlkdb.com/?spell=58324, 15.7274, 4.2625, 19.9899, 469
Glyph of Fire Ward, https://wotlkdb.com/?spell=58305, 15.6252, 4.2515, 19.8767, 467.5
Glyph of Frost Ward, https://wotlkdb.com/?spell=58307, 15.6144, 4.2625, 19.8769, 466.3
Glyph of Fade, https://wotlkdb.com/?spell=57184, 15.3807, 4.2625, 19.6432, 460.8
Glyph of Arcane Intellect, https://wotlkdb.com/?spell=58303, 15.1627, 4.5015, 19.6642, 436.8
Glyph of Shield Wall, https://wotlkdb.com/?spell=64252, 14.95, 4.2625, 19.2125, 450.7
Glyph of Lay on Hands, https://wotlkdb.com/?spell=58313, 14.9363, 4.5015, 19.4378, 431.8
Glyph of Blurred Speed, https://wotlkdb.com/?spell=58323, 14.9254, 4.5015, 19.4269, 431.6
Glyph of Pick Pocket, https://wotlkdb.com/?spell=58326, 14.8014, 4.5015, 19.3029, 428.8
Glyph of Shackle Undead, https://wotlkdb.com/?spell=58320, 14.6735, 4.2515, 18.925, 445.1
Glyph of Pick Lock, https://wotlkdb.com/?spell=58325, 14.6619, 4.2515, 18.9134, 444.9
Glyph of the Penguin, https://wotlkdb.com/?spell=58310, 14.5681, 4.5015, 19.0696, 423.6
Glyph of Slow Fall, https://wotlkdb.com/?spell=58308, 14.5544, 4.5015, 19.0559, 423.3
Glyph of Frenzied Regeneration, https://wotlkdb.com/?spell=56943, 14.51, 8.1429, 22.6529, 278.2
Glyph of Battle, https://wotlkdb.com/?spell=58342, 14.2346, 4.5015, 18.7361, 416.2
Glyph of Kilrogg, https://wotlkdb.com/?spell=58340, 14.0046, 4.2625, 18.2671, 428.6
Glyph of Revive Pet, https://wotlkdb.com/?spell=58299, 13.9171, 4.5015, 18.4186, 409.2
Glyph of Bloodrage, https://wotlkdb.com/?spell=58343, 13.842, 4.5015, 18.3435, 407.5
Glyph of Sense Undead, https://wotlkdb.com/?spell=58315, 13.7808, 4.2515, 18.0323, 424.1
Glyph of Water Breathing, https://wotlkdb.com/?spell=58331, 13.758, 4.2625, 18.0205, 422.8
Glyph of Aquatic Form, https://wotlkdb.com/?spell=58286, 13.6151, 4.2515, 17.8666, 420.2
Glyph of Cloak of Shadows, https://wotlkdb.com/?spell=64303, 13.553, 8.1429, 21.6959, 266.4
Glyph of Fading, https://wotlkdb.com/?spell=58317, 13.4985, 4.5015, 18, 399.9
Glyph of Mend Pet, https://wotlkdb.com/?spell=58301, 13.3921, 4.5015, 17.8936, 397.5
Certificate of Ownership, https://wotlkdb.com/?spell=59387, 13.3209, 16.6791, 30, 179.9
Glyph of Unburdened Rebirth, https://wotlkdb.com/?spell=58288, 13.045, 4.2515, 17.2965, 406.8
Glyph of Moonfire, https://wotlkdb.com/?spell=56951, 12.9249, 4.2625, 17.1874, 403.2
Glyph of Blessing of Might, https://wotlkdb.com/?spell=58314, 12.9105, 4.5015, 17.412, 386.8
Glyph of Frost Armor, https://wotlkdb.com/?spell=58306, 12.9014, 4.5015, 17.4029, 386.6
Glyph of Blessing of Kings, https://wotlkdb.com/?spell=58311, 12.7484, 4.2515, 16.9999, 399.9
Glyph of Ghost Wolf, https://wotlkdb.com/?spell=59326, 12.7482, 4.2515, 16.9997, 399.9
Glyph of Eviscerate, https://wotlkdb.com/?spell=57120, 12.7374, 4.2625, 16.9999, 398.8
Glyph of Flash Heal, https://wotlkdb.com/?spell=57186, 12.7374, 4.2625, 16.9999, 398.8
Glyph of Vanish, https://wotlkdb.com/?spell=58328, 12.7374, 4.2625, 16.9999, 398.8
Glyph of Salvation, https://wotlkdb.com/?spell=64251, 12.7374, 4.2625, 16.9999, 398.8
Glyph of Arcane Missiles, https://wotlkdb.com/?spell=56971, 12.7372, 4.2625, 16.9997, 398.8
Glyph of Riptide, https://wotlkdb.com/?spell=64289, 12.7336, 8.1429, 20.8765, 256.4
Glyph of Thorns, https://wotlkdb.com/?spell=58289, 12.6692, 4.5015, 17.1707, 381.4
Glyph of Flame Shock, https://wotlkdb.com/?spell=57239, 12.5961, 4.5015, 17.0976, 379.8
Glyph of Thunder Clap, https://wotlkdb.com/?spell=58346, 12.526, 4.5015, 17.0275, 378.3
Glyph of Blessing of Wisdom, https://wotlkdb.com/?spell=58312, 12.4984, 4.5015, 16.9999, 377.6
Glyph of Fortitude, https://wotlkdb.com/?spell=58318, 12.4984, 4.5015, 16.9999, 377.6
Glyph of Drain Soul, https://wotlkdb.com/?spell=58337, 12.4984, 4.5015, 16.9999, 377.6
Glyph of Stoneclaw Totem, https://wotlkdb.com/?spell=64247, 12.4984, 4.5015, 16.9999, 377.6
Glyph of Life Tap, https://wotlkdb.com/?spell=64248, 12.4984, 4.5015, 16.9999, 377.6
Glyph of Water Shield, https://wotlkdb.com/?spell=58332, 12.4855, 4.2515, 16.737, 393.7
Glyph of Charge, https://wotlkdb.com/?spell=58344, 12.4734, 4.5015, 16.9749, 377.1
Glyph of the Wild, https://wotlkdb.com/?spell=58296, 12.4223, 4.5015, 16.9238, 376
Glyph of Rejuvenation, https://wotlkdb.com/?spell=56955, 12.2985, 4.5015, 16.8, 373.2
Glyph of Explosive Shot, https://wotlkdb.com/?spell=64273, 11.787, 8.1429, 19.9299, 244.8
Glyph of Killing Spree, https://wotlkdb.com/?spell=64285, 11.6543, 8.1429, 19.7972, 243.1
Glyph of Disease, https://wotlkdb.com/?spell=64267, 11.65, 7.625, 19.275, 252.8
Glyph of Sprint, https://wotlkdb.com/?spell=57133, 11.6368, 7.625, 19.2618, 252.6
Glyph of Fire Nova, https://wotlkdb.com/?spell=57238, 11.4428, 4.2625, 15.7053, 368.5
Glyph of Trueshot Aura, https://wotlkdb.com/?spell=57012, 11.4398, 12.45, 23.8898, 191.9
Glyph of Pestilence, https://wotlkdb.com/?spell=57230, 11.3975, 7.7679, 19.1654, 246.7
Hellfire Tome, https://wotlkdb.com/?spell=59495, 11.3242, 28.6757, 39.9999, 139.5
Glyph of Dark Death, https://wotlkdb.com/?spell=64266, 11.3054, 7.625, 18.9304, 248.3
Glyph of Corpse Explosion, https://wotlkdb.com/?spell=57229, 11.1506, 7.7679, 18.9185, 243.5
Glyph of Healing Wave, https://wotlkdb.com/?spell=57243, 11.0929, 12.45, 23.5429, 189.1
Glyph of Heart Strike, https://wotlkdb.com/?spell=57208, 10.9121, 12.45, 23.3621, 187.6
Glyph of Guardian Spirit, https://wotlkdb.com/?spell=64281, 10.8695, 8.1429, 19.0124, 233.5
Glyph of Raise Dead, https://wotlkdb.com/?spell=57228, 10.7653, 7.7679, 18.5332, 238.6
Glyph of Health Funnel, https://wotlkdb.com/?spell=57265, 10.7494, 4.2625, 15.0119, 352.2
Glyph of Scatter Shot, https://wotlkdb.com/?spell=64249, 10.7485, 4.2515, 15, 352.8
Glyph of Judgement, https://wotlkdb.com/?spell=57030, 10.7374, 4.2625, 14.9999, 351.9
Glyph of Rending, https://wotlkdb.com/?spell=57163, 10.7374, 4.2625, 14.9999, 351.9
Glyph of Ice Barrier, https://wotlkdb.com/?spell=64257, 10.5976, 8.4583, 19.0559, 225.3
Glyph of Lightwell, https://wotlkdb.com/?spell=57189, 10.5196, 12.45, 22.9696, 184.5
Glyph of Serpent Sting, https://wotlkdb.com/?spell=57009, 10.4985, 4.5015, 15, 333.2
Glyph of Power Word: Shield, https://wotlkdb.com/?spell=57194, 10.4985, 4.5015, 15, 333.2
Glyph of Frost Nova, https://wotlkdb.com/?spell=56976, 10.4984, 4.5015, 14.9999, 333.2
Glyph of Blood Tap, https://wotlkdb.com/?spell=57209, 10.272, 8.1429, 18.4149, 226.1
Glyph of Living Bomb, https://wotlkdb.com/?spell=64275, 10.1156, 8.1429, 18.2585, 224.2
Glyph of Horn of Winter, https://wotlkdb.com/?spell=57217, 9.9193, 8.1429, 18.0622, 221.8
Glyph of Holy Light, https://wotlkdb.com/?spell=57029, 9.8874, 4.2625, 14.1499, 332
Glyph of Beacon of Light, https://wotlkdb.com/?spell=64277, 9.7336, 8.1429, 17.8765, 219.5
Glyph of Mirror Image, https://wotlkdb.com/?spell=64314, 9.6798, 12.45, 22.1298, 177.7
Glyph of Death's Embrace, https://wotlkdb.com/?spell=57215, 9.6692, 7.7679, 17.4371, 224.5
Glyph of Shadow Word: Death, https://wotlkdb.com/?spell=57199, 9.6245, 12.45, 22.0745, 177.3
Glyph of Bestial Wrath, https://wotlkdb.com/?spell=56999, 9.5264, 12.45, 21.9764, 176.5
Glyph of the Beast, https://wotlkdb.com/?spell=56996, 9.4994, 12.45, 21.9494, 176.3
Glyph of Scare Beast, https://wotlkdb.com/?spell=58298, 9.4984, 4.5015, 13.9999, 311
Glyph of Seal of Righteousness, https://wotlkdb.com/?spell=59560, 9.4283, 12.45, 21.8783, 175.7
Glyph of Icy Touch, https://wotlkdb.com/?spell=57219, 9.3749, 7.625, 16.9999, 222.9
Glyph of Mutilate, https://wotlkdb.com/?spell=64260, 9.3749, 7.625, 16.9999, 222.9
Glyph of Earth Shield, https://wotlkdb.com/?spell=64261, 9.3749, 7.625, 16.9999, 222.9
Glyph of Totem of Wrath, https://wotlkdb.com/?spell=64262, 9.3749, 7.625, 16.9999, 222.9
Glyph of Earthliving Weapon, https://wotlkdb.com/?spell=57236, 9.3277, 7.7679, 17.0956, 220.1
Glyph of Shred, https://wotlkdb.com/?spell=56957, 9.3249, 7.625, 16.9499, 222.3
Glyph of Rupture, https://wotlkdb.com/?spell=57128, 9.2565, 12.45, 21.7065, 174.3
Glyph of Dispersion, https://wotlkdb.com/?spell=64280, 9.1262, 8.1429, 17.2691, 212.1
Glyph of Feral Spirit, https://wotlkdb.com/?spell=64288, 9.0859, 8.1429, 17.2288, 211.6
Glyph of Souls, https://wotlkdb.com/?spell=58341, 9.0601, 12.45, 21.5101, 172.8
Glyph of Hamstring, https://wotlkdb.com/?spell=57157, 9.0375, 4.2625, 13.3, 312
Glyph of Heroic Strike, https://wotlkdb.com/?spell=57158, 8.9985, 4.5015, 13.5, 299.9
Glyph of Chimera Shot, https://wotlkdb.com/?spell=64271, 8.857, 8.1429, 16.9999, 208.8
Glyph of Hammer of the Righteous, https://wotlkdb.com/?spell=64278, 8.857, 8.1429, 16.9999, 208.8
Glyph of Penance, https://wotlkdb.com/?spell=64282, 8.857, 8.1429, 16.9999, 208.8
Glyph of Hunger for Blood, https://wotlkdb.com/?spell=64284, 8.857, 8.1429, 16.9999, 208.8
Glyph of Shadow Dance, https://wotlkdb.com/?spell=64286, 8.857, 8.1429, 16.9999, 208.8
Glyph of Shockwave, https://wotlkdb.com/?spell=64296, 8.857, 8.1429, 16.9999, 208.8
Glyph of Unholy Blight, https://wotlkdb.com/?spell=64299, 8.857, 8.1429, 16.9999, 208.8
Glyph of Dancing Rune Weapon, https://wotlkdb.com/?spell=64297, 8.8568, 8.1429, 16.9997, 208.8
Glyph of Arcane Blast, https://wotlkdb.com/?spell=56991, 8.8563, 8.1429, 16.9992, 208.8
Glyph of Howling Blast, https://wotlkdb.com/?spell=64300, 8.8562, 8.1429, 16.9991, 208.8
Glyph of Pain Suppression, https://wotlkdb.com/?spell=64259, 8.8249, 7.625, 16.4499, 215.7
Glyph of Shadowburn, https://wotlkdb.com/?spell=57272, 8.8247, 7.625, 16.4497, 215.7
Glyph of Berserk, https://wotlkdb.com/?spell=64268, 8.7833, 8.1429, 16.9262, 207.9
Glyph of Spell Reflection, https://wotlkdb.com/?spell=64302, 8.7708, 8.1429, 16.9137, 207.7
Glyph of the Ghoul, https://wotlkdb.com/?spell=57222, 8.7571, 8.1429, 16.9, 207.5
Glyph of Wild Growth, https://wotlkdb.com/?spell=64270, 8.7, 8.1429, 16.8429, 206.8
Glyph of Arcane Shot, https://wotlkdb.com/?spell=56995, 8.6985, 4.2515, 12.95, 304.6
Glyph of Metamorphosis, https://wotlkdb.com/?spell=64318, 8.6555, 8.1429, 16.7984, 206.3
Glyph of Safe Fall, https://wotlkdb.com/?spell=58327, 8.6541, 8.3458, 16.9999, 203.7
Glyph of Holy Shock, https://wotlkdb.com/?spell=64254, 8.6541, 8.3458, 16.9999, 203.7
Glyph of Vigilance, https://wotlkdb.com/?spell=64255, 8.6541, 8.3458, 16.9999, 203.7
Glyph of Blink, https://wotlkdb.com/?spell=56973, 8.6374, 4.2625, 12.8999, 302.6
Glyph of Spirit of Redemption, https://wotlkdb.com/?spell=57202, 8.6192, 12.45, 21.0692, 169.2
Glyph of Haunt, https://wotlkdb.com/?spell=64291, 8.6033, 8.1429, 16.7462, 205.7
Glyph of the Pack, https://wotlkdb.com/?spell=58297, 8.5679, 8.3458, 16.9137, 202.7
Glyph of Starfire, https://wotlkdb.com/?spell=56959, 8.5416, 8.4583, 16.9999, 201
Glyph of Barkskin, https://wotlkdb.com/?spell=64256, 8.4482, 8.4583, 16.9065, 199.9
Glyph of Consecration, https://wotlkdb.com/?spell=57023, 8.4416, 8.4583, 16.8999, 199.8
Glyph of Taunt, https://wotlkdb.com/?spell=57169, 8.3499, 12.45, 20.7999, 167.1
Glyph of Sinister Strike, https://wotlkdb.com/?spell=57131, 8.3417, 8.4583, 16.8, 198.6
Glyph of Corruption, https://wotlkdb.com/?spell=57259, 7.9675, 4.5015, 12.469, 277
Glyph of Divine Storm, https://wotlkdb.com/?spell=64279, 7.857, 8.1429, 15.9999, 196.5
Glyph of Blast Wave, https://wotlkdb.com/?spell=56990, 7.7794, 12.45, 20.2294, 162.5
Glyph of Hammer of Justice, https://wotlkdb.com/?spell=57027, 7.7535, 4.5015, 12.255, 272.2
Glyph of Lightning Bolt, https://wotlkdb.com/?spell=57245, 7.7375, 4.2625, 12, 281.5
Glyph of Fan of Knives, https://wotlkdb.com/?spell=64315, 7.7141, 12.45, 20.1641, 162
Glyph of Rip, https://wotlkdb.com/?spell=56956, 7.5727, 8.3458, 15.9185, 190.7
Glyph of Shocking, https://wotlkdb.com/?spell=57235, 7.5398, 12.45, 19.9898, 160.6
Glyph of Plague Strike, https://wotlkdb.com/?spell=57221, 7.5372, 7.7679, 15.3051, 197
Glyph of Frostbolt, https://wotlkdb.com/?spell=56977, 7.53, 12.45, 19.98, 160.5
Glyph of Siphon Life, https://wotlkdb.com/?spell=57273, 7.53, 12.45, 19.98, 160.5
Glyph of Seal of Wisdom, https://wotlkdb.com/?spell=57035, 7.529, 12.45, 19.979, 160.5
Glyph of Exorcism, https://wotlkdb.com/?spell=57025, 7.525, 7.625, 15.15, 198.7
Glyph of Maul, https://wotlkdb.com/?spell=56961, 7.4985, 4.5015, 12, 266.6
Glyph of Swiftmend, https://wotlkdb.com/?spell=56960, 7.4342, 12.45, 19.8842, 159.7
Glyph of Execution, https://wotlkdb.com/?spell=57156, 7.375, 7.625, 15, 196.7
Glyph of Frost Strike, https://wotlkdb.com/?spell=57216, 7.3737, 7.625, 14.9987, 196.7
Glyph of Icebound Fortitude, https://wotlkdb.com/?spell=57218, 7.3664, 12.45, 19.8164, 159.2
Warrior Glyph 21, https://wotlkdb.com/?spell=57173, 7.2801, 8.7198, 15.9999, 183.5
Warrior Glyph 22, https://wotlkdb.com/?spell=57174, 7.2801, 8.7198, 15.9999, 183.5
Warrior Glyph 23, https://wotlkdb.com/?spell=57175, 7.2801, 8.7198, 15.9999, 183.5
Warrior Glyph 25, https://wotlkdb.com/?spell=57176, 7.2801, 8.7198, 15.9999, 183.5
Warrior Glyph 24, https://wotlkdb.com/?spell=57180, 7.2801, 8.7198, 15.9999, 183.5
Death Knight Glyph 25, https://wotlkdb.com/?spell=57231, 7.2801, 8.7198, 15.9999, 183.5
Glyph of Starfall, https://wotlkdb.com/?spell=56958, 7.0541, 12.45, 19.5041, 156.7
Moonglow Ink, https://wotlkdb.com/?spell=52843, 6.899, 1, 7.899, 789.9
Glyph of Vampiric Blood, https://wotlkdb.com/?spell=57227, 6.8571, 8.1429, 15, 184.2
Glyph of Hungering Cold, https://wotlkdb.com/?spell=64298, 6.8571, 8.1429, 15, 184.2
Glyph of Whirlwind, https://wotlkdb.com/?spell=57172, 6.857, 8.1429, 14.9999, 184.2
Glyph of Incinerate, https://wotlkdb.com/?spell=57257, 6.857, 8.1429, 14.9999, 184.2
Glyph of Rune Tap, https://wotlkdb.com/?spell=59338, 6.857, 8.1429, 14.9999, 184.2
Glyph of Thunder, https://wotlkdb.com/?spell=64287, 6.8565, 8.1429, 14.9994, 184.2
Glyph of Bladestorm, https://wotlkdb.com/?spell=64295, 6.8565, 8.1429, 14.9994, 184.2
Glyph of Volley, https://wotlkdb.com/?spell=57013, 6.7652, 12.45, 19.2152, 154.3
Glyph of Curse of Exhaustion, https://wotlkdb.com/?spell=58338, 6.6773, 15.0025, 21.6798, 144.5
Fire Eater's Guide, https://wotlkdb.com/?spell=59489, 6.5909, 18.4091, 25, 135.8
Glyph of Anti-Magic Shell, https://wotlkdb.com/?spell=57207, 6.5599, 12.45, 19.0099, 152.7
Glyph of Elemental Mastery, https://wotlkdb.com/?spell=57250, 6.5498, 12.45, 18.9998, 152.6
Glyph of Scorch, https://wotlkdb.com/?spell=56982, 6.5417, 8.4583, 15, 177.3
Glyph of Cleaving, https://wotlkdb.com/?spell=57154, 6.5417, 8.4583, 15, 177.3
Glyph of Enslave Demon, https://wotlkdb.com/?spell=58339, 6.5141, 15.0025, 21.5166, 143.4
Glyph of Lesser Healing Wave, https://wotlkdb.com/?spell=57244, 6.4917, 8.4583, 14.95, 176.7
Glyph of Disengage, https://wotlkdb.com/?spell=57001, 6.4916, 8.4583, 14.9499, 176.7
Glyph of Growl, https://wotlkdb.com/?spell=56944, 6.475, 12.45, 18.925, 152
Glyph of Vigor, https://wotlkdb.com/?spell=57130, 6.4641, 12.45, 18.9141, 151.9
Glyph of Chain Lightning, https://wotlkdb.com/?spell=57233, 6.4268, 12.45, 18.8768, 151.6
Glyph of Last Stand, https://wotlkdb.com/?spell=57166, 6.4265, 12.45, 18.8765, 151.6
Glyph of Raptor Strike, https://wotlkdb.com/?spell=64246, 6.3885, 4.5015, 10.89, 241.9
Jadefire Ink, https://wotlkdb.com/?spell=57707, 6.1892, 8.8008, 14.99, 170.3
Glyph of Blocking, https://wotlkdb.com/?spell=57152, 6.1302, 12.45, 18.5802, 149.2
Glyph of Hemorrhage, https://wotlkdb.com/?spell=57126, 6.125, 12.45, 18.575, 149.2
Glyph of Polymorph, https://wotlkdb.com/?spell=56987, 6.0397, 12.45, 18.4897, 148.5
Glyph of Mortal Strike, https://wotlkdb.com/?spell=57160, 5.9777, 12.45, 18.4277, 148
Glyph of Mind Sear, https://wotlkdb.com/?spell=64309, 5.9529, 12.45, 18.4029, 147.8
Glyph of Hymn of Hope, https://wotlkdb.com/?spell=64283, 5.8571, 8.1429, 14, 171.9
Glyph of Devastate, https://wotlkdb.com/?spell=57155, 5.8455, 12.45, 18.2955, 147
Glyph of Steady Shot, https://wotlkdb.com/?spell=57011, 5.7074, 12.45, 18.1574, 145.8
Glyph of Molten Armor, https://wotlkdb.com/?spell=56986, 5.6377, 12.45, 18.0877, 145.3
Glyph of Wyvern Sting, https://wotlkdb.com/?spell=57014, 5.6233, 12.45, 18.0733, 145.2
Glyph of Focus, https://wotlkdb.com/?spell=62162, 5.55, 12.45, 18, 144.6
Shimmering Ink, https://wotlkdb.com/?spell=57711, 5.5, 2, 7.5, 375
Glyph of Mending, https://wotlkdb.com/?spell=56997, 5.463, 4.2625, 9.7255, 228.2
Glyph of Wrath, https://wotlkdb.com/?spell=56963, 5.3984, 4.5015, 9.8999, 219.9
Glyph of Preparation, https://wotlkdb.com/?spell=57127, 5.3885, 12.45, 17.8385, 143.3
Glyph of Lifebloom, https://wotlkdb.com/?spell=56949, 5.35, 12.45, 17.8, 143
Glyph of Felguard, https://wotlkdb.com/?spell=57263, 5.3304, 12.45, 17.7804, 142.8
Glyph of Enraged Regeneration, https://wotlkdb.com/?spell=64312, 5.3167, 12.45, 17.7667, 142.7
Glyph of Shadow, https://wotlkdb.com/?spell=57193, 5.2749, 12.45, 17.7249, 142.4
Glyph of Flash of Light, https://wotlkdb.com/?spell=57026, 5.2321, 7.7679, 13, 167.4
Glyph of Death and Decay, https://wotlkdb.com/?spell=57214, 5.1244, 12.45, 17.5744, 141.2
Glyph of Hunter's Mark, https://wotlkdb.com/?spell=57004, 4.9985, 4.5015, 9.5, 211
Glyph of Shadowfiend, https://wotlkdb.com/?spell=58322, 4.9537, 12.45, 17.4037, 139.8
Glyph of Holy Nova, https://wotlkdb.com/?spell=57187, 4.8571, 8.1429, 13, 159.6
Glyph of Shadow Word: Pain, https://wotlkdb.com/?spell=57192, 4.857, 8.1429, 12.9999, 159.6
Glyph of Conflagrate, https://wotlkdb.com/?spell=57258, 4.8569, 12.45, 17.3069, 139
Glyph of Feign Death, https://wotlkdb.com/?spell=58302, 4.8237, 15.0025, 19.8262, 132.2
Glyph of Seal of Vengeance, https://wotlkdb.com/?spell=59561, 4.7928, 12.45, 17.2428, 138.5
Glyph of Healing Stream Totem, https://wotlkdb.com/?spell=57242, 4.7616, 8.4583, 13.2199, 156.3
Glyph of Fear, https://wotlkdb.com/?spell=57262, 4.7375, 4.2625, 9, 211.1
Glyph of Quick Decay, https://wotlkdb.com/?spell=71102, 4.5512, 12.45, 17.0012, 136.6
Glyph of Fireball, https://wotlkdb.com/?spell=56975, 4.5499, 12.45, 16.9999, 136.5
Glyph of Avenger's Shield, https://wotlkdb.com/?spell=57019, 4.5499, 12.45, 16.9999, 136.5
Glyph of Seal of Light, https://wotlkdb.com/?spell=57034, 4.5499, 12.45, 16.9999, 136.5
Glyph of Prayer of Healing, https://wotlkdb.com/?spell=57195, 4.5499, 12.45, 16.9999, 136.5
Glyph of Obliterate, https://wotlkdb.com/?spell=57220, 4.5499, 12.45, 16.9999, 136.5
Glyph of Chain Heal, https://wotlkdb.com/?spell=57232, 4.5499, 12.45, 16.9999, 136.5
Glyph of Lava, https://wotlkdb.com/?spell=57234, 4.5499, 12.45, 16.9999, 136.5
Glyph of Thunderstorm, https://wotlkdb.com/?spell=57253, 4.5499, 12.45, 16.9999, 136.5
Glyph of Kill Shot, https://wotlkdb.com/?spell=64304, 4.5499, 12.45, 16.9999, 136.5
Glyph of Divine Plea, https://wotlkdb.com/?spell=64305, 4.5499, 12.45, 16.9999, 136.5
Glyph of Tricks of the Trade, https://wotlkdb.com/?spell=64310, 4.5499, 12.45, 16.9999, 136.5
Glyph of Shadowflame, https://wotlkdb.com/?spell=64311, 4.5499, 12.45, 16.9999, 136.5
Glyph of Command, https://wotlkdb.com/?spell=68166, 4.5499, 12.45, 16.9999, 136.5
Glyph of Bloodthirst, https://wotlkdb.com/?spell=57153, 4.5497, 12.45, 16.9997, 136.5
Glyph of Rapid Rejuvenation, https://wotlkdb.com/?spell=71015, 4.5495, 12.45, 16.9995, 136.5
Glyph of Holy Wrath, https://wotlkdb.com/?spell=59559, 4.5368, 12.45, 16.9868, 136.4
Glyph of Shadow Protection, https://wotlkdb.com/?spell=58321, 4.5268, 15.0025, 19.5293, 130.2
Glyph of Demonic Circle, https://wotlkdb.com/?spell=64317, 4.525, 12.45, 16.975, 136.3
Glyph of Intervene, https://wotlkdb.com/?spell=57159, 4.5, 12.45, 16.95, 136.1
Glyph of Turn Evil, https://wotlkdb.com/?spell=57036, 4.4999, 12.45, 16.9499, 136.1
Glyph of Circle of Healing, https://wotlkdb.com/?spell=57181, 4.4999, 12.45, 16.9499, 136.1
Glyph of Shield of Righteousness, https://wotlkdb.com/?spell=64308, 4.4999, 12.45, 16.9499, 136.1
Glyph of Immolate, https://wotlkdb.com/?spell=57268, 4.4997, 12.45, 16.9497, 136.1
Glyph of Adrenaline Rush, https://wotlkdb.com/?spell=57112, 4.4585, 12.45, 16.9085, 135.8
Glyph of Savage Roar, https://wotlkdb.com/?spell=64307, 4.3052, 12.45, 16.7552, 134.6
Glyph of Challenging Roar, https://wotlkdb.com/?spell=58287, 3.974, 15.0025, 18.9765, 126.5
Glyph of Chaos Bolt, https://wotlkdb.com/?spell=64294, 3.8571, 8.1429, 12, 147.4
Glyph of Flametongue Weapon, https://wotlkdb.com/?spell=57240, 3.7375, 4.2625, 8, 187.7
Glyph of Immolation Trap, https://wotlkdb.com/?spell=57005, 3.7374, 4.2625, 7.9999, 187.7
Glyph of Imp, https://wotlkdb.com/?spell=57269, 3.6624, 4.2625, 7.9249, 185.9
Glyph of Scourge Imprisonment, https://wotlkdb.com/?spell=57198, 3.55, 12.45, 16, 128.5
Glyph of Rune Strike, https://wotlkdb.com/?spell=57223, 3.5499, 12.45, 15.9999, 128.5
Glyph of Unstable Affliction, https://wotlkdb.com/?spell=57276, 3.5499, 12.45, 15.9999, 128.5
Glyph of Nourish, https://wotlkdb.com/?spell=64313, 3.5498, 12.45, 15.9998, 128.5
Glyph of Explosive Trap, https://wotlkdb.com/?spell=64253, 3.5194, 15.0025, 18.5219, 123.5
Glyph of Mangle, https://wotlkdb.com/?spell=56950, 3.5, 12.45, 15.95, 128.1
Glyph of Avenging Wrath, https://wotlkdb.com/?spell=57021, 3.5, 12.45, 15.95, 128.1
Glyph of Dark Command, https://wotlkdb.com/?spell=57212, 3.4993, 12.45, 15.9493, 128.1
Glyph of Lightning Shield, https://wotlkdb.com/?spell=57246, 3.4984, 4.5015, 7.9999, 177.7
Glyph of Crippling Poison, https://wotlkdb.com/?spell=57116, 3.475, 12.45, 15.925, 127.9
Glyph of Frostfire, https://wotlkdb.com/?spell=61677, 3.4685, 12.45, 15.9185, 127.9
Glyph of Regrowth, https://wotlkdb.com/?spell=56954, 3.4493, 12.45, 15.8993, 127.7
Glyph of Levitate, https://wotlkdb.com/?spell=58319, 3.2917, 15.0025, 18.2942, 121.9
Glyph of Spiritual Attunement, https://wotlkdb.com/?spell=57022, 3.2685, 4.5015, 7.77, 172.6
Glyph of Ghostly Strike, https://wotlkdb.com/?spell=57124, 3.2178, 12.45, 15.6678, 125.8
Glyph of Renewed Life, https://wotlkdb.com/?spell=58330, 3.2018, 15.0025, 18.2043, 121.3
Glyph of Survival Instincts, https://wotlkdb.com/?spell=65245, 3.0465, 11.9515, 14.998, 125.5
Glyph of Evasion, https://wotlkdb.com/?spell=57119, 2.9985, 4.5015, 7.5, 166.6
Glyph of Mage Armor, https://wotlkdb.com/?spell=56984, 2.8571, 8.1429, 11, 135.1
Glyph of Deadly Throw, https://wotlkdb.com/?spell=57117, 2.7941, 12.45, 15.2441, 122.4
Glyph of Curse of Agony, https://wotlkdb.com/?spell=57260, 2.5725, 12.45, 15.0225, 120.7
Glyph of Innervate, https://wotlkdb.com/?spell=56947, 2.55, 12.45, 15, 120.5
Glyph of Victory Rush, https://wotlkdb.com/?spell=57170, 2.55, 12.45, 15, 120.5
Glyph of Death Coil, https://wotlkdb.com/?spell=57261, 2.55, 12.45, 15, 120.5
Glyph of the Hawk, https://wotlkdb.com/?spell=57006, 2.5499, 12.45, 14.9999, 120.5
Glyph of Stormstrike, https://wotlkdb.com/?spell=57248, 2.5499, 12.45, 14.9999, 120.5
Glyph of Smite, https://wotlkdb.com/?spell=57201, 2.5417, 8.4583, 11, 130
Midnight Ink, https://wotlkdb.com/?spell=53462, 2.5, 2, 4.5, 225
Glyph of Astral Recall, https://wotlkdb.com/?spell=58329, 2.4599, 15.0025, 17.4624, 116.4
Glyph of Invisibility, https://wotlkdb.com/?spell=56983, 2.35, 12.45, 14.8, 118.9
Glyph of Fire Elemental Totem, https://wotlkdb.com/?spell=57237, 2.35, 12.45, 14.8, 118.9
Glyph of Entangling Roots, https://wotlkdb.com/?spell=48121, 2.1984, 4.2515, 6.4499, 151.7
Glyph of Hurricane, https://wotlkdb.com/?spell=56946, 2.05, 12.45, 14.5, 116.5
Glyph of Howl of Terror, https://wotlkdb.com/?spell=57267, 2.05, 12.45, 14.5, 116.5
Glyph of the Wise, https://wotlkdb.com/?spell=58316, 1.9974, 15.0025, 16.9999, 113.3
Glyph of Water Walking, https://wotlkdb.com/?spell=58333, 1.9974, 15.0025, 16.9999, 113.3
Glyph of Dash, https://wotlkdb.com/?spell=59315, 1.9974, 15.0025, 16.9999, 113.3
Ink of the Sea, https://wotlkdb.com/?spell=57715, 1.95, 10, 11.95, 119.5
Glyph of Seal of Command, https://wotlkdb.com/?spell=57033, 1.8571, 8.1429, 10, 122.8
Glyph of Windfury Weapon, https://wotlkdb.com/?spell=57252, 1.857, 8.1429, 9.9999, 122.8
Glyph of Succubus, https://wotlkdb.com/?spell=57275, 1.857, 8.1429, 9.9999, 122.8
Glyph of Inner Fire, https://wotlkdb.com/?spell=57188, 1.7374, 4.2625, 5.9999, 140.8
Scroll of Recall II, https://wotlkdb.com/?spell=60336, 1.6041, 8.3458, 9.9499, 119.2
