Glyph of Water Elemental, https://wotlkdb.com/?spell=56989, 1.55, 12.45, 14, 112.4
Glyph of Rapid Charge, https://wotlkdb.com/?spell=57162, 1.4985, 4.5015, 6, 133.3
Glyph of Slice and Dice, https://wotlkdb.com/?spell=57132, 1.4917, 8.4583, 9.95, 117.6
Glyph of Chains of Ice, https://wotlkdb.com/?spell=57211, 1.4301, 12.45, 13.8801, 111.5
Glyph of Aimed Shot, https://wotlkdb.com/?spell=56994, 0.9974, 15.0025, 15.9999, 106.6
Glyph of Death Strike, https://wotlkdb.com/?spell=59340, 0.857, 8.1429, 8.9999, 110.5
Glyph of Arcane Barrage, https://wotlkdb.com/?spell=64276, 0.8071, 8.1429, 8.95, 109.9
Glyph of Righteous Defense, https://wotlkdb.com/?spell=57032, 0.741, 15.0025, 15.7435, 104.9
Glyph of Aspect of the Viper, https://wotlkdb.com/?spell=56998, 0.5, 12.45, 12.95, 104
Glyph of Ice Armor, https://wotlkdb.com/?spell=56978, 0.4985, 4.5015, 5, 111.1
Lion's Ink, https://wotlkdb.com/?spell=57704, 0.33, 3.92, 4.25, 108.4
Glyph of Mana Gem, https://wotlkdb.com/?spell=56985, 0.275, 7.625, 7.9, 103.6
Glyph of Monsoon, https://wotlkdb.com/?spell=64258, 0.275, 7.625, 7.9, 103.6
Ivory Ink, https://wotlkdb.com/?spell=52738, 0.0989, 0.5, 0.5989, 119.8
Glyph of Overpower, https://wotlkdb.com/?spell=57161, -0.0025, 15.0025, 15, 100
Glyph of Renew, https://wotlkdb.com/?spell=57197, -0.0025, 15.0025, 15, 100
Scroll of Spirit, https://wotlkdb.com/?spell=48116, -0.1004, 0.6004, 0.5, 83.3
Glyph of Arcane Explosion, https://wotlkdb.com/?spell=56968, -0.1216, 4.2515, 4.1299, 97.1
Scroll of Stamina, https://wotlkdb.com/?spell=45382, -0.2004, 0.6004, 0.4, 66.6
Glyph of Healing Touch, https://wotlkdb.com/?spell=56945, -0.2826, 4.2625, 3.9799, 93.4
Glyph of Deep Freeze, https://wotlkdb.com/?spell=64274, -0.418, 8.1429, 7.7249, 94.9
Glyph of Felhunter, https://wotlkdb.com/?spell=57264, -0.5, 12.45, 11.95, 96
Scroll of Intellect, https://wotlkdb.com/?spell=48114, -0.5967, 0.6004, 0.0037, 0.6
Glyph of Deterrence, https://wotlkdb.com/?spell=57000, -0.6958, 8.3458, 7.65, 91.7
Glyph of Backstab, https://wotlkdb.com/?spell=57114, -0.7516, 4.5015, 3.7499, 83.3
Scroll of Agility, https://wotlkdb.com/?spell=58472, -0.7613, 1.1993, 0.438, 36.5
Glyph of Icy Veins, https://wotlkdb.com/?spell=56981, -1.0025, 15.0025, 14, 93.3
Glyph of Crusader Strike, https://wotlkdb.com/?spell=57024, -1.1833, 8.4583, 7.275, 86
Scroll of Strength, https://wotlkdb.com/?spell=58484, -1.1943, 1.1993, 0.005, 0.4
Celestial Ink, https://wotlkdb.com/?spell=57709, -1.2347, 9.568, 8.3333, 87.1
Ink of the Sky, https://wotlkdb.com/?spell=57712, -1.2501, 3, 1.7499, 58.3
Glyph of Garrote, https://wotlkdb.com/?spell=57123, -1.2625, 4.2625, 3, 70.4
Dawnstar Ink, https://wotlkdb.com/?spell=57706, -1.2982, 2, 0.7018, 35.1
Royal Ink, https://wotlkdb.com/?spell=57708, -1.4286, 2, 0.5714, 28.6
Glyph of Claw, https://wotlkdb.com/?spell=67600, -1.5015, 4.5015, 3, 66.6
Glyph of Healthstone, https://wotlkdb.com/?spell=57266, -1.5415, 4.5015, 2.96, 65.8
Hunter's Ink, https://wotlkdb.com/?spell=57703, -1.89, 2, 0.11, 5.5
Book of Survival, https://wotlkdb.com/?spell=59478, -2.134, 12.134, 10, 82.4
Glyph of Sweeping Strikes, https://wotlkdb.com/?spell=57168, -2.2429, 8.1429, 5.9, 72.5
Snowfall Ink, https://wotlkdb.com/?spell=57716, -2.25, 11.25, 9, 80
Glyph of Sunder Armor, https://wotlkdb.com/?spell=57167, -2.2626, 4.2625, 1.9999, 46.9
Glyph of Arcane Power, https://wotlkdb.com/?spell=56972, -2.2929, 8.1429, 5.85, 71.8
Armor Vellum II, https://wotlkdb.com/?spell=59499, -2.3433, 8.3583, 6.015, 72
Fiery Ink, https://wotlkdb.com/?spell=57710, -2.4015, 2.5, 0.0985, 3.9
Glyph of Psychic Scream, https://wotlkdb.com/?spell=57196, -2.4316, 4.5015, 2.0699, 46
Scroll of Agility II, https://wotlkdb.com/?spell=58473, -2.5415, 4.5015, 1.96, 43.5
Glyph of Hex, https://wotlkdb.com/?spell=64316, -2.6, 12.45, 9.85, 79.1
Weapon Vellum II, https://wotlkdb.com/?spell=59488, -2.6668, 8.6818, 6.015, 69.3
Glyph of Feint, https://wotlkdb.com/?spell=57122, -2.7679, 7.7679, 5, 64.4
Scroll of Strength VIII, https://wotlkdb.com/?spell=58491, -2.95, 12.95, 10, 77.2
Royal Guide of Escape Routes, https://wotlkdb.com/?spell=59486, -2.962, 32.962, 30, 91
Glyph of Rebirth, https://wotlkdb.com/?spell=56953, -3.0525, 15.0025, 11.95, 79.7
Glyph of Evocation, https://wotlkdb.com/?spell=56974, -3.0625, 15.0025, 11.94, 79.6
Glyph of Mind Flay, https://wotlkdb.com/?spell=57200, -3.0625, 15.0025, 11.94, 79.6
Glyph of Gouge, https://wotlkdb.com/?spell=57125, -3.1025, 15.0025, 11.9, 79.3
Glyph of Divinity, https://wotlkdb.com/?spell=57031, -3.1526, 4.2625, 1.1099, 26
Glyph of Rake, https://wotlkdb.com/?spell=56952, -3.1629, 8.1429, 4.98, 61.2
Glyph of Rapid Fire, https://wotlkdb.com/?spell=57008, -3.1829, 8.1429, 4.96, 60.9
Glyph of Remove Curse, https://wotlkdb.com/?spell=56988, -3.45, 12.45, 9, 72.3
Glyph of Ice Block, https://wotlkdb.com/?spell=56979, -3.4784, 8.4583, 4.9799, 58.9
Darkflame Ink, https://wotlkdb.com/?spell=57714, -3.5592, 3.6837, 0.1245, 3.4
Glyph of Expose Armor, https://wotlkdb.com/?spell=57121, -3.5625, 4.2625, 0.7, 16.4
Scroll of Stamina II, https://wotlkdb.com/?spell=50612, -4.0715, 4.5015, 0.43, 9.6
Glyph of Unbreakable Armor, https://wotlkdb.com/?spell=57226, -4.1204, 8.1429, 4.0225, 49.4
Scroll of Spirit II, https://wotlkdb.com/?spell=50605, -4.2716, 4.5015, 0.2299, 5.1
Scroll of Intellect II, https://wotlkdb.com/?spell=50598, -4.302, 4.5015, 0.1995, 4.4
Scroll of Recall III, https://wotlkdb.com/?spell=60337, -4.45, 12.45, 8, 64.3
Scroll of Strength II, https://wotlkdb.com/?spell=58485, -4.4923, 4.5015, 0.0092, 0.2
Mystic Tome, https://wotlkdb.com/?spell=58565, -4.565, 9.565, 5, 52.3
Weapon Vellum, https://wotlkdb.com/?spell=52840, -4.603, 13.503, 8.9, 65.9
Glyph of Death Grip, https://wotlkdb.com/?spell=57213, -4.605, 7.625, 3.02, 39.6
Glyph of Dispel Magic, https://wotlkdb.com/?spell=57183, -4.6383, 8.4583, 3.82, 45.2
Glyph of Freezing Trap, https://wotlkdb.com/?spell=57002, -4.725, 7.625, 2.9, 38
Glyph of Blood Strike, https://wotlkdb.com/?spell=59339, -4.813, 8.1429, 3.3299, 40.9
Armor Vellum III, https://wotlkdb.com/?spell=59500, -4.95, 12.95, 8, 61.8
Glyph of Ice Lance, https://wotlkdb.com/?spell=56980, -5.45, 12.45, 7, 56.2
Scroll of Agility VIII, https://wotlkdb.com/?spell=58483, -5.45, 12.95, 7.5, 57.9
Glyph of Searing Pain, https://wotlkdb.com/?spell=57270, -5.4583, 8.4583, 3, 35.5
Glyph of Bone Shield, https://wotlkdb.com/?spell=57210, -5.6251, 7.625, 1.9999, 26.2
Glyph of Ambush, https://wotlkdb.com/?spell=57113, -5.9429, 8.1429, 2.2, 27
Glyph of Scourge Strike, https://wotlkdb.com/?spell=57224, -6.1429, 8.1429, 2, 24.6
Glyph of Frost Trap, https://wotlkdb.com/?spell=57003, -6.232, 8.1429, 1.9109, 23.5
Glyph of Soulstone, https://wotlkdb.com/?spell=57274, -6.5183, 8.4583, 1.94, 22.9
Glyph of Fear Ward, https://wotlkdb.com/?spell=57185, -6.635, 7.625, 0.99, 13
Scroll of Agility V, https://wotlkdb.com/?spell=58480, -6.75, 7.75, 1, 12.9
Scroll of Stamina V, https://wotlkdb.com/?spell=50617, -6.785, 7.75, 0.965, 12.5
Armor Vellum, https://wotlkdb.com/?spell=52739, -6.8021, 7.902, 1.0999, 13.9
Scroll of Strength V, https://wotlkdb.com/?spell=58488, -6.82, 7.75, 0.93, 12
Scroll of Intellect V, https://wotlkdb.com/?spell=50601, -6.85, 7.75, 0.9, 11.6
Scroll of Recall, https://wotlkdb.com/?spell=48248, -7.2273, 7.9005, 0.6732, 8.5
Scroll of Spirit VI, https://wotlkdb.com/?spell=50609, -7.364, 7.75, 0.386, 5
Scroll of Strength VI, https://wotlkdb.com/?spell=58489, -7.4029, 7.8929, 0.49, 6.2
Scroll of Intellect VI, https://wotlkdb.com/?spell=50602, -7.4221, 7.8929, 0.4708, 6
Glyph of Barbaric Insults, https://wotlkdb.com/?spell=57151, -7.4583, 8.4583, 1, 11.8
Scroll of Agility VI, https://wotlkdb.com/?spell=58481, -7.6341, 7.8929, 0.2588, 3.3
Scroll of Stamina VI, https://wotlkdb.com/?spell=50618, -7.7215, 7.75, 0.0285, 0.4
Scroll of Spirit V, https://wotlkdb.com/?spell=50608, -7.7234, 7.75, 0.0266, 0.3
Scroll of Spirit IV, https://wotlkdb.com/?spell=50607, -7.9483, 8.5833, 0.635, 7.4
Glyph of Revenge, https://wotlkdb.com/?spell=57165, -8.0025, 15.0025, 7, 46.7
Glyph of Lava Lash, https://wotlkdb.com/?spell=57249, -8.0025, 15.0025, 7, 46.7
Scroll of Strength IV, https://wotlkdb.com/?spell=58487, -8.0933, 8.5833, 0.49, 5.7
Scroll of Agility IV, https://wotlkdb.com/?spell=58478, -8.1133, 8.5833, 0.47, 5.5
Scroll of Intellect IV, https://wotlkdb.com/?spell=50600, -8.1334, 8.5833, 0.4499, 5.2
Scroll of Stamina VIII, https://wotlkdb.com/?spell=50620, -8.17, 12.95, 4.78, 36.9
Ethereal Ink, https://wotlkdb.com/?spell=57713, -8.3571, 16, 7.6429, 47.8
Scroll of Stamina IV, https://wotlkdb.com/?spell=50616, -8.5716, 8.5833, 0.0117, 0.1
Book of Clever Tricks, https://wotlkdb.com/?spell=59496, -8.7257, 28.6757, 19.95, 69.6
Glyph of Insect Swarm, https://wotlkdb.com/?spell=56948, -9.0526, 15.0025, 5.9499, 39.7
Scroll of Spirit VIII, https://wotlkdb.com/?spell=50611, -9.95, 12.95, 3, 23.2
Glyph of Multi-Shot, https://wotlkdb.com/?spell=57007, -10.0027, 15.0025, 4.9998, 33.3
Scroll of Intellect VIII, https://wotlkdb.com/?spell=50604, -11.07, 12.95, 1.88, 14.5
Glyph of Strangulate, https://wotlkdb.com/?spell=57225, -11.46, 12.45, 0.99, 8
Glyph of Sap, https://wotlkdb.com/?spell=57129, -12.0025, 15.0025, 3, 20
Glyph of Shadow Bolt, https://wotlkdb.com/?spell=57271, -12.1125, 15.0025, 2.89, 19.3
Scroll of Stamina VII, https://wotlkdb.com/?spell=50619, -12.7637, 12.95, 0.1863, 1.4
Scroll of Spirit VII, https://wotlkdb.com/?spell=50610, -12.8734, 12.95, 0.0766, 0.6
Scroll of Agility VII, https://wotlkdb.com/?spell=58482, -12.883, 12.95, 0.067, 0.5
Scroll of Intellect VII, https://wotlkdb.com/?spell=50603, -12.894, 12.95, 0.056, 0.4
Scroll of Strength VII, https://wotlkdb.com/?spell=58490, -12.9, 12.95, 0.05, 0.4
Glyph of Cleansing, https://wotlkdb.com/?spell=57020, -13.0225, 15.0025, 1.98, 13.2
Glyph of Frost Shock, https://wotlkdb.com/?spell=57241, -14.0526, 15.0025, 0.9499, 6.3
Scroll of Spirit III, https://wotlkdb.com/?spell=50606, -14.2329, 15.015, 0.7821, 5.2
Scroll of Stamina III, https://wotlkdb.com/?spell=50614, -14.47, 15.015, 0.545, 3.6
Scroll of Agility III, https://wotlkdb.com/?spell=58476, -14.525, 15.015, 0.49, 3.3
Glyph of Voidwalker, https://wotlkdb.com/?spell=57277, -14.5625, 15.0025, 0.44, 2.9
Scroll of Intellect III, https://wotlkdb.com/?spell=50599, -14.795, 15.015, 0.22, 1.5
Scroll of Strength III, https://wotlkdb.com/?spell=58486, -15.0018, 15.015, 0.0132, 0.1
Weapon Vellum III, https://wotlkdb.com/?spell=59501, -20.85, 36.85, 16, 43.4
Stormbound Tome, https://wotlkdb.com/?spell=59493, -43.9842, 44.1242, 0.14, 0.3
Manual of Clouds, https://wotlkdb.com/?spell=59494, -45.1092, 45.2492, 0.14, 0.3
