Name, Link, Profit, Cost, Sell, ROI %
Transmute: Skyfire Diamond, https://wotlkdb.com/?spell=32766, 372.46, 126.54, 499, 394.3
Mercurial Stone, https://wotlkdb.com/?spell=38070, 130.4902, 42.4998, 172.99, 407
Transmute: Majestic Zircon, https://wotlkdb.com/?spell=66663, 103.5, 46, 149.5, 325
Transmute: Ametrine, https://wotlkdb.com/?spell=66658, 102.65, 96.1, 198.75, 206.8
Transmute: King's Amber, https://wotlkdb.com/?spell=66660, 98.99, 121, 219.99, 181.8
Transmute: Eternal Water to Fire, https://wotlkdb.com/?spell=53784, 78.5566, 8, 86.5566, 1082
Transmute: Eternal Life to Fire, https://wotlkdb.com/?spell=53773, 70.5566, 16, 86.5566, 541
Living Action Potion, https://wotlkdb.com/?spell=24367, 70.2857, 29.9642, 100.2499, 334.6
Transmute: Dreadstone, https://wotlkdb.com/?spell=66662, 66.8, 38.2, 105, 274.9
Elixir of Greater Firepower, https://wotlkdb.com/?spell=26277, 61.825, 7.75, 69.575, 897.7
Flask of Supreme Power, https://wotlkdb.com/?spell=17637, 53.6987, 21.3013, 75, 352.1
Transmute: Eye of Zul, https://wotlkdb.com/?spell=66664, 51.15, 17.85, 69, 386.6
Transmute: Primal Shadow to Water, https://wotlkdb.com/?spell=28580, 50.24, 0.76, 51, 6710.5
Limited Invulnerability Potion, https://wotlkdb.com/?spell=3175, 48.01, 6.99, 55, 786.8
Transmute: Primal Earth to Water, https://wotlkdb.com/?spell=28567, 48, 3, 51, 1700
Flask of Distilled Wisdom, https://wotlkdb.com/?spell=17636, 44.27, 42.73, 87, 203.6
Elixir of Major Defense, https://wotlkdb.com/?spell=28557, 41.65, 36.35, 78, 214.6
Frost Protection Potion, https://wotlkdb.com/?spell=7258, 40.4664, 2.3136, 42.78, 1849.1
Greater Fire Protection Potion, https://wotlkdb.com/?spell=17574, 40.37, 1.63, 42, 2576.7
Elixir of the Searching Eye, https://wotlkdb.com/?spell=28552, 35.89, 12.46, 48.35, 388
Transmute: Primal Fire to Mana, https://wotlkdb.com/?spell=28583, 32.2099, 0.79, 32.9999, 4177.2
Transmute: Eternal Earth to Air, https://wotlkdb.com/?spell=53781, 32, 4, 36, 900
Fire Protection Potion, https://wotlkdb.com/?spell=7257, 31.98, 12.02, 44, 366.1
Transmute: Earthsiege Diamond, https://wotlkdb.com/?spell=57427, 29.2034, 94.2966, 123.5, 131
Transmute: Eternal Water to Air, https://wotlkdb.com/?spell=53783, 28, 8, 36, 450
Transmute: Cardinal Ruby, https://wotlkdb.com/?spell=66659, 27.4434, 201.5566, 229, 113.6
Greater Dreamless Sleep Potion, https://wotlkdb.com/?spell=24366, 27.2674, 2.7325, 29.9999, 1097.9
Transmute: Eternal Earth to Shadow, https://wotlkdb.com/?spell=53782, 26.2, 4, 30.2, 755
Greater Frost Protection Potion, https://wotlkdb.com/?spell=17575, 25.46, 2.54, 28, 1102.4
Transmute: Arcanite, https://wotlkdb.com/?spell=17187, 25.3833, 75.95, 101.3333, 133.4
Transmute: Primal Might, https://wotlkdb.com/?spell=29688, 22.0701, 141.7799, 163.85, 115.6
Transmute: Life to Earth, https://wotlkdb.com/?spell=17565, 19.31, 0.59, 19.9, 3372.9
Stonescale Oil, https://wotlkdb.com/?spell=17551, 19.2657, 0.7143, 19.98, 2797.1
Transmute: Skyflare Diamond, https://wotlkdb.com/?spell=57425, 19.12, 52.88, 72, 136.2
Shadow Oil, https://wotlkdb.com/?spell=3449, 19.0131, 6.8464, 25.8595, 377.7
Transmute: Fire to Earth, https://wotlkdb.com/?spell=17560, 18.78, 1.12, 19.9, 1776.8
Ghost Dye, https://wotlkdb.com/?spell=11473, 18.62, 6.38, 25, 391.8
Transmute: Undeath to Water, https://wotlkdb.com/?spell=17563, 18.0001, 12.9999, 31, 238.5
Lesser Flask of Resistance, https://wotlkdb.com/?spell=62213, 16.26, 13.64, 29.9, 219.2
Elixir of Major Strength, https://wotlkdb.com/?spell=28544, 16.039, 5.861, 21.9, 373.7
Insane Strength Potion, https://wotlkdb.com/?spell=28550, 15.5, 24.5, 40, 163.3
Frost Oil, https://wotlkdb.com/?spell=3454, 14.5016, 4.68, 19.1816, 409.9
Invisibility Potion, https://wotlkdb.com/?spell=11464, 14.241, 4.18, 18.421, 440.7
Transmute: Eternal Life to Shadow, https://wotlkdb.com/?spell=53771, 14.2, 16, 30.2, 188.8
Mighty Nature Protection Potion, https://wotlkdb.com/?spell=53942, 13.4166, 5.3334, 18.75, 351.6
Major Dreamless Sleep Potion, https://wotlkdb.com/?spell=28562, 12.8887, 5.8513, 18.74, 320.3
Transmute: Earthstorm Diamond, https://wotlkdb.com/?spell=32765, 12.615, 138.135, 150.75, 109.1
Destruction Potion, https://wotlkdb.com/?spell=28565, 12.5221, 22.4779, 35, 155.7
Great Rage Potion, https://wotlkdb.com/?spell=6618, 12.175, 3.43, 15.605, 455
Mighty Rage Potion, https://wotlkdb.com/?spell=17527, 12.175, 3.43, 15.605, 455
Transmute: Titanium, https://wotlkdb.com/?spell=60350, 12.1, 40.8, 52.9, 129.7
Elixir of Dream Vision, https://wotlkdb.com/?spell=11468, 11.8503, 3.2497, 15.1, 464.7
Holy Protection Potion, https://wotlkdb.com/?spell=7255, 11.778, 1.172, 12.95, 1104.9
Transmute: Earth to Water, https://wotlkdb.com/?spell=17561, 11.1, 19.9, 31, 155.8
Elixir of Major Agility, https://wotlkdb.com/?spell=28553, 10.3922, 11.5078, 21.9, 190.3
Elixir of Giant Growth, https://wotlkdb.com/?spell=8240, 10.298, 5.602, 15.9, 283.8
Elixir of Giants, https://wotlkdb.com/?spell=11472, 10.08, 3.92, 14, 357.1
Elixir of Defense, https://wotlkdb.com/?spell=3177, 10.03, 5.77, 15.8, 273.8
Potion of Curing, https://wotlkdb.com/?spell=3174, 9.8501, 1.4499, 11.3, 779.4
Shadow Protection Potion, https://wotlkdb.com/?spell=7256, 9.8034, 1.3966, 11.2, 801.9
Elixir of Camouflage, https://wotlkdb.com/?spell=28543, 9.6161, 4.4839, 14.1, 314.5
Elixir of Major Fortitude, https://wotlkdb.com/?spell=39636, 9.0361, 5.9639, 15, 251.5
Flask of Mighty Restoration, https://wotlkdb.com/?spell=28588, 7.8529, 12.8471, 20.7, 161.1
Elixir of Protection, https://wotlkdb.com/?spell=54220, 7.79, 8.2, 15.99, 195
Greater Arcane Protection Potion, https://wotlkdb.com/?spell=17577, 7.7402, 1.2598, 9, 714.4
Elixir of Demonslaying, https://wotlkdb.com/?spell=11477, 7.28, 5.87, 13.15, 224
Swiftness Potion, https://wotlkdb.com/?spell=2335, 6.798, 2.202, 9, 408.7
Elixir of Minor Agility, https://wotlkdb.com/?spell=3230, 6.795, 0.205, 7, 3414.6
Lesser Stoneshield Potion, https://wotlkdb.com/?spell=4942, 6.6664, 7.3336, 14, 190.9
Free Action Potion, https://wotlkdb.com/?spell=6624, 6.3799, 43.02, 49.3999, 114.8
Magic Resistance Potion, https://wotlkdb.com/?spell=11453, 6.0501, 1.9499, 8, 410.3
Minor Magic Resistance Potion, https://wotlkdb.com/?spell=3172, 5.748, 4.252, 10, 235.2
Major Troll's Blood Elixir, https://wotlkdb.com/?spell=3451, 5.51, 1.49, 7, 469.8
Elixir of Lesser Agility, https://wotlkdb.com/?spell=2333, 5.4744, 2.97, 8.4444, 284.3
Major Rejuvenation Potion, https://wotlkdb.com/?spell=22732, 5.03, 9.97, 15, 150.5
Elixir of Frost Power, https://wotlkdb.com/?spell=21923, 4.42, 2.58, 7, 271.3
Catseye Elixir, https://wotlkdb.com/?spell=12609, 4.2183, 2.1236, 6.3419, 298.6
Lesser Flask of Toughness, https://wotlkdb.com/?spell=53899, 4.14, 17.46, 21.6, 123.7
Rage Potion, https://wotlkdb.com/?spell=6617, 4.113, 0.662, 4.775, 721.3
Blackmouth Oil, https://wotlkdb.com/?spell=7836, 4.02, 15.98, 20, 125.2
Ethereal Oil, https://wotlkdb.com/?spell=62409, 3.8464, 6.0036, 9.85, 164.1
Flask of Pure Death, https://wotlkdb.com/?spell=28591, 3.7079, 26.292, 29.9999, 114.1
Flask of Chromatic Wonder, https://wotlkdb.com/?spell=42736, 3.6352, 53.3648, 57, 106.8
Elixir of Detect Lesser Invisibility, https://wotlkdb.com/?spell=3453, 3.5, 1.46, 4.96, 339.7
Transmute: Primal Earth to Life, https://wotlkdb.com/?spell=28585, 3.4999, 3, 6.4999, 216.7
Lesser Invisibility Potion, https://wotlkdb.com/?spell=3448, 3.24, 3.51, 6.75, 192.3
Elixir of Minor Accuracy, https://wotlkdb.com/?spell=63732, 3.228, 2.972, 6.2, 208.6
Transmute: Primal Water to Air, https://wotlkdb.com/?spell=28569, 2.99, 51, 53.99, 105.9
Haste Potion, https://wotlkdb.com/?spell=28564, 2.7941, 31.7059, 34.5, 108.8
Elixir of Greater Water Breathing, https://wotlkdb.com/?spell=22808, 2.4727, 2.2773, 4.75, 208.6
Elixir of Mighty Thoughts, https://wotlkdb.com/?spell=60367, 2.37, 11.13, 13.5, 121.3
Transmute: Primal Fire to Earth, https://wotlkdb.com/?spell=28568, 2.21, 0.79, 3, 379.7
Elixir of Lightning Speed, https://wotlkdb.com/?spell=60366, 1.92, 5.93, 7.85, 132.4
Elixir of the Mongoose, https://wotlkdb.com/?spell=17571, 1.9158, 8.0842, 10, 123.7
Mighty Shadow Protection Potion, https://wotlkdb.com/?spell=53938, 1.6955, 3.86, 5.5555, 143.9
Elixir of Ogre's Strength, https://wotlkdb.com/?spell=3188, 1.33, 1.17, 2.5, 213.7
Fire Oil, https://wotlkdb.com/?spell=7837, 1, 1, 2, 200
Heroic Potion, https://wotlkdb.com/?spell=28563, 0.95, 25.95, 26.9, 103.7
Guru's Elixir, https://wotlkdb.com/?spell=53848, 0.8999, 7.7, 8.5999, 111.7
Dreamless Sleep Potion, https://wotlkdb.com/?spell=15833, 0.7503, 3.2497, 4, 123.1
Mighty Rage Potion, https://wotlkdb.com/?spell=17552, 0.7, 8.29, 8.99, 108.4
Potion of Wild Magic, https://wotlkdb.com/?spell=54222, 0.4, 49.5, 49.9, 100.8
Elixir of Minor Defense, https://wotlkdb.com/?spell=7183, 0.1364, 0.008, 0.1444, 1805
Elixir of Greater Intellect, https://wotlkdb.com/?spell=11465, 0.09, 2.85, 2.94, 103.2
Earthen Elixir, https://wotlkdb.com/?spell=39637, 0.0747, 5.9253, 6, 101.3
Indestructible Potion, https://wotlkdb.com/?spell=53905, 0.0399, 7.96, 7.9999, 100.5
Transmute: Elemental Fire, https://wotlkdb.com/?spell=25146, 0.039, 0.351, 0.39, 111.1
Elixir of Lion's Strength, https://wotlkdb.com/?spell=2329, 0.005, 0.745, 0.75, 100.7
Potion of Speed, https://wotlkdb.com/?spell=54221, 0, 49.9, 49.9, 100
Pygmy Oil, https://wotlkdb.com/?spell=53812, -0.08, 1.98, 1.9, 96
Oil of Immolation, https://wotlkdb.com/?spell=11451, -0.1136, 2.1136, 2, 94.6
Elixir of Detect Undead, https://wotlkdb.com/?spell=11460, -0.2102, 2.2102, 2, 90.5
Minor Healing Potion, https://wotlkdb.com/?spell=2330, -0.2135, 0.245, 0.0315, 12.9
Minor Rejuvenation Potion, https://wotlkdb.com/?spell=2332, -0.242, 1.242, 1, 80.5
Transmute: Iron to Gold, https://wotlkdb.com/?spell=11479, -0.4267, 1.4167, 0.99, 69.9
Minor Mana Potion, https://wotlkdb.com/?spell=2331, -0.495, 0.505, 0.01, 2
Arcane Elixir, https://wotlkdb.com/?spell=11461, -0.7736, 3.5136, 2.74, 78
Greater Healing Potion, https://wotlkdb.com/?spell=7181, -0.9112, 0.93, 0.0188, 2
Crazy Alchemist's Potion, https://wotlkdb.com/?spell=53895, -0.92, 8.92, 8, 89.7
Transmute: Water to Air, https://wotlkdb.com/?spell=17562, -1, 31, 30, 96.8
Weak Troll's Blood Elixir, https://wotlkdb.com/?spell=3170, -1.422, 1.722, 0.3, 17.4
Elixir of Firepower, https://wotlkdb.com/?spell=7845, -1.43, 4.43, 3, 67.7
Elixir of Minor Fortitude, https://wotlkdb.com/?spell=2334, -1.4363, 1.722, 0.2857, 16.6
Adept's Elixir, https://wotlkdb.com/?spell=33740, -1.4439, 3.9939, 2.55, 63.8
Mighty Arcane Protection Potion, https://wotlkdb.com/?spell=53936, -1.48, 2.48, 1, 40.3
Elixir of Healing Power, https://wotlkdb.com/?spell=28545, -1.547, 3.4678, 1.9208, 55.4
Sneaking Potion, https://wotlkdb.com/?spell=28546, -1.5839, 5.9639, 4.38, 73.4
Elixir of Greater Agility, https://wotlkdb.com/?spell=11467, -1.6036, 2.6036, 1, 38.4
Mighty Fire Protection Potion, https://wotlkdb.com/?spell=53939, -1.7889, 2.9, 1.1111, 38.3
Superior Healing Potion, https://wotlkdb.com/?spell=11457, -1.834, 1.94, 0.106, 5.5
Greater Mana Potion, https://wotlkdb.com/?spell=11448, -1.9666, 2.0836, 0.117, 5.6
Mighty Frost Protection Potion, https://wotlkdb.com/?spell=53937, -2.01, 12, 9.99, 83.3
Lesser Healing Potion, https://wotlkdb.com/?spell=2337, -2.023, 2.0315, 0.0085, 0.4
Healing Potion, https://wotlkdb.com/?spell=3447, -2.05, 2.99, 0.94, 31.4
Elixir of Mighty Defense, https://wotlkdb.com/?spell=60356, -2.1, 8.89, 6.79, 76.4
Mad Alchemist's Potion, https://wotlkdb.com/?spell=45061, -2.15, 3.21, 1.06, 33
Elixir of Fortitude, https://wotlkdb.com/?spell=3450, -2.1536, 4.1336, 1.98, 47.9
Greater Holy Protection Potion, https://wotlkdb.com/?spell=17579, -2.155, 2.23, 0.075, 3.4
Elixir of Spirit, https://wotlkdb.com/?spell=53847, -2.44, 11.39, 8.95, 78.6
Elixir of Tongues, https://wotlkdb.com/?spell=2336, -2.4795, 2.482, 0.0025, 0.1
Potion of Nightmares, https://wotlkdb.com/?spell=53900, -2.62, 11.72, 9.1, 77.6
Elixir of Detect Demon, https://wotlkdb.com/?spell=11478, -2.85, 5.61, 2.76, 49.2
Elixir of the Sages, https://wotlkdb.com/?spell=17555, -2.985, 3.36, 0.375, 11.2
Elixir of Mighty Strength, https://wotlkdb.com/?spell=54218, -3, 8, 5, 62.5
Elixir of Armor Piercing, https://wotlkdb.com/?spell=60365, -3, 8, 5, 62.5
Elixir of Greater Defense, https://wotlkdb.com/?spell=11450, -3.1536, 4.1336, 0.98, 23.7
Onslaught Elixir, https://wotlkdb.com/?spell=33738, -3.1797, 5.861, 2.6813, 45.7
Mana Potion, https://wotlkdb.com/?spell=3452, -3.2305, 3.43, 0.1995, 5.8
Mageblood Elixir, https://wotlkdb.com/?spell=24365, -3.26, 3.36, 0.1, 3
Volatile Healing Potion, https://wotlkdb.com/?spell=33732, -3.3876, 3.5064, 0.1188, 3.4
Lesser Mana Potion, https://wotlkdb.com/?spell=3173, -3.442, 3.502, 0.06, 1.7
Unstable Mana Potion, https://wotlkdb.com/?spell=33733, -3.4639, 5.9639, 2.5, 41.9
Nature Protection Potion, https://wotlkdb.com/?spell=7259, -3.49, 3.52, 0.03, 0.9
Transmute: Primal Life to Earth, https://wotlkdb.com/?spell=28584, -3.4999, 6.4999, 3, 46.2
Elixir of Wisdom, https://wotlkdb.com/?spell=3171, -3.502, 4.502, 1, 22.2
Elixir of Accuracy, https://wotlkdb.com/?spell=60354, -3.63, 11.13, 7.5, 67.4
Super Mana Potion, https://wotlkdb.com/?spell=28555, -3.6745, 4.9345, 1.26, 25.5
Elixir of Brute Force, https://wotlkdb.com/?spell=17557, -3.7301, 7.73, 3.9999, 51.7
Elixir of Agility, https://wotlkdb.com/?spell=11449, -3.8836, 4.3836, 0.5, 11.4
Major Healing Potion, https://wotlkdb.com/?spell=17556, -4.0021, 4.1121, 0.11, 2.7
Discolored Healing Potion, https://wotlkdb.com/?spell=4508, -4.2395, 4.242, 0.0025, 0.1
Spellpower Elixir, https://wotlkdb.com/?spell=53842, -4.7812, 8.46, 3.6788, 43.5
Mighty Troll's Blood Elixir, https://wotlkdb.com/?spell=24368, -4.95, 5.05, 0.1, 2
Elixir of Major Frost Power, https://wotlkdb.com/?spell=28549, -4.95, 12.95, 8, 61.8
Restorative Potion, https://wotlkdb.com/?spell=11452, -5.1386, 20.1386, 15, 74.5
Icy Mana Potion, https://wotlkdb.com/?spell=53839, -5.26, 8.26, 3, 36.3
Wrath Elixir, https://wotlkdb.com/?spell=53841, -5.4601, 11.46, 5.9999, 52.4
Elixir of Mastery, https://wotlkdb.com/?spell=33741, -5.5839, 10.5039, 4.92, 46.8
Strong Troll's Blood Elixir, https://wotlkdb.com/?spell=3176, -5.67, 5.96, 0.29, 4.9
Superior Mana Potion, https://wotlkdb.com/?spell=17553, -5.73, 6.03, 0.3, 5
Greater Arcane Elixir, https://wotlkdb.com/?spell=17573, -5.8521, 6.0771, 0.225, 3.7
Elixir of Ironskin, https://wotlkdb.com/?spell=39639, -7.28, 12.43, 5.15, 41.4
Transmute: Mithril to Truesilver, https://wotlkdb.com/?spell=11480, -7.7, 8.45, 0.75, 8.9
Elixir of Shadow Power, https://wotlkdb.com/?spell=11476, -7.8595, 9.07, 1.2105, 13.3
Elixir of Empowerment, https://wotlkdb.com/?spell=28578, -7.906, 17.9059, 9.9999, 55.8
Resurgent Healing Potion, https://wotlkdb.com/?spell=53838, -8.24, 8.92, 0.68, 7.6
Fel Mana Potion, https://wotlkdb.com/?spell=38961, -8.472, 8.972, 0.5, 5.6
Elixir of Draenic Wisdom, https://wotlkdb.com/?spell=39638, -8.5039, 10.5039, 2, 19
Elixir of Major Mageblood, https://wotlkdb.com/?spell=28570, -10.0809, 25.6559, 15.575, 60.7
Runic Healing Potion, https://wotlkdb.com/?spell=53836, -10.43, 11.42, 0.99, 8.7
Greater Nature Protection Potion, https://wotlkdb.com/?spell=17576, -10.765, 19.765, 9, 45.5
Elixir of Major Shadow Power, https://wotlkdb.com/?spell=28558, -10.836, 13.836, 3, 21.7
Elixir of Major Firepower, https://wotlkdb.com/?spell=28556, -10.8962, 11.1594, 0.2632, 2.4
Wildvine Potion, https://wotlkdb.com/?spell=11458, -11.1999, 12.1999, 1, 8.2
Major Shadow Protection Potion, https://wotlkdb.com/?spell=28576, -11.36, 14.36, 3, 20.9
Elixir of Mighty Fortitude, https://wotlkdb.com/?spell=53898, -11.84, 15.84, 4, 25.3
Fel Regeneration Potion, https://wotlkdb.com/?spell=38962, -12.1658, 12.6658, 0.5, 3.9
Swim Speed Potion, https://wotlkdb.com/?spell=7841, -12.182, 20.202, 8.02, 39.7
Flask of Chromatic Resistance, https://wotlkdb.com/?spell=17638, -13.8713, 84.3713, 70.5, 83.6
Major Fire Protection Potion, https://wotlkdb.com/?spell=28571, -13.89, 14.39, 0.5, 3.5
Transmute: Eternal Shadow to Life, https://wotlkdb.com/?spell=53780, -14.2, 30.2, 16, 53
Fel Strength Elixir, https://wotlkdb.com/?spell=38960, -14.972, 15.272, 0.3, 2
Flask of the Titans, https://wotlkdb.com/?spell=17635, -15.53, 84.5, 68.97, 81.6
Flask of Pure Mojo, https://wotlkdb.com/?spell=54213, -16.46, 34.46, 18, 52.2
Purification Potion, https://wotlkdb.com/?spell=17572, -16.5923, 22.37, 5.7777, 25.8
Transmute: Water to Undeath, https://wotlkdb.com/?spell=17564, -18.0001, 31, 12.9999, 41.9
Super Rejuvenation Potion, https://wotlkdb.com/?spell=28586, -18.0713, 20.0712, 1.9999, 10
Greater Shadow Protection Potion, https://wotlkdb.com/?spell=17578, -18.0995, 27.0995, 9, 33.2
Flask of Relentless Assault, https://wotlkdb.com/?spell=28589, -18.69, 58.59, 39.9, 68.1
Transmute: Earth to Life, https://wotlkdb.com/?spell=17566, -19.31, 19.9, 0.59, 3
Major Nature Protection Potion, https://wotlkdb.com/?spell=28573, -19.5999, 20.0999, 0.5, 2.5
Major Holy Protection Potion, https://wotlkdb.com/?spell=28577, -19.5999, 20.0999, 0.5, 2.5
Shrouding Potion, https://wotlkdb.com/?spell=28554, -20.6459, 21.1459, 0.5, 2.4
Ironshield Potion, https://wotlkdb.com/?spell=28579, -21.4197, 22.1197, 0.7, 3.2
Major Mana Potion, https://wotlkdb.com/?spell=17580, -22.92, 23.22, 0.3, 1.3
Transmute: Eternal Shadow to Earth, https://wotlkdb.com/?spell=53779, -26.2, 30.2, 4, 13.2
Elixir of Water Walking, https://wotlkdb.com/?spell=62410, -26.55, 31.55, 5, 15.8
Transmute: Eternal Air to Water, https://wotlkdb.com/?spell=53776, -28, 36, 8, 22.2
Transmute: Air to Fire, https://wotlkdb.com/?spell=17559, -28.88, 30, 1.12, 3.7
Cauldron of Major Shadow Protection, https://wotlkdb.com/?spell=41503, -29.835, 29.91, 0.075, 0.3
Cauldron of Major Fire Protection, https://wotlkdb.com/?spell=41500, -29.895, 29.97, 0.075, 0.3
Elixir of Superior Defense, https://wotlkdb.com/?spell=17554, -31.2001, 41.2, 9.9999, 24.3
Super Healing Potion, https://wotlkdb.com/?spell=28551, -31.9157, 32.4157, 0.5, 1.5
Transmute: Eternal Air to Earth, https://wotlkdb.com/?spell=53777, -32, 36, 4, 11.1
Transmute: Primal Mana to Fire, https://wotlkdb.com/?spell=28582, -32.2099, 32.9999, 0.79, 2.4
Elixir of Deadly Strikes, https://wotlkdb.com/?spell=60355, -33.1267, 51.46, 18.3333, 35.6
Elixir of Water Breathing, https://wotlkdb.com/?spell=7179, -38.002, 43.002, 5, 11.6
Greater Stoneshield Potion, https://wotlkdb.com/?spell=17570, -38.16, 48.16, 10, 20.8
Elixir of Expertise, https://wotlkdb.com/?spell=60357, -39.61, 51.46, 11.85, 23
Cauldron of Major Nature Protection, https://wotlkdb.com/?spell=41502, -41.3148, 41.3898, 0.075, 0.2
Major Arcane Protection Potion, https://wotlkdb.com/?spell=28575, -43.5999, 46.5999, 3, 6.4
Elixir of Mighty Mageblood, https://wotlkdb.com/?spell=56519, -44.0601, 51.06, 6.9999, 13.7
Elixir of Mighty Agility, https://wotlkdb.com/?spell=53840, -44.92, 54.92, 10, 18.2
Powerful Rejuvenation Potion, https://wotlkdb.com/?spell=53904, -45.86, 53.86, 8, 14.9
Runic Mana Potion, https://wotlkdb.com/?spell=53837, -46.06, 51.06, 5, 9.8
Transmute: Primal Water to Shadow, https://wotlkdb.com/?spell=28581, -50.24, 51, 0.76, 1.5
Transmute: Primal Air to Fire, https://wotlkdb.com/?spell=28566, -53.2, 53.99, 0.79, 1.5
Major Frost Protection Potion, https://wotlkdb.com/?spell=28572, -54.6, 64.6, 10, 15.5
Potion of Petrification, https://wotlkdb.com/?spell=17634, -61.13, 140.11, 78.98, 56.4
Flask of Fortification, https://wotlkdb.com/?spell=28587, -63.74, 68.74, 5, 7.3
Flask of the Frost Wyrm, https://wotlkdb.com/?spell=53901, -68.05, 136.8, 68.75, 50.3
Transmute: Eternal Fire to Life, https://wotlkdb.com/?spell=53775, -70.5566, 86.5566, 16, 18.5
Flask of Stoneblood, https://wotlkdb.com/?spell=53902, -75.5, 170.29, 94.79, 55.7
Indestructible Alchemist Stone, https://wotlkdb.com/?spell=60403, -77.6493, 85.7, 8.0507, 9.4
Transmute: Eternal Fire to Water, https://wotlkdb.com/?spell=53774, -78.5566, 86.5566, 8, 9.2
Flask of Endless Rage, https://wotlkdb.com/?spell=53903, -84.8801, 177.88, 92.9999, 52.3
Flask of Blinding Light, https://wotlkdb.com/?spell=28590, -94.0313, 109.0313, 15, 13.8
Cauldron of Major Arcane Protection, https://wotlkdb.com/?spell=41458, -94.3148, 94.3898, 0.075, 0.1
Mercurial Alchemist Stone, https://wotlkdb.com/?spell=60396, -96.0493, 104.1, 8.0507, 7.7
Cauldron of Major Frost Protection, https://wotlkdb.com/?spell=41501, -130.315, 130.39, 0.075, 0.1
Transmute: Eternal Might, https://wotlkdb.com/?spell=54020, -132.9566, 134.5566, 1.6, 1.2
Mighty Alchemist Stone, https://wotlkdb.com/?spell=60405, -384.8493, 392.9, 8.0507, 2
