Name, Link, Profit, Cost, Sell, ROI %
Transmute: Skyfire Diamond, https://wotlkdb.com/?spell=32766, 364.12, 134.88, 499, 370
Flask of Chromatic Resistance, https://wotlkdb.com/?spell=17638, 246.325, 86.675, 333, 384.2
Transmute: King's Amber, https://wotlkdb.com/?spell=66660, 135, 119, 254, 213.4
Mercurial Stone, https://wotlkdb.com/?spell=38070, 98, 52, 150, 288.5
Transmute: Ametrine, https://wotlkdb.com/?spell=66658, 94.84, 120.15, 214.99, 178.9
Transmute: Majestic Zircon, https://wotlkdb.com/?spell=66663, 90, 52.5, 142.5, 271.4
Transmute: Eternal Water to Fire, https://wotlkdb.com/?spell=53784, 77.5001, 9.9999, 87.5, 875
Flask of Supreme Power, https://wotlkdb.com/?spell=17637, 76.395, 23.605, 100, 423.6
Greater Fire Protection Potion, https://wotlkdb.com/?spell=17574, 75.395, 1.51, 76.905, 5093
Transmute: Eternal Life to Fire, https://wotlkdb.com/?spell=53773, 67.5, 20, 87.5, 437.5
Greater Frost Protection Potion, https://wotlkdb.com/?spell=17575, 67.2914, 2.6686, 69.96, 2621.6
Elixir of Major Defense, https://wotlkdb.com/?spell=28557, 64.5667, 24.3333, 88.9, 365.3
Transmute: Eye of Zul, https://wotlkdb.com/?spell=66664, 63, 15, 78, 520
Transmute: Dreadstone, https://wotlkdb.com/?spell=66662, 62.4612, 38.5288, 100.99, 262.1
Transmute: Cardinal Ruby, https://wotlkdb.com/?spell=66659, 62.25, 207.5, 269.75, 130
Living Action Potion, https://wotlkdb.com/?spell=24367, 57.6899, 33.21, 90.8999, 273.7
Greater Arcane Protection Potion, https://wotlkdb.com/?spell=17577, 54.3436, 1.2564, 55.6, 4425.3
Elixir of Greater Firepower, https://wotlkdb.com/?spell=26277, 53.8503, 19.7497, 73.6, 372.7
Limited Invulnerability Potion, https://wotlkdb.com/?spell=3175, 46.89, 8.11, 55, 678.2
Transmute: Primal Shadow to Water, https://wotlkdb.com/?spell=28580, 44.06, 0.44, 44.5, 10113.6
Fire Protection Potion, https://wotlkdb.com/?spell=7257, 43.99, 11.01, 55, 499.5
Flask of the Titans, https://wotlkdb.com/?spell=17635, 43.02, 25.95, 68.97, 265.8
Frost Protection Potion, https://wotlkdb.com/?spell=7258, 39.67, 2.73, 42.4, 1553.1
Transmute: Primal Earth to Water, https://wotlkdb.com/?spell=28567, 39.5, 5, 44.5, 890
Transmute: Primal Fire to Mana, https://wotlkdb.com/?spell=28583, 37.26, 1.74, 39, 2241.4
Transmute: Eternal Earth to Air, https://wotlkdb.com/?spell=53781, 35.8, 4, 39.8, 995
Free Action Potion, https://wotlkdb.com/?spell=6624, 35.7428, 50.0572, 85.8, 171.4
Elixir of Detect Lesser Invisibility, https://wotlkdb.com/?spell=3453, 32.075, 1.15, 33.225, 2889.1
Transmute: Undeath to Water, https://wotlkdb.com/?spell=17563, 29.9, 9, 38.9, 432.2
Flask of Distilled Wisdom, https://wotlkdb.com/?spell=17636, 29.895, 40.105, 70, 174.5
Transmute: Eternal Water to Air, https://wotlkdb.com/?spell=53783, 29.8001, 9.9999, 39.8, 398
Greater Stoneshield Potion, https://wotlkdb.com/?spell=17570, 29.125, 14.875, 44, 295.8
Insane Strength Potion, https://wotlkdb.com/?spell=28550, 29, 14, 43, 307.1
Greater Dreamless Sleep Potion, https://wotlkdb.com/?spell=24366, 27.1299, 2.87, 29.9999, 1045.3
Flask of Relentless Assault, https://wotlkdb.com/?spell=28589, 26.3685, 33.6315, 60, 178.4
Transmute: Eternal Earth to Shadow, https://wotlkdb.com/?spell=53782, 25.9, 4, 29.9, 747.5
Transmute: Earth to Water, https://wotlkdb.com/?spell=17561, 25.2, 13.7, 38.9, 283.9
Greater Nature Protection Potion, https://wotlkdb.com/?spell=17576, 22.75, 17.24, 39.99, 232
Shadow Oil, https://wotlkdb.com/?spell=3449, 22.2804, 5.2196, 27.5, 526.9
Flask of Chromatic Wonder, https://wotlkdb.com/?spell=42736, 21.89, 35.11, 57, 162.3
Transmute: Primal Might, https://wotlkdb.com/?spell=29688, 18.76, 150.24, 169, 112.5
Transmute: Arcanite, https://wotlkdb.com/?spell=17187, 18.1125, 77.6875, 95.8, 123.3
Ghost Dye, https://wotlkdb.com/?spell=11473, 16.74, 8.26, 25, 302.7
Elixir of Major Agility, https://wotlkdb.com/?spell=28553, 16.1, 7.9, 24, 303.8
Transmute: Primal Water to Air, https://wotlkdb.com/?spell=28569, 15.5, 44.5, 60, 134.8
Haste Potion, https://wotlkdb.com/?spell=28564, 15.25, 20, 35.25, 176.3
Invisibility Potion, https://wotlkdb.com/?spell=11464, 14.8298, 5.12, 19.9498, 389.6
Elixir of Giant Growth, https://wotlkdb.com/?spell=8240, 13.673, 5.502, 19.175, 348.5
Transmute: Life to Earth, https://wotlkdb.com/?spell=17565, 13.5015, 0.1985, 13.7, 6901.8
Frost Oil, https://wotlkdb.com/?spell=3454, 13.32, 3.68, 17, 462
Elixir of the Searching Eye, https://wotlkdb.com/?spell=28552, 12.3, 8, 20.3, 253.8
Blackmouth Oil, https://wotlkdb.com/?spell=7836, 11, 13.9, 24.9, 179.1
Transmute: Fire to Earth, https://wotlkdb.com/?spell=17560, 10.73, 2.97, 13.7, 461.3
Lesser Flask of Resistance, https://wotlkdb.com/?spell=62213, 10.16, 9.84, 20, 203.3
Shadow Protection Potion, https://wotlkdb.com/?spell=7256, 10.0101, 0.9899, 11, 1111.2
Transmute: Eternal Life to Shadow, https://wotlkdb.com/?spell=53771, 9.9, 20, 29.9, 149.5
Greater Shadow Protection Potion, https://wotlkdb.com/?spell=17578, 9.63, 28.74, 38.37, 133.5
Elixir of Lesser Agility, https://wotlkdb.com/?spell=2333, 9.5463, 1.6537, 11.2, 677.3
Transmute: Earthsiege Diamond, https://wotlkdb.com/?spell=57427, 8.7801, 96.2199, 105, 109.1
Potion of Curing, https://wotlkdb.com/?spell=3174, 8.69, 1.01, 9.7, 960.4
Elixir of Major Strength, https://wotlkdb.com/?spell=28544, 8.55, 7.45, 16, 214.8
Transmute: Skyflare Diamond, https://wotlkdb.com/?spell=57425, 8.5334, 61.4666, 70, 113.9
Swiftness Potion, https://wotlkdb.com/?spell=2335, 8.3642, 3.6358, 12, 330.1
Ethereal Oil, https://wotlkdb.com/?spell=62409, 8.15, 1.5, 9.65, 643.3
Potion of Wild Magic, https://wotlkdb.com/?spell=54222, 8.1199, 63.8801, 72, 112.7
Elixir of Camouflage, https://wotlkdb.com/?spell=28543, 7.6125, 3.95, 11.5625, 292.7
Transmute: Earthstorm Diamond, https://wotlkdb.com/?spell=32765, 7.0599, 142.9401, 150, 104.9
Elixir of Shadow Power, https://wotlkdb.com/?spell=11476, 6.61, 11.89, 18.5, 155.6
Elixir of Minor Agility, https://wotlkdb.com/?spell=3230, 6.3627, 0.6373, 7, 1098.4
Elixir of Demonslaying, https://wotlkdb.com/?spell=11477, 6.0516, 6.13, 12.1816, 198.7
Potion of Speed, https://wotlkdb.com/?spell=54221, 5.8001, 60.4999, 66.3, 109.6
Fire Oil, https://wotlkdb.com/?spell=7837, 5.58, 0.42, 6, 1428.6
Minor Magic Resistance Potion, https://wotlkdb.com/?spell=3172, 5.5081, 1.9919, 7.5, 376.5
Crazy Alchemist's Potion, https://wotlkdb.com/?spell=53895, 4.99, 9.96, 14.95, 150.1
Elixir of Frost Power, https://wotlkdb.com/?spell=21923, 4.91, 2.09, 7, 334.9
Mighty Rage Potion, https://wotlkdb.com/?spell=17552, 4.792, 6.25, 11.042, 176.7
Mighty Shadow Protection Potion, https://wotlkdb.com/?spell=53938, 4.67, 5.32, 9.99, 187.8
Nature Protection Potion, https://wotlkdb.com/?spell=7259, 4.5028, 0.4972, 5, 1005.6
Major Rejuvenation Potion, https://wotlkdb.com/?spell=22732, 4.4, 10.5, 14.9, 141.9
Lesser Flask of Toughness, https://wotlkdb.com/?spell=53899, 4.39, 19.66, 24.05, 122.3
Holy Protection Potion, https://wotlkdb.com/?spell=7255, 3.9042, 1.0758, 4.98, 462.9
Heroic Potion, https://wotlkdb.com/?spell=28563, 3.8888, 16.1111, 19.9999, 124.1
Elixir of Protection, https://wotlkdb.com/?spell=54220, 3.5618, 11.4382, 15, 131.1
Lesser Invisibility Potion, https://wotlkdb.com/?spell=3448, 3.3801, 1.6199, 5, 308.7
Elixir of Giants, https://wotlkdb.com/?spell=11472, 3.36, 3.24, 6.6, 203.7
Major Troll's Blood Elixir, https://wotlkdb.com/?spell=3451, 3.29, 0.7, 3.99, 570
Transmute: Primal Fire to Earth, https://wotlkdb.com/?spell=28568, 3.26, 1.74, 5, 287.4
Transmute: Primal Earth to Life, https://wotlkdb.com/?spell=28585, 3, 5, 8, 160
Elixir of Armor Piercing, https://wotlkdb.com/?spell=60365, 3, 10, 13, 130
Elixir of Dream Vision, https://wotlkdb.com/?spell=11468, 2.78, 2.2, 4.98, 226.4
Elixir of Ogre's Strength, https://wotlkdb.com/?spell=3188, 2.21, 0.79, 3, 379.7
Stonescale Oil, https://wotlkdb.com/?spell=17551, 2.185, 0.74, 2.925, 395.3
Elixir of Mighty Thoughts, https://wotlkdb.com/?spell=60367, 1.71, 13.29, 15, 112.9
Earthen Elixir, https://wotlkdb.com/?spell=39637, 1.65, 4.35, 6, 137.9
Elixir of Greater Water Breathing, https://wotlkdb.com/?spell=22808, 1.4322, 1.624, 3.0562, 188.2
Elixir of Lightning Speed, https://wotlkdb.com/?spell=60366, 0.92, 7.08, 8, 113
Rage Potion, https://wotlkdb.com/?spell=6617, 0.818, 0.182, 1, 549.5
Elixir of Defense, https://wotlkdb.com/?spell=3177, 0.7329, 1.2571, 1.99, 158.3
Pygmy Oil, https://wotlkdb.com/?spell=53812, 0.6601, 3.22, 3.8801, 120.5
Magic Resistance Potion, https://wotlkdb.com/?spell=11453, 0.57, 1.43, 2, 139.9
Elixir of Mastery, https://wotlkdb.com/?spell=33741, 0.5, 6.95, 7.45, 107.2
Elixir of Minor Defense, https://wotlkdb.com/?spell=7183, 0.3283, 0.005, 0.3333, 6666
Elixir of Detect Undead, https://wotlkdb.com/?spell=11460, 0.25, 1.25, 1.5, 120
Elixir of Greater Intellect, https://wotlkdb.com/?spell=11465, 0.23, 2.77, 3, 108.3
Mighty Fire Protection Potion, https://wotlkdb.com/?spell=53939, 0.2224, 3.7776, 4, 105.9
Elixir of Minor Fortitude, https://wotlkdb.com/?spell=2334, -0.0202, 1.0202, 1, 98
Minor Healing Potion, https://wotlkdb.com/?spell=2330, -0.0209, 0.0217, 0.0008, 3.7
Elixir of Healing Power, https://wotlkdb.com/?spell=28545, -0.05, 2.99, 2.94, 98.3
Transmute: Elemental Fire, https://wotlkdb.com/?spell=25146, -0.1299, 0.3999, 0.27, 67.5
Flask of Mighty Restoration, https://wotlkdb.com/?spell=28588, -0.1315, 8.0815, 7.95, 98.4
Arcane Elixir, https://wotlkdb.com/?spell=11461, -0.1801, 4.18, 3.9999, 95.7
Minor Rejuvenation Potion, https://wotlkdb.com/?spell=2332, -0.1802, 0.6802, 0.5, 73.5
Minor Mana Potion, https://wotlkdb.com/?spell=2331, -0.3217, 0.3335, 0.0118, 3.5
Elixir of Lion's Strength, https://wotlkdb.com/?spell=2329, -0.4035, 0.5035, 0.1, 19.9
Mana Potion, https://wotlkdb.com/?spell=3452, -0.4912, 0.5272, 0.036, 6.8
Greater Healing Potion, https://wotlkdb.com/?spell=7181, -0.4925, 0.53, 0.0375, 7.1
Transmute: Iron to Gold, https://wotlkdb.com/?spell=11479, -0.51, 1.46, 0.95, 65.1
Lesser Mana Potion, https://wotlkdb.com/?spell=3173, -0.5498, 0.5692, 0.0194, 3.4
Major Shadow Protection Potion, https://wotlkdb.com/?spell=28576, -0.6567, 13.4115, 12.7548, 95.1
Weak Troll's Blood Elixir, https://wotlkdb.com/?spell=3170, -0.6702, 1.0202, 0.35, 34.3
Mighty Nature Protection Potion, https://wotlkdb.com/?spell=53942, -0.701, 5.701, 5, 87.7
Mad Alchemist's Potion, https://wotlkdb.com/?spell=45061, -0.75, 2.25, 1.5, 66.7
Sneaking Potion, https://wotlkdb.com/?spell=28546, -1.1, 4.95, 3.85, 77.8
Mighty Arcane Protection Potion, https://wotlkdb.com/?spell=53936, -1.1264, 2.1264, 1, 47
Elixir of Detect Demon, https://wotlkdb.com/?spell=11478, -1.25, 4.25, 3, 70.6
Major Dreamless Sleep Potion, https://wotlkdb.com/?spell=28562, -1.35, 7.35, 6, 81.6
Transmute: Titanium, https://wotlkdb.com/?spell=60350, -1.4, 54.4, 53, 97.4
Elixir of Greater Defense, https://wotlkdb.com/?spell=11450, -1.4099, 2.9599, 1.55, 52.4
Catseye Elixir, https://wotlkdb.com/?spell=12609, -1.4489, 2.56, 1.1111, 43.4
Elixir of Minor Accuracy, https://wotlkdb.com/?spell=63732, -1.522, 6.442, 4.92, 76.4
Elixir of Tongues, https://wotlkdb.com/?spell=2336, -1.6595, 1.662, 0.0025, 0.2
Great Rage Potion, https://wotlkdb.com/?spell=6618, -1.69, 2.49, 0.8, 32.1
Mighty Rage Potion, https://wotlkdb.com/?spell=17527, -1.69, 2.49, 0.8, 32.1
Superior Healing Potion, https://wotlkdb.com/?spell=11457, -1.695, 1.77, 0.075, 4.2
Dreamless Sleep Potion, https://wotlkdb.com/?spell=15833, -1.7125, 2.2, 0.4875, 22.2
Elixir of Greater Agility, https://wotlkdb.com/?spell=11467, -1.88, 3.18, 1.3, 40.9
Adept's Elixir, https://wotlkdb.com/?spell=33740, -1.96, 3.94, 1.98, 50.3
Greater Holy Protection Potion, https://wotlkdb.com/?spell=17579, -2.045, 2.12, 0.075, 3.5
Elixir of Agility, https://wotlkdb.com/?spell=11449, -2.0722, 2.1972, 0.125, 5.7
Elixir of Major Fortitude, https://wotlkdb.com/?spell=39636, -2.31, 4.95, 2.64, 53.3
Elixir of Major Frost Power, https://wotlkdb.com/?spell=28549, -2.3611, 10.3611, 8, 77.2
Indestructible Potion, https://wotlkdb.com/?spell=53905, -2.375, 11.375, 9, 79.1
Unstable Mana Potion, https://wotlkdb.com/?spell=33733, -2.45, 4.95, 2.5, 50.5
Greater Mana Potion, https://wotlkdb.com/?spell=11448, -2.4506, 2.49, 0.0394, 1.6
Healing Potion, https://wotlkdb.com/?spell=3447, -2.47, 3.46, 0.99, 28.6
Oil of Immolation, https://wotlkdb.com/?spell=11451, -2.5899, 2.6899, 0.1, 3.7
Super Mana Potion, https://wotlkdb.com/?spell=28555, -2.65, 3.65, 1, 27.4
Elixir of Mighty Strength, https://wotlkdb.com/?spell=54218, -2.8571, 10, 7.1429, 71.4
Elixir of Fortitude, https://wotlkdb.com/?spell=3450, -2.8614, 2.9599, 0.0985, 3.3
Elixir of Empowerment, https://wotlkdb.com/?spell=28578, -2.9906, 12.9905, 9.9999, 77
Lesser Healing Potion, https://wotlkdb.com/?spell=2337, -2.9929, 3.0008, 0.0079, 0.3
Transmute: Primal Life to Earth, https://wotlkdb.com/?spell=28584, -3, 8, 5, 62.5
Onslaught Elixir, https://wotlkdb.com/?spell=33738, -3.25, 7.45, 4.2, 56.4
Volatile Healing Potion, https://wotlkdb.com/?spell=33732, -3.435, 3.59, 0.155, 4.3
Elixir of Accuracy, https://wotlkdb.com/?spell=60354, -3.45, 14.45, 11, 76.1
Elixir of Ironskin, https://wotlkdb.com/?spell=39639, -3.9611, 9.1111, 5.15, 56.5
Elixir of Superior Defense, https://wotlkdb.com/?spell=17554, -4.5925, 7.09, 2.4975, 35.2
Elixir of Draenic Wisdom, https://wotlkdb.com/?spell=39638, -4.95, 6.95, 2, 28.8
Strong Troll's Blood Elixir, https://wotlkdb.com/?spell=3176, -5.26, 6.9, 1.64, 23.8
Elixir of Wisdom, https://wotlkdb.com/?spell=3171, -5.342, 6.332, 0.99, 15.6
Lesser Stoneshield Potion, https://wotlkdb.com/?spell=4942, -5.445, 6.42, 0.975, 15.2
Wildvine Potion, https://wotlkdb.com/?spell=11458, -5.46, 6.9, 1.44, 20.9
Major Healing Potion, https://wotlkdb.com/?spell=17556, -5.8885, 6.03, 0.1415, 2.3
Transmute: Mithril to Truesilver, https://wotlkdb.com/?spell=11480, -5.9067, 6.3967, 0.49, 7.7
Superior Mana Potion, https://wotlkdb.com/?spell=17553, -6.01, 6.21, 0.2, 3.2
Guru's Elixir, https://wotlkdb.com/?spell=53848, -6.1903, 13.6403, 7.45, 54.6
Greater Arcane Elixir, https://wotlkdb.com/?spell=17573, -6.82, 7.72, 0.9, 11.7
Potion of Nightmares, https://wotlkdb.com/?spell=53900, -6.98, 14.88, 7.9, 53.1
Icy Mana Potion, https://wotlkdb.com/?spell=53839, -8.02, 10.9, 2.88, 26.4
Elixir of Major Firepower, https://wotlkdb.com/?spell=28556, -8.1779, 8.4411, 0.2632, 3.1
Spellpower Elixir, https://wotlkdb.com/?spell=53842, -8.3133, 9.98, 1.6667, 16.7
Elixir of Mighty Defense, https://wotlkdb.com/?spell=60356, -8.4895, 13.035, 4.5455, 34.9
Mighty Frost Protection Potion, https://wotlkdb.com/?spell=53937, -8.5, 16, 7.5, 46.9
Elixir of Mighty Fortitude, https://wotlkdb.com/?spell=53898, -8.92, 17.92, 9, 50.2
Resurgent Healing Potion, https://wotlkdb.com/?spell=53838, -9.188, 9.96, 0.772, 7.8
Elixir of the Mongoose, https://wotlkdb.com/?spell=17571, -9.25, 19.25, 10, 51.9
Elixir of Brute Force, https://wotlkdb.com/?spell=17557, -9.2501, 14.25, 4.9999, 35.1
Elixir of Spirit, https://wotlkdb.com/?spell=53847, -9.35, 15.35, 6, 39.1
Transmute: Eternal Shadow to Life, https://wotlkdb.com/?spell=53780, -9.9, 29.9, 20, 66.9
Discolored Healing Potion, https://wotlkdb.com/?spell=4508, -10.0477, 10.0502, 0.0025, 0
Elixir of Major Shadow Power, https://wotlkdb.com/?spell=28558, -10.1111, 13.1111, 3, 22.9
Elixir of Firepower, https://wotlkdb.com/?spell=7845, -10.29, 12.29, 2, 16.3
Elixir of the Sages, https://wotlkdb.com/?spell=17555, -10.7288, 11.24, 0.5112, 4.5
Mageblood Elixir, https://wotlkdb.com/?spell=24365, -11.14, 11.24, 0.1, 0.9
Wrath Elixir, https://wotlkdb.com/?spell=53841, -11.82, 12.82, 1, 7.8
Mighty Troll's Blood Elixir, https://wotlkdb.com/?spell=24368, -12.15, 12.25, 0.1, 0.8
Fel Mana Potion, https://wotlkdb.com/?spell=38961, -12.4905, 12.9905, 0.5, 3.8
Potion of Petrification, https://wotlkdb.com/?spell=17634, -12.9015, 20.725, 7.8235, 37.7
Destruction Potion, https://wotlkdb.com/?spell=28565, -13, 22, 9, 40.9
Elixir of Major Mageblood, https://wotlkdb.com/?spell=28570, -13.1111, 18.1111, 5, 27.6
Transmute: Earth to Life, https://wotlkdb.com/?spell=17566, -13.5015, 13.7, 0.1985, 1.4
Runic Healing Potion, https://wotlkdb.com/?spell=53836, -13.585, 15.355, 1.77, 11.5
Super Rejuvenation Potion, https://wotlkdb.com/?spell=28586, -13.5941, 14.331, 0.7369, 5.1
Transmute: Water to Air, https://wotlkdb.com/?spell=17562, -14.2, 38.9, 24.7, 63.5
Major Fire Protection Potion, https://wotlkdb.com/?spell=28571, -14.2115, 14.7115, 0.5, 3.4
Shrouding Potion, https://wotlkdb.com/?spell=28554, -14.5, 15, 0.5, 3.3
Restorative Potion, https://wotlkdb.com/?spell=11452, -15.21, 18.19, 2.98, 16.4
Flask of Pure Death, https://wotlkdb.com/?spell=28591, -15.6315, 40.6315, 25, 61.5
Fel Strength Elixir, https://wotlkdb.com/?spell=38960, -15.7, 16, 0.3, 1.9
Ironshield Potion, https://wotlkdb.com/?spell=28579, -15.7422, 16.4422, 0.7, 4.3
Swim Speed Potion, https://wotlkdb.com/?spell=7841, -18.0858, 25.5358, 7.45, 29.2
Fel Regeneration Potion, https://wotlkdb.com/?spell=38962, -18.4, 18.9, 0.5, 2.6
Major Nature Protection Potion, https://wotlkdb.com/?spell=28573, -20.4715, 20.9715, 0.5, 2.4
Major Holy Protection Potion, https://wotlkdb.com/?spell=28577, -20.4715, 20.9715, 0.5, 2.4
Transmute: Air to Fire, https://wotlkdb.com/?spell=17559, -21.73, 24.7, 2.97, 12
Super Healing Potion, https://wotlkdb.com/?spell=28551, -22.45, 22.95, 0.5, 2.2
Major Mana Potion, https://wotlkdb.com/?spell=17580, -22.8405, 23.22, 0.3795, 1.6
Purification Potion, https://wotlkdb.com/?spell=17572, -25.25, 30.25, 5, 16.5
Transmute: Eternal Shadow to Earth, https://wotlkdb.com/?spell=53779, -25.9, 29.9, 4, 13.4
Elixir of Water Walking, https://wotlkdb.com/?spell=62410, -26.47, 30.95, 4.48, 14.5
Flask of Pure Mojo, https://wotlkdb.com/?spell=54213, -27.6028, 50.4528, 22.85, 45.3
Transmute: Eternal Air to Water, https://wotlkdb.com/?spell=53776, -29.8001, 39.8, 9.9999, 25.1
Transmute: Water to Undeath, https://wotlkdb.com/?spell=17564, -29.9, 38.9, 9, 23.1
Major Arcane Protection Potion, https://wotlkdb.com/?spell=28575, -35.7773, 51.9715, 16.1942, 31.2
Transmute: Eternal Air to Earth, https://wotlkdb.com/?spell=53777, -35.8, 39.8, 4, 10.1
Transmute: Primal Mana to Fire, https://wotlkdb.com/?spell=28582, -37.26, 39, 1.74, 4.5
Cauldron of Major Shadow Protection, https://wotlkdb.com/?spell=41503, -39.7385, 39.8135, 0.075, 0.2
Cauldron of Major Fire Protection, https://wotlkdb.com/?spell=41500, -42.3385, 42.4135, 0.075, 0.2
Flask of Fortification, https://wotlkdb.com/?spell=28587, -43.4092, 48.4092, 5, 10.3
Transmute: Primal Water to Shadow, https://wotlkdb.com/?spell=28581, -44.06, 44.5, 0.44, 1
Major Frost Protection Potion, https://wotlkdb.com/?spell=28572, -47.4715, 57.4715, 10, 17.4
Elixir of Expertise, https://wotlkdb.com/?spell=60357, -48.5999, 60.5998, 11.9999, 19.8
Elixir of Water Breathing, https://wotlkdb.com/?spell=7179, -48.8392, 50.0392, 1.2, 2.4
Elixir of Mighty Mageblood, https://wotlkdb.com/?spell=56519, -52.53, 63.98, 11.45, 17.9
Elixir of Deadly Strikes, https://wotlkdb.com/?spell=60355, -52.6498, 60.5998, 7.95, 13.1
Runic Mana Potion, https://wotlkdb.com/?spell=53837, -53.48, 63.98, 10.5, 16.4
Elixir of Mighty Agility, https://wotlkdb.com/?spell=53840, -54.5798, 64.5798, 10, 15.5
Cauldron of Major Nature Protection, https://wotlkdb.com/?spell=41502, -54.8585, 54.9335, 0.075, 0.1
Transmute: Primal Air to Fire, https://wotlkdb.com/?spell=28566, -58.26, 60, 1.74, 2.9
Flask of Blinding Light, https://wotlkdb.com/?spell=28590, -60.6315, 75.6315, 15, 19.8
Powerful Rejuvenation Potion, https://wotlkdb.com/?spell=53904, -62.275, 68.9, 6.625, 9.6
Transmute: Eternal Fire to Life, https://wotlkdb.com/?spell=53775, -67.5, 87.5, 20, 22.9
Transmute: Eternal Fire to Water, https://wotlkdb.com/?spell=53774, -77.5001, 87.5, 9.9999, 11.4
Flask of the Frost Wyrm, https://wotlkdb.com/?spell=53901, -87.4375, 174.4375, 87, 49.9
Indestructible Alchemist Stone, https://wotlkdb.com/?spell=60403, -107.9105, 115.9612, 8.0507, 6.9
Flask of Stoneblood, https://wotlkdb.com/?spell=53902, -108.98, 213.98, 105, 49.1
Mercurial Alchemist Stone, https://wotlkdb.com/?spell=60396, -112.5493, 120.6, 8.0507, 6.7
Flask of Endless Rage, https://wotlkdb.com/?spell=53903, -116.19, 220.94, 104.75, 47.4
Cauldron of Major Arcane Protection, https://wotlkdb.com/?spell=41458, -116.8585, 116.9335, 0.075, 0.1
Cauldron of Major Frost Protection, https://wotlkdb.com/?spell=41501, -127.8585, 127.9335, 0.075, 0.1
Transmute: Eternal Might, https://wotlkdb.com/?spell=54020, -139.6999, 141.2999, 1.6, 1.1
Mighty Alchemist Stone, https://wotlkdb.com/?spell=60405, -462.5978, 470.6485, 8.0507, 1.7
