Name, Link, Profit, Cost, Sell, ROI %
Transmute: Skyfire Diamond, https://wotlkdb.com/?spell=32766, 355.3402, 143.6598, 499, 347.3
Mercurial Stone, https://wotlkdb.com/?spell=38070, 202.0726, 39.6774, 241.75, 609.3
Transmute: King's Amber, https://wotlkdb.com/?spell=66660, 101.3601, 137.6399, 239, 173.6
Transmute: Ametrine, https://wotlkdb.com/?spell=66658, 97, 103, 200, 194.2
Transmute: Majestic Zircon, https://wotlkdb.com/?spell=66663, 93, 47, 140, 297.9
Transmute: Dreadstone, https://wotlkdb.com/?spell=66662, 83.2222, 39, 122.2222, 313.4
Transmute: Eternal Water to Fire, https://wotlkdb.com/?spell=53784, 81, 9, 90, 1000
Transmute: Eternal Life to Fire, https://wotlkdb.com/?spell=53773, 70.1101, 19.8899, 90, 452.5
Elixir of Greater Firepower, https://wotlkdb.com/?spell=26277, 63.8258, 10.5442, 74.37, 705.3
Living Action Potion, https://wotlkdb.com/?spell=24367, 63.0358, 27.9642, 91, 325.4
Transmute: Cardinal Ruby, https://wotlkdb.com/?spell=66659, 60, 190, 250, 131.6
Elixir of Major Defense, https://wotlkdb.com/?spell=28557, 57.8137, 37.1863, 95, 255.5
Transmute: Eye of Zul, https://wotlkdb.com/?spell=66664, 54, 15, 69, 460
Greater Fire Protection Potion, https://wotlkdb.com/?spell=17574, 53.03, 1.97, 55, 2791.9
Greater Frost Protection Potion, https://wotlkdb.com/?spell=17575, 52.76, 2.24, 55, 2455.4
Flask of Supreme Power, https://wotlkdb.com/?spell=17637, 51.2487, 23.7513, 75, 315.8
Limited Invulnerability Potion, https://wotlkdb.com/?spell=3175, 48.4122, 6.5878, 55, 834.9
Transmute: Earthstorm Diamond, https://wotlkdb.com/?spell=32765, 47.6602, 102.3398, 150, 146.6
Transmute: Primal Shadow to Water, https://wotlkdb.com/?spell=28580, 40.6049, 0.395, 40.9999, 10379.7
Frost Protection Potion, https://wotlkdb.com/?spell=7258, 40.572, 2.208, 42.78, 1937.5
Transmute: Primal Earth to Water, https://wotlkdb.com/?spell=28567, 39.7999, 1.2, 40.9999, 3416.7
Transmute: Undeath to Water, https://wotlkdb.com/?spell=17563, 36.2251, 8.7749, 45, 512.8
Transmute: Eternal Earth to Air, https://wotlkdb.com/?spell=53781, 33, 4, 37, 925
Flask of Distilled Wisdom, https://wotlkdb.com/?spell=17636, 32.82, 45.18, 78, 172.6
Transmute: Primal Fire to Mana, https://wotlkdb.com/?spell=28583, 32.4199, 0.58, 32.9999, 5689.6
Transmute: Earth to Water, https://wotlkdb.com/?spell=17561, 29.91, 15.09, 45, 298.2
Transmute: Arcanite, https://wotlkdb.com/?spell=17187, 29.05, 75.95, 105, 138.2
Fire Protection Potion, https://wotlkdb.com/?spell=7257, 28.18, 15.82, 44, 278.1
Transmute: Eternal Water to Air, https://wotlkdb.com/?spell=53783, 28, 9, 37, 411.1
Elixir of Major Agility, https://wotlkdb.com/?spell=28553, 27.6637, 12.3363, 40, 324.2
Transmute: Eternal Earth to Shadow, https://wotlkdb.com/?spell=53782, 27, 4, 31, 775
Transmute: Earthsiege Diamond, https://wotlkdb.com/?spell=57427, 26.9, 97.1, 124, 127.7
Greater Dreamless Sleep Potion, https://wotlkdb.com/?spell=24366, 26.8299, 3.17, 29.9999, 946.4
Transmute: Primal Might, https://wotlkdb.com/?spell=29688, 24.8953, 141.1047, 166, 117.6
Transmute: Primal Water to Air, https://wotlkdb.com/?spell=28569, 24.325, 40.9999, 65.3249, 159.3
Lesser Flask of Resistance, https://wotlkdb.com/?spell=62213, 23.8092, 11.0908, 34.9, 314.7
Shadow Oil, https://wotlkdb.com/?spell=3449, 20.6795, 5.18, 25.8595, 499.2
Mad Alchemist's Potion, https://wotlkdb.com/?spell=45061, 20.49, 4.21, 24.7, 586.7
Transmute: Skyflare Diamond, https://wotlkdb.com/?spell=57425, 20.13, 54.77, 74.9, 136.8
Ghost Dye, https://wotlkdb.com/?spell=11473, 15.7444, 9.2556, 25, 270.1
Potion of Petrification, https://wotlkdb.com/?spell=17634, 15.73, 63.25, 78.98, 124.9
Elixir of the Searching Eye, https://wotlkdb.com/?spell=28552, 15.7036, 14.2963, 29.9999, 209.8
Frost Oil, https://wotlkdb.com/?spell=3454, 15.4016, 5.78, 21.1816, 366.5
Transmute: Life to Earth, https://wotlkdb.com/?spell=17565, 14.631, 0.459, 15.09, 3287.6
Transmute: Fire to Earth, https://wotlkdb.com/?spell=17560, 14.19, 0.9, 15.09, 1676.7
Flask of the Titans, https://wotlkdb.com/?spell=17635, 13.245, 55.725, 68.97, 123.8
Mighty Nature Protection Potion, https://wotlkdb.com/?spell=53942, 13.1302, 5.6198, 18.75, 333.6
Invisibility Potion, https://wotlkdb.com/?spell=11464, 13.0333, 5.3877, 18.421, 341.9
Swiftness Potion, https://wotlkdb.com/?spell=2335, 12.748, 1.202, 13.95, 1160.6
Insane Strength Potion, https://wotlkdb.com/?spell=28550, 12.2571, 27.0089, 39.266, 145.4
Potion of Curing, https://wotlkdb.com/?spell=3174, 11.644, 1.156, 12.8, 1107.3
Elixir of Detect Lesser Invisibility, https://wotlkdb.com/?spell=3453, 11.32, 1.48, 12.8, 864.9
Transmute: Eternal Life to Shadow, https://wotlkdb.com/?spell=53771, 11.1101, 19.8899, 31, 155.9
Great Rage Potion, https://wotlkdb.com/?spell=6618, 10.5426, 2.0624, 12.605, 611.2
Mighty Rage Potion, https://wotlkdb.com/?spell=17527, 10.5426, 2.0624, 12.605, 611.2
Shadow Protection Potion, https://wotlkdb.com/?spell=7256, 10.3376, 0.8624, 11.2, 1298.7
Elixir of Giant Growth, https://wotlkdb.com/?spell=8240, 10.178, 5.822, 16, 274.8
Elixir of Giants, https://wotlkdb.com/?spell=11472, 10.0651, 3.9349, 14, 355.8
Blackmouth Oil, https://wotlkdb.com/?spell=7836, 10.04, 9.96, 20, 200.8
Major Dreamless Sleep Potion, https://wotlkdb.com/?spell=28562, 10.0267, 7.3133, 17.34, 237.1
Elixir of Major Strength, https://wotlkdb.com/?spell=28544, 9.1429, 5.8571, 15, 256.1
Elixir of Major Fortitude, https://wotlkdb.com/?spell=39636, 8.04, 6.96, 15, 215.5
Magic Resistance Potion, https://wotlkdb.com/?spell=11453, 7.7809, 2.21, 9.9909, 452.1
Greater Arcane Protection Potion, https://wotlkdb.com/?spell=17577, 7.7115, 1.2885, 9, 698.5
Minor Magic Resistance Potion, https://wotlkdb.com/?spell=3172, 7.3995, 2.6005, 10, 384.5
Stonescale Oil, https://wotlkdb.com/?spell=17551, 7.2, 1.8, 9, 500
Lesser Flask of Toughness, https://wotlkdb.com/?spell=53899, 6.9802, 17.9198, 24.9, 139
Elixir of Minor Agility, https://wotlkdb.com/?spell=3230, 6.795, 0.205, 7, 3414.6
Elixir of Dream Vision, https://wotlkdb.com/?spell=11468, 6.78, 3.22, 10, 310.6
Lesser Invisibility Potion, https://wotlkdb.com/?spell=3448, 6.49, 2.51, 9, 358.6
Elixir of Lesser Agility, https://wotlkdb.com/?spell=2333, 6.18, 2.22, 8.4, 378.4
Major Troll's Blood Elixir, https://wotlkdb.com/?spell=3451, 5.884, 1.116, 7, 627.2
Elixir of Protection, https://wotlkdb.com/?spell=54220, 5.81, 10.18, 15.99, 157.1
Elixir of Demonslaying, https://wotlkdb.com/?spell=11477, 5.5972, 7.5528, 13.15, 174.1
Elixir of Shadow Power, https://wotlkdb.com/?spell=11476, 5.1166, 13.3834, 18.5, 138.2
Elixir of Camouflage, https://wotlkdb.com/?spell=28543, 4.97, 4.98, 9.95, 199.8
Elixir of Minor Accuracy, https://wotlkdb.com/?spell=63732, 4.802, 3.348, 8.15, 243.4
Elixir of the Sages, https://wotlkdb.com/?spell=17555, 4.69, 3.36, 8.05, 239.6
Rage Potion, https://wotlkdb.com/?spell=6617, 4.4602, 0.4898, 4.95, 1010.6
Ethereal Oil, https://wotlkdb.com/?spell=62409, 4.39, 5.96, 10.35, 173.7
Major Rejuvenation Potion, https://wotlkdb.com/?spell=22732, 4.28, 10.72, 15, 139.9
Transmute: Primal Earth to Life, https://wotlkdb.com/?spell=28585, 4.2775, 1.2, 5.4775, 456.5
Holy Protection Potion, https://wotlkdb.com/?spell=7255, 4.232, 0.748, 4.98, 665.8
Greater Stoneshield Potion, https://wotlkdb.com/?spell=17570, 4.2, 27.8, 32, 115.1
Elixir of Frost Power, https://wotlkdb.com/?spell=21923, 4.13, 2.87, 7, 243.9
Elixir of Ogre's Strength, https://wotlkdb.com/?spell=3188, 4.0576, 0.9424, 5, 530.6
Free Action Potion, https://wotlkdb.com/?spell=6624, 3.8299, 45.57, 49.3999, 108.4
Elixir of Mighty Thoughts, https://wotlkdb.com/?spell=60367, 3.56, 11.44, 15, 131.1
Arcane Elixir, https://wotlkdb.com/?spell=11461, 3.472, 2.478, 5.95, 240.1
Transmute: Titanium, https://wotlkdb.com/?spell=60350, 3.4, 51.6, 55, 106.6
Flask of Chromatic Wonder, https://wotlkdb.com/?spell=42736, 2.93, 54.07, 57, 105.4
Catseye Elixir, https://wotlkdb.com/?spell=12609, 2.182, 1.758, 3.94, 224.1
Elixir of the Mongoose, https://wotlkdb.com/?spell=17571, 1.9158, 8.0842, 10, 123.7
Elixir of Lightning Speed, https://wotlkdb.com/?spell=60366, 1.5367, 6.3133, 7.85, 124.3
Restorative Potion, https://wotlkdb.com/?spell=11452, 1.3591, 8.6409, 10, 115.7
Lesser Stoneshield Potion, https://wotlkdb.com/?spell=4942, 0.982, 9.018, 10, 110.9
Haste Potion, https://wotlkdb.com/?spell=28564, 0.9774, 33.5226, 34.5, 102.9
Mighty Shadow Protection Potion, https://wotlkdb.com/?spell=53938, 0.8889, 4.6666, 5.5555, 119
Onslaught Elixir, https://wotlkdb.com/?spell=33738, 0.8398, 5.8571, 6.6969, 114.3
Fire Oil, https://wotlkdb.com/?spell=7837, 0.82, 1.98, 2.8, 141.4
Elixir of Greater Intellect, https://wotlkdb.com/?spell=11465, 0.8, 2.2, 3, 136.4
Dreamless Sleep Potion, https://wotlkdb.com/?spell=15833, 0.74, 3.22, 3.96, 123
Transmute: Primal Fire to Earth, https://wotlkdb.com/?spell=28568, 0.62, 0.58, 1.2, 206.9
Greater Nature Protection Potion, https://wotlkdb.com/?spell=17576, 0.6171, 8.3829, 9, 107.4
Minor Rejuvenation Potion, https://wotlkdb.com/?spell=2332, 0.5115, 0.4885, 1, 204.7
Transmute: Elemental Fire, https://wotlkdb.com/?spell=25146, 0.42, 0.31, 0.73, 235.5
Transmute: Iron to Gold, https://wotlkdb.com/?spell=11479, 0.25, 0.75, 1, 133.3
Elixir of Minor Defense, https://wotlkdb.com/?spell=7183, 0.1364, 0.008, 0.1444, 1805
Pygmy Oil, https://wotlkdb.com/?spell=53812, 0.07, 2.18, 2.25, 103.2
Elixir of Armor Piercing, https://wotlkdb.com/?spell=60365, 0, 8, 8, 100
Minor Healing Potion, https://wotlkdb.com/?spell=2330, -0.0889, 0.0925, 0.0036, 3.9
Nature Protection Potion, https://wotlkdb.com/?spell=7259, -0.12, 6.12, 6, 98
Oil of Immolation, https://wotlkdb.com/?spell=11451, -0.1294, 2.1294, 2, 93.9
Elixir of Lion's Strength, https://wotlkdb.com/?spell=2329, -0.135, 0.885, 0.75, 84.7
Minor Mana Potion, https://wotlkdb.com/?spell=2331, -0.1945, 0.2045, 0.01, 4.9
Elixir of Detect Undead, https://wotlkdb.com/?spell=11460, -0.2102, 2.2102, 2, 90.5
Guru's Elixir, https://wotlkdb.com/?spell=53848, -0.25, 8.75, 8.5, 97.1
Elixir of Greater Water Breathing, https://wotlkdb.com/?spell=22808, -0.3295, 2.3295, 2, 85.9
Healing Potion, https://wotlkdb.com/?spell=3447, -0.576, 1.566, 0.99, 63.2
Greater Healing Potion, https://wotlkdb.com/?spell=7181, -0.5928, 0.6124, 0.0196, 3.2
Heroic Potion, https://wotlkdb.com/?spell=28563, -0.7226, 27.6226, 26.9, 97.4
Earthen Elixir, https://wotlkdb.com/?spell=39637, -0.94, 6.94, 6, 86.5
Lesser Healing Potion, https://wotlkdb.com/?spell=2337, -0.9951, 1.0036, 0.0085, 0.8
Indestructible Potion, https://wotlkdb.com/?spell=53905, -1.05, 10, 8.95, 89.5
Elixir of Wisdom, https://wotlkdb.com/?spell=3171, -1.2015, 2.2015, 1, 45.4
Mighty Fire Protection Potion, https://wotlkdb.com/?spell=53939, -1.2539, 2.365, 1.1111, 47
Elixir of Greater Agility, https://wotlkdb.com/?spell=11467, -1.2579, 2.2579, 1, 44.3
Elixir of Fortitude, https://wotlkdb.com/?spell=3450, -1.268, 3.268, 2, 61.2
Crazy Alchemist's Potion, https://wotlkdb.com/?spell=53895, -1.2996, 9.9996, 8.7, 87
Mighty Arcane Protection Potion, https://wotlkdb.com/?spell=53936, -1.36, 2.36, 1, 42.4
Elixir of Accuracy, https://wotlkdb.com/?spell=60354, -1.48, 11.48, 10, 87.1
Weak Troll's Blood Elixir, https://wotlkdb.com/?spell=3170, -1.5495, 1.8495, 0.3, 16.2
Elixir of Minor Fortitude, https://wotlkdb.com/?spell=2334, -1.5638, 1.8495, 0.2857, 15.4
Elixir of Defense, https://wotlkdb.com/?spell=3177, -1.57, 7.57, 6, 79.3
Superior Healing Potion, https://wotlkdb.com/?spell=11457, -1.9084, 1.9799, 0.0715, 3.6
Sneaking Potion, https://wotlkdb.com/?spell=28546, -1.96, 6.96, 5, 71.8
Adept's Elixir, https://wotlkdb.com/?spell=33740, -2.01, 3.99, 1.98, 49.6
Mighty Frost Protection Potion, https://wotlkdb.com/?spell=53937, -2.01, 12, 9.99, 83.3
Potion of Wild Magic, https://wotlkdb.com/?spell=54222, -2.05, 52.05, 50, 96.1
Greater Holy Protection Potion, https://wotlkdb.com/?spell=17579, -2.135, 2.21, 0.075, 3.4
Elixir of Tongues, https://wotlkdb.com/?spell=2336, -2.1585, 2.161, 0.0025, 0.1
Greater Mana Potion, https://wotlkdb.com/?spell=11448, -2.1882, 2.238, 0.0498, 2.2
Elixir of Greater Defense, https://wotlkdb.com/?spell=11450, -2.288, 3.268, 0.98, 30
Flask of Mighty Restoration, https://wotlkdb.com/?spell=28588, -2.495, 12.445, 9.95, 80
Major Shadow Protection Potion, https://wotlkdb.com/?spell=28576, -2.6619, 13.32, 10.6581, 80
Elixir of Firepower, https://wotlkdb.com/?spell=7845, -2.6624, 5.6624, 3, 53
Strong Troll's Blood Elixir, https://wotlkdb.com/?spell=3176, -2.822, 3.112, 0.29, 9.3
Potion of Speed, https://wotlkdb.com/?spell=54221, -2.95, 52.85, 49.9, 94.4
Elixir of Healing Power, https://wotlkdb.com/?spell=28545, -2.96, 3.92, 0.96, 24.5
Elixir of Mighty Strength, https://wotlkdb.com/?spell=54218, -3, 8, 5, 62.5
Elixir of Detect Demon, https://wotlkdb.com/?spell=11478, -3.1, 6.1, 3, 49.2
Mageblood Elixir, https://wotlkdb.com/?spell=24365, -3.26, 3.36, 0.1, 3
Elixir of Mastery, https://wotlkdb.com/?spell=33741, -3.3363, 11.3363, 8, 70.6
Super Mana Potion, https://wotlkdb.com/?spell=28555, -3.52, 4.96, 1.44, 29
Superior Mana Potion, https://wotlkdb.com/?spell=17553, -3.5303, 3.7298, 0.1995, 5.3
Volatile Healing Potion, https://wotlkdb.com/?spell=33732, -3.8212, 3.94, 0.1188, 3
Flask of Relentless Assault, https://wotlkdb.com/?spell=28589, -3.9391, 63.9391, 60, 93.8
Mighty Rage Potion, https://wotlkdb.com/?spell=17552, -4.045, 9.025, 4.98, 55.2
Discolored Healing Potion, https://wotlkdb.com/?spell=4508, -4.087, 4.0895, 0.0025, 0.1
Greater Arcane Elixir, https://wotlkdb.com/?spell=17573, -4.0971, 6.0771, 1.98, 32.6
Spellpower Elixir, https://wotlkdb.com/?spell=53842, -4.0998, 8.9998, 4.9, 54.4
Elixir of Brute Force, https://wotlkdb.com/?spell=17557, -4.2201, 8.22, 3.9999, 48.7
Transmute: Primal Life to Earth, https://wotlkdb.com/?spell=28584, -4.2775, 5.4775, 1.2, 21.9
Wrath Elixir, https://wotlkdb.com/?spell=53841, -4.4598, 11.9598, 7.5, 62.7
Unstable Mana Potion, https://wotlkdb.com/?spell=33733, -4.46, 6.96, 2.5, 35.9
Major Healing Potion, https://wotlkdb.com/?spell=17556, -4.8681, 4.9871, 0.119, 2.4
Elixir of Major Frost Power, https://wotlkdb.com/?spell=28549, -5.15, 13.15, 8, 60.8
Mighty Troll's Blood Elixir, https://wotlkdb.com/?spell=24368, -5.195, 5.295, 0.1, 1.9
Swim Speed Potion, https://wotlkdb.com/?spell=7841, -5.252, 20.202, 14.95, 74
Mana Potion, https://wotlkdb.com/?spell=3452, -5.5129, 5.6124, 0.0995, 1.8
Lesser Mana Potion, https://wotlkdb.com/?spell=3173, -5.6915, 5.7515, 0.06, 1
Flask of Pure Death, https://wotlkdb.com/?spell=28591, -5.9182, 35.9181, 29.9999, 83.5
Icy Mana Potion, https://wotlkdb.com/?spell=53839, -5.9601, 8.96, 2.9999, 33.5
Elixir of Agility, https://wotlkdb.com/?spell=11449, -6.318, 6.818, 0.5, 7.3
Wildvine Potion, https://wotlkdb.com/?spell=11458, -6.5733, 9.5733, 3, 31.3
Transmute: Mithril to Truesilver, https://wotlkdb.com/?spell=11480, -6.653, 6.95, 0.297, 4.3
Elixir of Mighty Defense, https://wotlkdb.com/?spell=60356, -7.3333, 11.3333, 4, 35.3
Elixir of Ironskin, https://wotlkdb.com/?spell=39639, -7.78, 12.93, 5.15, 39.8
Elixir of Empowerment, https://wotlkdb.com/?spell=28578, -7.8251, 17.825, 9.9999, 56.1
Potion of Nightmares, https://wotlkdb.com/?spell=53900, -7.9598, 12.9598, 5, 38.6
Transmute: Water to Air, https://wotlkdb.com/?spell=17562, -8, 45, 37, 82.2
Elixir of Spirit, https://wotlkdb.com/?spell=53847, -8.4601, 12.44, 3.9799, 32
Resurgent Healing Potion, https://wotlkdb.com/?spell=53838, -9.3196, 9.9996, 0.68, 6.8
Elixir of Draenic Wisdom, https://wotlkdb.com/?spell=39638, -9.3964, 11.3363, 1.9399, 17.1
Elixir of Major Firepower, https://wotlkdb.com/?spell=28556, -10.8962, 11.1594, 0.2632, 2.4
Transmute: Eternal Shadow to Life, https://wotlkdb.com/?spell=53780, -11.1101, 31, 19.8899, 64.2
Fel Mana Potion, https://wotlkdb.com/?spell=38961, -11.1416, 11.6416, 0.5, 4.3
Runic Healing Potion, https://wotlkdb.com/?spell=53836, -12.0198, 13.9998, 1.98, 14.1
Elixir of Major Shadow Power, https://wotlkdb.com/?spell=28558, -12.2833, 15.2833, 3, 19.6
Major Fire Protection Potion, https://wotlkdb.com/?spell=28571, -13.005, 13.505, 0.5, 3.7
Elixir of Mighty Fortitude, https://wotlkdb.com/?spell=53898, -13.9992, 17.9992, 4, 22.2
Elixir of Superior Defense, https://wotlkdb.com/?spell=17554, -14.0099, 19.0099, 5, 26.3
Transmute: Earth to Life, https://wotlkdb.com/?spell=17566, -14.631, 15.09, 0.459, 3
Flask of Chromatic Resistance, https://wotlkdb.com/?spell=17638, -16.3213, 86.8213, 70.5, 81.2
Fel Regeneration Potion, https://wotlkdb.com/?spell=38962, -16.4999, 16.9999, 0.5, 2.9
Destruction Potion, https://wotlkdb.com/?spell=28565, -16.5166, 25.5166, 9, 35.3
Purification Potion, https://wotlkdb.com/?spell=17572, -16.5923, 22.37, 5.7777, 25.8
Major Nature Protection Potion, https://wotlkdb.com/?spell=28573, -17.9025, 18.4025, 0.5, 2.7
Major Holy Protection Potion, https://wotlkdb.com/?spell=28577, -17.9025, 18.4025, 0.5, 2.7
Greater Shadow Protection Potion, https://wotlkdb.com/?spell=17578, -18.0995, 27.0995, 9, 33.2
Super Rejuvenation Potion, https://wotlkdb.com/?spell=28586, -18.12, 19.78, 1.66, 8.4
Fel Strength Elixir, https://wotlkdb.com/?spell=38960, -18.7029, 19.0029, 0.3, 1.6
Elixir of Major Mageblood, https://wotlkdb.com/?spell=28570, -19.8, 25.8, 6, 23.3
Ironshield Potion, https://wotlkdb.com/?spell=28579, -20.4, 21.1, 0.7, 3.3
Shrouding Potion, https://wotlkdb.com/?spell=28554, -22.29, 22.79, 0.5, 2.2
Major Mana Potion, https://wotlkdb.com/?spell=17580, -22.3951, 23.22, 0.8249, 3.6
Flask of Pure Mojo, https://wotlkdb.com/?spell=54213, -24.23, 42.23, 18, 42.6
Transmute: Eternal Shadow to Earth, https://wotlkdb.com/?spell=53779, -27, 31, 4, 12.9
Transmute: Eternal Air to Water, https://wotlkdb.com/?spell=53776, -28, 37, 9, 24.3
Elixir of Water Walking, https://wotlkdb.com/?spell=62410, -29.07, 33.05, 3.98, 12
Super Healing Potion, https://wotlkdb.com/?spell=28551, -32.2, 32.7, 0.5, 1.5
Transmute: Primal Mana to Fire, https://wotlkdb.com/?spell=28582, -32.4199, 32.9999, 0.58, 1.8
Transmute: Eternal Air to Earth, https://wotlkdb.com/?spell=53777, -33, 37, 4, 10.8
Transmute: Air to Fire, https://wotlkdb.com/?spell=17559, -36.1, 37, 0.9, 2.4
Transmute: Water to Undeath, https://wotlkdb.com/?spell=17564, -36.2251, 45, 8.7749, 19.5
Elixir of Deadly Strikes, https://wotlkdb.com/?spell=60355, -36.2665, 54.5998, 18.3333, 33.6
Cauldron of Major Shadow Protection, https://wotlkdb.com/?spell=41503, -39.44, 39.515, 0.075, 0.2
Cauldron of Major Fire Protection, https://wotlkdb.com/?spell=41500, -39.81, 39.885, 0.075, 0.2
Transmute: Primal Water to Shadow, https://wotlkdb.com/?spell=28581, -40.5999, 40.9999, 0.4, 1
Elixir of Water Breathing, https://wotlkdb.com/?spell=7179, -41.552, 45.552, 4, 8.8
Major Arcane Protection Potion, https://wotlkdb.com/?spell=28575, -41.9249, 45.9249, 4, 8.7
Major Frost Protection Potion, https://wotlkdb.com/?spell=28572, -43.9249, 53.9249, 10, 18.5
Elixir of Expertise, https://wotlkdb.com/?spell=60357, -44.6498, 54.5998, 9.95, 18.2
Elixir of Mighty Mageblood, https://wotlkdb.com/?spell=56519, -46.0498, 53.7998, 7.75, 14.4
Elixir of Mighty Agility, https://wotlkdb.com/?spell=53840, -47.8496, 58.5996, 10.75, 18.3
Powerful Rejuvenation Potion, https://wotlkdb.com/?spell=53904, -48.76, 56.76, 8, 14.1
Runic Mana Potion, https://wotlkdb.com/?spell=53837, -49.2998, 53.7998, 4.5, 8.4
Cauldron of Major Nature Protection, https://wotlkdb.com/?spell=41502, -49.605, 49.68, 0.075, 0.2
Flask of Fortification, https://wotlkdb.com/?spell=28587, -63.235, 68.235, 5, 7.3
Transmute: Primal Air to Fire, https://wotlkdb.com/?spell=28566, -64.7449, 65.3249, 0.58, 0.9
Transmute: Eternal Fire to Life, https://wotlkdb.com/?spell=53775, -70.1101, 90, 19.8899, 22.1
Flask of the Frost Wyrm, https://wotlkdb.com/?spell=53901, -76.98, 146.98, 70, 47.6
Flask of Stoneblood, https://wotlkdb.com/?spell=53902, -79.7799, 178.7799, 99, 55.4
Transmute: Eternal Fire to Water, https://wotlkdb.com/?spell=53774, -81, 90, 9, 10
Indestructible Alchemist Stone, https://wotlkdb.com/?spell=60403, -81.0293, 89.08, 8.0507, 9
Flask of Endless Rage, https://wotlkdb.com/?spell=53903, -93.7795, 186.7794, 92.9999, 49.8
Flask of Blinding Light, https://wotlkdb.com/?spell=28590, -94.535, 109.535, 15, 13.7
Cauldron of Major Arcane Protection, https://wotlkdb.com/?spell=41458, -104.6498, 104.7248, 0.075, 0.1
Mercurial Alchemist Stone, https://wotlkdb.com/?spell=60396, -114.2051, 122.2558, 8.0507, 6.6
Cauldron of Major Frost Protection, https://wotlkdb.com/?spell=41501, -120.6498, 120.7248, 0.075, 0.1
Transmute: Eternal Might, https://wotlkdb.com/?spell=54020, -138.4, 140, 1.6, 1.1
Mighty Alchemist Stone, https://wotlkdb.com/?spell=60405, -403.9293, 411.98, 8.0507, 2
