Name, Link, Profit, Cost, Sell, ROI %
Mercurial Stone, https://wotlkdb.com/?spell=38070, 218.495, 39.46, 257.955, 653.7
Flask of the Titans, https://wotlkdb.com/?spell=17635, 197.82, 20.93, 218.75, 1045.2
Transmute: Majestic Zircon, https://wotlkdb.com/?spell=66663, 98.2, 43.8, 142, 324.2
Shadow Oil, https://wotlkdb.com/?spell=3449, 92.7799, 7.22, 99.9999, 1385
Transmute: King's Amber, https://wotlkdb.com/?spell=66660, 86.9167, 133.0833, 220, 165.3
Transmute: Ametrine, https://wotlkdb.com/?spell=66658, 86.3001, 113.8999, 200.2, 175.8
Transmute: Eternal Water to Fire, https://wotlkdb.com/?spell=53784, 82.1375, 10, 92.1375, 921.4
Limited Invulnerability Potion, https://wotlkdb.com/?spell=3175, 80.79, 4.21, 85, 2019
Living Action Potion, https://wotlkdb.com/?spell=24367, 77.1834, 26.8166, 104, 387.8
Transmute: Eternal Life to Fire, https://wotlkdb.com/?spell=53773, 73.8042, 18.3333, 92.1375, 502.6
Transmute: Dreadstone, https://wotlkdb.com/?spell=66662, 73.0201, 38.9799, 112, 287.3
Transmute: Eye of Zul, https://wotlkdb.com/?spell=66664, 66.1354, 13.8645, 79.9999, 577
Potion of Petrification, https://wotlkdb.com/?spell=17634, 52.75, 7.25, 60, 827.6
Greater Nature Protection Potion, https://wotlkdb.com/?spell=17576, 44.87, 11.03, 55.9, 506.8
Insane Strength Potion, https://wotlkdb.com/?spell=28550, 44.45, 25.55, 70, 274
Transmute: Primal Might, https://wotlkdb.com/?spell=29688, 41.2601, 108.7399, 150, 137.9
Elixir of Major Agility, https://wotlkdb.com/?spell=28553, 38.7249, 11.275, 49.9999, 443.5
Fire Protection Potion, https://wotlkdb.com/?spell=7257, 36.8467, 13.1533, 50, 380.1
Ghost Dye, https://wotlkdb.com/?spell=11473, 36.54, 3.46, 40, 1156.1
Transmute: Primal Fire to Mana, https://wotlkdb.com/?spell=28583, 34.15, 0.75, 34.9, 4653.3
Flask of Distilled Wisdom, https://wotlkdb.com/?spell=17636, 30.1467, 36.52, 66.6667, 182.5
Transmute: Eternal Earth to Air, https://wotlkdb.com/?spell=53781, 30.1, 4.9, 35, 714.3
Transmute: Eternal Earth to Shadow, https://wotlkdb.com/?spell=53782, 29.0999, 4.9, 33.9999, 693.9
Invisibility Potion, https://wotlkdb.com/?spell=11464, 27.255, 2.745, 30, 1092.9
Flask of Supreme Power, https://wotlkdb.com/?spell=17637, 25.3301, 19.6699, 45, 228.8
Transmute: Eternal Water to Air, https://wotlkdb.com/?spell=53783, 25, 10, 35, 350
Transmute: Primal Shadow to Water, https://wotlkdb.com/?spell=28580, 24.9299, 0.56, 25.4899, 4551.8
Transmute: Skyflare Diamond, https://wotlkdb.com/?spell=57425, 23.395, 48.605, 72, 148.1
Transmute: Primal Earth to Water, https://wotlkdb.com/?spell=28567, 22.8899, 2.6, 25.4899, 980.4
Transmute: Skyfire Diamond, https://wotlkdb.com/?spell=32766, 21.6225, 108.1275, 129.75, 120
Major Dreamless Sleep Potion, https://wotlkdb.com/?spell=28562, 20.9, 4, 24.9, 622.5
Blackmouth Oil, https://wotlkdb.com/?spell=7836, 20.6999, 9.2, 29.8999, 325
Transmute: Life to Earth, https://wotlkdb.com/?spell=17565, 20.4345, 0.4655, 20.9, 4489.8
Transmute: Earthstorm Diamond, https://wotlkdb.com/?spell=32765, 20.1333, 78.8667, 99, 125.5
Transmute: Fire to Earth, https://wotlkdb.com/?spell=17560, 20.05, 0.85, 20.9, 2458.8
Transmute: Primal Water to Air, https://wotlkdb.com/?spell=28569, 19.5101, 25.4899, 45, 176.5
Transmute: Earthsiege Diamond, https://wotlkdb.com/?spell=57427, 16.8475, 99.5275, 116.375, 116.9
Elixir of Major Defense, https://wotlkdb.com/?spell=28557, 15.7103, 17.2897, 33, 190.9
Transmute: Eternal Life to Shadow, https://wotlkdb.com/?spell=53771, 15.6666, 18.3333, 33.9999, 185.5
Elixir of Lesser Agility, https://wotlkdb.com/?spell=2333, 15.51, 1.51, 17.02, 1127.2
Elixir of Superior Defense, https://wotlkdb.com/?spell=17554, 15.0683, 3.265, 18.3333, 561.5
Transmute: Arcanite, https://wotlkdb.com/?spell=17187, 13.35, 82.65, 96, 116.2
Transmute: Titanium, https://wotlkdb.com/?spell=60350, 13.16, 39.84, 53, 133
Greater Stoneshield Potion, https://wotlkdb.com/?spell=17570, 10.75, 9.25, 20, 216.2
Elixir of Giant Growth, https://wotlkdb.com/?spell=8240, 10.3513, 3.6487, 14, 383.7
Transmute: Cardinal Ruby, https://wotlkdb.com/?spell=66659, 9.8625, 215.1375, 225, 104.6
Transmute: Water to Air, https://wotlkdb.com/?spell=17562, 8.45, 10, 18.45, 184.5
Greater Frost Protection Potion, https://wotlkdb.com/?spell=17575, 8.038, 1.962, 10, 509.7
Fire Oil, https://wotlkdb.com/?spell=7837, 6.4333, 2.9, 9.3333, 321.8
Mighty Shadow Protection Potion, https://wotlkdb.com/?spell=53938, 5.775, 4.22, 9.995, 236.8
Elixir of Major Mageblood, https://wotlkdb.com/?spell=28570, 5.4201, 16.4799, 21.9, 132.9
Elixir of Major Firepower, https://wotlkdb.com/?spell=28556, 5.2211, 4.7289, 9.95, 210.4
Transmute: Undeath to Water, https://wotlkdb.com/?spell=17563, 5.16, 4.84, 10, 206.6
Elixir of Empowerment, https://wotlkdb.com/?spell=28578, 5.01, 14.99, 20, 133.4
Lesser Flask of Resistance, https://wotlkdb.com/?spell=62213, 4.93, 20.32, 25.25, 124.3
Greater Arcane Protection Potion, https://wotlkdb.com/?spell=17577, 4.4914, 1.0642, 5.5556, 522
Elixir of Protection, https://wotlkdb.com/?spell=54220, 4.35, 10.4, 14.75, 141.8
Major Troll's Blood Elixir, https://wotlkdb.com/?spell=3451, 3.95, 1.05, 5, 476.2
Flask of Pure Death, https://wotlkdb.com/?spell=28591, 3.93, 15.07, 19, 126.1
Shadow Protection Potion, https://wotlkdb.com/?spell=7256, 3.65, 1.35, 5, 370.4
Potion of Wild Magic, https://wotlkdb.com/?spell=54222, 3.6137, 47.3863, 51, 107.6
Minor Magic Resistance Potion, https://wotlkdb.com/?spell=3172, 3.528, 2.472, 6, 242.7
Destruction Potion, https://wotlkdb.com/?spell=28565, 3.3, 16.7, 20, 119.8
Elixir of Lightning Speed, https://wotlkdb.com/?spell=60366, 3.2233, 5.11, 8.3333, 163.1
Mighty Arcane Protection Potion, https://wotlkdb.com/?spell=53936, 2.2, 2.8, 5, 178.6
Transmute: Primal Fire to Earth, https://wotlkdb.com/?spell=28568, 1.85, 0.75, 2.6, 346.7
Adept's Elixir, https://wotlkdb.com/?spell=33740, 1.4875, 3.4925, 4.98, 142.6
Earthen Elixir, https://wotlkdb.com/?spell=39637, 1.35, 4.65, 6, 129
Elixir of Camouflage, https://wotlkdb.com/?spell=28543, 1.2875, 3.7125, 5, 134.7
Rage Potion, https://wotlkdb.com/?spell=6617, 1.19, 0.01, 1.2, 12000
Elixir of Minor Defense, https://wotlkdb.com/?spell=7183, 0.998, 0.502, 1.5, 298.8
Elixir of Minor Agility, https://wotlkdb.com/?spell=3230, 0.9247, 0.742, 1.6667, 224.6
Ethereal Oil, https://wotlkdb.com/?spell=62409, 0.7778, 2.2222, 3, 135
Elixir of Lion's Strength, https://wotlkdb.com/?spell=2329, 0.7479, 0.9187, 1.6666, 181.4
Transmute: Primal Life to Earth, https://wotlkdb.com/?spell=28584, 0.64, 1.96, 2.6, 132.7
Swiftness Potion, https://wotlkdb.com/?spell=2335, 0.598, 4.452, 5.05, 113.4
Stonescale Oil, https://wotlkdb.com/?spell=17551, 0.52, 0.48, 1, 208.3
Holy Protection Potion, https://wotlkdb.com/?spell=7255, 0.468, 0.882, 1.35, 153.1
Transmute: Iron to Gold, https://wotlkdb.com/?spell=11479, 0.3864, 0.685, 1.0714, 156.4
Transmute: Elemental Fire, https://wotlkdb.com/?spell=25146, 0.375, 0.325, 0.7, 215.4
Mad Alchemist's Potion, https://wotlkdb.com/?spell=45061, 0.325, 2.25, 2.575, 114.4
Haste Potion, https://wotlkdb.com/?spell=28564, 0.3, 29.7, 30, 101
Elixir of Major Fortitude, https://wotlkdb.com/?spell=39636, 0.2875, 4.7125, 5, 106.1
Lesser Invisibility Potion, https://wotlkdb.com/?spell=3448, 0.12, 1.88, 2, 106.4
Elixir of Giants, https://wotlkdb.com/?spell=11472, 0.025, 3.225, 3.25, 100.8
Mighty Fire Protection Potion, https://wotlkdb.com/?spell=53939, 0.02, 2.98, 3, 100.7
Major Rejuvenation Potion, https://wotlkdb.com/?spell=22732, -0.02, 10.02, 10, 99.8
Elixir of Ogre's Strength, https://wotlkdb.com/?spell=3188, -0.0767, 1.0767, 1, 92.9
Discolored Healing Potion, https://wotlkdb.com/?spell=4508, -0.1735, 0.181, 0.0075, 4.1
Minor Healing Potion, https://wotlkdb.com/?spell=2330, -0.3579, 0.401, 0.0431, 10.7
Potion of Curing, https://wotlkdb.com/?spell=3174, -0.438, 0.4415, 0.0035, 0.8
Pygmy Oil, https://wotlkdb.com/?spell=53812, -0.4937, 2.98, 2.4863, 83.4
Transmute: Primal Earth to Life, https://wotlkdb.com/?spell=28585, -0.64, 2.6, 1.96, 75.4
Elixir of Minor Fortitude, https://wotlkdb.com/?spell=2334, -0.6944, 1.4844, 0.79, 53.2
Sneaking Potion, https://wotlkdb.com/?spell=28546, -0.7125, 4.7125, 4, 84.9
Minor Mana Potion, https://wotlkdb.com/?spell=2331, -0.7279, 0.742, 0.0141, 1.9
Elixir of the Searching Eye, https://wotlkdb.com/?spell=28552, -0.7389, 11.85, 11.1111, 93.8
Minor Rejuvenation Potion, https://wotlkdb.com/?spell=2332, -0.781, 1.131, 0.35, 30.9
Elixir of Armor Piercing, https://wotlkdb.com/?spell=60365, -0.8, 8.8, 8, 90.9
Great Rage Potion, https://wotlkdb.com/?spell=6618, -0.91, 3.41, 2.5, 73.3
Mighty Rage Potion, https://wotlkdb.com/?spell=17527, -0.91, 3.41, 2.5, 73.3
Greater Healing Potion, https://wotlkdb.com/?spell=7181, -1.0369, 1.05, 0.0131, 1.2
Elixir of Detect Undead, https://wotlkdb.com/?spell=11460, -1.09, 1.24, 0.15, 12.1
Mighty Rage Potion, https://wotlkdb.com/?spell=17552, -1.13, 6.13, 5, 81.6
Greater Holy Protection Potion, https://wotlkdb.com/?spell=17579, -1.355, 1.43, 0.075, 5.2
Elixir of Detect Lesser Invisibility, https://wotlkdb.com/?spell=3453, -1.38, 1.88, 0.5, 26.6
Weak Troll's Blood Elixir, https://wotlkdb.com/?spell=3170, -1.4544, 1.4844, 0.03, 2
Guru's Elixir, https://wotlkdb.com/?spell=53848, -1.459, 9.4589, 7.9999, 84.6
Dreamless Sleep Potion, https://wotlkdb.com/?spell=15833, -1.544, 6.304, 4.76, 75.5
Greater Fire Protection Potion, https://wotlkdb.com/?spell=17574, -1.655, 1.73, 0.075, 4.3
Fel Mana Potion, https://wotlkdb.com/?spell=38961, -1.69, 5.69, 4, 70.3
Elixir of Frost Power, https://wotlkdb.com/?spell=21923, -1.9721, 1.9756, 0.0035, 0.2
Elixir of Greater Water Breathing, https://wotlkdb.com/?spell=22808, -1.9727, 4.3426, 2.3699, 54.6
Frost Oil, https://wotlkdb.com/?spell=3454, -1.9756, 4.9756, 3, 60.3
Elixir of Greater Intellect, https://wotlkdb.com/?spell=11465, -1.99, 2.49, 0.5, 20.1
Elixir of Major Frost Power, https://wotlkdb.com/?spell=28549, -1.9997, 6.9997, 5, 71.4
Mighty Nature Protection Potion, https://wotlkdb.com/?spell=53942, -2, 4, 2, 50
Oil of Immolation, https://wotlkdb.com/?spell=11451, -2.1958, 5.1958, 3, 57.7
Superior Healing Potion, https://wotlkdb.com/?spell=11457, -2.2271, 2.265, 0.0379, 1.7
Magic Resistance Potion, https://wotlkdb.com/?spell=11453, -2.228, 3.268, 1.04, 31.8
Wildvine Potion, https://wotlkdb.com/?spell=11458, -2.268, 4.268, 2, 46.9
Elixir of Tongues, https://wotlkdb.com/?spell=2336, -2.3129, 2.3154, 0.0025, 0.1
Lesser Flask of Toughness, https://wotlkdb.com/?spell=53899, -2.3899, 14.2899, 11.9, 83.3
Catseye Elixir, https://wotlkdb.com/?spell=12609, -2.4425, 4.88, 2.4375, 49.9
Elixir of Accuracy, https://wotlkdb.com/?spell=60354, -2.4468, 12.78, 10.3332, 80.9
Elixir of Mastery, https://wotlkdb.com/?spell=33741, -2.5425, 10.5625, 8.02, 75.9
Greater Dreamless Sleep Potion, https://wotlkdb.com/?spell=24366, -2.685, 2.785, 0.1, 3.6
Elixir of Healing Power, https://wotlkdb.com/?spell=28545, -2.689, 3.625, 0.936, 25.8
Elixir of Minor Accuracy, https://wotlkdb.com/?spell=63732, -2.7253, 9.7253, 7, 72
Elixir of Demonslaying, https://wotlkdb.com/?spell=11477, -3.09, 3.69, 0.6, 16.3
Indestructible Potion, https://wotlkdb.com/?spell=53905, -3.1, 10, 6.9, 69
Super Mana Potion, https://wotlkdb.com/?spell=28555, -3.1239, 4.0125, 0.8886, 22.1
Elixir of Mighty Defense, https://wotlkdb.com/?spell=60356, -3.16, 11.11, 7.95, 71.6
Elixir of Shadow Power, https://wotlkdb.com/?spell=11476, -3.25, 4.69, 1.44, 30.7
Elixir of Defense, https://wotlkdb.com/?spell=3177, -3.3057, 5.3057, 2, 37.7
Healing Potion, https://wotlkdb.com/?spell=3447, -3.395, 4.37, 0.975, 22.3
Elixir of Spirit, https://wotlkdb.com/?spell=53847, -3.43, 13.94, 10.51, 75.4
Volatile Healing Potion, https://wotlkdb.com/?spell=33732, -3.473, 3.6875, 0.2145, 5.8
Arcane Elixir, https://wotlkdb.com/?spell=11461, -3.49, 5.49, 2, 36.4
Elixir of Major Strength, https://wotlkdb.com/?spell=28544, -3.5458, 6.0458, 2.5, 41.4
Elixir of Greater Agility, https://wotlkdb.com/?spell=11467, -3.615, 5.265, 1.65, 31.3
Transmute: Mithril to Truesilver, https://wotlkdb.com/?spell=11480, -3.6401, 4.05, 0.4099, 10.1
Purification Potion, https://wotlkdb.com/?spell=17572, -3.755, 25.755, 22, 85.4
Elixir of Detect Demon, https://wotlkdb.com/?spell=11478, -3.92, 4.17, 0.25, 6
Nature Protection Potion, https://wotlkdb.com/?spell=7259, -3.9557, 4.9457, 0.99, 20
Lesser Healing Potion, https://wotlkdb.com/?spell=2337, -4.0004, 4.0031, 0.0027, 0.1
Elixir of Fortitude, https://wotlkdb.com/?spell=3450, -4.02, 5.02, 1, 19.9
Mana Potion, https://wotlkdb.com/?spell=3452, -4.2457, 4.6957, 0.45, 9.6
Unstable Mana Potion, https://wotlkdb.com/?spell=33733, -4.2925, 4.7125, 0.42, 8.9
Lesser Mana Potion, https://wotlkdb.com/?spell=3173, -4.2977, 4.7777, 0.48, 10
Frost Protection Potion, https://wotlkdb.com/?spell=7258, -4.4678, 4.4978, 0.03, 0.7
Elixir of Dream Vision, https://wotlkdb.com/?spell=11468, -4.4707, 6.304, 1.8333, 29.1
Superior Mana Potion, https://wotlkdb.com/?spell=17553, -4.5605, 4.76, 0.1995, 4.2
Onslaught Elixir, https://wotlkdb.com/?spell=33738, -4.699, 6.0458, 1.3468, 22.3
Elixir of Greater Defense, https://wotlkdb.com/?spell=11450, -4.7762, 5.02, 0.2438, 4.9
Greater Mana Potion, https://wotlkdb.com/?spell=11448, -4.935, 5.02, 0.085, 1.7
Icy Mana Potion, https://wotlkdb.com/?spell=53839, -5.01, 9.96, 4.95, 49.7
Greater Arcane Elixir, https://wotlkdb.com/?spell=17573, -5.0361, 5.9233, 0.8872, 15
Transmute: Water to Undeath, https://wotlkdb.com/?spell=17564, -5.16, 10, 4.84, 48.4
Elixir of Major Shadow Power, https://wotlkdb.com/?spell=28558, -5.2299, 5.8299, 0.6, 10.3
Elixir of Ironskin, https://wotlkdb.com/?spell=39639, -5.322, 5.4799, 0.1579, 2.9
Major Healing Potion, https://wotlkdb.com/?spell=17556, -5.4298, 5.5333, 0.1035, 1.9
Crazy Alchemist's Potion, https://wotlkdb.com/?spell=53895, -5.5799, 10.5798, 4.9999, 47.3
Lesser Stoneshield Potion, https://wotlkdb.com/?spell=4942, -5.82, 6.02, 0.2, 3.3
Elixir of Water Walking, https://wotlkdb.com/?spell=62410, -6.02, 11, 4.98, 45.3
Wrath Elixir, https://wotlkdb.com/?spell=53841, -6.4899, 10.2899, 3.8, 36.9
Elixir of the Mongoose, https://wotlkdb.com/?spell=17571, -6.5216, 14.5216, 8, 55.1
Elixir of Mighty Strength, https://wotlkdb.com/?spell=54218, -6.55, 8.8, 2.25, 25.6
Strong Troll's Blood Elixir, https://wotlkdb.com/?spell=3176, -6.71, 8.72, 2.01, 23.1
Elixir of Brute Force, https://wotlkdb.com/?spell=17557, -6.775, 11.775, 5, 42.5
Ironshield Potion, https://wotlkdb.com/?spell=28579, -6.8598, 7.5598, 0.7, 9.3
Fel Regeneration Potion, https://wotlkdb.com/?spell=38962, -6.975, 7.475, 0.5, 6.7
Elixir of Mighty Thoughts, https://wotlkdb.com/?spell=60367, -6.98, 9.98, 3, 30.1
Flask of Mighty Restoration, https://wotlkdb.com/?spell=28588, -7.17, 10.17, 3, 29.5
Elixir of Agility, https://wotlkdb.com/?spell=11449, -7.3057, 8.3057, 1, 12
Elixir of the Sages, https://wotlkdb.com/?spell=17555, -7.635, 8.635, 1, 11.6
Elixir of Wisdom, https://wotlkdb.com/?spell=3171, -7.912, 8.412, 0.5, 5.9
Spellpower Elixir, https://wotlkdb.com/?spell=53842, -8.1899, 9.6899, 1.5, 15.5
Mageblood Elixir, https://wotlkdb.com/?spell=24365, -8.535, 8.635, 0.1, 1.2
Elixir of Draenic Wisdom, https://wotlkdb.com/?spell=39638, -8.8958, 10.5625, 1.6667, 15.8
Mighty Troll's Blood Elixir, https://wotlkdb.com/?spell=24368, -9.715, 9.815, 0.1, 1
Resurgent Healing Potion, https://wotlkdb.com/?spell=53838, -10.0798, 10.5798, 0.5, 4.7
Mighty Frost Protection Potion, https://wotlkdb.com/?spell=53937, -10.4125, 17.5554, 7.1429, 40.7
Flask of Relentless Assault, https://wotlkdb.com/?spell=28589, -10.57, 60.57, 50, 82.5
Restorative Potion, https://wotlkdb.com/?spell=11452, -10.75, 14.25, 3.5, 24.6
Transmute: Earth to Water, https://wotlkdb.com/?spell=17561, -10.9, 20.9, 10, 47.8
Fel Strength Elixir, https://wotlkdb.com/?spell=38960, -12.25, 12.55, 0.3, 2.4
Major Shadow Protection Potion, https://wotlkdb.com/?spell=28576, -12.77, 13.53, 0.76, 5.6
Potion of Nightmares, https://wotlkdb.com/?spell=53900, -13.1399, 14.2499, 1.11, 7.8
Major Fire Protection Potion, https://wotlkdb.com/?spell=28571, -13.22, 13.72, 0.5, 3.6
Runic Healing Potion, https://wotlkdb.com/?spell=53836, -13.3099, 14.2899, 0.98, 6.9
Potion of Speed, https://wotlkdb.com/?spell=54221, -14.0061, 63.8861, 49.88, 78.1
Major Nature Protection Potion, https://wotlkdb.com/?spell=28573, -14.43, 14.93, 0.5, 3.3
Major Holy Protection Potion, https://wotlkdb.com/?spell=28577, -14.43, 14.93, 0.5, 3.3
Transmute: Eternal Shadow to Life, https://wotlkdb.com/?spell=53780, -15.6666, 33.9999, 18.3333, 53.9
Super Rejuvenation Potion, https://wotlkdb.com/?spell=28586, -15.8931, 16.63, 0.7369, 4.4
Elixir of Mighty Fortitude, https://wotlkdb.com/?spell=53898, -16.1996, 19.1596, 2.96, 15.4
Shrouding Potion, https://wotlkdb.com/?spell=28554, -16.5, 17, 0.5, 2.9
Heroic Potion, https://wotlkdb.com/?spell=28563, -17.1799, 20.1799, 3, 14.9
Transmute: Air to Fire, https://wotlkdb.com/?spell=17559, -17.6, 18.45, 0.85, 4.6
Flask of Fortification, https://wotlkdb.com/?spell=28587, -17.9793, 22.9793, 5, 21.8
Flask of Pure Mojo, https://wotlkdb.com/?spell=54213, -18.4389, 42.4389, 24, 56.6
Major Frost Protection Potion, https://wotlkdb.com/?spell=28572, -18.4599, 38.4599, 20, 52
Elixir of Firepower, https://wotlkdb.com/?spell=7845, -18.7099, 19.0766, 0.3667, 1.9
Elixir of Mighty Mageblood, https://wotlkdb.com/?spell=56519, -19.1899, 49.1899, 30, 61
Major Mana Potion, https://wotlkdb.com/?spell=17580, -20.14, 20.49, 0.35, 1.7
Elixir of Greater Firepower, https://wotlkdb.com/?spell=26277, -20.4206, 31.0873, 10.6667, 34.3
Transmute: Earth to Life, https://wotlkdb.com/?spell=17566, -20.4345, 20.9, 0.4655, 2.2
Cauldron of Major Shadow Protection, https://wotlkdb.com/?spell=41503, -20.775, 20.85, 0.075, 0.4
Cauldron of Major Fire Protection, https://wotlkdb.com/?spell=41500, -21.155, 21.23, 0.075, 0.4
Elixir of Expertise, https://wotlkdb.com/?spell=60357, -21.6897, 65.6897, 44, 67
Cauldron of Major Nature Protection, https://wotlkdb.com/?spell=41502, -23.575, 23.65, 0.075, 0.3
Transmute: Primal Water to Shadow, https://wotlkdb.com/?spell=28581, -24.9299, 25.4899, 0.56, 2.2
Transmute: Eternal Air to Water, https://wotlkdb.com/?spell=53776, -25, 35, 10, 28.6
Super Healing Potion, https://wotlkdb.com/?spell=28551, -26.2125, 26.7125, 0.5, 1.9
Swim Speed Potion, https://wotlkdb.com/?spell=7841, -27.432, 30.3919, 2.9599, 9.7
Transmute: Eternal Shadow to Earth, https://wotlkdb.com/?spell=53779, -29.0999, 33.9999, 4.9, 14.4
Transmute: Eternal Air to Earth, https://wotlkdb.com/?spell=53777, -30.1, 35, 4.9, 14
Elixir of Deadly Strikes, https://wotlkdb.com/?spell=60355, -30.5623, 65.6897, 35.1274, 53.5
Free Action Potion, https://wotlkdb.com/?spell=6624, -34.1055, 64.1055, 30, 46.8
Transmute: Primal Mana to Fire, https://wotlkdb.com/?spell=28582, -34.15, 34.9, 0.75, 2.1
Runic Mana Potion, https://wotlkdb.com/?spell=53837, -37.2899, 49.1899, 11.9, 24.2
Flask of Chromatic Wonder, https://wotlkdb.com/?spell=42736, -43.075, 43.2, 0.125, 0.3
Transmute: Primal Air to Fire, https://wotlkdb.com/?spell=28566, -44.25, 45, 0.75, 1.7
Major Arcane Protection Potion, https://wotlkdb.com/?spell=28575, -47.11, 47.87, 0.76, 1.6
Powerful Rejuvenation Potion, https://wotlkdb.com/?spell=53904, -51.86, 52.86, 1, 1.9
Flask of the Frost Wyrm, https://wotlkdb.com/?spell=53901, -54.855, 134.23, 79.375, 59.1
Elixir of Mighty Agility, https://wotlkdb.com/?spell=53840, -59.7296, 69.9796, 10.25, 14.6
Elixir of Water Breathing, https://wotlkdb.com/?spell=7179, -61.6125, 64.0875, 2.475, 3.9
Indestructible Alchemist Stone, https://wotlkdb.com/?spell=60403, -63.7649, 71.8156, 8.0507, 11.2
Cauldron of Major Frost Protection, https://wotlkdb.com/?spell=41501, -70.6348, 70.7098, 0.075, 0.1
Flask of Stoneblood, https://wotlkdb.com/?spell=53902, -70.96, 160.46, 89.5, 55.8
Transmute: Eternal Fire to Life, https://wotlkdb.com/?spell=53775, -73.8042, 92.1375, 18.3333, 19.9
Flask of Chromatic Resistance, https://wotlkdb.com/?spell=17638, -76.7349, 76.8599, 0.125, 0.2
Flask of Blinding Light, https://wotlkdb.com/?spell=28590, -79.6201, 89.62, 9.9999, 11.2
Flask of Endless Rage, https://wotlkdb.com/?spell=53903, -79.9997, 169.9997, 90, 52.9
Transmute: Eternal Fire to Water, https://wotlkdb.com/?spell=53774, -82.1375, 92.1375, 10, 10.9
Cauldron of Major Arcane Protection, https://wotlkdb.com/?spell=41458, -89.455, 89.53, 0.075, 0.1
Greater Shadow Protection Potion, https://wotlkdb.com/?spell=17578, -100.9549, 101.0299, 0.075, 0.1
Mercurial Alchemist Stone, https://wotlkdb.com/?spell=60396, -116.3939, 124.4446, 8.0507, 6.5
Transmute: Eternal Might, https://wotlkdb.com/?spell=54020, -140.4375, 142.0375, 1.6, 1.1
Mighty Alchemist Stone, https://wotlkdb.com/?spell=60405, -490.4278, 498.4785, 8.0507, 1.6
