Name, Link, Profit, Cost, Sell, ROI %
Transmute: Skyfire Diamond, https://wotlkdb.com/?spell=32766, 381.1402, 117.8598, 499, 423.4
Mercurial Stone, https://wotlkdb.com/?spell=38070, 130.1568, 42.8332, 172.99, 403.9
Greater Shadow Protection Potion, https://wotlkdb.com/?spell=17578, 127.2695, 27.0805, 154.35, 570
Transmute: Ametrine, https://wotlkdb.com/?spell=66658, 110.6, 87.4, 198, 226.5
Transmute: Majestic Zircon, https://wotlkdb.com/?spell=66663, 109.5, 40.25, 149.75, 372
Transmute: King's Amber, https://wotlkdb.com/?spell=66660, 88.81, 112.99, 201.8, 178.6
Transmute: Eternal Water to Fire, https://wotlkdb.com/?spell=53784, 72, 8, 80, 1000
Transmute: Dreadstone, https://wotlkdb.com/?spell=66662, 66.5, 33.4, 99.9, 299.1
Transmute: Eternal Life to Fire, https://wotlkdb.com/?spell=53773, 65.01, 14.99, 80, 533.7
Living Action Potion, https://wotlkdb.com/?spell=24367, 64.4362, 38.5638, 103, 267.1
Elixir of Greater Firepower, https://wotlkdb.com/?spell=26277, 59.85, 7.75, 67.6, 872.3
Limited Invulnerability Potion, https://wotlkdb.com/?spell=3175, 59.01, 6.99, 66, 944.2
Transmute: Eye of Zul, https://wotlkdb.com/?spell=66664, 57.06, 11.94, 69, 577.9
Elixir of Major Defense, https://wotlkdb.com/?spell=28557, 56.25, 21.75, 78, 358.6
Transmute: Primal Shadow to Water, https://wotlkdb.com/?spell=28580, 52.28, 0.76, 53.04, 6978.9
Transmute: Primal Earth to Water, https://wotlkdb.com/?spell=28567, 50.04, 3, 53.04, 1768
Flask of Supreme Power, https://wotlkdb.com/?spell=17637, 47.1152, 27.8848, 75, 269
Frost Protection Potion, https://wotlkdb.com/?spell=7258, 40.75, 2.05, 42.8, 2087.8
Transmute: Earthsiege Diamond, https://wotlkdb.com/?spell=57427, 35.77, 87.73, 123.5, 140.8
Greater Fire Protection Potion, https://wotlkdb.com/?spell=17574, 33.5695, 2.4305, 36, 1481.2
Flask of Distilled Wisdom, https://wotlkdb.com/?spell=17636, 32.6868, 56.2132, 88.9, 158.1
Transmute: Primal Fire to Mana, https://wotlkdb.com/?spell=28583, 32.5633, 0.77, 33.3333, 4329
Elixir of the Searching Eye, https://wotlkdb.com/?spell=28552, 31.99, 9.71, 41.7, 429.5
Transmute: Cardinal Ruby, https://wotlkdb.com/?spell=66659, 30.5, 197, 227.5, 115.5
Greater Arcane Protection Potion, https://wotlkdb.com/?spell=17577, 29.7997, 2.2003, 32, 1454.3
Insane Strength Potion, https://wotlkdb.com/?spell=28550, 29.13, 16.25, 45.38, 279.3
Transmute: Eternal Earth to Air, https://wotlkdb.com/?spell=53781, 27.66, 4.64, 32.3, 696.1
Transmute: Primal Might, https://wotlkdb.com/?spell=29688, 27.5568, 140.1432, 167.7, 119.7
Greater Dreamless Sleep Potion, https://wotlkdb.com/?spell=24366, 25.3864, 4.6135, 29.9999, 650.3
Transmute: Eternal Water to Air, https://wotlkdb.com/?spell=53783, 24.3, 8, 32.3, 403.8
Greater Frost Protection Potion, https://wotlkdb.com/?spell=17575, 23.8395, 4.1605, 28, 673
Transmute: Skyflare Diamond, https://wotlkdb.com/?spell=57425, 22.82, 49.18, 72, 146.4
Transmute: Undeath to Water, https://wotlkdb.com/?spell=17563, 22.0786, 8.9214, 31, 347.5
Transmute: Eternal Earth to Shadow, https://wotlkdb.com/?spell=53782, 20.76, 4.64, 25.4, 547.4
Transmute: Arcanite, https://wotlkdb.com/?spell=17187, 20.03, 79.96, 99.99, 125.1
Ghost Dye, https://wotlkdb.com/?spell=11473, 18.62, 6.38, 25, 391.8
Holy Protection Potion, https://wotlkdb.com/?spell=7255, 18.523, 1.277, 19.8, 1550.5
Shadow Oil, https://wotlkdb.com/?spell=3449, 17.6908, 7.2092, 24.9, 345.4
Lesser Flask of Resistance, https://wotlkdb.com/?spell=62213, 17.6144, 12.2856, 29.9, 243.4
Destruction Potion, https://wotlkdb.com/?spell=28565, 17.55, 17.45, 35, 200.6
Flask of Pure Death, https://wotlkdb.com/?spell=28591, 16.9099, 13.09, 29.9999, 229.2
Transmute: Earth to Water, https://wotlkdb.com/?spell=17561, 15.91, 15.09, 31, 205.4
Frost Oil, https://wotlkdb.com/?spell=3454, 14.5016, 4.68, 19.1816, 409.9
Transmute: Life to Earth, https://wotlkdb.com/?spell=17565, 14.5, 0.59, 15.09, 2557.6
Invisibility Potion, https://wotlkdb.com/?spell=11464, 14.241, 4.18, 18.421, 440.7
Transmute: Fire to Earth, https://wotlkdb.com/?spell=17560, 14.1, 0.99, 15.09, 1524.2
Mighty Nature Protection Potion, https://wotlkdb.com/?spell=53942, 12.75, 6, 18.75, 312.5
Great Rage Potion, https://wotlkdb.com/?spell=6618, 12.175, 3.43, 15.605, 455
Mighty Rage Potion, https://wotlkdb.com/?spell=17527, 12.175, 3.43, 15.605, 455
Transmute: Titanium, https://wotlkdb.com/?spell=60350, 11.93, 40.8, 52.73, 129.2
Elixir of Dream Vision, https://wotlkdb.com/?spell=11468, 11.8503, 3.2497, 15.1, 464.7
Major Dreamless Sleep Potion, https://wotlkdb.com/?spell=28562, 11.5, 3.99, 15.49, 388.2
Elixir of Giant Growth, https://wotlkdb.com/?spell=8240, 11.0955, 3.9045, 15, 384.2
Stonescale Oil, https://wotlkdb.com/?spell=17551, 11.0191, 0.8125, 11.8316, 1456.2
Transmute: Eternal Life to Shadow, https://wotlkdb.com/?spell=53771, 10.41, 14.99, 25.4, 169.4
Heroic Potion, https://wotlkdb.com/?spell=28563, 10.4, 16.5, 26.9, 163
Elixir of Camouflage, https://wotlkdb.com/?spell=28543, 10.28, 4.72, 15, 317.8
Elixir of Defense, https://wotlkdb.com/?spell=3177, 10.23, 7.77, 18, 231.7
Elixir of Giants, https://wotlkdb.com/?spell=11472, 10.08, 3.92, 14, 357.1
Potion of Curing, https://wotlkdb.com/?spell=3174, 9.8501, 1.4499, 11.3, 779.4
Shadow Protection Potion, https://wotlkdb.com/?spell=7256, 9.8427, 1.3573, 11.2, 825.2
Haste Potion, https://wotlkdb.com/?spell=28564, 9.55, 24.95, 34.5, 138.3
Flask of the Titans, https://wotlkdb.com/?spell=17635, 8.9152, 60.0548, 68.97, 114.8
Elixir of Major Fortitude, https://wotlkdb.com/?spell=39636, 8.8, 6.2, 15, 241.9
Magic Resistance Potion, https://wotlkdb.com/?spell=11453, 8.0501, 1.9499, 10, 512.8
Fire Protection Potion, https://wotlkdb.com/?spell=7257, 7.98, 12.02, 20, 166.4
Flask of Mighty Restoration, https://wotlkdb.com/?spell=28588, 7.68, 13.02, 20.7, 159
Swiftness Potion, https://wotlkdb.com/?spell=2335, 7.5429, 2.457, 9.9999, 407
Elixir of Demonslaying, https://wotlkdb.com/?spell=11477, 7.28, 5.87, 13.15, 224
Flask of Chromatic Wonder, https://wotlkdb.com/?spell=42736, 7.23, 49.77, 57, 114.5
Elixir of Minor Agility, https://wotlkdb.com/?spell=3230, 6.69, 0.31, 7, 2258.1
Potion of Wild Magic, https://wotlkdb.com/?spell=54222, 6, 43.9, 49.9, 113.7
Elixir of Major Agility, https://wotlkdb.com/?spell=28553, 5.77, 9.23, 15, 162.5
Elixir of Protection, https://wotlkdb.com/?spell=54220, 5.7543, 8.2457, 14, 169.8
Major Troll's Blood Elixir, https://wotlkdb.com/?spell=3451, 5.51, 1.49, 7, 469.8
Elixir of Lesser Agility, https://wotlkdb.com/?spell=2333, 5.3694, 3.075, 8.4444, 274.6
Free Action Potion, https://wotlkdb.com/?spell=6624, 4.48, 45.02, 49.5, 110
Elixir of Frost Power, https://wotlkdb.com/?spell=21923, 4.42, 2.58, 7, 271.3
Catseye Elixir, https://wotlkdb.com/?spell=12609, 4.3519, 1.99, 6.3419, 318.7
Minor Magic Resistance Potion, https://wotlkdb.com/?spell=3172, 4.308, 5.692, 10, 175.7
Rage Potion, https://wotlkdb.com/?spell=6617, 4.113, 0.662, 4.775, 721.3
Elixir of Major Strength, https://wotlkdb.com/?spell=28544, 3.8029, 6.0971, 9.9, 162.4
Transmute: Primal Earth to Life, https://wotlkdb.com/?spell=28585, 3.4999, 3, 6.4999, 216.7
Elixir of Detect Lesser Invisibility, https://wotlkdb.com/?spell=3453, 3.37, 1.59, 4.96, 311.9
Elixir of Minor Accuracy, https://wotlkdb.com/?spell=63732, 3.228, 2.972, 6.2, 208.6
Oil of Immolation, https://wotlkdb.com/?spell=11451, 3.13, 1.85, 4.98, 269.2
Elixir of Greater Water Breathing, https://wotlkdb.com/?spell=22808, 2.7027, 2.2773, 4.98, 218.7
Greater Nature Protection Potion, https://wotlkdb.com/?spell=17576, 2.3695, 17.6305, 20, 113.4
Ethereal Oil, https://wotlkdb.com/?spell=62409, 2.31, 7.54, 9.85, 130.6
Transmute: Primal Fire to Earth, https://wotlkdb.com/?spell=28568, 2.23, 0.77, 3, 389.6
Blackmouth Oil, https://wotlkdb.com/?spell=7836, 2.1, 17.9, 20, 111.7
Mighty Shadow Protection Potion, https://wotlkdb.com/?spell=53938, 1.9155, 3.64, 5.5555, 152.6
Elixir of Lightning Speed, https://wotlkdb.com/?spell=60366, 1.7993, 6.0507, 7.85, 129.7
Elixir of Armor Piercing, https://wotlkdb.com/?spell=60365, 1.759, 7.74, 9.499, 122.7
Lesser Flask of Toughness, https://wotlkdb.com/?spell=53899, 1.5072, 18.7928, 20.3, 108
Guru's Elixir, https://wotlkdb.com/?spell=53848, 1.05, 7.7, 8.75, 113.6
Elixir of the Mongoose, https://wotlkdb.com/?spell=17571, 1.036, 8.964, 10, 111.6
Fire Oil, https://wotlkdb.com/?spell=7837, 1, 1, 2, 200
Elixir of Minor Defense, https://wotlkdb.com/?spell=7183, 0.962, 0.008, 0.97, 12125
Lesser Invisibility Potion, https://wotlkdb.com/?spell=3448, 0.84, 3.64, 4.48, 123.1
Dreamless Sleep Potion, https://wotlkdb.com/?spell=15833, 0.743, 3.2497, 3.9927, 122.9
Mighty Rage Potion, https://wotlkdb.com/?spell=17552, 0.7, 8.29, 8.99, 108.4
Flask of Relentless Assault, https://wotlkdb.com/?spell=28589, 0.56, 39.34, 39.9, 101.4
Elixir of Mighty Thoughts, https://wotlkdb.com/?spell=60367, 0.4886, 11.4614, 11.95, 104.3
Elixir of Ogre's Strength, https://wotlkdb.com/?spell=3188, 0.3925, 0.92, 1.3125, 142.7
Elixir of Detect Undead, https://wotlkdb.com/?spell=11460, 0.29, 1.71, 2, 117
Potion of Speed, https://wotlkdb.com/?spell=54221, 0.1, 49.9, 50, 100.2
Elixir of Greater Intellect, https://wotlkdb.com/?spell=11465, 0.07, 2.85, 2.92, 102.5
Earthen Elixir, https://wotlkdb.com/?spell=39637, 0.05, 5.95, 6, 100.8
Indestructible Potion, https://wotlkdb.com/?spell=53905, 0.0399, 7.96, 7.9999, 100.5
Pygmy Oil, https://wotlkdb.com/?spell=53812, -0.04, 1.94, 1.9, 97.9
Lesser Stoneshield Potion, https://wotlkdb.com/?spell=4942, -0.15, 6.1, 5.95, 97.5
Minor Healing Potion, https://wotlkdb.com/?spell=2330, -0.23, 0.245, 0.015, 6.1
Transmute: Iron to Gold, https://wotlkdb.com/?spell=11479, -0.26, 1, 0.74, 74
Transmute: Elemental Fire, https://wotlkdb.com/?spell=25146, -0.27, 0.52, 0.25, 48.1
Elixir of Lion's Strength, https://wotlkdb.com/?spell=2329, -0.345, 0.495, 0.15, 30.3
Major Rejuvenation Potion, https://wotlkdb.com/?spell=22732, -0.7319, 15.7319, 15, 95.3
Transmute: Earthstorm Diamond, https://wotlkdb.com/?spell=32765, -0.9, 151.65, 150.75, 99.4
Greater Healing Potion, https://wotlkdb.com/?spell=7181, -0.9151, 0.93, 0.0149, 1.6
Weak Troll's Blood Elixir, https://wotlkdb.com/?spell=3170, -0.922, 1.222, 0.3, 24.5
Elixir of Minor Fortitude, https://wotlkdb.com/?spell=2334, -0.9363, 1.222, 0.2857, 23.4
Minor Mana Potion, https://wotlkdb.com/?spell=2331, -0.9749, 0.985, 0.0101, 1
Transmute: Water to Air, https://wotlkdb.com/?spell=17562, -1, 31, 30, 96.8
Elixir of Major Frost Power, https://wotlkdb.com/?spell=28549, -1.2, 9.2, 8, 87
Minor Rejuvenation Potion, https://wotlkdb.com/?spell=2332, -1.202, 2.202, 1, 45.4
Adept's Elixir, https://wotlkdb.com/?spell=33740, -1.2105, 5.1705, 3.96, 76.6
Elixir of Greater Agility, https://wotlkdb.com/?spell=11467, -1.34, 2.34, 1, 42.7
Elixir of Firepower, https://wotlkdb.com/?spell=7845, -1.43, 4.43, 3, 67.7
Mighty Arcane Protection Potion, https://wotlkdb.com/?spell=53936, -1.5714, 2.5714, 1, 38.9
Elixir of Healing Power, https://wotlkdb.com/?spell=28545, -1.5717, 3.4925, 1.9208, 55
Greater Mana Potion, https://wotlkdb.com/?spell=11448, -1.703, 1.82, 0.117, 6.4
Restorative Potion, https://wotlkdb.com/?spell=11452, -1.8, 16.8, 15, 89.3
Sneaking Potion, https://wotlkdb.com/?spell=28546, -1.82, 6.2, 4.38, 70.6
Superior Healing Potion, https://wotlkdb.com/?spell=11457, -1.8255, 1.94, 0.1145, 5.9
Arcane Elixir, https://wotlkdb.com/?spell=11461, -1.84, 3.25, 1.41, 43.4
Elixir of Fortitude, https://wotlkdb.com/?spell=3450, -1.87, 3.87, 2, 51.7
Mighty Fire Protection Potion, https://wotlkdb.com/?spell=53939, -1.8889, 3, 1.1111, 37
Elixir of Mighty Defense, https://wotlkdb.com/?spell=60356, -1.99, 8.78, 6.79, 77.3
Mighty Frost Protection Potion, https://wotlkdb.com/?spell=53937, -2.01, 12, 9.99, 83.3
Elixir of Spirit, https://wotlkdb.com/?spell=53847, -2.05, 11, 8.95, 81.4
Mad Alchemist's Potion, https://wotlkdb.com/?spell=45061, -2.15, 3.21, 1.06, 33
Lesser Healing Potion, https://wotlkdb.com/?spell=2337, -2.155, 2.165, 0.01, 0.5
Healing Potion, https://wotlkdb.com/?spell=3447, -2.2, 3.14, 0.94, 29.9
Elixir of Mighty Strength, https://wotlkdb.com/?spell=54218, -2.74, 7.74, 5, 64.6
Potion of Nightmares, https://wotlkdb.com/?spell=53900, -2.77, 11.87, 9.1, 76.7
Elixir of Detect Demon, https://wotlkdb.com/?spell=11478, -2.85, 5.61, 2.76, 49.2
Elixir of Greater Defense, https://wotlkdb.com/?spell=11450, -2.89, 3.87, 0.98, 25.3
Elixir of Tongues, https://wotlkdb.com/?spell=2336, -2.9395, 2.942, 0.0025, 0.1
Transmute: Primal Water to Air, https://wotlkdb.com/?spell=28569, -3.0401, 53.04, 49.9999, 94.3
Greater Holy Protection Potion, https://wotlkdb.com/?spell=17579, -3.1054, 3.1804, 0.075, 2.4
Elixir of Mastery, https://wotlkdb.com/?spell=33741, -3.13, 7.99, 4.86, 60.8
Elixir of Accuracy, https://wotlkdb.com/?spell=60354, -3.24, 10.74, 7.5, 69.8
Unstable Mana Potion, https://wotlkdb.com/?spell=33733, -3.3, 6.2, 2.9, 46.8
Elixir of Ironskin, https://wotlkdb.com/?spell=39639, -3.33, 8.48, 5.15, 60.7
Onslaught Elixir, https://wotlkdb.com/?spell=33738, -3.4158, 6.0971, 2.6813, 44
Transmute: Primal Life to Earth, https://wotlkdb.com/?spell=28584, -3.4999, 6.4999, 3, 46.2
Volatile Healing Potion, https://wotlkdb.com/?spell=33732, -3.633, 3.7425, 0.1095, 2.9
Major Healing Potion, https://wotlkdb.com/?spell=17556, -3.9806, 4.1121, 0.1315, 3.2
Potion of Petrification, https://wotlkdb.com/?spell=17634, -4.0912, 83.0712, 78.98, 95.1
Super Mana Potion, https://wotlkdb.com/?spell=28555, -4.095, 5.22, 1.125, 21.6
Elixir of Agility, https://wotlkdb.com/?spell=11449, -4.1895, 6.12, 1.9305, 31.5
Discolored Healing Potion, https://wotlkdb.com/?spell=4508, -4.2395, 4.242, 0.0025, 0.1
Elixir of Wisdom, https://wotlkdb.com/?spell=3171, -4.282, 5.282, 1, 18.9
Elixir of Brute Force, https://wotlkdb.com/?spell=17557, -4.6099, 8.6098, 3.9999, 46.5
Fel Mana Potion, https://wotlkdb.com/?spell=38961, -4.7, 5.2, 0.5, 9.6
Crazy Alchemist's Potion, https://wotlkdb.com/?spell=53895, -4.74, 9.74, 5, 51.3
Elixir of the Sages, https://wotlkdb.com/?spell=17555, -4.8103, 5.1803, 0.37, 7.1
Elixir of Major Mageblood, https://wotlkdb.com/?spell=28570, -4.875, 20.45, 15.575, 76.2
Elixir of Major Shadow Power, https://wotlkdb.com/?spell=28558, -5, 8, 3, 37.5
Icy Mana Potion, https://wotlkdb.com/?spell=53839, -5, 8, 3, 37.5
Spellpower Elixir, https://wotlkdb.com/?spell=53842, -5.0612, 8.74, 3.6788, 42.1
Mageblood Elixir, https://wotlkdb.com/?spell=24365, -5.0803, 5.1803, 0.1, 1.9
Mana Potion, https://wotlkdb.com/?spell=3452, -5.33, 5.43, 0.1, 1.8
Nature Protection Potion, https://wotlkdb.com/?spell=7259, -5.49, 5.52, 0.03, 0.5
Elixir of Draenic Wisdom, https://wotlkdb.com/?spell=39638, -5.6617, 7.99, 2.3283, 29.1
Superior Mana Potion, https://wotlkdb.com/?spell=17553, -5.73, 6.03, 0.3, 5
Lesser Mana Potion, https://wotlkdb.com/?spell=3173, -5.752, 5.982, 0.23, 3.8
Mighty Troll's Blood Elixir, https://wotlkdb.com/?spell=24368, -5.8298, 5.9298, 0.1, 1.7
Strong Troll's Blood Elixir, https://wotlkdb.com/?spell=3176, -6.04, 6.26, 0.22, 3.5
Wrath Elixir, https://wotlkdb.com/?spell=53841, -6.3315, 12.3314, 5.9999, 48.7
Elixir of Empowerment, https://wotlkdb.com/?spell=28578, -6.6501, 16.65, 9.9999, 60.1
Fel Regeneration Potion, https://wotlkdb.com/?spell=38962, -6.98, 7.48, 0.5, 6.7
Elixir of Major Firepower, https://wotlkdb.com/?spell=28556, -7.1118, 7.375, 0.2632, 3.6
Elixir of Shadow Power, https://wotlkdb.com/?spell=11476, -7.8595, 9.07, 1.2105, 13.3
Transmute: Mithril to Truesilver, https://wotlkdb.com/?spell=11480, -8.19, 8.94, 0.75, 8.4
Fel Strength Elixir, https://wotlkdb.com/?spell=38960, -8.45, 8.75, 0.3, 3.4
Wildvine Potion, https://wotlkdb.com/?spell=11458, -8.5832, 9.5832, 1, 10.4
Greater Arcane Elixir, https://wotlkdb.com/?spell=17573, -8.6736, 8.8986, 0.225, 2.5
Resurgent Healing Potion, https://wotlkdb.com/?spell=53838, -9.06, 9.74, 0.68, 7
Transmute: Eternal Shadow to Life, https://wotlkdb.com/?spell=53780, -10.41, 25.4, 14.99, 59
Runic Healing Potion, https://wotlkdb.com/?spell=53836, -10.87, 11.83, 0.96, 8.1
Major Shadow Protection Potion, https://wotlkdb.com/?spell=28576, -11.36, 14.36, 3, 20.9
Flask of Pure Mojo, https://wotlkdb.com/?spell=54213, -11.76, 32.76, 21, 64.1
Swim Speed Potion, https://wotlkdb.com/?spell=7841, -12.287, 20.307, 8.02, 39.5
Elixir of Mighty Fortitude, https://wotlkdb.com/?spell=53898, -13.48, 17.48, 4, 22.9
Ironshield Potion, https://wotlkdb.com/?spell=28579, -13.5197, 14.2197, 0.7, 4.9
Major Fire Protection Potion, https://wotlkdb.com/?spell=28571, -13.87, 14.37, 0.5, 3.5
Transmute: Earth to Life, https://wotlkdb.com/?spell=17566, -14.5, 15.09, 0.59, 3.9
Elixir of Superior Defense, https://wotlkdb.com/?spell=17554, -14.9033, 24.9032, 9.9999, 40.2
Super Rejuvenation Potion, https://wotlkdb.com/?spell=28586, -16.8401, 18.84, 1.9999, 10.6
Shrouding Potion, https://wotlkdb.com/?spell=28554, -19.39, 19.89, 0.5, 2.5
Major Nature Protection Potion, https://wotlkdb.com/?spell=28573, -19.5999, 20.0999, 0.5, 2.5
Major Holy Protection Potion, https://wotlkdb.com/?spell=28577, -19.5999, 20.0999, 0.5, 2.5
Transmute: Eternal Shadow to Earth, https://wotlkdb.com/?spell=53779, -20.76, 25.4, 4.64, 18.3
Greater Stoneshield Potion, https://wotlkdb.com/?spell=17570, -21.8632, 31.8632, 10, 31.4
Purification Potion, https://wotlkdb.com/?spell=17572, -22.0719, 27.8496, 5.7777, 20.7
Transmute: Water to Undeath, https://wotlkdb.com/?spell=17564, -22.0786, 31, 8.9214, 28.8
Transmute: Eternal Air to Water, https://wotlkdb.com/?spell=53776, -24.3, 32.3, 8, 24.8
Elixir of Water Walking, https://wotlkdb.com/?spell=62410, -25.75, 31.55, 5.8, 18.4
Transmute: Eternal Air to Earth, https://wotlkdb.com/?spell=53777, -27.66, 32.3, 4.64, 14.4
Transmute: Air to Fire, https://wotlkdb.com/?spell=17559, -29.01, 30, 0.99, 3.3
Super Healing Potion, https://wotlkdb.com/?spell=28551, -29.64, 30.14, 0.5, 1.7
Cauldron of Major Shadow Protection, https://wotlkdb.com/?spell=41503, -29.835, 29.91, 0.075, 0.3
Cauldron of Major Fire Protection, https://wotlkdb.com/?spell=41500, -29.855, 29.93, 0.075, 0.3
Major Mana Potion, https://wotlkdb.com/?spell=17580, -29.9013, 30.6413, 0.74, 2.4
Flask of Chromatic Resistance, https://wotlkdb.com/?spell=17638, -29.9706, 100.4706, 70.5, 70.2
Flask of Fortification, https://wotlkdb.com/?spell=28587, -30.19, 41.09, 10.9, 26.5
Transmute: Primal Mana to Fire, https://wotlkdb.com/?spell=28582, -32.5633, 33.3333, 0.77, 2.3
Elixir of Deadly Strikes, https://wotlkdb.com/?spell=60355, -33.5367, 51.87, 18.3333, 35.3
Elixir of Mighty Mageblood, https://wotlkdb.com/?spell=56519, -38.8701, 45.87, 6.9999, 15.3
Powerful Rejuvenation Potion, https://wotlkdb.com/?spell=53904, -40, 48, 8, 16.7
Elixir of Expertise, https://wotlkdb.com/?spell=60357, -40.02, 51.87, 11.85, 22.8
Runic Mana Potion, https://wotlkdb.com/?spell=53837, -40.87, 45.87, 5, 10.9
Cauldron of Major Nature Protection, https://wotlkdb.com/?spell=41502, -41.3148, 41.3898, 0.075, 0.2
Elixir of Water Breathing, https://wotlkdb.com/?spell=7179, -42.002, 45.002, 3, 6.7
Major Arcane Protection Potion, https://wotlkdb.com/?spell=28575, -43.9333, 46.9333, 3, 6.4
Elixir of Mighty Agility, https://wotlkdb.com/?spell=53840, -45.74, 55.74, 10, 17.9
Transmute: Primal Air to Fire, https://wotlkdb.com/?spell=28566, -49.2299, 49.9999, 0.77, 1.5
Flask of the Frost Wyrm, https://wotlkdb.com/?spell=53901, -51.1, 121.1, 70, 57.8
Transmute: Primal Water to Shadow, https://wotlkdb.com/?spell=28581, -52.28, 53.04, 0.76, 1.4
Major Frost Protection Potion, https://wotlkdb.com/?spell=28572, -56.64, 66.64, 10, 15
Flask of Stoneblood, https://wotlkdb.com/?spell=53902, -58.66, 148.66, 90, 60.5
Transmute: Eternal Fire to Life, https://wotlkdb.com/?spell=53775, -65.01, 80, 14.99, 18.7
Flask of Endless Rage, https://wotlkdb.com/?spell=53903, -65.81, 157.81, 92, 58.3
Transmute: Eternal Fire to Water, https://wotlkdb.com/?spell=53774, -72, 80, 8, 10
Indestructible Alchemist Stone, https://wotlkdb.com/?spell=60403, -80.5633, 88.614, 8.0507, 9.1
Flask of Blinding Light, https://wotlkdb.com/?spell=28590, -85.24, 100.24, 15, 15
Cauldron of Major Arcane Protection, https://wotlkdb.com/?spell=41458, -94.9816, 95.0566, 0.075, 0.1
Mercurial Alchemist Stone, https://wotlkdb.com/?spell=60396, -100.5293, 108.58, 8.0507, 7.4
Transmute: Eternal Might, https://wotlkdb.com/?spell=54020, -123.34, 124.94, 1.6, 1.3
Cauldron of Major Frost Protection, https://wotlkdb.com/?spell=41501, -134.395, 134.47, 0.075, 0.1
Mighty Alchemist Stone, https://wotlkdb.com/?spell=60405, -381.1993, 389.25, 8.0507, 2.1
