Name, Link, Profit, Cost, Sell, ROI %
Fel Edged Battleaxe, https://wotlkdb.com/?spell=29694, 76445.9774, 3554.0226, 80000, 2251
Helm of the Great Chief, https://wotlkdb.com/?spell=16728, 9352.0006, 647.9994, 10000, 1543.2
Hand of Eternity, https://wotlkdb.com/?spell=29700, 8757.9548, 3242.0452, 12000, 370.1
Sageblade, https://wotlkdb.com/?spell=27832, 7866.4, 1433.6, 9300, 648.7
Sulfuron Hammer, https://wotlkdb.com/?spell=21161, 5275.65, 7624.35, 12900, 169.2
Dark Iron Mail, https://wotlkdb.com/?spell=15293, 3909.7002, 90.2998, 4000, 4429.7
Oathkeeper's Helm, https://wotlkdb.com/?spell=29668, 3898.4887, 1100.5113, 4999, 454.2
Steelgrip Gauntlets, https://wotlkdb.com/?spell=29662, 3554.4887, 1445.5113, 5000, 345.9
Belt of the Guardian, https://wotlkdb.com/?spell=36389, 3229.5, 770, 3999.5, 519.4
Arcanite Reaper, https://wotlkdb.com/?spell=16994, 2963.6, 2036.4, 5000, 245.5
Frostguard, https://wotlkdb.com/?spell=16992, 2824.4008, 2575.5992, 5400, 209.7
Dark Iron Helm, https://wotlkdb.com/?spell=23636, 2461.04, 38.96, 2500, 6416.8
Indestructible Plate Girdle, https://wotlkdb.com/?spell=63191, 2266, 3980, 6246, 156.9
Belt of the Titans, https://wotlkdb.com/?spell=63187, 2257, 3980, 6237, 156.7
Nightfall, https://wotlkdb.com/?spell=23653, 2250.62, 1304.38, 3555, 272.5
Dark Iron Reaver, https://wotlkdb.com/?spell=20890, 2028.9, 193.1, 2222, 1150.7
Treads of Destiny, https://wotlkdb.com/?spell=63190, 2020, 3980, 6000, 150.8
Spiked Deathdealers, https://wotlkdb.com/?spell=63192, 2020, 3980, 6000, 150.8
Dark Iron Gauntlets, https://wotlkdb.com/?spell=23637, 1949.54, 50.46, 2000, 3963.5
Dark Iron Shoulders, https://wotlkdb.com/?spell=15295, 1945.9001, 54.0999, 2000, 3696.9
Annihilator, https://wotlkdb.com/?spell=16991, 1936, 2064, 4000, 193.8
Puresteel Legplates, https://wotlkdb.com/?spell=70562, 1860, 9220, 11080, 120.2
Black Dragonscale Breastplate, https://wotlkdb.com/?spell=19085, 1847.2401, 127.7599, 1975, 1545.9
Dark Iron Destroyer, https://wotlkdb.com/?spell=20897, 1791.4, 208.6, 2000, 958.8
Protectors of Life, https://wotlkdb.com/?spell=70563, 1776, 5477, 7253, 132.4
Blazing Rapier, https://wotlkdb.com/?spell=16978, 1766.8204, 163.6796, 1930.5, 1179.4
Whitesoul Helm, https://wotlkdb.com/?spell=16724, 1719.56, 280.44, 2000, 713.2
Red Belt of Battle, https://wotlkdb.com/?spell=36390, 1682.1, 317.4, 1999.5, 630
Battlelord's Plate Boots, https://wotlkdb.com/?spell=63188, 1519, 3980, 5499, 138.2
Legplates of Painful Death, https://wotlkdb.com/?spell=70565, 1473, 9022, 10495, 116.3
Helm of the Stalwart Defender, https://wotlkdb.com/?spell=29664, 1471.4887, 1027.5113, 2499, 243.2
Shadesteel Bracers, https://wotlkdb.com/?spell=40034, 1429.4401, 70.5599, 1500, 2125.9
Shadesteel Sabots, https://wotlkdb.com/?spell=40033, 1424.6401, 75.3599, 1500, 1990.4
Titanium Spikeguards, https://wotlkdb.com/?spell=67133, 1403.3601, 4095.6399, 5499, 134.3
Felsteel Longblade, https://wotlkdb.com/?spell=29692, 1383.9774, 3216.0226, 4600, 143
Shadesteel Greaves, https://wotlkdb.com/?spell=40035, 1364.3201, 135.6799, 1500, 1105.5
Enchanted Adamantite Belt, https://wotlkdb.com/?spell=29608, 1316.1, 183.9, 1500, 815.7
Pillars of Might, https://wotlkdb.com/?spell=70567, 1293.9999, 8504, 9797.9999, 115.2
Enchanted Adamantite Boots, https://wotlkdb.com/?spell=29611, 1244.0998, 255.9, 1499.9998, 586.2
Boots of Kingly Upheaval, https://wotlkdb.com/?spell=70568, 1241, 5477, 6718, 122.7
Enchanted Adamantite Breastplate, https://wotlkdb.com/?spell=29610, 1116.1999, 383.8, 1499.9999, 390.8
Flamebane Breastplate, https://wotlkdb.com/?spell=29617, 1106.79, 393.96, 1500.75, 380.9
Enchanted Adamantite Leggings, https://wotlkdb.com/?spell=29613, 1100.1999, 399.8, 1499.9999, 375.2
Breastplate of the White Knight, https://wotlkdb.com/?spell=67091, 1098.7195, 6506.28, 7604.9995, 116.9
Titanium Razorplate, https://wotlkdb.com/?spell=67093, 1091.72, 5585.28, 6677, 119.5
Hellfrozen Bonegrinders, https://wotlkdb.com/?spell=70566, 986.0005, 6013.9994, 6999.9999, 116.4
Truesilver Gauntlets, https://wotlkdb.com/?spell=9954, 919.1776, 80.6624, 999.84, 1239.5
Shadesteel Girdle, https://wotlkdb.com/?spell=40036, 897.8801, 103.1199, 1001, 970.7
Dazzling Mithril Rapier, https://wotlkdb.com/?spell=10005, 881.0197, 94.9803, 976, 1027.6
Saronite Swordbreakers, https://wotlkdb.com/?spell=67092, 833.3099, 3822.64, 4655.9499, 121.8
Sunforged Breastplate, https://wotlkdb.com/?spell=67095, 793.72, 5805.28, 6599, 113.7
Titansteel Spellblade, https://wotlkdb.com/?spell=63182, 743.68, 2151.32, 2895, 134.6
Phantom Blade, https://wotlkdb.com/?spell=10007, 705.2216, 215.7784, 921, 426.8
Titansteel Bonecrusher, https://wotlkdb.com/?spell=55370, 700.2, 2178.8, 2879, 132.1
Titansteel Guardian, https://wotlkdb.com/?spell=55371, 615.2, 2178.8, 2794, 128.2
Dark Iron Pulverizer, https://wotlkdb.com/?spell=15292, 614.3004, 162.6996, 777, 477.6
Dark Iron Sunderer, https://wotlkdb.com/?spell=15294, 555.7004, 234.2996, 790, 337.2
Icebane Chestguard, https://wotlkdb.com/?spell=61008, 493.7002, 486.2997, 979.9999, 201.5
Spiked Titansteel Helm, https://wotlkdb.com/?spell=55372, 471.8, 1424.2, 1896, 133.1
Titansteel Destroyer, https://wotlkdb.com/?spell=55369, 447.6, 2848.4, 3296, 115.7
Ornate Mithril Gloves, https://wotlkdb.com/?spell=9950, 434.7753, 65.2247, 500, 766.6
Ornate Mithril Pants, https://wotlkdb.com/?spell=9945, 422.6419, 77.3581, 500, 646.3
Felsteel Helm, https://wotlkdb.com/?spell=29621, 420.8, 479.2, 900, 187.8
Ornate Mithril Shoulder, https://wotlkdb.com/?spell=9952, 416.6296, 83.3704, 500, 599.7
Ornate Mithril Boots, https://wotlkdb.com/?spell=9979, 403.2785, 96.7215, 500, 516.9
Titansteel Shield Wall, https://wotlkdb.com/?spell=56400, 402.8, 1096.2, 1499, 136.7
Ornate Mithril Helm, https://wotlkdb.com/?spell=9980, 396.5651, 103.4349, 500, 483.4
Ornate Mithril Breastplate, https://wotlkdb.com/?spell=9972, 394.2052, 105.7948, 500, 472.6
Heavy Copper Longsword, https://wotlkdb.com/?spell=43549, 383.9499, 16.05, 399.9999, 2492.2
Titansteel Shanker, https://wotlkdb.com/?spell=56234, 370.2, 2178.8, 2549, 117
Imperial Plate Boots, https://wotlkdb.com/?spell=16657, 364.7404, 126, 490.7404, 389.5
Heavy Mithril Shoulder, https://wotlkdb.com/?spell=9926, 337.4936, 62.5064, 400, 639.9
Adamantite Plate Gloves, https://wotlkdb.com/?spell=29605, 333.2962, 65.7038, 399, 607.3
Icebane Girdle, https://wotlkdb.com/?spell=61009, 310.4001, 361.5998, 671.9999, 185.8
Titanium Spikeguards, https://wotlkdb.com/?spell=67094, 304.36, 4095.6399, 4399.9999, 107.4
Searing Golden Blade, https://wotlkdb.com/?spell=15973, 301.3824, 45.6176, 347, 760.7
Savage Cobalt Slicer, https://wotlkdb.com/?spell=55177, 292.1191, 62.8808, 354.9999, 564.6
Imperial Plate Helm, https://wotlkdb.com/?spell=16658, 288.925, 136.075, 425, 312.3
Imperial Plate Shoulders, https://wotlkdb.com/?spell=16646, 286.1, 93.9, 380, 404.7
Titanium Plating, https://wotlkdb.com/?spell=62202, 268.4, 331.6, 600, 180.9
Imperial Plate Chest, https://wotlkdb.com/?spell=16663, 240, 140, 380, 271.4
Vengeance Bindings, https://wotlkdb.com/?spell=55298, 239.8999, 169.1, 408.9999, 241.9
Icebane Treads, https://wotlkdb.com/?spell=61010, 238.4002, 361.5998, 600, 165.9
Saronite Protector, https://wotlkdb.com/?spell=55013, 222.7394, 33.2606, 256, 769.7
Imperial Plate Leggings, https://wotlkdb.com/?spell=16730, 212, 168, 380, 226.2
Saronite Ambusher, https://wotlkdb.com/?spell=55179, 208.5783, 41.1717, 249.75, 606.6
Saronite Spellblade, https://wotlkdb.com/?spell=59442, 205.75, 116, 321.75, 277.4
Cudgel of Saronite Justice, https://wotlkdb.com/?spell=56280, 190.9723, 103.7776, 294.7499, 284
Repair the Blade of Heroes, https://wotlkdb.com/?spell=11923, 159.6799, 20.32, 179.9999, 885.8
Saronite Defender, https://wotlkdb.com/?spell=54557, 145.7394, 33.2606, 179, 538.2
Stronghold Gauntlets, https://wotlkdb.com/?spell=16741, 138.0008, 1861.9992, 2000, 107.4
Savage Saronite Waistguard, https://wotlkdb.com/?spell=55307, 135.1099, 91.5999, 226.7098, 247.5
Savage Saronite Gauntlets, https://wotlkdb.com/?spell=55309, 129.8999, 169.1, 298.9999, 176.8
Shining Silver Breastplate, https://wotlkdb.com/?spell=2675, 129.6512, 60.0988, 189.75, 315.7
Truesilver Breastplate, https://wotlkdb.com/?spell=9974, 126.9942, 123.0058, 250, 203.2
Saronite Bulwark, https://wotlkdb.com/?spell=55014, 125.5499, 95.2, 220.7499, 231.9
Savage Saronite Bracers, https://wotlkdb.com/?spell=55305, 118.5908, 121.4, 239.9908, 197.7
Moonsteel Broadsword, https://wotlkdb.com/?spell=3496, 111.7854, 38.2146, 150, 392.5
Savage Saronite Walkers, https://wotlkdb.com/?spell=55308, 111.7749, 111.5, 223.2749, 200.2
Savage Saronite Legplates, https://wotlkdb.com/?spell=55310, 110.9908, 135, 245.9908, 182.2
Ornate Saronite Gauntlets, https://wotlkdb.com/?spell=56553, 107.9, 169.1, 277, 163.8
Adamantite Breastplate, https://wotlkdb.com/?spell=29606, 107.74, 82.76, 190.5, 230.2
Heavy Mithril Helm, https://wotlkdb.com/?spell=9970, 107.4462, 91.5538, 199, 217.4
Savage Saronite Pauldrons, https://wotlkdb.com/?spell=55306, 102.425, 91.5999, 194.0249, 211.8
Ornate Saronite Bracers, https://wotlkdb.com/?spell=56549, 97.6, 121.4, 219, 180.4
Righteous Greaves, https://wotlkdb.com/?spell=55304, 93.7901, 105.1999, 198.99, 189.2
Pearl-handled Dagger, https://wotlkdb.com/?spell=6517, 88.74, 10.26, 99, 964.9
Spiked Cobalt Helm, https://wotlkdb.com/?spell=54917, 84.0507, 7.0707, 91.1214, 1288.7
Tempered Saronite Legplates, https://wotlkdb.com/?spell=54554, 80.8863, 39.1137, 120, 306.8
Cobalt Legplates, https://wotlkdb.com/?spell=52567, 79.9495, 5.0505, 85, 1683
Brilliant Saronite Gauntlets, https://wotlkdb.com/?spell=55056, 77.5697, 57.4303, 135, 235.1
Tempered Titansteel Helm, https://wotlkdb.com/?spell=55373, 75.8, 1424.2, 1500, 105.3
Brilliant Titansteel Helm, https://wotlkdb.com/?spell=55374, 75.7999, 1424.2, 1499.9999, 105.3
Titanium Weapon Chain, https://wotlkdb.com/?spell=55839, 73.4, 66.6, 140, 210.2
Eternium Rod, https://wotlkdb.com/?spell=32657, 73, 24, 97, 404.2
Arcanite Rod, https://wotlkdb.com/?spell=20201, 70.15, 287.6, 357.75, 124.4
Heavy Mithril Pants, https://wotlkdb.com/?spell=9933, 69.033, 63.967, 133, 207.9
Brilliant Saronite Pauldrons, https://wotlkdb.com/?spell=59440, 67.4, 81.6, 149, 182.6
Furious Saronite Beatstick, https://wotlkdb.com/?spell=55182, 66.6234, 102.1264, 168.7498, 165.2
Steel Weapon Chain, https://wotlkdb.com/?spell=7224, 60.4448, 39.5552, 100, 252.8
Spiked Cobalt Belt, https://wotlkdb.com/?spell=54946, 57.8788, 12.1212, 70, 577.5
Adamantite Plate Bracers, https://wotlkdb.com/?spell=29603, 56.88, 43.12, 100, 231.9
Righteous Gauntlets, https://wotlkdb.com/?spell=55300, 54.4001, 91.5999, 146, 159.4
Helm of Command, https://wotlkdb.com/?spell=55302, 54.05, 182.7, 236.75, 129.6
Tempered Titansteel Treads, https://wotlkdb.com/?spell=55376, 53.8, 1096.2, 1150, 104.9
Iron Counterweight, https://wotlkdb.com/?spell=7222, 53.5506, 6.4494, 60, 930.3
Titanium Rod, https://wotlkdb.com/?spell=55732, 53.4, 66.6, 120, 180.2
Spiked Cobalt Bracers, https://wotlkdb.com/?spell=54948, 52.6235, 12.1212, 64.7447, 534.1
Adamantite Rod, https://wotlkdb.com/?spell=32656, 49.6, 49.4, 99, 200.4
Green Iron Gauntlets, https://wotlkdb.com/?spell=3336, 49.59, 8.41, 58, 689.7
Golden Scale Leggings, https://wotlkdb.com/?spell=3507, 49.1317, 17.5, 66.6317, 380.8
Brilliant Saronite Legplates, https://wotlkdb.com/?spell=55055, 48.9607, 39.9393, 88.9, 222.6
Honed Cobalt Cleaver, https://wotlkdb.com/?spell=55174, 46.6788, 53.3212, 100, 187.5
Fel Iron Rod, https://wotlkdb.com/?spell=32655, 45.6321, 45, 90.6321, 201.4
Adamantite Cleaver, https://wotlkdb.com/?spell=29568, 45.48, 39.52, 85, 215.1
Cobalt Chestpiece, https://wotlkdb.com/?spell=52570, 43.9393, 6.0606, 49.9999, 825
Tempered Saronite Bracers, https://wotlkdb.com/?spell=55017, 42.455, 88.4, 130.855, 148
Ornate Saronite Pauldrons, https://wotlkdb.com/?spell=56550, 38.4001, 91.5999, 130, 141.9
Tempered Saronite Helm, https://wotlkdb.com/?spell=54555, 38.3368, 81.6632, 120, 146.9
Fel Iron Greatsword, https://wotlkdb.com/?spell=29565, 35, 90, 125, 138.9
Savage Saronite Skullshield, https://wotlkdb.com/?spell=55312, 34.9, 125.1, 160, 127.9
Fel Iron Plate Pants, https://wotlkdb.com/?spell=29549, 34, 60, 94, 156.7
Titanium Shield Spike, https://wotlkdb.com/?spell=56357, 33.4, 66.6, 100, 150.2
Eternal Belt Buckle, https://wotlkdb.com/?spell=55656, 32.9001, 71.0999, 104, 146.3
Ebon Hand, https://wotlkdb.com/?spell=23650, 32.74, 1467.26, 1500, 102.2
Felsteel Shield Spike, https://wotlkdb.com/?spell=29657, 32.44, 266.56, 299, 112.2
Adamantite Rapier, https://wotlkdb.com/?spell=29571, 30.72, 59.28, 90, 151.8
Reinforced Cobalt Chestpiece, https://wotlkdb.com/?spell=54981, 30.1416, 9.8584, 40, 405.7
Green Iron Shoulders, https://wotlkdb.com/?spell=3504, 28.77, 11.23, 40, 356.2
Ornate Saronite Waistguard, https://wotlkdb.com/?spell=56551, 28.4001, 91.5999, 120, 131
Mighty Iron Hammer, https://wotlkdb.com/?spell=3297, 28.1812, 16.8188, 45, 267.6
Adamantite Maul, https://wotlkdb.com/?spell=29566, 27.12, 39.52, 66.64, 168.6
Heavy Bronze Mace, https://wotlkdb.com/?spell=3296, 26.76, 17.24, 44, 255.2
Green Iron Boots, https://wotlkdb.com/?spell=3334, 26.67, 9.33, 36, 385.9
Reinforced Cobalt Helm, https://wotlkdb.com/?spell=54979, 26.1416, 9.8584, 36, 365.2
Cobalt Triangle Shield, https://wotlkdb.com/?spell=54550, 25.9595, 4.0404, 29.9999, 742.5
Whirling Steel Axes, https://wotlkdb.com/?spell=34981, 25.6012, 24.3988, 50, 204.9
Jade Serpentblade, https://wotlkdb.com/?spell=3493, 25.2536, 29.7464, 55, 184.9
Spiked Cobalt Chestpiece, https://wotlkdb.com/?spell=54944, 25.2525, 8.0808, 33.3333, 412.5
Saronite Shiv, https://wotlkdb.com/?spell=55181, 22.1561, 85.301, 107.4571, 126
Cobalt Boots, https://wotlkdb.com/?spell=52569, 20.9596, 4.0404, 25, 618.8
Forged Cobalt Claymore, https://wotlkdb.com/?spell=55203, 19.799, 10.101, 29.9, 296
Tempered Saronite Breastplate, https://wotlkdb.com/?spell=54553, 18.8762, 40.1238, 59, 147
Brilliant Saronite Boots, https://wotlkdb.com/?spell=55057, 18.3, 81.6, 99.9, 122.4
Copper Battle Axe, https://wotlkdb.com/?spell=3293, 17.19, 20.81, 38, 182.6
Cobalt Tenderizer, https://wotlkdb.com/?spell=55201, 16.9192, 8.0808, 25, 309.4
Ornate Saronite Legplates, https://wotlkdb.com/?spell=56554, 15, 135, 150, 111.1
Cobalt Helm, https://wotlkdb.com/?spell=52571, 14.9495, 5.0505, 20, 396
Brilliant Saronite Belt, https://wotlkdb.com/?spell=59436, 14.9394, 40.0606, 55, 137.3
Sturdy Cobalt Quickblade, https://wotlkdb.com/?spell=55200, 13.9192, 8.0808, 22, 272.3
Greater Ward of Shielding, https://wotlkdb.com/?spell=29729, 13.8, 6, 19.8, 330
Spiked Cobalt Legplates, https://wotlkdb.com/?spell=54947, 13.1553, 12.1212, 25.2765, 208.5
Notched Cobalt War Axe, https://wotlkdb.com/?spell=55204, 12.899, 10.101, 23, 227.7
Heavy Mithril Axe, https://wotlkdb.com/?spell=9993, 12.1767, 86.8233, 99, 114
Horned Cobalt Helm, https://wotlkdb.com/?spell=54949, 11.9192, 8.0808, 20, 247.5
Savage Saronite Hauberk, https://wotlkdb.com/?spell=55311, 11.55, 99.2, 110.75, 111.6
Deadly Bronze Poniard, https://wotlkdb.com/?spell=3295, 10.72, 23.72, 34.44, 145.2
Fel Iron Casing, https://wotlkdb.com/?spell=30304, 9.5, 22.5, 32, 142.2
Sure-fire Shuriken, https://wotlkdb.com/?spell=55202, 8.9293, 7.0707, 16, 226.3
Cobalt Bracers, https://wotlkdb.com/?spell=55834, 8.6346, 4.0404, 12.675, 313.7
Wicked Mithril Blade, https://wotlkdb.com/?spell=9997, 6.3385, 93.6615, 100, 106.8
Cobalt Shoulders, https://wotlkdb.com/?spell=52572, 5.8396, 4.0404, 9.88, 244.5
Cobalt Belt, https://wotlkdb.com/?spell=52568, 5.7396, 4.0404, 9.78, 242.1
Thick Bronze Darts, https://wotlkdb.com/?spell=34979, 5.35, 9.65, 15, 155.4
Golden Scale Boots, https://wotlkdb.com/?spell=3515, 4.7, 45.3, 50, 110.4
Adamantite Sharpening Stone, https://wotlkdb.com/?spell=29656, 4.58, 6.42, 11, 171.3
Saronite Sharpening Stone, https://wotlkdb.com/?spell=56307, 4.58, 6.42, 11, 171.3
Cobalt Gauntlets, https://wotlkdb.com/?spell=55835, 4.4829, 5.0505, 9.5334, 188.8
Big Bronze Knife, https://wotlkdb.com/?spell=3491, 4.31, 10.69, 15, 140.3
Spiked Cobalt Gauntlets, https://wotlkdb.com/?spell=54945, 2.8788, 12.1212, 15, 123.8
Golden Iron Destroyer, https://wotlkdb.com/?spell=3495, 2.8236, 24.6764, 27.5, 111.4
Tempered Saronite Boots, https://wotlkdb.com/?spell=54552, 2.4787, 57.4303, 59.909, 104.3
Golden Rod, https://wotlkdb.com/?spell=14379, 1.99, 1.51, 3.5, 231.8
Truesilver Rod, https://wotlkdb.com/?spell=14380, 1.95, 1.49, 3.44, 230.9
Spiked Cobalt Boots, https://wotlkdb.com/?spell=54918, 1.9293, 7.0707, 9, 127.3
Green Iron Hauberk, https://wotlkdb.com/?spell=3508, 1.8, 128.2, 130, 101.4
Heavy Weightstone, https://wotlkdb.com/?spell=3117, 1.4663, 1.0337, 2.5, 241.8
Spiked Cobalt Shoulders, https://wotlkdb.com/?spell=54941, 0.9293, 7.0707, 8, 113.1
Solid Weightstone, https://wotlkdb.com/?spell=9921, 0.8991, 0.1159, 1.015, 875.8
Daunting Legplates, https://wotlkdb.com/?spell=55303, 0.8, 99.2, 100, 100.8
Coarse Sharpening Stone, https://wotlkdb.com/?spell=2665, 0.4688, 0.0311, 0.4999, 1607.4
Dense Sharpening Stone, https://wotlkdb.com/?spell=16641, 0.4514, 0.0486, 0.5, 1028.8
Coarse Grinding Stone, https://wotlkdb.com/?spell=3326, 0.2178, 0.0622, 0.28, 450.2
Rough Sharpening Stone, https://wotlkdb.com/?spell=2660, 0.0726, 0.0043, 0.0769, 1788.4
Rough Grinding Stone, https://wotlkdb.com/?spell=3320, 0.0664, 0.0086, 0.075, 872.1
Rough Weightstone, https://wotlkdb.com/?spell=3115, 0.0446, 0.0061, 0.0507, 831.1
Fel Iron Plate Belt, https://wotlkdb.com/?spell=29547, 0, 30, 30, 100
Heavy Sharpening Stone, https://wotlkdb.com/?spell=2674, -0.0038, 1.0238, 1.02, 99.6
Coarse Weightstone, https://wotlkdb.com/?spell=3116, -0.031, 0.041, 0.01, 24.4
Solid Sharpening Stone, https://wotlkdb.com/?spell=9918, -0.088, 0.1, 0.012, 12
Fel Iron Chain Coif, https://wotlkdb.com/?spell=29551, -0.1011, 30, 29.8989, 99.7
Adamantite Weightstone, https://wotlkdb.com/?spell=34608, -0.193, 5.293, 5.1, 96.4
Iron Buckle, https://wotlkdb.com/?spell=8768, -0.22, 1.46, 1.24, 84.9
Solid Grinding Stone, https://wotlkdb.com/?spell=9920, -0.2923, 0.4, 0.1077, 26.9
Massive Iron Axe, https://wotlkdb.com/?spell=3498, -0.4176, 30.4176, 30, 98.6
Ornate Saronite Walkers, https://wotlkdb.com/?spell=56552, -1.5, 111.5, 110, 98.7
Heavy Grinding Stone, https://wotlkdb.com/?spell=3337, -2.0714, 3.0714, 1, 32.6
Silver Rod, https://wotlkdb.com/?spell=7818, -2.15, 7.15, 5, 69.9
Reinforced Cobalt Legplates, https://wotlkdb.com/?spell=54980, -2.5504, 9.8584, 7.308, 74.1
Fel Iron Plate Gloves, https://wotlkdb.com/?spell=29545, -2.5532, 30, 27.4468, 91.5
Copper Bracers, https://wotlkdb.com/?spell=2663, -2.59, 2.98, 0.39, 13.1
Rough Bronze Cuirass, https://wotlkdb.com/?spell=2670, -4.75, 8.75, 4, 45.7
Reinforced Cobalt Shoulders, https://wotlkdb.com/?spell=54978, -4.7948, 9.8584, 5.0636, 51.4
Iron Shield Spike, https://wotlkdb.com/?spell=7221, -4.8238, 9.88, 5.0562, 51.2
Shadow Crescent Axe, https://wotlkdb.com/?spell=3500, -4.9, 94.9, 90, 94.8
Rough Bronze Bracers, https://wotlkdb.com/?spell=2671, -4.9371, 5, 0.0629, 1.3
Silvered Bronze Breastplate, https://wotlkdb.com/?spell=2673, -5.06, 27.06, 22, 81.3
Bronze Shortsword, https://wotlkdb.com/?spell=2742, -5.29, 10.29, 5, 48.6
Rough Bronze Shoulders, https://wotlkdb.com/?spell=3328, -5.33, 6.53, 1.2, 18.4
Bronze Mace, https://wotlkdb.com/?spell=2740, -5.5401, 9.54, 3.9999, 41.9
Copper Chain Pants, https://wotlkdb.com/?spell=2662, -5.76, 5.96, 0.2, 3.4
Patterned Bronze Bracers, https://wotlkdb.com/?spell=2672, -5.82, 6.81, 0.99, 14.5
Hardened Iron Shortsword, https://wotlkdb.com/?spell=3492, -5.9252, 15.9252, 10, 62.8
Copper Mace, https://wotlkdb.com/?spell=2737, -5.9536, 8.9536, 3, 33.5
Brilliant Saronite Helm, https://wotlkdb.com/?spell=59441, -6.0888, 96.0888, 90, 93.7
Rough Bronze Leggings, https://wotlkdb.com/?spell=2668, -6.51, 7.5, 0.99, 13.2
Rough Bronze Boots, https://wotlkdb.com/?spell=7817, -6.93, 7.95, 1.02, 12.8
Copper Shortsword, https://wotlkdb.com/?spell=2739, -6.9536, 8.9536, 2, 22.3
Fel Sharpening Stone, https://wotlkdb.com/?spell=29654, -6.99, 8.24, 1.25, 15.2
Bronze Warhammer, https://wotlkdb.com/?spell=9985, -7.2, 12.2, 5, 41
Green Iron Leggings, https://wotlkdb.com/?spell=3506, -7.74, 12.69, 4.95, 39
Brilliant Saronite Bracers, https://wotlkdb.com/?spell=59438, -7.758, 57.4303, 49.6723, 86.5
Green Iron Bracers, https://wotlkdb.com/?spell=3501, -7.78, 8.77, 0.99, 11.3
Heavy Copper Broadsword, https://wotlkdb.com/?spell=3292, -7.88, 26.88, 19, 70.7
Copper Chain Belt, https://wotlkdb.com/?spell=2661, -8.29, 8.94, 0.65, 7.3
Copper Axe, https://wotlkdb.com/?spell=2738, -8.6536, 8.9536, 0.3, 3.4
Copper Dagger, https://wotlkdb.com/?spell=8880, -9.3149, 9.415, 0.1001, 1.1
Bronze Greatsword, https://wotlkdb.com/?spell=9986, -9.3899, 19.4, 10.0101, 51.6
Deadly Saronite Dirk, https://wotlkdb.com/?spell=55206, -9.54, 54.54, 45, 82.5
Bronze Axe, https://wotlkdb.com/?spell=2741, -9.9, 10.79, 0.89, 8.2
Copper Chain Vest, https://wotlkdb.com/?spell=3321, -10.07, 12.07, 2, 16.6
Tempered Saronite Belt, https://wotlkdb.com/?spell=54551, -10.1516, 40.0606, 29.909, 74.7
Bronze Battle Axe, https://wotlkdb.com/?spell=9987, -10.7, 21.7, 11, 50.7
Runed Copper Gauntlets, https://wotlkdb.com/?spell=3323, -10.97, 12.07, 1.1, 9.1
Runed Copper Breastplate, https://wotlkdb.com/?spell=2667, -11.01, 19.01, 8, 42.1
Runed Copper Pants, https://wotlkdb.com/?spell=3324, -11.065, 12.165, 1.1, 9
Daunting Handguards, https://wotlkdb.com/?spell=55301, -11.6, 85.6, 74, 86.4
Copper Chain Boots, https://wotlkdb.com/?spell=3319, -11.89, 11.92, 0.03, 0.3
Silvered Bronze Boots, https://wotlkdb.com/?spell=3331, -12.07, 15.06, 2.99, 19.9
Adamantite Dagger, https://wotlkdb.com/?spell=29569, -12.2838, 42.2838, 30, 70.9
Silvered Bronze Shoulders, https://wotlkdb.com/?spell=3330, -12.56, 24.56, 12, 48.9
Gemmed Copper Gauntlets, https://wotlkdb.com/?spell=3325, -12.67, 13.91, 1.24, 8.9
Runed Copper Belt, https://wotlkdb.com/?spell=2666, -13.02, 14.9, 1.88, 12.6
Runed Copper Bracers, https://wotlkdb.com/?spell=2664, -13.125, 15.125, 2, 13.2
Silvered Bronze Gauntlets, https://wotlkdb.com/?spell=3333, -13.56, 17.56, 4, 22.8
Heavy Copper Maul, https://wotlkdb.com/?spell=7408, -13.68, 18.68, 5, 26.8
Green Iron Helm, https://wotlkdb.com/?spell=3502, -13.7301, 18.73, 4.9999, 26.7
Barbaric Iron Shoulders, https://wotlkdb.com/?spell=9811, -13.79, 14.04, 0.25, 1.8
Ironforge Gauntlets, https://wotlkdb.com/?spell=8368, -13.9455, 14.06, 0.1145, 0.8
Copper Claymore, https://wotlkdb.com/?spell=9983, -14.385, 15.385, 1, 6.5
Glinting Steel Dagger, https://wotlkdb.com/?spell=15972, -16.2888, 57.2888, 41, 71.6
Ironvine Belt, https://wotlkdb.com/?spell=28463, -16.4433, 18.397, 1.9537, 10.6
Heavy Iron Knuckles, https://wotlkdb.com/?spell=25612, -17.1119, 17.68, 0.5681, 3.2
Fel Iron Chain Gloves, https://wotlkdb.com/?spell=29552, -17.5, 37.5, 20, 53.3
Barbaric Iron Helm, https://wotlkdb.com/?spell=9814, -18.8463, 19.18, 0.3337, 1.7
Iridescent Hammer, https://wotlkdb.com/?spell=6518, -18.8906, 19.26, 0.3694, 1.9
Golden Scale Gauntlets, https://wotlkdb.com/?spell=11643, -19.3, 45.3, 26, 57.4
Golden Scale Bracers, https://wotlkdb.com/?spell=7223, -19.75, 20.75, 1, 4.8
Golden Scale Cuirass, https://wotlkdb.com/?spell=3511, -19.9, 50.9, 31, 60.9
Imperial Plate Belt, https://wotlkdb.com/?spell=16647, -19.9, 79.9, 60, 75.1
Ironforge Chain, https://wotlkdb.com/?spell=8366, -19.9604, 20.01, 0.0496, 0.2
Golden Scale Shoulders, https://wotlkdb.com/?spell=3505, -20.4, 25.4, 5, 19.7
Barbaric Iron Collar, https://wotlkdb.com/?spell=25498, -21.4001, 24.4, 2.9999, 12.3
Mithril Spurs, https://wotlkdb.com/?spell=9964, -22.4199, 25.9099, 3.49, 13.5
Fel Iron Plate Boots, https://wotlkdb.com/?spell=29548, -23, 45, 22, 48.9
Ironvine Gloves, https://wotlkdb.com/?spell=28462, -23.0005, 24.947, 1.9465, 7.8
Thick War Axe, https://wotlkdb.com/?spell=3294, -23.85, 29.85, 6, 20.1
Mithril Shield Spike, https://wotlkdb.com/?spell=9939, -24.9976, 26.9976, 2, 7.4
Fel Iron Chain Bracers, https://wotlkdb.com/?spell=29553, -25, 45, 20, 44.4
Ironforge Breastplate, https://wotlkdb.com/?spell=8367, -25.9779, 26.065, 0.0871, 0.3
Barbaric Iron Gloves, https://wotlkdb.com/?spell=9820, -27.5689, 27.84, 0.2711, 1
Barbaric Iron Boots, https://wotlkdb.com/?spell=9818, -27.95, 28.32, 0.37, 1.3
Volcanic Breastplate, https://wotlkdb.com/?spell=19076, -28.6425, 30.37, 1.7275, 5.7
Enchanted Thorium Blades, https://wotlkdb.com/?spell=34982, -29.65, 49.65, 20, 40.3
Thorium Armor, https://wotlkdb.com/?spell=16642, -29.9999, 128.9999, 99, 76.7
Golden Scale Coif, https://wotlkdb.com/?spell=3503, -30.9, 33.9, 3, 8.8
Tempered Saronite Shoulders, https://wotlkdb.com/?spell=54556, -31.7, 81.6, 49.9, 61.2
Elemental Sharpening Stone, https://wotlkdb.com/?spell=22757, -32.0208, 32.1458, 0.125, 0.4
Fel Iron Hatchet, https://wotlkdb.com/?spell=29557, -32.5, 67.5, 35, 51.9
Polished Steel Boots, https://wotlkdb.com/?spell=3513, -32.8557, 33.2494, 0.3937, 1.2
Barbaric Iron Breastplate, https://wotlkdb.com/?spell=9813, -32.8669, 33.2, 0.3331, 1
Steel Plate Helm, https://wotlkdb.com/?spell=9935, -33.8078, 53.8077, 19.9999, 37.2
Tempered Saronite Gauntlets, https://wotlkdb.com/?spell=55015, -35.291, 95.2, 59.909, 62.9
Dark Iron Bracers, https://wotlkdb.com/?spell=20874, -35.8158, 38.04, 2.2242, 5.8
Heavy Mithril Gauntlet, https://wotlkdb.com/?spell=9928, -35.8202, 38.8202, 3, 7.7
Solid Iron Maul, https://wotlkdb.com/?spell=3494, -35.8576, 44.8576, 9, 20.1
Mithril Scale Bracers, https://wotlkdb.com/?spell=9937, -36.1736, 51.1736, 15, 29.3
Brilliant Saronite Breastplate, https://wotlkdb.com/?spell=55058, -40.0888, 96.0888, 56, 58.3
Blood Tiger Breastplate, https://wotlkdb.com/?spell=24124, -40.3478, 43.0297, 2.6819, 6.2
Fel Iron Breastplate, https://wotlkdb.com/?spell=29550, -40.9725, 75, 34.0275, 45.4
Fel Iron Chain Tunic, https://wotlkdb.com/?spell=29556, -42.72, 67.5, 24.78, 36.7
Flamebane Gloves, https://wotlkdb.com/?spell=29616, -44.96, 244.96, 200, 81.6
Fel Iron Hammer, https://wotlkdb.com/?spell=29558, -45, 75, 30, 40
