Name, Link, Profit, Cost, Sell, ROI %
Heavy Copper Longsword, https://wotlkdb.com/?spell=43549, 15283.429, 15.571, 15299, 98253.2
Sulfuron Hammer, https://wotlkdb.com/?spell=21161, 10208.2703, 6791.7297, 17000, 250.3
Oathkeeper's Helm, https://wotlkdb.com/?spell=29668, 9142.7899, 855.21, 9997.9999, 1169.1
Khorium Champion, https://wotlkdb.com/?spell=29693, 6504.14, 3495.86, 10000, 286.1
Nightfall, https://wotlkdb.com/?spell=23653, 6124.2014, 1375.7986, 7500, 545.1
Arcanite Reaper, https://wotlkdb.com/?spell=16994, 5888.2, 2111.8, 8000, 378.8
Lionheart Helm, https://wotlkdb.com/?spell=16729, 5434.4, 2065.6, 7500, 363.1
Dark Iron Helm, https://wotlkdb.com/?spell=23636, 4923.4004, 75.5996, 4999, 6612.5
Helm of the Stalwart Defender, https://wotlkdb.com/?spell=29664, 4344.47, 654.53, 4999, 763.8
Frostguard, https://wotlkdb.com/?spell=16992, 4072.8, 2327.2, 6400, 275
Steelgrip Gauntlets, https://wotlkdb.com/?spell=29662, 3844.695, 1155.305, 5000, 432.8
Enchanted Thorium Breastplate, https://wotlkdb.com/?spell=16745, 3790.4002, 1209.5998, 5000, 413.4
Black Felsteel Bracers, https://wotlkdb.com/?spell=29669, 3248.695, 251.305, 3500, 1392.7
Dark Iron Leggings, https://wotlkdb.com/?spell=20876, 3205.6008, 294.3992, 3500, 1188.9
Dark Iron Gauntlets, https://wotlkdb.com/?spell=23637, 2879.621, 119.379, 2999, 2512.2
Blazing Rapier, https://wotlkdb.com/?spell=16978, 2853.9092, 144.5908, 2998.5, 2073.8
Dark Iron Boots, https://wotlkdb.com/?spell=24399, 2847.0006, 151.9994, 2999, 1973
Felsteel Longblade, https://wotlkdb.com/?spell=29692, 2441.765, 2557.235, 4999, 195.5
Fel Edged Battleaxe, https://wotlkdb.com/?spell=29694, 2372.765, 2857.235, 5230, 183
Spiked Deathdealers, https://wotlkdb.com/?spell=63192, 2261.9, 3660.1, 5922, 161.8
Belt of the Titans, https://wotlkdb.com/?spell=63187, 1983.9, 3660.1, 5644, 154.2
Battlelord's Plate Boots, https://wotlkdb.com/?spell=63188, 1747.4, 3660.1, 5407.5, 147.7
Hand of Eternity, https://wotlkdb.com/?spell=29700, 1738.48, 2691.52, 4430, 164.6
Whitesoul Helm, https://wotlkdb.com/?spell=16724, 1731.3406, 268.6594, 2000, 744.4
Felsteel Reaper, https://wotlkdb.com/?spell=29695, 1672.765, 2857.235, 4530, 158.5
Dark Iron Shoulders, https://wotlkdb.com/?spell=15295, 1490.4606, 108.5394, 1599, 1473.2
Shadesteel Bracers, https://wotlkdb.com/?spell=40034, 1429.02, 70.98, 1500, 2113.3
Shadesteel Sabots, https://wotlkdb.com/?spell=40033, 1425.56, 74.44, 1500, 2015
Shadesteel Girdle, https://wotlkdb.com/?spell=40036, 1398, 102, 1500, 1470.6
Indestructible Plate Girdle, https://wotlkdb.com/?spell=63191, 1377.9, 3660.1, 5038, 137.6
Shadesteel Greaves, https://wotlkdb.com/?spell=40035, 1366.98, 133.02, 1500, 1127.6
Enchanted Adamantite Belt, https://wotlkdb.com/?spell=29608, 1340.72, 159.28, 1500, 941.7
Treads of Destiny, https://wotlkdb.com/?spell=63190, 1338.9, 3660.1, 4999, 136.6
Enchanted Adamantite Boots, https://wotlkdb.com/?spell=29611, 1284.88, 215.12, 1500, 697.3
Felsteel Gloves, https://wotlkdb.com/?spell=29619, 1257.975, 242.025, 1500, 619.8
Felsteel Helm, https://wotlkdb.com/?spell=29621, 1177.3, 322.7, 1500, 464.8
Enchanted Adamantite Breastplate, https://wotlkdb.com/?spell=29610, 1171.6, 328.4, 1500, 456.8
Enchanted Adamantite Leggings, https://wotlkdb.com/?spell=29613, 1161.76, 338.24, 1500, 443.5
Felfury Gauntlets, https://wotlkdb.com/?spell=29658, 1109.695, 855.305, 1965, 229.7
Saronite Swordbreakers, https://wotlkdb.com/?spell=67092, 1103.34, 3397.66, 4501, 132.5
Legplates of Painful Death, https://wotlkdb.com/?spell=70565, 1033.16, 7969.84, 9003, 113
Pillars of Might, https://wotlkdb.com/?spell=70567, 963.494, 7436.506, 8400, 113
Bloodsoul Shoulders, https://wotlkdb.com/?spell=24137, 938.96, 161.04, 1100, 683.1
Girdle of the Dawn, https://wotlkdb.com/?spell=23632, 933.6806, 66.3194, 1000, 1507.9
Bloodsoul Breastplate, https://wotlkdb.com/?spell=24136, 882.2, 217.8, 1100, 505.1
Boots of Kingly Upheaval, https://wotlkdb.com/?spell=70568, 872.3404, 4796.1596, 5668.5, 118.2
Bloodsoul Gauntlets, https://wotlkdb.com/?spell=24138, 868.12, 231.88, 1100, 474.4
Breastplate of the White Knight, https://wotlkdb.com/?spell=67130, 838.3002, 5860.6998, 6699, 114.3
Gloves of the Dawn, https://wotlkdb.com/?spell=23633, 802.041, 197.959, 1000, 505.2
Titanium Razorplate, https://wotlkdb.com/?spell=67132, 774.8, 5020.2, 5795, 115.4
Blackguard, https://wotlkdb.com/?spell=23652, 773.6012, 1196.3988, 1970, 164.7
Saronite Swordbreakers, https://wotlkdb.com/?spell=67131, 702.34, 3397.66, 4100, 120.7
Protectors of Life, https://wotlkdb.com/?spell=70563, 681.8404, 4796.1596, 5478, 114.2
Felsteel Leggings, https://wotlkdb.com/?spell=29620, 677.3, 322.7, 1000, 309.9
Sunforged Breastplate, https://wotlkdb.com/?spell=67134, 672.65, 5216.35, 5889, 112.9
Titansteel Guardian, https://wotlkdb.com/?spell=55371, 672.3064, 1992.37, 2664.6764, 133.7
Phantom Blade, https://wotlkdb.com/?spell=10007, 664.4462, 250.5538, 915, 365.2
Titansteel Destroyer, https://wotlkdb.com/?spell=55369, 614.34, 2600.16, 3214.5, 123.6
Hellfrozen Bonegrinders, https://wotlkdb.com/?spell=70566, 526.44, 5373.56, 5900, 109.8
Titansteel Bonecrusher, https://wotlkdb.com/?spell=55370, 521.3064, 1992.37, 2513.6764, 126.2
Icebane Treads, https://wotlkdb.com/?spell=61010, 462.2, 336.8, 799, 237.2
Icebane Girdle, https://wotlkdb.com/?spell=61009, 451.9468, 336.8, 788.7468, 234.2
Titanium Spikeguards, https://wotlkdb.com/?spell=67133, 449.1399, 3619.86, 4068.9999, 112.4
Plate Girdle of Righteousness, https://wotlkdb.com/?spell=63189, 439.9, 3660.1, 4100, 112
Greater Rune of Warding, https://wotlkdb.com/?spell=32285, 425, 125, 550, 440
Ornate Mithril Gloves, https://wotlkdb.com/?spell=9950, 419.4108, 80.5892, 500, 620.4
Adamantite Breastplate, https://wotlkdb.com/?spell=29606, 411.3, 88.7, 500, 563.7
Honed Cobalt Cleaver, https://wotlkdb.com/?spell=55174, 407.2265, 56.4, 463.6265, 822
Furious Saronite Beatstick, https://wotlkdb.com/?spell=55182, 405.0208, 58.9822, 464.003, 786.7
Ornate Mithril Pants, https://wotlkdb.com/?spell=9945, 403.5692, 96.4308, 500, 518.5
Ornate Mithril Shoulder, https://wotlkdb.com/?spell=9952, 399.9901, 100.0099, 500, 500
Spiked Titansteel Helm, https://wotlkdb.com/?spell=55372, 398.6664, 1300.08, 1698.7464, 130.7
Imperial Plate Shoulders, https://wotlkdb.com/?spell=16646, 393.32, 106.68, 500, 468.7
Imperial Plate Helm, https://wotlkdb.com/?spell=16658, 388.5, 161.5, 550, 340.6
Radiant Boots, https://wotlkdb.com/?spell=16656, 388.3424, 110.6576, 499, 450.9
Ornate Mithril Boots, https://wotlkdb.com/?spell=9979, 383.2593, 116.7407, 500, 428.3
Adamantite Plate Gloves, https://wotlkdb.com/?spell=29605, 381.54, 68.46, 450, 657.3
Smelt Hardened Khorium, https://wotlkdb.com/?spell=46353, 378.9999, 421, 799.9999, 190
Ornate Mithril Helm, https://wotlkdb.com/?spell=9980, 371.1593, 128.8407, 500, 388.1
Ornate Mithril Breastplate, https://wotlkdb.com/?spell=9972, 368.9803, 131.0197, 500, 381.6
Imperial Plate Boots, https://wotlkdb.com/?spell=16657, 360.5, 139.5, 500, 358.4
Radiant Gloves, https://wotlkdb.com/?spell=16654, 357.3424, 141.6576, 499, 352.3
Tempered Saronite Helm, https://wotlkdb.com/?spell=54555, 351.8214, 46.9286, 398.75, 849.7
Saronite Spellblade, https://wotlkdb.com/?spell=59442, 350.8015, 73.825, 424.6265, 575.2
Imperial Plate Chest, https://wotlkdb.com/?spell=16663, 345, 155, 500, 322.6
Radiant Leggings, https://wotlkdb.com/?spell=16725, 341.8424, 157.1576, 499, 317.5
Icebane Chestguard, https://wotlkdb.com/?spell=61008, 334.6764, 455.2, 789.8764, 173.5
Imperial Plate Leggings, https://wotlkdb.com/?spell=16730, 314, 186, 500, 268.8
Brilliant Titansteel Helm, https://wotlkdb.com/?spell=55374, 299.92, 1300.08, 1600, 123.1
Gemmed Copper Gauntlets, https://wotlkdb.com/?spell=3325, 285.42, 14.58, 300, 2057.6
Cudgel of Saronite Justice, https://wotlkdb.com/?spell=56280, 285.3515, 59.525, 344.8765, 579.4
Titansteel Spellblade, https://wotlkdb.com/?spell=63182, 269.88, 1981.12, 2251, 113.6
Adamantite Plate Bracers, https://wotlkdb.com/?spell=29603, 254.8999, 45.1, 299.9999, 665.2
Searing Golden Blade, https://wotlkdb.com/?spell=15973, 253.94, 46.06, 300, 651.3
Heavy Mithril Shoulder, https://wotlkdb.com/?spell=9926, 232.82, 67.18, 300, 446.6
Tempered Titansteel Helm, https://wotlkdb.com/?spell=55373, 227.2512, 1300.08, 1527.3312, 117.5
Shining Silver Breastplate, https://wotlkdb.com/?spell=2675, 224.2392, 75.7608, 300, 396
Heavy Mithril Pants, https://wotlkdb.com/?spell=9933, 220, 80, 300, 375
Savage Saronite Gauntlets, https://wotlkdb.com/?spell=55309, 201.6084, 137.4, 339.0084, 246.7
Tempered Titansteel Treads, https://wotlkdb.com/?spell=55376, 199.94, 1000.06, 1200, 120
Titanium Plating, https://wotlkdb.com/?spell=62202, 197.8765, 332, 529.8765, 159.6
Saronite Bulwark, https://wotlkdb.com/?spell=55014, 196.6264, 54.25, 250.8764, 462.4
Brilliant Saronite Pauldrons, https://wotlkdb.com/?spell=59440, 185.1293, 46.5, 231.6293, 498.1
Tempered Saronite Belt, https://wotlkdb.com/?spell=54551, 178.4015, 31.975, 210.3765, 657.9
Imperial Plate Belt, https://wotlkdb.com/?spell=16647, 163.82, 91.18, 255, 279.7
Vengeance Bindings, https://wotlkdb.com/?spell=55298, 162.3, 137.4, 299.7, 218.1
Fel Iron Hammer, https://wotlkdb.com/?spell=29558, 160.4, 39.6, 200, 505.1
Heavy Mithril Helm, https://wotlkdb.com/?spell=9970, 141.5, 113.5, 255, 224.7
Savage Cobalt Slicer, https://wotlkdb.com/?spell=55177, 141.0045, 55.75, 196.7545, 352.9
Savage Saronite Waistguard, https://wotlkdb.com/?spell=55307, 139.5, 58.5, 198, 338.5
Adamantite Maul, https://wotlkdb.com/?spell=29566, 133.8, 51.2, 185, 361.3
Sturdy Cobalt Quickblade, https://wotlkdb.com/?spell=55200, 129.0765, 16.8, 145.8765, 868.3
Righteous Greaves, https://wotlkdb.com/?spell=55304, 127.2529, 66.25, 193.5029, 292.1
Savage Saronite Bracers, https://wotlkdb.com/?spell=55305, 119.2528, 80.5, 199.7528, 248.1
Ornate Saronite Gauntlets, https://wotlkdb.com/?spell=56553, 116.6961, 137.4, 254.0961, 184.9
Fel Iron Hatchet, https://wotlkdb.com/?spell=29557, 114.36, 35.64, 150, 420.9
Brilliant Saronite Helm, https://wotlkdb.com/?spell=59441, 113.9264, 54.95, 168.8764, 307.3
Ironvine Breastplate, https://wotlkdb.com/?spell=28461, 102.94, 230.06, 333, 144.7
Spiked Titansteel Treads, https://wotlkdb.com/?spell=55375, 99.9399, 1000.06, 1099.9999, 110
Ragesteel Gloves, https://wotlkdb.com/?spell=29642, 98.82, 416.18, 515, 123.7
Helm of Command, https://wotlkdb.com/?spell=55302, 98.583, 145.15, 243.733, 167.9
Truesilver Gauntlets, https://wotlkdb.com/?spell=9954, 93.9432, 95.0568, 189, 198.8
Savage Saronite Legplates, https://wotlkdb.com/?spell=55310, 91.3768, 88.25, 179.6268, 203.5
Tempered Saronite Legplates, https://wotlkdb.com/?spell=54554, 89.5729, 30.3036, 119.8765, 395.6
Titansteel Shield Wall, https://wotlkdb.com/?spell=56400, 87.2712, 1000.06, 1087.3312, 108.7
Savage Saronite Pauldrons, https://wotlkdb.com/?spell=55306, 86.9265, 58.5, 145.4265, 248.6
Spiked Cobalt Helm, https://wotlkdb.com/?spell=54917, 85, 14.7, 99.7, 678.2
Brilliant Saronite Belt, https://wotlkdb.com/?spell=59436, 82.4014, 31.975, 114.3764, 357.7
Brilliant Saronite Gauntlets, https://wotlkdb.com/?spell=55056, 73.5765, 37.3, 110.8765, 297.3
Savage Saronite Walkers, https://wotlkdb.com/?spell=55308, 73.5, 76.5, 150, 196.1
Eternium Rod, https://wotlkdb.com/?spell=32657, 71.98, 19.92, 91.9, 461.3
Saronite Shiv, https://wotlkdb.com/?spell=55181, 67.8209, 52.0556, 119.8765, 230.3
Brilliant Saronite Legplates, https://wotlkdb.com/?spell=55055, 67.725, 30.575, 98.3, 321.5
Saronite Defender, https://wotlkdb.com/?spell=54557, 60.7765, 28.1, 88.8765, 316.3
Tempered Saronite Boots, https://wotlkdb.com/?spell=54552, 53.3765, 37.3, 90.6765, 243.1
Massive Iron Axe, https://wotlkdb.com/?spell=3498, 52.89, 17.11, 70, 409.1
Cobalt Tenderizer, https://wotlkdb.com/?spell=55201, 52.553, 16.8, 69.353, 412.8
Enchanted Thorium Blades, https://wotlkdb.com/?spell=34982, 49.52, 60.48, 110, 181.9
Brilliant Saronite Boots, https://wotlkdb.com/?spell=55057, 48.5, 46.5, 95, 204.3
Ornate Saronite Walkers, https://wotlkdb.com/?spell=56552, 48.3765, 76.5, 124.8765, 163.2
Tempered Saronite Breastplate, https://wotlkdb.com/?spell=54553, 46.5964, 32.4036, 79, 243.8
Fel Iron Rod, https://wotlkdb.com/?spell=32655, 45.94, 23.76, 69.7, 293.4
Savage Saronite Skullshield, https://wotlkdb.com/?spell=55312, 45.75, 84.25, 130, 154.3
Golden Iron Destroyer, https://wotlkdb.com/?spell=3495, 45.512, 14.488, 60, 414.1
Saronite Ambusher, https://wotlkdb.com/?spell=55179, 44.1515, 43.4778, 87.6293, 201.5
Savage Saronite Hauberk, https://wotlkdb.com/?spell=55311, 42.4167, 57.5833, 100, 173.7
Ornate Saronite Pauldrons, https://wotlkdb.com/?spell=56550, 41.4999, 58.5, 99.9999, 170.9
Adamantite Rod, https://wotlkdb.com/?spell=32656, 41, 64, 105, 164.1
Saronite Protector, https://wotlkdb.com/?spell=55013, 40.7, 28.1, 68.8, 244.8
Eternal Belt Buckle, https://wotlkdb.com/?spell=55656, 40.0431, 60.8333, 100.8764, 165.8
Tempered Saronite Bracers, https://wotlkdb.com/?spell=55017, 39.625, 50.375, 90, 178.7
Steel Weapon Chain, https://wotlkdb.com/?spell=7224, 38.8643, 36.18, 75.0443, 207.4
Frost Tiger Blade, https://wotlkdb.com/?spell=3497, 34, 66, 100, 151.5
Reinforced Cobalt Shoulders, https://wotlkdb.com/?spell=54978, 31.8, 18.2, 50, 274.7
Ornate Saronite Legplates, https://wotlkdb.com/?spell=56554, 31.7499, 88.25, 119.9999, 136
Hardened Iron Shortsword, https://wotlkdb.com/?spell=3492, 30.752, 7.248, 38, 524.3
Cobalt Helm, https://wotlkdb.com/?spell=52571, 29.5, 10.5, 40, 381
Forged Cobalt Claymore, https://wotlkdb.com/?spell=55203, 28.8, 21, 49.8, 237.1
Jade Serpentblade, https://wotlkdb.com/?spell=3493, 28.47, 21.53, 50, 232.2
Solid Iron Maul, https://wotlkdb.com/?spell=3494, 28.18, 47.77, 75.95, 159
Notched Cobalt War Axe, https://wotlkdb.com/?spell=55204, 28.0765, 21, 49.0765, 233.7
Arcanite Rod, https://wotlkdb.com/?spell=20201, 26.55, 288.2, 314.75, 109.2
Cobalt Legplates, https://wotlkdb.com/?spell=52567, 26.5, 10.5, 37, 352.4
Spiked Cobalt Gauntlets, https://wotlkdb.com/?spell=54945, 25.8, 25.2, 51, 202.4
Repair the Blade of Heroes, https://wotlkdb.com/?spell=11923, 25.7338, 24.2662, 50, 206
Brilliant Saronite Breastplate, https://wotlkdb.com/?spell=55058, 25.7012, 54.95, 80.6512, 146.8
Spiked Cobalt Belt, https://wotlkdb.com/?spell=54946, 24.6765, 25.2, 49.8765, 197.9
Adamantite Rapier, https://wotlkdb.com/?spell=29571, 23.2, 76.8, 100, 130.2
Cobalt Chestpiece, https://wotlkdb.com/?spell=52570, 22.0765, 12.6, 34.6765, 275.2
Cobalt Triangle Shield, https://wotlkdb.com/?spell=54550, 21.2765, 8.4, 29.6765, 353.3
Ornate Saronite Skullshield, https://wotlkdb.com/?spell=56556, 20.75, 84.25, 105, 124.6
Green Iron Helm, https://wotlkdb.com/?spell=3502, 19.3414, 9.6586, 29, 300.3
Titanium Rod, https://wotlkdb.com/?spell=55732, 18.25, 60.75, 79, 130
Cobalt Bracers, https://wotlkdb.com/?spell=55834, 16.2765, 8.4, 24.6765, 293.8
Cobalt Boots, https://wotlkdb.com/?spell=52569, 16.0765, 8.4, 24.4765, 291.4
Titanium Weapon Chain, https://wotlkdb.com/?spell=55839, 14.1268, 60.75, 74.8768, 123.3
Spiked Cobalt Chestpiece, https://wotlkdb.com/?spell=54944, 13.19, 16.8, 29.99, 178.5
Deadly Saronite Dirk, https://wotlkdb.com/?spell=55206, 11.875, 33.125, 45, 135.8
Tempered Saronite Gauntlets, https://wotlkdb.com/?spell=55015, 11.7386, 54.25, 65.9886, 121.6
Whirling Steel Axes, https://wotlkdb.com/?spell=34981, 11.61, 23.39, 35, 149.6
Truesilver Rod, https://wotlkdb.com/?spell=14380, 11.5601, 1.4399, 13, 902.8
Cobalt Belt, https://wotlkdb.com/?spell=52568, 11.4765, 8.4, 19.8765, 236.6
Pearl-handled Dagger, https://wotlkdb.com/?spell=6517, 10.9542, 10.0458, 21, 209
Bronze Mace, https://wotlkdb.com/?spell=2740, 9.24, 9.76, 19, 194.7
Fel Iron Plate Belt, https://wotlkdb.com/?spell=29547, 9.16, 15.84, 25, 157.8
Adamantite Cleaver, https://wotlkdb.com/?spell=29568, 8.8, 51.2, 60, 117.2
Cobalt Shoulders, https://wotlkdb.com/?spell=52572, 8.6, 8.4, 17, 202.4
Sure-fire Shuriken, https://wotlkdb.com/?spell=55202, 8.2, 14.7, 22.9, 155.8
Bronze Axe, https://wotlkdb.com/?spell=2741, 7.74, 11.26, 19, 168.7
Brilliant Saronite Bracers, https://wotlkdb.com/?spell=59438, 7.6999, 37.3, 44.9999, 120.6
Big Bronze Knife, https://wotlkdb.com/?spell=3491, 7.469, 10.531, 18, 170.9
Cobalt Gauntlets, https://wotlkdb.com/?spell=55835, 6.45, 10.5, 16.95, 161.4
Fel Iron Plate Boots, https://wotlkdb.com/?spell=29548, 6.14, 23.76, 29.9, 125.8
Green Iron Boots, https://wotlkdb.com/?spell=3334, 6.1241, 4.406, 10.5301, 239
Iron Counterweight, https://wotlkdb.com/?spell=7222, 5.915, 3.085, 9, 291.7
Spiked Cobalt Boots, https://wotlkdb.com/?spell=54918, 5.2, 14.7, 19.9, 135.4
Greater Ward of Shielding, https://wotlkdb.com/?spell=29729, 5.02, 4.98, 10, 200.8
Iridescent Hammer, https://wotlkdb.com/?spell=6518, 4.124, 17.876, 22, 123.1
Tempered Saronite Shoulders, https://wotlkdb.com/?spell=54556, 3.5, 46.5, 50, 107.5
Horned Cobalt Helm, https://wotlkdb.com/?spell=54949, 3.2, 16.8, 20, 119
Runed Copper Pants, https://wotlkdb.com/?spell=3324, 3.1235, 11.8765, 15, 126.3
Spiked Cobalt Legplates, https://wotlkdb.com/?spell=54947, 2.8, 25.2, 28, 111.1
Golden Scale Gauntlets, https://wotlkdb.com/?spell=11643, 1.88, 48.12, 50, 103.9
Golden Rod, https://wotlkdb.com/?spell=14379, 1.714, 1.286, 3, 233.3
Righteous Gauntlets, https://wotlkdb.com/?spell=55300, 1.5, 58.5, 60, 102.6
Thick Bronze Darts, https://wotlkdb.com/?spell=34979, 1.489, 9.731, 11.22, 115.3
Coarse Sharpening Stone, https://wotlkdb.com/?spell=2665, 1.465, 0.015, 1.48, 9866.7
Iron Buckle, https://wotlkdb.com/?spell=8768, 1.455, 0.685, 2.14, 312.4
Fel Iron Plate Gloves, https://wotlkdb.com/?spell=29545, 1.16, 15.84, 17, 107.3
Runed Copper Breastplate, https://wotlkdb.com/?spell=2667, 1.109, 18.891, 20, 105.9
Bronze Shortsword, https://wotlkdb.com/?spell=2742, 1.01, 8.98, 9.99, 111.2
Coarse Weightstone, https://wotlkdb.com/?spell=3116, 0.4375, 0.0625, 0.5, 800
Dense Sharpening Stone, https://wotlkdb.com/?spell=16641, 0.4215, 0.0385, 0.46, 1194.8
Spiked Cobalt Shoulders, https://wotlkdb.com/?spell=54941, 0.3, 14.7, 15, 102
Solid Sharpening Stone, https://wotlkdb.com/?spell=9918, 0.212, 0.088, 0.3, 340.9
Fel Iron Chain Coif, https://wotlkdb.com/?spell=29551, 0.16, 15.84, 16, 101
Rough Sharpening Stone, https://wotlkdb.com/?spell=2660, 0.1441, 0.0049, 0.149, 3040.8
Coarse Grinding Stone, https://wotlkdb.com/?spell=3326, 0.113, 0.03, 0.143, 476.7
Daunting Handguards, https://wotlkdb.com/?spell=55301, 0.0667, 49.8333, 49.9, 100.1
Rough Grinding Stone, https://wotlkdb.com/?spell=3320, -0.0043, 0.0098, 0.0055, 56.1
Rough Weightstone, https://wotlkdb.com/?spell=3115, -0.0057, 0.0066, 0.0009, 13.6
Brilliant Titansteel Treads, https://wotlkdb.com/?spell=55377, -0.0601, 1000.06, 999.9999, 100
Solid Weightstone, https://wotlkdb.com/?spell=9921, -0.1077, 0.1117, 0.004, 3.6
Spiked Cobalt Bracers, https://wotlkdb.com/?spell=54948, -0.2001, 25.2, 24.9999, 99.2
Green Iron Gauntlets, https://wotlkdb.com/?spell=3336, -0.2658, 3.5958, 3.33, 92.6
Solid Grinding Stone, https://wotlkdb.com/?spell=9920, -0.3311, 0.352, 0.0209, 5.9
Titansteel Shanker, https://wotlkdb.com/?spell=56234, -0.37, 1992.37, 1992, 100
Heavy Sharpening Stone, https://wotlkdb.com/?spell=2674, -0.49, 0.99, 0.5, 50.5
Green Iron Shoulders, https://wotlkdb.com/?spell=3504, -0.835, 5.835, 5, 85.7
Fel Iron Casing, https://wotlkdb.com/?spell=30304, -0.93, 11.88, 10.95, 92.2
Heavy Weightstone, https://wotlkdb.com/?spell=3117, -1.0335, 1.0375, 0.004, 0.4
Adamantite Weightstone, https://wotlkdb.com/?spell=34608, -1.6058, 6.6058, 5, 75.7
Fel Iron Plate Pants, https://wotlkdb.com/?spell=29549, -1.68, 31.68, 30, 94.7
Heavy Grinding Stone, https://wotlkdb.com/?spell=3337, -1.94, 2.97, 1.03, 34.7
Copper Bracers, https://wotlkdb.com/?spell=2663, -1.96, 2.96, 1, 33.8
Daunting Legplates, https://wotlkdb.com/?spell=55303, -2.5833, 57.5833, 55, 95.5
Iron Shield Spike, https://wotlkdb.com/?spell=7221, -3.082, 4.682, 1.6, 34.2
Green Iron Bracers, https://wotlkdb.com/?spell=3501, -3.35, 4.12, 0.77, 18.7
Fel Sharpening Stone, https://wotlkdb.com/?spell=29654, -3.66, 4.16, 0.5, 12
Golden Scale Boots, https://wotlkdb.com/?spell=3515, -4.12, 48.12, 44, 91.4
Golden Scale Cuirass, https://wotlkdb.com/?spell=3511, -4.12, 54.12, 50, 92.4
Bronze Warhammer, https://wotlkdb.com/?spell=9985, -4.59, 12.92, 8.33, 64.5
Golden Scale Leggings, https://wotlkdb.com/?spell=3507, -4.88, 9.88, 5, 50.6
Silver Rod, https://wotlkdb.com/?spell=7818, -4.961, 9.961, 5, 50.2
Copper Chain Pants, https://wotlkdb.com/?spell=2662, -5.42, 5.92, 0.5, 8.4
Green Iron Leggings, https://wotlkdb.com/?spell=3506, -5.75, 6.52, 0.77, 11.8
Rough Bronze Bracers, https://wotlkdb.com/?spell=2671, -5.9371, 6, 0.0629, 1
Silvered Bronze Shoulders, https://wotlkdb.com/?spell=3330, -6.196, 32.186, 25.99, 80.7
Rough Bronze Shoulders, https://wotlkdb.com/?spell=3328, -6.643, 7.643, 1, 13.1
Adamantite Sharpening Stone, https://wotlkdb.com/?spell=29656, -6.7, 6.8, 0.1, 1.5
Saronite Sharpening Stone, https://wotlkdb.com/?spell=56307, -6.7, 6.8, 0.1, 1.5
Patterned Bronze Bracers, https://wotlkdb.com/?spell=2672, -6.796, 7.786, 0.99, 12.7
Copper Shortsword, https://wotlkdb.com/?spell=2739, -6.8934, 8.8934, 2, 22.5
Rough Bronze Leggings, https://wotlkdb.com/?spell=2668, -7, 9, 2, 22.2
Rough Bronze Boots, https://wotlkdb.com/?spell=7817, -7.0128, 9.033, 2.0202, 22.4
Golden Scale Shoulders, https://wotlkdb.com/?spell=3505, -7.03, 27.03, 20, 74
Barbaric Iron Shoulders, https://wotlkdb.com/?spell=9811, -7.306, 7.556, 0.25, 3.3
Mighty Iron Hammer, https://wotlkdb.com/?spell=3297, -7.3988, 7.854, 0.4552, 5.8
Rough Bronze Cuirass, https://wotlkdb.com/?spell=2670, -7.5, 10.5, 3, 28.6
Fel Iron Greatsword, https://wotlkdb.com/?spell=29565, -7.82, 47.52, 39.7, 83.5
Copper Axe, https://wotlkdb.com/?spell=2738, -7.8934, 8.8934, 1, 11.2
Heavy Iron Knuckles, https://wotlkdb.com/?spell=25612, -7.9119, 8.48, 0.5681, 6.7
Ornate Saronite Waistguard, https://wotlkdb.com/?spell=56551, -8.5, 58.5, 50, 85.5
Copper Chain Belt, https://wotlkdb.com/?spell=2661, -8.82, 8.88, 0.06, 0.7
Copper Mace, https://wotlkdb.com/?spell=2737, -8.8828, 8.8934, 0.0106, 0.1
Heavy Bronze Mace, https://wotlkdb.com/?spell=3296, -9.0175, 17.0174, 7.9999, 47
Copper Dagger, https://wotlkdb.com/?spell=8880, -9.2355, 9.2655, 0.03, 0.3
Bronze Greatsword, https://wotlkdb.com/?spell=9986, -9.28, 19.84, 10.56, 53.2
Fel Iron Chain Gloves, https://wotlkdb.com/?spell=29552, -9.85, 19.8, 9.95, 50.3
Ornate Saronite Bracers, https://wotlkdb.com/?spell=56549, -10.5, 80.5, 70, 87
Reinforced Cobalt Chestpiece, https://wotlkdb.com/?spell=54981, -10.7008, 18.2, 7.4992, 41.2
Runed Copper Gauntlets, https://wotlkdb.com/?spell=3323, -10.851, 11.851, 1, 8.4
Reinforced Cobalt Legplates, https://wotlkdb.com/?spell=54980, -10.892, 18.2, 7.308, 40.2
Silvered Bronze Boots, https://wotlkdb.com/?spell=3331, -11.236, 19.236, 8, 41.6
Copper Chain Boots, https://wotlkdb.com/?spell=3319, -11.29, 11.84, 0.55, 4.6
Runed Copper Bracers, https://wotlkdb.com/?spell=2664, -11.8165, 14.8165, 3, 20.2
Copper Chain Vest, https://wotlkdb.com/?spell=3321, -11.8368, 11.851, 0.0142, 0.1
Copper Claymore, https://wotlkdb.com/?spell=9983, -12.1955, 15.1955, 3, 19.7
Barbaric Iron Helm, https://wotlkdb.com/?spell=9814, -12.5243, 12.858, 0.3337, 2.6
Fel Iron Breastplate, https://wotlkdb.com/?spell=29550, -12.6, 39.6, 27, 68.2
Bronze Battle Axe, https://wotlkdb.com/?spell=9987, -12.64, 22.64, 10, 44.2
Reinforced Cobalt Helm, https://wotlkdb.com/?spell=54979, -12.8722, 18.2, 5.3278, 29.3
Heavy Copper Maul, https://wotlkdb.com/?spell=7408, -13.52, 18.52, 5, 27
Fel Iron Chain Bracers, https://wotlkdb.com/?spell=29553, -13.76, 23.76, 10, 42.1
Runed Copper Belt, https://wotlkdb.com/?spell=2666, -14.65, 14.8, 0.15, 1
Deadly Bronze Poniard, https://wotlkdb.com/?spell=3295, -14.9429, 15.216, 0.2731, 1.8
Ironforge Gauntlets, https://wotlkdb.com/?spell=8368, -15.8175, 15.932, 0.1145, 0.7
Barbaric Iron Collar, https://wotlkdb.com/?spell=25498, -16.2978, 19.525, 3.2272, 16.5
Fel Iron Chain Tunic, https://wotlkdb.com/?spell=29556, -16.64, 35.64, 19, 53.3
Heavy Copper Broadsword, https://wotlkdb.com/?spell=3292, -16.7, 23.7, 7, 29.5
Mithril Spurs, https://wotlkdb.com/?spell=9964, -17.0627, 32.0627, 15, 46.8
Steel Plate Helm, https://wotlkdb.com/?spell=9935, -17.4495, 57.4495, 40, 69.6
Barbaric Iron Breastplate, https://wotlkdb.com/?spell=9813, -17.4869, 17.82, 0.3331, 1.9
Barbaric Iron Gloves, https://wotlkdb.com/?spell=9820, -18.4089, 18.68, 0.2711, 1.5
Golden Scale Bracers, https://wotlkdb.com/?spell=7223, -20.06, 22.06, 2, 9.1
Elemental Sharpening Stone, https://wotlkdb.com/?spell=22757, -20.3905, 20.5155, 0.125, 0.6
Silvered Bronze Gauntlets, https://wotlkdb.com/?spell=3333, -21.236, 22.236, 1, 4.5
Ironforge Chain, https://wotlkdb.com/?spell=8366, -21.6814, 21.731, 0.0496, 0.2
Barbaric Iron Boots, https://wotlkdb.com/?spell=9818, -21.91, 22.28, 0.37, 1.7
Copper Battle Axe, https://wotlkdb.com/?spell=3293, -22.391, 22.491, 0.1, 0.4
Mithril Shield Spike, https://wotlkdb.com/?spell=9939, -22.9034, 32.9034, 10, 30.4
Blood Tiger Breastplate, https://wotlkdb.com/?spell=24124, -24.0482, 26.7301, 2.6819, 10
Ironforge Breastplate, https://wotlkdb.com/?spell=8367, -25.1294, 25.2165, 0.0871, 0.3
Golden Scale Coif, https://wotlkdb.com/?spell=3503, -29.06, 36.06, 7, 19.4
Huge Thorium Battleaxe, https://wotlkdb.com/?spell=16971, -29.88, 107.88, 78, 72.3
Ornate Saronite Hauberk, https://wotlkdb.com/?spell=56555, -31.5833, 57.5833, 26, 45.2
Glinting Steel Dagger, https://wotlkdb.com/?spell=15972, -33.1014, 53.1014, 20, 37.7
Ironvine Belt, https://wotlkdb.com/?spell=28463, -34.1863, 36.14, 1.9537, 5.4
Thick War Axe, https://wotlkdb.com/?spell=3294, -34.471, 35.471, 1, 2.8
Silvered Bronze Breastplate, https://wotlkdb.com/?spell=2673, -35.0029, 35.186, 0.1831, 0.5
Polished Steel Boots, https://wotlkdb.com/?spell=3513, -35.1539, 35.5476, 0.3937, 1.1
Moonsteel Broadsword, https://wotlkdb.com/?spell=3496, -35.2117, 36.227, 1.0153, 2.8
Titanium Shield Spike, https://wotlkdb.com/?spell=56357, -35.75, 60.75, 25, 41.2
