Name, Link, Profit, Cost, Sell, ROI %
Heavy Copper Longsword, https://wotlkdb.com/?spell=43549, 15275.4716, 23.5284, 15299, 65023.5
Sulfuron Hammer, https://wotlkdb.com/?spell=21161, 13154.4142, 6845.5857, 19999.9999, 292.2
Helm of the Great Chief, https://wotlkdb.com/?spell=16728, 9442.2, 557.8, 10000, 1792.8
Oathkeeper's Helm, https://wotlkdb.com/?spell=29668, 8624.82, 875.18, 9500, 1085.5
Khorium Champion, https://wotlkdb.com/?spell=29693, 6204.2, 3795.8, 10000, 263.4
Nightfall, https://wotlkdb.com/?spell=23653, 6095.7705, 1404.2295, 7500, 534.1
Arcanite Reaper, https://wotlkdb.com/?spell=16994, 5888.1402, 2111.8598, 8000, 378.8
Lionheart Helm, https://wotlkdb.com/?spell=16729, 5464.4, 2035.6, 7500, 368.4
Helm of the Stalwart Defender, https://wotlkdb.com/?spell=29664, 4071.9, 927.1, 4999, 539.2
Frostguard, https://wotlkdb.com/?spell=16992, 4059.5402, 2340.4598, 6400, 273.5
Steelgrip Gauntlets, https://wotlkdb.com/?spell=29662, 3828.1, 1171.9, 5000, 426.7
Enchanted Thorium Breastplate, https://wotlkdb.com/?spell=16745, 3787.2, 1212.8, 5000, 412.3
Black Felsteel Bracers, https://wotlkdb.com/?spell=29669, 3237.7, 262.3, 3500, 1334.3
Dark Iron Gauntlets, https://wotlkdb.com/?spell=23637, 2900.3905, 98.6095, 2999, 3041.3
Blazing Rapier, https://wotlkdb.com/?spell=16978, 2870.5501, 126.4498, 2996.9999, 2370.1
Dark Iron Boots, https://wotlkdb.com/?spell=24399, 2866.4503, 132.5497, 2999, 2262.5
Dark Iron Leggings, https://wotlkdb.com/?spell=20876, 2477.6804, 322.3196, 2800, 868.7
Treads of Destiny, https://wotlkdb.com/?spell=63190, 2260, 3740, 6000, 160.4
Fel Edged Battleaxe, https://wotlkdb.com/?spell=29694, 2208.7, 3021.3, 5230, 173.1
Spiked Deathdealers, https://wotlkdb.com/?spell=63192, 2182, 3740, 5922, 158.3
Felsteel Longblade, https://wotlkdb.com/?spell=29692, 2168.7, 2721.3, 4890, 179.7
Dark Iron Helm, https://wotlkdb.com/?spell=23636, 2139.7802, 82.2198, 2222, 2702.5
Felsteel Reaper, https://wotlkdb.com/?spell=29695, 1908.7, 3021.3, 4930, 163.2
Sunforged Breastplate, https://wotlkdb.com/?spell=67134, 1903.334, 5066.666, 6970, 137.6
Belt of the Titans, https://wotlkdb.com/?spell=63187, 1876, 3740, 5616, 150.2
Radiant Breastplate, https://wotlkdb.com/?spell=16648, 1842.9, 157.1, 2000, 1273.1
Whitesoul Helm, https://wotlkdb.com/?spell=16724, 1739.46, 260.54, 2000, 767.6
Hand of Eternity, https://wotlkdb.com/?spell=29700, 1581.1, 2848.9, 4430, 155.5
Dark Iron Shoulders, https://wotlkdb.com/?spell=15295, 1479.9, 119.1, 1599, 1342.6
Shadesteel Bracers, https://wotlkdb.com/?spell=40034, 1451.56, 48.44, 1500, 3096.6
Shadesteel Sabots, https://wotlkdb.com/?spell=40033, 1447.96, 52.04, 1500, 2882.4
Shadesteel Girdle, https://wotlkdb.com/?spell=40036, 1440.08, 59.92, 1500, 2503.3
Shadesteel Greaves, https://wotlkdb.com/?spell=40035, 1428.6, 71.4, 1500, 2100.8
Enchanted Adamantite Belt, https://wotlkdb.com/?spell=29608, 1335.72, 164.28, 1500, 913.1
Indestructible Plate Girdle, https://wotlkdb.com/?spell=63191, 1285, 3740, 5025, 134.4
Enchanted Adamantite Boots, https://wotlkdb.com/?spell=29611, 1277.38, 222.62, 1500, 673.8
Felsteel Gloves, https://wotlkdb.com/?spell=29619, 1248, 252, 1500, 595.2
Breastplate of the White Knight, https://wotlkdb.com/?spell=67130, 1232.3338, 5766.6662, 6999, 121.4
Felsteel Leggings, https://wotlkdb.com/?spell=29620, 1164, 336, 1500, 446.4
Felsteel Helm, https://wotlkdb.com/?spell=29621, 1164, 336, 1500, 446.4
Enchanted Adamantite Breastplate, https://wotlkdb.com/?spell=29610, 1161.6, 338.4, 1500, 443.3
Enchanted Adamantite Leggings, https://wotlkdb.com/?spell=29613, 1151.76, 348.24, 1500, 430.7
Saronite Swordbreakers, https://wotlkdb.com/?spell=67092, 1121.4, 3379.6, 4501, 133.2
Felfury Gauntlets, https://wotlkdb.com/?spell=29658, 1093.1, 871.9, 1965, 225.4
Titanium Razorplate, https://wotlkdb.com/?spell=67132, 1050.8, 4939.2, 5990, 121.3
Phantom Blade, https://wotlkdb.com/?spell=10007, 936.3, 133.7, 1070, 800.3
Bloodsoul Shoulders, https://wotlkdb.com/?spell=24137, 934.28, 155.72, 1090, 700
Girdle of the Dawn, https://wotlkdb.com/?spell=23632, 933.29, 66.71, 1000, 1499
Pillars of Might, https://wotlkdb.com/?spell=70567, 888.9999, 7775, 8663.9999, 111.4
Bloodsoul Breastplate, https://wotlkdb.com/?spell=24136, 882.6, 207.4, 1090, 525.6
Bloodsoul Gauntlets, https://wotlkdb.com/?spell=24138, 858.36, 231.64, 1090, 470.6
Saronite Swordbreakers, https://wotlkdb.com/?spell=67131, 820.4, 3379.6, 4200, 124.3
Blackguard, https://wotlkdb.com/?spell=23652, 811.8206, 1158.1794, 1970, 170.1
Legplates of Painful Death, https://wotlkdb.com/?spell=70565, 811.0019, 8363.998, 9174.9999, 109.7
Gloves of the Dawn, https://wotlkdb.com/?spell=23633, 802.37, 197.63, 1000, 506
Boots of Kingly Upheaval, https://wotlkdb.com/?spell=70568, 656.4, 5012.1, 5668.5, 113.1
Titanium Spikeguards, https://wotlkdb.com/?spell=67133, 655.1235, 3524.8765, 4180, 118.6
Hellfrozen Bonegrinders, https://wotlkdb.com/?spell=70566, 635.1, 5562.9, 6198, 111.4
Titansteel Destroyer, https://wotlkdb.com/?spell=55369, 514.86, 2699.64, 3214.5, 119.1
Adamantite Breastplate, https://wotlkdb.com/?spell=29606, 470.34, 29.66, 500, 1685.8
Ornate Mithril Gloves, https://wotlkdb.com/?spell=9950, 463.552, 36.448, 500, 1371.8
Ornate Mithril Pants, https://wotlkdb.com/?spell=9945, 456.78, 43.22, 500, 1156.9
Titansteel Bonecrusher, https://wotlkdb.com/?spell=55370, 456.3275, 2069.68, 2526.0075, 122
Ornate Mithril Shoulder, https://wotlkdb.com/?spell=9952, 452.07, 47.93, 500, 1043.2
Icebane Treads, https://wotlkdb.com/?spell=61010, 447.54, 351.46, 799, 227.3
Ornate Mithril Boots, https://wotlkdb.com/?spell=9979, 444.25, 55.75, 500, 896.9
Ornate Mithril Helm, https://wotlkdb.com/?spell=9980, 442.55, 57.45, 500, 870.3
Ornate Mithril Breastplate, https://wotlkdb.com/?spell=9972, 441.33, 58.67, 500, 852.2
Icebane Girdle, https://wotlkdb.com/?spell=61009, 437.2868, 351.46, 788.7468, 224.4
Adamantite Plate Gloves, https://wotlkdb.com/?spell=29605, 421.36, 28.64, 450, 1571.2
Greater Rune of Warding, https://wotlkdb.com/?spell=32285, 410.25, 139.75, 550, 393.6
Tempered Saronite Helm, https://wotlkdb.com/?spell=54555, 404.3265, 60.05, 464.3765, 773.3
Brilliant Saronite Helm, https://wotlkdb.com/?spell=59441, 390.5415, 70.21, 460.7515, 656.2
Radiant Boots, https://wotlkdb.com/?spell=16656, 389.3, 109.7, 499, 454.9
Furious Saronite Beatstick, https://wotlkdb.com/?spell=55182, 388.723, 75.28, 464.003, 616.4
Cudgel of Saronite Justice, https://wotlkdb.com/?spell=56280, 369.1965, 75.68, 444.8765, 587.8
Battlelord's Plate Boots, https://wotlkdb.com/?spell=63188, 360, 3740, 4100, 109.6
Radiant Gloves, https://wotlkdb.com/?spell=16654, 358.3, 140.7, 499, 354.7
Spiked Titansteel Helm, https://wotlkdb.com/?spell=55372, 348.9264, 1349.82, 1698.7464, 125.8
Imperial Plate Chest, https://wotlkdb.com/?spell=16663, 345, 155, 500, 322.6
Imperial Plate Helm, https://wotlkdb.com/?spell=16658, 343.4999, 156.5, 499.9999, 319.5
Radiant Leggings, https://wotlkdb.com/?spell=16725, 342.8, 156.2, 499, 319.5
Smelt Hardened Khorium, https://wotlkdb.com/?spell=46353, 332.2499, 467.75, 799.9999, 171
Searing Golden Blade, https://wotlkdb.com/?spell=15973, 323.26, 26.74, 350, 1308.9
Heavy Mithril Pants, https://wotlkdb.com/?spell=9933, 298.75, 35, 333.75, 953.6
Imperial Plate Shoulders, https://wotlkdb.com/?spell=16646, 298.22, 105.78, 404, 381.9
Protectors of Life, https://wotlkdb.com/?spell=70563, 287.9, 5012.1, 5300, 105.7
Adamantite Plate Bracers, https://wotlkdb.com/?spell=29603, 284.4199, 15.58, 299.9999, 1925.5
Righteous Gauntlets, https://wotlkdb.com/?spell=55300, 279.3662, 69.76, 349.1262, 500.5
Gemmed Copper Gauntlets, https://wotlkdb.com/?spell=3325, 279.15, 20.85, 300, 1438.8
Tempered Titansteel Helm, https://wotlkdb.com/?spell=55373, 278.9264, 1349.82, 1628.7464, 120.7
Righteous Greaves, https://wotlkdb.com/?spell=55304, 269.655, 79.72, 349.375, 438.3
Imperial Plate Boots, https://wotlkdb.com/?spell=16657, 265.5, 139.5, 405, 290.3
Brilliant Titansteel Helm, https://wotlkdb.com/?spell=55374, 250.18, 1349.82, 1600, 118.5
Shining Silver Breastplate, https://wotlkdb.com/?spell=2675, 233.782, 66.218, 300, 453
Titansteel Guardian, https://wotlkdb.com/?spell=55371, 230.32, 2069.68, 2300, 111.1
Imperial Plate Leggings, https://wotlkdb.com/?spell=16730, 218, 186, 404, 217.2
Heavy Mithril Helm, https://wotlkdb.com/?spell=9970, 204.5, 50.5, 255, 505
Savage Saronite Waistguard, https://wotlkdb.com/?spell=55307, 188.7429, 69.76, 258.5029, 370.6
Savage Saronite Gauntlets, https://wotlkdb.com/?spell=55309, 188.3484, 150.66, 339.0084, 225
Tempered Saronite Bracers, https://wotlkdb.com/?spell=55017, 184.8865, 64.74, 249.6265, 385.6
Saronite Bulwark, https://wotlkdb.com/?spell=55014, 180.9065, 69.72, 250.6265, 359.5
Spiked Cobalt Bracers, https://wotlkdb.com/?spell=54948, 174.6764, 25.2, 199.8764, 793.2
Adamantite Maul, https://wotlkdb.com/?spell=29566, 173.16, 11.84, 185, 1562.5
Brilliant Saronite Pauldrons, https://wotlkdb.com/?spell=59440, 172.1165, 59.76, 231.8765, 388
Honed Cobalt Cleaver, https://wotlkdb.com/?spell=55174, 169.2008, 60.6754, 229.8762, 378.9
Tempered Saronite Gauntlets, https://wotlkdb.com/?spell=55015, 164.9065, 69.72, 234.6265, 336.5
Tempered Titansteel Treads, https://wotlkdb.com/?spell=55376, 160.18, 1039.82, 1200, 115.4
Saronite Spellblade, https://wotlkdb.com/?spell=59442, 159.4946, 90.2554, 249.75, 276.7
Titansteel Shield Wall, https://wotlkdb.com/?spell=56400, 159.18, 1039.82, 1199, 115.3
Savage Saronite Walkers, https://wotlkdb.com/?spell=55308, 155.9901, 93.7599, 249.75, 266.4
Repair the Blade of Heroes, https://wotlkdb.com/?spell=11923, 154.2938, 14.7062, 169, 1149.2
Brilliant Saronite Gauntlets, https://wotlkdb.com/?spell=55056, 153.985, 46.14, 200.125, 433.7
Titansteel Shanker, https://wotlkdb.com/?spell=56234, 153.32, 2069.68, 2223, 107.4
Savage Cobalt Slicer, https://wotlkdb.com/?spell=55177, 147.2673, 62.2354, 209.5027, 336.6
Titansteel Spellblade, https://wotlkdb.com/?spell=63182, 147.2, 2051.8, 2199, 107.2
Truesilver Gauntlets, https://wotlkdb.com/?spell=9954, 139.8, 49.2, 189, 384.1
Imperial Plate Belt, https://wotlkdb.com/?spell=16647, 135.47, 90.28, 225.75, 250.1
Icebane Chestguard, https://wotlkdb.com/?spell=61008, 127.5965, 472.28, 599.8765, 127
Tempered Saronite Legplates, https://wotlkdb.com/?spell=54554, 124.1865, 35.69, 159.8765, 448
Brilliant Saronite Boots, https://wotlkdb.com/?spell=55057, 119.9929, 59.76, 179.7529, 300.8
Sturdy Cobalt Quickblade, https://wotlkdb.com/?spell=55200, 118.0765, 16.8, 134.8765, 802.8
Helm of Command, https://wotlkdb.com/?spell=55302, 114.8065, 160.62, 275.4265, 171.5
Savage Saronite Legplates, https://wotlkdb.com/?spell=55310, 112.4068, 107.22, 219.6268, 204.8
Bronze Greatsword, https://wotlkdb.com/?spell=9986, 111.67, 14.08, 125.75, 893.1
Ironvine Breastplate, https://wotlkdb.com/?spell=28461, 108.069, 224.931, 333, 148
Savage Saronite Bracers, https://wotlkdb.com/?spell=55305, 102.4928, 97.26, 199.7528, 205.4
Ornate Saronite Gauntlets, https://wotlkdb.com/?spell=56553, 100.8951, 150.66, 251.5551, 167
Saronite Defender, https://wotlkdb.com/?spell=54557, 99.23, 32.52, 131.75, 405.1
Vengeance Bindings, https://wotlkdb.com/?spell=55298, 94.2165, 150.66, 244.8765, 162.5
Adamantite Rapier, https://wotlkdb.com/?spell=29571, 82.24, 17.76, 100, 563.1
Ornate Saronite Legplates, https://wotlkdb.com/?spell=56554, 81.4068, 107.22, 188.6268, 175.9
Ornate Saronite Waistguard, https://wotlkdb.com/?spell=56551, 80.2148, 69.76, 149.9748, 215
Ornate Saronite Pauldrons, https://wotlkdb.com/?spell=56550, 79.3665, 69.76, 149.1265, 213.8
Adamantite Rod, https://wotlkdb.com/?spell=32656, 79.1999, 14.8, 93.9999, 635.1
Savage Saronite Pauldrons, https://wotlkdb.com/?spell=55306, 75.6665, 69.76, 145.4265, 208.5
Fel Iron Hammer, https://wotlkdb.com/?spell=29558, 69.1, 29.9, 99, 331.1
Tempered Saronite Belt, https://wotlkdb.com/?spell=54551, 62.5, 37.5, 100, 266.7
Ragesteel Gloves, https://wotlkdb.com/?spell=29642, 62.33, 452.67, 515, 113.8
Frost Tiger Blade, https://wotlkdb.com/?spell=3497, 58, 42, 100, 238.1
Savage Saronite Skullshield, https://wotlkdb.com/?spell=55312, 56.1569, 103.7199, 159.8768, 154.1
Tempered Saronite Boots, https://wotlkdb.com/?spell=54552, 53.86, 46.14, 100, 216.7
Saronite Ambusher, https://wotlkdb.com/?spell=55179, 53.7564, 46.12, 99.8764, 216.6
Enchanted Thorium Blades, https://wotlkdb.com/?spell=34982, 53.37, 56.63, 110, 194.2
Massive Iron Axe, https://wotlkdb.com/?spell=3498, 52.65, 17.35, 70, 403.5
Savage Saronite Hauberk, https://wotlkdb.com/?spell=55311, 51.6064, 74.27, 125.8764, 169.5
Eternium Rod, https://wotlkdb.com/?spell=32657, 50.08, 19.92, 70, 351.4
Titanium Plating, https://wotlkdb.com/?spell=62202, 49.2769, 355.5996, 404.8765, 113.9
Adamantite Cleaver, https://wotlkdb.com/?spell=29568, 48.16, 11.84, 60, 506.8
Fel Iron Rod, https://wotlkdb.com/?spell=32655, 47.56, 17.94, 65.5, 365.1
Tempered Saronite Breastplate, https://wotlkdb.com/?spell=54553, 47.0865, 37.79, 84.8765, 224.6
Ornate Saronite Skullshield, https://wotlkdb.com/?spell=56556, 45.2791, 103.7199, 148.999, 143.7
Golden Iron Destroyer, https://wotlkdb.com/?spell=3495, 45.272, 14.728, 60, 407.4
Daunting Legplates, https://wotlkdb.com/?spell=55303, 44.6065, 74.27, 118.8765, 160.1
Spiked Cobalt Helm, https://wotlkdb.com/?spell=54917, 40.0765, 14.7, 54.7765, 372.6
Saronite Shiv, https://wotlkdb.com/?spell=55181, 37.14, 61.76, 98.9, 160.1
Saronite Protector, https://wotlkdb.com/?spell=55013, 36.28, 32.52, 68.8, 211.6
Cobalt Helm, https://wotlkdb.com/?spell=52571, 35.1765, 10.5, 45.6765, 435
Brilliant Saronite Belt, https://wotlkdb.com/?spell=59436, 34.1765, 37.5, 71.6765, 191.1
Reinforced Cobalt Shoulders, https://wotlkdb.com/?spell=54978, 32.22, 17.78, 50, 281.2
Eternal Belt Buckle, https://wotlkdb.com/?spell=55656, 31.4301, 68.4699, 99.9, 145.9
Ornate Saronite Walkers, https://wotlkdb.com/?spell=56552, 31.1166, 93.7599, 124.8765, 133.2
Hardened Iron Shortsword, https://wotlkdb.com/?spell=3492, 30.752, 7.248, 38, 524.3
Steel Weapon Chain, https://wotlkdb.com/?spell=7224, 29.8643, 20.18, 50.0443, 248
Heavy Mithril Shoulder, https://wotlkdb.com/?spell=9926, 28.82, 31.18, 60, 192.4
Forged Cobalt Claymore, https://wotlkdb.com/?spell=55203, 28.8, 21, 49.8, 237.1
Jade Serpentblade, https://wotlkdb.com/?spell=3493, 28.47, 21.53, 50, 232.2
Solid Iron Maul, https://wotlkdb.com/?spell=3494, 28.18, 47.77, 75.95, 159
Arcanite Rod, https://wotlkdb.com/?spell=20201, 26.5201, 288.2299, 314.75, 109.2
Cobalt Legplates, https://wotlkdb.com/?spell=52567, 26.5, 10.5, 37, 352.4
Spiked Cobalt Gauntlets, https://wotlkdb.com/?spell=54945, 25.6765, 25.2, 50.8765, 201.9
Daunting Handguards, https://wotlkdb.com/?spell=55301, 24.59, 64.31, 88.9, 138.2
Spiked Cobalt Belt, https://wotlkdb.com/?spell=54946, 24.5765, 25.2, 49.7765, 197.5
Brilliant Saronite Bracers, https://wotlkdb.com/?spell=59438, 23.6599, 46.14, 69.7999, 151.3
Cobalt Bracers, https://wotlkdb.com/?spell=55834, 23.4765, 8.4, 31.8765, 379.5
Fel Iron Hatchet, https://wotlkdb.com/?spell=29557, 23.09, 26.91, 50, 185.8
Cobalt Chestpiece, https://wotlkdb.com/?spell=52570, 22.0765, 12.6, 34.6765, 275.2
Golden Scale Gauntlets, https://wotlkdb.com/?spell=11643, 21.64, 28.36, 50, 176.3
Cobalt Triangle Shield, https://wotlkdb.com/?spell=54550, 21.4765, 8.4, 29.8765, 355.7
Blue Glittering Axe, https://wotlkdb.com/?spell=9995, 21.21, 63.79, 85, 133.2
Deadly Saronite Dirk, https://wotlkdb.com/?spell=55206, 19.9402, 39.8598, 59.8, 150
Golden Scale Cuirass, https://wotlkdb.com/?spell=3511, 19.76, 30.24, 50, 165.3
Cobalt Tenderizer, https://wotlkdb.com/?spell=55201, 19.2, 16.8, 36, 214.3
Brilliant Saronite Legplates, https://wotlkdb.com/?spell=55055, 19.11, 35.89, 55, 153.2
Whirling Steel Axes, https://wotlkdb.com/?spell=34981, 18.61, 13.39, 32, 239
Cobalt Belt, https://wotlkdb.com/?spell=52568, 18.0524, 8.4, 26.4524, 314.9
Thick Bronze Darts, https://wotlkdb.com/?spell=34979, 18.0216, 6.9784, 25, 358.2
Cobalt Shoulders, https://wotlkdb.com/?spell=52572, 16.4765, 8.4, 24.8765, 296.1
Cobalt Boots, https://wotlkdb.com/?spell=52569, 16.0765, 8.4, 24.4765, 291.4
Golden Scale Boots, https://wotlkdb.com/?spell=3515, 15.64, 28.36, 44, 155.1
Green Iron Boots, https://wotlkdb.com/?spell=3334, 15.48, 4.52, 20, 442.5
Sure-fire Shuriken, https://wotlkdb.com/?spell=55202, 15.3, 14.7, 30, 204.1
Fel Iron Greatsword, https://wotlkdb.com/?spell=29565, 14.12, 35.88, 50, 139.4
Pearl-handled Dagger, https://wotlkdb.com/?spell=6517, 13.812, 7.188, 21, 292.2
Spiked Cobalt Chestpiece, https://wotlkdb.com/?spell=54944, 13.19, 16.8, 29.99, 178.5
Fel Iron Plate Belt, https://wotlkdb.com/?spell=29547, 13.04, 11.96, 25, 209
Bronze Mace, https://wotlkdb.com/?spell=2740, 12.12, 6.88, 19, 276.2
Heavy Bronze Mace, https://wotlkdb.com/?spell=3296, 11.68, 13.32, 25, 187.7
Bronze Axe, https://wotlkdb.com/?spell=2741, 11.1, 7.9, 19, 240.5
Notched Cobalt War Axe, https://wotlkdb.com/?spell=55204, 10.8, 21, 31.8, 151.4
Brilliant Saronite Breastplate, https://wotlkdb.com/?spell=55058, 10.4412, 70.21, 80.6512, 114.9
Titanium Rod, https://wotlkdb.com/?spell=55732, 10.14, 64.86, 75, 115.6
Big Bronze Knife, https://wotlkdb.com/?spell=3491, 9.9916, 8.0084, 18, 224.8
Tempered Saronite Shoulders, https://wotlkdb.com/?spell=54556, 9.2004, 59.76, 68.9604, 115.4
Bronze Shortsword, https://wotlkdb.com/?spell=2742, 9.12, 6.58, 15.7, 238.6
Iridescent Hammer, https://wotlkdb.com/?spell=6518, 8.81, 13.19, 22, 166.8
Truesilver Rod, https://wotlkdb.com/?spell=14380, 8.74, 1.26, 10, 793.7
Fel Iron Plate Gloves, https://wotlkdb.com/?spell=29545, 8.09, 11.96, 20.05, 167.6
Titanium Weapon Chain, https://wotlkdb.com/?spell=55839, 8.0668, 64.86, 72.9268, 112.4
Fel Iron Plate Boots, https://wotlkdb.com/?spell=29548, 7.06, 17.94, 25, 139.4
Green Iron Helm, https://wotlkdb.com/?spell=3502, 6.77, 9.23, 16, 173.3
Fel Iron Plate Pants, https://wotlkdb.com/?spell=29549, 6.08, 23.92, 30, 125.4
Mithril Spurs, https://wotlkdb.com/?spell=9964, 5.93, 16.97, 22.9, 134.9
Iron Counterweight, https://wotlkdb.com/?spell=7222, 5.801, 3.199, 9, 281.3
Cobalt Gauntlets, https://wotlkdb.com/?spell=55835, 5.5, 10.5, 16, 152.4
Spiked Cobalt Boots, https://wotlkdb.com/?spell=54918, 5.2631, 14.7, 19.9631, 135.8
Fel Iron Breastplate, https://wotlkdb.com/?spell=29550, 5.1, 29.9, 35, 117.1
Greater Ward of Shielding, https://wotlkdb.com/?spell=29729, 5.02, 4.98, 10, 200.8
Golden Scale Shoulders, https://wotlkdb.com/?spell=3505, 4.85, 15.15, 20, 132
Fel Iron Chain Coif, https://wotlkdb.com/?spell=29551, 4.04, 11.96, 16, 133.8
Adamantite Weightstone, https://wotlkdb.com/?spell=34608, 3.3866, 1.6134, 5, 309.9
Fel Iron Casing, https://wotlkdb.com/?spell=30304, 3.23, 8.97, 12.2, 136
Spiked Cobalt Legplates, https://wotlkdb.com/?spell=54947, 2.1, 25.2, 27.3, 108.3
Bronze Warhammer, https://wotlkdb.com/?spell=9985, 1.9199, 9.08, 10.9999, 121.1
Steel Plate Helm, https://wotlkdb.com/?spell=9935, 1.01, 29.99, 31, 103.4
Solid Grinding Stone, https://wotlkdb.com/?spell=9920, 0.79, 0.2, 0.99, 495
Golden Rod, https://wotlkdb.com/?spell=14379, 0.54, 1.46, 2, 137
Coarse Weightstone, https://wotlkdb.com/?spell=3116, 0.4511, 0.0489, 0.5, 1022.5
Iron Buckle, https://wotlkdb.com/?spell=8768, 0.3149, 0.685, 0.9999, 146
Solid Sharpening Stone, https://wotlkdb.com/?spell=9918, 0.25, 0.05, 0.3, 600
Coarse Grinding Stone, https://wotlkdb.com/?spell=3326, 0.1972, 0.0028, 0.2, 7142.9
Coarse Sharpening Stone, https://wotlkdb.com/?spell=2665, 0.1645, 0.0014, 0.1659, 11850
Rough Sharpening Stone, https://wotlkdb.com/?spell=2660, 0.1451, 0.0039, 0.149, 3820.5
Dense Sharpening Stone, https://wotlkdb.com/?spell=16641, 0.1101, 0.0399, 0.15, 375.9
Rough Grinding Stone, https://wotlkdb.com/?spell=3320, 0.0614, 0.0078, 0.0692, 887.2
Rough Weightstone, https://wotlkdb.com/?spell=3115, -0.0047, 0.0056, 0.0009, 16.1
Solid Weightstone, https://wotlkdb.com/?spell=9921, -0.0647, 0.0687, 0.004, 5.8
Green Iron Gauntlets, https://wotlkdb.com/?spell=3336, -0.288, 3.618, 3.33, 92
Truesilver Breastplate, https://wotlkdb.com/?spell=9974, -0.74, 100.74, 100, 99.3
Green Iron Shoulders, https://wotlkdb.com/?spell=3504, -0.835, 5.835, 5, 85.7
Heavy Sharpening Stone, https://wotlkdb.com/?spell=2674, -0.93, 0.98, 0.05, 5.1
Heavy Weightstone, https://wotlkdb.com/?spell=3117, -1.0235, 1.0275, 0.004, 0.4
Horned Cobalt Helm, https://wotlkdb.com/?spell=54949, -1.8, 16.8, 15, 89.3
Heavy Grinding Stone, https://wotlkdb.com/?spell=3337, -1.91, 2.94, 1.03, 35
Adamantite Sharpening Stone, https://wotlkdb.com/?spell=29656, -2.24, 2.34, 0.1, 4.3
Saronite Sharpening Stone, https://wotlkdb.com/?spell=56307, -2.24, 2.34, 0.1, 4.3
Silvered Bronze Shoulders, https://wotlkdb.com/?spell=3330, -2.47, 28.46, 25.99, 91.3
Fel Sharpening Stone, https://wotlkdb.com/?spell=29654, -2.82, 3.42, 0.6, 17.5
Fel Iron Chain Bracers, https://wotlkdb.com/?spell=29553, -2.94, 17.94, 15, 83.6
Runed Copper Pants, https://wotlkdb.com/?spell=3324, -3.1476, 18.1476, 15, 82.7
Iron Shield Spike, https://wotlkdb.com/?spell=7221, -3.31, 4.91, 1.6, 32.6
Green Iron Bracers, https://wotlkdb.com/?spell=3501, -3.35, 4.12, 0.77, 18.7
Rough Bronze Shoulders, https://wotlkdb.com/?spell=3328, -3.4, 5.3, 1.9, 35.8
Copper Bracers, https://wotlkdb.com/?spell=2663, -3.48, 4.48, 1, 22.3
Rough Bronze Bracers, https://wotlkdb.com/?spell=2671, -4.0171, 4.08, 0.0629, 1.5
Rough Bronze Leggings, https://wotlkdb.com/?spell=2668, -4.12, 6.12, 2, 32.7
Rough Bronze Cuirass, https://wotlkdb.com/?spell=2670, -4.14, 7.14, 3, 42
Patterned Bronze Bracers, https://wotlkdb.com/?spell=2672, -4.5, 5.5, 1, 18.2
Rough Bronze Boots, https://wotlkdb.com/?spell=7817, -4.515, 6.5352, 2.0202, 30.9
Fel Iron Chain Gloves, https://wotlkdb.com/?spell=29552, -4.95, 14.95, 10, 66.9
Golden Scale Leggings, https://wotlkdb.com/?spell=3507, -5, 10, 5, 50
Silver Rod, https://wotlkdb.com/?spell=7818, -5.0884, 10.0884, 5, 49.6
Spiked Cobalt Shoulders, https://wotlkdb.com/?spell=54941, -5.7, 14.7, 9, 61.2
Green Iron Leggings, https://wotlkdb.com/?spell=3506, -5.75, 6.52, 0.77, 11.8
Bronze Battle Axe, https://wotlkdb.com/?spell=9987, -5.92, 15.92, 10, 62.8
Heavy Iron Knuckles, https://wotlkdb.com/?spell=25612, -6.9119, 7.48, 0.5681, 7.6
Mighty Iron Hammer, https://wotlkdb.com/?spell=3297, -7.0128, 7.468, 0.4552, 6.1
Barbaric Iron Shoulders, https://wotlkdb.com/?spell=9811, -7.306, 7.556, 0.25, 3.3
Mithril Shield Spike, https://wotlkdb.com/?spell=9939, -8.42, 18.42, 10, 54.3
Silvered Bronze Boots, https://wotlkdb.com/?spell=3331, -8.47, 16.47, 8, 48.6
Copper Chain Pants, https://wotlkdb.com/?spell=2662, -8.94, 8.96, 0.02, 0.2
Golden Scale Bracers, https://wotlkdb.com/?spell=7223, -9.56, 12.06, 2.5, 20.7
Golden Scale Coif, https://wotlkdb.com/?spell=3503, -10.18, 20.18, 10, 49.6
Reinforced Cobalt Chestpiece, https://wotlkdb.com/?spell=54981, -10.2808, 17.78, 7.4992, 42.2
Reinforced Cobalt Legplates, https://wotlkdb.com/?spell=54980, -10.472, 17.78, 7.308, 41.1
Dazzling Mithril Rapier, https://wotlkdb.com/?spell=10005, -10.684, 55.684, 45, 80.8
Adamantite Dagger, https://wotlkdb.com/?spell=29569, -11.0236, 17.86, 6.8364, 38.3
Copper Shortsword, https://wotlkdb.com/?spell=2739, -11.4534, 13.4534, 2, 14.9
Fel Iron Chain Tunic, https://wotlkdb.com/?spell=29556, -11.91, 26.91, 15, 55.7
Ironforge Gauntlets, https://wotlkdb.com/?spell=8368, -12.2055, 12.32, 0.1145, 0.9
Reinforced Cobalt Helm, https://wotlkdb.com/?spell=54979, -12.4522, 17.78, 5.3278, 30
Copper Axe, https://wotlkdb.com/?spell=2738, -12.4534, 13.4534, 1, 7.4
Barbaric Iron Helm, https://wotlkdb.com/?spell=9814, -12.5243, 12.858, 0.3337, 2.6
Glinting Steel Dagger, https://wotlkdb.com/?spell=15972, -12.93, 32.93, 20, 60.7
Copper Chain Belt, https://wotlkdb.com/?spell=2661, -13.38, 13.44, 0.06, 0.4
Copper Mace, https://wotlkdb.com/?spell=2737, -13.4428, 13.4534, 0.0106, 0.1
Copper Dagger, https://wotlkdb.com/?spell=8880, -13.8792, 13.9092, 0.03, 0.2
Heavy Mithril Boots, https://wotlkdb.com/?spell=9968, -14.8, 52.8, 38, 72
Runed Copper Gauntlets, https://wotlkdb.com/?spell=3323, -16.0584, 18.0584, 2, 11.1
Heavy Mithril Gauntlet, https://wotlkdb.com/?spell=9928, -16.152, 21.152, 5, 23.6
Heavy Earthforged Breastplate, https://wotlkdb.com/?spell=36129, -17.0803, 22.24, 5.1597, 23.2
Heavy Mithril Axe, https://wotlkdb.com/?spell=9993, -17.11, 47.11, 30, 63.7
Steel Breastplate, https://wotlkdb.com/?spell=9916, -17.31, 35.09, 17.78, 50.7
Copper Chain Boots, https://wotlkdb.com/?spell=3319, -17.37, 17.92, 0.55, 3.1
Barbaric Iron Breastplate, https://wotlkdb.com/?spell=9813, -17.4869, 17.82, 0.3331, 1.9
Silvered Bronze Gauntlets, https://wotlkdb.com/?spell=3333, -17.51, 18.51, 1, 5.4
Blood Tiger Breastplate, https://wotlkdb.com/?spell=24124, -17.8181, 20.5, 2.6819, 13.1
Deadly Bronze Poniard, https://wotlkdb.com/?spell=3295, -17.9869, 18.26, 0.2731, 1.5
Copper Chain Vest, https://wotlkdb.com/?spell=3321, -18.0442, 18.0584, 0.0142, 0.1
Barbaric Iron Gloves, https://wotlkdb.com/?spell=9820, -18.4089, 18.68, 0.2711, 1.5
Polished Steel Boots, https://wotlkdb.com/?spell=3513, -18.7253, 19.119, 0.3937, 2.1
Moonsteel Broadsword, https://wotlkdb.com/?spell=3496, -19.2117, 20.227, 1.0153, 5
Ornate Saronite Hauberk, https://wotlkdb.com/?spell=56555, -19.27, 74.27, 55, 74.1
Barbaric Iron Collar, https://wotlkdb.com/?spell=25498, -19.6, 22.58, 2.98, 13.2
Runed Copper Bracers, https://wotlkdb.com/?spell=2664, -19.6076, 22.6076, 3, 13.3
Copper Claymore, https://wotlkdb.com/?spell=9983, -19.8792, 22.8792, 3, 13.1
Elemental Sharpening Stone, https://wotlkdb.com/?spell=22757, -19.9947, 20.1197, 0.125, 0.6
Heavy Mithril Breastplate, https://wotlkdb.com/?spell=9959, -21, 56, 35, 62.5
Runed Copper Belt, https://wotlkdb.com/?spell=2666, -21.4, 22.4, 1, 4.5
Barbaric Iron Boots, https://wotlkdb.com/?spell=9818, -21.91, 22.28, 0.37, 1.7
Heavy Copper Maul, https://wotlkdb.com/?spell=7408, -22.68, 27.68, 5, 18.1
Ironvine Belt, https://wotlkdb.com/?spell=28463, -22.9773, 24.931, 1.9537, 7.8
Mithril Scale Bracers, https://wotlkdb.com/?spell=9937, -23, 28, 5, 17.9
