Name, Link, Profit, Cost, Sell, ROI %
Belt of the Guardian, https://wotlkdb.com/?spell=36389, 14448.14, 551.36, 14999.5, 2720.5
Helm of the Great Chief, https://wotlkdb.com/?spell=16728, 9563.48, 436.52, 10000, 2290.8
Sageblade, https://wotlkdb.com/?spell=27832, 9145.2, 1354.8, 10500, 775
Red Belt of Battle, https://wotlkdb.com/?spell=36390, 9104.4731, 212.06, 9316.5331, 4393.3
Nightfall, https://wotlkdb.com/?spell=23653, 4456.12, 1341.88, 5798, 432.1
Dark Iron Mail, https://wotlkdb.com/?spell=15293, 3921.101, 78.899, 4000, 5069.8
Sulfuron Hammer, https://wotlkdb.com/?spell=21161, 3873.65, 6126.35, 10000, 163.2
Frostguard, https://wotlkdb.com/?spell=16992, 3761.6004, 2538.3996, 6300, 248.2
Heavy Copper Longsword, https://wotlkdb.com/?spell=43549, 3289.49, 10.51, 3300, 31398.7
Flamebane Breastplate, https://wotlkdb.com/?spell=29617, 2733.76, 266.24, 3000, 1126.8
Felsteel Longblade, https://wotlkdb.com/?spell=29692, 2611.6, 2788.4, 5400, 193.7
Dark Iron Helm, https://wotlkdb.com/?spell=23636, 2464.76, 35.24, 2500, 7094.2
Dark Iron Reaver, https://wotlkdb.com/?spell=20890, 2400.6, 199.4, 2600, 1303.9
Spiked Deathdealers, https://wotlkdb.com/?spell=63192, 2276.25, 3723.75, 6000, 161.1
Indestructible Plate Girdle, https://wotlkdb.com/?spell=63191, 2126.2487, 3723.75, 5849.9987, 157.1
Annihilator, https://wotlkdb.com/?spell=16991, 1960.5, 2039.5, 4000, 196.1
Shadesteel Bracers, https://wotlkdb.com/?spell=40034, 1937.26, 62.74, 2000, 3187.8
Shadesteel Sabots, https://wotlkdb.com/?spell=40033, 1934.02, 65.98, 2000, 3031.2
Dark Iron Gauntlets, https://wotlkdb.com/?spell=23637, 1920.42, 79.58, 2000, 2513.2
Shadesteel Girdle, https://wotlkdb.com/?spell=40036, 1905.02, 94.98, 2000, 2105.7
Shadesteel Greaves, https://wotlkdb.com/?spell=40035, 1872.78, 127.22, 2000, 1572.1
Sunforged Breastplate, https://wotlkdb.com/?spell=67095, 1831.7, 4995.3, 6827, 136.7
Steelgrip Gauntlets, https://wotlkdb.com/?spell=29662, 1806.55, 1192.45, 2999, 251.5
Whitesoul Helm, https://wotlkdb.com/?spell=16724, 1795.2972, 204.7028, 2000, 977
Dark Iron Destroyer, https://wotlkdb.com/?spell=20897, 1791.38, 208.62, 2000, 958.7
Helm of the Stalwart Defender, https://wotlkdb.com/?spell=29664, 1698.84, 800.16, 2499, 312.3
Protectors of Life, https://wotlkdb.com/?spell=70563, 1630.82, 4863.18, 6494, 133.5
Battlelord's Plate Boots, https://wotlkdb.com/?spell=63188, 1520.25, 3723.75, 5244, 140.8
Enchanted Adamantite Belt, https://wotlkdb.com/?spell=29608, 1348.4, 151.6, 1500, 989.4
Enchanted Adamantite Boots, https://wotlkdb.com/?spell=29611, 1295.5, 204.5, 1500, 733.5
Belt of the Titans, https://wotlkdb.com/?spell=63187, 1275.25, 3723.75, 4999, 134.2
Enchanted Adamantite Breastplate, https://wotlkdb.com/?spell=29610, 1183.6, 316.4, 1500, 474.1
Enchanted Adamantite Leggings, https://wotlkdb.com/?spell=29613, 1170.4, 329.6, 1500, 455.1
Puresteel Legplates, https://wotlkdb.com/?spell=70562, 1156, 8061, 9217, 114.3
Legplates of Painful Death, https://wotlkdb.com/?spell=70565, 1018, 7969, 8987, 112.8
Boots of Kingly Upheaval, https://wotlkdb.com/?spell=70568, 968.82, 4863.18, 5832, 119.9
Pillars of Might, https://wotlkdb.com/?spell=70567, 940.2, 7553.8, 8494, 112.4
Breastplate of the White Knight, https://wotlkdb.com/?spell=67091, 906.58, 5692.42, 6599, 115.9
Truesilver Gauntlets, https://wotlkdb.com/?spell=9954, 892.1567, 107.6833, 999.84, 928.5
Wicked Mithril Blade, https://wotlkdb.com/?spell=9997, 870.5948, 129.4052, 1000, 772.8
Hellfrozen Bonegrinders, https://wotlkdb.com/?spell=70566, 849.1, 5337.9, 6187, 115.9
Dazzling Mithril Rapier, https://wotlkdb.com/?spell=10005, 844.07, 131.93, 976, 739.8
Blazing Rapier, https://wotlkdb.com/?spell=16978, 835.642, 164.358, 1000, 608.4
Titanium Razorplate, https://wotlkdb.com/?spell=67093, 783.5004, 4975.4996, 5759, 115.7
Titanium Spikeguards, https://wotlkdb.com/?spell=67094, 741.0202, 3546.9797, 4287.9999, 120.9
Dark Iron Sunderer, https://wotlkdb.com/?spell=15294, 692.102, 204.898, 897, 437.8
Titansteel Spellblade, https://wotlkdb.com/?spell=63182, 683.0599, 1868.94, 2551.9999, 136.5
Saronite Swordbreakers, https://wotlkdb.com/?spell=67092, 663, 3314, 3977, 120
Phantom Blade, https://wotlkdb.com/?spell=10007, 516.5696, 283.4304, 800, 282.3
Tempered Titansteel Helm, https://wotlkdb.com/?spell=55373, 449.9999, 1235, 1684.9999, 136.4
Black Dragonscale Breastplate, https://wotlkdb.com/?spell=19085, 437.65, 112.35, 550, 489.5
Ornate Mithril Gloves, https://wotlkdb.com/?spell=9950, 408.6562, 91.3438, 500, 547.4
Icebane Treads, https://wotlkdb.com/?spell=61010, 393.1999, 296.8, 689.9999, 232.5
Ornate Mithril Pants, https://wotlkdb.com/?spell=9945, 391.6162, 108.3838, 500, 461.3
Ornate Mithril Shoulder, https://wotlkdb.com/?spell=9952, 388.6662, 111.3338, 500, 449.1
Ornate Mithril Boots, https://wotlkdb.com/?spell=9979, 369.0024, 130.9976, 500, 381.7
Icebane Chestguard, https://wotlkdb.com/?spell=61008, 354.7999, 405.2, 759.9999, 187.6
Titansteel Guardian, https://wotlkdb.com/?spell=55371, 349.4999, 1882.5, 2231.9999, 118.6
Green Iron Gauntlets, https://wotlkdb.com/?spell=3336, 329.5442, 3.4558, 333, 9636
Icebane Girdle, https://wotlkdb.com/?spell=61009, 316.1999, 296.8, 612.9999, 206.5
Ornate Mithril Helm, https://wotlkdb.com/?spell=9980, 305.7924, 144.9576, 450.75, 311
Ornate Mithril Breastplate, https://wotlkdb.com/?spell=9972, 302.8177, 147.9323, 450.75, 304.7
Saronite Ambusher, https://wotlkdb.com/?spell=55179, 297.3333, 51.6667, 349, 675.5
Spiked Titansteel Helm, https://wotlkdb.com/?spell=55372, 296, 1235, 1531, 124
Treads of Destiny, https://wotlkdb.com/?spell=63190, 276.24, 3723.75, 3999.99, 107.4
Searing Golden Blade, https://wotlkdb.com/?spell=15973, 272.9195, 43.08, 315.9995, 733.5
Cudgel of Saronite Justice, https://wotlkdb.com/?spell=56280, 251.6699, 76.32, 327.9899, 429.8
Dark Iron Pulverizer, https://wotlkdb.com/?spell=15292, 232.902, 142.098, 375, 263.9
Imperial Plate Helm, https://wotlkdb.com/?spell=16658, 224, 77, 301, 390.9
Iron Shield Spike, https://wotlkdb.com/?spell=7221, 221.2284, 3.7716, 225, 5965.6
Heavy Mithril Axe, https://wotlkdb.com/?spell=9993, 221.048, 111.952, 333, 297.4
Savage Cobalt Slicer, https://wotlkdb.com/?spell=55177, 216.9999, 60, 276.9999, 461.7
Titanium Plating, https://wotlkdb.com/?spell=62202, 206.8, 313.2, 520, 166
Adamantite Plate Gloves, https://wotlkdb.com/?spell=29605, 206.54, 53.46, 260, 486.3
Stronghold Gauntlets, https://wotlkdb.com/?spell=16741, 201.501, 1798.499, 2000, 111.2
Honed Cobalt Cleaver, https://wotlkdb.com/?spell=55174, 194.9999, 60, 254.9999, 425
Vengeance Bindings, https://wotlkdb.com/?spell=55298, 193.0797, 139.9, 332.9797, 238
Imperial Plate Belt, https://wotlkdb.com/?spell=16647, 192.46, 36.54, 229, 626.7
Dark Iron Shoulders, https://wotlkdb.com/?spell=15295, 174.7005, 47.2995, 222, 469.3
Titansteel Shield Wall, https://wotlkdb.com/?spell=56400, 173.75, 946.25, 1120, 118.4
Flamebane Gloves, https://wotlkdb.com/?spell=29616, 173.5415, 167.84, 341.3815, 203.4
Shining Silver Breastplate, https://wotlkdb.com/?spell=2675, 167.6132, 32.8868, 200.5, 609.7
Saronite Spellblade, https://wotlkdb.com/?spell=59442, 165, 85, 250, 294.1
Saronite Bulwark, https://wotlkdb.com/?spell=55014, 160.9999, 70, 230.9999, 330
Imperial Plate Shoulders, https://wotlkdb.com/?spell=16646, 156.46, 42.54, 199, 467.8
Ornate Saronite Gauntlets, https://wotlkdb.com/?spell=56553, 147.1, 139.9, 287, 205.1
Imperial Plate Boots, https://wotlkdb.com/?spell=16657, 145, 54, 199, 368.5
Saronite Protector, https://wotlkdb.com/?spell=55013, 142, 35, 177, 505.7
Imperial Plate Chest, https://wotlkdb.com/?spell=16663, 141, 60, 201, 335
Tempered Saronite Breastplate, https://wotlkdb.com/?spell=54553, 129.59, 40.4, 169.99, 420.8
Tempered Saronite Legplates, https://wotlkdb.com/?spell=54554, 129.1, 37.9, 167, 440.6
Imperial Plate Leggings, https://wotlkdb.com/?spell=16730, 129, 72, 201, 279.2
Savage Saronite Legplates, https://wotlkdb.com/?spell=55310, 128.7497, 100, 228.7497, 228.7
Savage Saronite Bracers, https://wotlkdb.com/?spell=55305, 127.7499, 90, 217.7499, 241.9
Brilliant Saronite Gauntlets, https://wotlkdb.com/?spell=55056, 122.5, 47.5, 170, 357.9
Repair the Blade of Heroes, https://wotlkdb.com/?spell=11923, 115.28, 24.72, 140, 566.3
Moonsteel Broadsword, https://wotlkdb.com/?spell=3496, 112.11, 37.89, 150, 395.9
Savage Saronite Waistguard, https://wotlkdb.com/?spell=55307, 110.5, 68.5, 179, 261.3
Savage Saronite Gauntlets, https://wotlkdb.com/?spell=55309, 109.8499, 139.9, 249.7499, 178.5
Savage Saronite Walkers, https://wotlkdb.com/?spell=55308, 109.5899, 85.4, 194.9899, 228.3
Tempered Saronite Belt, https://wotlkdb.com/?spell=54551, 109, 40, 149, 372.5
Ebon Hand, https://wotlkdb.com/?spell=23650, 101.96, 1398.04, 1500, 107.3
Ornate Saronite Pauldrons, https://wotlkdb.com/?spell=56550, 100.5, 68.5, 169, 246.7
Helm of Command, https://wotlkdb.com/?spell=55302, 100.0999, 149.9, 249.9999, 166.8
Ornate Saronite Legplates, https://wotlkdb.com/?spell=56554, 99, 100, 199, 199
Ornate Saronite Bracers, https://wotlkdb.com/?spell=56549, 98, 90, 188, 208.9
Felsteel Shield Spike, https://wotlkdb.com/?spell=29657, 97.04, 201.96, 299, 148
Pearl-handled Dagger, https://wotlkdb.com/?spell=6517, 91.7542, 7.2458, 99, 1366.3
Heavy Mithril Pants, https://wotlkdb.com/?spell=9933, 89.3, 89.7, 179, 199.6
Savage Saronite Skullshield, https://wotlkdb.com/?spell=55312, 83.3499, 95.4, 178.7499, 187.4
Brilliant Saronite Breastplate, https://wotlkdb.com/?spell=55058, 79.34, 70.66, 150, 212.3
Brilliant Saronite Helm, https://wotlkdb.com/?spell=59441, 79.3398, 70.66, 149.9998, 212.3
Titansteel Destroyer, https://wotlkdb.com/?spell=55369, 79, 2470, 2549, 103.2
Plate Girdle of Righteousness, https://wotlkdb.com/?spell=63189, 76.25, 3723.75, 3800, 102
Smelt Hardened Khorium, https://wotlkdb.com/?spell=46353, 75.3, 474.7, 550, 115.9
Savage Saronite Hauberk, https://wotlkdb.com/?spell=55311, 74.36, 74.64, 149, 199.6
Heavy Mithril Helm, https://wotlkdb.com/?spell=9970, 71.44, 127.56, 199, 156
Savage Saronite Pauldrons, https://wotlkdb.com/?spell=55306, 70.5, 68.5, 139, 202.9
Spiked Cobalt Helm, https://wotlkdb.com/?spell=54917, 69.5, 17.5, 87, 497.1
Saronite Defender, https://wotlkdb.com/?spell=54557, 65, 35, 100, 285.7
Tempered Saronite Helm, https://wotlkdb.com/?spell=54555, 64.6138, 60.4, 125.0138, 207
Adamantite Plate Bracers, https://wotlkdb.com/?spell=29603, 62.52, 37.48, 100, 266.8
Golden Scale Leggings, https://wotlkdb.com/?spell=3507, 59.06, 8.94, 68, 760.6
Fel Iron Plate Pants, https://wotlkdb.com/?spell=29549, 58, 32, 90, 281.3
Cobalt Chestpiece, https://wotlkdb.com/?spell=52570, 55, 15, 70, 466.7
Brilliant Saronite Bracers, https://wotlkdb.com/?spell=59438, 51.4999, 47.5, 98.9999, 208.4
Arcanite Rod, https://wotlkdb.com/?spell=20201, 49.79, 270.2, 319.99, 118.4
Golden Scale Boots, https://wotlkdb.com/?spell=3515, 49.32, 49.68, 99, 199.3
Truesilver Breastplate, https://wotlkdb.com/?spell=9974, 47.9344, 202.0656, 250, 123.7
Brilliant Saronite Legplates, https://wotlkdb.com/?spell=55055, 47.84, 38.16, 86, 225.4
Adamantite Rod, https://wotlkdb.com/?spell=32656, 44.99, 50, 94.99, 190
Adamantite Weightstone, https://wotlkdb.com/?spell=34608, 44.2, 5.8, 50, 862.1
Eternal Belt Buckle, https://wotlkdb.com/?spell=55656, 42.86, 58.54, 101.4, 173.2
Tempered Titansteel Treads, https://wotlkdb.com/?spell=55376, 42.76, 946.25, 989.01, 104.5
Green Iron Helm, https://wotlkdb.com/?spell=3502, 42.559, 8.341, 50.9, 610.2
Eternium Rod, https://wotlkdb.com/?spell=32657, 41.99, 22, 63.99, 290.9
Tempered Saronite Boots, https://wotlkdb.com/?spell=54552, 41.875, 47.5, 89.375, 188.2
Fel Iron Rod, https://wotlkdb.com/?spell=32655, 41, 24, 65, 270.8
Cobalt Bracers, https://wotlkdb.com/?spell=55834, 40, 10, 50, 500
Sturdy Cobalt Quickblade, https://wotlkdb.com/?spell=55200, 40, 20, 60, 300
Titanium Rod, https://wotlkdb.com/?spell=55732, 39.85, 62.9, 102.75, 163.4
Mighty Iron Hammer, https://wotlkdb.com/?spell=3297, 37.5217, 7.4783, 45, 601.7
Cobalt Legplates, https://wotlkdb.com/?spell=52567, 37.4, 12.5, 49.9, 399.2
Titanium Weapon Chain, https://wotlkdb.com/?spell=55839, 37.1, 62.9, 100, 159
Tempered Saronite Shoulders, https://wotlkdb.com/?spell=54556, 37, 60, 97, 161.7
Jade Serpentblade, https://wotlkdb.com/?spell=3493, 36.3, 18.7, 55, 294.1
Oathkeeper's Helm, https://wotlkdb.com/?spell=29668, 34.95, 915.05, 950, 103.8
Deadly Saronite Dirk, https://wotlkdb.com/?spell=55206, 33.6199, 36.38, 69.9999, 192.4
Furious Saronite Beatstick, https://wotlkdb.com/?spell=55182, 33.4, 75.8, 109.2, 144.1
Righteous Gauntlets, https://wotlkdb.com/?spell=55300, 31.4999, 68.5, 99.9999, 146
Adamantite Cleaver, https://wotlkdb.com/?spell=29568, 30, 40, 70, 175
Tempered Saronite Bracers, https://wotlkdb.com/?spell=55017, 30, 65, 95, 146.2
Thorium Armor, https://wotlkdb.com/?spell=16642, 28, 71, 99, 139.4
Cobalt Helm, https://wotlkdb.com/?spell=52571, 27.5, 12.5, 40, 320
Adamantite Maul, https://wotlkdb.com/?spell=29566, 26.64, 40, 66.64, 166.6
Cobalt Boots, https://wotlkdb.com/?spell=52569, 25, 10, 35, 350
Forged Cobalt Claymore, https://wotlkdb.com/?spell=55203, 25, 25, 50, 200
Copper Battle Axe, https://wotlkdb.com/?spell=3293, 24.486, 13.514, 38, 281.2
Fel Iron Hatchet, https://wotlkdb.com/?spell=29557, 22, 36, 58, 161.1
Fel Iron Greatsword, https://wotlkdb.com/?spell=29565, 22, 48, 70, 145.8
Ornate Saronite Waistguard, https://wotlkdb.com/?spell=56551, 21.5, 68.5, 90, 131.4
Righteous Greaves, https://wotlkdb.com/?spell=55304, 21.5, 78.5, 100, 127.4
Cobalt Triangle Shield, https://wotlkdb.com/?spell=54550, 21, 10, 31, 310
Cobalt Belt, https://wotlkdb.com/?spell=52568, 20, 10, 30, 300
Ornate Saronite Walkers, https://wotlkdb.com/?spell=56552, 19.6, 85.4, 105, 123
Spiked Cobalt Bracers, https://wotlkdb.com/?spell=54948, 19, 30, 49, 163.3
Green Iron Shoulders, https://wotlkdb.com/?spell=3504, 18.79, 6.21, 25, 402.6
Reinforced Cobalt Chestpiece, https://wotlkdb.com/?spell=54981, 18.68, 21.32, 40, 187.6
Brilliant Saronite Boots, https://wotlkdb.com/?spell=55057, 17, 60, 77, 128.3
Adamantite Breastplate, https://wotlkdb.com/?spell=29606, 16.31, 73.44, 89.75, 122.2
Deadly Bronze Poniard, https://wotlkdb.com/?spell=3295, 16.1742, 18.2658, 34.44, 188.5
Heavy Mithril Shoulder, https://wotlkdb.com/?spell=9926, 15.24, 74.76, 90, 120.4
Reinforced Cobalt Helm, https://wotlkdb.com/?spell=54979, 14.68, 21.32, 36, 168.9
Cobalt Tenderizer, https://wotlkdb.com/?spell=55201, 13, 20, 33, 165
Titanium Shield Spike, https://wotlkdb.com/?spell=56357, 12.1, 62.9, 75, 119.2
Golden Scale Coif, https://wotlkdb.com/?spell=3503, 11.22, 36.78, 48, 130.5
Ornate Saronite Hauberk, https://wotlkdb.com/?spell=56555, 11.06, 74.64, 85.7, 114.8
Cobalt Shoulders, https://wotlkdb.com/?spell=52572, 11, 10, 21, 210
Silver Rod, https://wotlkdb.com/?spell=7818, 10.8233, 1.6767, 12.5, 745.5
Bronze Warhammer, https://wotlkdb.com/?spell=9985, 10.76, 9.19, 19.95, 217.1
Tempered Saronite Gauntlets, https://wotlkdb.com/?spell=55015, 10, 70, 80, 114.3
Fel Iron Plate Gloves, https://wotlkdb.com/?spell=29545, 9, 16, 25, 156.3
Fel Iron Chain Coif, https://wotlkdb.com/?spell=29551, 9, 16, 25, 156.3
Spiked Cobalt Legplates, https://wotlkdb.com/?spell=54947, 9, 30, 39, 130
Silvered Bronze Shoulders, https://wotlkdb.com/?spell=3330, 8.5808, 11.4192, 20, 175.1
Heavy Copper Broadsword, https://wotlkdb.com/?spell=3292, 7.85, 17.15, 25, 145.8
Bronze Greatsword, https://wotlkdb.com/?spell=9986, 7.62, 14.38, 22, 153
Big Bronze Knife, https://wotlkdb.com/?spell=3491, 7.21, 7.79, 15, 192.6
Spiked Cobalt Belt, https://wotlkdb.com/?spell=54946, 7, 30, 37, 123.3
Green Iron Boots, https://wotlkdb.com/?spell=3334, 6.3042, 3.6958, 10, 270.6
Fel Iron Chain Bracers, https://wotlkdb.com/?spell=29553, 6, 24, 30, 125
Daunting Legplates, https://wotlkdb.com/?spell=55303, 5.36, 74.64, 80, 107.2
Golden Rod, https://wotlkdb.com/?spell=14379, 5.3542, 0.5558, 5.91, 1063.3
Fel Iron Chain Gloves, https://wotlkdb.com/?spell=29552, 5, 20, 25, 125
Adamantite Sharpening Stone, https://wotlkdb.com/?spell=29656, 4.8402, 6.1598, 11, 178.6
Saronite Sharpening Stone, https://wotlkdb.com/?spell=56307, 4.8402, 6.1598, 11, 178.6
Whirling Steel Axes, https://wotlkdb.com/?spell=34981, 4.7484, 26.1, 30.8484, 118.2
Silvered Bronze Breastplate, https://wotlkdb.com/?spell=2673, 4.5808, 13.4192, 18, 134.1
Heavy Weightstone, https://wotlkdb.com/?spell=3117, 4.565, 0.935, 5.5, 588.2
Fel Iron Plate Belt, https://wotlkdb.com/?spell=29547, 4, 16, 20, 125
Fel Sharpening Stone, https://wotlkdb.com/?spell=29654, 3.6424, 4.5799, 8.2223, 179.5
Steel Plate Helm, https://wotlkdb.com/?spell=9935, 3.299, 56.901, 60.2, 105.8
Bronze Battle Axe, https://wotlkdb.com/?spell=9987, 3.11, 16.18, 19.29, 119.2
Heavy Copper Maul, https://wotlkdb.com/?spell=7408, 3.076, 11.924, 15, 125.8
Iron Counterweight, https://wotlkdb.com/?spell=7222, 2.4542, 2.5358, 4.99, 196.8
Hardened Iron Shortsword, https://wotlkdb.com/?spell=3492, 2.4, 7.6, 10, 131.6
Iron Buckle, https://wotlkdb.com/?spell=8768, 2.38, 0.6, 2.98, 496.7
Solid Weightstone, https://wotlkdb.com/?spell=9921, 2.3652, 0.1348, 2.5, 1854.6
Truesilver Rod, https://wotlkdb.com/?spell=14380, 2.3062, 2.6938, 5, 185.6
Fel Iron Plate Boots, https://wotlkdb.com/?spell=29548, 0.9899, 24, 24.9899, 104.1
Dense Sharpening Stone, https://wotlkdb.com/?spell=16641, 0.915, 0.075, 0.99, 1320
Coarse Sharpening Stone, https://wotlkdb.com/?spell=2665, 0.4953, 0.0047, 0.5, 10638.3
Solid Sharpening Stone, https://wotlkdb.com/?spell=9918, 0.3001, 0.0999, 0.4, 400.4
Rough Sharpening Stone, https://wotlkdb.com/?spell=2660, 0.0453, 0.0047, 0.05, 1063.8
Rough Weightstone, https://wotlkdb.com/?spell=3115, 0.0364, 0.0124, 0.0488, 393.5
Coarse Grinding Stone, https://wotlkdb.com/?spell=3326, 0.0335, 0.0094, 0.0429, 456.4
Rough Grinding Stone, https://wotlkdb.com/?spell=3320, -0.0044, 0.0094, 0.005, 53.2
Coarse Weightstone, https://wotlkdb.com/?spell=3116, -0.0697, 0.0797, 0.01, 12.5
Solid Grinding Stone, https://wotlkdb.com/?spell=9920, -0.3496, 0.3996, 0.05, 12.5
Cobalt Gauntlets, https://wotlkdb.com/?spell=55835, -0.55, 12.5, 11.95, 95.6
Heavy Grinding Stone, https://wotlkdb.com/?spell=3337, -0.58, 2.58, 2, 77.5
Heavy Sharpening Stone, https://wotlkdb.com/?spell=2674, -0.71, 0.86, 0.15, 17.4
Enchanted Thorium Blades, https://wotlkdb.com/?spell=34982, -1.05, 26.05, 25, 96
Thick War Axe, https://wotlkdb.com/?spell=3294, -1.3174, 13.3174, 12, 90.1
Copper Bracers, https://wotlkdb.com/?spell=2663, -1.75, 1.95, 0.2, 10.3
Green Iron Leggings, https://wotlkdb.com/?spell=3506, -1.83, 6.81, 4.98, 73.1
Fel Iron Casing, https://wotlkdb.com/?spell=30304, -2, 12, 10, 83.3
Daunting Handguards, https://wotlkdb.com/?spell=55301, -2.04, 64.64, 62.6, 96.8
Brilliant Saronite Belt, https://wotlkdb.com/?spell=59436, -2.15, 40, 37.85, 94.6
Green Iron Bracers, https://wotlkdb.com/?spell=3501, -2.31, 3.61, 1.3, 36
Sure-fire Shuriken, https://wotlkdb.com/?spell=55202, -2.5, 17.5, 15, 85.7
Rough Bronze Cuirass, https://wotlkdb.com/?spell=2670, -3.1, 7, 3.9, 55.7
Rough Bronze Shoulders, https://wotlkdb.com/?spell=3328, -3.3429, 5.0429, 1.7, 33.7
Patterned Bronze Bracers, https://wotlkdb.com/?spell=2672, -3.5458, 5.0858, 1.54, 30.3
Copper Chain Pants, https://wotlkdb.com/?spell=2662, -3.7, 3.9, 0.2, 5.1
Silvered Bronze Boots, https://wotlkdb.com/?spell=3331, -3.7525, 7.7525, 4, 51.6
Runed Copper Bracers, https://wotlkdb.com/?spell=2664, -3.865, 9.765, 5.9, 60.4
Gemmed Copper Gauntlets, https://wotlkdb.com/?spell=3325, -3.9, 9.34, 5.44, 58.2
Copper Chain Vest, https://wotlkdb.com/?spell=3321, -3.93, 7.81, 3.88, 49.7
Rough Bronze Bracers, https://wotlkdb.com/?spell=2671, -3.9371, 4, 0.0629, 1.6
Spiked Cobalt Gauntlets, https://wotlkdb.com/?spell=54945, -4.0001, 30, 25.9999, 86.7
Rough Bronze Leggings, https://wotlkdb.com/?spell=2668, -4.56, 6, 1.44, 24
Thick Bronze Darts, https://wotlkdb.com/?spell=34979, -4.85, 7, 2.15, 30.7
Notched Cobalt War Axe, https://wotlkdb.com/?spell=55204, -5, 25, 20, 80
Bronze Mace, https://wotlkdb.com/?spell=2740, -5.03, 7.03, 2, 28.4
Horned Cobalt Helm, https://wotlkdb.com/?spell=54949, -5.05, 20, 14.95, 74.8
Rough Bronze Boots, https://wotlkdb.com/?spell=7817, -5.13, 6.03, 0.9, 14.9
Runed Copper Breastplate, https://wotlkdb.com/?spell=2667, -5.21, 13.21, 8, 60.6
Copper Chain Belt, https://wotlkdb.com/?spell=2661, -5.36, 5.85, 0.49, 8.4
Greater Ward of Shielding, https://wotlkdb.com/?spell=29729, -5.375, 5.5, 0.125, 2.3
Copper Shortsword, https://wotlkdb.com/?spell=2739, -5.3754, 5.8754, 0.5, 8.5
Runed Copper Belt, https://wotlkdb.com/?spell=2666, -5.76, 9.75, 3.99, 40.9
Runed Copper Gauntlets, https://wotlkdb.com/?spell=3323, -5.8505, 7.81, 1.9595, 25.1
Copper Axe, https://wotlkdb.com/?spell=2738, -5.8554, 5.8754, 0.02, 0.3
Copper Mace, https://wotlkdb.com/?spell=2737, -5.8648, 5.8754, 0.0106, 0.2
Solid Iron Maul, https://wotlkdb.com/?spell=3494, -5.8668, 14.8668, 9, 60.5
Copper Dagger, https://wotlkdb.com/?spell=8880, -5.9476, 5.967, 0.0194, 0.3
Spiked Cobalt Chestpiece, https://wotlkdb.com/?spell=54944, -6, 20, 14, 70
Silvered Bronze Gauntlets, https://wotlkdb.com/?spell=3333, -6.7525, 9.7525, 3, 30.8
Bronze Shortsword, https://wotlkdb.com/?spell=2742, -6.7801, 7.02, 0.2399, 3.4
Runed Copper Pants, https://wotlkdb.com/?spell=3324, -6.835, 7.835, 1, 12.8
Heavy Iron Knuckles, https://wotlkdb.com/?spell=25612, -6.8569, 7.425, 0.5681, 7.7
Bronze Axe, https://wotlkdb.com/?spell=2741, -7.14, 8.03, 0.89, 11.1
Spiked Cobalt Boots, https://wotlkdb.com/?spell=54918, -7.3123, 17.5, 10.1877, 58.2
Spiked Cobalt Shoulders, https://wotlkdb.com/?spell=54941, -7.5, 17.5, 10, 57.1
Copper Chain Boots, https://wotlkdb.com/?spell=3319, -7.78, 7.8, 0.02, 0.3
Adamantite Dagger, https://wotlkdb.com/?spell=29569, -8, 38, 30, 78.9
Blood Tiger Breastplate, https://wotlkdb.com/?spell=24124, -8.1181, 10.8, 2.6819, 24.8
Copper Claymore, https://wotlkdb.com/?spell=9983, -8.877, 9.877, 1, 10.1
Adamantite Rapier, https://wotlkdb.com/?spell=29571, -9.443, 60, 50.557, 84.3
Ornate Saronite Skullshield, https://wotlkdb.com/?spell=56556, -10.4, 95.4, 85, 89.1
Huge Thorium Battleaxe, https://wotlkdb.com/?spell=16971, -10.54, 45.54, 35, 76.9
Barbaric Iron Shoulders, https://wotlkdb.com/?spell=9811, -10.55, 10.8, 0.25, 2.3
Barbaric Iron Helm, https://wotlkdb.com/?spell=9814, -10.6663, 11, 0.3337, 3
Heavy Bronze Mace, https://wotlkdb.com/?spell=3296, -10.7258, 13.7258, 3, 21.9
Thorium Belt, https://wotlkdb.com/?spell=16643, -12.0001, 24, 11.9999, 50
Barbaric Iron Collar, https://wotlkdb.com/?spell=25498, -12.48, 14.48, 2, 13.8
Golden Iron Destroyer, https://wotlkdb.com/?spell=3495, -12.5439, 13.38, 0.8361, 6.2
Ironforge Gauntlets, https://wotlkdb.com/?spell=8368, -12.5571, 12.6716, 0.1145, 0.9
Iridescent Hammer, https://wotlkdb.com/?spell=6518, -12.9964, 13.3658, 0.3694, 2.8
Ironforge Chain, https://wotlkdb.com/?spell=8366, -13.2404, 13.29, 0.0496, 0.4
Saronite Shiv, https://wotlkdb.com/?spell=55181, -13.3334, 63.3334, 50, 78.9
Glinting Steel Dagger, https://wotlkdb.com/?spell=15972, -13.71, 54.71, 41, 74.9
Reinforced Cobalt Legplates, https://wotlkdb.com/?spell=54980, -14.012, 21.32, 7.308, 34.3
Massive Iron Axe, https://wotlkdb.com/?spell=3498, -14.5552, 15.68, 1.1248, 7.2
Brilliant Saronite Pauldrons, https://wotlkdb.com/?spell=59440, -15, 60, 45, 75
Imperial Plate Bracers, https://wotlkdb.com/?spell=16649, -15.7, 36, 20.3, 56.4
Fel Iron Chain Tunic, https://wotlkdb.com/?spell=29556, -16, 36, 20, 55.6
Thorium Leggings, https://wotlkdb.com/?spell=16662, -16.05, 36, 19.95, 55.4
Reinforced Cobalt Shoulders, https://wotlkdb.com/?spell=54978, -16.2564, 21.32, 5.0636, 23.8
Ironforge Breastplate, https://wotlkdb.com/?spell=8367, -17.0279, 17.115, 0.0871, 0.5
Barbaric Iron Gloves, https://wotlkdb.com/?spell=9820, -18.1289, 18.4, 0.2711, 1.5
Barbaric Iron Boots, https://wotlkdb.com/?spell=9818, -18.83, 19.2, 0.37, 1.9
Barbaric Iron Breastplate, https://wotlkdb.com/?spell=9813, -19.6669, 20, 0.3331, 1.7
Fel Iron Breastplate, https://wotlkdb.com/?spell=29550, -19.8, 40, 20.2, 50.5
Ironvine Belt, https://wotlkdb.com/?spell=28463, -19.8663, 21.82, 1.9537, 9
Golden Scale Bracers, https://wotlkdb.com/?spell=7223, -20.92, 23.9, 2.98, 12.5
Golden Scale Shoulders, https://wotlkdb.com/?spell=3505, -21.82, 26.82, 5, 18.6
Thorium Bracers, https://wotlkdb.com/?spell=16644, -22.02, 24, 1.98, 8.3
Mithril Shield Spike, https://wotlkdb.com/?spell=9939, -23.4676, 37.4676, 14, 37.4
Golden Scale Gauntlets, https://wotlkdb.com/?spell=11643, -23.68, 49.68, 26, 52.3
Elemental Sharpening Stone, https://wotlkdb.com/?spell=22757, -24.2, 24.325, 0.125, 0.5
Golden Scale Cuirass, https://wotlkdb.com/?spell=3511, -25.7, 56.7, 31, 54.7
Ironvine Gloves, https://wotlkdb.com/?spell=28462, -27.1668, 29.1133, 1.9465, 6.7
Volcanic Breastplate, https://wotlkdb.com/?spell=19076, -28.4824, 30.2099, 1.7275, 5.7
Fel Iron Hammer, https://wotlkdb.com/?spell=29558, -30, 40, 10, 25
Mithril Spurs, https://wotlkdb.com/?spell=9964, -31.19, 36.03, 4.84, 13.4
Girdle of the Dawn, https://wotlkdb.com/?spell=23632, -31.4745, 33.1228, 1.6483, 5
Thorium Greatsword, https://wotlkdb.com/?spell=16960, -31.9979, 35.36, 3.3621, 9.5
Dark Iron Bracers, https://wotlkdb.com/?spell=20874, -32.0958, 34.32, 2.2242, 6.5
Ironfeather Shoulders, https://wotlkdb.com/?spell=19062, -33.4122, 34.688, 1.2758, 3.7
Titansteel Shanker, https://wotlkdb.com/?spell=56234, -33.5, 1882.5, 1849, 98.2
Thorium Boots, https://wotlkdb.com/?spell=16652, -35.82, 44.72, 8.9, 19.9
Polished Steel Boots, https://wotlkdb.com/?spell=3513, -36.6273, 37.021, 0.3937, 1.1
Steel Weapon Chain, https://wotlkdb.com/?spell=7224, -37.69, 37.84, 0.15, 0.4
Brilliant Titansteel Helm, https://wotlkdb.com/?spell=55374, -38, 1235, 1197, 96.9
Radiant Boots, https://wotlkdb.com/?spell=16656, -41.1559, 42.798, 1.6421, 3.8
Ironfeather Breastplate, https://wotlkdb.com/?spell=19086, -41.413, 43.778, 2.365, 5.4
Heavy Earthforged Breastplate, https://wotlkdb.com/?spell=36129, -46.7603, 51.92, 5.1597, 9.9
Thorium Helm, https://wotlkdb.com/?spell=16653, -47, 59, 12, 20.3
