Name, Link, Profit, Cost, Sell, ROI %
Belt of the Guardian, https://wotlkdb.com/?spell=36389, 10271, 728.5, 10999.5, 1509.9
Helm of the Great Chief, https://wotlkdb.com/?spell=16728, 9340.1506, 659.8494, 10000, 1515.5
Hand of Eternity, https://wotlkdb.com/?spell=29700, 9265.14, 2734.86, 12000, 438.8
Sulfuron Hammer, https://wotlkdb.com/?spell=21161, 8288.635, 6711.365, 15000, 223.5
Sageblade, https://wotlkdb.com/?spell=27832, 8110.0004, 1489.9996, 9600, 644.3
Arcanite Reaper, https://wotlkdb.com/?spell=16994, 4297.734, 2202.266, 6500, 295.2
Nightfall, https://wotlkdb.com/?spell=23653, 4070.647, 1428.353, 5499, 385
Dark Iron Mail, https://wotlkdb.com/?spell=15293, 3920.298, 79.702, 4000, 5018.7
Frostguard, https://wotlkdb.com/?spell=16992, 3630.4406, 2669.5594, 6300, 236
Heavy Copper Longsword, https://wotlkdb.com/?spell=43549, 3289.371, 10.629, 3300, 31047.1
Felsteel Longblade, https://wotlkdb.com/?spell=29692, 2743.02, 2656.98, 5400, 203.2
Dark Iron Helm, https://wotlkdb.com/?spell=23636, 2460.36, 39.64, 2500, 6306.8
Treads of Destiny, https://wotlkdb.com/?spell=63190, 2368.6822, 3631.3178, 6000, 165.2
Spiked Deathdealers, https://wotlkdb.com/?spell=63192, 2268.6822, 3631.3178, 5900, 162.5
Indestructible Plate Girdle, https://wotlkdb.com/?spell=63191, 2218.6809, 3631.3178, 5849.9987, 161.1
Belt of the Titans, https://wotlkdb.com/?spell=63187, 2209.6822, 3631.3178, 5841, 160.9
Oathkeeper's Helm, https://wotlkdb.com/?spell=29668, 2062.81, 936.19, 2999, 320.3
Dark Iron Reaver, https://wotlkdb.com/?spell=20890, 2009.76, 212.24, 2222, 1046.9
Dark Iron Gauntlets, https://wotlkdb.com/?spell=23637, 1874.15, 125.85, 2000, 1589.2
Battlelord's Plate Boots, https://wotlkdb.com/?spell=63188, 1855.6822, 3631.3178, 5487, 151.1
Red Belt of Battle, https://wotlkdb.com/?spell=36390, 1788.1, 211.4, 1999.5, 945.8
Dark Iron Destroyer, https://wotlkdb.com/?spell=20897, 1786, 214, 2000, 934.6
Whitesoul Helm, https://wotlkdb.com/?spell=16724, 1736.94, 263.06, 2000, 760.3
Annihilator, https://wotlkdb.com/?spell=16991, 1724.8604, 2275.1396, 4000, 175.8
Helm of the Stalwart Defender, https://wotlkdb.com/?spell=29664, 1717.4612, 781.5388, 2499, 319.8
Steelgrip Gauntlets, https://wotlkdb.com/?spell=29662, 1707.81, 1291.19, 2999, 232.3
Protectors of Life, https://wotlkdb.com/?spell=70563, 1576.8, 4917.2, 6494, 132.1
Puresteel Legplates, https://wotlkdb.com/?spell=70562, 1470.2, 8278.8, 9749, 117.8
Shadesteel Bracers, https://wotlkdb.com/?spell=40034, 1421.0001, 78.9999, 1500, 1898.7
Sunforged Breastplate, https://wotlkdb.com/?spell=67095, 1418, 5177, 6595, 127.4
Shadesteel Sabots, https://wotlkdb.com/?spell=40033, 1417.9001, 82.0999, 1500, 1827
Black Dragonscale Breastplate, https://wotlkdb.com/?spell=19085, 1404.25, 94.75, 1499, 1582.1
Shadesteel Girdle, https://wotlkdb.com/?spell=40036, 1384.9501, 115.0499, 1500, 1303.8
Enchanted Adamantite Belt, https://wotlkdb.com/?spell=29608, 1357.1808, 142.8192, 1500, 1050.3
Shadesteel Greaves, https://wotlkdb.com/?spell=40035, 1348.9001, 151.0999, 1500, 992.7
Enchanted Adamantite Boots, https://wotlkdb.com/?spell=29611, 1305.7212, 194.2788, 1500, 772.1
Enchanted Adamantite Breastplate, https://wotlkdb.com/?spell=29610, 1202.602, 297.398, 1500, 504.4
Enchanted Adamantite Leggings, https://wotlkdb.com/?spell=29613, 1190.8424, 309.1576, 1500, 485.2
Titanium Razorplate, https://wotlkdb.com/?spell=67093, 1142, 5053, 6195, 122.6
Flamebane Breastplate, https://wotlkdb.com/?spell=29617, 1122.2572, 378.4928, 1500.75, 396.5
Boots of Kingly Upheaval, https://wotlkdb.com/?spell=70568, 1082.8, 4917.2, 6000, 122
Legplates of Painful Death, https://wotlkdb.com/?spell=70565, 1034.4999, 8162.8, 9197.2999, 112.7
Blazing Rapier, https://wotlkdb.com/?spell=16978, 937.716, 162.284, 1100, 677.8
Phantom Blade, https://wotlkdb.com/?spell=10007, 935.044, 263.956, 1199, 454.2
Titansteel Shanker, https://wotlkdb.com/?spell=56234, 929, 1910, 2839, 148.6
Truesilver Gauntlets, https://wotlkdb.com/?spell=9954, 900.4916, 99.3484, 999.84, 1006.4
Hellfrozen Bonegrinders, https://wotlkdb.com/?spell=70566, 895.2, 5442.8, 6338, 116.4
Dazzling Mithril Rapier, https://wotlkdb.com/?spell=10005, 856.4697, 119.5303, 976, 816.5
Pillars of Might, https://wotlkdb.com/?spell=70567, 855.2, 7638.8, 8494, 111.2
Dark Iron Sunderer, https://wotlkdb.com/?spell=15294, 690.196, 206.804, 897, 433.7
Breastplate of the White Knight, https://wotlkdb.com/?spell=67091, 635.2, 5863.8, 6499, 110.8
Titanium Spikeguards, https://wotlkdb.com/?spell=67094, 600.8, 3598.2, 4199, 116.7
Saronite Swordbreakers, https://wotlkdb.com/?spell=67092, 595.8, 3400.2, 3996, 117.5
Titansteel Guardian, https://wotlkdb.com/?spell=55371, 490, 1910, 2400, 125.7
Titansteel Bonecrusher, https://wotlkdb.com/?spell=55370, 484.1, 1910, 2394.1, 125.3
Titansteel Spellblade, https://wotlkdb.com/?spell=63182, 456.6, 1891.4, 2348, 124.1
Imperial Plate Belt, https://wotlkdb.com/?spell=16647, 431.2, 68.8, 500, 726.7
Ornate Mithril Gloves, https://wotlkdb.com/?spell=9950, 418.3613, 81.6387, 500, 612.5
Ornate Mithril Pants, https://wotlkdb.com/?spell=9945, 403.1115, 96.8885, 500, 516.1
Spiked Titansteel Helm, https://wotlkdb.com/?spell=55372, 398, 1250, 1648, 131.8
Ornate Mithril Shoulder, https://wotlkdb.com/?spell=9952, 397.0012, 102.9988, 500, 485.4
Ornate Mithril Boots, https://wotlkdb.com/?spell=9979, 381.2117, 118.7883, 500, 420.9
Icebane Treads, https://wotlkdb.com/?spell=61010, 367.5999, 322.4, 689.9999, 214
Green Iron Gauntlets, https://wotlkdb.com/?spell=3336, 327.223, 5.777, 333, 5764.2
Searing Golden Blade, https://wotlkdb.com/?spell=15973, 323.48, 31.52, 355, 1126.3
Icebane Chestguard, https://wotlkdb.com/?spell=61008, 321.5999, 438.4, 759.9999, 173.4
Titansteel Destroyer, https://wotlkdb.com/?spell=55369, 300, 2500, 2800, 112
Saronite Spellblade, https://wotlkdb.com/?spell=59442, 268.4999, 86.5, 354.9999, 410.4
Cudgel of Saronite Justice, https://wotlkdb.com/?spell=56280, 248.1349, 76.865, 324.9999, 422.8
Saronite Ambusher, https://wotlkdb.com/?spell=55179, 245.3541, 53.6459, 299, 557.4
Ornate Mithril Helm, https://wotlkdb.com/?spell=9980, 221.1619, 129.5881, 350.75, 270.7
Ornate Mithril Breastplate, https://wotlkdb.com/?spell=9972, 218.0109, 132.7391, 350.75, 264.2
Savage Cobalt Slicer, https://wotlkdb.com/?spell=55177, 215.3471, 61.6528, 276.9999, 449.3
Honed Cobalt Cleaver, https://wotlkdb.com/?spell=55174, 215.0106, 61.9792, 276.9898, 446.9
Icebane Girdle, https://wotlkdb.com/?spell=61009, 197.6, 322.4, 520, 161.3
Titanium Plating, https://wotlkdb.com/?spell=62202, 187.6, 332.4, 520, 156.4
Dark Iron Shoulders, https://wotlkdb.com/?spell=15295, 174.249, 47.751, 222, 464.9
Silvered Bronze Breastplate, https://wotlkdb.com/?spell=2673, 170.9623, 30.5068, 201.4691, 660.4
Imperial Plate Helm, https://wotlkdb.com/?spell=16658, 168.9, 132.1, 301, 227.9
Saronite Protector, https://wotlkdb.com/?spell=55013, 160.8104, 36.1896, 197, 544.4
Shining Silver Breastplate, https://wotlkdb.com/?spell=2675, 160.3895, 72.5582, 232.9477, 321
Saronite Bulwark, https://wotlkdb.com/?spell=55014, 159.5999, 71.4, 230.9999, 323.5
Smelt Hardened Khorium, https://wotlkdb.com/?spell=46353, 155.8555, 399.7, 555.5555, 139
Saronite Defender, https://wotlkdb.com/?spell=54557, 153.8104, 36.1896, 190, 525
Vengeance Bindings, https://wotlkdb.com/?spell=55298, 151.2, 148.8, 300, 201.6
Titansteel Shield Wall, https://wotlkdb.com/?spell=56400, 150.8999, 960.1, 1110.9999, 115.7
Tempered Saronite Legplates, https://wotlkdb.com/?spell=54554, 136.162, 38.838, 175, 450.6
Dark Iron Pulverizer, https://wotlkdb.com/?spell=15292, 131.396, 143.604, 275, 191.5
Ornate Saronite Waistguard, https://wotlkdb.com/?spell=56551, 129.8, 69.2, 199, 287.6
Adamantite Plate Gloves, https://wotlkdb.com/?spell=29605, 127.46, 72.54, 200, 275.7
Tempered Saronite Boots, https://wotlkdb.com/?spell=54552, 126.3052, 48.6948, 175, 359.4
Moonsteel Broadsword, https://wotlkdb.com/?spell=3496, 125.482, 24.518, 150, 611.8
Savage Saronite Waistguard, https://wotlkdb.com/?spell=55307, 124.825, 69.2, 194.025, 280.4
Savage Saronite Gauntlets, https://wotlkdb.com/?spell=55309, 123.9499, 148.8, 272.7499, 183.3
Brilliant Saronite Gauntlets, https://wotlkdb.com/?spell=55056, 120.3052, 48.6948, 169, 347.1
Imperial Plate Shoulders, https://wotlkdb.com/?spell=16646, 118.3, 80.7, 199, 246.6
Savage Saronite Bracers, https://wotlkdb.com/?spell=55305, 117.8, 97.2, 215, 221.2
Ornate Saronite Gauntlets, https://wotlkdb.com/?spell=56553, 117.1899, 148.8, 265.9899, 178.8
Savage Saronite Legplates, https://wotlkdb.com/?spell=55310, 113.3499, 107.4, 220.7499, 205.5
Ornate Saronite Walkers, https://wotlkdb.com/?spell=56552, 108.6101, 91.4, 200.0101, 218.8
Brilliant Saronite Helm, https://wotlkdb.com/?spell=59441, 108.1675, 71.5825, 179.75, 251.1
Savage Saronite Walkers, https://wotlkdb.com/?spell=55308, 107.5999, 91.4, 198.9999, 217.7
Savage Saronite Pauldrons, https://wotlkdb.com/?spell=55306, 105.7999, 69.2, 174.9999, 252.9
Brilliant Saronite Bracers, https://wotlkdb.com/?spell=59438, 102.3051, 48.6948, 150.9999, 310.1
Ornate Saronite Pauldrons, https://wotlkdb.com/?spell=56550, 99.8, 69.2, 169, 244.2
Felsteel Whisper Knives, https://wotlkdb.com/?spell=34983, 99.0515, 427.4599, 526.5114, 123.2
Heavy Mithril Pants, https://wotlkdb.com/?spell=9933, 99.001, 79.999, 179, 223.8
Felsteel Shield Spike, https://wotlkdb.com/?spell=29657, 95.84, 203.16, 299, 147.2
Savage Saronite Hauberk, https://wotlkdb.com/?spell=55311, 93.5999, 75.4, 168.9999, 224.1
Imperial Plate Boots, https://wotlkdb.com/?spell=16657, 91.9, 107.1, 199, 185.8
Helm of Command, https://wotlkdb.com/?spell=55302, 91.7499, 159, 250.7499, 157.7
Ornate Saronite Bracers, https://wotlkdb.com/?spell=56549, 90.8, 97.2, 188, 193.4
Heavy Mithril Helm, https://wotlkdb.com/?spell=9970, 86.0014, 112.9986, 199, 176.1
Cobalt Chestpiece, https://wotlkdb.com/?spell=52570, 83.1104, 15.7896, 98.9, 626.4
Imperial Plate Chest, https://wotlkdb.com/?spell=16663, 82, 119, 201, 168.9
Repair the Blade of Heroes, https://wotlkdb.com/?spell=11923, 81.36, 17.64, 99, 561.2
Brilliant Saronite Breastplate, https://wotlkdb.com/?spell=55058, 79.0599, 71.5825, 150.6424, 210.4
Savage Saronite Skullshield, https://wotlkdb.com/?spell=55312, 73.15, 101.6, 174.75, 172
Pearl-handled Dagger, https://wotlkdb.com/?spell=6517, 72.3031, 7.707, 80.0101, 1038.1
Golden Scale Boots, https://wotlkdb.com/?spell=3515, 66.58, 32.42, 99, 305.4
Eternium Rod, https://wotlkdb.com/?spell=32657, 64.8999, 23, 87.8999, 382.2
Fel Iron Plate Pants, https://wotlkdb.com/?spell=29549, 59.3336, 34.6664, 94, 271.2
Tempered Saronite Belt, https://wotlkdb.com/?spell=54551, 58.7104, 41.2896, 100, 242.2
Tempered Saronite Helm, https://wotlkdb.com/?spell=54555, 58.62, 61.38, 120, 195.5
Truesilver Breastplate, https://wotlkdb.com/?spell=9974, 58.4418, 191.5582, 250, 130.5
Imperial Plate Leggings, https://wotlkdb.com/?spell=16730, 58.2, 142.8, 201, 140.8
Arcanite Rod, https://wotlkdb.com/?spell=20201, 55.6901, 304.7999, 360.49, 118.3
Golden Scale Leggings, https://wotlkdb.com/?spell=3507, 54.53, 13.47, 68, 504.8
Brilliant Saronite Boots, https://wotlkdb.com/?spell=55057, 52.8, 61.2, 114, 186.3
Ornate Saronite Legplates, https://wotlkdb.com/?spell=56554, 52.6, 107.4, 160, 149
Titanium Rod, https://wotlkdb.com/?spell=55732, 51.65, 63.1, 114.75, 181.9
Bronze Shortsword, https://wotlkdb.com/?spell=2742, 50.95, 6.05, 57, 942.1
Spiked Cobalt Helm, https://wotlkdb.com/?spell=54917, 50.5788, 18.4212, 69, 374.6
Tempered Titansteel Helm, https://wotlkdb.com/?spell=55373, 50, 1250, 1300, 104
Titanium Weapon Chain, https://wotlkdb.com/?spell=55839, 46.65, 63.1, 109.75, 173.9
Tempered Saronite Breastplate, https://wotlkdb.com/?spell=54553, 43.5304, 41.4696, 85, 205
Adamantite Plate Bracers, https://wotlkdb.com/?spell=29603, 43.17, 46.58, 89.75, 192.7
Adamantite Weightstone, https://wotlkdb.com/?spell=34608, 43.04, 6.96, 50, 718.4
Fel Iron Rod, https://wotlkdb.com/?spell=32655, 38.9002, 25.9998, 64.9, 249.6
Eternal Belt Buckle, https://wotlkdb.com/?spell=55656, 36.4, 62.6, 99, 158.1
Adamantite Rod, https://wotlkdb.com/?spell=32656, 34.9, 65, 99.9, 153.7
Cobalt Belt, https://wotlkdb.com/?spell=52568, 34.4736, 10.5264, 45, 427.5
Mighty Iron Hammer, https://wotlkdb.com/?spell=3297, 34.041, 10.959, 45, 410.6
Righteous Gauntlets, https://wotlkdb.com/?spell=55300, 30.7999, 69.2, 99.9999, 144.5
Sturdy Cobalt Quickblade, https://wotlkdb.com/?spell=55200, 28.9472, 21.0528, 50, 237.5
Tempered Titansteel Treads, https://wotlkdb.com/?spell=55376, 28.91, 960.1, 989.01, 103
Tempered Saronite Bracers, https://wotlkdb.com/?spell=55017, 28.7, 66.3, 95, 143.3
Cobalt Legplates, https://wotlkdb.com/?spell=52567, 26.842, 13.158, 40, 304
Golden Scale Coif, https://wotlkdb.com/?spell=3503, 24.44, 23.56, 48, 203.7
Cobalt Triangle Shield, https://wotlkdb.com/?spell=54550, 24.3736, 10.5264, 34.9, 331.5
Jade Serpentblade, https://wotlkdb.com/?spell=3493, 23.82, 31.18, 55, 176.4
Copper Battle Axe, https://wotlkdb.com/?spell=3293, 23.181, 14.819, 38, 256.4
Righteous Greaves, https://wotlkdb.com/?spell=55304, 20.6, 79.4, 100, 125.9
Thick Bronze Darts, https://wotlkdb.com/?spell=34979, 19.351, 6.649, 26, 391
Tempered Saronite Shoulders, https://wotlkdb.com/?spell=54556, 18.8, 61.2, 80, 130.7
Reinforced Cobalt Chestpiece, https://wotlkdb.com/?spell=54981, 18.5822, 21.4178, 40, 186.8
Furious Saronite Beatstick, https://wotlkdb.com/?spell=55182, 18.14, 76.86, 95, 123.6
Deadly Bronze Poniard, https://wotlkdb.com/?spell=3295, 17.613, 16.827, 34.44, 204.7
Spiked Cobalt Bracers, https://wotlkdb.com/?spell=54948, 17.4208, 31.5792, 49, 155.2
Green Iron Shoulders, https://wotlkdb.com/?spell=3504, 16.65, 8.35, 25, 299.4
Fel Iron Casing, https://wotlkdb.com/?spell=30304, 15.899, 12.9999, 28.8989, 222.3
Daunting Handguards, https://wotlkdb.com/?spell=55301, 15.1, 65.2, 80.3, 123.2
Adamantite Maul, https://wotlkdb.com/?spell=29566, 14.64, 52, 66.64, 128.2
Reinforced Cobalt Helm, https://wotlkdb.com/?spell=54979, 14.5822, 21.4178, 36, 168.1
Cobalt Bracers, https://wotlkdb.com/?spell=55834, 14.4736, 10.5264, 25, 237.5
Whirling Steel Axes, https://wotlkdb.com/?spell=34981, 13.03, 16.97, 30, 176.8
Heavy Mithril Shoulder, https://wotlkdb.com/?spell=9926, 11.2008, 68.7992, 80, 116.3
Fel Iron Hatchet, https://wotlkdb.com/?spell=29557, 11.0003, 38.9997, 50, 128.2
Ornate Saronite Hauberk, https://wotlkdb.com/?spell=56555, 10.3, 75.4, 85.7, 113.7
Cobalt Helm, https://wotlkdb.com/?spell=52571, 9.842, 13.158, 23, 174.8
Shadow Crescent Axe, https://wotlkdb.com/?spell=3500, 8.861, 81.139, 90, 110.9
Heavy Copper Broadsword, https://wotlkdb.com/?spell=3292, 8.84, 16.16, 25, 154.7
Tempered Saronite Gauntlets, https://wotlkdb.com/?spell=55015, 8.6, 71.4, 80, 112
Cobalt Boots, https://wotlkdb.com/?spell=52569, 8.4736, 10.5264, 19, 180.5
Fel Iron Plate Gloves, https://wotlkdb.com/?spell=29545, 7.6668, 17.3332, 25, 144.2
Big Bronze Knife, https://wotlkdb.com/?spell=3491, 7.561, 7.439, 15, 201.6
Deadly Saronite Dirk, https://wotlkdb.com/?spell=55206, 7.2, 41.8, 49, 117.2
Adamantite Cleaver, https://wotlkdb.com/?spell=29568, 7, 52, 59, 113.5
Green Iron Helm, https://wotlkdb.com/?spell=3502, 6.93, 15.07, 22, 146
Fel Iron Hammer, https://wotlkdb.com/?spell=29558, 6.667, 43.333, 50, 115.4
Bronze Warhammer, https://wotlkdb.com/?spell=9985, 6.35, 8.65, 15, 173.4
Brilliant Saronite Legplates, https://wotlkdb.com/?spell=55055, 6.1595, 38.8405, 45, 115.9
Brilliant Saronite Belt, https://wotlkdb.com/?spell=59436, 4.6104, 41.2896, 45.9, 111.2
Daunting Legplates, https://wotlkdb.com/?spell=55303, 4.6, 75.4, 80, 106.1
Spiked Cobalt Belt, https://wotlkdb.com/?spell=54946, 3.9763, 31.5792, 35.5555, 112.6
Green Iron Boots, https://wotlkdb.com/?spell=3334, 3.083, 6.917, 10, 144.6
Adamantite Sharpening Stone, https://wotlkdb.com/?spell=29656, 3.0202, 7.9798, 11, 137.8
Saronite Sharpening Stone, https://wotlkdb.com/?spell=56307, 3.0202, 7.9798, 11, 137.8
Forged Cobalt Claymore, https://wotlkdb.com/?spell=55203, 2.884, 26.316, 29.2, 111
Truesilver Rod, https://wotlkdb.com/?spell=14380, 2.83, 1.69, 4.52, 267.5
Solid Weightstone, https://wotlkdb.com/?spell=9921, 2.4476, 0.0524, 2.5, 4771
Heavy Weightstone, https://wotlkdb.com/?spell=3117, 2.3405, 0.1595, 2.5, 1567.4
Heavy Copper Maul, https://wotlkdb.com/?spell=7408, 2.34, 12.66, 15, 118.5
Solid Sharpening Stone, https://wotlkdb.com/?spell=9918, 1.97, 0.03, 2, 6666.7
Notched Cobalt War Axe, https://wotlkdb.com/?spell=55204, 1.684, 26.316, 28, 106.4
Fel Iron Chain Coif, https://wotlkdb.com/?spell=29551, 1.6168, 17.3332, 18.95, 109.3
Cobalt Shoulders, https://wotlkdb.com/?spell=52572, 1.4736, 10.5264, 12, 114
Iron Buckle, https://wotlkdb.com/?spell=8768, 1.45, 1.05, 2.5, 238.1
Dense Sharpening Stone, https://wotlkdb.com/?spell=16641, 0.9327, 0.0473, 0.98, 2071.9
Heavy Sharpening Stone, https://wotlkdb.com/?spell=2674, 0.8672, 0.1345, 1.0017, 744.8
Fel Iron Plate Belt, https://wotlkdb.com/?spell=29547, 0.6668, 17.3332, 18, 103.8
Heavy Grinding Stone, https://wotlkdb.com/?spell=3337, 0.5865, 0.4035, 0.99, 245.4
Coarse Sharpening Stone, https://wotlkdb.com/?spell=2665, 0.5127, 0.0373, 0.55, 1474.5
Coarse Grinding Stone, https://wotlkdb.com/?spell=3326, 0.2289, 0.0746, 0.3035, 406.8
Iron Counterweight, https://wotlkdb.com/?spell=7222, 0.137, 4.853, 4.99, 102.8
Rough Sharpening Stone, https://wotlkdb.com/?spell=2660, 0.1364, 0.0081, 0.1445, 1784
Sure-fire Shuriken, https://wotlkdb.com/?spell=55202, 0.0788, 18.4212, 18.5, 100.4
Rough Grinding Stone, https://wotlkdb.com/?spell=3320, 0.0733, 0.0162, 0.0895, 552.5
Solid Grinding Stone, https://wotlkdb.com/?spell=9920, 0.0697, 0.12, 0.1897, 158.1
Rough Weightstone, https://wotlkdb.com/?spell=3115, 0.0387, 0.012, 0.0507, 422.5
Coarse Weightstone, https://wotlkdb.com/?spell=3116, -0.0523, 0.0623, 0.01, 16.1
Fel Sharpening Stone, https://wotlkdb.com/?spell=29654, -0.0732, 5.0732, 5, 98.6
Hardened Iron Shortsword, https://wotlkdb.com/?spell=3492, -0.182, 10.182, 10, 98.2
Golden Rod, https://wotlkdb.com/?spell=14379, -0.447, 1.597, 1.15, 72
Rough Bronze Cuirass, https://wotlkdb.com/?spell=2670, -0.9301, 6.93, 5.9999, 86.6
Fel Iron Plate Boots, https://wotlkdb.com/?spell=29548, -1.0099, 25.9998, 24.9899, 96.1
Cobalt Tenderizer, https://wotlkdb.com/?spell=55201, -1.0528, 21.0528, 20, 95
Spiked Cobalt Boots, https://wotlkdb.com/?spell=54918, -1.4212, 18.4212, 17, 92.3
Fel Iron Chain Gloves, https://wotlkdb.com/?spell=29552, -1.6665, 21.6665, 20, 92.3
Copper Bracers, https://wotlkdb.com/?spell=2663, -1.74, 1.94, 0.2, 10.3
Adamantite Breastplate, https://wotlkdb.com/?spell=29606, -1.83, 91.58, 89.75, 98
Fel Iron Greatsword, https://wotlkdb.com/?spell=29565, -1.9997, 51.9996, 49.9999, 96.2
Iron Shield Spike, https://wotlkdb.com/?spell=7221, -2.4578, 7.514, 5.0562, 67.3
Copper Mace, https://wotlkdb.com/?spell=2737, -2.8378, 5.8378, 3, 51.4
Rough Bronze Shoulders, https://wotlkdb.com/?spell=3328, -3.0313, 5.2535, 2.2222, 42.3
Titanium Shield Spike, https://wotlkdb.com/?spell=56357, -3.1, 63.1, 60, 95.1
Bronze Greatsword, https://wotlkdb.com/?spell=9986, -3.2188, 13.34, 10.1212, 75.9
Heavy Mithril Axe, https://wotlkdb.com/?spell=9993, -3.3085, 104.3085, 101, 96.8
Spiked Cobalt Legplates, https://wotlkdb.com/?spell=54947, -3.3792, 31.5792, 28.2, 89.3
Patterned Bronze Bracers, https://wotlkdb.com/?spell=2672, -3.557, 5.557, 2, 36
Copper Chain Pants, https://wotlkdb.com/?spell=2662, -3.68, 3.88, 0.2, 5.2
Copper Shortsword, https://wotlkdb.com/?spell=2739, -3.8378, 5.8378, 2, 34.3
Rough Bronze Bracers, https://wotlkdb.com/?spell=2671, -3.8971, 3.96, 0.0629, 1.6
Gemmed Copper Gauntlets, https://wotlkdb.com/?spell=3325, -4.06, 9.5, 5.44, 57.3
Runed Copper Bracers, https://wotlkdb.com/?spell=2664, -4.0685, 9.9685, 5.9, 59.2
Silver Rod, https://wotlkdb.com/?spell=7818, -4.2289, 10.1789, 5.95, 58.5
Green Iron Bracers, https://wotlkdb.com/?spell=3501, -4.33, 6.31, 1.98, 31.4
Golden Scale Cuirass, https://wotlkdb.com/?spell=3511, -4.34, 35.34, 31, 87.7
Green Iron Leggings, https://wotlkdb.com/?spell=3506, -4.42, 9.4, 4.98, 53
Heavy Bronze Mace, https://wotlkdb.com/?spell=3296, -4.4345, 13.787, 9.3525, 67.8
Rough Bronze Leggings, https://wotlkdb.com/?spell=2668, -4.46, 5.94, 1.48, 24.9
Bronze Mace, https://wotlkdb.com/?spell=2740, -4.51, 6.51, 2, 30.7
Cobalt Gauntlets, https://wotlkdb.com/?spell=55835, -4.658, 13.158, 8.5, 64.6
Runed Copper Breastplate, https://wotlkdb.com/?spell=2667, -4.819, 12.819, 8, 62.4
Bronze Battle Axe, https://wotlkdb.com/?spell=9987, -5.12, 15.12, 10, 66.1
Copper Chain Belt, https://wotlkdb.com/?spell=2661, -5.33, 5.82, 0.49, 8.4
Rough Bronze Boots, https://wotlkdb.com/?spell=7817, -5.3771, 6.477, 1.0999, 17
Copper Axe, https://wotlkdb.com/?spell=2738, -5.5378, 5.8378, 0.3, 5.1
Greater Ward of Shielding, https://wotlkdb.com/?spell=29729, -5.625, 5.75, 0.125, 2.2
Copper Chain Vest, https://wotlkdb.com/?spell=3321, -5.939, 7.939, 2, 25.2
Runed Copper Gauntlets, https://wotlkdb.com/?spell=3323, -5.9795, 7.939, 1.9595, 24.7
Fel Iron Chain Bracers, https://wotlkdb.com/?spell=29553, -5.9998, 25.9998, 20, 76.9
Spiked Cobalt Chestpiece, https://wotlkdb.com/?spell=54944, -6.0528, 21.0528, 15, 71.2
Horned Cobalt Helm, https://wotlkdb.com/?spell=54949, -6.1028, 21.0528, 14.95, 71
Glinting Steel Dagger, https://wotlkdb.com/?spell=15972, -6.225, 47.225, 41, 86.8
Copper Dagger, https://wotlkdb.com/?spell=8880, -6.4001, 6.4195, 0.0194, 0.3
Golden Scale Gauntlets, https://wotlkdb.com/?spell=11643, -6.42, 32.42, 26, 80.2
Bronze Axe, https://wotlkdb.com/?spell=2741, -6.61, 7.5, 0.89, 11.9
Runed Copper Belt, https://wotlkdb.com/?spell=2666, -6.7, 9.7, 3, 30.9
Runed Copper Pants, https://wotlkdb.com/?spell=3324, -7.0485, 8.0485, 1, 12.4
Copper Chain Boots, https://wotlkdb.com/?spell=3319, -7.74, 7.76, 0.02, 0.3
Silvered Bronze Shoulders, https://wotlkdb.com/?spell=3330, -8.5268, 28.5268, 20, 70.1
Spiked Cobalt Shoulders, https://wotlkdb.com/?spell=54941, -8.5412, 18.4212, 9.88, 53.6
Copper Claymore, https://wotlkdb.com/?spell=9983, -9.3095, 10.3095, 1, 9.7
Golden Scale Bracers, https://wotlkdb.com/?spell=7223, -10.64, 14.23, 3.59, 25.2
Steel Plate Helm, https://wotlkdb.com/?spell=9935, -11.0813, 36.9497, 25.8684, 70
Thorium Armor, https://wotlkdb.com/?spell=16642, -11.15, 110.15, 99, 89.9
Barbaric Iron Shoulders, https://wotlkdb.com/?spell=9811, -11.45, 11.7, 0.25, 2.1
Ornate Saronite Skullshield, https://wotlkdb.com/?spell=56556, -11.6, 101.6, 90, 88.6
Ironforge Gauntlets, https://wotlkdb.com/?spell=8368, -12.0195, 12.134, 0.1145, 0.9
Golden Scale Shoulders, https://wotlkdb.com/?spell=3505, -12.67, 17.67, 5, 28.3
Heavy Iron Knuckles, https://wotlkdb.com/?spell=25612, -12.8319, 13.4, 0.5681, 4.2
Spiked Cobalt Gauntlets, https://wotlkdb.com/?spell=54945, -13.6292, 31.5792, 17.95, 56.8
Silvered Bronze Boots, https://wotlkdb.com/?spell=3331, -13.6469, 16.5469, 2.9, 17.5
Ironforge Chain, https://wotlkdb.com/?spell=8366, -13.7494, 13.799, 0.0496, 0.4
Reinforced Cobalt Legplates, https://wotlkdb.com/?spell=54980, -14.1098, 21.4178, 7.308, 34.1
Iridescent Hammer, https://wotlkdb.com/?spell=6518, -14.7309, 15.1003, 0.3694, 2.4
Brilliant Saronite Pauldrons, https://wotlkdb.com/?spell=59440, -16.2, 61.2, 45, 73.5
Reinforced Cobalt Shoulders, https://wotlkdb.com/?spell=54978, -16.3542, 21.4178, 5.0636, 23.6
Silvered Bronze Gauntlets, https://wotlkdb.com/?spell=3333, -16.5269, 18.5269, 2, 10.8
Barbaric Iron Helm, https://wotlkdb.com/?spell=9814, -16.7863, 17.12, 0.3337, 1.9
Barbaric Iron Collar, https://wotlkdb.com/?spell=25498, -17.04, 20.04, 3, 15
Wicked Mithril Blade, https://wotlkdb.com/?spell=9997, -17.0883, 117.0883, 100, 85.4
Ironforge Breastplate, https://wotlkdb.com/?spell=8367, -17.2014, 17.2885, 0.0871, 0.5
Golden Iron Destroyer, https://wotlkdb.com/?spell=3495, -17.6959, 18.532, 0.8361, 4.5
Thick War Axe, https://wotlkdb.com/?spell=3294, -18.8988, 30.8988, 12, 38.8
Enchanted Thorium Blades, https://wotlkdb.com/?spell=34982, -19.21, 44.21, 25, 56.5
Stronghold Gauntlets, https://wotlkdb.com/?spell=16741, -19.6791, 2019.6791, 2000, 99
Blood Tiger Breastplate, https://wotlkdb.com/?spell=24124, -20.0681, 22.75, 2.6819, 11.8
Ironvine Belt, https://wotlkdb.com/?spell=28463, -20.1063, 22.06, 1.9537, 8.9
Mithril Shield Spike, https://wotlkdb.com/?spell=9939, -20.1584, 34.1584, 14, 41
Massive Iron Axe, https://wotlkdb.com/?spell=3498, -21.5152, 22.64, 1.1248, 5
Fel Iron Breastplate, https://wotlkdb.com/?spell=29550, -22.333, 43.333, 21, 48.5
Saronite Shiv, https://wotlkdb.com/?spell=55181, -22.5334, 64.5334, 42, 65.1
Barbaric Iron Gloves, https://wotlkdb.com/?spell=9820, -23.3589, 23.63, 0.2711, 1.1
Polished Steel Boots, https://wotlkdb.com/?spell=3513, -23.6923, 24.086, 0.3937, 1.6
Barbaric Iron Breastplate, https://wotlkdb.com/?spell=9813, -24.6269, 24.96, 0.3331, 1.3
Steel Weapon Chain, https://wotlkdb.com/?spell=7224, -24.63, 24.78, 0.15, 0.6
Adamantite Dagger, https://wotlkdb.com/?spell=29569, -25.46, 55.46, 30, 54.1
Barbaric Iron Boots, https://wotlkdb.com/?spell=9818, -26.13, 26.5, 0.37, 1.4
Fel Iron Chain Tunic, https://wotlkdb.com/?spell=29556, -26.9997, 38.9997, 12, 30.8
Ironvine Gloves, https://wotlkdb.com/?spell=28462, -27.4068, 29.3533, 1.9465, 6.6
Adamantite Rapier, https://wotlkdb.com/?spell=29571, -27.443, 78, 50.557, 64.8
Mithril Spurs, https://wotlkdb.com/?spell=9964, -27.5687, 32.5687, 5, 15.4
Volcanic Breastplate, https://wotlkdb.com/?spell=19076, -32.1925, 33.92, 1.7275, 5.1
Dark Iron Bracers, https://wotlkdb.com/?spell=20874, -35.5158, 37.74, 2.2242, 5.9
Elemental Sharpening Stone, https://wotlkdb.com/?spell=22757, -37.0669, 37.1919, 0.125, 0.3
Steel Breastplate, https://wotlkdb.com/?spell=9916, -37.17, 42.17, 5, 11.9
Ebon Hand, https://wotlkdb.com/?spell=23650, -37.8396, 1537.8396, 1500, 97.5
Flamebane Gloves, https://wotlkdb.com/?spell=29616, -41.8264, 241.8264, 200, 82.7
Solid Iron Maul, https://wotlkdb.com/?spell=3494, -42.3896, 51.3896, 9, 17.5
Thorium Belt, https://wotlkdb.com/?spell=16643, -42.6, 47.6, 5, 10.5
