Name, Link, Profit, Cost, Sell, ROI %
Belt of the Guardian, https://wotlkdb.com/?spell=36389, 14250.5999, 748.9, 14999.4999, 2002.9
Helm of the Great Chief, https://wotlkdb.com/?spell=16728, 9484.59, 515.41, 10000, 1940.2
Hand of Eternity, https://wotlkdb.com/?spell=29700, 9265.14, 2734.86, 12000, 438.8
Sulfuron Hammer, https://wotlkdb.com/?spell=21161, 8343.895, 6656.105, 15000, 225.4
Sageblade, https://wotlkdb.com/?spell=27832, 8326.12, 1473.88, 9800, 664.9
Arcanite Reaper, https://wotlkdb.com/?spell=16994, 4325.2, 2174.8, 6500, 298.9
Nightfall, https://wotlkdb.com/?spell=23653, 4090.04, 1408.96, 5499, 390.3
Dark Iron Mail, https://wotlkdb.com/?spell=15293, 3920.798, 79.202, 4000, 5050.4
Frostguard, https://wotlkdb.com/?spell=16992, 3659.18, 2640.82, 6300, 238.6
Heavy Copper Longsword, https://wotlkdb.com/?spell=43549, 3289.4502, 10.5498, 3300, 31280.2
Felsteel Longblade, https://wotlkdb.com/?spell=29692, 2743.02, 2656.98, 5400, 203.2
Dark Iron Helm, https://wotlkdb.com/?spell=23636, 2462.68, 37.32, 2500, 6698.8
Dark Iron Reaver, https://wotlkdb.com/?spell=20890, 2400.539, 199.461, 2600, 1303.5
Treads of Destiny, https://wotlkdb.com/?spell=63190, 2270.5, 3729.5, 6000, 160.9
Spiked Deathdealers, https://wotlkdb.com/?spell=63192, 2170.5, 3729.5, 5900, 158.2
Indestructible Plate Girdle, https://wotlkdb.com/?spell=63191, 2120.4987, 3729.5, 5849.9987, 156.9
Belt of the Titans, https://wotlkdb.com/?spell=63187, 2110.4997, 3729.5, 5839.9997, 156.6
Dark Iron Gauntlets, https://wotlkdb.com/?spell=23637, 1918.799, 81.201, 2000, 2463
Red Belt of Battle, https://wotlkdb.com/?spell=36390, 1788.3, 211.2, 1999.5, 946.7
Dark Iron Destroyer, https://wotlkdb.com/?spell=20897, 1785.079, 214.921, 2000, 930.6
Annihilator, https://wotlkdb.com/?spell=16991, 1781.18, 2218.82, 4000, 180.3
Helm of the Stalwart Defender, https://wotlkdb.com/?spell=29664, 1777.46, 721.54, 2499, 346.3
Battlelord's Plate Boots, https://wotlkdb.com/?spell=63188, 1757.5, 3729.5, 5487, 147.1
Whitesoul Helm, https://wotlkdb.com/?spell=16724, 1754.3, 245.7, 2000, 814
Steelgrip Gauntlets, https://wotlkdb.com/?spell=29662, 1707.81, 1291.19, 2999, 232.3
Sunforged Breastplate, https://wotlkdb.com/?spell=67095, 1621.2, 5078.8, 6700, 131.9
Protectors of Life, https://wotlkdb.com/?spell=70563, 1576.85, 4917.15, 6494, 132.1
Puresteel Legplates, https://wotlkdb.com/?spell=70562, 1544.28, 8204.72, 9749, 118.8
Shadesteel Bracers, https://wotlkdb.com/?spell=40034, 1423.9403, 76.0597, 1500, 1972.1
Shadesteel Sabots, https://wotlkdb.com/?spell=40033, 1420.8403, 79.1597, 1500, 1894.9
Shadesteel Girdle, https://wotlkdb.com/?spell=40036, 1390.3804, 109.6196, 1500, 1368.4
Black Dragonscale Breastplate, https://wotlkdb.com/?spell=19085, 1386, 113, 1499, 1326.5
Shadesteel Greaves, https://wotlkdb.com/?spell=40035, 1356.8205, 143.1795, 1500, 1047.6
Enchanted Adamantite Belt, https://wotlkdb.com/?spell=29608, 1342.0064, 157.9936, 1500, 949.4
Titanium Razorplate, https://wotlkdb.com/?spell=67093, 1296, 4899, 6195, 126.5
Enchanted Adamantite Boots, https://wotlkdb.com/?spell=29611, 1287.0096, 212.9904, 1500, 704.3
Enchanted Adamantite Breastplate, https://wotlkdb.com/?spell=29610, 1168.716, 331.284, 1500, 452.8
Enchanted Adamantite Leggings, https://wotlkdb.com/?spell=29613, 1153.4192, 346.5808, 1500, 432.8
Legplates of Painful Death, https://wotlkdb.com/?spell=70565, 1130.5799, 8066.72, 9197.2999, 114
Flamebane Breastplate, https://wotlkdb.com/?spell=29617, 1117.0316, 383.7184, 1500.75, 391.1
Boots of Kingly Upheaval, https://wotlkdb.com/?spell=70568, 1082.85, 4917.15, 6000, 122
Phantom Blade, https://wotlkdb.com/?spell=10007, 1013.0999, 274.9, 1287.9999, 468.5
Titansteel Shanker, https://wotlkdb.com/?spell=56234, 947, 1892, 2839, 150.1
Blazing Rapier, https://wotlkdb.com/?spell=16978, 930.476, 169.524, 1100, 648.9
Hellfrozen Bonegrinders, https://wotlkdb.com/?spell=70566, 912.05, 5425.95, 6338, 116.8
Truesilver Gauntlets, https://wotlkdb.com/?spell=9954, 897.54, 102.3, 999.84, 977.4
Pillars of Might, https://wotlkdb.com/?spell=70567, 855.28, 7638.72, 8494, 111.2
Dazzling Mithril Rapier, https://wotlkdb.com/?spell=10005, 850.388, 125.612, 976, 777
Breastplate of the White Knight, https://wotlkdb.com/?spell=67091, 721.28, 5777.72, 6499, 112.5
Dark Iron Sunderer, https://wotlkdb.com/?spell=15294, 691.496, 205.504, 897, 436.5
Titanium Spikeguards, https://wotlkdb.com/?spell=67094, 639.8, 3559.2, 4199, 118
Saronite Swordbreakers, https://wotlkdb.com/?spell=67092, 615.8, 3361.2, 3977, 118.3
Titansteel Guardian, https://wotlkdb.com/?spell=55371, 508, 1892, 2400, 126.8
Titansteel Spellblade, https://wotlkdb.com/?spell=63182, 474.6, 1873.4, 2348, 125.3
Imperial Plate Belt, https://wotlkdb.com/?spell=16647, 441.1, 58.9, 500, 848.9
Ornate Mithril Gloves, https://wotlkdb.com/?spell=9950, 413.95, 86.05, 500, 581.1
Ornate Mithril Pants, https://wotlkdb.com/?spell=9945, 397.8, 102.2, 500, 489.2
Ornate Mithril Shoulder, https://wotlkdb.com/?spell=9952, 391.55, 108.45, 500, 461
Icebane Treads, https://wotlkdb.com/?spell=61010, 382.1999, 307.8, 689.9999, 224.2
Ornate Mithril Boots, https://wotlkdb.com/?spell=9979, 374.95, 125.05, 500, 399.8
Icebane Chestguard, https://wotlkdb.com/?spell=61008, 338.9999, 421, 759.9999, 180.5
Green Iron Gauntlets, https://wotlkdb.com/?spell=3336, 327.8, 5.2, 333, 6403.8
Titansteel Destroyer, https://wotlkdb.com/?spell=55369, 318, 2482, 2800, 112.8
Searing Golden Blade, https://wotlkdb.com/?spell=15973, 285.3995, 30.6, 315.9995, 1032.7
Ornate Mithril Helm, https://wotlkdb.com/?spell=9980, 263, 136.75, 399.75, 292.3
Ornate Mithril Breastplate, https://wotlkdb.com/?spell=9972, 259.399, 140.101, 399.5, 285.2
Spiked Titansteel Helm, https://wotlkdb.com/?spell=55372, 259, 1241, 1500, 120.9
Cudgel of Saronite Justice, https://wotlkdb.com/?spell=56280, 250.4899, 77.5, 327.9899, 423.2
Titansteel Shield Wall, https://wotlkdb.com/?spell=56400, 241.9, 951.1, 1193, 125.4
Saronite Ambusher, https://wotlkdb.com/?spell=55179, 240.9333, 58.0667, 299, 514.9
Saronite Spellblade, https://wotlkdb.com/?spell=59442, 213.4899, 86.5, 299.9899, 346.8
Savage Cobalt Slicer, https://wotlkdb.com/?spell=55177, 212.3999, 64.6, 276.9999, 428.8
Icebane Girdle, https://wotlkdb.com/?spell=61009, 212.2, 307.8, 520, 168.9
Titansteel Bonecrusher, https://wotlkdb.com/?spell=55370, 208, 1892, 2100, 111
Titanium Plating, https://wotlkdb.com/?spell=62202, 207.48, 312.52, 520, 166.4
Adamantite Plate Gloves, https://wotlkdb.com/?spell=29605, 193.54, 66.46, 260, 391.2
Imperial Plate Helm, https://wotlkdb.com/?spell=16658, 188.72, 112.28, 301, 268.1
Honed Cobalt Cleaver, https://wotlkdb.com/?spell=55174, 188.5999, 66.4, 254.9999, 384
Dark Iron Shoulders, https://wotlkdb.com/?spell=15295, 174.549, 47.451, 222, 467.9
Saronite Bulwark, https://wotlkdb.com/?spell=55014, 159.5999, 71.4, 230.9999, 323.5
Dark Iron Pulverizer, https://wotlkdb.com/?spell=15292, 157.296, 142.704, 300, 210.2
Smelt Hardened Khorium, https://wotlkdb.com/?spell=46353, 155.8555, 399.7, 555.5555, 139
Vengeance Bindings, https://wotlkdb.com/?spell=55298, 154, 146, 300, 205.5
Saronite Protector, https://wotlkdb.com/?spell=55013, 141.66, 38.4, 180.06, 468.9
Ornate Saronite Gauntlets, https://wotlkdb.com/?spell=56553, 141, 146, 287, 196.6
Shining Silver Breastplate, https://wotlkdb.com/?spell=2675, 136.888, 63.612, 200.5, 315.2
Tempered Saronite Legplates, https://wotlkdb.com/?spell=54554, 134.26, 40.74, 175, 429.6
Imperial Plate Shoulders, https://wotlkdb.com/?spell=16646, 130.18, 68.82, 199, 289.2
Ornate Saronite Waistguard, https://wotlkdb.com/?spell=56551, 128.8, 69.2, 198, 286.1
Savage Saronite Gauntlets, https://wotlkdb.com/?spell=55309, 126.7499, 146, 272.7499, 186.8
Moonsteel Broadsword, https://wotlkdb.com/?spell=3496, 125.482, 24.518, 150, 611.8
Tempered Saronite Boots, https://wotlkdb.com/?spell=54552, 125.2, 49.8, 175, 351.4
Savage Saronite Waistguard, https://wotlkdb.com/?spell=55307, 124.825, 69.2, 194.025, 280.4
Savage Saronite Bracers, https://wotlkdb.com/?spell=55305, 121.5, 93.5, 215, 229.9
Brilliant Saronite Gauntlets, https://wotlkdb.com/?spell=55056, 120.2, 49.8, 170, 341.4
Repair the Blade of Heroes, https://wotlkdb.com/?spell=11923, 117.92, 15.08, 133, 882
Brilliant Saronite Helm, https://wotlkdb.com/?spell=59441, 117.1, 71.9, 189, 262.9
Savage Saronite Legplates, https://wotlkdb.com/?spell=55310, 117.0499, 103.7, 220.7499, 212.9
Savage Saronite Walkers, https://wotlkdb.com/?spell=55308, 112.3999, 86.6, 198.9999, 229.8
Imperial Plate Boots, https://wotlkdb.com/?spell=16657, 109.72, 89.28, 199, 222.9
Ornate Saronite Walkers, https://wotlkdb.com/?spell=56552, 108.4, 86.6, 195, 225.2
Savage Saronite Pauldrons, https://wotlkdb.com/?spell=55306, 105.7999, 69.2, 174.9999, 252.9
Imperial Plate Chest, https://wotlkdb.com/?spell=16663, 101.8, 99.2, 201, 202.6
Felsteel Whisper Knives, https://wotlkdb.com/?spell=34983, 97.1715, 429.3399, 526.5114, 122.6
Felsteel Shield Spike, https://wotlkdb.com/?spell=29657, 95.92, 203.08, 299, 147.2
Helm of Command, https://wotlkdb.com/?spell=55302, 94.5499, 156.2, 250.7499, 160.5
Heavy Mithril Pants, https://wotlkdb.com/?spell=9933, 94.5, 84.5, 179, 211.8
Ornate Saronite Bracers, https://wotlkdb.com/?spell=56549, 94.5, 93.5, 188, 201.1
Ornate Saronite Pauldrons, https://wotlkdb.com/?spell=56550, 87.8, 69.2, 157, 226.9
Imperial Plate Leggings, https://wotlkdb.com/?spell=16730, 81.96, 119.04, 201, 168.9
Heavy Mithril Helm, https://wotlkdb.com/?spell=9970, 79.7, 119.3, 199, 166.8
Brilliant Saronite Breastplate, https://wotlkdb.com/?spell=55058, 78.7424, 71.9, 150.6424, 209.5
Savage Saronite Skullshield, https://wotlkdb.com/?spell=55312, 77.95, 96.8, 174.75, 180.5
Savage Saronite Hauberk, https://wotlkdb.com/?spell=55311, 73.6, 75.4, 149, 197.6
Golden Scale Boots, https://wotlkdb.com/?spell=3515, 66.54, 32.46, 99, 305
Saronite Defender, https://wotlkdb.com/?spell=54557, 61.6, 38.4, 100, 260.4
Stronghold Gauntlets, https://wotlkdb.com/?spell=16741, 61.15, 1938.85, 2000, 103.2
Cobalt Chestpiece, https://wotlkdb.com/?spell=52570, 60.99, 18, 78.99, 438.8
Arcanite Rod, https://wotlkdb.com/?spell=20201, 60.02, 300.47, 360.49, 120
Tempered Titansteel Helm, https://wotlkdb.com/?spell=55373, 59, 1241, 1300, 104.8
Fel Iron Plate Pants, https://wotlkdb.com/?spell=29549, 58.8008, 31.1992, 90, 288.5
Tempered Saronite Helm, https://wotlkdb.com/?spell=54555, 58.56, 61.44, 120, 195.3
Tempered Saronite Belt, https://wotlkdb.com/?spell=54551, 56.5, 43.5, 100, 229.9
Ornate Saronite Legplates, https://wotlkdb.com/?spell=56554, 56.3, 103.7, 160, 154.3
Golden Scale Leggings, https://wotlkdb.com/?spell=3507, 55.01, 12.99, 68, 523.5
Truesilver Breastplate, https://wotlkdb.com/?spell=9974, 54.494, 195.506, 250, 127.9
Brilliant Saronite Boots, https://wotlkdb.com/?spell=55057, 52.8, 61.2, 114, 186.3
Bronze Shortsword, https://wotlkdb.com/?spell=2742, 50.7266, 6.2734, 57, 908.6
Brilliant Saronite Bracers, https://wotlkdb.com/?spell=59438, 50.1999, 49.8, 99.9999, 200.8
Spiked Cobalt Helm, https://wotlkdb.com/?spell=54917, 48, 21, 69, 328.6
Titanium Weapon Chain, https://wotlkdb.com/?spell=55839, 46.82, 62.93, 109.75, 174.4
Adamantite Plate Bracers, https://wotlkdb.com/?spell=29603, 46.27, 43.48, 89.75, 206.4
Adamantite Weightstone, https://wotlkdb.com/?spell=34608, 43.55, 6.45, 50, 775.2
Fel Iron Rod, https://wotlkdb.com/?spell=32655, 41.5006, 23.3994, 64.9, 277.4
Tempered Saronite Breastplate, https://wotlkdb.com/?spell=54553, 41.26, 43.74, 85, 194.3
Eternal Belt Buckle, https://wotlkdb.com/?spell=55656, 41.2, 57.8, 99, 171.3
Eternium Rod, https://wotlkdb.com/?spell=32657, 41, 23, 64, 278.3
Titanium Rod, https://wotlkdb.com/?spell=55732, 39.82, 62.93, 102.75, 163.3
Adamantite Rod, https://wotlkdb.com/?spell=32656, 35.0999, 59.9, 94.9999, 158.6
Mighty Iron Hammer, https://wotlkdb.com/?spell=3297, 34.4946, 10.5054, 45, 428.4
Jade Serpentblade, https://wotlkdb.com/?spell=3493, 34.22, 20.78, 55, 264.7
Cobalt Belt, https://wotlkdb.com/?spell=52568, 33, 12, 45, 375
Righteous Gauntlets, https://wotlkdb.com/?spell=55300, 30.7999, 69.2, 99.9999, 144.5
Tempered Saronite Bracers, https://wotlkdb.com/?spell=55017, 28.7, 66.3, 95, 143.3
Fel Iron Greatsword, https://wotlkdb.com/?spell=29565, 28.2012, 46.7988, 75, 160.3
Green Iron Helm, https://wotlkdb.com/?spell=3502, 27.09, 13.91, 41, 294.8
Sturdy Cobalt Quickblade, https://wotlkdb.com/?spell=55200, 26, 24, 50, 208.3
Cobalt Legplates, https://wotlkdb.com/?spell=52567, 25, 15, 40, 266.7
Cobalt Helm, https://wotlkdb.com/?spell=52571, 25, 15, 40, 266.7
Golden Scale Coif, https://wotlkdb.com/?spell=3503, 24.42, 23.58, 48, 203.6
Copper Battle Axe, https://wotlkdb.com/?spell=3293, 23.3604, 14.6396, 38, 259.6
Ornate Saronite Skullshield, https://wotlkdb.com/?spell=56556, 23.1999, 96.8, 119.9999, 124
Cobalt Triangle Shield, https://wotlkdb.com/?spell=54550, 22.9, 12, 34.9, 290.8
Oathkeeper's Helm, https://wotlkdb.com/?spell=29668, 21.9118, 928.0882, 950, 102.4
Righteous Greaves, https://wotlkdb.com/?spell=55304, 20.6, 79.4, 100, 125.9
Tempered Saronite Shoulders, https://wotlkdb.com/?spell=54556, 18.8, 61.2, 80, 130.7
Adamantite Maul, https://wotlkdb.com/?spell=29566, 18.72, 47.92, 66.64, 139.1
Furious Saronite Beatstick, https://wotlkdb.com/?spell=55182, 18.02, 76.98, 95, 123.4
Heavy Mithril Shoulder, https://wotlkdb.com/?spell=9926, 17.6, 72.4, 90, 124.3
Green Iron Shoulders, https://wotlkdb.com/?spell=3504, 17, 8, 25, 312.5
Deadly Bronze Poniard, https://wotlkdb.com/?spell=3295, 16.8067, 17.6333, 34.44, 195.3
Brilliant Saronite Belt, https://wotlkdb.com/?spell=59436, 16.4, 43.5, 59.9, 137.7
Daunting Handguards, https://wotlkdb.com/?spell=55301, 15.1, 65.2, 80.3, 123.2
Reinforced Cobalt Chestpiece, https://wotlkdb.com/?spell=54981, 15, 25, 40, 160
Fel Iron Hatchet, https://wotlkdb.com/?spell=29557, 14.9009, 35.0991, 50, 142.5
Cobalt Bracers, https://wotlkdb.com/?spell=55834, 14, 12, 26, 216.7
Pearl-handled Dagger, https://wotlkdb.com/?spell=6517, 13.63, 7.27, 20.9, 287.5
Spiked Cobalt Bracers, https://wotlkdb.com/?spell=54948, 13, 36, 49, 136.1
Whirling Steel Axes, https://wotlkdb.com/?spell=34981, 12.99, 17.01, 30, 176.4
Thick Bronze Darts, https://wotlkdb.com/?spell=34979, 12.1935, 6.6465, 18.84, 283.5
Adamantite Cleaver, https://wotlkdb.com/?spell=29568, 11.08, 47.92, 59, 123.1
Fel Iron Hammer, https://wotlkdb.com/?spell=29558, 11.001, 38.999, 50, 128.2
Reinforced Cobalt Helm, https://wotlkdb.com/?spell=54979, 11, 25, 36, 144
Shadow Crescent Axe, https://wotlkdb.com/?spell=3500, 10.1, 79.9, 90, 112.6
Ornate Saronite Hauberk, https://wotlkdb.com/?spell=56555, 9.6, 75.4, 85, 112.7
Fel Iron Plate Gloves, https://wotlkdb.com/?spell=29545, 9.4004, 15.5996, 25, 160.3
Heavy Copper Broadsword, https://wotlkdb.com/?spell=3292, 8.5666, 16.4334, 25, 152.1
Fel Iron Casing, https://wotlkdb.com/?spell=30304, 8.2903, 11.6997, 19.99, 170.9
Big Bronze Knife, https://wotlkdb.com/?spell=3491, 7.5635, 7.4365, 15, 201.7
Cobalt Boots, https://wotlkdb.com/?spell=52569, 7, 12, 19, 158.3
Bronze Warhammer, https://wotlkdb.com/?spell=9985, 6.2933, 8.7067, 15, 172.3
Thorium Armor, https://wotlkdb.com/?spell=16642, 4.64, 94.36, 99, 104.9
Daunting Legplates, https://wotlkdb.com/?spell=55303, 4.6, 75.4, 80, 106.1
Adamantite Breastplate, https://wotlkdb.com/?spell=29606, 4.33, 85.42, 89.75, 105.1
Spiked Cobalt Belt, https://wotlkdb.com/?spell=54946, 4, 36, 40, 111.1
Brilliant Saronite Legplates, https://wotlkdb.com/?spell=55055, 4, 41, 45, 109.8
Green Iron Boots, https://wotlkdb.com/?spell=3334, 3.81, 6.19, 10, 161.6
Adamantite Sharpening Stone, https://wotlkdb.com/?spell=29656, 3.5302, 7.4698, 11, 147.3
Saronite Sharpening Stone, https://wotlkdb.com/?spell=56307, 3.5302, 7.4698, 11, 147.3
Fel Iron Chain Coif, https://wotlkdb.com/?spell=29551, 3.3504, 15.5996, 18.95, 121.5
Truesilver Rod, https://wotlkdb.com/?spell=14380, 2.78, 1.74, 4.52, 259.8
Solid Weightstone, https://wotlkdb.com/?spell=9921, 2.4476, 0.0524, 2.5, 4771
Heavy Copper Maul, https://wotlkdb.com/?spell=7408, 2.4402, 12.5598, 15, 119.4
Fel Iron Plate Belt, https://wotlkdb.com/?spell=29547, 2.4004, 15.5996, 18, 115.4
Heavy Weightstone, https://wotlkdb.com/?spell=3117, 1.995, 0.505, 2.5, 495
Solid Sharpening Stone, https://wotlkdb.com/?spell=9918, 1.97, 0.03, 2, 6666.7
Fel Iron Plate Boots, https://wotlkdb.com/?spell=29548, 1.5905, 23.3994, 24.9899, 106.8
Iron Buckle, https://wotlkdb.com/?spell=8768, 1.5, 1, 2.5, 250
Dense Sharpening Stone, https://wotlkdb.com/?spell=16641, 0.9327, 0.0473, 0.98, 2071.9
Iron Counterweight, https://wotlkdb.com/?spell=7222, 0.764, 4.226, 4.99, 118.1
Fel Iron Chain Gloves, https://wotlkdb.com/?spell=29552, 0.5005, 19.4995, 20, 102.6
Coarse Sharpening Stone, https://wotlkdb.com/?spell=2665, 0.48, 0.02, 0.5, 2500
Fel Sharpening Stone, https://wotlkdb.com/?spell=29654, 0.3602, 4.6398, 5, 107.8
Glinting Steel Dagger, https://wotlkdb.com/?spell=15972, 0.29, 40.71, 41, 100.7
Rough Sharpening Stone, https://wotlkdb.com/?spell=2660, 0.1387, 0.0058, 0.1445, 2491.4
Hardened Iron Shortsword, https://wotlkdb.com/?spell=3492, 0.118, 9.882, 10, 101.2
Coarse Grinding Stone, https://wotlkdb.com/?spell=3326, 0.05, 0.04, 0.09, 225
Rough Weightstone, https://wotlkdb.com/?spell=3115, 0.0399, 0.0108, 0.0507, 469.4
Rough Grinding Stone, https://wotlkdb.com/?spell=3320, 0.0383, 0.0116, 0.0499, 430.2
Cobalt Shoulders, https://wotlkdb.com/?spell=52572, 0, 12, 12, 100
Golden Rod, https://wotlkdb.com/?spell=14379, -0.03, 1.18, 1.15, 97.5
Coarse Weightstone, https://wotlkdb.com/?spell=3116, -0.035, 0.045, 0.01, 22.2
Heavy Sharpening Stone, https://wotlkdb.com/?spell=2674, -0.0625, 0.48, 0.4175, 87
Solid Grinding Stone, https://wotlkdb.com/?spell=9920, -0.07, 0.12, 0.05, 41.7
Heavy Grinding Stone, https://wotlkdb.com/?spell=3337, -0.45, 1.44, 0.99, 68.8
Forged Cobalt Claymore, https://wotlkdb.com/?spell=55203, -0.8, 30, 29.2, 97.3
Iron Shield Spike, https://wotlkdb.com/?spell=7221, -1.3038, 6.36, 5.0562, 79.5
Copper Bracers, https://wotlkdb.com/?spell=2663, -1.74, 1.94, 0.2, 10.3
Rough Bronze Cuirass, https://wotlkdb.com/?spell=2670, -1.86, 6.86, 5, 72.9
Notched Cobalt War Axe, https://wotlkdb.com/?spell=55204, -2, 30, 28, 93.3
Patterned Bronze Bracers, https://wotlkdb.com/?spell=2672, -2.08, 5.08, 3, 59.1
Silver Rod, https://wotlkdb.com/?spell=7818, -2.6498, 8.5998, 5.95, 69.2
Copper Mace, https://wotlkdb.com/?spell=2737, -2.84, 5.84, 3, 51.4
Rough Bronze Shoulders, https://wotlkdb.com/?spell=3328, -3, 4.99, 1.99, 39.9
Bronze Greatsword, https://wotlkdb.com/?spell=9986, -3.3722, 13.4934, 10.1212, 75
Fel Iron Chain Bracers, https://wotlkdb.com/?spell=29553, -3.3994, 23.3994, 20, 85.5
Copper Chain Pants, https://wotlkdb.com/?spell=2662, -3.68, 3.88, 0.2, 5.2
Copper Shortsword, https://wotlkdb.com/?spell=2739, -3.84, 5.84, 2, 34.2
Rough Bronze Bracers, https://wotlkdb.com/?spell=2671, -3.8571, 3.92, 0.0629, 1.6
Runed Copper Bracers, https://wotlkdb.com/?spell=2664, -3.9497, 9.8497, 5.9, 59.9
Spiked Cobalt Boots, https://wotlkdb.com/?spell=54918, -4, 21, 17, 81
Cobalt Tenderizer, https://wotlkdb.com/?spell=55201, -4, 24, 20, 83.3
Green Iron Leggings, https://wotlkdb.com/?spell=3506, -4.02, 9, 4.98, 55.3
Green Iron Bracers, https://wotlkdb.com/?spell=3501, -4.03, 6.01, 1.98, 32.9
Gemmed Copper Gauntlets, https://wotlkdb.com/?spell=3325, -4.06, 9.5, 5.44, 57.3
Heavy Bronze Mace, https://wotlkdb.com/?spell=3296, -4.1609, 13.5134, 9.3525, 69.2
Golden Scale Cuirass, https://wotlkdb.com/?spell=3511, -4.36, 35.36, 31, 87.7
Rough Bronze Leggings, https://wotlkdb.com/?spell=2668, -4.4, 5.88, 1.48, 25.2
Silvered Bronze Boots, https://wotlkdb.com/?spell=3331, -4.56, 14.56, 10, 68.7
Bronze Mace, https://wotlkdb.com/?spell=2740, -4.5867, 6.5867, 2, 30.4
Runed Copper Breastplate, https://wotlkdb.com/?spell=2667, -4.7398, 12.7398, 8, 62.8
Silvered Bronze Shoulders, https://wotlkdb.com/?spell=3330, -5.02, 25.02, 20, 79.9
Rough Bronze Boots, https://wotlkdb.com/?spell=7817, -5.0795, 6.1794, 1.0999, 17.8
Bronze Battle Axe, https://wotlkdb.com/?spell=9987, -5.2534, 15.2534, 10, 65.6
Copper Chain Belt, https://wotlkdb.com/?spell=2661, -5.33, 5.82, 0.49, 8.4
Greater Ward of Shielding, https://wotlkdb.com/?spell=29729, -5.625, 5.75, 0.125, 2.2
Copper Axe, https://wotlkdb.com/?spell=2738, -5.82, 5.84, 0.02, 0.3
Copper Chain Vest, https://wotlkdb.com/?spell=3321, -5.8598, 7.8598, 2, 25.4
Runed Copper Gauntlets, https://wotlkdb.com/?spell=3323, -5.9003, 7.8598, 1.9595, 24.9
Sure-fire Shuriken, https://wotlkdb.com/?spell=55202, -6.3, 21, 14.7, 70
Copper Dagger, https://wotlkdb.com/?spell=8880, -6.3104, 6.3298, 0.0194, 0.3
Golden Scale Gauntlets, https://wotlkdb.com/?spell=11643, -6.46, 32.46, 26, 80.1
Cobalt Gauntlets, https://wotlkdb.com/?spell=55835, -6.5, 15, 8.5, 56.7
Bronze Axe, https://wotlkdb.com/?spell=2741, -6.6767, 7.5667, 0.89, 11.8
Runed Copper Belt, https://wotlkdb.com/?spell=2666, -6.7, 9.7, 3, 30.9
Runed Copper Pants, https://wotlkdb.com/?spell=3324, -6.9297, 7.9297, 1, 12.6
Heavy Mithril Axe, https://wotlkdb.com/?spell=9993, -7.45, 108.45, 101, 93.1
Copper Chain Boots, https://wotlkdb.com/?spell=3319, -7.74, 7.76, 0.02, 0.3
Spiked Cobalt Legplates, https://wotlkdb.com/?spell=54947, -7.8, 36, 28.2, 78.3
Titanium Shield Spike, https://wotlkdb.com/?spell=56357, -7.9301, 62.93, 54.9999, 87.4
Silvered Bronze Breastplate, https://wotlkdb.com/?spell=2673, -8.98, 26.98, 18, 66.7
Horned Cobalt Helm, https://wotlkdb.com/?spell=54949, -9.05, 24, 14.95, 62.3
Copper Claymore, https://wotlkdb.com/?spell=9983, -9.2198, 10.2198, 1, 9.8
Enchanted Thorium Blades, https://wotlkdb.com/?spell=34982, -9.31, 39.31, 30, 76.3
Deadly Saronite Dirk, https://wotlkdb.com/?spell=55206, -9.66, 39.66, 30, 75.6
Spiked Cobalt Chestpiece, https://wotlkdb.com/?spell=54944, -10, 24, 14, 58.3
Steel Plate Helm, https://wotlkdb.com/?spell=9935, -10.3816, 36.25, 25.8684, 71.4
Barbaric Iron Shoulders, https://wotlkdb.com/?spell=9811, -11.05, 11.3, 0.25, 2.2
Ironforge Gauntlets, https://wotlkdb.com/?spell=8368, -11.0855, 11.2, 0.1145, 1
Spiked Cobalt Shoulders, https://wotlkdb.com/?spell=54941, -11.12, 21, 9.88, 47
Golden Scale Bracers, https://wotlkdb.com/?spell=7223, -11.25, 14.23, 2.98, 20.9
Heavy Iron Knuckles, https://wotlkdb.com/?spell=25612, -12.4319, 13, 0.5681, 4.4
Golden Scale Shoulders, https://wotlkdb.com/?spell=3505, -12.69, 17.69, 5, 28.3
Iridescent Hammer, https://wotlkdb.com/?spell=6518, -13.144, 13.5134, 0.3694, 2.7
Silvered Bronze Gauntlets, https://wotlkdb.com/?spell=3333, -13.52, 16.52, 3, 18.2
Ebon Hand, https://wotlkdb.com/?spell=23650, -13.6, 1513.6, 1500, 99.1
Ironforge Chain, https://wotlkdb.com/?spell=8366, -13.6702, 13.7198, 0.0496, 0.4
Fel Iron Breastplate, https://wotlkdb.com/?spell=29550, -13.999, 38.999, 25, 64.1
Barbaric Iron Collar, https://wotlkdb.com/?spell=25498, -14, 17, 3, 17.6
Thick War Axe, https://wotlkdb.com/?spell=3294, -15.7196, 27.7196, 12, 43.3
Brilliant Saronite Pauldrons, https://wotlkdb.com/?spell=59440, -16.2, 61.2, 45, 73.5
Barbaric Iron Helm, https://wotlkdb.com/?spell=9814, -16.3263, 16.66, 0.3337, 2
Ironforge Breastplate, https://wotlkdb.com/?spell=8367, -17.0826, 17.1697, 0.0871, 0.5
Golden Iron Destroyer, https://wotlkdb.com/?spell=3495, -17.2359, 18.072, 0.8361, 4.6
Reinforced Cobalt Legplates, https://wotlkdb.com/?spell=54980, -17.692, 25, 7.308, 29.2
Spiked Cobalt Gauntlets, https://wotlkdb.com/?spell=54945, -18.05, 36, 17.95, 49.9
Blood Tiger Breastplate, https://wotlkdb.com/?spell=24124, -19.8181, 22.5, 2.6819, 11.9
Adamantite Dagger, https://wotlkdb.com/?spell=29569, -19.93, 49.93, 30, 60.1
Reinforced Cobalt Shoulders, https://wotlkdb.com/?spell=54978, -19.9364, 25, 5.0636, 20.3
Massive Iron Axe, https://wotlkdb.com/?spell=3498, -20.8552, 21.98, 1.1248, 5.1
Adamantite Rapier, https://wotlkdb.com/?spell=29571, -21.323, 71.88, 50.557, 70.3
Mithril Shield Spike, https://wotlkdb.com/?spell=9939, -21.5, 35.5, 14, 39.4
Saronite Shiv, https://wotlkdb.com/?spell=55181, -22.5334, 64.5334, 42, 65.1
Barbaric Iron Gloves, https://wotlkdb.com/?spell=9820, -22.6989, 22.97, 0.2711, 1.2
Fel Iron Chain Tunic, https://wotlkdb.com/?spell=29556, -23.0991, 35.0991, 12, 34.2
Polished Steel Boots, https://wotlkdb.com/?spell=3513, -23.1323, 23.526, 0.3937, 1.7
Ironvine Belt, https://wotlkdb.com/?spell=28463, -23.2263, 25.18, 1.9537, 7.8
Wicked Mithril Blade, https://wotlkdb.com/?spell=9997, -23.45, 123.45, 100, 81
Barbaric Iron Breastplate, https://wotlkdb.com/?spell=9813, -23.6269, 23.96, 0.3331, 1.4
Elemental Sharpening Stone, https://wotlkdb.com/?spell=22757, -24.1169, 24.2419, 0.125, 0.5
Steel Weapon Chain, https://wotlkdb.com/?spell=7224, -24.63, 24.78, 0.15, 0.6
Tempered Saronite Gauntlets, https://wotlkdb.com/?spell=55015, -25.5, 71.4, 45.9, 64.3
Barbaric Iron Boots, https://wotlkdb.com/?spell=9818, -25.61, 25.98, 0.37, 1.4
Mithril Spurs, https://wotlkdb.com/?spell=9964, -28.95, 33.95, 5, 14.7
Thorium Belt, https://wotlkdb.com/?spell=16643, -30.68, 39.68, 9, 22.7
Huge Thorium Battleaxe, https://wotlkdb.com/?spell=16971, -30.82, 71.82, 41, 57.1
Ironvine Gloves, https://wotlkdb.com/?spell=28462, -31.5668, 33.5133, 1.9465, 5.8
Volcanic Breastplate, https://wotlkdb.com/?spell=19076, -32.8525, 34.58, 1.7275, 5
Dark Iron Bracers, https://wotlkdb.com/?spell=20874, -33.1358, 35.36, 2.2242, 6.3
Thorium Bracers, https://wotlkdb.com/?spell=16644, -35.14, 39.68, 4.54, 11.4
Solid Iron Maul, https://wotlkdb.com/?spell=3494, -35.99, 44.99, 9, 20
Thorium Leggings, https://wotlkdb.com/?spell=16662, -36.95, 59.52, 22.57, 37.9
Steel Breastplate, https://wotlkdb.com/?spell=9916, -37.17, 42.17, 5, 11.9
Imperial Plate Bracers, https://wotlkdb.com/?spell=16649, -39.22, 59.52, 20.3, 34.1
Ironfeather Shoulders, https://wotlkdb.com/?spell=19062, -45.2122, 46.488, 1.2758, 2.7
Heavy Mithril Gauntlet, https://wotlkdb.com/?spell=9928, -45.35, 51.2, 5.85, 11.4
Flamebane Gloves, https://wotlkdb.com/?spell=29616, -46.4392, 246.4392, 200, 81.2
Mithril Scale Bracers, https://wotlkdb.com/?spell=9937, -46.85, 67.6, 20.75, 30.7
