Glyph of Avenging Wrath, https://wotlkdb.com/?spell=57021, 0.4, 12.6, 13, 103.2
Glyph of Scourge Imprisonment, https://wotlkdb.com/?spell=57198, 0.3996, 12.6, 12.9996, 103.2
Glyph of Aspect of the Viper, https://wotlkdb.com/?spell=56998, 0.35, 12.6, 12.95, 102.8
Lion's Ink, https://wotlkdb.com/?spell=57704, 0.33, 3.92, 4.25, 108.4
Scroll of Spirit, https://wotlkdb.com/?spell=48116, 0.1385, 0.5015, 0.64, 127.6
Glyph of Renew, https://wotlkdb.com/?spell=57197, 0.0475, 15.0025, 15.05, 100.3
Ivory Ink, https://wotlkdb.com/?spell=52738, 0, 0.5, 0.5, 100
Glyph of Rapid Fire, https://wotlkdb.com/?spell=57008, 0, 5, 5, 100
Celestial Ink, https://wotlkdb.com/?spell=57709, 0, 10, 10, 100
Scroll of Recall II, https://wotlkdb.com/?spell=60336, -0.0626, 10.0125, 9.9499, 99.4
Scroll of Stamina, https://wotlkdb.com/?spell=45382, -0.1015, 0.5015, 0.4, 79.8
Glyph of Arcane Explosion, https://wotlkdb.com/?spell=56968, -0.1216, 4.2515, 4.1299, 97.1
Glyph of Cleaving, https://wotlkdb.com/?spell=57154, -0.125, 10.125, 10, 98.8
Glyph of Searing Pain, https://wotlkdb.com/?spell=57270, -0.175, 10.125, 9.95, 98.3
Glyph of Healing Touch, https://wotlkdb.com/?spell=56945, -0.2826, 4.2625, 3.9799, 93.4
Glyph of Aimed Shot, https://wotlkdb.com/?spell=56994, -0.4525, 15.0025, 14.55, 97
Scroll of Intellect, https://wotlkdb.com/?spell=48114, -0.4978, 0.5015, 0.0037, 0.7
Glyph of Entangling Roots, https://wotlkdb.com/?spell=48121, -0.5616, 4.2515, 3.6899, 86.8
Scroll of Agility, https://wotlkdb.com/?spell=58472, -0.5635, 1.0015, 0.438, 43.7
Glyph of Felhunter, https://wotlkdb.com/?spell=57264, -0.65, 12.6, 11.95, 94.8
Glyph of Backstab, https://wotlkdb.com/?spell=57114, -0.7516, 4.5015, 3.7499, 83.3
Dawnstar Ink, https://wotlkdb.com/?spell=57706, -0.8501, 1.8, 0.9499, 52.8
Glyph of Unbreakable Armor, https://wotlkdb.com/?spell=57226, -0.9775, 5, 4.0225, 80.5
Scroll of Strength, https://wotlkdb.com/?spell=58484, -0.9965, 1.0015, 0.005, 0.5
Glyph of Mind Flay, https://wotlkdb.com/?spell=57200, -1.0025, 15.0025, 14, 93.3
Glyph of Evocation, https://wotlkdb.com/?spell=56974, -1.0125, 15.0025, 13.99, 93.3
Glyph of Ice Block, https://wotlkdb.com/?spell=56979, -1.125, 10.125, 9, 88.9
Glyph of Freezing Trap, https://wotlkdb.com/?spell=57002, -1.165, 5.125, 3.96, 77.3
Ink of the Sky, https://wotlkdb.com/?spell=57712, -1.2501, 3, 1.7499, 58.3
Snowfall Ink, https://wotlkdb.com/?spell=57716, -1.38, 11.33, 9.95, 87.8
Glyph of Healthstone, https://wotlkdb.com/?spell=57266, -1.5415, 4.5015, 2.96, 65.8
Glyph of Blood Strike, https://wotlkdb.com/?spell=59339, -1.6701, 5, 3.3299, 66.6
Hunter's Ink, https://wotlkdb.com/?spell=57703, -1.89, 2, 0.11, 5.5
Glyph of Scourge Strike, https://wotlkdb.com/?spell=57224, -2, 5, 3, 60
Glyph of Icy Veins, https://wotlkdb.com/?spell=56981, -2.0026, 15.0025, 12.9999, 86.7
Glyph of Mana Gem, https://wotlkdb.com/?spell=56985, -2.1151, 5.125, 3.0099, 58.7
Glyph of Slice and Dice, https://wotlkdb.com/?spell=57132, -2.175, 10.125, 7.95, 78.5
Glyph of Sunder Armor, https://wotlkdb.com/?spell=57167, -2.2626, 4.2625, 1.9999, 46.9
Glyph of Deterrence, https://wotlkdb.com/?spell=57000, -2.3625, 10.0125, 7.65, 76.4
Fiery Ink, https://wotlkdb.com/?spell=57710, -2.4014, 2.4999, 0.0985, 3.9
Glyph of Psychic Scream, https://wotlkdb.com/?spell=57196, -2.5017, 4.5015, 1.9998, 44.4
Glyph of Claw, https://wotlkdb.com/?spell=67600, -2.5017, 4.5015, 1.9998, 44.4
Glyph of Lightning Shield, https://wotlkdb.com/?spell=57246, -2.5415, 4.5015, 1.96, 43.5
Mystic Tome, https://wotlkdb.com/?spell=58565, -2.565, 9.565, 7, 73.2
Glyph of Hex, https://wotlkdb.com/?spell=64316, -2.75, 12.6, 9.85, 78.2
Jadefire Ink, https://wotlkdb.com/?spell=57707, -2.81, 17.8, 14.99, 84.2
Royal Guide of Escape Routes, https://wotlkdb.com/?spell=59486, -2.962, 32.962, 30, 91
Glyph of Arcane Power, https://wotlkdb.com/?spell=56972, -3, 5, 2, 40
Scroll of Strength VIII, https://wotlkdb.com/?spell=58491, -3.1, 13.1, 10, 76.3
Glyph of Gouge, https://wotlkdb.com/?spell=57125, -3.1025, 15.0025, 11.9, 79.3
Glyph of Bone Shield, https://wotlkdb.com/?spell=57210, -3.1251, 5.125, 1.9999, 39
Glyph of Death Grip, https://wotlkdb.com/?spell=57213, -3.1252, 5.125, 1.9998, 39
Glyph of Divinity, https://wotlkdb.com/?spell=57031, -3.1526, 4.2625, 1.1099, 26
Book of Survival, https://wotlkdb.com/?spell=59478, -3.3745, 13.3745, 10, 74.8
Scroll of Agility II, https://wotlkdb.com/?spell=58473, -3.4719, 4.5015, 1.0296, 22.9
Glyph of Expose Armor, https://wotlkdb.com/?spell=57121, -3.5625, 4.2625, 0.7, 16.4
Glyph of Remove Curse, https://wotlkdb.com/?spell=56988, -3.6, 12.6, 9, 71.4
Royal Ink, https://wotlkdb.com/?spell=57708, -3.6211, 4.1925, 0.5714, 13.6
Glyph of Snake Trap, https://wotlkdb.com/?spell=57010, -3.6501, 12.6, 8.9499, 71
Scroll of Strength VI, https://wotlkdb.com/?spell=58489, -3.75, 4.75, 1, 21.1
Darkflame Ink, https://wotlkdb.com/?spell=57714, -3.8555, 3.98, 0.1245, 3.1
Glyph of Rebirth, https://wotlkdb.com/?spell=56953, -4.0025, 15.0025, 11, 73.3
Armor Vellum II, https://wotlkdb.com/?spell=59499, -4.01, 10.025, 6.015, 60
Scroll of Stamina II, https://wotlkdb.com/?spell=50612, -4.0715, 4.5015, 0.43, 9.6
Glyph of Fear Ward, https://wotlkdb.com/?spell=57185, -4.125, 5.125, 1, 19.5
Scroll of Agility V, https://wotlkdb.com/?spell=58480, -4.25, 5.25, 1, 19
Scroll of Spirit II, https://wotlkdb.com/?spell=50605, -4.2716, 4.5015, 0.2299, 5.1
Scroll of Intellect VI, https://wotlkdb.com/?spell=50602, -4.2792, 4.75, 0.4708, 9.9
Scroll of Stamina V, https://wotlkdb.com/?spell=50617, -4.285, 5.25, 0.965, 18.4
Scroll of Intellect II, https://wotlkdb.com/?spell=50598, -4.302, 4.5015, 0.1995, 4.4
Scroll of Strength V, https://wotlkdb.com/?spell=58488, -4.32, 5.25, 0.93, 17.7
Weapon Vellum II, https://wotlkdb.com/?spell=59488, -4.3335, 10.3485, 6.015, 58.1
Scroll of Intellect V, https://wotlkdb.com/?spell=50601, -4.35, 5.25, 0.9, 17.1
Scroll of Agility VI, https://wotlkdb.com/?spell=58481, -4.4912, 4.75, 0.2588, 5.4
Scroll of Strength II, https://wotlkdb.com/?spell=58485, -4.4923, 4.5015, 0.0092, 0.2
Scroll of Recall III, https://wotlkdb.com/?spell=60337, -4.6, 12.6, 8, 63.5
Glyph of Curse of Agony, https://wotlkdb.com/?spell=57260, -4.625, 12.6, 7.975, 63.3
Scroll of Spirit VI, https://wotlkdb.com/?spell=50609, -4.864, 5.25, 0.386, 7.4
Armor Vellum, https://wotlkdb.com/?spell=52739, -4.9132, 5.893, 0.9798, 16.6
Glyph of Insect Swarm, https://wotlkdb.com/?spell=56948, -5.0025, 15.0025, 10, 66.7
Glyph of Scorch, https://wotlkdb.com/?spell=56982, -5.135, 10.125, 4.99, 49.3
Scroll of Recall, https://wotlkdb.com/?spell=48248, -5.2183, 5.8915, 0.6732, 11.4
Scroll of Stamina VI, https://wotlkdb.com/?spell=50618, -5.2215, 5.25, 0.0285, 0.5
Scroll of Spirit V, https://wotlkdb.com/?spell=50608, -5.2234, 5.25, 0.0266, 0.5
Glyph of Crusader Strike, https://wotlkdb.com/?spell=57024, -5.2501, 10.125, 4.8749, 48.1
Glyph of Ice Lance, https://wotlkdb.com/?spell=56980, -5.6, 12.6, 7, 55.6
Armor Vellum III, https://wotlkdb.com/?spell=59500, -5.6, 13.1, 7.5, 57.3
Glyph of Revenge, https://wotlkdb.com/?spell=57165, -6.2775, 15.0025, 8.725, 58.2
Glyph of Dispel Magic, https://wotlkdb.com/?spell=57183, -6.305, 10.125, 3.82, 37.7
Weapon Vellum, https://wotlkdb.com/?spell=52840, -6.603, 13.503, 6.9, 51.1
Scroll of Agility VIII, https://wotlkdb.com/?spell=58483, -7.9, 13.1, 5.2, 39.7
Glyph of Lava Lash, https://wotlkdb.com/?spell=57249, -8.0025, 15.0025, 7, 46.7
Glyph of Soulstone, https://wotlkdb.com/?spell=57274, -8.185, 10.125, 1.94, 19.2
Glyph of Barbaric Insults, https://wotlkdb.com/?spell=57151, -9.125, 10.125, 1, 9.9
Scroll of Stamina VIII, https://wotlkdb.com/?spell=50620, -9.2, 13.1, 3.9, 29.8
Scroll of Spirit IV, https://wotlkdb.com/?spell=50607, -9.615, 10.25, 0.635, 6.2
Scroll of Strength IV, https://wotlkdb.com/?spell=58487, -9.76, 10.25, 0.49, 4.8
Scroll of Intellect IV, https://wotlkdb.com/?spell=50600, -9.8001, 10.25, 0.4499, 4.4
Scroll of Agility IV, https://wotlkdb.com/?spell=58478, -10.2368, 10.25, 0.0132, 0.1
Scroll of Stamina IV, https://wotlkdb.com/?spell=50616, -10.2383, 10.25, 0.0117, 0.1
Scroll of Intellect VIII, https://wotlkdb.com/?spell=50604, -10.6, 13.1, 2.5, 19.1
Glyph of Sap, https://wotlkdb.com/?spell=57129, -11.0225, 15.0025, 3.98, 26.5
Scroll of Spirit VIII, https://wotlkdb.com/?spell=50611, -11.1, 13.1, 2, 15.3
Ethereal Ink, https://wotlkdb.com/?spell=57713, -11.5, 16, 4.5, 28.1
Glyph of Strangulate, https://wotlkdb.com/?spell=57225, -11.6, 12.6, 1, 7.9
Glyph of Multi-Shot, https://wotlkdb.com/?spell=57007, -12.0025, 15.0025, 3, 20
Glyph of Shadow Bolt, https://wotlkdb.com/?spell=57271, -12.1125, 15.0025, 2.89, 19.3
Scroll of Stamina VII, https://wotlkdb.com/?spell=50619, -12.95, 13.1, 0.15, 1.1
Scroll of Spirit VII, https://wotlkdb.com/?spell=50610, -13.0215, 13.1, 0.0785, 0.6
Glyph of Cleansing, https://wotlkdb.com/?spell=57020, -13.0225, 15.0025, 1.98, 13.2
Scroll of Intellect VII, https://wotlkdb.com/?spell=50603, -13.044, 13.1, 0.056, 0.4
Scroll of Strength VII, https://wotlkdb.com/?spell=58490, -13.05, 13.1, 0.05, 0.4
Scroll of Agility VII, https://wotlkdb.com/?spell=58482, -13.0508, 13.1, 0.0492, 0.4
Glyph of Frost Shock, https://wotlkdb.com/?spell=57241, -14.0526, 15.0025, 0.9499, 6.3
Scroll of Spirit III, https://wotlkdb.com/?spell=50606, -14.2329, 15.015, 0.7821, 5.2
Scroll of Stamina III, https://wotlkdb.com/?spell=50614, -14.475, 15.015, 0.54, 3.6
Scroll of Agility III, https://wotlkdb.com/?spell=58476, -14.555, 15.015, 0.46, 3.1
Glyph of Voidwalker, https://wotlkdb.com/?spell=57277, -14.5625, 15.0025, 0.44, 2.9
Scroll of Intellect III, https://wotlkdb.com/?spell=50599, -14.795, 15.015, 0.22, 1.5
Scroll of Strength III, https://wotlkdb.com/?spell=58486, -15.0018, 15.015, 0.0132, 0.1
Weapon Vellum III, https://wotlkdb.com/?spell=59501, -21.3, 37.3, 16, 42.9
Stormbound Tome, https://wotlkdb.com/?spell=59493, -33.9842, 34.1242, 0.14, 0.4
Manual of Clouds, https://wotlkdb.com/?spell=59494, -35.1092, 35.2492, 0.14, 0.4
