Glyph of Death Grip, https://wotlkdb.com/?spell=57213, 2.2249, 5.125, 7.3499, 143.4
Glyph of Focus, https://wotlkdb.com/?spell=62162, 1.6224, 18.4, 20.0224, 108.8
Glyph of the Hawk, https://wotlkdb.com/?spell=57006, 1.6, 18.4, 20, 108.7
Glyph of Trueshot Aura, https://wotlkdb.com/?spell=57012, 1.6, 18.4, 20, 108.7
Glyph of Immolate, https://wotlkdb.com/?spell=57268, 1.6, 18.4, 20, 108.7
Glyph of Stormstrike, https://wotlkdb.com/?spell=57248, 1.59, 18.4, 19.99, 108.6
Midnight Ink, https://wotlkdb.com/?spell=53462, 1.5882, 4.8824, 6.4706, 132.5
Glyph of Rune Strike, https://wotlkdb.com/?spell=57223, 1.5683, 18.4, 19.9683, 108.5
Glyph of Avenger's Shield, https://wotlkdb.com/?spell=57019, 1.55, 18.4, 19.95, 108.4
Glyph of Rake, https://wotlkdb.com/?spell=56952, 1.4, 10.5, 11.9, 113.3
Glyph of Water Elemental, https://wotlkdb.com/?spell=56989, 1.4, 18.4, 19.8, 107.6
Glyph of Sap, https://wotlkdb.com/?spell=57129, 0.9875, 6.0125, 7, 116.4
Glyph of Hurricane, https://wotlkdb.com/?spell=56946, 0.5999, 18.4, 18.9999, 103.3
Glyph of Mass Dispel, https://wotlkdb.com/?spell=57190, 0.5995, 18.4, 18.9995, 103.3
Glyph of Ice Block, https://wotlkdb.com/?spell=56979, 0.555, 2.445, 3, 122.7
Moonglow Ink, https://wotlkdb.com/?spell=52843, 0.5, 4, 4.5, 112.5
Scroll of Stamina, https://wotlkdb.com/?spell=45382, 0.4935, 0.4465, 0.94, 210.5
Scroll of Intellect, https://wotlkdb.com/?spell=48114, 0.4457, 0.4465, 0.8922, 199.8
Darkflame Ink, https://wotlkdb.com/?spell=57714, 0.3471, 0.99, 1.3371, 135.1
Glyph of Fire Nova, https://wotlkdb.com/?spell=57238, 0.1875, 5.0125, 5.2, 103.7
Royal Ink, https://wotlkdb.com/?spell=57708, 0.0416, 0.0584, 0.1, 171.2
Dawnstar Ink, https://wotlkdb.com/?spell=57706, 0.0254, 0.75, 0.7754, 103.4
Scroll of Recall II, https://wotlkdb.com/?spell=60336, -0.0107, 2.3325, 2.3218, 99.5
Ink of the Sky, https://wotlkdb.com/?spell=57712, -0.2443, 2.9943, 2.75, 91.8
Glyph of Rapid Rejuvenation, https://wotlkdb.com/?spell=71015, -0.2515, 18.4, 18.1485, 98.6
Scroll of Spirit, https://wotlkdb.com/?spell=48116, -0.4366, 0.4465, 0.0099, 2.2
Hunter's Ink, https://wotlkdb.com/?spell=57703, -0.4621, 0.5121, 0.05, 9.8
Glyph of Crusader Strike, https://wotlkdb.com/?spell=57024, -0.495, 2.445, 1.95, 79.8
Armor Vellum, https://wotlkdb.com/?spell=52739, -0.503, 4.503, 4, 88.8
Glyph of Searing Pain, https://wotlkdb.com/?spell=57270, -0.5247, 2.445, 1.9203, 78.5
Scroll of Agility IV, https://wotlkdb.com/?spell=58478, -0.57, 2.57, 2, 77.8
Glyph of Holy Nova, https://wotlkdb.com/?spell=57187, -0.6, 10.5, 9.9, 94.3
Scroll of Strength, https://wotlkdb.com/?spell=58484, -0.743, 0.8915, 0.1485, 16.7
Scroll of Agility, https://wotlkdb.com/?spell=58472, -0.8766, 0.8915, 0.0149, 1.7
Glyph of Freezing Trap, https://wotlkdb.com/?spell=57002, -1.125, 5.125, 4, 78
Scroll of Recall, https://wotlkdb.com/?spell=48248, -1.3515, 4.5015, 3.15, 70
Glyph of Soulstone, https://wotlkdb.com/?spell=57274, -1.425, 2.445, 1.02, 41.7
Glyph of Barbaric Insults, https://wotlkdb.com/?spell=57151, -1.445, 2.445, 1, 40.9
Glyph of Evasion, https://wotlkdb.com/?spell=57119, -1.4721, 6.4721, 5, 77.3
Ivory Ink, https://wotlkdb.com/?spell=52738, -1.555, 2, 0.445, 22.3
Scroll of Intellect IV, https://wotlkdb.com/?spell=50600, -1.57, 2.57, 1, 38.9
Fiery Ink, https://wotlkdb.com/?spell=57710, -1.9826, 2.2321, 0.2495, 11.2
Ethereal Ink, https://wotlkdb.com/?spell=57713, -2, 12, 10, 83.3
Glyph of Bone Shield, https://wotlkdb.com/?spell=57210, -2.239, 5.125, 2.886, 56.3
Scroll of Spirit IV, https://wotlkdb.com/?spell=50607, -2.4115, 2.57, 0.1585, 6.2
Glyph of Backstab, https://wotlkdb.com/?spell=57114, -2.4721, 6.4721, 4, 61.8
Glyph of Claw, https://wotlkdb.com/?spell=67600, -2.4721, 6.4721, 4, 61.8
Scroll of Strength IV, https://wotlkdb.com/?spell=58487, -2.5327, 2.57, 0.0373, 1.5
Scroll of Stamina IV, https://wotlkdb.com/?spell=50616, -2.5368, 2.57, 0.0332, 1.3
Glyph of Shocking, https://wotlkdb.com/?spell=57235, -2.9, 18.4, 15.5, 84.2
Glyph of Intervene, https://wotlkdb.com/?spell=57159, -2.9001, 18.4, 15.4999, 84.2
Shimmering Ink, https://wotlkdb.com/?spell=57711, -2.9266, 7.9266, 5, 63.1
Snowfall Ink, https://wotlkdb.com/?spell=57716, -2.9999, 13.9998, 10.9999, 78.6
Lion's Ink, https://wotlkdb.com/?spell=57704, -3, 8, 5, 62.5
Glyph of Entangling Roots, https://wotlkdb.com/?spell=48121, -3.0215, 5.0015, 1.98, 39.6
Glyph of Invisibility, https://wotlkdb.com/?spell=56983, -3.4, 18.4, 15, 81.5
Glyph of Spiritual Attunement, https://wotlkdb.com/?spell=57022, -3.4721, 6.4721, 3, 46.4
Glyph of Lightning Shield, https://wotlkdb.com/?spell=57246, -3.4721, 6.4721, 3, 46.4
Glyph of Divinity, https://wotlkdb.com/?spell=57031, -3.5125, 5.0125, 1.5, 29.9
Jadefire Ink, https://wotlkdb.com/?spell=57707, -3.75, 9.75, 6, 61.5
Glyph of Shadow Bolt, https://wotlkdb.com/?spell=57271, -4.0126, 6.0125, 1.9999, 33.3
Glyph of Fear Ward, https://wotlkdb.com/?spell=57185, -4.125, 5.125, 1, 19.5
Scroll of Stamina VI, https://wotlkdb.com/?spell=50618, -4.25, 5.25, 1, 19
Glyph of Ice Lance, https://wotlkdb.com/?spell=56980, -4.4001, 18.4, 13.9999, 76.1
Glyph of Wrath, https://wotlkdb.com/?spell=56963, -4.4721, 6.4721, 2, 30.9
Glyph of Healthstone, https://wotlkdb.com/?spell=57266, -4.4721, 6.4721, 2, 30.9
Glyph of Lifebloom, https://wotlkdb.com/?spell=56949, -4.475, 18.4, 13.925, 75.7
Glyph of Shadow Word: Pain, https://wotlkdb.com/?spell=57192, -4.5, 10.5, 6, 57.1
Scroll of Agility V, https://wotlkdb.com/?spell=58480, -4.5833, 5.25, 0.6667, 12.7
Glyph of Feral Spirit, https://wotlkdb.com/?spell=64288, -4.6, 10.5, 5.9, 56.2
Scroll of Stamina V, https://wotlkdb.com/?spell=50617, -4.6465, 5.25, 0.6035, 11.5
Scroll of Spirit VI, https://wotlkdb.com/?spell=50609, -4.7722, 5.25, 0.4778, 9.1
Scroll of Intellect V, https://wotlkdb.com/?spell=50601, -4.81, 5.25, 0.44, 8.4
Glyph of Cleansing, https://wotlkdb.com/?spell=57020, -5.0125, 6.0125, 1, 16.6
Glyph of Lava Lash, https://wotlkdb.com/?spell=57249, -5.0125, 6.0125, 1, 16.6
Scroll of Spirit V, https://wotlkdb.com/?spell=50608, -5.051, 5.25, 0.199, 3.8
Scroll of Strength V, https://wotlkdb.com/?spell=58488, -5.051, 5.25, 0.199, 3.8
Glyph of Voidwalker, https://wotlkdb.com/?spell=57277, -5.0911, 6.0125, 0.9214, 15.3
Scroll of Stamina III, https://wotlkdb.com/?spell=50614, -5.135, 6.025, 0.89, 14.8
Scroll of Agility III, https://wotlkdb.com/?spell=58476, -5.4383, 6.025, 0.5867, 9.7
Glyph of Arcane Power, https://wotlkdb.com/?spell=56972, -5.5, 10.5, 5, 47.6
Glyph of Scourge Strike, https://wotlkdb.com/?spell=57224, -5.5, 10.5, 5, 47.6
Glyph of Psychic Scream, https://wotlkdb.com/?spell=57196, -5.5021, 6.4721, 0.97, 15
Glyph of Frost Shock, https://wotlkdb.com/?spell=57241, -5.603, 6.0125, 0.4095, 6.8
Glyph of Rapid Fire, https://wotlkdb.com/?spell=57008, -5.664, 10.5, 4.836, 46.1
Scroll of Intellect III, https://wotlkdb.com/?spell=50599, -5.825, 6.025, 0.2, 3.3
Scroll of Strength III, https://wotlkdb.com/?spell=58486, -5.865, 6.025, 0.16, 2.7
Scroll of Agility II, https://wotlkdb.com/?spell=58473, -5.8721, 6.4721, 0.6, 9.3
Scroll of Strength II, https://wotlkdb.com/?spell=58485, -5.9846, 6.4721, 0.4875, 7.5
Scroll of Stamina II, https://wotlkdb.com/?spell=50612, -5.9921, 6.4721, 0.48, 7.4
Scroll of Spirit III, https://wotlkdb.com/?spell=50606, -6.015, 6.025, 0.01, 0.2
Scroll of Spirit II, https://wotlkdb.com/?spell=50605, -6.411, 6.4721, 0.0611, 0.9
Scroll of Intellect II, https://wotlkdb.com/?spell=50598, -6.4625, 6.4721, 0.0096, 0.1
Glyph of Feint, https://wotlkdb.com/?spell=57122, -7.125, 10.125, 3, 29.6
Celestial Ink, https://wotlkdb.com/?spell=57709, -7.6798, 9.9998, 2.32, 23.2
Mystic Tome, https://wotlkdb.com/?spell=58565, -7.8432, 13.0632, 5.22, 40
Tome of the Dawn, https://wotlkdb.com/?spell=59475, -8.002, 14.002, 6, 42.9
Scroll of Intellect VI, https://wotlkdb.com/?spell=50602, -8.19, 10.25, 2.06, 20.1
Glyph of Holy Wrath, https://wotlkdb.com/?spell=59559, -8.4, 18.4, 10, 54.3
Glyph of Blood Strike, https://wotlkdb.com/?spell=59339, -8.5, 10.5, 2, 19
Armor Vellum III, https://wotlkdb.com/?spell=59500, -8.5, 18.9, 10.4, 55
Glyph of Frost Trap, https://wotlkdb.com/?spell=57003, -8.51, 10.5, 1.99, 19
Glyph of Unbreakable Armor, https://wotlkdb.com/?spell=57226, -8.52, 10.5, 1.98, 18.9
Glyph of Ambush, https://wotlkdb.com/?spell=57113, -8.525, 10.5, 1.975, 18.8
Scroll of Recall III, https://wotlkdb.com/?spell=60337, -8.85, 18.4, 9.55, 51.9
Glyph of Mage Armor, https://wotlkdb.com/?spell=56984, -9.5, 10.5, 1, 9.5
Scroll of Strength VI, https://wotlkdb.com/?spell=58489, -9.9477, 10.25, 0.3023, 2.9
Scroll of Agility VI, https://wotlkdb.com/?spell=58481, -9.9773, 10.25, 0.2727, 2.7
Weapon Vellum, https://wotlkdb.com/?spell=52840, -11.4148, 19.4148, 8, 41.2
Glyph of Victory Rush, https://wotlkdb.com/?spell=57170, -12.4, 18.4, 6, 32.6
Glyph of Elemental Mastery, https://wotlkdb.com/?spell=57250, -12.45, 18.4, 5.95, 32.3
Glyph of Howl of Terror, https://wotlkdb.com/?spell=57267, -12.55, 18.4, 5.85, 31.8
Glyph of Chain Lightning, https://wotlkdb.com/?spell=57233, -12.75, 18.4, 5.65, 30.7
Scroll of Agility VIII, https://wotlkdb.com/?spell=58483, -16.9, 18.9, 2, 10.6
Scroll of Spirit VIII, https://wotlkdb.com/?spell=50611, -16.9001, 18.9, 1.9999, 10.6
Scroll of Stamina VIII, https://wotlkdb.com/?spell=50620, -17.1783, 18.9, 1.7217, 9.1
Glyph of Strangulate, https://wotlkdb.com/?spell=57225, -17.4, 18.4, 1, 5.4
Scroll of Intellect VIII, https://wotlkdb.com/?spell=50604, -17.9, 18.9, 1, 5.3
Scroll of Strength VIII, https://wotlkdb.com/?spell=58491, -18.17, 18.9, 0.73, 3.9
Scroll of Agility VII, https://wotlkdb.com/?spell=58482, -18.68, 18.9, 0.22, 1.2
Scroll of Strength VII, https://wotlkdb.com/?spell=58490, -18.733, 18.9, 0.167, 0.9
Scroll of Intellect VII, https://wotlkdb.com/?spell=50603, -18.8195, 18.9, 0.0805, 0.4
Scroll of Spirit VII, https://wotlkdb.com/?spell=50610, -18.8545, 18.9, 0.0455, 0.2
Scroll of Stamina VII, https://wotlkdb.com/?spell=50619, -18.8605, 18.9, 0.0395, 0.2
Weapon Vellum III, https://wotlkdb.com/?spell=59501, -21.4, 54.7, 33.3, 60.9
Manual of Clouds, https://wotlkdb.com/?spell=59494, -23.25, 43.25, 20, 46.2
Twilight Tome, https://wotlkdb.com/?spell=64053, -84.5, 134.5, 50, 37.2
