Glyph of Hymn of Hope, https://wotlkdb.com/?spell=64283, -5.8002, 12.5, 6.6998, 53.6
Glyph of Scorch, https://wotlkdb.com/?spell=56982, -5.85, 10.85, 5, 46.1
Glyph of Lightning Shield, https://wotlkdb.com/?spell=57246, -5.9517, 7.4515, 1.4998, 20.1
Glyph of Deterrence, https://wotlkdb.com/?spell=57000, -6.019, 10.7375, 4.7185, 43.9
Glyph of Psychic Scream, https://wotlkdb.com/?spell=57196, -6.0716, 7.4515, 1.3799, 18.5
Glyph of Stormstrike, https://wotlkdb.com/?spell=57248, -6.35, 14.35, 8, 55.7
Glyph of Scourge Imprisonment, https://wotlkdb.com/?spell=57198, -6.4502, 14.35, 7.8998, 55.1
Scroll of Stamina II, https://wotlkdb.com/?spell=50612, -6.4515, 7.4515, 1, 13.4
Glyph of Healthstone, https://wotlkdb.com/?spell=57266, -6.4615, 7.4515, 0.99, 13.3
Glyph of Backstab, https://wotlkdb.com/?spell=57114, -6.4716, 7.4515, 0.9799, 13.2
Glyph of Berserk, https://wotlkdb.com/?spell=64268, -6.5007, 12.5, 5.9993, 48
Glyph of Hamstring, https://wotlkdb.com/?spell=57157, -6.5313, 9.5113, 2.98, 31.3
Glyph of Immolation Trap, https://wotlkdb.com/?spell=57005, -6.5315, 9.5113, 2.9798, 31.3
Glyph of Claw, https://wotlkdb.com/?spell=67600, -6.5815, 7.4515, 0.87, 11.7
Glyph of Blink, https://wotlkdb.com/?spell=56973, -6.6314, 9.5113, 2.8799, 30.3
Glyph of Mass Dispel, https://wotlkdb.com/?spell=57190, -6.65, 14.35, 7.7, 53.7
Glyph of Health Funnel, https://wotlkdb.com/?spell=57265, -6.7064, 9.5113, 2.8049, 29.5
Armor Vellum III, https://wotlkdb.com/?spell=59500, -6.8, 14.85, 8.05, 54.2
Glyph of Turn Evil, https://wotlkdb.com/?spell=57036, -6.8002, 14.35, 7.5498, 52.6
Glyph of Evasion, https://wotlkdb.com/?spell=57119, -6.9515, 7.4515, 0.5, 6.7
Glyph of Icy Veins, https://wotlkdb.com/?spell=56981, -7.0026, 15.0025, 7.9999, 53.3
Scroll of Agility II, https://wotlkdb.com/?spell=58473, -7.0515, 7.4515, 0.4, 5.4
Glyph of Dark Death, https://wotlkdb.com/?spell=64266, -7.1614, 22.325, 15.1636, 67.9
Glyph of Exorcism, https://wotlkdb.com/?spell=57025, -7.3252, 22.325, 14.9998, 67.2
Glyph of Mutilate, https://wotlkdb.com/?spell=64260, -7.3252, 22.325, 14.9998, 67.2
Glyph of Icy Touch, https://wotlkdb.com/?spell=57219, -7.3253, 22.325, 14.9997, 67.2
Glyph of Totem of Wrath, https://wotlkdb.com/?spell=64262, -7.3253, 22.325, 14.9997, 67.2
Glyph of Victory Rush, https://wotlkdb.com/?spell=57170, -7.4, 14.35, 6.95, 48.4
Scroll of Spirit II, https://wotlkdb.com/?spell=50605, -7.4054, 7.4515, 0.0461, 0.6
Scroll of Strength II, https://wotlkdb.com/?spell=58485, -7.4423, 7.4515, 0.0092, 0.1
Glyph of Spell Reflection, https://wotlkdb.com/?spell=64302, -7.4506, 12.5, 5.0494, 40.4
Glyph of Garrote, https://wotlkdb.com/?spell=57123, -7.4964, 9.5113, 2.0149, 21.2
Glyph of Divinity, https://wotlkdb.com/?spell=57031, -7.5914, 9.5113, 1.9199, 20.2
Glyph of Ambush, https://wotlkdb.com/?spell=57113, -7.7202, 12.5, 4.7798, 38.2
Glyph of Pain Suppression, https://wotlkdb.com/?spell=64259, -7.8153, 22.325, 14.5097, 65
Glyph of Ice Block, https://wotlkdb.com/?spell=56979, -7.8501, 10.85, 2.9999, 27.6
Ivory Ink, https://wotlkdb.com/?spell=52738, -8.2, 8.45, 0.25, 3
Glyph of Frost Strike, https://wotlkdb.com/?spell=57216, -8.325, 22.325, 14, 62.7
Glyph of Focus, https://wotlkdb.com/?spell=62162, -8.35, 14.35, 6, 41.8
Glyph of Sweeping Strikes, https://wotlkdb.com/?spell=57168, -8.5, 12.5, 4, 32
Glyph of Entangling Roots, https://wotlkdb.com/?spell=48121, -8.5003, 9.5003, 1, 10.5
Glyph of Sunder Armor, https://wotlkdb.com/?spell=57167, -8.5113, 9.5113, 1, 10.5
Glyph of Succubus, https://wotlkdb.com/?spell=57275, -8.5201, 12.5, 3.9799, 31.8
Midnight Ink, https://wotlkdb.com/?spell=53462, -8.7778, 16.2278, 7.45, 45.9
Glyph of Slice and Dice, https://wotlkdb.com/?spell=57132, -8.8501, 10.85, 1.9999, 18.4
Glyph of Lifebloom, https://wotlkdb.com/?spell=56949, -8.95, 14.35, 5.4, 37.6
Ink of the Sky, https://wotlkdb.com/?spell=57712, -9.1787, 9.4286, 0.2499, 2.7
Scroll of Recall II, https://wotlkdb.com/?spell=60336, -9.2375, 10.7375, 1.5, 14
Glyph of Howl of Terror, https://wotlkdb.com/?spell=57267, -9.35, 14.35, 5, 34.8
Glyph of Mana Tide Totem, https://wotlkdb.com/?spell=57247, -9.3701, 14.35, 4.9799, 34.7
Scroll of Strength IV, https://wotlkdb.com/?spell=58487, -9.495, 10.975, 1.48, 13.5
Glyph of Mage Armor, https://wotlkdb.com/?spell=56984, -9.5003, 12.5, 2.9997, 24
Book of Survival, https://wotlkdb.com/?spell=59478, -9.5876, 19.5876, 10, 51.1
Glyph of Unbreakable Armor, https://wotlkdb.com/?spell=57226, -9.6003, 12.5, 2.8997, 23.2
Scroll of Strength VIII, https://wotlkdb.com/?spell=58491, -9.85, 14.85, 5, 33.7
Glyph of Crusader Strike, https://wotlkdb.com/?spell=57024, -9.9003, 10.85, 0.9497, 8.8
Glyph of Barbaric Insults, https://wotlkdb.com/?spell=57151, -9.9103, 10.85, 0.9397, 8.7
Glyph of Gouge, https://wotlkdb.com/?spell=57125, -10.0028, 15.0025, 4.9997, 33.3
Glyph of Dispel Magic, https://wotlkdb.com/?spell=57183, -10.0101, 10.85, 0.8399, 7.7
Scroll of Intellect IV, https://wotlkdb.com/?spell=50600, -10.025, 10.975, 0.95, 8.7
Scroll of Intellect VIII, https://wotlkdb.com/?spell=50604, -10.0703, 14.85, 4.7797, 32.2
Glyph of Feint, https://wotlkdb.com/?spell=57122, -10.2251, 12.125, 1.8999, 15.7
Glyph of Execution, https://wotlkdb.com/?spell=57156, -10.31, 22.325, 12.015, 53.8
Scroll of Spirit IV, https://wotlkdb.com/?spell=50607, -10.34, 10.975, 0.635, 5.8
Glyph of Soulstone, https://wotlkdb.com/?spell=57274, -10.3701, 10.85, 0.4799, 4.4
Glyph of Rapid Fire, https://wotlkdb.com/?spell=57008, -10.5, 12.5, 2, 16
Glyph of Frost Trap, https://wotlkdb.com/?spell=57003, -10.5501, 12.5, 1.9499, 15.6
Glyph of Scourge Strike, https://wotlkdb.com/?spell=57224, -10.5501, 12.5, 1.9499, 15.6
Scroll of Agility IV, https://wotlkdb.com/?spell=58478, -10.9618, 10.975, 0.0132, 0.1
Scroll of Stamina IV, https://wotlkdb.com/?spell=50616, -10.9633, 10.975, 0.0117, 0.1
Glyph of Rake, https://wotlkdb.com/?spell=56952, -11.0003, 12.5, 1.4997, 12
Scroll of Intellect VI, https://wotlkdb.com/?spell=50602, -11.28, 12.25, 0.97, 7.9
Glyph of Shred, https://wotlkdb.com/?spell=56957, -11.3025, 22.325, 11.0225, 49.4
Glyph of Sprint, https://wotlkdb.com/?spell=57133, -11.445, 22.325, 10.88, 48.7
Scroll of Agility VI, https://wotlkdb.com/?spell=58481, -11.4671, 12.25, 0.7829, 6.4
Glyph of Blood Strike, https://wotlkdb.com/?spell=59339, -11.53, 12.5, 0.97, 7.8
Glyph of Arcane Power, https://wotlkdb.com/?spell=56972, -11.565, 12.5, 0.935, 7.5
Scroll of Strength VI, https://wotlkdb.com/?spell=58489, -12.2263, 12.25, 0.0237, 0.2
Glyph of Earth Shield, https://wotlkdb.com/?spell=64261, -12.3253, 22.325, 9.9997, 44.8
Glyph of Ice Lance, https://wotlkdb.com/?spell=56980, -12.35, 14.35, 2, 13.9
Glyph of Strangulate, https://wotlkdb.com/?spell=57225, -12.3703, 14.35, 1.9797, 13.8
Scroll of Intellect III, https://wotlkdb.com/?spell=50599, -12.515, 15.015, 2.5, 16.7
Glyph of Revenge, https://wotlkdb.com/?spell=57165, -12.5326, 15.0025, 2.4699, 16.5
Glyph of Shadow Bolt, https://wotlkdb.com/?spell=57271, -12.6025, 15.0025, 2.4, 16
Scroll of Stamina VIII, https://wotlkdb.com/?spell=50620, -12.8703, 14.85, 1.9797, 13.3
Weapon Vellum, https://wotlkdb.com/?spell=52840, -13.3555, 22.353, 8.9975, 40.3
Scroll of Agility VIII, https://wotlkdb.com/?spell=58483, -13.85, 14.85, 1, 6.7
Scroll of Spirit VIII, https://wotlkdb.com/?spell=50611, -13.8601, 14.85, 0.9899, 6.7
Glyph of Cleansing, https://wotlkdb.com/?spell=57020, -13.8927, 15.0025, 1.1098, 7.4
Glyph of Rebirth, https://wotlkdb.com/?spell=56953, -14.0025, 15.0025, 1, 6.7
Glyph of Voidwalker, https://wotlkdb.com/?spell=57277, -14.0125, 15.0025, 0.99, 6.6
Glyph of Multi-Shot, https://wotlkdb.com/?spell=57007, -14.0284, 15.0025, 0.9741, 6.5
Glyph of Frost Shock, https://wotlkdb.com/?spell=57241, -14.0425, 15.0025, 0.96, 6.4
Glyph of Lava Lash, https://wotlkdb.com/?spell=57249, -14.0426, 15.0025, 0.9599, 6.4
Scroll of Strength III, https://wotlkdb.com/?spell=58486, -14.145, 15.015, 0.87, 5.8
Glyph of Sap, https://wotlkdb.com/?spell=57129, -14.1626, 15.0025, 0.8399, 5.6
Moonglow Ink, https://wotlkdb.com/?spell=52843, -14.35, 16.9, 2.55, 15.1
Scroll of Agility III, https://wotlkdb.com/?spell=58476, -14.725, 15.015, 0.29, 1.9
Scroll of Intellect VII, https://wotlkdb.com/?spell=50603, -14.7476, 14.85, 0.1024, 0.7
Scroll of Strength VII, https://wotlkdb.com/?spell=58490, -14.776, 14.85, 0.074, 0.5
Scroll of Agility VII, https://wotlkdb.com/?spell=58482, -14.7845, 14.85, 0.0655, 0.4
Scroll of Stamina VII, https://wotlkdb.com/?spell=50619, -14.8098, 14.85, 0.0402, 0.3
Scroll of Spirit VII, https://wotlkdb.com/?spell=50610, -14.8246, 14.85, 0.0254, 0.2
Scroll of Stamina III, https://wotlkdb.com/?spell=50614, -14.89, 15.015, 0.125, 0.8
Scroll of Spirit III, https://wotlkdb.com/?spell=50606, -14.8955, 15.015, 0.1195, 0.8
Weapon Vellum III, https://wotlkdb.com/?spell=59501, -16.95, 42.55, 25.6, 60.2
Glyph of Monsoon, https://wotlkdb.com/?spell=64258, -17.8254, 22.325, 4.4996, 20.2
Ethereal Ink, https://wotlkdb.com/?spell=57713, -19.2, 31.2, 12, 38.5
Glyph of Mana Gem, https://wotlkdb.com/?spell=56985, -19.3151, 22.325, 3.0099, 13.5
Glyph of Shadowburn, https://wotlkdb.com/?spell=57272, -19.5255, 22.325, 2.7995, 12.5
Glyph of Death Grip, https://wotlkdb.com/?spell=57213, -20.3252, 22.325, 1.9998, 9
Glyph of Bone Shield, https://wotlkdb.com/?spell=57210, -20.8352, 22.325, 1.4898, 6.7
Glyph of Freezing Trap, https://wotlkdb.com/?spell=57002, -21.3251, 22.325, 0.9999, 4.5
Glyph of Fear Ward, https://wotlkdb.com/?spell=57185, -21.3551, 22.325, 0.9699, 4.3
Scroll of Agility V, https://wotlkdb.com/?spell=58480, -21.46, 22.45, 0.99, 4.4
Scroll of Stamina V, https://wotlkdb.com/?spell=50617, -21.485, 22.45, 0.965, 4.3
Scroll of Intellect V, https://wotlkdb.com/?spell=50601, -21.52, 22.45, 0.93, 4.1
Book of Clever Tricks, https://wotlkdb.com/?spell=59496, -21.8714, 41.8214, 19.95, 47.7
Scroll of Spirit VI, https://wotlkdb.com/?spell=50609, -21.9358, 22.45, 0.5142, 2.3
Scroll of Strength V, https://wotlkdb.com/?spell=58488, -21.96, 22.45, 0.49, 2.2
Scroll of Spirit V, https://wotlkdb.com/?spell=50608, -22.22, 22.45, 0.23, 1
Scroll of Stamina VI, https://wotlkdb.com/?spell=50618, -22.4215, 22.45, 0.0285, 0.1
Jadefire Ink, https://wotlkdb.com/?spell=57707, -27.01, 42, 14.99, 35.7
Stormbound Tome, https://wotlkdb.com/?spell=59493, -90.7842, 90.9242, 0.14, 0.2
Manual of Clouds, https://wotlkdb.com/?spell=59494, -91.9092, 92.0492, 0.14, 0.2
