Name, Link, Profit, Cost, Sell, ROI %
Rituals of the New Moon, https://wotlkdb.com/?spell=64051, 2048.75, 172.25, 2221, 1289.4
Faces of Doom, https://wotlkdb.com/?spell=59498, 170.6, 169.4, 340, 200.7
Iron-bound Tome, https://wotlkdb.com/?spell=59497, 154.4765, 169.4, 323.8765, 191.2
Glyph of Enduring Victory, https://wotlkdb.com/?spell=58347, 77.2134, 12.45, 89.6634, 720.2
Glyph of Typhoon, https://wotlkdb.com/?spell=56965, 53.7573, 15.95, 69.7073, 437
Glyph of Deadly Throw, https://wotlkdb.com/?spell=57117, 43.37, 15.95, 59.32, 371.9
Glyph of Soul Link, https://wotlkdb.com/?spell=64250, 37.0299, 15.2015, 52.2314, 343.6
Glyph of Fire Blast, https://wotlkdb.com/?spell=57719, 28.2593, 15.95, 44.2093, 277.2
Twilight Tome, https://wotlkdb.com/?spell=64053, 25.0834, 118.9166, 144, 121.1
Shimmering Ink, https://wotlkdb.com/?spell=57711, 17.1106, 4.8674, 21.978, 451.5
Glyph of Hammer of Wrath, https://wotlkdb.com/?spell=57028, 15.3766, 15.95, 31.3266, 196.4
Glyph of Hex, https://wotlkdb.com/?spell=64316, 15.0558, 15.95, 31.0058, 194.4
Glyph of Deep Freeze, https://wotlkdb.com/?spell=64274, 11.7236, 12.45, 24.1736, 194.2
Celestial Ink, https://wotlkdb.com/?spell=57709, 11.2749, 6, 17.2749, 287.9
Glyph of Blurred Speed, https://wotlkdb.com/?spell=58323, 11.0956, 7.4515, 18.5471, 248.9
Glyph of Arcane Intellect, https://wotlkdb.com/?spell=58303, 9.3691, 7.4515, 16.8206, 225.7
Lion's Ink, https://wotlkdb.com/?spell=57704, 9.2, 6, 15.2, 253.3
Glyph of Lay on Hands, https://wotlkdb.com/?spell=58313, 9.1785, 7.4515, 16.63, 223.2
Glyph of Fading, https://wotlkdb.com/?spell=58317, 9.0451, 7.4515, 16.4966, 221.4
Glyph of Battle, https://wotlkdb.com/?spell=58342, 8.4249, 7.4515, 15.8764, 213.1
Glyph of Charge, https://wotlkdb.com/?spell=58344, 7.6293, 7.4515, 15.0808, 202.4
Glyph of Mend Pet, https://wotlkdb.com/?spell=58301, 7.6243, 7.4515, 15.0758, 202.3
Glyph of the Wild, https://wotlkdb.com/?spell=58296, 7.6068, 7.4515, 15.0583, 202.1
Glyph of Blessing of Wisdom, https://wotlkdb.com/?spell=58312, 7.6061, 7.4515, 15.0576, 202.1
Glyph of Thorns, https://wotlkdb.com/?spell=58289, 7.5629, 7.4515, 15.0144, 201.5
Glyph of Blessing of Might, https://wotlkdb.com/?spell=58314, 7.5595, 7.4515, 15.011, 201.4
Glyph of Thunder Clap, https://wotlkdb.com/?spell=58346, 7.5538, 7.4515, 15.0053, 201.4
Glyph of Revive Pet, https://wotlkdb.com/?spell=58299, 7.5485, 7.4515, 15, 201.3
Glyph of Slow Fall, https://wotlkdb.com/?spell=58308, 7.5485, 7.4515, 15, 201.3
Glyph of Fortitude, https://wotlkdb.com/?spell=58318, 7.5485, 7.4515, 15, 201.3
Glyph of Drain Soul, https://wotlkdb.com/?spell=58337, 7.5485, 7.4515, 15, 201.3
Glyph of Bloodrage, https://wotlkdb.com/?spell=58343, 7.5485, 7.4515, 15, 201.3
Glyph of Scare Beast, https://wotlkdb.com/?spell=58298, 7.5484, 7.4515, 14.9999, 201.3
Glyph of Life Tap, https://wotlkdb.com/?spell=64248, 7.5484, 7.4515, 14.9999, 201.3
Glyph of the Penguin, https://wotlkdb.com/?spell=58310, 7.5479, 7.4515, 14.9994, 201.3
Glyph of Stoneclaw Totem, https://wotlkdb.com/?spell=64247, 7.5477, 7.4515, 14.9992, 201.3
Glyph of Possessed Strength, https://wotlkdb.com/?spell=58300, 7.4732, 7.4515, 14.9247, 200.3
Glyph of Healing Wave, https://wotlkdb.com/?spell=57243, 7.3429, 15.95, 23.2929, 146
Glyph of Frost Armor, https://wotlkdb.com/?spell=58306, 6.5485, 7.4515, 14, 187.9
Glyph of Power Word: Shield, https://wotlkdb.com/?spell=57194, 6.5483, 7.4515, 13.9998, 187.9
Glyph of Pick Pocket, https://wotlkdb.com/?spell=58326, 6.4784, 7.4515, 13.9299, 186.9
Ink of the Sea, https://wotlkdb.com/?spell=57715, 5.45, 10, 15.45, 154.5
Certificate of Ownership, https://wotlkdb.com/?spell=59387, 5.4277, 34.5623, 39.99, 115.7
Glyph of Rejuvenation, https://wotlkdb.com/?spell=56955, 5.0984, 7.4515, 12.5499, 168.4
Glyph of Siphon Life, https://wotlkdb.com/?spell=57273, 4.8579, 15.95, 20.8079, 130.5
Glyph of Invisibility, https://wotlkdb.com/?spell=56983, 4.7051, 15.95, 20.6551, 129.5
Glyph of Frostbolt, https://wotlkdb.com/?spell=56977, 4.565, 15.95, 20.515, 128.6
Glyph of Frost Nova, https://wotlkdb.com/?spell=56976, 4.5484, 7.4515, 11.9999, 161
Glyph of Heroic Strike, https://wotlkdb.com/?spell=57158, 4.5484, 7.4515, 11.9999, 161
Glyph of Hammer of Justice, https://wotlkdb.com/?spell=57027, 4.4883, 7.4515, 11.9398, 160.2
Glyph of Pestilence, https://wotlkdb.com/?spell=57230, 4.0939, 12.075, 16.1689, 133.9
Glyph of Fan of Knives, https://wotlkdb.com/?spell=64315, 4.0499, 15.95, 19.9999, 125.4
Glyph of Taunt, https://wotlkdb.com/?spell=57169, 4.0399, 15.95, 19.9899, 125.3
Glyph of Distract, https://wotlkdb.com/?spell=58324, 4.0381, 15.2125, 19.2506, 126.5
Glyph of Trueshot Aura, https://wotlkdb.com/?spell=57012, 3.994, 15.95, 19.944, 125
Glyph of Cloak of Shadows, https://wotlkdb.com/?spell=64303, 3.9765, 12.45, 16.4265, 131.9
Glyph of Resonating Power, https://wotlkdb.com/?spell=57164, 3.9264, 15.95, 19.8764, 124.6
Glyph of Horn of Winter, https://wotlkdb.com/?spell=57217, 3.7712, 12.45, 16.2212, 130.3
Glyph of Raise Dead, https://wotlkdb.com/?spell=57228, 3.5777, 12.075, 15.6527, 129.6
Glyph of Scatter Shot, https://wotlkdb.com/?spell=64249, 3.5117, 15.2015, 18.7132, 123.1
Glyph of Frost Ward, https://wotlkdb.com/?spell=58307, 3.4207, 15.2125, 18.6332, 122.5
Glyph of Killing Spree, https://wotlkdb.com/?spell=64285, 3.1786, 12.45, 15.6286, 125.5
Warrior Glyph 21, https://wotlkdb.com/?spell=57173, 3.1209, 6.879, 9.9999, 145.4
Warrior Glyph 22, https://wotlkdb.com/?spell=57174, 3.1209, 6.879, 9.9999, 145.4
Warrior Glyph 23, https://wotlkdb.com/?spell=57175, 3.1209, 6.879, 9.9999, 145.4
Warrior Glyph 25, https://wotlkdb.com/?spell=57176, 3.1209, 6.879, 9.9999, 145.4
Warrior Glyph 24, https://wotlkdb.com/?spell=57180, 3.1209, 6.879, 9.9999, 145.4
Death Knight Glyph 25, https://wotlkdb.com/?spell=57231, 3.1209, 6.879, 9.9999, 145.4
Glyph of Pick Lock, https://wotlkdb.com/?spell=58325, 3.0986, 15.2015, 18.3001, 120.4
Glyph of Holy Wrath, https://wotlkdb.com/?spell=59559, 2.9676, 15.95, 18.9176, 118.6
Glyph of Shadow Protection, https://wotlkdb.com/?spell=58321, 2.9662, 15.2873, 18.2535, 119.4
Glyph of Death's Embrace, https://wotlkdb.com/?spell=57215, 2.925, 12.075, 15, 124.2
Glyph of Corpse Explosion, https://wotlkdb.com/?spell=57229, 2.9249, 12.075, 14.9999, 124.2
Glyph of Curse of Exhaustion, https://wotlkdb.com/?spell=58338, 2.7226, 15.2873, 18.0099, 117.8
Glyph of Unending Breath, https://wotlkdb.com/?spell=58336, 2.675, 15.2015, 17.8765, 117.6
Glyph of Rupture, https://wotlkdb.com/?spell=57128, 2.6675, 15.95, 18.6175, 116.7
Glyph of Explosive Shot, https://wotlkdb.com/?spell=64273, 2.5879, 12.45, 15.0379, 120.8
Glyph of Blood Tap, https://wotlkdb.com/?spell=57209, 2.5531, 12.45, 15.0031, 120.5
Glyph of Beacon of Light, https://wotlkdb.com/?spell=64277, 2.5499, 12.45, 14.9999, 120.5
Glyph of Dispersion, https://wotlkdb.com/?spell=64280, 2.5499, 12.45, 14.9999, 120.5
Glyph of Haunt, https://wotlkdb.com/?spell=64291, 2.5499, 12.45, 14.9999, 120.5
Glyph of Living Bomb, https://wotlkdb.com/?spell=64275, 2.5498, 12.45, 14.9998, 120.5
Glyph of Feral Spirit, https://wotlkdb.com/?spell=64288, 2.5498, 12.45, 14.9998, 120.5
Glyph of Metamorphosis, https://wotlkdb.com/?spell=64318, 2.5498, 12.45, 14.9998, 120.5
Glyph of Vampiric Blood, https://wotlkdb.com/?spell=57227, 2.5497, 12.45, 14.9997, 120.5
Glyph of Chimera Shot, https://wotlkdb.com/?spell=64271, 2.5497, 12.45, 14.9997, 120.5
Glyph of Hammer of the Righteous, https://wotlkdb.com/?spell=64278, 2.5497, 12.45, 14.9997, 120.5
Glyph of Divine Storm, https://wotlkdb.com/?spell=64279, 2.5497, 12.45, 14.9997, 120.5
Glyph of Shadow Dance, https://wotlkdb.com/?spell=64286, 2.5497, 12.45, 14.9997, 120.5
Glyph of Penance, https://wotlkdb.com/?spell=64282, 2.5495, 12.45, 14.9995, 120.5
Glyph of Hunger for Blood, https://wotlkdb.com/?spell=64284, 2.5494, 12.45, 14.9994, 120.5
Glyph of Serpent Sting, https://wotlkdb.com/?spell=57009, 2.5485, 7.4515, 10, 134.2
Glyph of Corruption, https://wotlkdb.com/?spell=57259, 2.5485, 7.4515, 10, 134.2
Glyph of Raptor Strike, https://wotlkdb.com/?spell=64246, 2.5485, 7.4515, 10, 134.2
Glyph of the Ghoul, https://wotlkdb.com/?spell=57222, 2.5387, 12.45, 14.9887, 120.4
Glyph of Hunter's Mark, https://wotlkdb.com/?spell=57004, 2.5385, 7.4515, 9.99, 134.1
Glyph of Flame Shock, https://wotlkdb.com/?spell=57239, 2.5235, 7.4515, 9.975, 133.9
Glyph of Dancing Rune Weapon, https://wotlkdb.com/?spell=64297, 2.5, 12.45, 14.95, 120.1
Glyph of Unholy Blight, https://wotlkdb.com/?spell=64299, 2.4998, 12.45, 14.9498, 120.1
Glyph of Hemorrhage, https://wotlkdb.com/?spell=57126, 2.1872, 15.95, 18.1372, 113.7
Glyph of Shackle Undead, https://wotlkdb.com/?spell=58320, 2.0942, 15.2015, 17.2957, 113.8
Glyph of Flash of Light, https://wotlkdb.com/?spell=57026, 1.9249, 12.075, 13.9999, 115.9
Glyph of Plague Strike, https://wotlkdb.com/?spell=57221, 1.9249, 12.075, 13.9999, 115.9
Glyph of Kilrogg, https://wotlkdb.com/?spell=58340, 1.8211, 15.2125, 17.0336, 112
Glyph of Anti-Magic Shell, https://wotlkdb.com/?spell=57207, 1.6557, 15.95, 17.6057, 110.4
Glyph of Starfall, https://wotlkdb.com/?spell=56958, 1.6543, 15.95, 17.6043, 110.4
Glyph of Wild Growth, https://wotlkdb.com/?spell=64270, 1.55, 12.45, 14, 112.4
Glyph of Howling Blast, https://wotlkdb.com/?spell=64300, 1.55, 12.45, 14, 112.4
Glyph of Arcane Blast, https://wotlkdb.com/?spell=56991, 1.5499, 12.45, 13.9999, 112.4
Glyph of Shockwave, https://wotlkdb.com/?spell=64296, 1.5499, 12.45, 13.9999, 112.4
Glyph of Eternal Water, https://wotlkdb.com/?spell=71101, 1.5498, 12.45, 13.9998, 112.4
Glyph of Maul, https://wotlkdb.com/?spell=56961, 1.5484, 7.4515, 8.9999, 120.8
Glyph of Death Strike, https://wotlkdb.com/?spell=59340, 1.5, 12.45, 13.95, 112
Glyph of Bladestorm, https://wotlkdb.com/?spell=64295, 1.4799, 12.45, 13.9299, 111.9
Glyph of Hungering Cold, https://wotlkdb.com/?spell=64298, 1.4799, 12.45, 13.9299, 111.9
Glyph of Whirlwind, https://wotlkdb.com/?spell=57172, 1.4499, 12.45, 13.8999, 111.6
Glyph of Mind Control, https://wotlkdb.com/?spell=57191, 1.3982, 15.95, 17.3482, 108.8
Glyph of Chaos Bolt, https://wotlkdb.com/?spell=64294, 1.3787, 12.45, 13.8287, 111.1
Glyph of Souls, https://wotlkdb.com/?spell=58341, 1.3401, 15.95, 17.2901, 108.4
Glyph of Fire Ward, https://wotlkdb.com/?spell=58305, 1.3053, 15.2015, 16.5068, 108.6
Glyph of Thunder, https://wotlkdb.com/?spell=64287, 1.1869, 12.45, 13.6369, 109.5
Glyph of Unburdened Rebirth, https://wotlkdb.com/?spell=58288, 0.8467, 15.2015, 16.0482, 105.6
Glyph of Sense Undead, https://wotlkdb.com/?spell=58315, 0.5512, 15.2015, 15.7527, 103.6
Scroll of Strength, https://wotlkdb.com/?spell=58484, 0.5185, 0.5015, 1.02, 203.4
Glyph of Earthliving Weapon, https://wotlkdb.com/?spell=57236, 0.4249, 12.075, 12.4999, 103.5
Scroll of Spirit, https://wotlkdb.com/?spell=48116, 0.3885, 0.2515, 0.64, 254.5
Glyph of Crippling Poison, https://wotlkdb.com/?spell=57116, 0.2985, 15.95, 16.2485, 101.9
Glyph of Shield Wall, https://wotlkdb.com/?spell=64252, 0.246, 15.2125, 15.4585, 101.6
Glyph of Blessing of Kings, https://wotlkdb.com/?spell=58311, -0.0326, 15.2015, 15.1689, 99.8
Glyph of Mocking Blow, https://wotlkdb.com/?spell=58345, -0.0362, 15.2015, 15.1653, 99.8
Glyph of Innervate, https://wotlkdb.com/?spell=56947, -0.051, 15.95, 15.899, 99.7
Scroll of Agility, https://wotlkdb.com/?spell=58472, -0.0635, 0.5015, 0.438, 87.3
Glyph of Challenging Roar, https://wotlkdb.com/?spell=58287, -0.108, 15.2873, 15.1793, 99.3
Glyph of Wyvern Sting, https://wotlkdb.com/?spell=57014, -0.1179, 15.95, 15.8321, 99.3
Scroll of Stamina, https://wotlkdb.com/?spell=45382, -0.1615, 0.2515, 0.09, 35.8
Glyph of Vanish, https://wotlkdb.com/?spell=58328, -0.177, 15.2125, 15.0355, 98.8
Glyph of Icebound Fortitude, https://wotlkdb.com/?spell=57218, -0.1935, 15.95, 15.7565, 98.8
Glyph of Unstable Affliction, https://wotlkdb.com/?spell=57276, -0.1971, 15.95, 15.7529, 98.8
Glyph of Aquatic Form, https://wotlkdb.com/?spell=58286, -0.2015, 15.2015, 15, 98.7
Glyph of Ghost Wolf, https://wotlkdb.com/?spell=59326, -0.2015, 15.2015, 15, 98.7
Glyph of Water Shield, https://wotlkdb.com/?spell=58332, -0.2016, 15.2015, 14.9999, 98.7
Glyph of Arcane Missiles, https://wotlkdb.com/?spell=56971, -0.2126, 15.2125, 14.9999, 98.6
Glyph of Eviscerate, https://wotlkdb.com/?spell=57120, -0.2126, 15.2125, 14.9999, 98.6
Glyph of Rending, https://wotlkdb.com/?spell=57163, -0.2126, 15.2125, 14.9999, 98.6
Glyph of Salvation, https://wotlkdb.com/?spell=64251, -0.2126, 15.2125, 14.9999, 98.6
Glyph of Flash Heal, https://wotlkdb.com/?spell=57186, -0.2127, 15.2125, 14.9998, 98.6
Glyph of Dash, https://wotlkdb.com/?spell=59315, -0.2416, 15.2873, 15.0457, 98.4
Scroll of Intellect, https://wotlkdb.com/?spell=48114, -0.2478, 0.2515, 0.0037, 1.5
Glyph of Levitate, https://wotlkdb.com/?spell=58319, -0.2873, 15.2873, 15, 98.1
Glyph of Renewed Life, https://wotlkdb.com/?spell=58330, -0.2873, 15.2873, 15, 98.1
Glyph of Water Walking, https://wotlkdb.com/?spell=58333, -0.2873, 15.2873, 15, 98.1
Glyph of the Wise, https://wotlkdb.com/?spell=58316, -0.2875, 15.2873, 14.9998, 98.1
Glyph of Astral Recall, https://wotlkdb.com/?spell=58329, -0.3374, 15.2873, 14.9499, 97.8
Glyph of Feign Death, https://wotlkdb.com/?spell=58302, -0.3386, 15.2873, 14.9487, 97.8
Glyph of Heart Strike, https://wotlkdb.com/?spell=57208, -0.3667, 15.95, 15.5833, 97.7
Glyph of Bestial Wrath, https://wotlkdb.com/?spell=56999, -0.4259, 15.95, 15.5241, 97.3
Glyph of Seal of Wisdom, https://wotlkdb.com/?spell=57035, -0.4444, 15.95, 15.5056, 97.2
Glyph of Rune Tap, https://wotlkdb.com/?spell=59338, -0.4501, 12.45, 11.9999, 96.4
Glyph of Incinerate, https://wotlkdb.com/?spell=57257, -0.4502, 12.45, 11.9998, 96.4
Glyph of Avenging Wrath, https://wotlkdb.com/?spell=57021, -0.4985, 15.95, 15.4515, 96.9
Glyph of Riptide, https://wotlkdb.com/?spell=64289, -0.5001, 12.45, 11.9499, 96
Glyph of Blast Wave, https://wotlkdb.com/?spell=56990, -0.5212, 15.95, 15.4288, 96.7
Glyph of Judgement, https://wotlkdb.com/?spell=57030, -0.5702, 15.2125, 14.6423, 96.3
Glyph of Enslave Demon, https://wotlkdb.com/?spell=58339, -0.7108, 15.2873, 14.5765, 95.4
Hunter's Ink, https://wotlkdb.com/?spell=57703, -0.7495, 0.8, 0.0505, 6.3
Glyph of Kill Shot, https://wotlkdb.com/?spell=64304, -0.888, 15.95, 15.062, 94.4
Glyph of Steady Shot, https://wotlkdb.com/?spell=57011, -0.9009, 15.95, 15.0491, 94.4
Glyph of Chain Heal, https://wotlkdb.com/?spell=57232, -0.9167, 15.95, 15.0333, 94.3
Glyph of Prayer of Healing, https://wotlkdb.com/?spell=57195, -0.9364, 15.95, 15.0136, 94.1
Glyph of Felguard, https://wotlkdb.com/?spell=57263, -0.9365, 15.95, 15.0135, 94.1
Glyph of Command, https://wotlkdb.com/?spell=68166, -0.9389, 15.95, 15.0111, 94.1
Glyph of Blocking, https://wotlkdb.com/?spell=57152, -0.9441, 15.95, 15.0059, 94.1
Glyph of Growl, https://wotlkdb.com/?spell=56944, -0.95, 15.95, 15, 94
Glyph of Mangle, https://wotlkdb.com/?spell=56950, -0.95, 15.95, 15, 94
Glyph of Swiftmend, https://wotlkdb.com/?spell=56960, -0.95, 15.95, 15, 94
Glyph of Fireball, https://wotlkdb.com/?spell=56975, -0.95, 15.95, 15, 94
Glyph of Molten Armor, https://wotlkdb.com/?spell=56986, -0.95, 15.95, 15, 94
Glyph of Polymorph, https://wotlkdb.com/?spell=56987, -0.95, 15.95, 15, 94
Glyph of Water Elemental, https://wotlkdb.com/?spell=56989, -0.95, 15.95, 15, 94
Glyph of Volley, https://wotlkdb.com/?spell=57013, -0.95, 15.95, 15, 94
Glyph of Ghostly Strike, https://wotlkdb.com/?spell=57124, -0.95, 15.95, 15, 94
Glyph of Preparation, https://wotlkdb.com/?spell=57127, -0.95, 15.95, 15, 94
Glyph of Vigor, https://wotlkdb.com/?spell=57130, -0.95, 15.95, 15, 94
Glyph of Devastate, https://wotlkdb.com/?spell=57155, -0.95, 15.95, 15, 94
Glyph of Shadow, https://wotlkdb.com/?spell=57193, -0.95, 15.95, 15, 94
Glyph of Rune Strike, https://wotlkdb.com/?spell=57223, -0.95, 15.95, 15, 94
Glyph of Lava, https://wotlkdb.com/?spell=57234, -0.95, 15.95, 15, 94
Glyph of Fire Elemental Totem, https://wotlkdb.com/?spell=57237, -0.95, 15.95, 15, 94
Glyph of Shadowfiend, https://wotlkdb.com/?spell=58322, -0.95, 15.95, 15, 94
Glyph of Seal of Righteousness, https://wotlkdb.com/?spell=59560, -0.95, 15.95, 15, 94
Glyph of Nourish, https://wotlkdb.com/?spell=64313, -0.95, 15.95, 15, 94
Glyph of Mortal Strike, https://wotlkdb.com/?spell=57160, -0.9501, 15.95, 14.9999, 94
Glyph of Last Stand, https://wotlkdb.com/?spell=57166, -0.9501, 15.95, 14.9999, 94
Glyph of Circle of Healing, https://wotlkdb.com/?spell=57181, -0.9501, 15.95, 14.9999, 94
Glyph of Death and Decay, https://wotlkdb.com/?spell=57214, -0.9501, 15.95, 14.9999, 94
Glyph of Thunderstorm, https://wotlkdb.com/?spell=57253, -0.9501, 15.95, 14.9999, 94
Glyph of Conflagrate, https://wotlkdb.com/?spell=57258, -0.9501, 15.95, 14.9999, 94
Glyph of Felhunter, https://wotlkdb.com/?spell=57264, -0.9501, 15.95, 14.9999, 94
Glyph of Seal of Light, https://wotlkdb.com/?spell=57034, -0.9502, 15.95, 14.9998, 94
Glyph of Dark Command, https://wotlkdb.com/?spell=57212, -0.9506, 15.95, 14.9994, 94
Glyph of Seal of Vengeance, https://wotlkdb.com/?spell=59561, -0.9506, 15.95, 14.9994, 94
Glyph of Frostfire, https://wotlkdb.com/?spell=61677, -0.9506, 15.95, 14.9994, 94
Glyph of Obliterate, https://wotlkdb.com/?spell=57220, -0.9513, 15.95, 14.9987, 94
Glyph of Spiritual Attunement, https://wotlkdb.com/?spell=57022, -0.9515, 7.4515, 6.5, 87.2
Glyph of Immolate, https://wotlkdb.com/?spell=57268, -1.0001, 15.95, 14.9499, 93.7
Glyph of Tricks of the Trade, https://wotlkdb.com/?spell=64310, -1.0001, 15.95, 14.9499, 93.7
Glyph of Shadowflame, https://wotlkdb.com/?spell=64311, -1.0001, 15.95, 14.9499, 93.7
Glyph of Quick Decay, https://wotlkdb.com/?spell=71102, -1.0001, 15.95, 14.9499, 93.7
Glyph of Savage Roar, https://wotlkdb.com/?spell=64307, -1.0002, 15.95, 14.9498, 93.7
Glyph of Shadow Word: Death, https://wotlkdb.com/?spell=57199, -1.025, 15.95, 14.925, 93.6
Glyph of Demonic Circle, https://wotlkdb.com/?spell=64317, -1.0256, 15.95, 14.9244, 93.6
Glyph of Lightwell, https://wotlkdb.com/?spell=57189, -1.0263, 15.95, 14.9237, 93.6
Dawnstar Ink, https://wotlkdb.com/?spell=57706, -1.101, 1.19, 0.089, 7.5
Glyph of Divine Plea, https://wotlkdb.com/?spell=64305, -1.1027, 15.95, 14.8473, 93.1
Glyph of Moonfire, https://wotlkdb.com/?spell=56951, -1.19, 15.2125, 14.0225, 92.2
Glyph of Water Breathing, https://wotlkdb.com/?spell=58331, -1.2125, 15.2125, 14, 92
Glyph of Flametongue Weapon, https://wotlkdb.com/?spell=57240, -1.2431, 15.2125, 13.9694, 91.8
Glyph of Survival Instincts, https://wotlkdb.com/?spell=65245, -1.4563, 15.4515, 13.9952, 90.6
Hellfire Tome, https://wotlkdb.com/?spell=59495, -1.6595, 41.6594, 39.9999, 96
Glyph of Holy Light, https://wotlkdb.com/?spell=57029, -1.7672, 15.2125, 13.4453, 88.4
Glyph of Bloodthirst, https://wotlkdb.com/?spell=57153, -1.9501, 15.95, 13.9999, 87.8
Glyph of the Hawk, https://wotlkdb.com/?spell=57006, -1.9503, 15.95, 13.9997, 87.8
Glyph of Regrowth, https://wotlkdb.com/?spell=56954, -1.9506, 15.95, 13.9994, 87.8
Glyph of Safe Fall, https://wotlkdb.com/?spell=58327, -2.0865, 17.2874, 15.2009, 87.9
Glyph of Mending, https://wotlkdb.com/?spell=56997, -2.2126, 15.2125, 12.9999, 85.5
Glyph of Evocation, https://wotlkdb.com/?spell=56974, -2.2874, 15.2873, 12.9999, 85
Glyph of the Pack, https://wotlkdb.com/?spell=58297, -2.288, 17.2874, 14.9994, 86.8
Glyph of Rip, https://wotlkdb.com/?spell=56956, -2.2945, 17.2874, 14.9929, 86.7
Glyph of Vigilance, https://wotlkdb.com/?spell=64255, -2.3376, 17.2874, 14.9498, 86.5
Glyph of Disengage, https://wotlkdb.com/?spell=57001, -2.4, 17.3999, 14.9999, 86.2
Glyph of Ice Barrier, https://wotlkdb.com/?spell=64257, -2.4003, 17.3999, 14.9996, 86.2
Glyph of Frenzied Regeneration, https://wotlkdb.com/?spell=56943, -2.45, 12.45, 10, 80.3
Glyph of Shadow Word: Pain, https://wotlkdb.com/?spell=57192, -2.45, 12.45, 10, 80.3
Glyph of Windfury Weapon, https://wotlkdb.com/?spell=57252, -2.45, 12.45, 10, 80.3
Glyph of Guardian Spirit, https://wotlkdb.com/?spell=64281, -2.4503, 12.45, 9.9997, 80.3
Glyph of Ice Armor, https://wotlkdb.com/?spell=56978, -2.4715, 7.4515, 4.98, 66.8
Glyph of Arcane Barrage, https://wotlkdb.com/?spell=64276, -2.5003, 12.45, 9.9497, 79.9
Fiery Ink, https://wotlkdb.com/?spell=57710, -2.5291, 3.069, 0.5399, 17.6
Glyph of Wrath, https://wotlkdb.com/?spell=56963, -2.5316, 7.4515, 4.9199, 66
Glyph of Insect Swarm, https://wotlkdb.com/?spell=56948, -2.7873, 15.2873, 12.5, 81.8
Glyph of Shield of Righteousness, https://wotlkdb.com/?spell=64308, -2.95, 15.95, 13, 81.5
Glyph of Snake Trap, https://wotlkdb.com/?spell=57010, -3.0151, 15.95, 12.9349, 81.1
Glyph of Intervene, https://wotlkdb.com/?spell=57159, -3.15, 15.95, 12.8, 80.3
Glyph of Avenger's Shield, https://wotlkdb.com/?spell=57019, -3.1801, 15.95, 12.7699, 80.1
Glyph of Water Mastery, https://wotlkdb.com/?spell=57251, -3.2213, 22.103, 18.8817, 85.4
Glyph of Mind Flay, https://wotlkdb.com/?spell=57200, -3.2874, 15.2873, 11.9999, 78.5
Glyph of Holy Shock, https://wotlkdb.com/?spell=64254, -3.2976, 17.2874, 13.9898, 80.9
Glyph of Adrenaline Rush, https://wotlkdb.com/?spell=57112, -3.4, 15.95, 12.55, 78.7
Glyph of Consecration, https://wotlkdb.com/?spell=57023, -3.4, 17.3999, 13.9999, 80.5
Glyph of Healing Stream Totem, https://wotlkdb.com/?spell=57242, -3.4, 17.3999, 13.9999, 80.5
Glyph of Barkskin, https://wotlkdb.com/?spell=64256, -3.4003, 17.3999, 13.9996, 80.5
Glyph of Rapid Fire, https://wotlkdb.com/?spell=57008, -3.4502, 12.45, 8.9998, 72.3
Glyph of Rapid Charge, https://wotlkdb.com/?spell=57162, -3.4715, 7.4515, 3.98, 53.4
Glyph of Stormstrike, https://wotlkdb.com/?spell=57248, -3.9501, 15.95, 11.9999, 75.2
Glyph of Elemental Mastery, https://wotlkdb.com/?spell=57250, -3.9502, 15.95, 11.9998, 75.2
Glyph of Mind Sear, https://wotlkdb.com/?spell=64309, -3.9502, 15.95, 11.9998, 75.2
Glyph of Shocking, https://wotlkdb.com/?spell=57235, -4, 15.95, 11.95, 74.9
Snowfall Ink, https://wotlkdb.com/?spell=57716, -4.033, 13.833, 9.8, 70.8
Royal Ink, https://wotlkdb.com/?spell=57708, -4.075, 4.1924, 0.1174, 2.8
Moonglow Ink, https://wotlkdb.com/?spell=52843, -4.21, 9.96, 5.75, 57.7
Glyph of Overpower, https://wotlkdb.com/?spell=57161, -4.2875, 15.2873, 10.9998, 72
Darkflame Ink, https://wotlkdb.com/?spell=57714, -4.2951, 4.43, 0.1349, 3
Glyph of Holy Nova, https://wotlkdb.com/?spell=57187, -4.4277, 12.45, 8.0223, 64.4
Glyph of Lightning Shield, https://wotlkdb.com/?spell=57246, -4.4715, 7.4515, 2.98, 40
Scroll of Recall, https://wotlkdb.com/?spell=48248, -4.5216, 5.7515, 1.2299, 21.4
Ivory Ink, https://wotlkdb.com/?spell=52738, -4.73, 4.98, 0.25, 5
Glyph of Enraged Regeneration, https://wotlkdb.com/?spell=64312, -4.95, 15.95, 11, 69
Glyph of Aspect of the Viper, https://wotlkdb.com/?spell=56998, -4.9501, 15.95, 10.9999, 69
Glyph of Death Coil, https://wotlkdb.com/?spell=57261, -5.0553, 15.95, 10.8947, 68.3
Mystic Tome, https://wotlkdb.com/?spell=58565, -5.1676, 15.1675, 9.9999, 65.9
Glyph of Disease, https://wotlkdb.com/?spell=64267, -5.182, 22.103, 16.921, 76.6
Glyph of Arcane Shot, https://wotlkdb.com/?spell=56995, -5.2116, 15.2015, 9.9899, 65.7
Glyph of Lightning Bolt, https://wotlkdb.com/?spell=57245, -5.2125, 15.2125, 10, 65.7
Glyph of Fire Nova, https://wotlkdb.com/?spell=57238, -5.2126, 15.2125, 9.9999, 65.7
Armor Vellum, https://wotlkdb.com/?spell=52739, -5.223, 5.753, 0.53, 9.2
Glyph of Righteous Defense, https://wotlkdb.com/?spell=57032, -5.2873, 15.2873, 10, 65.4
Glyph of Renew, https://wotlkdb.com/?spell=57197, -5.2873, 15.2873, 10, 65.4
Glyph of Aimed Shot, https://wotlkdb.com/?spell=56994, -5.2874, 15.2873, 9.9999, 65.4
Glyph of Explosive Trap, https://wotlkdb.com/?spell=64253, -5.2875, 15.2873, 9.9998, 65.4
Glyph of Hymn of Hope, https://wotlkdb.com/?spell=64283, -5.8502, 12.45, 6.5998, 53
Glyph of Hurricane, https://wotlkdb.com/?spell=56946, -5.9403, 15.95, 10.0097, 62.8
Glyph of Remove Curse, https://wotlkdb.com/?spell=56988, -5.95, 15.95, 10, 62.7
Glyph of Curse of Agony, https://wotlkdb.com/?spell=57260, -5.95, 15.95, 10, 62.7
Glyph of Chain Lightning, https://wotlkdb.com/?spell=57233, -5.9501, 15.95, 9.9999, 62.7
Glyph of Mirror Image, https://wotlkdb.com/?spell=64314, -5.9506, 15.95, 9.9994, 62.7
Glyph of Chains of Ice, https://wotlkdb.com/?spell=57211, -6, 15.95, 9.95, 62.4
Glyph of the Beast, https://wotlkdb.com/?spell=56996, -6.0001, 15.95, 9.9499, 62.4
Glyph of Rapid Rejuvenation, https://wotlkdb.com/?spell=71015, -6.0001, 15.95, 9.9499, 62.4
Glyph of Spirit of Redemption, https://wotlkdb.com/?spell=57202, -6.0003, 15.95, 9.9497, 62.4
Glyph of Psychic Scream, https://wotlkdb.com/?spell=57196, -6.0715, 7.4515, 1.38, 18.5
Glyph of Expose Armor, https://wotlkdb.com/?spell=57121, -6.3129, 15.2125, 8.8996, 58.5
Scroll of Intellect II, https://wotlkdb.com/?spell=50598, -6.4615, 7.4515, 0.99, 13.3
Glyph of Healthstone, https://wotlkdb.com/?spell=57266, -6.4616, 7.4515, 0.9899, 13.3
Scroll of Stamina II, https://wotlkdb.com/?spell=50612, -6.4715, 7.4515, 0.98, 13.2
Glyph of Backstab, https://wotlkdb.com/?spell=57114, -6.5115, 7.4515, 0.94, 12.6
Glyph of Claw, https://wotlkdb.com/?spell=67600, -6.5815, 7.4515, 0.87, 11.7
Midnight Ink, https://wotlkdb.com/?spell=53462, -6.65, 14.1, 7.45, 52.8
Glyph of Evasion, https://wotlkdb.com/?spell=57119, -6.9515, 7.4515, 0.5, 6.7
Scroll of Agility II, https://wotlkdb.com/?spell=58473, -7.0515, 7.4515, 0.4, 5.4
Scroll of Strength II, https://wotlkdb.com/?spell=58485, -7.0865, 7.4515, 0.365, 4.9
Glyph of Dark Death, https://wotlkdb.com/?spell=64266, -7.103, 22.103, 15, 67.9
Glyph of Exorcism, https://wotlkdb.com/?spell=57025, -7.1032, 22.103, 14.9998, 67.9
Glyph of Mutilate, https://wotlkdb.com/?spell=64260, -7.1032, 22.103, 14.9998, 67.9
Glyph of Icy Touch, https://wotlkdb.com/?spell=57219, -7.1033, 22.103, 14.9997, 67.9
Glyph of Totem of Wrath, https://wotlkdb.com/?spell=64262, -7.1033, 22.103, 14.9997, 67.9
Glyph of Fade, https://wotlkdb.com/?spell=57184, -7.2625, 15.2125, 7.95, 52.3
Glyph of Cleaving, https://wotlkdb.com/?spell=57154, -7.3999, 17.3999, 10, 57.5
