Glyph of Shadow Word: Pain, https://wotlkdb.com/?spell=57192, -0.55, 12.45, 11.9, 95.6
Ivory Ink, https://wotlkdb.com/?spell=52738, -0.6499, 1.8999, 1.25, 65.8
Ink of the Sky, https://wotlkdb.com/?spell=57712, -0.6924, 7.98, 7.2876, 91.3
Glyph of Evasion, https://wotlkdb.com/?spell=57119, -0.9815, 9.9815, 9, 90.2
Scroll of Spirit, https://wotlkdb.com/?spell=48116, -1.0015, 1.2515, 0.25, 20
Scroll of Recall II, https://wotlkdb.com/?spell=60336, -1.0125, 4.0125, 3, 74.8
Glyph of Insect Swarm, https://wotlkdb.com/?spell=56948, -1.0625, 9.0125, 7.95, 88.2
Royal Ink, https://wotlkdb.com/?spell=57708, -1.1971, 1.5271, 0.33, 21.6
Glyph of Seal of Command, https://wotlkdb.com/?spell=57033, -1.45, 12.45, 11, 88.4
Armor Vellum II, https://wotlkdb.com/?spell=59499, -1.525, 4.025, 2.5, 62.1
Glyph of Succubus, https://wotlkdb.com/?spell=57275, -1.7737, 12.45, 10.6763, 85.8
Glyph of Wrath, https://wotlkdb.com/?spell=56963, -1.9815, 9.9815, 8, 80.1
Glyph of Healing Touch, https://wotlkdb.com/?spell=56945, -1.99, 5.0125, 3.0225, 60.3
Glyph of Deterrence, https://wotlkdb.com/?spell=57000, -1.9926, 4.0125, 2.0199, 50.3
Glyph of Backstab, https://wotlkdb.com/?spell=57114, -2.0315, 9.9815, 7.95, 79.6
Glyph of Corruption, https://wotlkdb.com/?spell=57259, -2.0315, 9.9815, 7.95, 79.6
Glyph of Healthstone, https://wotlkdb.com/?spell=57266, -2.0315, 9.9815, 7.95, 79.6
Glyph of Searing Pain, https://wotlkdb.com/?spell=57270, -2.125, 4.125, 2, 48.5
Glyph of Fear Ward, https://wotlkdb.com/?spell=57185, -2.125, 5.125, 3, 58.5
Glyph of Soulstone, https://wotlkdb.com/?spell=57274, -2.145, 4.125, 1.98, 48
Scroll of Strength, https://wotlkdb.com/?spell=58484, -2.353, 2.5015, 0.1485, 5.9
Glyph of the Beast, https://wotlkdb.com/?spell=56996, -2.4163, 17.4163, 15, 86.1
Glyph of Snake Trap, https://wotlkdb.com/?spell=57010, -2.4163, 17.4163, 15, 86.1
Glyph of Focus, https://wotlkdb.com/?spell=62162, -2.4163, 17.4163, 15, 86.1
Scroll of Agility, https://wotlkdb.com/?spell=58472, -2.4866, 2.5015, 0.0149, 0.6
Glyph of Mage Armor, https://wotlkdb.com/?spell=56984, -2.5, 12.45, 9.95, 79.9
Glyph of Unholy Blight, https://wotlkdb.com/?spell=64299, -2.5, 12.45, 9.95, 79.9
Glyph of Blood Strike, https://wotlkdb.com/?spell=59339, -2.65, 12.45, 9.8, 78.7
Shimmering Ink, https://wotlkdb.com/?spell=57711, -2.9266, 7.9266, 5, 63.1
Lion's Ink, https://wotlkdb.com/?spell=57704, -3, 8, 5, 62.5
Fiery Ink, https://wotlkdb.com/?spell=57710, -3.0437, 3.58, 0.5363, 15
Glyph of Barbaric Insults, https://wotlkdb.com/?spell=57151, -3.135, 4.125, 0.99, 24
Glyph of Bone Shield, https://wotlkdb.com/?spell=57210, -3.145, 5.125, 1.98, 38.6
Ethereal Ink, https://wotlkdb.com/?spell=57713, -3.15, 15.1, 11.95, 79.1
Scroll of Strength IV, https://wotlkdb.com/?spell=58487, -3.41, 4.25, 0.84, 19.8
Glyph of Unstable Affliction, https://wotlkdb.com/?spell=57276, -3.4171, 17.4163, 13.9992, 80.4
Stormbound Tome, https://wotlkdb.com/?spell=59493, -3.4258, 78.4258, 75, 95.6
Scroll of Stamina VI, https://wotlkdb.com/?spell=50618, -3.47, 5.25, 1.78, 33.9
Glyph of Fear, https://wotlkdb.com/?spell=57262, -3.5592, 5.0125, 1.4533, 29
Royal Guide of Escape Routes, https://wotlkdb.com/?spell=59486, -3.775, 19.775, 16, 80.9
Glyph of Slice and Dice, https://wotlkdb.com/?spell=57132, -3.9255, 4.125, 0.1995, 4.8
Glyph of Divinity, https://wotlkdb.com/?spell=57031, -4.0125, 5.0125, 1, 20
Glyph of Evocation, https://wotlkdb.com/?spell=56974, -4.0125, 9.0125, 5, 55.5
Glyph of Imp, https://wotlkdb.com/?spell=57269, -4.0225, 5.0125, 0.99, 19.8
Glyph of Sunder Armor, https://wotlkdb.com/?spell=57167, -4.0625, 5.0125, 0.95, 19
Scroll of Intellect IV, https://wotlkdb.com/?spell=50600, -4.13, 4.25, 0.12, 2.8
Glyph of Freezing Trap, https://wotlkdb.com/?spell=57002, -4.135, 5.125, 0.99, 19.3
Scroll of Agility IV, https://wotlkdb.com/?spell=58478, -4.2126, 4.25, 0.0374, 0.9
Scroll of Stamina IV, https://wotlkdb.com/?spell=50616, -4.2167, 4.25, 0.0333, 0.8
Scroll of Spirit IV, https://wotlkdb.com/?spell=50607, -4.22, 4.25, 0.03, 0.7
Scroll of Stamina V, https://wotlkdb.com/?spell=50617, -4.2248, 5.25, 1.0252, 19.5
Darkflame Ink, https://wotlkdb.com/?spell=57714, -4.24, 4.84, 0.6, 12.4
Scroll of Strength V, https://wotlkdb.com/?spell=58488, -4.26, 5.25, 0.99, 18.9
Scroll of Spirit V, https://wotlkdb.com/?spell=50608, -4.285, 5.25, 0.965, 18.4
Glyph of Howl of Terror, https://wotlkdb.com/?spell=57267, -4.5163, 17.4163, 12.9, 74.1
Snowfall Ink, https://wotlkdb.com/?spell=57716, -4.55, 14.5, 9.95, 68.6
Scroll of Intellect V, https://wotlkdb.com/?spell=50601, -4.74, 5.25, 0.51, 9.7
Glyph of Expose Armor, https://wotlkdb.com/?spell=57121, -4.8125, 5.0125, 0.2, 4
Scroll of Spirit VI, https://wotlkdb.com/?spell=50609, -4.85, 5.25, 0.4, 7.6
Armor Vellum, https://wotlkdb.com/?spell=52739, -4.913, 5.953, 1.04, 17.5
Glyph of Rapid Charge, https://wotlkdb.com/?spell=57162, -4.9816, 9.9815, 4.9999, 50.1
Glyph of Rebirth, https://wotlkdb.com/?spell=56953, -5.0125, 9.0125, 4, 44.4
Glyph of Lava Lash, https://wotlkdb.com/?spell=57249, -5.0125, 9.0125, 4, 44.4
Glyph of Claw, https://wotlkdb.com/?spell=67600, -5.0215, 9.9815, 4.96, 49.7
Glyph of Cleansing, https://wotlkdb.com/?spell=57020, -5.0325, 9.0125, 3.98, 44.2
Scroll of Agility V, https://wotlkdb.com/?spell=58480, -5.2, 5.25, 0.05, 1
Scroll of Recall, https://wotlkdb.com/?spell=48248, -5.3115, 5.9515, 0.64, 10.8
Glyph of Arcane Power, https://wotlkdb.com/?spell=56972, -5.38, 12.45, 7.07, 56.8
Armor Vellum III, https://wotlkdb.com/?spell=59500, -5.9163, 17.9163, 12, 67
Glyph of Spiritual Attunement, https://wotlkdb.com/?spell=57022, -6.0015, 9.9815, 3.98, 39.9
Glyph of Multi-Shot, https://wotlkdb.com/?spell=57007, -6.0125, 9.0125, 3, 33.3
Tome of Kings, https://wotlkdb.com/?spell=59484, -6.775, 19.775, 13, 65.7
Glyph of Frost Shock, https://wotlkdb.com/?spell=57241, -7.0125, 9.0125, 2, 22.2
Glyph of Voidwalker, https://wotlkdb.com/?spell=57277, -7.0125, 9.0125, 2, 22.2
Glyph of Sap, https://wotlkdb.com/?spell=57129, -7.0625, 9.0125, 1.95, 21.6
Glyph of Revenge, https://wotlkdb.com/?spell=57165, -7.0725, 9.0125, 1.94, 21.5
Glyph of Avenging Wrath, https://wotlkdb.com/?spell=57021, -7.4158, 17.4163, 10.0005, 57.4
Glyph of Ice Lance, https://wotlkdb.com/?spell=56980, -7.4163, 17.4163, 10, 57.4
Glyph of Fire Elemental Totem, https://wotlkdb.com/?spell=57237, -7.4163, 17.4163, 10, 57.4
Glyph of Felhunter, https://wotlkdb.com/?spell=57264, -7.5487, 17.4163, 9.8676, 56.7
Glyph of Lightning Shield, https://wotlkdb.com/?spell=57246, -7.9815, 9.9815, 2, 20
Scroll of Agility III, https://wotlkdb.com/?spell=58476, -8.035, 9.025, 0.99, 11
Scroll of Stamina III, https://wotlkdb.com/?spell=50614, -8.135, 9.025, 0.89, 9.9
Glyph of Shadow Bolt, https://wotlkdb.com/?spell=57271, -8.2125, 9.0125, 0.8, 8.9
Tome of the Dawn, https://wotlkdb.com/?spell=59475, -8.225, 14.225, 6, 42.2
Glyph of Intervene, https://wotlkdb.com/?spell=57159, -8.4163, 17.4163, 9, 51.7
Glyph of Blade Flurry, https://wotlkdb.com/?spell=57115, -8.4164, 17.4163, 8.9999, 51.7
Glyph of Hymn of Hope, https://wotlkdb.com/?spell=64283, -8.4501, 12.45, 3.9999, 32.1
Scroll of Strength III, https://wotlkdb.com/?spell=58486, -8.675, 9.025, 0.35, 3.9
Glyph of Rake, https://wotlkdb.com/?spell=56952, -8.71, 12.45, 3.74, 30
Scroll of Intellect III, https://wotlkdb.com/?spell=50599, -8.845, 9.025, 0.18, 2
Scroll of Spirit III, https://wotlkdb.com/?spell=50606, -9.015, 9.025, 0.01, 0.1
Glyph of Crippling Poison, https://wotlkdb.com/?spell=57116, -9.4163, 17.4163, 8, 45.9
Scroll of Agility II, https://wotlkdb.com/?spell=58473, -9.4415, 9.9815, 0.54, 5.4
Glyph of Unbreakable Armor, https://wotlkdb.com/?spell=57226, -9.47, 12.45, 2.98, 23.9
Scroll of Strength II, https://wotlkdb.com/?spell=58485, -9.494, 9.9815, 0.4875, 4.9
Scroll of Stamina II, https://wotlkdb.com/?spell=50612, -9.5015, 9.9815, 0.48, 4.8
Scroll of Spirit II, https://wotlkdb.com/?spell=50605, -9.7465, 9.9815, 0.235, 2.4
Glyph of Psychic Scream, https://wotlkdb.com/?spell=57196, -9.877, 9.9815, 0.1045, 1
Scroll of Intellect II, https://wotlkdb.com/?spell=50598, -9.9718, 9.9815, 0.0097, 0.1
Glyph of Feint, https://wotlkdb.com/?spell=57122, -10.135, 12.075, 1.94, 16.1
Glyph of Remove Curse, https://wotlkdb.com/?spell=56988, -10.3963, 17.4163, 7.02, 40.3
Glyph of Rapid Fire, https://wotlkdb.com/?spell=57008, -10.47, 12.45, 1.98, 15.9
Glyph of Scourge Strike, https://wotlkdb.com/?spell=57224, -10.53, 12.45, 1.92, 15.4
Scroll of Intellect VI, https://wotlkdb.com/?spell=50602, -11.759, 12.2, 0.441, 3.6
Scroll of Agility VI, https://wotlkdb.com/?spell=58481, -11.805, 12.2, 0.395, 3.2
Scroll of Strength VI, https://wotlkdb.com/?spell=58489, -12.1763, 12.2, 0.0237, 0.2
Glyph of Frost Trap, https://wotlkdb.com/?spell=57003, -12.24, 12.45, 0.21, 1.7
Book of Survival, https://wotlkdb.com/?spell=59478, -13.625, 14.225, 0.6, 4.2
Scroll of Strength VIII, https://wotlkdb.com/?spell=58491, -13.9663, 17.9163, 3.95, 22
Glyph of Hurricane, https://wotlkdb.com/?spell=56946, -14.4163, 17.4163, 3, 17.2
Scroll of Recall III, https://wotlkdb.com/?spell=60337, -14.9563, 17.4163, 2.46, 14.1
Glyph of Mind Control, https://wotlkdb.com/?spell=57191, -15.4163, 17.4163, 2, 11.5
Glyph of Strangulate, https://wotlkdb.com/?spell=57225, -15.5163, 17.4163, 1.9, 10.9
Celestial Ink, https://wotlkdb.com/?spell=57709, -15.9998, 19.9998, 4, 20
Scroll of Stamina VIII, https://wotlkdb.com/?spell=50620, -16.2266, 17.9163, 1.6897, 9.4
Jadefire Ink, https://wotlkdb.com/?spell=57707, -16.542, 25.542, 9, 35.2
Scroll of Spirit VIII, https://wotlkdb.com/?spell=50611, -16.7363, 17.9163, 1.18, 6.6
Scroll of Agility VIII, https://wotlkdb.com/?spell=58483, -16.8763, 17.9163, 1.04, 5.8
Scroll of Intellect VIII, https://wotlkdb.com/?spell=50604, -16.9763, 17.9163, 0.94, 5.2
Scroll of Stamina VII, https://wotlkdb.com/?spell=50619, -17.7698, 17.9163, 0.1465, 0.8
Scroll of Intellect VII, https://wotlkdb.com/?spell=50603, -17.8168, 17.9163, 0.0995, 0.6
Scroll of Agility VII, https://wotlkdb.com/?spell=58482, -17.8488, 17.9163, 0.0675, 0.4
Scroll of Spirit VII, https://wotlkdb.com/?spell=50610, -17.8699, 17.9163, 0.0464, 0.3
Scroll of Strength VII, https://wotlkdb.com/?spell=58490, -17.8763, 17.9163, 0.04, 0.2
Weapon Vellum III, https://wotlkdb.com/?spell=59501, -18.4489, 51.7489, 33.3, 64.3
Weapon Vellum, https://wotlkdb.com/?spell=52840, -21.943, 29.943, 8, 26.7
Manual of Clouds, https://wotlkdb.com/?spell=59494, -59.5508, 79.5508, 20, 25.1
Twilight Tome, https://wotlkdb.com/?spell=64053, -79.5815, 129.5815, 50, 38.6
