Scroll of Recall II, https://wotlkdb.com/?spell=60336, -2.0999, 5.0999, 3, 58.8
Glyph of Snake Trap, https://wotlkdb.com/?spell=57010, -2.1001, 17.5, 15.3999, 88
Glyph of Rebirth, https://wotlkdb.com/?spell=56953, -2.175, 12.125, 9.95, 82.1
Glyph of Revenge, https://wotlkdb.com/?spell=57165, -2.175, 12.125, 9.95, 82.1
Glyph of Renew, https://wotlkdb.com/?spell=57197, -2.175, 12.125, 9.95, 82.1
Glyph of Shadowburn, https://wotlkdb.com/?spell=57272, -2.375, 15.125, 12.75, 84.3
Glyph of Demonic Circle, https://wotlkdb.com/?spell=64317, -2.48, 17.5, 15.02, 85.8
Glyph of the Beast, https://wotlkdb.com/?spell=56996, -2.5, 17.5, 15, 85.7
Armor Vellum II, https://wotlkdb.com/?spell=59499, -2.6124, 5.1124, 2.5, 48.9
Fiery Ink, https://wotlkdb.com/?spell=57710, -2.76, 3.6, 0.84, 23.3
Glyph of Flash of Light, https://wotlkdb.com/?spell=57026, -3.075, 18.075, 15, 83
Glyph of Deterrence, https://wotlkdb.com/?spell=57000, -3.08, 5.0999, 2.0199, 39.6
Glyph of Wrath, https://wotlkdb.com/?spell=56963, -3.0815, 9.9815, 6.9, 69.1
Glyph of Frenzied Regeneration, https://wotlkdb.com/?spell=56943, -3.45, 18.45, 15, 81.3
Glyph of Rune Tap, https://wotlkdb.com/?spell=59338, -3.45, 18.45, 15, 81.3
Glyph of Metamorphosis, https://wotlkdb.com/?spell=64318, -3.4502, 18.45, 14.9998, 81.3
Glyph of Unstable Affliction, https://wotlkdb.com/?spell=57276, -3.5008, 17.5, 13.9992, 80
Glyph of Mage Armor, https://wotlkdb.com/?spell=56984, -3.55, 18.45, 14.9, 80.8
Glyph of Searing Pain, https://wotlkdb.com/?spell=57270, -3.6225, 5.2124, 1.5899, 30.5
Glyph of Insect Swarm, https://wotlkdb.com/?spell=56948, -4.125, 12.125, 8, 66
Scroll of Strength IV, https://wotlkdb.com/?spell=58487, -4.1574, 5.3374, 1.18, 22.1
Glyph of Barbaric Insults, https://wotlkdb.com/?spell=57151, -4.2374, 5.2124, 0.975, 18.7
Glyph of Vampiric Blood, https://wotlkdb.com/?spell=57227, -4.45, 18.45, 14, 75.9
Armor Vellum III, https://wotlkdb.com/?spell=59500, -4.5, 18, 13.5, 75
Snowfall Ink, https://wotlkdb.com/?spell=57716, -4.65, 14.6, 9.95, 68.2
Armor Vellum, https://wotlkdb.com/?spell=52739, -4.7034, 5.7434, 1.04, 18.1
Scroll of Recall, https://wotlkdb.com/?spell=48248, -4.8061, 5.7419, 0.9358, 16.3
Glyph of Immolation Trap, https://wotlkdb.com/?spell=57005, -4.9625, 9.9625, 5, 50.2
Glyph of Lightning Bolt, https://wotlkdb.com/?spell=57245, -4.9625, 9.9625, 5, 50.2
Glyph of Spiritual Attunement, https://wotlkdb.com/?spell=57022, -4.9815, 9.9815, 5, 50.1
Glyph of Claw, https://wotlkdb.com/?spell=67600, -4.9815, 9.9815, 5, 50.1
Glyph of Rapid Charge, https://wotlkdb.com/?spell=57162, -4.9816, 9.9815, 4.9999, 50.1
Glyph of Slice and Dice, https://wotlkdb.com/?spell=57132, -5.0129, 5.2124, 0.1995, 3.8
Glyph of Soulstone, https://wotlkdb.com/?spell=57274, -5.1124, 5.2124, 0.1, 1.9
Glyph of Lightning Shield, https://wotlkdb.com/?spell=57246, -5.1215, 9.9815, 4.86, 48.7
Scroll of Intellect IV, https://wotlkdb.com/?spell=50600, -5.2174, 5.3374, 0.12, 2.2
Scroll of Agility IV, https://wotlkdb.com/?spell=58478, -5.3, 5.3374, 0.0374, 0.7
Scroll of Spirit IV, https://wotlkdb.com/?spell=50607, -5.3074, 5.3374, 0.03, 0.6
Scroll of Stamina IV, https://wotlkdb.com/?spell=50616, -5.3206, 5.3374, 0.0168, 0.3
Glyph of Death Grip, https://wotlkdb.com/?spell=57213, -5.675, 15.125, 9.45, 62.5
Glyph of Imp, https://wotlkdb.com/?spell=57269, -5.9625, 9.9625, 4, 40.2
Glyph of Monsoon, https://wotlkdb.com/?spell=64258, -6.175, 15.125, 8.95, 59.2
Glyph of Ice Lance, https://wotlkdb.com/?spell=56980, -6.55, 17.5, 10.95, 62.6
Glyph of Shadow Word: Pain, https://wotlkdb.com/?spell=57192, -6.55, 18.45, 11.9, 64.5
Glyph of Healthstone, https://wotlkdb.com/?spell=57266, -6.9915, 9.9815, 2.99, 30
Glyph of Multi-Shot, https://wotlkdb.com/?spell=57007, -7.1251, 12.125, 4.9999, 41.2
Glyph of Avenging Wrath, https://wotlkdb.com/?spell=57021, -7.4995, 17.5, 10.0005, 57.1
Glyph of Fire Elemental Totem, https://wotlkdb.com/?spell=57237, -7.5, 17.5, 10, 57.1
Glyph of Focus, https://wotlkdb.com/?spell=62162, -7.5, 17.5, 10, 57.1
Glyph of the Hawk, https://wotlkdb.com/?spell=57006, -7.5001, 17.5, 9.9999, 57.1
Glyph of Succubus, https://wotlkdb.com/?spell=57275, -7.7737, 18.45, 10.6763, 57.9
Scroll of Recall III, https://wotlkdb.com/?spell=60337, -8, 17.5, 9.5, 54.3
Glyph of Cleansing, https://wotlkdb.com/?spell=57020, -8.125, 12.125, 4, 33
Glyph of Lava Lash, https://wotlkdb.com/?spell=57249, -8.125, 12.125, 4, 33
Glyph of Seal of Command, https://wotlkdb.com/?spell=57033, -8.45, 18.45, 10, 54.2
Mystic Tome, https://wotlkdb.com/?spell=58565, -8.475, 23.475, 15, 63.9
Glyph of Intervene, https://wotlkdb.com/?spell=57159, -8.5, 17.5, 9, 51.4
Glyph of Blade Flurry, https://wotlkdb.com/?spell=57115, -8.5001, 17.5, 8.9999, 51.4
Glyph of Crippling Poison, https://wotlkdb.com/?spell=57116, -8.5001, 17.5, 8.9999, 51.4
Glyph of Fear, https://wotlkdb.com/?spell=57262, -8.5092, 9.9625, 1.4533, 14.6
Glyph of Divinity, https://wotlkdb.com/?spell=57031, -8.9625, 9.9625, 1, 10
Scroll of Agility III, https://wotlkdb.com/?spell=58476, -9.1575, 12.1375, 2.98, 24.6
Scroll of Stamina III, https://wotlkdb.com/?spell=50614, -9.1775, 12.1375, 2.96, 24.4
Glyph of Evasion, https://wotlkdb.com/?spell=57119, -9.3815, 9.9815, 0.6, 6
Glyph of Holy Nova, https://wotlkdb.com/?spell=57187, -9.45, 18.45, 9, 48.8
Scroll of Agility II, https://wotlkdb.com/?spell=58473, -9.4915, 9.9815, 0.49, 4.9
Scroll of Strength II, https://wotlkdb.com/?spell=58485, -9.5415, 9.9815, 0.44, 4.4
Scroll of Intellect II, https://wotlkdb.com/?spell=50598, -9.6815, 9.9815, 0.3, 3
Scroll of Stamina II, https://wotlkdb.com/?spell=50612, -9.728, 9.9815, 0.2535, 2.5
Scroll of Spirit II, https://wotlkdb.com/?spell=50605, -9.7465, 9.9815, 0.235, 2.4
Glyph of Expose Armor, https://wotlkdb.com/?spell=57121, -9.7625, 9.9625, 0.2, 2
Glyph of Psychic Scream, https://wotlkdb.com/?spell=57196, -9.877, 9.9815, 0.1045, 1
Glyph of Sap, https://wotlkdb.com/?spell=57129, -10.105, 12.125, 2.02, 16.7
Glyph of Voidwalker, https://wotlkdb.com/?spell=57277, -10.125, 12.125, 2, 16.5
Scroll of Strength III, https://wotlkdb.com/?spell=58486, -10.2071, 12.1375, 1.9304, 15.9
Glyph of Frost Shock, https://wotlkdb.com/?spell=57241, -11.135, 12.125, 0.99, 8.2
Glyph of Shadow Bolt, https://wotlkdb.com/?spell=57271, -11.135, 12.125, 0.99, 8.2
Scroll of Spirit III, https://wotlkdb.com/?spell=50606, -11.2375, 12.1375, 0.9, 7.4
Tome of the Dawn, https://wotlkdb.com/?spell=59475, -11.2765, 24.8265, 13.55, 54.6
Glyph of Arcane Power, https://wotlkdb.com/?spell=56972, -11.38, 18.45, 7.07, 38.3
Scroll of Intellect III, https://wotlkdb.com/?spell=50599, -11.9575, 12.1375, 0.18, 1.5
Glyph of Fear Ward, https://wotlkdb.com/?spell=57185, -12.125, 15.125, 3, 19.8
Glyph of Blood Strike, https://wotlkdb.com/?spell=59339, -12.6975, 18.45, 5.7525, 31.2
Glyph of Rapid Fire, https://wotlkdb.com/?spell=57008, -13.45, 18.45, 5, 27.1
Glyph of Frost Trap, https://wotlkdb.com/?spell=57003, -13.59, 18.45, 4.86, 26.3
Glyph of Bone Shield, https://wotlkdb.com/?spell=57210, -14.125, 15.125, 1, 6.6
Glyph of Freezing Trap, https://wotlkdb.com/?spell=57002, -14.1451, 15.125, 0.9799, 6.5
Scroll of Spirit V, https://wotlkdb.com/?spell=50608, -14.1825, 15.25, 1.0675, 7
Glyph of Ambush, https://wotlkdb.com/?spell=57113, -14.4401, 18.45, 4.0099, 21.7
Glyph of Hymn of Hope, https://wotlkdb.com/?spell=64283, -14.4501, 18.45, 3.9999, 21.7
Glyph of Rake, https://wotlkdb.com/?spell=56952, -14.47, 18.45, 3.98, 21.6
Scroll of Stamina VI, https://wotlkdb.com/?spell=50618, -14.5, 15.25, 0.75, 4.9
Glyph of Hurricane, https://wotlkdb.com/?spell=56946, -14.5, 17.5, 3, 17.1
Scroll of Stamina V, https://wotlkdb.com/?spell=50617, -14.7, 15.25, 0.55, 3.6
Scroll of Spirit VI, https://wotlkdb.com/?spell=50609, -14.85, 15.25, 0.4, 2.6
Scroll of Agility V, https://wotlkdb.com/?spell=58480, -15.2, 15.25, 0.05, 0.3
Scroll of Intellect V, https://wotlkdb.com/?spell=50601, -15.2001, 15.25, 0.0499, 0.3
Scroll of Strength V, https://wotlkdb.com/?spell=58488, -15.225, 15.25, 0.025, 0.2
Glyph of Unbreakable Armor, https://wotlkdb.com/?spell=57226, -15.47, 18.45, 2.98, 16.2
Glyph of Mind Control, https://wotlkdb.com/?spell=57191, -15.5, 17.5, 2, 11.4
Scroll of Spirit VIII, https://wotlkdb.com/?spell=50611, -15.96, 18, 2.04, 11.3
Glyph of Feint, https://wotlkdb.com/?spell=57122, -16.085, 18.075, 1.99, 11
Tome of Kings, https://wotlkdb.com/?spell=59484, -16.2, 29.2, 13, 44.5
Glyph of Scourge Strike, https://wotlkdb.com/?spell=57224, -16.53, 18.45, 1.92, 10.4
Scroll of Stamina VIII, https://wotlkdb.com/?spell=50620, -17, 18, 1, 5.6
Scroll of Agility VIII, https://wotlkdb.com/?spell=58483, -17.0542, 18, 0.9458, 5.3
Scroll of Intellect VIII, https://wotlkdb.com/?spell=50604, -17.06, 18, 0.94, 5.2
Glyph of Strangulate, https://wotlkdb.com/?spell=57225, -17.1, 17.5, 0.4, 2.3
Royal Guide of Escape Routes, https://wotlkdb.com/?spell=59486, -17.2, 29.2, 12, 41.1
Scroll of Agility VI, https://wotlkdb.com/?spell=58481, -17.7993, 18.2, 0.4007, 2.2
Scroll of Stamina VII, https://wotlkdb.com/?spell=50619, -17.8105, 18, 0.1895, 1.1
Scroll of Strength VIII, https://wotlkdb.com/?spell=58491, -17.82, 18, 0.18, 1
Scroll of Agility VII, https://wotlkdb.com/?spell=58482, -17.9325, 18, 0.0675, 0.4
Scroll of Strength VII, https://wotlkdb.com/?spell=58490, -17.9501, 18, 0.0499, 0.3
Scroll of Spirit VII, https://wotlkdb.com/?spell=50610, -17.963, 18, 0.037, 0.2
Scroll of Intellect VII, https://wotlkdb.com/?spell=50603, -17.973, 18, 0.027, 0.2
Scroll of Intellect VI, https://wotlkdb.com/?spell=50602, -18.15, 18.2, 0.05, 0.3
Scroll of Strength VI, https://wotlkdb.com/?spell=58489, -18.1763, 18.2, 0.0237, 0.1
Celestial Ink, https://wotlkdb.com/?spell=57709, -18.9126, 24, 5.0874, 21.2
Weapon Vellum, https://wotlkdb.com/?spell=52840, -19.943, 29.943, 10, 33.4
Weapon Vellum III, https://wotlkdb.com/?spell=59501, -22, 52, 30, 57.7
Book of Clever Tricks, https://wotlkdb.com/?spell=59496, -22.97, 81.47, 58.5, 71.8
Book of Survival, https://wotlkdb.com/?spell=59478, -24.2265, 24.8265, 0.6, 2.4
Twilight Tome, https://wotlkdb.com/?spell=64053, -29.7798, 129.7798, 100, 77.1
Stormbound Tome, https://wotlkdb.com/?spell=59493, -43.4258, 118.4258, 75, 63.3
Manual of Clouds, https://wotlkdb.com/?spell=59494, -99.5508, 119.5508, 20, 16.7
