Glyph of Sinister Strike, https://wotlkdb.com/?spell=57131, -7.4, 17.3999, 9.9999, 57.5
Glyph of Starfire, https://wotlkdb.com/?spell=56959, -7.4001, 17.3999, 9.9998, 57.5
Glyph of Spell Reflection, https://wotlkdb.com/?spell=64302, -7.4006, 12.45, 5.0494, 40.6
Scroll of Spirit II, https://wotlkdb.com/?spell=50605, -7.4054, 7.4515, 0.0461, 0.6
Glyph of Seal of Command, https://wotlkdb.com/?spell=57033, -7.4502, 12.45, 4.9998, 40.2
Glyph of Scorch, https://wotlkdb.com/?spell=56982, -7.4502, 17.3999, 9.9497, 57.2
Glyph of Pain Suppression, https://wotlkdb.com/?spell=64259, -7.6666, 22.103, 14.4364, 65.3
Glyph of Ambush, https://wotlkdb.com/?spell=57113, -7.6902, 12.45, 4.7598, 38.2
Glyph of Blade Flurry, https://wotlkdb.com/?spell=57115, -7.9502, 15.95, 7.9998, 50.2
Glyph of Scourge Imprisonment, https://wotlkdb.com/?spell=57198, -8.0507, 15.95, 7.8993, 49.5
Glyph of Mass Dispel, https://wotlkdb.com/?spell=57190, -8.25, 15.95, 7.7, 48.3
Glyph of Icy Veins, https://wotlkdb.com/?spell=56981, -8.2873, 15.2873, 7, 45.8
Glyph of Turn Evil, https://wotlkdb.com/?spell=57036, -8.4002, 15.95, 7.5498, 47.3
Glyph of Berserk, https://wotlkdb.com/?spell=64268, -8.4502, 12.45, 3.9998, 32.1
Glyph of Sweeping Strikes, https://wotlkdb.com/?spell=57168, -8.4503, 12.45, 3.9997, 32.1
Glyph of Succubus, https://wotlkdb.com/?spell=57275, -8.4701, 12.45, 3.9799, 32
Armor Vellum III, https://wotlkdb.com/?spell=59500, -8.95, 16.45, 7.5, 45.6
Glyph of Imp, https://wotlkdb.com/?spell=57269, -9.2129, 15.2125, 5.9996, 39.4
Glyph of Arcane Explosion, https://wotlkdb.com/?spell=56968, -9.2521, 15.2015, 5.9494, 39.1
Armor Vellum II, https://wotlkdb.com/?spell=59499, -9.2849, 17.2999, 8.015, 46.3
Glyph of Mage Armor, https://wotlkdb.com/?spell=56984, -9.4503, 12.45, 2.9997, 24.1
Glyph of Victory Rush, https://wotlkdb.com/?spell=57170, -9.95, 15.95, 6, 37.6
Scroll of Recall III, https://wotlkdb.com/?spell=60337, -9.95, 15.95, 6, 37.6
Glyph of Focus, https://wotlkdb.com/?spell=62162, -9.95, 15.95, 6, 37.6
Weapon Vellum II, https://wotlkdb.com/?spell=59488, -10.0648, 18.0648, 8, 44.3
Glyph of Execution, https://wotlkdb.com/?spell=57156, -10.088, 22.103, 12.015, 54.4
Glyph of Healing Touch, https://wotlkdb.com/?spell=56945, -10.2726, 15.2125, 4.9399, 32.5
Glyph of Lesser Healing Wave, https://wotlkdb.com/?spell=57244, -10.4501, 17.3999, 6.9498, 39.9
Glyph of Feint, https://wotlkdb.com/?spell=57122, -10.5751, 12.075, 1.4999, 12.4
Glyph of Howl of Terror, https://wotlkdb.com/?spell=57267, -10.95, 15.95, 5, 31.3
Glyph of Rake, https://wotlkdb.com/?spell=56952, -10.9503, 12.45, 1.4997, 12
Glyph of Lifebloom, https://wotlkdb.com/?spell=56949, -10.975, 15.95, 4.975, 31.2
Glyph of Shred, https://wotlkdb.com/?spell=56957, -11.0805, 22.103, 11.0225, 49.9
Glyph of Earth Shield, https://wotlkdb.com/?spell=64261, -11.103, 22.103, 11, 49.8
Glyph of Inner Fire, https://wotlkdb.com/?spell=57188, -11.2127, 15.2125, 3.9998, 26.3
Glyph of Sprint, https://wotlkdb.com/?spell=57133, -11.223, 22.103, 10.88, 49.2
Glyph of Fear, https://wotlkdb.com/?spell=57262, -11.2326, 15.2125, 3.9799, 26.2
Glyph of Frost Trap, https://wotlkdb.com/?spell=57003, -11.2504, 12.45, 1.1996, 9.6
Scroll of Agility VI, https://wotlkdb.com/?spell=58481, -11.4171, 12.2, 0.7829, 6.4
Glyph of Scourge Strike, https://wotlkdb.com/?spell=57224, -11.4501, 12.45, 0.9999, 8
Glyph of Unbreakable Armor, https://wotlkdb.com/?spell=57226, -11.4501, 12.45, 0.9999, 8
Glyph of Blood Strike, https://wotlkdb.com/?spell=59339, -11.48, 12.45, 0.97, 7.8
Glyph of Arcane Power, https://wotlkdb.com/?spell=56972, -11.515, 12.45, 0.935, 7.5
Glyph of Smite, https://wotlkdb.com/?spell=57201, -11.5999, 17.3999, 5.8, 33.3
Scroll of Intellect VI, https://wotlkdb.com/?spell=50602, -11.71, 12.2, 0.49, 4
Glyph of Mana Tide Totem, https://wotlkdb.com/?spell=57247, -11.9701, 15.95, 3.9799, 25
Glyph of Frost Strike, https://wotlkdb.com/?spell=57216, -12.0805, 22.103, 10.0225, 45.3
Glyph of Mana Gem, https://wotlkdb.com/?spell=56985, -12.103, 22.103, 10, 45.2
Scroll of Strength VI, https://wotlkdb.com/?spell=58489, -12.1763, 12.2, 0.0237, 0.2
Glyph of Hamstring, https://wotlkdb.com/?spell=57157, -12.2125, 15.2125, 3, 19.7
Glyph of Gouge, https://wotlkdb.com/?spell=57125, -12.2873, 15.2873, 3, 19.6
Glyph of Blink, https://wotlkdb.com/?spell=56973, -12.3326, 15.2125, 2.8799, 18.9
Weapon Vellum, https://wotlkdb.com/?spell=52840, -12.353, 22.353, 10, 44.7
Glyph of Deterrence, https://wotlkdb.com/?spell=57000, -12.5695, 17.2874, 4.7179, 27.3
Glyph of Immolation Trap, https://wotlkdb.com/?spell=57005, -12.7526, 15.2125, 2.4599, 16.2
Ink of the Sky, https://wotlkdb.com/?spell=57712, -12.7776, 13.0275, 0.2499, 1.9
Glyph of Revenge, https://wotlkdb.com/?spell=57165, -12.8174, 15.2873, 2.4699, 16.2
Glyph of Shadow Bolt, https://wotlkdb.com/?spell=57271, -13.2875, 15.2873, 1.9998, 13.1
Glyph of Divinity, https://wotlkdb.com/?spell=57031, -13.2926, 15.2125, 1.9199, 12.6
Fire Eater's Guide, https://wotlkdb.com/?spell=59489, -13.4993, 38.4993, 25, 64.9
Glyph of Health Funnel, https://wotlkdb.com/?spell=57265, -13.5129, 15.2125, 1.6996, 11.2
Glyph of Ice Lance, https://wotlkdb.com/?spell=56980, -13.95, 15.95, 2, 12.5
Glyph of Entangling Roots, https://wotlkdb.com/?spell=48121, -13.9518, 15.2015, 1.2497, 8.2
Glyph of Strangulate, https://wotlkdb.com/?spell=57225, -13.9703, 15.95, 1.9797, 12.4
Glyph of Garrote, https://wotlkdb.com/?spell=57123, -14.183, 15.2125, 1.0295, 6.8
Glyph of Sunder Armor, https://wotlkdb.com/?spell=57167, -14.2125, 15.2125, 1, 6.6
Glyph of Cleansing, https://wotlkdb.com/?spell=57020, -14.2674, 15.2873, 1.0199, 6.7
Glyph of Rebirth, https://wotlkdb.com/?spell=56953, -14.2874, 15.2873, 0.9999, 6.5
Glyph of Frost Shock, https://wotlkdb.com/?spell=57241, -14.2874, 15.2873, 0.9999, 6.5
Glyph of Voidwalker, https://wotlkdb.com/?spell=57277, -14.2973, 15.2873, 0.99, 6.5
Glyph of Multi-Shot, https://wotlkdb.com/?spell=57007, -14.3132, 15.2873, 0.9741, 6.4
Glyph of Lava Lash, https://wotlkdb.com/?spell=57249, -14.3274, 15.2873, 0.9599, 6.3
Scroll of Strength III, https://wotlkdb.com/?spell=58486, -14.4298, 15.2998, 0.87, 5.7
Glyph of Ice Block, https://wotlkdb.com/?spell=56979, -14.44, 17.3999, 2.9599, 17
Glyph of Sap, https://wotlkdb.com/?spell=57129, -14.4474, 15.2873, 0.8399, 5.5
Jadefire Ink, https://wotlkdb.com/?spell=57707, -14.7252, 30, 15.2748, 50.9
Scroll of Intellect III, https://wotlkdb.com/?spell=50599, -14.8098, 15.2998, 0.49, 3.2
Glyph of Searing Pain, https://wotlkdb.com/?spell=57270, -14.9, 17.3999, 2.4999, 14.4
Scroll of Agility III, https://wotlkdb.com/?spell=58476, -15.0098, 15.2998, 0.29, 1.9
Scroll of Stamina III, https://wotlkdb.com/?spell=50614, -15.1753, 15.2998, 0.1245, 0.8
Scroll of Spirit III, https://wotlkdb.com/?spell=50606, -15.1803, 15.2998, 0.1195, 0.8
Glyph of Slice and Dice, https://wotlkdb.com/?spell=57132, -15.4, 17.3999, 1.9999, 11.5
Scroll of Agility VIII, https://wotlkdb.com/?spell=58483, -15.46, 16.45, 0.99, 6
Scroll of Strength VIII, https://wotlkdb.com/?spell=58491, -15.46, 16.45, 0.99, 6
Scroll of Spirit VIII, https://wotlkdb.com/?spell=50611, -15.4601, 16.45, 0.9899, 6
Scroll of Intellect VIII, https://wotlkdb.com/?spell=50604, -15.47, 16.45, 0.98, 6
Scroll of Stamina VIII, https://wotlkdb.com/?spell=50620, -15.47, 16.45, 0.98, 6
Scroll of Intellect VII, https://wotlkdb.com/?spell=50603, -16.3476, 16.45, 0.1024, 0.6
Scroll of Strength VII, https://wotlkdb.com/?spell=58490, -16.3627, 16.45, 0.0873, 0.5
Scroll of Agility VII, https://wotlkdb.com/?spell=58482, -16.3845, 16.45, 0.0655, 0.4
Scroll of Stamina VII, https://wotlkdb.com/?spell=50619, -16.4098, 16.45, 0.0402, 0.2
Scroll of Spirit VII, https://wotlkdb.com/?spell=50610, -16.4246, 16.45, 0.0254, 0.2
Glyph of Crusader Strike, https://wotlkdb.com/?spell=57024, -16.4502, 17.3999, 0.9497, 5.5
Glyph of Barbaric Insults, https://wotlkdb.com/?spell=57151, -16.4602, 17.3999, 0.9397, 5.4
Glyph of Dispel Magic, https://wotlkdb.com/?spell=57183, -16.56, 17.3999, 0.8399, 4.8
Scroll of Intellect IV, https://wotlkdb.com/?spell=50600, -16.5749, 17.5249, 0.95, 5.4
Scroll of Strength IV, https://wotlkdb.com/?spell=58487, -16.6499, 17.5249, 0.875, 5
Scroll of Spirit IV, https://wotlkdb.com/?spell=50607, -16.8899, 17.5249, 0.635, 3.6
Glyph of Soulstone, https://wotlkdb.com/?spell=57274, -16.92, 17.3999, 0.4799, 2.8
Scroll of Recall II, https://wotlkdb.com/?spell=60336, -17.1763, 17.2874, 0.1111, 0.6
Scroll of Stamina IV, https://wotlkdb.com/?spell=50616, -17.4049, 17.5249, 0.12, 0.7
Scroll of Agility IV, https://wotlkdb.com/?spell=58478, -17.5117, 17.5249, 0.0132, 0.1
Glyph of Monsoon, https://wotlkdb.com/?spell=64258, -17.6034, 22.103, 4.4996, 20.4
Ethereal Ink, https://wotlkdb.com/?spell=57713, -19.25, 31.2, 11.95, 38.3
Glyph of Shadowburn, https://wotlkdb.com/?spell=57272, -19.3631, 22.103, 2.7399, 12.4
Weapon Vellum III, https://wotlkdb.com/?spell=59501, -19.45, 47.35, 27.9, 58.9
Glyph of Death Grip, https://wotlkdb.com/?spell=57213, -19.7032, 22.103, 2.3998, 10.9
Tome of Kings, https://wotlkdb.com/?spell=59484, -19.7616, 31.2616, 11.5, 36.8
Glyph of Bone Shield, https://wotlkdb.com/?spell=57210, -20.6132, 22.103, 1.4898, 6.7
Book of Survival, https://wotlkdb.com/?spell=59478, -20.97, 30.97, 10, 32.3
Glyph of Freezing Trap, https://wotlkdb.com/?spell=57002, -21.1031, 22.103, 0.9999, 4.5
Glyph of Fear Ward, https://wotlkdb.com/?spell=57185, -21.1331, 22.103, 0.9699, 4.4
Scroll of Stamina V, https://wotlkdb.com/?spell=50617, -21.263, 22.228, 0.965, 4.3
Book of Clever Tricks, https://wotlkdb.com/?spell=59496, -21.7094, 41.6594, 19.95, 47.9
Scroll of Intellect V, https://wotlkdb.com/?spell=50601, -21.728, 22.228, 0.5, 2.2
Scroll of Spirit VI, https://wotlkdb.com/?spell=50609, -21.738, 22.228, 0.49, 2.2
Scroll of Agility V, https://wotlkdb.com/?spell=58480, -21.738, 22.228, 0.49, 2.2
Scroll of Strength V, https://wotlkdb.com/?spell=58488, -21.738, 22.228, 0.49, 2.2
Scroll of Spirit V, https://wotlkdb.com/?spell=50608, -21.938, 22.228, 0.29, 1.3
Tome of the Dawn, https://wotlkdb.com/?spell=59475, -21.98, 30.97, 8.99, 29
Scroll of Stamina VI, https://wotlkdb.com/?spell=50618, -22.1995, 22.228, 0.0285, 0.1
Royal Guide of Escape Routes, https://wotlkdb.com/?spell=59486, -22.2616, 31.2616, 9, 28.8
Book of Stars, https://wotlkdb.com/?spell=59490, -37.4993, 38.4993, 1, 2.6
Stormbound Tome, https://wotlkdb.com/?spell=59493, -89.8962, 90.0362, 0.14, 0.2
Manual of Clouds, https://wotlkdb.com/?spell=59494, -91.0212, 91.1612, 0.14, 0.2
