Name, Link, Profit, Cost, Sell, ROI %
Fire Eater's Guide, https://wotlkdb.com/?spell=59489, 1386.55, 13.45, 1400, 10408.9
Rituals of the New Moon, https://wotlkdb.com/?spell=64051, 816.9999, 183, 999.9999, 546.4
Glyph of Eternal Water, https://wotlkdb.com/?spell=71101, 184.1569, 15.4495, 199.6064, 1292
Glyph of Curse of Exhaustion, https://wotlkdb.com/?spell=58338, 183.7664, 15.0125, 198.7789, 1324.1
Glyph of Corpse Explosion, https://wotlkdb.com/?spell=57229, 172.2534, 15.0745, 187.3279, 1242.7
Glyph of Trueshot Aura, https://wotlkdb.com/?spell=57012, 171.4378, 17.5, 188.9378, 1079.6
Glyph of Bestial Wrath, https://wotlkdb.com/?spell=56999, 170.4218, 17.5, 187.9218, 1073.8
Faces of Doom, https://wotlkdb.com/?spell=59498, 123, 176.75, 299.75, 169.6
Iron-bound Tome, https://wotlkdb.com/?spell=59497, 122, 176.75, 298.75, 169
Glyph of Souls, https://wotlkdb.com/?spell=58341, 110.7556, 17.5, 128.2556, 732.9
Glyph of Scare Beast, https://wotlkdb.com/?spell=58298, 108.2321, 9.8515, 118.0836, 1198.6
Glyph of Volley, https://wotlkdb.com/?spell=57013, 102.8795, 17.5, 120.3795, 687.9
Glyph of Distract, https://wotlkdb.com/?spell=58324, 94.8621, 5.0125, 99.8746, 1992.5
Glyph of Enduring Victory, https://wotlkdb.com/?spell=58347, 84.3052, 15.4495, 99.7547, 645.7
Book of Stars, https://wotlkdb.com/?spell=59490, 83.55, 13.45, 97, 721.2
Glyph of Cloak of Shadows, https://wotlkdb.com/?spell=64303, 83.0195, 15.4495, 98.469, 637.4
Glyph of Polymorph, https://wotlkdb.com/?spell=56987, 82.36, 17.5, 99.86, 570.6
Glyph of Fire Blast, https://wotlkdb.com/?spell=57719, 74.9795, 17.5, 92.4795, 528.5
Glyph of Soul Link, https://wotlkdb.com/?spell=64250, 73.7985, 5.0015, 78.8, 1575.5
Glyph of Enslave Demon, https://wotlkdb.com/?spell=58339, 55.1146, 15.0125, 70.1271, 467.1
Glyph of Water Mastery, https://wotlkdb.com/?spell=57251, 54.3647, 5.125, 59.4897, 1160.8
Glyph of Curse of Agony, https://wotlkdb.com/?spell=57260, 48.4896, 17.5, 65.9896, 377.1
Hellfire Tome, https://wotlkdb.com/?spell=59495, 47.5315, 72.4685, 120, 165.6
Glyph of Raptor Strike, https://wotlkdb.com/?spell=64246, 47.0871, 9.8515, 56.9386, 578
Glyph of Frost Armor, https://wotlkdb.com/?spell=58306, 40.1171, 9.8515, 49.9686, 507.2
Certificate of Ownership, https://wotlkdb.com/?spell=59387, 37.9874, 8.0125, 45.9999, 574.1
Glyph of Flametongue Weapon, https://wotlkdb.com/?spell=57240, 33.9772, 5.0125, 38.9897, 777.8
Glyph of Elemental Mastery, https://wotlkdb.com/?spell=57250, 32.6292, 17.5, 50.1292, 286.5
Glyph of Dark Command, https://wotlkdb.com/?spell=57212, 32.2249, 17.5, 49.7249, 284.1
Glyph of Frostbolt, https://wotlkdb.com/?spell=56977, 29.3041, 17.5, 46.8041, 267.5
Glyph of Mocking Blow, https://wotlkdb.com/?spell=58345, 28.3884, 5.0015, 33.3899, 667.6
Glyph of Holy Wrath, https://wotlkdb.com/?spell=59559, 26.21, 17.5, 43.71, 249.8
Glyph of Mana Tide Totem, https://wotlkdb.com/?spell=57247, 25.5791, 17.5, 43.0791, 246.2
Glyph of Ghostly Strike, https://wotlkdb.com/?spell=57124, 25.5349, 17.5, 43.0349, 245.9
Glyph of Water Elemental, https://wotlkdb.com/?spell=56989, 22.4796, 17.5, 39.9796, 228.5
Glyph of Shocking, https://wotlkdb.com/?spell=57235, 20.4897, 17.5, 37.9897, 217.1
Glyph of Vigilance, https://wotlkdb.com/?spell=64255, 19.9023, 4.0125, 23.9148, 596
Glyph of Cleaving, https://wotlkdb.com/?spell=57154, 19.7749, 4.125, 23.8999, 579.4
Glyph of Safe Fall, https://wotlkdb.com/?spell=58327, 19.7164, 4.0125, 23.7289, 591.4
Glyph of the Pack, https://wotlkdb.com/?spell=58297, 19.4071, 4.0125, 23.4196, 583.7
Glyph of Rip, https://wotlkdb.com/?spell=56956, 19.3962, 4.0125, 23.4087, 583.4
Glyph of Sinister Strike, https://wotlkdb.com/?spell=57131, 19.2439, 4.125, 23.3689, 566.5
Glyph of Explosive Shot, https://wotlkdb.com/?spell=64273, 19.1501, 15.4495, 34.5996, 224
Glyph of Frost Nova, https://wotlkdb.com/?spell=56976, 19.1281, 9.8515, 28.9796, 294.2
Glyph of Barkskin, https://wotlkdb.com/?spell=64256, 19.0083, 4.125, 23.1333, 560.8
Glyph of Unending Breath, https://wotlkdb.com/?spell=58336, 18.9777, 5.0015, 23.9792, 479.4
Glyph of Unburdened Rebirth, https://wotlkdb.com/?spell=58288, 18.9684, 5.0015, 23.9699, 479.3
Glyph of Water Shield, https://wotlkdb.com/?spell=58332, 18.967, 5.0015, 23.9685, 479.2
Glyph of Frost Ward, https://wotlkdb.com/?spell=58307, 18.9668, 5.0125, 23.9793, 478.4
Glyph of Sense Undead, https://wotlkdb.com/?spell=58315, 18.958, 5.0015, 23.9595, 479
Glyph of Blessing of Kings, https://wotlkdb.com/?spell=58311, 18.9478, 5.0015, 23.9493, 478.8
Glyph of Vanish, https://wotlkdb.com/?spell=58328, 18.947, 5.0125, 23.9595, 478
Glyph of Pick Lock, https://wotlkdb.com/?spell=58325, 18.9431, 5.0015, 23.9446, 478.7
Glyph of Rending, https://wotlkdb.com/?spell=57163, 18.9424, 5.0125, 23.9549, 477.9
Glyph of Fire Ward, https://wotlkdb.com/?spell=58305, 18.8985, 5.0015, 23.9, 477.9
Glyph of Aquatic Form, https://wotlkdb.com/?spell=58286, 18.8634, 5.0015, 23.8649, 477.2
Glyph of Disease, https://wotlkdb.com/?spell=64267, 18.8449, 5.125, 23.9699, 467.7
Glyph of Icy Touch, https://wotlkdb.com/?spell=57219, 18.7749, 5.125, 23.8999, 466.3
Glyph of Exorcism, https://wotlkdb.com/?spell=57025, 18.7549, 5.125, 23.8799, 465.9
Glyph of Earth Shield, https://wotlkdb.com/?spell=64261, 18.7432, 5.125, 23.8682, 465.7
Glyph of Ghost Wolf, https://wotlkdb.com/?spell=59326, 18.6979, 5.0015, 23.6994, 473.8
Glyph of Holy Shock, https://wotlkdb.com/?spell=64254, 18.6771, 4.0125, 22.6896, 565.5
Glyph of Kilrogg, https://wotlkdb.com/?spell=58340, 18.611, 5.0125, 23.6235, 471.3
Glyph of Totem of Wrath, https://wotlkdb.com/?spell=64262, 18.5447, 5.125, 23.6697, 461.8
Glyph of Shield Wall, https://wotlkdb.com/?spell=64252, 18.4968, 5.0125, 23.5093, 469
Glyph of Shackle Undead, https://wotlkdb.com/?spell=58320, 18.4884, 5.0015, 23.4899, 469.7
Glyph of Dark Death, https://wotlkdb.com/?spell=64266, 18.2747, 5.125, 23.3997, 456.6
Glyph of Ice Barrier, https://wotlkdb.com/?spell=64257, 18.1043, 4.125, 22.2293, 538.9
Glyph of Water Breathing, https://wotlkdb.com/?spell=58331, 18.0723, 5.0125, 23.0848, 460.5
Glyph of Starfire, https://wotlkdb.com/?spell=56959, 17.775, 4.125, 21.9, 530.9
Glyph of Moonfire, https://wotlkdb.com/?spell=56951, 17.6875, 5.0125, 22.7, 452.9
Glyph of Salvation, https://wotlkdb.com/?spell=64251, 17.6873, 5.0125, 22.6998, 452.9
Glyph of Inner Fire, https://wotlkdb.com/?spell=57188, 17.5874, 5.0125, 22.5999, 450.9
Glyph of Lifebloom, https://wotlkdb.com/?spell=56949, 17.2795, 17.5, 34.7795, 198.7
Glyph of Sprint, https://wotlkdb.com/?spell=57133, 17.1004, 5.125, 22.2254, 433.7
Glyph of Arcane Missiles, https://wotlkdb.com/?spell=56971, 16.9875, 5.0125, 22, 438.9
Glyph of Eviscerate, https://wotlkdb.com/?spell=57120, 16.9875, 5.0125, 22, 438.9
Glyph of Mutilate, https://wotlkdb.com/?spell=64260, 16.9632, 5.125, 22.0882, 431
Glyph of Fade, https://wotlkdb.com/?spell=57184, 16.8912, 5.0125, 21.9037, 437
Glyph of Consecration, https://wotlkdb.com/?spell=57023, 15.875, 4.125, 20, 484.8
Glyph of Pick Pocket, https://wotlkdb.com/?spell=58326, 15.2221, 9.8515, 25.0736, 254.5
Glyph of Spirit of Redemption, https://wotlkdb.com/?spell=57202, 15.05, 17.5, 32.55, 186
Glyph of Flash Heal, https://wotlkdb.com/?spell=57186, 14.9875, 5.0125, 20, 399
Glyph of Shred, https://wotlkdb.com/?spell=56957, 14.875, 5.125, 20, 390.2
Glyph of Frost Strike, https://wotlkdb.com/?spell=57216, 14.875, 5.125, 20, 390.2
Glyph of Pain Suppression, https://wotlkdb.com/?spell=64259, 14.8649, 5.125, 19.9899, 390
Glyph of Blink, https://wotlkdb.com/?spell=56973, 14.7875, 5.0125, 19.8, 395
Glyph of Lay on Hands, https://wotlkdb.com/?spell=58313, 14.1381, 9.8515, 23.9896, 243.5
Glyph of Blurred Speed, https://wotlkdb.com/?spell=58323, 14.1381, 9.8515, 23.9896, 243.5
Glyph of Charge, https://wotlkdb.com/?spell=58344, 14.1272, 9.8515, 23.9787, 243.4
Glyph of Arcane Intellect, https://wotlkdb.com/?spell=58303, 14.1184, 9.8515, 23.9699, 243.3
Glyph of Fortitude, https://wotlkdb.com/?spell=58318, 14.108, 9.8515, 23.9595, 243.2
Glyph of Bloodrage, https://wotlkdb.com/?spell=58343, 14.0984, 9.8515, 23.9499, 243.1
Glyph of Blessing of Wisdom, https://wotlkdb.com/?spell=58312, 14.093, 9.8515, 23.9445, 243.1
Glyph of Battle, https://wotlkdb.com/?spell=58342, 14.0884, 9.8515, 23.9399, 243
Glyph of Mend Pet, https://wotlkdb.com/?spell=58301, 14.0877, 9.8515, 23.9392, 243
Glyph of the Wild, https://wotlkdb.com/?spell=58296, 14.0484, 9.8515, 23.8999, 242.6
Glyph of Life Tap, https://wotlkdb.com/?spell=64248, 13.9926, 9.8515, 23.8441, 242
Glyph of Heart Strike, https://wotlkdb.com/?spell=57208, 13.932, 17.5, 31.432, 179.6
Glyph of Scorch, https://wotlkdb.com/?spell=56982, 13.875, 4.125, 18, 436.4
Glyph of Healing Stream Totem, https://wotlkdb.com/?spell=57242, 13.875, 4.125, 18, 436.4
Glyph of Mana Gem, https://wotlkdb.com/?spell=56985, 13.8648, 5.125, 18.9898, 370.5
Glyph of Execution, https://wotlkdb.com/?spell=57156, 13.775, 5.125, 18.9, 368.8
Glyph of Resonating Power, https://wotlkdb.com/?spell=57164, 13.6395, 17.5, 31.1395, 177.9
Glyph of Blessing of Might, https://wotlkdb.com/?spell=58314, 13.613, 9.8515, 23.4645, 238.2
Glyph of Thunder Clap, https://wotlkdb.com/?spell=58346, 13.4134, 9.8515, 23.2649, 236.2
Glyph of Slow Fall, https://wotlkdb.com/?spell=58308, 13.3685, 9.8515, 23.22, 235.7
Glyph of Thorns, https://wotlkdb.com/?spell=58289, 13.0881, 9.8515, 22.9396, 232.9
Glyph of Revive Pet, https://wotlkdb.com/?spell=58299, 12.9634, 9.8515, 22.8149, 231.6
Glyph of Drain Soul, https://wotlkdb.com/?spell=58337, 12.9603, 9.8515, 22.8118, 231.6
Glyph of Disengage, https://wotlkdb.com/?spell=57001, 12.8748, 4.125, 16.9998, 412.1
Glyph of Scatter Shot, https://wotlkdb.com/?spell=64249, 12.3984, 5.0015, 17.3999, 347.9
Glyph of Typhoon, https://wotlkdb.com/?spell=56965, 12.3661, 17.5, 29.8661, 170.7
Glyph of Stoneclaw Totem, https://wotlkdb.com/?spell=64247, 12.1279, 9.8515, 21.9794, 223.1
Glyph of Dispel Magic, https://wotlkdb.com/?spell=57183, 12, 4.125, 16.125, 390.9
Glyph of Judgement, https://wotlkdb.com/?spell=57030, 11.9875, 5.0125, 17, 339.2
Glyph of Rejuvenation, https://wotlkdb.com/?spell=56955, 11.9485, 9.8515, 21.8, 221.3
Glyph of Holy Light, https://wotlkdb.com/?spell=57029, 11.9375, 5.0125, 16.95, 338.2
Glyph of Chain Lightning, https://wotlkdb.com/?spell=57233, 11.5397, 17.5, 29.0397, 165.9
Warrior Glyph 21, https://wotlkdb.com/?spell=57173, 11.4223, 6.5774, 17.9997, 273.7
Warrior Glyph 22, https://wotlkdb.com/?spell=57174, 11.4223, 6.5774, 17.9997, 273.7
Warrior Glyph 23, https://wotlkdb.com/?spell=57175, 11.4223, 6.5774, 17.9997, 273.7
Warrior Glyph 25, https://wotlkdb.com/?spell=57176, 11.4223, 6.5774, 17.9997, 273.7
Warrior Glyph 24, https://wotlkdb.com/?spell=57180, 11.4223, 6.5774, 17.9997, 273.7
Death Knight Glyph 25, https://wotlkdb.com/?spell=57231, 11.4223, 6.5774, 17.9997, 273.7
Glyph of Lesser Healing Wave, https://wotlkdb.com/?spell=57244, 10.875, 4.125, 15, 363.6
Glyph of Health Funnel, https://wotlkdb.com/?spell=57265, 10.236, 5.0125, 15.2485, 304.2
Glyph of Hamstring, https://wotlkdb.com/?spell=57157, 10.1441, 5.0125, 15.1566, 302.4
Glyph of Fading, https://wotlkdb.com/?spell=58317, 10.1383, 9.8515, 19.9898, 202.9
Glyph of Flame Shock, https://wotlkdb.com/?spell=57239, 10.0985, 9.8515, 19.95, 202.5
Glyph of Riptide, https://wotlkdb.com/?spell=64289, 9.5301, 15.4495, 24.9796, 161.7
Glyph of Victory Rush, https://wotlkdb.com/?spell=57170, 9.5, 17.5, 27, 154.3
Glyph of Innervate, https://wotlkdb.com/?spell=56947, 9.2, 17.5, 26.7, 152.6
Glyph of Arcane Explosion, https://wotlkdb.com/?spell=56968, 9.1399, 5.0015, 14.1414, 282.7
Glyph of the Penguin, https://wotlkdb.com/?spell=58310, 9.1383, 9.8515, 18.9898, 192.8
Glyph of Serpent Sting, https://wotlkdb.com/?spell=57009, 9.0985, 9.8515, 18.95, 192.4
Jadefire Ink, https://wotlkdb.com/?spell=57707, 9, 6, 15, 250
Glyph of Renewed Life, https://wotlkdb.com/?spell=58330, 8.9274, 15.0125, 23.9399, 159.5
Glyph of Raise Dead, https://wotlkdb.com/?spell=57228, 8.8851, 15.0745, 23.9596, 158.9
Glyph of Pestilence, https://wotlkdb.com/?spell=57230, 8.8804, 15.0745, 23.9549, 158.9
Glyph of Dash, https://wotlkdb.com/?spell=59315, 8.877, 15.0125, 23.8895, 159.1
Glyph of Water Walking, https://wotlkdb.com/?spell=58333, 8.7664, 15.0125, 23.7789, 158.4
Glyph of Death's Embrace, https://wotlkdb.com/?spell=57215, 8.6749, 15.0745, 23.7494, 157.5
Glyph of Challenging Roar, https://wotlkdb.com/?spell=58287, 8.6519, 15.0125, 23.6644, 157.6
Glyph of Horn of Winter, https://wotlkdb.com/?spell=57217, 8.5404, 15.4495, 23.9899, 155.3
Glyph of Killing Spree, https://wotlkdb.com/?spell=64285, 8.5204, 15.4495, 23.9699, 155.2
Glyph of Shockwave, https://wotlkdb.com/?spell=64296, 8.4454, 15.4495, 23.8949, 154.7
Glyph of Guardian Spirit, https://wotlkdb.com/?spell=64281, 8.4352, 15.4495, 23.8847, 154.6
Glyph of Hungering Cold, https://wotlkdb.com/?spell=64298, 8.4062, 15.4495, 23.8557, 154.4
Glyph of Wild Growth, https://wotlkdb.com/?spell=64270, 8.3854, 15.4495, 23.8349, 154.3
Glyph of Hammer of the Righteous, https://wotlkdb.com/?spell=64278, 8.3254, 15.4495, 23.7749, 153.9
Glyph of Haunt, https://wotlkdb.com/?spell=64291, 8.2999, 15.4495, 23.7494, 153.7
Glyph of Divine Storm, https://wotlkdb.com/?spell=64279, 8.2493, 15.4495, 23.6988, 153.4
Glyph of Plague Strike, https://wotlkdb.com/?spell=57221, 8.2488, 15.0745, 23.3233, 154.7
Glyph of Shadow Dance, https://wotlkdb.com/?spell=64286, 8.2293, 15.4495, 23.6788, 153.3
Glyph of Shadow Protection, https://wotlkdb.com/?spell=58321, 8.183, 15.0125, 23.1955, 154.5
Glyph of Chaos Bolt, https://wotlkdb.com/?spell=64294, 8.1172, 15.4495, 23.5667, 152.5
Glyph of Explosive Trap, https://wotlkdb.com/?spell=64253, 8.0872, 15.0125, 23.0997, 153.9
Glyph of Feign Death, https://wotlkdb.com/?spell=58302, 7.9874, 15.0125, 22.9999, 153.2
Glyph of Levitate, https://wotlkdb.com/?spell=58319, 7.9128, 15.0125, 22.9253, 152.7
Glyph of Penance, https://wotlkdb.com/?spell=64282, 7.8949, 15.4495, 23.3444, 151.1
Glyph of Chimera Shot, https://wotlkdb.com/?spell=64271, 7.8783, 15.4495, 23.3278, 151
Glyph of Living Bomb, https://wotlkdb.com/?spell=64275, 7.8773, 15.4495, 23.3268, 151
Glyph of Thunder, https://wotlkdb.com/?spell=64287, 7.8217, 15.4495, 23.2712, 150.6
Glyph of Blood Tap, https://wotlkdb.com/?spell=57209, 7.7854, 15.4495, 23.2349, 150.4
Glyph of Dancing Rune Weapon, https://wotlkdb.com/?spell=64297, 7.7104, 15.4495, 23.1599, 149.9
Glyph of Shadowburn, https://wotlkdb.com/?spell=57272, 7.625, 5.125, 12.75, 248.8
Glyph of Beacon of Light, https://wotlkdb.com/?spell=64277, 7.5401, 15.4495, 22.9896, 148.8
Glyph of the Wise, https://wotlkdb.com/?spell=58316, 7.5297, 15.0125, 22.5422, 150.2
Glyph of Bladestorm, https://wotlkdb.com/?spell=64295, 7.4396, 15.4495, 22.8891, 148.2
Glyph of Dispersion, https://wotlkdb.com/?spell=64280, 7.3505, 15.4495, 22.8, 147.6
Glyph of Siphon Life, https://wotlkdb.com/?spell=57273, 7.2397, 17.5, 24.7397, 141.4
Glyph of Mirror Image, https://wotlkdb.com/?spell=64314, 7.139, 17.5, 24.639, 140.8
Glyph of Berserk, https://wotlkdb.com/?spell=64268, 6.9502, 15.4495, 22.3997, 145
Glyph of Smite, https://wotlkdb.com/?spell=57201, 6.875, 4.125, 11, 266.7
Weapon Vellum II, https://wotlkdb.com/?spell=59488, 6.86, 5.09, 11.95, 234.8
Glyph of Arcane Blast, https://wotlkdb.com/?spell=56991, 6.6002, 15.4495, 22.0497, 142.7
Glyph of Whirlwind, https://wotlkdb.com/?spell=57172, 6.5505, 15.4495, 22, 142.4
Glyph of the Ghoul, https://wotlkdb.com/?spell=57222, 6.5505, 15.4495, 22, 142.4
Glyph of Spell Reflection, https://wotlkdb.com/?spell=64302, 6.5505, 15.4495, 22, 142.4
Glyph of Starfall, https://wotlkdb.com/?spell=56958, 6.4999, 17.5, 23.9999, 137.1
Glyph of Seal of Vengeance, https://wotlkdb.com/?spell=59561, 6.4996, 17.5, 23.9996, 137.1
Glyph of Rupture, https://wotlkdb.com/?spell=57128, 6.4897, 17.5, 23.9897, 137.1
Glyph of Fan of Knives, https://wotlkdb.com/?spell=64315, 6.4897, 17.5, 23.9897, 137.1
Glyph of Last Stand, https://wotlkdb.com/?spell=57166, 6.479, 17.5, 23.979, 137
Glyph of Anti-Magic Shell, https://wotlkdb.com/?spell=57207, 6.47, 17.5, 23.97, 137
Glyph of Mortal Strike, https://wotlkdb.com/?spell=57160, 6.4699, 17.5, 23.9699, 137
Glyph of Command, https://wotlkdb.com/?spell=68166, 6.4699, 17.5, 23.9699, 137
Glyph of Fireball, https://wotlkdb.com/?spell=56975, 6.4598, 17.5, 23.9598, 136.9
Glyph of Prayer of Healing, https://wotlkdb.com/?spell=57195, 6.4592, 17.5, 23.9592, 136.9
Glyph of Chain Heal, https://wotlkdb.com/?spell=57232, 6.4584, 17.5, 23.9584, 136.9
Glyph of Rune Strike, https://wotlkdb.com/?spell=57223, 6.4478, 17.5, 23.9478, 136.8
Glyph of Steady Shot, https://wotlkdb.com/?spell=57011, 6.4186, 17.5, 23.9186, 136.7
Glyph of Tricks of the Trade, https://wotlkdb.com/?spell=64310, 6.3797, 17.5, 23.8797, 136.5
Glyph of Devastate, https://wotlkdb.com/?spell=57155, 6.3289, 17.5, 23.8289, 136.2
Glyph of Avenger's Shield, https://wotlkdb.com/?spell=57019, 6.2599, 17.5, 23.7599, 135.8
Glyph of Blocking, https://wotlkdb.com/?spell=57152, 6.2598, 17.5, 23.7598, 135.8
Glyph of Bloodthirst, https://wotlkdb.com/?spell=57153, 6.2598, 17.5, 23.7598, 135.8
Glyph of Seal of Wisdom, https://wotlkdb.com/?spell=57035, 6.2495, 17.5, 23.7495, 135.7
Glyph of Swiftmend, https://wotlkdb.com/?spell=56960, 6.2381, 17.5, 23.7381, 135.6
Glyph of Lava, https://wotlkdb.com/?spell=57234, 6.2193, 17.5, 23.7193, 135.5
Glyph of Astral Recall, https://wotlkdb.com/?spell=58329, 6.2075, 15.0125, 21.22, 141.3
Glyph of Mind Sear, https://wotlkdb.com/?spell=64309, 6.1899, 17.5, 23.6899, 135.4
Glyph of Hunter's Mark, https://wotlkdb.com/?spell=57004, 6.0985, 9.8515, 15.95, 161.9
Glyph of Power Word: Shield, https://wotlkdb.com/?spell=57194, 6.0985, 9.8515, 15.95, 161.9
Glyph of Adrenaline Rush, https://wotlkdb.com/?spell=57112, 6.089, 17.5, 23.589, 134.8
Glyph of Divine Plea, https://wotlkdb.com/?spell=64305, 6.0799, 17.5, 23.5799, 134.7
Glyph of Conflagrate, https://wotlkdb.com/?spell=57258, 6.0796, 17.5, 23.5796, 134.7
Glyph of Shadowfiend, https://wotlkdb.com/?spell=58322, 6.0779, 17.5, 23.5779, 134.7
Glyph of Shadow, https://wotlkdb.com/?spell=57193, 6.0214, 17.5, 23.5214, 134.4
Glyph of Death Strike, https://wotlkdb.com/?spell=59340, 6.0005, 15.4495, 21.45, 138.8
Glyph of Arcane Shot, https://wotlkdb.com/?spell=56995, 5.9985, 5.0015, 11, 219.9
Glyph of Crusader Strike, https://wotlkdb.com/?spell=57024, 5.875, 4.125, 10, 242.4
Midnight Ink, https://wotlkdb.com/?spell=53462, 5.85, 4, 9.85, 246.3
Glyph of Thunderstorm, https://wotlkdb.com/?spell=57253, 5.8159, 17.5, 23.3159, 133.2
Glyph of Immolate, https://wotlkdb.com/?spell=57268, 5.7496, 17.5, 23.2496, 132.9
Glyph of Obliterate, https://wotlkdb.com/?spell=57220, 5.7104, 17.5, 23.2104, 132.6
Glyph of Blast Wave, https://wotlkdb.com/?spell=56990, 5.4897, 17.5, 22.9897, 131.4
Glyph of Seal of Righteousness, https://wotlkdb.com/?spell=59560, 5.4895, 17.5, 22.9895, 131.4
Glyph of Enraged Regeneration, https://wotlkdb.com/?spell=64312, 5.4894, 17.5, 22.9894, 131.4
Glyph of Felguard, https://wotlkdb.com/?spell=57263, 5.4797, 17.5, 22.9797, 131.3
Glyph of Shadowflame, https://wotlkdb.com/?spell=64311, 5.4797, 17.5, 22.9797, 131.3
Glyph of Molten Armor, https://wotlkdb.com/?spell=56986, 5.4791, 17.5, 22.9791, 131.3
Glyph of Circle of Healing, https://wotlkdb.com/?spell=57181, 5.4249, 17.5, 22.9249, 131
Glyph of Quick Decay, https://wotlkdb.com/?spell=71102, 5.3985, 17.5, 22.8985, 130.8
Glyph of Savage Roar, https://wotlkdb.com/?spell=64307, 5.1898, 17.5, 22.6898, 129.7
Glyph of Hammer of Justice, https://wotlkdb.com/?spell=57027, 5.1485, 9.8515, 15, 152.3
Glyph of Possessed Strength, https://wotlkdb.com/?spell=58300, 5.1485, 9.8515, 15, 152.3
Glyph of Deep Freeze, https://wotlkdb.com/?spell=64274, 5.0199, 15.4495, 20.4694, 132.5
Glyph of Entangling Roots, https://wotlkdb.com/?spell=48121, 4.9984, 5.0015, 9.9999, 199.9
Glyph of Garrote, https://wotlkdb.com/?spell=57123, 4.9875, 5.0125, 10, 199.5
Glyph of Overpower, https://wotlkdb.com/?spell=57161, 4.9875, 15.0125, 20, 133.2
Glyph of Stormstrike, https://wotlkdb.com/?spell=57248, 4.9597, 17.5, 22.4597, 128.3
Glyph of Arcane Barrage, https://wotlkdb.com/?spell=64276, 4.8302, 15.4495, 20.2797, 131.3
Glyph of Preparation, https://wotlkdb.com/?spell=57127, 4.5982, 17.5, 22.0982, 126.3
Glyph of Howling Blast, https://wotlkdb.com/?spell=64300, 4.5505, 15.4495, 20, 129.5
Glyph of Holy Nova, https://wotlkdb.com/?spell=57187, 4.5403, 15.4495, 19.9898, 129.4
Glyph of Incinerate, https://wotlkdb.com/?spell=57257, 4.5005, 15.4495, 19.95, 129.1
Glyph of Growl, https://wotlkdb.com/?spell=56944, 4.5, 17.5, 22, 125.7
Glyph of Hemorrhage, https://wotlkdb.com/?spell=57126, 4.5, 17.5, 22, 125.7
Glyph of Windfury Weapon, https://wotlkdb.com/?spell=57252, 4.4504, 15.4495, 19.8999, 128.8
Glyph of Hunger for Blood, https://wotlkdb.com/?spell=64284, 4.4268, 15.4495, 19.8763, 128.7
Glyph of Survival Instincts, https://wotlkdb.com/?spell=65245, 4.4105, 17.0015, 21.412, 125.9
Glyph of Mass Dispel, https://wotlkdb.com/?spell=57190, 4.38, 17.5, 21.88, 125
Glyph of Nourish, https://wotlkdb.com/?spell=64313, 4.344, 17.5, 21.844, 124.8
Glyph of Death Grip, https://wotlkdb.com/?spell=57213, 4.325, 5.125, 9.45, 184.4
Glyph of Vigor, https://wotlkdb.com/?spell=57130, 4.192, 17.5, 21.692, 124
Glyph of Mending, https://wotlkdb.com/?spell=56997, 4.066, 5.0125, 9.0785, 181.1
Glyph of Sunder Armor, https://wotlkdb.com/?spell=57167, 3.9875, 5.0125, 9, 179.6
Glyph of Gouge, https://wotlkdb.com/?spell=57125, 3.9273, 15.0125, 18.9398, 126.2
Glyph of Ice Block, https://wotlkdb.com/?spell=56979, 3.8749, 4.125, 7.9999, 193.9
Glyph of Monsoon, https://wotlkdb.com/?spell=64258, 3.825, 5.125, 8.95, 174.6
Glyph of Death and Decay, https://wotlkdb.com/?spell=57214, 3.772, 17.5, 21.272, 121.6
Glyph of Kill Shot, https://wotlkdb.com/?spell=64304, 3.5, 17.5, 21, 120
Glyph of Shield of Righteousness, https://wotlkdb.com/?spell=64308, 3.5, 17.5, 21, 120
Glyph of Hammer of Wrath, https://wotlkdb.com/?spell=57028, 3.4999, 17.5, 20.9999, 120
Glyph of Frostfire, https://wotlkdb.com/?spell=61677, 3.4796, 17.5, 20.9796, 119.9
Glyph of Sweeping Strikes, https://wotlkdb.com/?spell=57168, 3.3505, 15.4495, 18.8, 121.7
Glyph of Aimed Shot, https://wotlkdb.com/?spell=56994, 2.9872, 15.0125, 17.9997, 119.9
Glyph of Healing Touch, https://wotlkdb.com/?spell=56945, 2.9774, 5.0125, 7.9899, 159.4
Glyph of Feral Spirit, https://wotlkdb.com/?spell=64288, 2.5403, 15.4495, 17.9898, 116.4
Glyph of Invisibility, https://wotlkdb.com/?spell=56983, 2.4999, 17.5, 19.9999, 114.3
Glyph of Remove Curse, https://wotlkdb.com/?spell=56988, 2.49, 17.5, 19.99, 114.2
Glyph of Regrowth, https://wotlkdb.com/?spell=56954, 2.4897, 17.5, 19.9897, 114.2
Glyph of Aspect of the Viper, https://wotlkdb.com/?spell=56998, 2.4897, 17.5, 19.9897, 114.2
Glyph of Mangle, https://wotlkdb.com/?spell=56950, 2.45, 17.5, 19.95, 114
Glyph of Lightwell, https://wotlkdb.com/?spell=57189, 2.3, 17.5, 19.8, 113.1
Glyph of Mind Flay, https://wotlkdb.com/?spell=57200, 1.9875, 15.0125, 17, 113.2
Glyph of Fire Nova, https://wotlkdb.com/?spell=57238, 1.9874, 5.0125, 6.9999, 139.6
Glyph of Chains of Ice, https://wotlkdb.com/?spell=57211, 1.95, 17.5, 19.45, 111.1
Ethereal Ink, https://wotlkdb.com/?spell=57713, 1.9495, 13, 14.9495, 115
Glyph of Earthliving Weapon, https://wotlkdb.com/?spell=57236, 1.9255, 15.0745, 17, 112.8
Glyph of Shadow Word: Death, https://wotlkdb.com/?spell=57199, 1.7596, 17.5, 19.2596, 110.1
Glyph of Rapid Rejuvenation, https://wotlkdb.com/?spell=71015, 1.7557, 17.5, 19.2557, 110
Moonglow Ink, https://wotlkdb.com/?spell=52843, 1.7404, 4, 5.7404, 143.5
Glyph of Howl of Terror, https://wotlkdb.com/?spell=57267, 1.1, 17.5, 18.6, 106.3
Glyph of Heroic Strike, https://wotlkdb.com/?spell=57158, 1.0985, 9.8515, 10.95, 111.2
Ink of the Sea, https://wotlkdb.com/?spell=57715, 1.0002, 15.9998, 17, 106.3
Glyph of Felhunter, https://wotlkdb.com/?spell=57264, 0.975, 17.5, 18.475, 105.6
Glyph of Wyvern Sting, https://wotlkdb.com/?spell=57014, 0.5, 17.5, 18, 102.9
Glyph of Seal of Light, https://wotlkdb.com/?spell=57034, 0.5, 17.5, 18, 102.9
Glyph of Turn Evil, https://wotlkdb.com/?spell=57036, 0.5, 17.5, 18, 102.9
Glyph of Scourge Imprisonment, https://wotlkdb.com/?spell=57198, 0.5, 17.5, 18, 102.9
Glyph of Healing Wave, https://wotlkdb.com/?spell=57243, 0.5, 17.5, 18, 102.9
Glyph of Icebound Fortitude, https://wotlkdb.com/?spell=57218, 0.378, 17.5, 17.878, 102.2
Glyph of Maul, https://wotlkdb.com/?spell=56961, 0.0985, 9.8515, 9.95, 101
Glyph of Icy Veins, https://wotlkdb.com/?spell=56981, 0.01, 15.0125, 15.0225, 100.1
Glyph of Lightning Bolt, https://wotlkdb.com/?spell=57245, -0.0125, 5.0125, 5, 99.8
Glyph of Righteous Defense, https://wotlkdb.com/?spell=57032, -0.0125, 15.0125, 15, 99.9
Glyph of Immolation Trap, https://wotlkdb.com/?spell=57005, -0.0126, 5.0125, 4.9999, 99.7
Dawnstar Ink, https://wotlkdb.com/?spell=57706, -0.055, 1, 0.945, 94.5
Glyph of Flash of Light, https://wotlkdb.com/?spell=57026, -0.0745, 15.0745, 15, 99.5
Scroll of Intellect, https://wotlkdb.com/?spell=48114, -0.1092, 1.0014, 0.8922, 89.1
Hunter's Ink, https://wotlkdb.com/?spell=57703, -0.2719, 0.9062, 0.6343, 70
Glyph of Rune Tap, https://wotlkdb.com/?spell=59338, -0.2745, 15.4495, 15.175, 98.2
Glyph of Frenzied Regeneration, https://wotlkdb.com/?spell=56943, -0.4495, 15.4495, 15, 97.1
Glyph of Metamorphosis, https://wotlkdb.com/?spell=64318, -0.4497, 15.4495, 14.9998, 97.1
Glyph of Death Coil, https://wotlkdb.com/?spell=57261, -0.5001, 17.5, 16.9999, 97.1
Glyph of Mage Armor, https://wotlkdb.com/?spell=56984, -0.5495, 15.4495, 14.9, 96.4
Ink of the Sky, https://wotlkdb.com/?spell=57712, -0.7124, 8, 7.2876, 91.1
Royal Ink, https://wotlkdb.com/?spell=57708, -0.8384, 1.47, 0.6316, 43
Scroll of Stamina, https://wotlkdb.com/?spell=45382, -0.9019, 1.0014, 0.0995, 9.9
Scroll of Spirit, https://wotlkdb.com/?spell=48116, -0.9019, 1.0014, 0.0995, 9.9
Ivory Ink, https://wotlkdb.com/?spell=52738, -1.0001, 2, 0.9999, 50
