Glyph of Unbreakable Armor, https://wotlkdb.com/?spell=57226, -0.85, 15.5, 14.65, 94.5
Scroll of Strength, https://wotlkdb.com/?spell=58484, -0.888, 1.0365, 0.1485, 14.3
Scroll of Agility, https://wotlkdb.com/?spell=58472, -0.937, 1.0365, 0.0995, 9.6
Glyph of Scatter Shot, https://wotlkdb.com/?spell=64249, -0.9514, 14.9514, 14, 93.6
Glyph of Scourge Imprisonment, https://wotlkdb.com/?spell=57198, -1, 16, 15, 93.8
Glyph of Rebirth, https://wotlkdb.com/?spell=56953, -1.125, 12.125, 11, 90.7
Glyph of Ice Armor, https://wotlkdb.com/?spell=56978, -1.5015, 9.5515, 8.05, 84.3
Armor Vellum III, https://wotlkdb.com/?spell=59500, -1.9001, 16.5, 14.5999, 88.5
Glyph of Blade Flurry, https://wotlkdb.com/?spell=57115, -2, 16, 14, 87.5
Glyph of Evocation, https://wotlkdb.com/?spell=56974, -2.125, 12.125, 10, 82.5
Glyph of Revenge, https://wotlkdb.com/?spell=57165, -2.125, 12.125, 10, 82.5
Fiery Ink, https://wotlkdb.com/?spell=57710, -2.2396, 3.2049, 0.9653, 30.1
Glyph of Shadowburn, https://wotlkdb.com/?spell=57272, -2.285, 15.125, 12.84, 84.9
Scroll of Recall II, https://wotlkdb.com/?spell=60336, -2.4277, 5.4077, 2.98, 55.1
Glyph of Hunter's Mark, https://wotlkdb.com/?spell=57004, -2.5765, 9.5515, 6.975, 73
Glyph of Wrath, https://wotlkdb.com/?spell=56963, -2.6515, 9.5515, 6.9, 72.2
Scroll of Recall, https://wotlkdb.com/?spell=48248, -2.7619, 5.7419, 2.98, 51.9
Glyph of Arcane Explosion, https://wotlkdb.com/?spell=56968, -2.9514, 14.9514, 12, 80.3
Glyph of Deterrence, https://wotlkdb.com/?spell=57000, -2.9703, 5.4077, 2.4374, 45.1
Glyph of Smite, https://wotlkdb.com/?spell=57201, -3.0203, 5.5202, 2.4999, 45.3
Glyph of Rake, https://wotlkdb.com/?spell=56952, -3.5, 15.5, 12, 77.4
Glyph of Searing Pain, https://wotlkdb.com/?spell=57270, -3.9303, 5.5202, 1.5899, 28.8
Scroll of Agility IV, https://wotlkdb.com/?spell=58478, -4.0552, 5.6452, 1.59, 28.2
Moonglow Ink, https://wotlkdb.com/?spell=52843, -4.2596, 10, 5.7404, 57.4
Scroll of Strength IV, https://wotlkdb.com/?spell=58487, -4.4652, 5.6452, 1.18, 20.9
Ivory Ink, https://wotlkdb.com/?spell=52738, -4.4825, 5, 0.5175, 10.4
Glyph of Barbaric Insults, https://wotlkdb.com/?spell=57151, -4.5452, 5.5202, 0.975, 17.7
Glyph of Succubus, https://wotlkdb.com/?spell=57275, -4.55, 15.5, 10.95, 70.6
Celestial Ink, https://wotlkdb.com/?spell=57709, -4.6046, 9.9998, 5.3952, 54
Glyph of Lightning Shield, https://wotlkdb.com/?spell=57246, -4.6915, 9.5515, 4.86, 50.9
Glyph of Corruption, https://wotlkdb.com/?spell=57259, -4.7115, 9.5515, 4.84, 50.7
Glyph of Claw, https://wotlkdb.com/?spell=67600, -4.7115, 9.5515, 4.84, 50.7
Armor Vellum, https://wotlkdb.com/?spell=52739, -4.8148, 5.7434, 0.9286, 16.2
Glyph of Arcane Shot, https://wotlkdb.com/?spell=56995, -4.9515, 14.9514, 9.9999, 66.9
Glyph of Healing Touch, https://wotlkdb.com/?spell=56945, -4.9624, 14.9624, 10, 66.8
Glyph of Ice Lance, https://wotlkdb.com/?spell=56980, -5.0001, 16, 10.9999, 68.7
Glyph of Intervene, https://wotlkdb.com/?spell=57159, -5.0501, 16, 10.9499, 68.4
Scroll of Stamina IV, https://wotlkdb.com/?spell=50616, -5.1352, 5.6452, 0.51, 9
Glyph of Soulstone, https://wotlkdb.com/?spell=57274, -5.4202, 5.5202, 0.1, 1.8
Scroll of Spirit IV, https://wotlkdb.com/?spell=50607, -5.4452, 5.6452, 0.2, 3.5
Glyph of Mage Armor, https://wotlkdb.com/?spell=56984, -5.5, 15.5, 10, 64.5
Scroll of Intellect IV, https://wotlkdb.com/?spell=50600, -5.5252, 5.6452, 0.12, 2.1
Glyph of Death Grip, https://wotlkdb.com/?spell=57213, -5.675, 15.125, 9.45, 62.5
Glyph of the Hawk, https://wotlkdb.com/?spell=57006, -6.0001, 16, 9.9999, 62.5
Scroll of Recall III, https://wotlkdb.com/?spell=60337, -6.1, 16, 9.9, 61.9
Glyph of Monsoon, https://wotlkdb.com/?spell=64258, -6.175, 15.125, 8.95, 59.2
Glyph of Crippling Poison, https://wotlkdb.com/?spell=57116, -6.25, 16, 9.75, 60.9
Glyph of Windfury Weapon, https://wotlkdb.com/?spell=57252, -6.45, 15.5, 9.05, 58.4
Glyph of Holy Nova, https://wotlkdb.com/?spell=57187, -6.5, 15.5, 9, 58.1
Glyph of Healthstone, https://wotlkdb.com/?spell=57266, -6.8823, 9.5515, 2.6692, 27.9
Glyph of Sunder Armor, https://wotlkdb.com/?spell=57167, -6.9624, 14.9624, 8, 53.5
Glyph of Multi-Shot, https://wotlkdb.com/?spell=57007, -7.145, 12.125, 4.98, 41.1
Glyph of Rapid Charge, https://wotlkdb.com/?spell=57162, -7.5515, 9.5515, 2, 20.9
Glyph of Psychic Scream, https://wotlkdb.com/?spell=57196, -7.5515, 9.5515, 2, 20.9
Glyph of Howl of Terror, https://wotlkdb.com/?spell=57267, -8, 16, 8, 50
Glyph of Focus, https://wotlkdb.com/?spell=62162, -8, 16, 8, 50
Glyph of Fire Elemental Totem, https://wotlkdb.com/?spell=57237, -8.0001, 16, 7.9999, 50
Snowfall Ink, https://wotlkdb.com/?spell=57716, -8.1298, 17.8198, 9.69, 54.4
Scroll of Agility III, https://wotlkdb.com/?spell=58476, -8.1975, 12.1375, 3.94, 32.5
Glyph of Frost Trap, https://wotlkdb.com/?spell=57003, -8.5, 15.5, 7, 45.2
Glyph of Evasion, https://wotlkdb.com/?spell=57119, -8.9515, 9.5515, 0.6, 6.3
Scroll of Stamina III, https://wotlkdb.com/?spell=50614, -9.1575, 12.1375, 2.98, 24.6
Scroll of Intellect II, https://wotlkdb.com/?spell=50598, -9.1615, 9.5515, 0.39, 4.1
Scroll of Strength II, https://wotlkdb.com/?spell=58485, -9.2215, 9.5515, 0.33, 3.5
Scroll of Stamina II, https://wotlkdb.com/?spell=50612, -9.3015, 9.5515, 0.25, 2.6
Scroll of Agility II, https://wotlkdb.com/?spell=58473, -9.3515, 9.5515, 0.2, 2.1
Scroll of Spirit II, https://wotlkdb.com/?spell=50605, -9.4035, 9.5515, 0.148, 1.5
Glyph of Scourge Strike, https://wotlkdb.com/?spell=57224, -9.65, 15.5, 5.85, 37.7
Glyph of Blood Strike, https://wotlkdb.com/?spell=59339, -9.7475, 15.5, 5.7525, 37.1
Glyph of Hymn of Hope, https://wotlkdb.com/?spell=64283, -9.9001, 15.5, 5.5999, 36.1
Glyph of Imp, https://wotlkdb.com/?spell=57269, -9.9399, 14.9624, 5.0225, 33.6
Glyph of Hurricane, https://wotlkdb.com/?spell=56946, -10, 16, 6, 37.5
Glyph of Garrote, https://wotlkdb.com/?spell=57123, -10.0024, 14.9624, 4.96, 33.1
Glyph of Sap, https://wotlkdb.com/?spell=57129, -10.125, 12.125, 2, 16.5
Glyph of Voidwalker, https://wotlkdb.com/?spell=57277, -10.125, 12.125, 2, 16.5
Scroll of Strength III, https://wotlkdb.com/?spell=58486, -10.1575, 12.1375, 1.98, 16.3
Glyph of Arcane Power, https://wotlkdb.com/?spell=56972, -10.5, 15.5, 5, 32.3
Glyph of Rapid Fire, https://wotlkdb.com/?spell=57008, -10.5, 15.5, 5, 32.3
Glyph of Cleansing, https://wotlkdb.com/?spell=57020, -11.125, 12.125, 1, 8.2
Glyph of Lava Lash, https://wotlkdb.com/?spell=57249, -11.125, 12.125, 1, 8.2
Glyph of Frost Shock, https://wotlkdb.com/?spell=57241, -11.135, 12.125, 0.99, 8.2
Scroll of Spirit III, https://wotlkdb.com/?spell=50606, -11.2375, 12.1375, 0.9, 7.4
Glyph of Ambush, https://wotlkdb.com/?spell=57113, -11.4901, 15.5, 4.0099, 25.9
Glyph of Feint, https://wotlkdb.com/?spell=57122, -11.4998, 15.125, 3.6252, 24
Glyph of Shadow Bolt, https://wotlkdb.com/?spell=57271, -11.625, 12.125, 0.5, 4.1
Scroll of Intellect III, https://wotlkdb.com/?spell=50599, -11.9575, 12.1375, 0.18, 1.5
Glyph of Fear Ward, https://wotlkdb.com/?spell=57185, -12.125, 15.125, 3, 19.8
Twilight Tome, https://wotlkdb.com/?spell=64053, -12.48, 112.48, 100, 88.9
Glyph of Immolation Trap, https://wotlkdb.com/?spell=57005, -12.9824, 14.9624, 1.98, 13.2
Glyph of Divinity, https://wotlkdb.com/?spell=57031, -13.9624, 14.9624, 1, 6.7
Glyph of Bone Shield, https://wotlkdb.com/?spell=57210, -14.125, 15.125, 1, 6.6
Glyph of Freezing Trap, https://wotlkdb.com/?spell=57002, -14.145, 15.125, 0.98, 6.5
Scroll of Spirit V, https://wotlkdb.com/?spell=50608, -14.27, 15.25, 0.98, 6.4
Scroll of Agility VI, https://wotlkdb.com/?spell=58481, -14.6, 15.25, 0.65, 4.3
Scroll of Stamina VI, https://wotlkdb.com/?spell=50618, -14.61, 15.25, 0.64, 4.2
Scroll of Stamina V, https://wotlkdb.com/?spell=50617, -14.7, 15.25, 0.55, 3.6
Scroll of Strength VI, https://wotlkdb.com/?spell=58489, -15.03, 15.25, 0.22, 1.4
Scroll of Intellect VI, https://wotlkdb.com/?spell=50602, -15.2, 15.25, 0.05, 0.3
Scroll of Agility V, https://wotlkdb.com/?spell=58480, -15.2, 15.25, 0.05, 0.3
Scroll of Intellect V, https://wotlkdb.com/?spell=50601, -15.2001, 15.25, 0.0499, 0.3
Scroll of Spirit VI, https://wotlkdb.com/?spell=50609, -15.2137, 15.25, 0.0363, 0.2
Scroll of Strength V, https://wotlkdb.com/?spell=58488, -15.225, 15.25, 0.025, 0.2
Scroll of Agility VIII, https://wotlkdb.com/?spell=58483, -15.25, 16.5, 1.25, 7.6
Scroll of Intellect VIII, https://wotlkdb.com/?spell=50604, -15.43, 16.5, 1.07, 6.5
Scroll of Stamina VIII, https://wotlkdb.com/?spell=50620, -15.5, 16.5, 1, 6.1
Glyph of Strangulate, https://wotlkdb.com/?spell=57225, -15.6, 16, 0.4, 2.5
Tome of Kings, https://wotlkdb.com/?spell=59484, -15.85, 28.85, 13, 45.1
Mystic Tome, https://wotlkdb.com/?spell=58565, -16.115, 26.115, 10, 38.3
Scroll of Strength VIII, https://wotlkdb.com/?spell=58491, -16.32, 16.5, 0.18, 1.1
Scroll of Spirit VIII, https://wotlkdb.com/?spell=50611, -16.375, 16.5, 0.125, 0.8
Scroll of Strength VII, https://wotlkdb.com/?spell=58490, -16.4105, 16.5, 0.0895, 0.5
Scroll of Stamina VII, https://wotlkdb.com/?spell=50619, -16.4612, 16.5, 0.0388, 0.2
Scroll of Agility VII, https://wotlkdb.com/?spell=58482, -16.4664, 16.5, 0.0336, 0.2
Scroll of Spirit VII, https://wotlkdb.com/?spell=50610, -16.4703, 16.5, 0.0297, 0.2
Scroll of Intellect VII, https://wotlkdb.com/?spell=50603, -16.473, 16.5, 0.027, 0.2
Weapon Vellum III, https://wotlkdb.com/?spell=59501, -17.5, 47.5, 30, 63.2
Weapon Vellum, https://wotlkdb.com/?spell=52840, -18.653, 28.653, 10, 34.9
Royal Guide of Escape Routes, https://wotlkdb.com/?spell=59486, -18.85, 28.85, 10, 34.7
Tome of the Dawn, https://wotlkdb.com/?spell=59475, -20.2248, 33.7748, 13.55, 40.1
Book of Clever Tricks, https://wotlkdb.com/?spell=59496, -30.3, 80.3, 50, 62.3
Book of Survival, https://wotlkdb.com/?spell=59478, -33.1748, 33.7748, 0.6, 1.8
Stormbound Tome, https://wotlkdb.com/?spell=59493, -33.725, 108.725, 75, 69
Manual of Clouds, https://wotlkdb.com/?spell=59494, -89.85, 109.85, 20, 18.2
