Name, Link, Profit, Cost, Sell, ROI %
Fire Eater's Guide, https://wotlkdb.com/?spell=59489, 1384.3752, 15.6248, 1400, 8960.1
Rituals of the New Moon, https://wotlkdb.com/?spell=64051, 816.9999, 183, 999.9999, 546.4
Glyph of Curse of Exhaustion, https://wotlkdb.com/?spell=58338, 186.6542, 12.125, 198.7792, 1639.4
Glyph of Eternal Water, https://wotlkdb.com/?spell=71101, 181.1974, 18.45, 199.6474, 1082.1
Glyph of Bestial Wrath, https://wotlkdb.com/?spell=56999, 172.361, 17.5, 189.861, 1084.9
Glyph of Trueshot Aura, https://wotlkdb.com/?spell=57012, 171.4687, 17.5, 188.9687, 1079.8
Glyph of Corpse Explosion, https://wotlkdb.com/?spell=57229, 169.2937, 18.075, 187.3687, 1036.6
Glyph of Cloak of Shadows, https://wotlkdb.com/?spell=64303, 134.6749, 18.45, 153.1249, 829.9
Faces of Doom, https://wotlkdb.com/?spell=59498, 123, 176.75, 299.75, 169.6
Iron-bound Tome, https://wotlkdb.com/?spell=59497, 122.75, 176.75, 299.5, 169.4
Glyph of Scare Beast, https://wotlkdb.com/?spell=58298, 108.1434, 9.9815, 118.1249, 1183.4
Glyph of Volley, https://wotlkdb.com/?spell=57013, 102.8999, 17.5, 120.3999, 688
Glyph of Polymorph, https://wotlkdb.com/?spell=56987, 101.2493, 17.5, 118.7493, 678.6
Glyph of Distract, https://wotlkdb.com/?spell=58324, 89.9121, 9.9625, 99.8746, 1002.5
Book of Stars, https://wotlkdb.com/?spell=59490, 81.3752, 15.6248, 97, 620.8
Glyph of Fire Blast, https://wotlkdb.com/?spell=57719, 74.9999, 17.5, 92.4999, 528.6
Glyph of Soul Link, https://wotlkdb.com/?spell=64250, 68.8485, 9.9515, 78.8, 791.8
Glyph of Enslave Demon, https://wotlkdb.com/?spell=58339, 58.0021, 12.125, 70.1271, 578.4
Glyph of Curse of Agony, https://wotlkdb.com/?spell=57260, 49.6999, 17.5, 67.1999, 384
Glyph of Raptor Strike, https://wotlkdb.com/?spell=64246, 46.9774, 9.9815, 56.9589, 570.6
Glyph of Water Mastery, https://wotlkdb.com/?spell=57251, 44.3647, 15.125, 59.4897, 393.3
Glyph of Frost Armor, https://wotlkdb.com/?spell=58306, 40.018, 9.9815, 49.9995, 500.9
Certificate of Ownership, https://wotlkdb.com/?spell=59387, 39.2377, 10.1873, 49.425, 485.2
Hellfire Tome, https://wotlkdb.com/?spell=59495, 38.53, 81.47, 120, 147.3
Glyph of Elemental Mastery, https://wotlkdb.com/?spell=57250, 32.7741, 17.5, 50.2741, 287.3
Glyph of Souls, https://wotlkdb.com/?spell=58341, 32.3714, 17.5, 49.8714, 285
Glyph of Dark Command, https://wotlkdb.com/?spell=57212, 32.2584, 17.5, 49.7584, 284.3
Glyph of Enduring Victory, https://wotlkdb.com/?spell=58347, 31.5395, 18.45, 49.9895, 270.9
Glyph of Frostbolt, https://wotlkdb.com/?spell=56977, 29.3245, 17.5, 46.8245, 267.6
Glyph of Flametongue Weapon, https://wotlkdb.com/?spell=57240, 29.0375, 9.9625, 39, 391.5
Glyph of Holy Wrath, https://wotlkdb.com/?spell=59559, 26.2488, 17.5, 43.7488, 250
Glyph of Mana Tide Totem, https://wotlkdb.com/?spell=57247, 25.5995, 17.5, 43.0995, 246.3
Glyph of Ghostly Strike, https://wotlkdb.com/?spell=57124, 25.5654, 17.5, 43.0654, 246.1
Glyph of Mocking Blow, https://wotlkdb.com/?spell=58345, 23.4384, 9.9515, 33.3899, 335.5
Glyph of Water Elemental, https://wotlkdb.com/?spell=56989, 22.5, 17.5, 40, 228.6
Glyph of Remove Curse, https://wotlkdb.com/?spell=56988, 22.3596, 17.5, 39.8596, 227.8
Glyph of Frost Nova, https://wotlkdb.com/?spell=56976, 21.9878, 9.9815, 31.9693, 320.3
Glyph of Shocking, https://wotlkdb.com/?spell=57235, 21.8244, 17.5, 39.3244, 224.7
Glyph of Vigilance, https://wotlkdb.com/?spell=64255, 18.8149, 5.0999, 23.9148, 468.9
Glyph of Safe Fall, https://wotlkdb.com/?spell=58327, 18.3421, 5.0999, 23.442, 459.7
Glyph of the Pack, https://wotlkdb.com/?spell=58297, 18.3401, 5.0999, 23.44, 459.6
Glyph of Rip, https://wotlkdb.com/?spell=56956, 18.3088, 5.0999, 23.4087, 459
Glyph of Barkskin, https://wotlkdb.com/?spell=64256, 17.9209, 5.2124, 23.1333, 443.8
Glyph of Sinister Strike, https://wotlkdb.com/?spell=57131, 17.6559, 5.2124, 22.8683, 438.7
Glyph of Cleaving, https://wotlkdb.com/?spell=57154, 17.6476, 5.2124, 22.86, 438.6
Glyph of Holy Shock, https://wotlkdb.com/?spell=64254, 17.5897, 5.0999, 22.6896, 444.9
Glyph of Lifebloom, https://wotlkdb.com/?spell=56949, 17.2796, 17.5, 34.7796, 198.7
Glyph of Ice Barrier, https://wotlkdb.com/?spell=64257, 17.0169, 5.2124, 22.2293, 426.5
Glyph of Starfire, https://wotlkdb.com/?spell=56959, 16.6876, 5.2124, 21.9, 420.2
Glyph of Explosive Shot, https://wotlkdb.com/?spell=64273, 16.1496, 18.45, 34.5996, 187.5
Glyph of Inner Fire, https://wotlkdb.com/?spell=57188, 15.7375, 9.9625, 25.7, 258
Glyph of Spirit of Redemption, https://wotlkdb.com/?spell=57202, 15.4795, 17.5, 32.9795, 188.5
Glyph of Pick Pocket, https://wotlkdb.com/?spell=58326, 15.0921, 9.9815, 25.0736, 251.2
Glyph of Consecration, https://wotlkdb.com/?spell=57023, 14.7876, 5.2124, 20, 383.7
Glyph of Unending Breath, https://wotlkdb.com/?spell=58336, 14.0277, 9.9515, 23.9792, 241
Glyph of Water Shield, https://wotlkdb.com/?spell=58332, 14.017, 9.9515, 23.9685, 240.9
Glyph of Lay on Hands, https://wotlkdb.com/?spell=58313, 13.9977, 9.9815, 23.9792, 240.2
Glyph of Pick Lock, https://wotlkdb.com/?spell=58325, 13.9931, 9.9515, 23.9446, 240.6
Glyph of Rending, https://wotlkdb.com/?spell=57163, 13.9924, 9.9625, 23.9549, 240.5
Glyph of Charge, https://wotlkdb.com/?spell=58344, 13.9874, 9.9815, 23.9689, 240.1
Glyph of Bloodrage, https://wotlkdb.com/?spell=58343, 13.9684, 9.9815, 23.9499, 239.9
Glyph of Frost Ward, https://wotlkdb.com/?spell=58307, 13.9661, 9.9625, 23.9286, 240.2
Glyph of Fire Ward, https://wotlkdb.com/?spell=58305, 13.9485, 9.9515, 23.9, 240.2
Glyph of Unburdened Rebirth, https://wotlkdb.com/?spell=58288, 13.9484, 9.9515, 23.8999, 240.2
Glyph of Blurred Speed, https://wotlkdb.com/?spell=58323, 13.9425, 9.9815, 23.924, 239.7
Glyph of Heart Strike, https://wotlkdb.com/?spell=57208, 13.932, 17.5, 31.432, 179.6
Glyph of Arcane Intellect, https://wotlkdb.com/?spell=58303, 13.8652, 9.9815, 23.8467, 238.9
Glyph of Life Tap, https://wotlkdb.com/?spell=64248, 13.8385, 9.9815, 23.82, 238.6
Glyph of Ghost Wolf, https://wotlkdb.com/?spell=59326, 13.7479, 9.9515, 23.6994, 238.1
Glyph of Kilrogg, https://wotlkdb.com/?spell=58340, 13.661, 9.9625, 23.6235, 237.1
Glyph of Resonating Power, https://wotlkdb.com/?spell=57164, 13.6395, 17.5, 31.1395, 177.9
Glyph of Shield Wall, https://wotlkdb.com/?spell=64252, 13.5468, 9.9625, 23.5093, 236
Glyph of Shackle Undead, https://wotlkdb.com/?spell=58320, 13.5384, 9.9515, 23.4899, 236
Glyph of Vanish, https://wotlkdb.com/?spell=58328, 13.4975, 9.9625, 23.46, 235.5
Glyph of Blessing of Might, https://wotlkdb.com/?spell=58314, 13.483, 9.9815, 23.4645, 235.1
Glyph of Battle, https://wotlkdb.com/?spell=58342, 13.2919, 9.9815, 23.2734, 233.2
Glyph of Thunder Clap, https://wotlkdb.com/?spell=58346, 13.2834, 9.9815, 23.2649, 233.1
Glyph of the Wild, https://wotlkdb.com/?spell=58296, 13.222, 9.9815, 23.2035, 232.5
Glyph of Water Breathing, https://wotlkdb.com/?spell=58331, 13.1223, 9.9625, 23.0848, 231.7
Glyph of Thorns, https://wotlkdb.com/?spell=58289, 12.9581, 9.9815, 22.9396, 229.8
Glyph of Slow Fall, https://wotlkdb.com/?spell=58308, 12.9579, 9.9815, 22.9394, 229.8
Glyph of Fortitude, https://wotlkdb.com/?spell=58318, 12.9521, 9.9815, 22.9336, 229.8
Glyph of Blessing of Kings, https://wotlkdb.com/?spell=58311, 12.8628, 9.9515, 22.8143, 229.3
Glyph of Aquatic Form, https://wotlkdb.com/?spell=58286, 12.8579, 9.9515, 22.8094, 229.2
Glyph of Mend Pet, https://wotlkdb.com/?spell=58301, 12.845, 9.9815, 22.8265, 228.7
Glyph of Sense Undead, https://wotlkdb.com/?spell=58315, 12.8422, 9.9515, 22.7937, 229
Glyph of Revive Pet, https://wotlkdb.com/?spell=58299, 12.8334, 9.9815, 22.8149, 228.6
Glyph of Blessing of Wisdom, https://wotlkdb.com/?spell=58312, 12.8334, 9.9815, 22.8149, 228.6
Glyph of Drain Soul, https://wotlkdb.com/?spell=58337, 12.8303, 9.9815, 22.8118, 228.5
Glyph of Healing Stream Totem, https://wotlkdb.com/?spell=57242, 12.7876, 5.2124, 18, 345.3
Glyph of Salvation, https://wotlkdb.com/?spell=64251, 12.6874, 9.9625, 22.6499, 227.4
Glyph of Typhoon, https://wotlkdb.com/?spell=56965, 12.3661, 17.5, 29.8661, 170.7
Glyph of Scorch, https://wotlkdb.com/?spell=56982, 12.2275, 5.2124, 17.4399, 334.6
Glyph of Arcane Missiles, https://wotlkdb.com/?spell=56971, 12.0375, 9.9625, 22, 220.8
Glyph of Eviscerate, https://wotlkdb.com/?spell=57120, 12.0375, 9.9625, 22, 220.8
Glyph of Moonfire, https://wotlkdb.com/?spell=56951, 12.0274, 9.9625, 21.9899, 220.7
Glyph of Stoneclaw Totem, https://wotlkdb.com/?spell=64247, 11.9979, 9.9815, 21.9794, 220.2
Glyph of Fade, https://wotlkdb.com/?spell=57184, 11.9412, 9.9625, 21.9037, 219.9
Glyph of Rejuvenation, https://wotlkdb.com/?spell=56955, 11.8185, 9.9815, 21.8, 218.4
Glyph of Renewed Life, https://wotlkdb.com/?spell=58330, 11.8047, 12.125, 23.9297, 197.4
Glyph of Disengage, https://wotlkdb.com/?spell=57001, 11.7874, 5.2124, 16.9998, 326.1
Glyph of Water Walking, https://wotlkdb.com/?spell=58333, 11.6539, 12.125, 23.7789, 196.1
Glyph of Chain Lightning, https://wotlkdb.com/?spell=57233, 11.6397, 17.5, 29.1397, 166.5
Glyph of Challenging Roar, https://wotlkdb.com/?spell=58287, 11.5394, 12.125, 23.6644, 195.2
Warrior Glyph 21, https://wotlkdb.com/?spell=57173, 11.4208, 6.5789, 17.9997, 273.6
Warrior Glyph 22, https://wotlkdb.com/?spell=57174, 11.4208, 6.5789, 17.9997, 273.6
Warrior Glyph 23, https://wotlkdb.com/?spell=57175, 11.4208, 6.5789, 17.9997, 273.6
Warrior Glyph 25, https://wotlkdb.com/?spell=57176, 11.4208, 6.5789, 17.9997, 273.6
Warrior Glyph 24, https://wotlkdb.com/?spell=57180, 11.4208, 6.5789, 17.9997, 273.6
Death Knight Glyph 25, https://wotlkdb.com/?spell=57231, 11.4208, 6.5789, 17.9997, 273.6
Glyph of Dash, https://wotlkdb.com/?spell=59315, 11.2327, 12.125, 23.3577, 192.6
Glyph of Shadow Protection, https://wotlkdb.com/?spell=58321, 11.0705, 12.125, 23.1955, 191.3
Glyph of Explosive Trap, https://wotlkdb.com/?spell=64253, 10.9747, 12.125, 23.0997, 190.5
Glyph of Dispel Magic, https://wotlkdb.com/?spell=57183, 10.9126, 5.2124, 16.125, 309.4
Glyph of Feign Death, https://wotlkdb.com/?spell=58302, 10.8749, 12.125, 22.9999, 189.7
Glyph of Levitate, https://wotlkdb.com/?spell=58319, 10.8003, 12.125, 22.9253, 189.1
Glyph of Evocation, https://wotlkdb.com/?spell=56974, 10.6635, 12.125, 22.7885, 187.9
Glyph of the Wise, https://wotlkdb.com/?spell=58316, 10.4172, 12.125, 22.5422, 185.9
Glyph of Flash Heal, https://wotlkdb.com/?spell=57186, 10.0375, 9.9625, 20, 200.8
Glyph of Fading, https://wotlkdb.com/?spell=58317, 10.0083, 9.9815, 19.9898, 200.3
Glyph of Flame Shock, https://wotlkdb.com/?spell=57239, 9.9685, 9.9815, 19.95, 199.9
Glyph of Blink, https://wotlkdb.com/?spell=56973, 9.8375, 9.9625, 19.8, 198.7
Glyph of Lesser Healing Wave, https://wotlkdb.com/?spell=57244, 9.7876, 5.2124, 15, 287.8
Glyph of Victory Rush, https://wotlkdb.com/?spell=57170, 9.5, 17.5, 27, 154.3
Glyph of Innervate, https://wotlkdb.com/?spell=56947, 9.2, 17.5, 26.7, 152.6
Glyph of Astral Recall, https://wotlkdb.com/?spell=58329, 9.095, 12.125, 21.22, 175
Glyph of the Penguin, https://wotlkdb.com/?spell=58310, 9.0083, 9.9815, 18.9898, 190.2
Glyph of Serpent Sting, https://wotlkdb.com/?spell=57009, 8.9685, 9.9815, 18.95, 189.9
Glyph of Icy Touch, https://wotlkdb.com/?spell=57219, 8.7749, 15.125, 23.8999, 158
Glyph of Exorcism, https://wotlkdb.com/?spell=57025, 8.7549, 15.125, 23.8799, 157.9
Glyph of Earth Shield, https://wotlkdb.com/?spell=64261, 8.733, 15.125, 23.858, 157.7
Glyph of Dark Death, https://wotlkdb.com/?spell=64266, 8.2747, 15.125, 23.3997, 154.7
Glyph of Overpower, https://wotlkdb.com/?spell=57161, 7.875, 12.125, 20, 164.9
Glyph of Mind Flay, https://wotlkdb.com/?spell=57200, 7.8749, 12.125, 19.9999, 164.9
Glyph of Disease, https://wotlkdb.com/?spell=64267, 7.8746, 15.125, 22.9996, 152.1
Glyph of Totem of Wrath, https://wotlkdb.com/?spell=64262, 7.6093, 15.125, 22.7343, 150.3
Glyph of Scatter Shot, https://wotlkdb.com/?spell=64249, 7.4484, 9.9515, 17.3999, 174.8
Glyph of Siphon Life, https://wotlkdb.com/?spell=57273, 7.2397, 17.5, 24.7397, 141.4
Glyph of Mirror Image, https://wotlkdb.com/?spell=64314, 7.1391, 17.5, 24.6391, 140.8
Glyph of Sprint, https://wotlkdb.com/?spell=57133, 7.1004, 15.125, 22.2254, 146.9
Shimmering Ink, https://wotlkdb.com/?spell=57711, 7.0734, 7.9266, 15, 189.2
Glyph of Judgement, https://wotlkdb.com/?spell=57030, 7.0375, 9.9625, 17, 170.6
Glyph of Holy Light, https://wotlkdb.com/?spell=57029, 6.9875, 9.9625, 16.95, 170.1
Glyph of Mutilate, https://wotlkdb.com/?spell=64260, 6.9735, 15.125, 22.0985, 146.1
Glyph of Gouge, https://wotlkdb.com/?spell=57125, 6.8148, 12.125, 18.9398, 156.2
Glyph of Riptide, https://wotlkdb.com/?spell=64289, 6.5296, 18.45, 24.9796, 135.4
Glyph of Starfall, https://wotlkdb.com/?spell=56958, 6.4998, 17.5, 23.9998, 137.1
Glyph of Rupture, https://wotlkdb.com/?spell=57128, 6.4897, 17.5, 23.9897, 137.1
Glyph of Last Stand, https://wotlkdb.com/?spell=57166, 6.479, 17.5, 23.979, 137
Glyph of Fan of Knives, https://wotlkdb.com/?spell=64315, 6.47, 17.5, 23.97, 137
Glyph of Mortal Strike, https://wotlkdb.com/?spell=57160, 6.4699, 17.5, 23.9699, 137
Glyph of Anti-Magic Shell, https://wotlkdb.com/?spell=57207, 6.4693, 17.5, 23.9693, 137
Glyph of Seal of Vengeance, https://wotlkdb.com/?spell=59561, 6.4597, 17.5, 23.9597, 136.9
Glyph of Chain Heal, https://wotlkdb.com/?spell=57232, 6.4584, 17.5, 23.9584, 136.9
Glyph of Tricks of the Trade, https://wotlkdb.com/?spell=64310, 6.3797, 17.5, 23.8797, 136.5
Glyph of Prayer of Healing, https://wotlkdb.com/?spell=57195, 6.3525, 17.5, 23.8525, 136.3
Glyph of Devastate, https://wotlkdb.com/?spell=57155, 6.3289, 17.5, 23.8289, 136.2
Glyph of Avenger's Shield, https://wotlkdb.com/?spell=57019, 6.2599, 17.5, 23.7599, 135.8
Glyph of Blocking, https://wotlkdb.com/?spell=57152, 6.2598, 17.5, 23.7598, 135.8
Glyph of Bloodthirst, https://wotlkdb.com/?spell=57153, 6.2598, 17.5, 23.7598, 135.8
Glyph of Command, https://wotlkdb.com/?spell=68166, 6.2497, 17.5, 23.7497, 135.7
Glyph of Swiftmend, https://wotlkdb.com/?spell=56960, 6.2381, 17.5, 23.7381, 135.6
Glyph of Lava, https://wotlkdb.com/?spell=57234, 6.2193, 17.5, 23.7193, 135.5
Glyph of Mind Sear, https://wotlkdb.com/?spell=64309, 6.1899, 17.5, 23.6899, 135.4
Jadefire Ink, https://wotlkdb.com/?spell=57707, 6.1125, 6, 12.1125, 201.9
Glyph of Adrenaline Rush, https://wotlkdb.com/?spell=57112, 6.089, 17.5, 23.589, 134.8
Glyph of Conflagrate, https://wotlkdb.com/?spell=57258, 6.0796, 17.5, 23.5796, 134.7
Glyph of Shadowfiend, https://wotlkdb.com/?spell=58322, 6.0779, 17.5, 23.5779, 134.7
Glyph of Health Funnel, https://wotlkdb.com/?spell=57265, 6.0375, 9.9625, 16, 160.6
Glyph of Shadow, https://wotlkdb.com/?spell=57193, 6.0214, 17.5, 23.5214, 134.4
Midnight Ink, https://wotlkdb.com/?spell=53462, 5.98, 4, 9.98, 249.5
Glyph of Hunter's Mark, https://wotlkdb.com/?spell=57004, 5.9685, 9.9815, 15.95, 159.8
Glyph of Power Word: Shield, https://wotlkdb.com/?spell=57194, 5.9685, 9.9815, 15.95, 159.8
Glyph of Pestilence, https://wotlkdb.com/?spell=57230, 5.8799, 18.075, 23.9549, 132.5
Glyph of Aimed Shot, https://wotlkdb.com/?spell=56994, 5.8747, 12.125, 17.9997, 148.5
Glyph of Raise Dead, https://wotlkdb.com/?spell=57228, 5.8746, 18.075, 23.9496, 132.5
Glyph of Thunderstorm, https://wotlkdb.com/?spell=57253, 5.8159, 17.5, 23.3159, 133.2
Weapon Vellum II, https://wotlkdb.com/?spell=59488, 5.7726, 6.1774, 11.95, 193.4
Glyph of Immolate, https://wotlkdb.com/?spell=57268, 5.7496, 17.5, 23.2496, 132.9
Glyph of Obliterate, https://wotlkdb.com/?spell=57220, 5.7104, 17.5, 23.2104, 132.6
Glyph of Death's Embrace, https://wotlkdb.com/?spell=57215, 5.6744, 18.075, 23.7494, 131.4
Glyph of Divine Plea, https://wotlkdb.com/?spell=64305, 5.6589, 17.5, 23.1589, 132.3
Glyph of Horn of Winter, https://wotlkdb.com/?spell=57217, 5.5398, 18.45, 23.9898, 130
Glyph of Killing Spree, https://wotlkdb.com/?spell=64285, 5.5049, 18.45, 23.9549, 129.8
Glyph of Blast Wave, https://wotlkdb.com/?spell=56990, 5.4897, 17.5, 22.9897, 131.4
Glyph of Enraged Regeneration, https://wotlkdb.com/?spell=64312, 5.4894, 17.5, 22.9894, 131.4
Glyph of Felguard, https://wotlkdb.com/?spell=57263, 5.4797, 17.5, 22.9797, 131.3
Glyph of Shadowflame, https://wotlkdb.com/?spell=64311, 5.4797, 17.5, 22.9797, 131.3
Glyph of Molten Armor, https://wotlkdb.com/?spell=56986, 5.4791, 17.5, 22.9791, 131.3
Glyph of Shockwave, https://wotlkdb.com/?spell=64296, 5.4449, 18.45, 23.8949, 129.5
Glyph of Guardian Spirit, https://wotlkdb.com/?spell=64281, 5.4347, 18.45, 23.8847, 129.5
Glyph of Circle of Healing, https://wotlkdb.com/?spell=57181, 5.4249, 17.5, 22.9249, 131
Glyph of Quick Decay, https://wotlkdb.com/?spell=71102, 5.3985, 17.5, 22.8985, 130.8
Glyph of Hungering Cold, https://wotlkdb.com/?spell=64298, 5.3954, 18.45, 23.8454, 129.2
Glyph of Preparation, https://wotlkdb.com/?spell=57127, 5.3499, 17.5, 22.8499, 130.6
Glyph of Fireball, https://wotlkdb.com/?spell=56975, 5.345, 17.5, 22.845, 130.5
Glyph of Seal of Wisdom, https://wotlkdb.com/?spell=57035, 5.3394, 17.5, 22.8394, 130.5
Glyph of Hammer of the Righteous, https://wotlkdb.com/?spell=64278, 5.3248, 18.45, 23.7748, 128.9
Glyph of Haunt, https://wotlkdb.com/?spell=64291, 5.2994, 18.45, 23.7494, 128.7
Glyph of Divine Storm, https://wotlkdb.com/?spell=64279, 5.2488, 18.45, 23.6988, 128.4
Glyph of Seal of Righteousness, https://wotlkdb.com/?spell=59560, 5.2248, 17.5, 22.7248, 129.9
Glyph of Hamstring, https://wotlkdb.com/?spell=57157, 5.1941, 9.9625, 15.1566, 152.1
Glyph of Savage Roar, https://wotlkdb.com/?spell=64307, 5.1898, 17.5, 22.6898, 129.7
Glyph of Fire Nova, https://wotlkdb.com/?spell=57238, 5.1874, 9.9625, 15.1499, 152.1
Glyph of Shadow Dance, https://wotlkdb.com/?spell=64286, 5.1289, 18.45, 23.5789, 127.8
Glyph of Chaos Bolt, https://wotlkdb.com/?spell=64294, 5.1167, 18.45, 23.5667, 127.7
Glyph of Hammer of Justice, https://wotlkdb.com/?spell=57027, 5.0185, 9.9815, 15, 150.3
Glyph of Possessed Strength, https://wotlkdb.com/?spell=58300, 5.0185, 9.9815, 15, 150.3
Glyph of Stormstrike, https://wotlkdb.com/?spell=57248, 4.9597, 17.5, 22.4597, 128.3
Ethereal Ink, https://wotlkdb.com/?spell=57713, 4.95, 13, 17.95, 138.1
Glyph of Penance, https://wotlkdb.com/?spell=64282, 4.8944, 18.45, 23.3444, 126.5
Glyph of Chimera Shot, https://wotlkdb.com/?spell=64271, 4.8778, 18.45, 23.3278, 126.4
Glyph of Living Bomb, https://wotlkdb.com/?spell=64275, 4.8768, 18.45, 23.3268, 126.4
Glyph of Shred, https://wotlkdb.com/?spell=56957, 4.875, 15.125, 20, 132.2
Glyph of Frost Strike, https://wotlkdb.com/?spell=57216, 4.875, 15.125, 20, 132.2
Glyph of Pain Suppression, https://wotlkdb.com/?spell=64259, 4.8649, 15.125, 19.9899, 132.2
Glyph of Thunder, https://wotlkdb.com/?spell=64287, 4.8212, 18.45, 23.2712, 126.1
Glyph of Smite, https://wotlkdb.com/?spell=57201, 4.7876, 5.2124, 10, 191.9
Glyph of Blood Tap, https://wotlkdb.com/?spell=57209, 4.7849, 18.45, 23.2349, 125.9
Glyph of Crusader Strike, https://wotlkdb.com/?spell=57024, 4.7376, 5.2124, 9.95, 190.9
Glyph of Dancing Rune Weapon, https://wotlkdb.com/?spell=64297, 4.7099, 18.45, 23.1599, 125.5
Glyph of Beacon of Light, https://wotlkdb.com/?spell=64277, 4.5396, 18.45, 22.9896, 124.6
Glyph of Growl, https://wotlkdb.com/?spell=56944, 4.5, 17.5, 22, 125.7
Glyph of Steady Shot, https://wotlkdb.com/?spell=57011, 4.5, 17.5, 22, 125.7
Glyph of Hemorrhage, https://wotlkdb.com/?spell=57126, 4.5, 17.5, 22, 125.7
Glyph of Rune Strike, https://wotlkdb.com/?spell=57223, 4.4485, 17.5, 21.9485, 125.4
Glyph of Bladestorm, https://wotlkdb.com/?spell=64295, 4.4391, 18.45, 22.8891, 124.1
Glyph of Survival Instincts, https://wotlkdb.com/?spell=65245, 4.4105, 17.0015, 21.412, 125.9
Glyph of Mass Dispel, https://wotlkdb.com/?spell=57190, 4.4, 17.5, 21.9, 125.1
Glyph of Dispersion, https://wotlkdb.com/?spell=64280, 4.35, 18.45, 22.8, 123.6
Glyph of Nourish, https://wotlkdb.com/?spell=64313, 4.344, 17.5, 21.844, 124.8
Glyph of Wild Growth, https://wotlkdb.com/?spell=64270, 4.3291, 18.45, 22.7791, 123.5
Glyph of Vigor, https://wotlkdb.com/?spell=57130, 4.192, 17.5, 21.692, 124
Glyph of Arcane Explosion, https://wotlkdb.com/?spell=56968, 4.1899, 9.9515, 14.1414, 142.1
Glyph of Berserk, https://wotlkdb.com/?spell=64268, 3.9497, 18.45, 22.3997, 121.4
Glyph of Mana Gem, https://wotlkdb.com/?spell=56985, 3.8648, 15.125, 18.9898, 125.6
Glyph of Execution, https://wotlkdb.com/?spell=57156, 3.775, 15.125, 18.9, 125
Glyph of Death and Decay, https://wotlkdb.com/?spell=57214, 3.772, 17.5, 21.272, 121.6
Glyph of Kill Shot, https://wotlkdb.com/?spell=64304, 3.672, 17.5, 21.172, 121
Glyph of Arcane Blast, https://wotlkdb.com/?spell=56991, 3.5899, 18.45, 22.0399, 119.5
Glyph of Whirlwind, https://wotlkdb.com/?spell=57172, 3.55, 18.45, 22, 119.2
Glyph of the Ghoul, https://wotlkdb.com/?spell=57222, 3.55, 18.45, 22, 119.2
Glyph of Spell Reflection, https://wotlkdb.com/?spell=64302, 3.55, 18.45, 22, 119.2
Glyph of Shield of Righteousness, https://wotlkdb.com/?spell=64308, 3.5, 17.5, 21, 120
Glyph of Hammer of Wrath, https://wotlkdb.com/?spell=57028, 3.4999, 17.5, 20.9999, 120
Glyph of Frostfire, https://wotlkdb.com/?spell=61677, 3.4796, 17.5, 20.9796, 119.9
Glyph of Death Strike, https://wotlkdb.com/?spell=59340, 3, 18.45, 21.45, 116.3
Glyph of Icy Veins, https://wotlkdb.com/?spell=56981, 2.8975, 12.125, 15.0225, 123.9
Glyph of Righteous Defense, https://wotlkdb.com/?spell=57032, 2.875, 12.125, 15, 123.7
Glyph of Ice Block, https://wotlkdb.com/?spell=56979, 2.7875, 5.2124, 7.9999, 153.5
Glyph of Invisibility, https://wotlkdb.com/?spell=56983, 2.4999, 17.5, 19.9999, 114.3
Glyph of Regrowth, https://wotlkdb.com/?spell=56954, 2.4897, 17.5, 19.9897, 114.2
Glyph of Aspect of the Viper, https://wotlkdb.com/?spell=56998, 2.4897, 17.5, 19.9897, 114.2
Glyph of Mangle, https://wotlkdb.com/?spell=56950, 2.45, 17.5, 19.95, 114
Glyph of Lightwell, https://wotlkdb.com/?spell=57189, 2.3, 17.5, 19.8, 113.1
Glyph of Wyvern Sting, https://wotlkdb.com/?spell=57014, 2.2998, 17.5, 19.7998, 113.1
Glyph of Deep Freeze, https://wotlkdb.com/?spell=64274, 2.0295, 18.45, 20.4795, 111
Lion's Ink, https://wotlkdb.com/?spell=57704, 1.95, 8, 9.95, 124.4
Glyph of Chains of Ice, https://wotlkdb.com/?spell=57211, 1.95, 17.5, 19.45, 111.1
Glyph of Arcane Barrage, https://wotlkdb.com/?spell=64276, 1.8398, 18.45, 20.2898, 110
Glyph of Plague Strike, https://wotlkdb.com/?spell=57221, 1.7945, 18.075, 19.8695, 109.9
Glyph of Shadow Word: Death, https://wotlkdb.com/?spell=57199, 1.7596, 17.5, 19.2596, 110.1
Glyph of Rapid Rejuvenation, https://wotlkdb.com/?spell=71015, 1.7557, 17.5, 19.2557, 110
Moonglow Ink, https://wotlkdb.com/?spell=52843, 1.7404, 4, 5.7404, 143.5
Glyph of Howling Blast, https://wotlkdb.com/?spell=64300, 1.55, 18.45, 20, 108.4
Glyph of Incinerate, https://wotlkdb.com/?spell=57257, 1.5, 18.45, 19.95, 108.1
Glyph of Windfury Weapon, https://wotlkdb.com/?spell=57252, 1.4499, 18.45, 19.8999, 107.9
Glyph of Hunger for Blood, https://wotlkdb.com/?spell=64284, 1.4263, 18.45, 19.8763, 107.7
Glyph of Howl of Terror, https://wotlkdb.com/?spell=57267, 1.1, 17.5, 18.6, 106.3
Glyph of Arcane Shot, https://wotlkdb.com/?spell=56995, 1.0485, 9.9515, 11, 110.5
Glyph of Felhunter, https://wotlkdb.com/?spell=57264, 1.0249, 17.5, 18.5249, 105.9
Ink of the Sea, https://wotlkdb.com/?spell=57715, 1.0002, 15.9998, 17, 106.3
Glyph of Heroic Strike, https://wotlkdb.com/?spell=57158, 0.9685, 9.9815, 10.95, 109.7
Glyph of Garrote, https://wotlkdb.com/?spell=57123, 0.8375, 9.9625, 10.8, 108.4
Glyph of Unholy Blight, https://wotlkdb.com/?spell=64299, 0.728, 18.45, 19.178, 103.9
Glyph of Seal of Light, https://wotlkdb.com/?spell=57034, 0.5, 17.5, 18, 102.9
Glyph of Turn Evil, https://wotlkdb.com/?spell=57036, 0.5, 17.5, 18, 102.9
Glyph of Scourge Imprisonment, https://wotlkdb.com/?spell=57198, 0.5, 17.5, 18, 102.9
Glyph of Healing Wave, https://wotlkdb.com/?spell=57243, 0.5, 17.5, 18, 102.9
Glyph of Icebound Fortitude, https://wotlkdb.com/?spell=57218, 0.378, 17.5, 17.878, 102.2
Scroll of Intellect, https://wotlkdb.com/?spell=48114, 0.3732, 0.519, 0.8922, 171.9
Glyph of Sweeping Strikes, https://wotlkdb.com/?spell=57168, 0.35, 18.45, 18.8, 101.9
Royal Ink, https://wotlkdb.com/?spell=57708, 0.0515, 0.9185, 0.97, 105.6
Glyph of Entangling Roots, https://wotlkdb.com/?spell=48121, 0.0484, 9.9515, 9.9999, 100.5
Glyph of Mending, https://wotlkdb.com/?spell=56997, -0.0125, 9.9625, 9.95, 99.9
Glyph of Maul, https://wotlkdb.com/?spell=56961, -0.0315, 9.9815, 9.95, 99.7
Dawnstar Ink, https://wotlkdb.com/?spell=57706, -0.0397, 1, 0.9603, 96
Hunter's Ink, https://wotlkdb.com/?spell=57703, -0.2062, 0.9062, 0.7, 77.2
Scroll of Stamina, https://wotlkdb.com/?spell=45382, -0.4195, 0.519, 0.0995, 19.2
Scroll of Spirit, https://wotlkdb.com/?spell=48116, -0.4195, 0.519, 0.0995, 19.2
Glyph of Feral Spirit, https://wotlkdb.com/?spell=64288, -0.4602, 18.45, 17.9898, 97.5
Glyph of Death Coil, https://wotlkdb.com/?spell=57261, -0.5001, 17.5, 16.9999, 97.1
Ink of the Sky, https://wotlkdb.com/?spell=57712, -0.7124, 8, 7.2876, 91.1
Scroll of Strength, https://wotlkdb.com/?spell=58484, -0.888, 1.0365, 0.1485, 14.3
Glyph of Sunder Armor, https://wotlkdb.com/?spell=57167, -0.9625, 9.9625, 9, 90.3
Scroll of Agility, https://wotlkdb.com/?spell=58472, -1.0216, 1.0365, 0.0149, 1.4
Glyph of Corruption, https://wotlkdb.com/?spell=57259, -1.0315, 9.9815, 8.95, 89.7
Glyph of Earthliving Weapon, https://wotlkdb.com/?spell=57236, -1.075, 18.075, 17, 94.1
Glyph of Deadly Throw, https://wotlkdb.com/?spell=57117, -1.1002, 17.5, 16.3998, 93.7
Darkflame Ink, https://wotlkdb.com/?spell=57714, -1.13, 4.9, 3.77, 76.9
Ivory Ink, https://wotlkdb.com/?spell=52738, -1.4825, 2, 0.5175, 25.9
Glyph of Hex, https://wotlkdb.com/?spell=64316, -1.5003, 17.5, 15.9997, 91.4
Glyph of Taunt, https://wotlkdb.com/?spell=57169, -1.6, 17.5, 15.9, 90.9
Glyph of Ice Armor, https://wotlkdb.com/?spell=56978, -1.9315, 9.9815, 8.05, 80.6
Glyph of Healing Touch, https://wotlkdb.com/?spell=56945, -1.9725, 9.9625, 7.99, 80.2
Glyph of Backstab, https://wotlkdb.com/?spell=57114, -2.0315, 9.9815, 7.95, 79.6
