Name, Link, Profit, Cost, Sell, ROI %
Rituals of the New Moon, https://wotlkdb.com/?spell=64051, 2034.0003, 186.9997, 2221, 1187.7
Iron-bound Tome, https://wotlkdb.com/?spell=59497, 204.8821, 175.5, 380.3821, 216.7
Faces of Doom, https://wotlkdb.com/?spell=59498, 164.5, 175.5, 340, 193.7
Glyph of Enduring Victory, https://wotlkdb.com/?spell=58347, 76.7035, 12.45, 89.1535, 716.1
Glyph of Typhoon, https://wotlkdb.com/?spell=56965, 52.2148, 16.5, 68.7148, 416.5
Glyph of Deadly Throw, https://wotlkdb.com/?spell=57117, 41.0763, 16.5, 57.5763, 348.9
Glyph of Fire Blast, https://wotlkdb.com/?spell=57719, 26.4265, 16.5, 42.9265, 260.2
Twilight Tome, https://wotlkdb.com/?spell=64053, 22.3334, 121.6666, 144, 118.4
Shimmering Ink, https://wotlkdb.com/?spell=57711, 16.1326, 4.8674, 21, 431.4
Glyph of Blurred Speed, https://wotlkdb.com/?spell=58323, 11.3053, 7.4515, 18.7568, 251.7
Glyph of Soul Link, https://wotlkdb.com/?spell=64250, 11.2113, 16.5015, 27.7128, 167.9
Glyph of Lay on Hands, https://wotlkdb.com/?spell=58313, 10.7288, 7.4515, 18.1803, 244
Glyph of Deep Freeze, https://wotlkdb.com/?spell=64274, 9.52, 12.45, 21.97, 176.5
Glyph of Arcane Intellect, https://wotlkdb.com/?spell=58303, 9.3691, 7.4515, 16.8206, 225.7
Certificate of Ownership, https://wotlkdb.com/?spell=59387, 9.1775, 30.8125, 39.99, 129.8
Glyph of Fading, https://wotlkdb.com/?spell=58317, 9.0451, 7.4515, 16.4966, 221.4
Lion's Ink, https://wotlkdb.com/?spell=57704, 8.94, 7.56, 16.5, 218.3
Glyph of Battle, https://wotlkdb.com/?spell=58342, 8.4249, 7.4515, 15.8764, 213.1
Glyph of Blessing of Wisdom, https://wotlkdb.com/?spell=58312, 7.8145, 7.4515, 15.266, 204.9
Glyph of Mend Pet, https://wotlkdb.com/?spell=58301, 7.7057, 7.4515, 15.1572, 203.4
Glyph of Charge, https://wotlkdb.com/?spell=58344, 7.6293, 7.4515, 15.0808, 202.4
Glyph of the Wild, https://wotlkdb.com/?spell=58296, 7.6068, 7.4515, 15.0583, 202.1
Glyph of Thorns, https://wotlkdb.com/?spell=58289, 7.5629, 7.4515, 15.0144, 201.5
Glyph of Blessing of Might, https://wotlkdb.com/?spell=58314, 7.5595, 7.4515, 15.011, 201.4
Glyph of Thunder Clap, https://wotlkdb.com/?spell=58346, 7.5538, 7.4515, 15.0053, 201.4
Glyph of Revive Pet, https://wotlkdb.com/?spell=58299, 7.5485, 7.4515, 15, 201.3
Glyph of Slow Fall, https://wotlkdb.com/?spell=58308, 7.5485, 7.4515, 15, 201.3
Glyph of Fortitude, https://wotlkdb.com/?spell=58318, 7.5485, 7.4515, 15, 201.3
Glyph of Drain Soul, https://wotlkdb.com/?spell=58337, 7.5485, 7.4515, 15, 201.3
Glyph of Bloodrage, https://wotlkdb.com/?spell=58343, 7.5485, 7.4515, 15, 201.3
Glyph of Scare Beast, https://wotlkdb.com/?spell=58298, 7.5484, 7.4515, 14.9999, 201.3
Glyph of Frost Armor, https://wotlkdb.com/?spell=58306, 7.5484, 7.4515, 14.9999, 201.3
Glyph of Life Tap, https://wotlkdb.com/?spell=64248, 7.5484, 7.4515, 14.9999, 201.3
Glyph of the Penguin, https://wotlkdb.com/?spell=58310, 7.5479, 7.4515, 14.9994, 201.3
Glyph of Stoneclaw Totem, https://wotlkdb.com/?spell=64247, 7.5477, 7.4515, 14.9992, 201.3
Glyph of Possessed Strength, https://wotlkdb.com/?spell=58300, 7.4732, 7.4515, 14.9247, 200.3
Glyph of Power Word: Shield, https://wotlkdb.com/?spell=57194, 7.4485, 7.4515, 14.9, 200
Glyph of Raptor Strike, https://wotlkdb.com/?spell=64246, 7.1645, 7.4515, 14.616, 196.1
Glyph of Healing Wave, https://wotlkdb.com/?spell=57243, 6.6693, 16.5, 23.1693, 140.4
Glyph of Pick Pocket, https://wotlkdb.com/?spell=58326, 6.4784, 7.4515, 13.9299, 186.9
Ink of the Sea, https://wotlkdb.com/?spell=57715, 6, 10, 16, 160
Glyph of Rupture, https://wotlkdb.com/?spell=57128, 5.9809, 16.5, 22.4809, 136.2
Glyph of Raise Dead, https://wotlkdb.com/?spell=57228, 5.7313, 12.075, 17.8063, 147.5
Glyph of Frost Ward, https://wotlkdb.com/?spell=58307, 5.3538, 16.5125, 21.8663, 132.4
Glyph of Hex, https://wotlkdb.com/?spell=64316, 5.3199, 16.5, 21.8199, 132.2
Glyph of Corruption, https://wotlkdb.com/?spell=57259, 4.6685, 7.4515, 12.12, 162.7
Glyph of Corpse Explosion, https://wotlkdb.com/?spell=57229, 4.5542, 12.075, 16.6292, 137.7
Glyph of Rejuvenation, https://wotlkdb.com/?spell=56955, 4.5484, 7.4515, 11.9999, 161
Glyph of Hammer of Justice, https://wotlkdb.com/?spell=57027, 4.5484, 7.4515, 11.9999, 161
Glyph of Heroic Strike, https://wotlkdb.com/?spell=57158, 4.5484, 7.4515, 11.9999, 161
Glyph of Hammer of Wrath, https://wotlkdb.com/?spell=57028, 4.5, 16.5, 21, 127.3
Glyph of Curse of Exhaustion, https://wotlkdb.com/?spell=58338, 4.3957, 15.2873, 19.683, 128.8
Glyph of Siphon Life, https://wotlkdb.com/?spell=57273, 4.3079, 16.5, 20.8079, 126.1
Glyph of Cloak of Shadows, https://wotlkdb.com/?spell=64303, 4.1451, 12.45, 16.5951, 133.3
Glyph of Pestilence, https://wotlkdb.com/?spell=57230, 4.0939, 12.075, 16.1689, 133.9
Glyph of Horn of Winter, https://wotlkdb.com/?spell=57217, 3.7896, 12.45, 16.2396, 130.4
Glyph of Challenging Roar, https://wotlkdb.com/?spell=58287, 3.5468, 15.2873, 18.8341, 123.2
Glyph of Fan of Knives, https://wotlkdb.com/?spell=64315, 3.4999, 16.5, 19.9999, 121.2
Glyph of Taunt, https://wotlkdb.com/?spell=57169, 3.4899, 16.5, 19.9899, 121.2
Glyph of Killing Spree, https://wotlkdb.com/?spell=64285, 3.4306, 12.45, 15.8806, 127.6
Warrior Glyph 21, https://wotlkdb.com/?spell=57173, 3.071, 6.9289, 9.9999, 144.3
Warrior Glyph 22, https://wotlkdb.com/?spell=57174, 3.071, 6.9289, 9.9999, 144.3
Warrior Glyph 23, https://wotlkdb.com/?spell=57175, 3.071, 6.9289, 9.9999, 144.3
Warrior Glyph 25, https://wotlkdb.com/?spell=57176, 3.071, 6.9289, 9.9999, 144.3
Warrior Glyph 24, https://wotlkdb.com/?spell=57180, 3.071, 6.9289, 9.9999, 144.3
Death Knight Glyph 25, https://wotlkdb.com/?spell=57231, 3.071, 6.9289, 9.9999, 144.3
Glyph of Trueshot Aura, https://wotlkdb.com/?spell=57012, 3.0643, 16.5, 19.5643, 118.6
Glyph of Death's Embrace, https://wotlkdb.com/?spell=57215, 2.925, 12.075, 15, 124.2
Glyph of Unending Breath, https://wotlkdb.com/?spell=58336, 2.8742, 16.5015, 19.3757, 117.4
Glyph of Distract, https://wotlkdb.com/?spell=58324, 2.7381, 16.5125, 19.2506, 116.6
Glyph of Explosive Shot, https://wotlkdb.com/?spell=64273, 2.5879, 12.45, 15.0379, 120.8
Glyph of Blood Tap, https://wotlkdb.com/?spell=57209, 2.5531, 12.45, 15.0031, 120.5
Glyph of Living Bomb, https://wotlkdb.com/?spell=64275, 2.5499, 12.45, 14.9999, 120.5
Glyph of Beacon of Light, https://wotlkdb.com/?spell=64277, 2.5499, 12.45, 14.9999, 120.5
Glyph of Dispersion, https://wotlkdb.com/?spell=64280, 2.5499, 12.45, 14.9999, 120.5
Glyph of Haunt, https://wotlkdb.com/?spell=64291, 2.5499, 12.45, 14.9999, 120.5
Glyph of Vampiric Blood, https://wotlkdb.com/?spell=57227, 2.5498, 12.45, 14.9998, 120.5
Glyph of Death Strike, https://wotlkdb.com/?spell=59340, 2.5498, 12.45, 14.9998, 120.5
Glyph of Feral Spirit, https://wotlkdb.com/?spell=64288, 2.5498, 12.45, 14.9998, 120.5
Glyph of Chimera Shot, https://wotlkdb.com/?spell=64271, 2.5497, 12.45, 14.9997, 120.5
Glyph of Hammer of the Righteous, https://wotlkdb.com/?spell=64278, 2.5497, 12.45, 14.9997, 120.5
Glyph of Divine Storm, https://wotlkdb.com/?spell=64279, 2.5497, 12.45, 14.9997, 120.5
Glyph of Shadow Dance, https://wotlkdb.com/?spell=64286, 2.5497, 12.45, 14.9997, 120.5
Glyph of Howling Blast, https://wotlkdb.com/?spell=64300, 2.5496, 12.45, 14.9996, 120.5
Glyph of Penance, https://wotlkdb.com/?spell=64282, 2.5495, 12.45, 14.9995, 120.5
Glyph of Hunger for Blood, https://wotlkdb.com/?spell=64284, 2.5495, 12.45, 14.9995, 120.5
Glyph of Serpent Sting, https://wotlkdb.com/?spell=57009, 2.5485, 7.4515, 10, 134.2
Glyph of Flame Shock, https://wotlkdb.com/?spell=57239, 2.5485, 7.4515, 10, 134.2
Glyph of Maul, https://wotlkdb.com/?spell=56961, 2.5484, 7.4515, 9.9999, 134.2
Glyph of the Ghoul, https://wotlkdb.com/?spell=57222, 2.5387, 12.45, 14.9887, 120.4
Glyph of Resonating Power, https://wotlkdb.com/?spell=57164, 2.5017, 16.5, 19.0017, 115.2
Glyph of Dancing Rune Weapon, https://wotlkdb.com/?spell=64297, 2.5, 12.45, 14.95, 120.1
Glyph of Unholy Blight, https://wotlkdb.com/?spell=64299, 2.4747, 12.45, 14.9247, 119.9
Glyph of Hunter's Mark, https://wotlkdb.com/?spell=57004, 2.4484, 7.4515, 9.8999, 132.9
Glyph of Wild Growth, https://wotlkdb.com/?spell=64270, 2.3998, 12.45, 14.8498, 119.3
Glyph of Shadow Protection, https://wotlkdb.com/?spell=58321, 2.2195, 15.2873, 17.5068, 114.5
Glyph of Holy Wrath, https://wotlkdb.com/?spell=59559, 2.1704, 16.5, 18.6704, 113.2
Glyph of Hemorrhage, https://wotlkdb.com/?spell=57126, 2.1082, 16.5, 18.6082, 112.8
Glyph of Arcane Blast, https://wotlkdb.com/?spell=56991, 2.1, 12.45, 14.55, 116.9
Glyph of Pick Lock, https://wotlkdb.com/?spell=58325, 1.977, 16.5015, 18.4785, 112
Glyph of Plague Strike, https://wotlkdb.com/?spell=57221, 1.9249, 12.075, 13.9999, 115.9
Glyph of Flash of Light, https://wotlkdb.com/?spell=57026, 1.8749, 12.075, 13.9499, 115.5
Glyph of Rending, https://wotlkdb.com/?spell=57163, 1.8304, 16.5125, 18.3429, 111.1
Glyph of Frostbolt, https://wotlkdb.com/?spell=56977, 1.6623, 16.5, 18.1623, 110.1
Glyph of Shockwave, https://wotlkdb.com/?spell=64296, 1.5499, 12.45, 13.9999, 112.4
Glyph of Eternal Water, https://wotlkdb.com/?spell=71101, 1.5498, 12.45, 13.9998, 112.4
Glyph of Starfall, https://wotlkdb.com/?spell=56958, 1.509, 16.5, 18.009, 109.1
Glyph of Scatter Shot, https://wotlkdb.com/?spell=64249, 1.5004, 16.5015, 18.0019, 109.1
Glyph of Bladestorm, https://wotlkdb.com/?spell=64295, 1.4799, 12.45, 13.9299, 111.9
Glyph of Hungering Cold, https://wotlkdb.com/?spell=64298, 1.4799, 12.45, 13.9299, 111.9
Glyph of Whirlwind, https://wotlkdb.com/?spell=57172, 1.4499, 12.45, 13.8999, 111.6
Glyph of Souls, https://wotlkdb.com/?spell=58341, 1.3767, 16.5, 17.8767, 108.3
Glyph of Chaos Bolt, https://wotlkdb.com/?spell=64294, 1.3087, 12.45, 13.7587, 110.5
Glyph of Thunder, https://wotlkdb.com/?spell=64287, 1.1869, 12.45, 13.6369, 109.5
Glyph of Frost Nova, https://wotlkdb.com/?spell=56976, 1.1735, 7.4515, 8.625, 115.7
Glyph of Innervate, https://wotlkdb.com/?spell=56947, 1.0515, 16.5, 17.5515, 106.4
Glyph of Shackle Undead, https://wotlkdb.com/?spell=58320, 0.7942, 16.5015, 17.2957, 104.8
Glyph of Shield Wall, https://wotlkdb.com/?spell=64252, 0.7458, 16.5125, 17.2583, 104.5
Glyph of Intervene, https://wotlkdb.com/?spell=57159, 0.6925, 16.5, 17.1925, 104.2
Glyph of Incinerate, https://wotlkdb.com/?spell=57257, 0.5498, 12.45, 12.9998, 104.4
Glyph of Kilrogg, https://wotlkdb.com/?spell=58340, 0.5211, 16.5125, 17.0336, 103.2
Glyph of Earthliving Weapon, https://wotlkdb.com/?spell=57236, 0.4748, 12.075, 12.5498, 103.9
Glyph of Frenzied Regeneration, https://wotlkdb.com/?spell=56943, 0.2249, 12.45, 12.6749, 101.8
Glyph of Fire Ward, https://wotlkdb.com/?spell=58305, 0.0053, 16.5015, 16.5068, 100
Glyph of Polymorph, https://wotlkdb.com/?spell=56987, -0.118, 16.5, 16.382, 99.3
Glyph of Safe Fall, https://wotlkdb.com/?spell=58327, -0.2116, 15.4125, 15.2009, 98.6
Glyph of Dash, https://wotlkdb.com/?spell=59315, -0.2416, 15.2873, 15.0457, 98.4
Glyph of Crippling Poison, https://wotlkdb.com/?spell=57116, -0.2515, 16.5, 16.2485, 98.5
Glyph of Levitate, https://wotlkdb.com/?spell=58319, -0.2873, 15.2873, 15, 98.1
Glyph of Renewed Life, https://wotlkdb.com/?spell=58330, -0.2873, 15.2873, 15, 98.1
Glyph of Water Walking, https://wotlkdb.com/?spell=58333, -0.2873, 15.2873, 15, 98.1
Glyph of the Wise, https://wotlkdb.com/?spell=58316, -0.2875, 15.2873, 14.9998, 98.1
Glyph of Feign Death, https://wotlkdb.com/?spell=58302, -0.2886, 15.2873, 14.9987, 98.1
Glyph of the Pack, https://wotlkdb.com/?spell=58297, -0.3051, 15.4125, 15.1074, 98
Glyph of Renew, https://wotlkdb.com/?spell=57197, -0.3374, 15.2873, 14.9499, 97.8
Glyph of Astral Recall, https://wotlkdb.com/?spell=58329, -0.3374, 15.2873, 14.9499, 97.8
Scroll of Spirit, https://wotlkdb.com/?spell=48116, -0.3515, 0.9915, 0.64, 64.5
Glyph of Aquatic Form, https://wotlkdb.com/?spell=58286, -0.4077, 16.5015, 16.0938, 97.5
Glyph of Rip, https://wotlkdb.com/?spell=56956, -0.4196, 15.4125, 14.9929, 97.3
Glyph of Vigilance, https://wotlkdb.com/?spell=64255, -0.4228, 15.4125, 14.9897, 97.3
Glyph of Windfury Weapon, https://wotlkdb.com/?spell=57252, -0.4501, 12.45, 11.9999, 96.4
Glyph of Rune Tap, https://wotlkdb.com/?spell=59338, -0.4501, 12.45, 11.9999, 96.4
Glyph of Unburdened Rebirth, https://wotlkdb.com/?spell=58288, -0.4533, 16.5015, 16.0482, 97.3
Glyph of Mind Control, https://wotlkdb.com/?spell=57191, -0.4722, 16.5, 16.0278, 97.1
Glyph of Riptide, https://wotlkdb.com/?spell=64289, -0.5001, 12.45, 11.9499, 96
Dawnstar Ink, https://wotlkdb.com/?spell=57706, -0.5175, 0.594, 0.0765, 12.9
Glyph of Disengage, https://wotlkdb.com/?spell=57001, -0.5251, 15.525, 14.9999, 96.6
Glyph of Ice Barrier, https://wotlkdb.com/?spell=64257, -0.5254, 15.525, 14.9996, 96.6
Glyph of Sense Undead, https://wotlkdb.com/?spell=58315, -0.7488, 16.5015, 15.7527, 95.5
Hunter's Ink, https://wotlkdb.com/?spell=57703, -0.7495, 0.8, 0.0505, 6.3
Glyph of Enslave Demon, https://wotlkdb.com/?spell=58339, -0.7838, 15.2873, 14.5035, 94.9
Glyph of Growl, https://wotlkdb.com/?spell=56944, -0.8735, 16.5, 15.6265, 94.7
Scroll of Stamina, https://wotlkdb.com/?spell=45382, -0.9015, 0.9915, 0.09, 9.1
Glyph of Spiritual Attunement, https://wotlkdb.com/?spell=57022, -0.9515, 7.4515, 6.5, 87.2
Scroll of Strength, https://wotlkdb.com/?spell=58484, -0.9615, 1.9815, 1.02, 51.5
Scroll of Intellect, https://wotlkdb.com/?spell=48114, -0.9878, 0.9915, 0.0037, 0.4
Glyph of Seal of Wisdom, https://wotlkdb.com/?spell=57035, -0.9944, 16.5, 15.5056, 94
Glyph of Blast Wave, https://wotlkdb.com/?spell=56990, -1.0712, 16.5, 15.4288, 93.5
Glyph of Focus, https://wotlkdb.com/?spell=62162, -1.1182, 16.5, 15.3818, 93.2
Glyph of Unstable Affliction, https://wotlkdb.com/?spell=57276, -1.2834, 16.5, 15.2166, 92.2
Glyph of Mind Flay, https://wotlkdb.com/?spell=57200, -1.2874, 15.2873, 13.9999, 91.6
Glyph of Vanish, https://wotlkdb.com/?spell=58328, -1.3319, 16.5125, 15.1806, 91.9
Glyph of Blessing of Kings, https://wotlkdb.com/?spell=58311, -1.3326, 16.5015, 15.1689, 91.9
Glyph of Mocking Blow, https://wotlkdb.com/?spell=58345, -1.3362, 16.5015, 15.1653, 91.9
Glyph of Evocation, https://wotlkdb.com/?spell=56974, -1.3373, 15.2873, 13.95, 91.3
Glyph of Claw, https://wotlkdb.com/?spell=67600, -1.3642, 7.4515, 6.0873, 81.7
Glyph of Heart Strike, https://wotlkdb.com/?spell=57208, -1.4115, 16.5, 15.0885, 91.4
Glyph of Avenging Wrath, https://wotlkdb.com/?spell=57021, -1.4194, 16.5, 15.0806, 91.4
Glyph of Holy Shock, https://wotlkdb.com/?spell=64254, -1.4227, 15.4125, 13.9898, 90.8
Glyph of Kill Shot, https://wotlkdb.com/?spell=64304, -1.438, 16.5, 15.062, 91.3
Glyph of Metamorphosis, https://wotlkdb.com/?spell=64318, -1.45, 12.45, 11, 88.4
Glyph of Steady Shot, https://wotlkdb.com/?spell=57011, -1.4509, 16.5, 15.0491, 91.2
Glyph of Chain Heal, https://wotlkdb.com/?spell=57232, -1.4667, 16.5, 15.0333, 91.1
Glyph of Prayer of Healing, https://wotlkdb.com/?spell=57195, -1.4863, 16.5, 15.0137, 91
Glyph of Felguard, https://wotlkdb.com/?spell=57263, -1.4865, 16.5, 15.0135, 91
Glyph of Command, https://wotlkdb.com/?spell=68166, -1.4889, 16.5, 15.0111, 91
Glyph of Blocking, https://wotlkdb.com/?spell=57152, -1.4941, 16.5, 15.0059, 90.9
Glyph of Icebound Fortitude, https://wotlkdb.com/?spell=57218, -1.4944, 16.5, 15.0056, 90.9
Glyph of Mangle, https://wotlkdb.com/?spell=56950, -1.5, 16.5, 15, 90.9
Glyph of Swiftmend, https://wotlkdb.com/?spell=56960, -1.5, 16.5, 15, 90.9
Glyph of Fireball, https://wotlkdb.com/?spell=56975, -1.5, 16.5, 15, 90.9
Glyph of Molten Armor, https://wotlkdb.com/?spell=56986, -1.5, 16.5, 15, 90.9
Glyph of Water Elemental, https://wotlkdb.com/?spell=56989, -1.5, 16.5, 15, 90.9
Glyph of Volley, https://wotlkdb.com/?spell=57013, -1.5, 16.5, 15, 90.9
Glyph of Ghostly Strike, https://wotlkdb.com/?spell=57124, -1.5, 16.5, 15, 90.9
Glyph of Preparation, https://wotlkdb.com/?spell=57127, -1.5, 16.5, 15, 90.9
Glyph of Vigor, https://wotlkdb.com/?spell=57130, -1.5, 16.5, 15, 90.9
Glyph of Devastate, https://wotlkdb.com/?spell=57155, -1.5, 16.5, 15, 90.9
Glyph of Shadow, https://wotlkdb.com/?spell=57193, -1.5, 16.5, 15, 90.9
Glyph of Rune Strike, https://wotlkdb.com/?spell=57223, -1.5, 16.5, 15, 90.9
Glyph of Lava, https://wotlkdb.com/?spell=57234, -1.5, 16.5, 15, 90.9
Glyph of Fire Elemental Totem, https://wotlkdb.com/?spell=57237, -1.5, 16.5, 15, 90.9
Glyph of Shadowfiend, https://wotlkdb.com/?spell=58322, -1.5, 16.5, 15, 90.9
Glyph of Seal of Righteousness, https://wotlkdb.com/?spell=59560, -1.5, 16.5, 15, 90.9
Glyph of Nourish, https://wotlkdb.com/?spell=64313, -1.5, 16.5, 15, 90.9
Glyph of Avenger's Shield, https://wotlkdb.com/?spell=57019, -1.5001, 16.5, 14.9999, 90.9
Glyph of Mortal Strike, https://wotlkdb.com/?spell=57160, -1.5001, 16.5, 14.9999, 90.9
Glyph of Last Stand, https://wotlkdb.com/?spell=57166, -1.5001, 16.5, 14.9999, 90.9
Glyph of Circle of Healing, https://wotlkdb.com/?spell=57181, -1.5001, 16.5, 14.9999, 90.9
Glyph of Death and Decay, https://wotlkdb.com/?spell=57214, -1.5001, 16.5, 14.9999, 90.9
Glyph of Thunderstorm, https://wotlkdb.com/?spell=57253, -1.5001, 16.5, 14.9999, 90.9
Glyph of Conflagrate, https://wotlkdb.com/?spell=57258, -1.5001, 16.5, 14.9999, 90.9
Glyph of Immolate, https://wotlkdb.com/?spell=57268, -1.5001, 16.5, 14.9999, 90.9
Glyph of Mage Armor, https://wotlkdb.com/?spell=56984, -1.5002, 12.45, 10.9498, 88
Glyph of Wyvern Sting, https://wotlkdb.com/?spell=57014, -1.5002, 16.5, 14.9998, 90.9
Glyph of Seal of Light, https://wotlkdb.com/?spell=57034, -1.5002, 16.5, 14.9998, 90.9
Glyph of Stormstrike, https://wotlkdb.com/?spell=57248, -1.5002, 16.5, 14.9998, 90.9
Glyph of Shadowflame, https://wotlkdb.com/?spell=64311, -1.5003, 16.5, 14.9997, 90.9
Glyph of Regrowth, https://wotlkdb.com/?spell=56954, -1.5006, 16.5, 14.9994, 90.9
Glyph of Dark Command, https://wotlkdb.com/?spell=57212, -1.5006, 16.5, 14.9994, 90.9
Glyph of Seal of Vengeance, https://wotlkdb.com/?spell=59561, -1.5006, 16.5, 14.9994, 90.9
Glyph of Frostfire, https://wotlkdb.com/?spell=61677, -1.5006, 16.5, 14.9994, 90.9
Glyph of Obliterate, https://wotlkdb.com/?spell=57220, -1.5013, 16.5, 14.9987, 90.9
Glyph of Water Shield, https://wotlkdb.com/?spell=58332, -1.5015, 16.5015, 15, 90.9
Glyph of Ghost Wolf, https://wotlkdb.com/?spell=59326, -1.5015, 16.5015, 15, 90.9
Glyph of Moonfire, https://wotlkdb.com/?spell=56951, -1.5126, 16.5125, 14.9999, 90.8
Glyph of Eviscerate, https://wotlkdb.com/?spell=57120, -1.5126, 16.5125, 14.9999, 90.8
Glyph of Water Breathing, https://wotlkdb.com/?spell=58331, -1.5126, 16.5125, 14.9999, 90.8
Glyph of Salvation, https://wotlkdb.com/?spell=64251, -1.5126, 16.5125, 14.9999, 90.8
Glyph of Flash Heal, https://wotlkdb.com/?spell=57186, -1.5127, 16.5125, 14.9998, 90.8
Glyph of Fade, https://wotlkdb.com/?spell=57184, -1.5132, 16.5125, 14.9993, 90.8
Glyph of Enraged Regeneration, https://wotlkdb.com/?spell=64312, -1.52, 16.5, 14.98, 90.8
Glyph of Arcane Missiles, https://wotlkdb.com/?spell=56971, -1.5225, 16.5125, 14.99, 90.8
Glyph of Consecration, https://wotlkdb.com/?spell=57023, -1.5251, 15.525, 13.9999, 90.2
Glyph of Healing Stream Totem, https://wotlkdb.com/?spell=57242, -1.5251, 15.525, 13.9999, 90.2
Glyph of Barkskin, https://wotlkdb.com/?spell=64256, -1.5251, 15.525, 13.9999, 90.2
Scroll of Agility, https://wotlkdb.com/?spell=58472, -1.5435, 1.9815, 0.438, 22.1
Glyph of Tricks of the Trade, https://wotlkdb.com/?spell=64310, -1.5501, 16.5, 14.9499, 90.6
Glyph of Savage Roar, https://wotlkdb.com/?spell=64307, -1.5502, 16.5, 14.9498, 90.6
Glyph of Felhunter, https://wotlkdb.com/?spell=57264, -1.5754, 16.5, 14.9246, 90.5
Glyph of Demonic Circle, https://wotlkdb.com/?spell=64317, -1.5756, 16.5, 14.9244, 90.5
Glyph of Lightwell, https://wotlkdb.com/?spell=57189, -1.6516, 16.5, 14.8484, 90
Glyph of Divine Plea, https://wotlkdb.com/?spell=64305, -1.6527, 16.5, 14.8473, 90
Hellfire Tome, https://wotlkdb.com/?spell=59495, -1.6595, 41.6594, 39.9999, 96
Glyph of Curse of Agony, https://wotlkdb.com/?spell=57260, -1.6998, 16.5, 14.8002, 89.7
Glyph of Invisibility, https://wotlkdb.com/?spell=56983, -1.8004, 16.5, 14.6996, 89.1
Glyph of Judgement, https://wotlkdb.com/?spell=57030, -1.8702, 16.5125, 14.6423, 88.7
Glyph of Survival Instincts, https://wotlkdb.com/?spell=65245, -2.0063, 16.0015, 13.9952, 87.5
Glyph of Water Mastery, https://wotlkdb.com/?spell=57251, -2.2433, 21.125, 18.8817, 89.4
Glyph of Shadow Word: Pain, https://wotlkdb.com/?spell=57192, -2.45, 12.45, 10, 80.3
Glyph of Guardian Spirit, https://wotlkdb.com/?spell=64281, -2.4503, 12.45, 9.9997, 80.3
Glyph of Psychic Scream, https://wotlkdb.com/?spell=57196, -2.4517, 7.4515, 4.9998, 67.1
Glyph of Ice Armor, https://wotlkdb.com/?spell=56978, -2.4715, 7.4515, 4.98, 66.8
Glyph of Mending, https://wotlkdb.com/?spell=56997, -2.4976, 16.5125, 14.0149, 84.9
Glyph of Bestial Wrath, https://wotlkdb.com/?spell=56999, -2.5, 16.5, 14, 84.8
Glyph of Shadow Word: Death, https://wotlkdb.com/?spell=57199, -2.5, 16.5, 14, 84.8
Glyph of Turn Evil, https://wotlkdb.com/?spell=57036, -2.5001, 16.5, 13.9999, 84.8
Glyph of Bloodthirst, https://wotlkdb.com/?spell=57153, -2.5001, 16.5, 13.9999, 84.8
Glyph of Quick Decay, https://wotlkdb.com/?spell=71102, -2.5001, 16.5, 13.9999, 84.8
Glyph of Arcane Barrage, https://wotlkdb.com/?spell=64276, -2.5003, 12.45, 9.9497, 79.9
Glyph of the Hawk, https://wotlkdb.com/?spell=57006, -2.5003, 16.5, 13.9997, 84.8
Glyph of Shield of Righteousness, https://wotlkdb.com/?spell=64308, -2.5008, 16.5, 13.9992, 84.8
Glyph of Flametongue Weapon, https://wotlkdb.com/?spell=57240, -2.528, 16.5125, 13.9845, 84.7
Glyph of Wrath, https://wotlkdb.com/?spell=56963, -2.5316, 7.4515, 4.9199, 66
Fiery Ink, https://wotlkdb.com/?spell=57710, -2.719, 3.069, 0.35, 11.4
Glyph of Insect Swarm, https://wotlkdb.com/?spell=56948, -2.7874, 15.2873, 12.4999, 81.8
Glyph of Holy Light, https://wotlkdb.com/?spell=57029, -3.0672, 16.5125, 13.4453, 81.4
Glyph of Holy Nova, https://wotlkdb.com/?spell=57187, -3.3403, 12.45, 9.1097, 73.2
Glyph of Rapid Fire, https://wotlkdb.com/?spell=57008, -3.4502, 12.45, 8.9998, 72.3
Glyph of Rapid Charge, https://wotlkdb.com/?spell=57162, -3.4715, 7.4515, 3.98, 53.4
Glyph of Snake Trap, https://wotlkdb.com/?spell=57010, -3.6307, 16.5, 12.8693, 78
Snowfall Ink, https://wotlkdb.com/?spell=57716, -3.933, 13.833, 9.9, 71.6
Glyph of Adrenaline Rush, https://wotlkdb.com/?spell=57112, -3.95, 16.5, 12.55, 76.1
Ivory Ink, https://wotlkdb.com/?spell=52738, -3.99, 4.98, 0.99, 19.9
Moonglow Ink, https://wotlkdb.com/?spell=52843, -4.1601, 9.96, 5.7999, 58.2
Glyph of Disease, https://wotlkdb.com/?spell=64267, -4.204, 21.125, 16.921, 80.1
Darkflame Ink, https://wotlkdb.com/?spell=57714, -4.2805, 4.4154, 0.1349, 3.1
Glyph of Overpower, https://wotlkdb.com/?spell=57161, -4.2875, 15.2873, 10.9998, 72
Glyph of Lightning Shield, https://wotlkdb.com/?spell=57246, -4.4518, 7.4515, 2.9997, 40.3
Glyph of Elemental Mastery, https://wotlkdb.com/?spell=57250, -4.5002, 16.5, 11.9998, 72.7
Glyph of Mind Sear, https://wotlkdb.com/?spell=64309, -4.5002, 16.5, 11.9998, 72.7
Glyph of Sprint, https://wotlkdb.com/?spell=57133, -4.5213, 21.125, 16.6037, 78.6
Glyph of Slice and Dice, https://wotlkdb.com/?spell=57132, -4.5251, 15.525, 10.9999, 70.9
Midnight Ink, https://wotlkdb.com/?spell=53462, -4.55, 12, 7.45, 62.1
Mystic Tome, https://wotlkdb.com/?spell=58565, -5.1676, 15.1675, 9.9999, 65.9
Armor Vellum, https://wotlkdb.com/?spell=52739, -5.2529, 5.8029, 0.55, 9.5
Glyph of Righteous Defense, https://wotlkdb.com/?spell=57032, -5.2873, 15.2873, 10, 65.4
Glyph of Aimed Shot, https://wotlkdb.com/?spell=56994, -5.2874, 15.2873, 9.9999, 65.4
Glyph of Explosive Trap, https://wotlkdb.com/?spell=64253, -5.2875, 15.2873, 9.9998, 65.4
Glyph of Aspect of the Viper, https://wotlkdb.com/?spell=56998, -5.5001, 16.5, 10.9999, 66.7
Glyph of Cleaving, https://wotlkdb.com/?spell=57154, -5.525, 15.525, 10, 64.4
Glyph of Sinister Strike, https://wotlkdb.com/?spell=57131, -5.5251, 15.525, 9.9999, 64.4
Glyph of Starfire, https://wotlkdb.com/?spell=56959, -5.5252, 15.525, 9.9998, 64.4
Scroll of Recall, https://wotlkdb.com/?spell=48248, -5.7903, 5.8014, 0.0111, 0.2
Glyph of Hymn of Hope, https://wotlkdb.com/?spell=64283, -5.8502, 12.45, 6.5998, 53
Glyph of Chain Lightning, https://wotlkdb.com/?spell=57233, -5.8726, 16.5, 10.6274, 64.4
Glyph of Dark Death, https://wotlkdb.com/?spell=64266, -6.125, 21.125, 15, 71
Glyph of Exorcism, https://wotlkdb.com/?spell=57025, -6.1251, 21.125, 14.9999, 71
Glyph of Icy Touch, https://wotlkdb.com/?spell=57219, -6.1252, 21.125, 14.9998, 71
Glyph of Mutilate, https://wotlkdb.com/?spell=64260, -6.1252, 21.125, 14.9998, 71
Glyph of Totem of Wrath, https://wotlkdb.com/?spell=64262, -6.1253, 21.125, 14.9997, 71
Glyph of Mana Gem, https://wotlkdb.com/?spell=56985, -6.1258, 21.125, 14.9992, 71
Armor Vellum II, https://wotlkdb.com/?spell=59499, -6.425, 15.425, 9, 58.3
Glyph of Evasion, https://wotlkdb.com/?spell=57119, -6.4515, 7.4515, 1, 13.4
Scroll of Stamina II, https://wotlkdb.com/?spell=50612, -6.4715, 7.4515, 0.98, 13.2
Glyph of Hurricane, https://wotlkdb.com/?spell=56946, -6.4903, 16.5, 10.0097, 60.7
Glyph of Inner Fire, https://wotlkdb.com/?spell=57188, -6.4977, 16.5125, 10.0148, 60.6
Glyph of Remove Curse, https://wotlkdb.com/?spell=56988, -6.5, 16.5, 10, 60.6
Glyph of Anti-Magic Shell, https://wotlkdb.com/?spell=57207, -6.5, 16.5, 10, 60.6
Glyph of Mirror Image, https://wotlkdb.com/?spell=64314, -6.5006, 16.5, 9.9994, 60.6
Scroll of Intellect II, https://wotlkdb.com/?spell=50598, -6.5015, 7.4515, 0.95, 12.7
Glyph of Arcane Shot, https://wotlkdb.com/?spell=56995, -6.502, 16.5015, 9.9995, 60.6
Glyph of Backstab, https://wotlkdb.com/?spell=57114, -6.5115, 7.4515, 0.94, 12.6
Glyph of Lightning Bolt, https://wotlkdb.com/?spell=57245, -6.5125, 16.5125, 10, 60.6
Glyph of Fire Nova, https://wotlkdb.com/?spell=57238, -6.5126, 16.5125, 9.9999, 60.6
Glyph of Death Coil, https://wotlkdb.com/?spell=57261, -6.5251, 16.5, 9.9749, 60.5
Glyph of Shocking, https://wotlkdb.com/?spell=57235, -6.55, 16.5, 9.95, 60.3
