Scroll of Recall II, https://wotlkdb.com/?spell=60336, -1.0125, 4.0125, 3, 74.8
Glyph of Deadly Throw, https://wotlkdb.com/?spell=57117, -1.1002, 17.5, 16.3998, 93.7
Darkflame Ink, https://wotlkdb.com/?spell=57714, -1.11, 4.88, 3.77, 77.3
Tome of the Dawn, https://wotlkdb.com/?spell=59475, -1.3, 14.85, 13.55, 91.2
Glyph of Vampiric Blood, https://wotlkdb.com/?spell=57227, -1.4495, 15.4495, 14, 90.6
Glyph of Hex, https://wotlkdb.com/?spell=64316, -1.5003, 17.5, 15.9997, 91.4
Armor Vellum II, https://wotlkdb.com/?spell=59499, -1.525, 4.025, 2.5, 62.1
Glyph of Taunt, https://wotlkdb.com/?spell=57169, -1.6, 17.5, 15.9, 90.9
Glyph of Imp, https://wotlkdb.com/?spell=57269, -1.6826, 5.0125, 3.3299, 66.4
Glyph of Ice Armor, https://wotlkdb.com/?spell=56978, -1.8015, 9.8515, 8.05, 81.7
Scroll of Strength, https://wotlkdb.com/?spell=58484, -1.8528, 2.0013, 0.1485, 7.4
Glyph of Backstab, https://wotlkdb.com/?spell=57114, -1.9015, 9.8515, 7.95, 80.7
Glyph of Corruption, https://wotlkdb.com/?spell=57259, -1.9015, 9.8515, 7.95, 80.7
Scroll of Agility, https://wotlkdb.com/?spell=58472, -1.9864, 2.0013, 0.0149, 0.7
Glyph of Deterrence, https://wotlkdb.com/?spell=57000, -1.9926, 4.0125, 2.0199, 50.3
Glyph of Fear Ward, https://wotlkdb.com/?spell=57185, -2.125, 5.125, 3, 58.5
Glyph of Demonic Circle, https://wotlkdb.com/?spell=64317, -2.48, 17.5, 15.02, 85.8
Glyph of the Beast, https://wotlkdb.com/?spell=56996, -2.5, 17.5, 15, 85.7
Glyph of Snake Trap, https://wotlkdb.com/?spell=57010, -2.5, 17.5, 15, 85.7
Glyph of Searing Pain, https://wotlkdb.com/?spell=57270, -2.5351, 4.125, 1.5899, 38.5
Fiery Ink, https://wotlkdb.com/?spell=57710, -2.76, 3.6, 0.84, 23.3
Shimmering Ink, https://wotlkdb.com/?spell=57711, -2.9266, 7.9266, 5, 63.1
Glyph of Wrath, https://wotlkdb.com/?spell=56963, -2.9515, 9.8515, 6.9, 70
Lion's Ink, https://wotlkdb.com/?spell=57704, -3, 8, 5, 62.5
Glyph of Barbaric Insults, https://wotlkdb.com/?spell=57151, -3.135, 4.125, 0.99, 24
Scroll of Strength IV, https://wotlkdb.com/?spell=58487, -3.32, 4.25, 0.93, 21.9
Stormbound Tome, https://wotlkdb.com/?spell=59493, -3.4258, 78.4258, 75, 95.6
Glyph of Unstable Affliction, https://wotlkdb.com/?spell=57276, -3.5008, 17.5, 13.9992, 80
Glyph of Shadow Word: Pain, https://wotlkdb.com/?spell=57192, -3.5495, 15.4495, 11.9, 77
Glyph of Fear, https://wotlkdb.com/?spell=57262, -3.5592, 5.0125, 1.4533, 29
Glyph of Slice and Dice, https://wotlkdb.com/?spell=57132, -3.9255, 4.125, 0.1995, 4.8
Glyph of Divinity, https://wotlkdb.com/?spell=57031, -4.0125, 5.0125, 1, 20
Glyph of Soulstone, https://wotlkdb.com/?spell=57274, -4.025, 4.125, 0.1, 2.4
Glyph of Bone Shield, https://wotlkdb.com/?spell=57210, -4.125, 5.125, 1, 19.5
Scroll of Intellect IV, https://wotlkdb.com/?spell=50600, -4.13, 4.25, 0.12, 2.8
Glyph of Freezing Trap, https://wotlkdb.com/?spell=57002, -4.1451, 5.125, 0.9799, 19.1
Scroll of Spirit V, https://wotlkdb.com/?spell=50608, -4.1825, 5.25, 1.0675, 20.3
Scroll of Agility IV, https://wotlkdb.com/?spell=58478, -4.2126, 4.25, 0.0374, 0.9
Scroll of Spirit IV, https://wotlkdb.com/?spell=50607, -4.22, 4.25, 0.03, 0.7
Scroll of Stamina V, https://wotlkdb.com/?spell=50617, -4.2248, 5.25, 1.0252, 19.5
Scroll of Stamina IV, https://wotlkdb.com/?spell=50616, -4.2332, 4.25, 0.0168, 0.4
Scroll of Stamina VI, https://wotlkdb.com/?spell=50618, -4.5, 5.25, 0.75, 14.3
Snowfall Ink, https://wotlkdb.com/?spell=57716, -4.61, 14.56, 9.95, 68.3
Armor Vellum, https://wotlkdb.com/?spell=52739, -4.7034, 5.7434, 1.04, 18.1
Glyph of Succubus, https://wotlkdb.com/?spell=57275, -4.7732, 15.4495, 10.6763, 69.1
Scroll of Recall, https://wotlkdb.com/?spell=48248, -4.8061, 5.7419, 0.9358, 16.3
Glyph of Expose Armor, https://wotlkdb.com/?spell=57121, -4.8125, 5.0125, 0.2, 4
Scroll of Spirit VI, https://wotlkdb.com/?spell=50609, -4.85, 5.25, 0.4, 7.6
Glyph of Spiritual Attunement, https://wotlkdb.com/?spell=57022, -4.8515, 9.8515, 5, 50.8
Glyph of Claw, https://wotlkdb.com/?spell=67600, -4.8515, 9.8515, 5, 50.8
Glyph of Rapid Charge, https://wotlkdb.com/?spell=57162, -4.8516, 9.8515, 4.9999, 50.8
Glyph of Lightning Shield, https://wotlkdb.com/?spell=57246, -4.8715, 9.8515, 4.98, 50.6
Scroll of Agility V, https://wotlkdb.com/?spell=58480, -5.2, 5.25, 0.05, 1
Scroll of Intellect V, https://wotlkdb.com/?spell=50601, -5.2001, 5.25, 0.0499, 1
Scroll of Strength V, https://wotlkdb.com/?spell=58488, -5.225, 5.25, 0.025, 0.5
Armor Vellum III, https://wotlkdb.com/?spell=59500, -5.2727, 18, 12.7273, 70.7
Glyph of Seal of Command, https://wotlkdb.com/?spell=57033, -5.4495, 15.4495, 10, 64.7
Glyph of Unholy Blight, https://wotlkdb.com/?spell=64299, -5.4995, 15.4495, 9.95, 64.4
Glyph of Healthstone, https://wotlkdb.com/?spell=57266, -5.8516, 9.8515, 3.9999, 40.6
Glyph of Renew, https://wotlkdb.com/?spell=57197, -6.0125, 15.0125, 9, 60
Glyph of Ice Lance, https://wotlkdb.com/?spell=56980, -6.5, 17.5, 11, 62.9
Glyph of Insect Swarm, https://wotlkdb.com/?spell=56948, -7.0625, 15.0125, 7.95, 53
Glyph of Avenging Wrath, https://wotlkdb.com/?spell=57021, -7.4995, 17.5, 10.0005, 57.1
Glyph of Fire Elemental Totem, https://wotlkdb.com/?spell=57237, -7.5, 17.5, 10, 57.1
Glyph of Focus, https://wotlkdb.com/?spell=62162, -7.5, 17.5, 10, 57.1
Glyph of the Hawk, https://wotlkdb.com/?spell=57006, -7.5001, 17.5, 9.9999, 57.1
Mystic Tome, https://wotlkdb.com/?spell=58565, -7.8865, 22.8865, 15, 65.5
Glyph of Arcane Power, https://wotlkdb.com/?spell=56972, -8.3795, 15.4495, 7.07, 45.8
Glyph of Intervene, https://wotlkdb.com/?spell=57159, -8.5, 17.5, 9, 51.4
Glyph of Blade Flurry, https://wotlkdb.com/?spell=57115, -8.5001, 17.5, 8.9999, 51.4
Glyph of Evasion, https://wotlkdb.com/?spell=57119, -9.2515, 9.8515, 0.6, 6.1
Scroll of Agility II, https://wotlkdb.com/?spell=58473, -9.3615, 9.8515, 0.49, 5
Scroll of Strength II, https://wotlkdb.com/?spell=58485, -9.3615, 9.8515, 0.49, 5
Glyph of Crippling Poison, https://wotlkdb.com/?spell=57116, -9.5, 17.5, 8, 45.7
Scroll of Intellect II, https://wotlkdb.com/?spell=50598, -9.5515, 9.8515, 0.3, 3
Scroll of Stamina II, https://wotlkdb.com/?spell=50612, -9.598, 9.8515, 0.2535, 2.6
Scroll of Spirit II, https://wotlkdb.com/?spell=50605, -9.6165, 9.8515, 0.235, 2.4
Glyph of Blood Strike, https://wotlkdb.com/?spell=59339, -9.697, 15.4495, 5.7525, 37.2
Glyph of Psychic Scream, https://wotlkdb.com/?spell=57196, -9.747, 9.8515, 0.1045, 1.1
Glyph of Rebirth, https://wotlkdb.com/?spell=56953, -10.0125, 15.0125, 5, 33.3
Glyph of Evocation, https://wotlkdb.com/?spell=56974, -10.0125, 15.0125, 5, 33.3
Glyph of Multi-Shot, https://wotlkdb.com/?spell=57007, -10.0126, 15.0125, 4.9999, 33.3
Glyph of Rapid Fire, https://wotlkdb.com/?spell=57008, -10.4495, 15.4495, 5, 32.4
Glyph of Cleansing, https://wotlkdb.com/?spell=57020, -11.0125, 15.0125, 4, 26.6
Glyph of Revenge, https://wotlkdb.com/?spell=57165, -11.4325, 15.0125, 3.58, 23.8
Glyph of Ambush, https://wotlkdb.com/?spell=57113, -11.4396, 15.4495, 4.0099, 26
Glyph of Hymn of Hope, https://wotlkdb.com/?spell=64283, -11.4496, 15.4495, 3.9999, 25.9
Glyph of Rake, https://wotlkdb.com/?spell=56952, -11.5695, 15.4495, 3.88, 25.1
Glyph of Lava Lash, https://wotlkdb.com/?spell=57249, -11.99, 15.0125, 3.0225, 20.1
Scroll of Agility III, https://wotlkdb.com/?spell=58476, -12.045, 15.025, 2.98, 19.8
Scroll of Stamina III, https://wotlkdb.com/?spell=50614, -12.065, 15.025, 2.96, 19.7
Book of Clever Tricks, https://wotlkdb.com/?spell=59496, -12.4685, 72.4685, 60, 82.8
Glyph of Unbreakable Armor, https://wotlkdb.com/?spell=57226, -12.4695, 15.4495, 2.98, 19.3
Glyph of Sap, https://wotlkdb.com/?spell=57129, -12.9925, 15.0125, 2.02, 13.5
Glyph of Voidwalker, https://wotlkdb.com/?spell=57277, -13.0125, 15.0125, 2, 13.3
Glyph of Feint, https://wotlkdb.com/?spell=57122, -13.0845, 15.0745, 1.99, 13.2
Scroll of Strength III, https://wotlkdb.com/?spell=58486, -13.0946, 15.025, 1.9304, 12.8
Glyph of Scourge Strike, https://wotlkdb.com/?spell=57224, -13.5295, 15.4495, 1.92, 12.4
Glyph of Frost Shock, https://wotlkdb.com/?spell=57241, -14.0225, 15.0125, 0.99, 6.6
Glyph of Shadow Bolt, https://wotlkdb.com/?spell=57271, -14.0425, 15.0125, 0.97, 6.5
Scroll of Spirit III, https://wotlkdb.com/?spell=50606, -14.125, 15.025, 0.9, 6
Book of Survival, https://wotlkdb.com/?spell=59478, -14.25, 14.85, 0.6, 4
Glyph of Hurricane, https://wotlkdb.com/?spell=56946, -14.5, 17.5, 3, 17.1
Scroll of Agility VI, https://wotlkdb.com/?spell=58481, -14.7988, 15.1995, 0.4007, 2.6
Scroll of Intellect III, https://wotlkdb.com/?spell=50599, -14.845, 15.025, 0.18, 1.2
Scroll of Recall III, https://wotlkdb.com/?spell=60337, -15.04, 17.5, 2.46, 14.1
Scroll of Intellect VI, https://wotlkdb.com/?spell=50602, -15.1495, 15.1995, 0.05, 0.3
Scroll of Strength VI, https://wotlkdb.com/?spell=58489, -15.1758, 15.1995, 0.0237, 0.2
Glyph of Frost Trap, https://wotlkdb.com/?spell=57003, -15.2395, 15.4495, 0.21, 1.4
Glyph of Mind Control, https://wotlkdb.com/?spell=57191, -15.5, 17.5, 2, 11.4
Scroll of Spirit VIII, https://wotlkdb.com/?spell=50611, -15.926, 18, 2.074, 11.5
Scroll of Stamina VIII, https://wotlkdb.com/?spell=50620, -17, 18, 1, 5.6
Scroll of Agility VIII, https://wotlkdb.com/?spell=58483, -17.0542, 18, 0.9458, 5.3
Scroll of Intellect VIII, https://wotlkdb.com/?spell=50604, -17.06, 18, 0.94, 5.2
Glyph of Strangulate, https://wotlkdb.com/?spell=57225, -17.1, 17.5, 0.4, 2.3
Royal Guide of Escape Routes, https://wotlkdb.com/?spell=59486, -17.283, 33.283, 16, 48.1
Scroll of Stamina VII, https://wotlkdb.com/?spell=50619, -17.803, 18, 0.197, 1.1
Scroll of Strength VIII, https://wotlkdb.com/?spell=58491, -17.82, 18, 0.18, 1
Scroll of Agility VII, https://wotlkdb.com/?spell=58482, -17.9325, 18, 0.0675, 0.4
Scroll of Strength VII, https://wotlkdb.com/?spell=58490, -17.9501, 18, 0.0499, 0.3
Scroll of Spirit VII, https://wotlkdb.com/?spell=50610, -17.963, 18, 0.037, 0.2
Scroll of Intellect VII, https://wotlkdb.com/?spell=50603, -17.973, 18, 0.027, 0.2
Weapon Vellum, https://wotlkdb.com/?spell=52840, -19.553, 29.553, 10, 33.8
Celestial Ink, https://wotlkdb.com/?spell=57709, -20, 24, 4, 16.7
Tome of Kings, https://wotlkdb.com/?spell=59484, -20.283, 33.283, 13, 39.1
Weapon Vellum III, https://wotlkdb.com/?spell=59501, -22, 52, 30, 57.7
Twilight Tome, https://wotlkdb.com/?spell=64053, -29.3334, 129.3334, 100, 77.3
Manual of Clouds, https://wotlkdb.com/?spell=59494, -59.5508, 79.5508, 20, 25.1
