Name, Link, Profit, Cost, Sell, ROI %
Rituals of the New Moon, https://wotlkdb.com/?spell=64051, 2333.75, 164.25, 2498, 1520.9
Book of Stars, https://wotlkdb.com/?spell=59490, 375.2505, 25.6995, 400.95, 1560.1
Faces of Doom, https://wotlkdb.com/?spell=59498, 176.3, 163.7, 340, 207.7
Iron-bound Tome, https://wotlkdb.com/?spell=59497, 160.1765, 163.7, 323.8765, 197.8
Glyph of Enduring Victory, https://wotlkdb.com/?spell=58347, 78.5264, 12.5, 91.0264, 728.2
Glyph of Typhoon, https://wotlkdb.com/?spell=56965, 57.9953, 14.35, 72.3453, 504.1
Glyph of Soul Link, https://wotlkdb.com/?spell=64250, 53.7293, 9.5003, 63.2296, 665.6
Glyph of Resonating Power, https://wotlkdb.com/?spell=57164, 52.1553, 14.35, 66.5053, 463.5
Glyph of Deadly Throw, https://wotlkdb.com/?spell=57117, 50.0592, 14.35, 64.4092, 448.8
Twilight Tome, https://wotlkdb.com/?spell=64053, 37.75, 106.25, 144, 135.5
Glyph of Fire Blast, https://wotlkdb.com/?spell=57719, 31.4428, 14.35, 45.7928, 319.1
Certificate of Ownership, https://wotlkdb.com/?spell=59387, 28.5374, 21.4625, 49.9999, 233
Tome of Kings, https://wotlkdb.com/?spell=59484, 24.2505, 30.7495, 55, 178.9
Glyph of Hex, https://wotlkdb.com/?spell=64316, 22.5964, 14.35, 36.9464, 257.5
Glyph of Hammer of Wrath, https://wotlkdb.com/?spell=57028, 20.9254, 14.35, 35.2754, 245.8
Shimmering Ink, https://wotlkdb.com/?spell=57711, 17.3326, 4.8674, 22.2, 456.1
Glyph of Hurricane, https://wotlkdb.com/?spell=56946, 15.0218, 14.35, 29.3718, 204.7
Glyph of Deep Freeze, https://wotlkdb.com/?spell=64274, 14.9199, 12.5, 27.4199, 219.4
Glyph of Scatter Shot, https://wotlkdb.com/?spell=64249, 11.8078, 9.5003, 21.3081, 224.3
Glyph of Blurred Speed, https://wotlkdb.com/?spell=58323, 11.0956, 7.4515, 18.5471, 248.9
Glyph of Fading, https://wotlkdb.com/?spell=58317, 9.8053, 7.4515, 17.2568, 231.6
Glyph of Distract, https://wotlkdb.com/?spell=58324, 9.7393, 9.5113, 19.2506, 202.4
Glyph of Lay on Hands, https://wotlkdb.com/?spell=58313, 9.4253, 7.4515, 16.8768, 226.5
Glyph of Arcane Intellect, https://wotlkdb.com/?spell=58303, 9.3691, 7.4515, 16.8206, 225.7
Glyph of Possessed Strength, https://wotlkdb.com/?spell=58300, 9.1762, 7.4515, 16.6277, 223.1
Glyph of Frost Ward, https://wotlkdb.com/?spell=58307, 9.1219, 9.5113, 18.6332, 195.9
Glyph of Pick Lock, https://wotlkdb.com/?spell=58325, 8.7998, 9.5003, 18.3001, 192.6
Glyph of Slow Fall, https://wotlkdb.com/?spell=58308, 8.6832, 7.4515, 16.1347, 216.5
Glyph of Healing Wave, https://wotlkdb.com/?spell=57243, 8.4957, 14.35, 22.8457, 159.2
Glyph of Battle, https://wotlkdb.com/?spell=58342, 8.4249, 7.4515, 15.8764, 213.1
Glyph of Frostbolt, https://wotlkdb.com/?spell=56977, 8.3829, 14.35, 22.7329, 158.4
Glyph of Unending Breath, https://wotlkdb.com/?spell=58336, 8.3762, 9.5003, 17.8765, 188.2
Warrior Glyph 21, https://wotlkdb.com/?spell=57173, 8.3209, 3.679, 11.9999, 326.2
Warrior Glyph 22, https://wotlkdb.com/?spell=57174, 8.3209, 3.679, 11.9999, 326.2
Warrior Glyph 23, https://wotlkdb.com/?spell=57175, 8.3209, 3.679, 11.9999, 326.2
Warrior Glyph 25, https://wotlkdb.com/?spell=57176, 8.3209, 3.679, 11.9999, 326.2
Warrior Glyph 24, https://wotlkdb.com/?spell=57180, 8.3209, 3.679, 11.9999, 326.2
Death Knight Glyph 25, https://wotlkdb.com/?spell=57231, 8.3209, 3.679, 11.9999, 326.2
Glyph of Blessing of Wisdom, https://wotlkdb.com/?spell=58312, 7.8145, 7.4515, 15.266, 204.9
Glyph of Shackle Undead, https://wotlkdb.com/?spell=58320, 7.7954, 9.5003, 17.2957, 182.1
Glyph of Charge, https://wotlkdb.com/?spell=58344, 7.7723, 7.4515, 15.2238, 204.3
Glyph of Mend Pet, https://wotlkdb.com/?spell=58301, 7.7057, 7.4515, 15.1572, 203.4
Glyph of Invisibility, https://wotlkdb.com/?spell=56983, 7.6156, 14.35, 21.9656, 153.1
Glyph of the Wild, https://wotlkdb.com/?spell=58296, 7.6068, 7.4515, 15.0583, 202.1
Glyph of Drain Soul, https://wotlkdb.com/?spell=58337, 7.5992, 7.4515, 15.0507, 202
Glyph of Fortitude, https://wotlkdb.com/?spell=58318, 7.5775, 7.4515, 15.029, 201.7
Glyph of Thorns, https://wotlkdb.com/?spell=58289, 7.5629, 7.4515, 15.0144, 201.5
Glyph of Blessing of Might, https://wotlkdb.com/?spell=58314, 7.5595, 7.4515, 15.011, 201.4
Glyph of Thunder Clap, https://wotlkdb.com/?spell=58346, 7.5538, 7.4515, 15.0053, 201.4
Glyph of Revive Pet, https://wotlkdb.com/?spell=58299, 7.5485, 7.4515, 15, 201.3
Glyph of Bloodrage, https://wotlkdb.com/?spell=58343, 7.5485, 7.4515, 15, 201.3
Glyph of Life Tap, https://wotlkdb.com/?spell=64248, 7.5485, 7.4515, 15, 201.3
Glyph of Scare Beast, https://wotlkdb.com/?spell=58298, 7.5484, 7.4515, 14.9999, 201.3
Glyph of Pick Pocket, https://wotlkdb.com/?spell=58326, 7.5484, 7.4515, 14.9999, 201.3
Glyph of the Penguin, https://wotlkdb.com/?spell=58310, 7.5479, 7.4515, 14.9994, 201.3
Glyph of Stoneclaw Totem, https://wotlkdb.com/?spell=64247, 7.5477, 7.4515, 14.9992, 201.3
Glyph of Kilrogg, https://wotlkdb.com/?spell=58340, 7.5223, 9.5113, 17.0336, 179.1
Glyph of Fire Ward, https://wotlkdb.com/?spell=58305, 7.0065, 9.5003, 16.5068, 173.8
Glyph of Unburdened Rebirth, https://wotlkdb.com/?spell=58288, 6.5479, 9.5003, 16.0482, 168.9
Glyph of Trueshot Aura, https://wotlkdb.com/?spell=57012, 6.4993, 14.35, 20.8493, 145.3
Glyph of Siphon Life, https://wotlkdb.com/?spell=57273, 6.4579, 14.35, 20.8079, 145
Glyph of Sense Undead, https://wotlkdb.com/?spell=58315, 6.2524, 9.5003, 15.7527, 165.8
Glyph of Shield Wall, https://wotlkdb.com/?spell=64252, 5.9472, 9.5113, 15.4585, 162.5
Glyph of Blessing of Kings, https://wotlkdb.com/?spell=58311, 5.7274, 9.5003, 15.2277, 160.3
Glyph of Raise Dead, https://wotlkdb.com/?spell=57228, 5.6813, 12.125, 17.8063, 146.9
Glyph of Mocking Blow, https://wotlkdb.com/?spell=58345, 5.665, 9.5003, 15.1653, 159.6
Glyph of Power Word: Shield, https://wotlkdb.com/?spell=57194, 5.5484, 7.4515, 12.9999, 174.5
Glyph of Frost Armor, https://wotlkdb.com/?spell=58306, 5.5484, 7.4515, 12.9999, 174.5
Glyph of Vanish, https://wotlkdb.com/?spell=58328, 5.5242, 9.5113, 15.0355, 158.1
Glyph of Aquatic Form, https://wotlkdb.com/?spell=58286, 5.4997, 9.5003, 15, 157.9
Glyph of Water Shield, https://wotlkdb.com/?spell=58332, 5.4997, 9.5003, 15, 157.9
Glyph of Ghost Wolf, https://wotlkdb.com/?spell=59326, 5.4997, 9.5003, 15, 157.9
Glyph of Eviscerate, https://wotlkdb.com/?spell=57120, 5.4886, 9.5113, 14.9999, 157.7
Glyph of Rending, https://wotlkdb.com/?spell=57163, 5.4886, 9.5113, 14.9999, 157.7
Glyph of Salvation, https://wotlkdb.com/?spell=64251, 5.4886, 9.5113, 14.9999, 157.7
Glyph of Flash Heal, https://wotlkdb.com/?spell=57186, 5.4885, 9.5113, 14.9998, 157.7
Glyph of Arcane Missiles, https://wotlkdb.com/?spell=56971, 5.4787, 9.5113, 14.99, 157.6
Glyph of Holy Wrath, https://wotlkdb.com/?spell=59559, 5.4505, 14.35, 19.8005, 138
Glyph of Judgement, https://wotlkdb.com/?spell=57030, 5.131, 9.5113, 14.6423, 153.9
Glyph of Rejuvenation, https://wotlkdb.com/?spell=56955, 5.0984, 7.4515, 12.5499, 168.4
Celestial Ink, https://wotlkdb.com/?spell=57709, 4.725, 6, 10.725, 178.8
Glyph of Mind Control, https://wotlkdb.com/?spell=57191, 4.7038, 14.35, 19.0538, 132.8
Glyph of Swiftmend, https://wotlkdb.com/?spell=56960, 4.65, 14.35, 19, 132.4
Glyph of Heroic Strike, https://wotlkdb.com/?spell=57158, 4.5385, 7.4515, 11.99, 160.9
Glyph of Moonfire, https://wotlkdb.com/?spell=56951, 4.5112, 9.5113, 14.0225, 147.4
Glyph of Water Breathing, https://wotlkdb.com/?spell=58331, 4.4887, 9.5113, 14, 147.2
Glyph of Safe Fall, https://wotlkdb.com/?spell=58327, 4.4635, 10.7375, 15.201, 141.6
Glyph of Rupture, https://wotlkdb.com/?spell=57128, 4.2675, 14.35, 18.6175, 129.7
Glyph of Rip, https://wotlkdb.com/?spell=56956, 4.2554, 10.7375, 14.9929, 139.6
Glyph of Vigilance, https://wotlkdb.com/?spell=64255, 4.2522, 10.7375, 14.9897, 139.6
Glyph of the Pack, https://wotlkdb.com/?spell=58297, 4.2119, 10.7375, 14.9494, 139.2
Glyph of Pestilence, https://wotlkdb.com/?spell=57230, 4.1699, 12.125, 16.2949, 134.4
Glyph of Ice Barrier, https://wotlkdb.com/?spell=64257, 4.1498, 10.85, 14.9998, 138.2
Glyph of Eternal Water, https://wotlkdb.com/?spell=71101, 4.0729, 12.5, 16.5729, 132.6
Glyph of Horn of Winter, https://wotlkdb.com/?spell=57217, 3.9865, 12.5, 16.4865, 131.9
Glyph of Holy Light, https://wotlkdb.com/?spell=57029, 3.934, 9.5113, 13.4453, 141.4
Glyph of Cloak of Shadows, https://wotlkdb.com/?spell=64303, 3.9265, 12.5, 16.4265, 131.4
Ink of the Sea, https://wotlkdb.com/?spell=57715, 3.85, 10, 13.85, 138.5
Glyph of Hemorrhage, https://wotlkdb.com/?spell=57126, 3.7872, 14.35, 18.1372, 126.4
Lion's Ink, https://wotlkdb.com/?spell=57704, 3.6788, 5.82, 9.4988, 163.2
Glyph of Healing Stream Totem, https://wotlkdb.com/?spell=57242, 3.5924, 10.85, 14.4424, 133.1
Glyph of Fan of Knives, https://wotlkdb.com/?spell=64315, 3.5268, 14.35, 17.8768, 124.6
Glyph of Mending, https://wotlkdb.com/?spell=56997, 3.4887, 9.5113, 13, 136.7
Glyph of Rune Strike, https://wotlkdb.com/?spell=57223, 3.2999, 14.35, 17.6499, 123
Glyph of Anti-Magic Shell, https://wotlkdb.com/?spell=57207, 3.2557, 14.35, 17.6057, 122.7
Glyph of Holy Shock, https://wotlkdb.com/?spell=64254, 3.2523, 10.7375, 13.9898, 130.3
Glyph of Shadow Protection, https://wotlkdb.com/?spell=58321, 3.251, 15.0025, 18.2535, 121.7
Glyph of Starfall, https://wotlkdb.com/?spell=56958, 3.1764, 14.35, 17.5264, 122.1
Glyph of Disengage, https://wotlkdb.com/?spell=57001, 3.15, 10.85, 14, 129
Glyph of Barkskin, https://wotlkdb.com/?spell=64256, 3.15, 10.85, 14, 129
Glyph of Consecration, https://wotlkdb.com/?spell=57023, 3.1499, 10.85, 13.9999, 129
Glyph of Killing Spree, https://wotlkdb.com/?spell=64285, 3.1286, 12.5, 15.6286, 125
Glyph of Shocking, https://wotlkdb.com/?spell=57235, 3.119, 14.35, 17.469, 121.7
Glyph of Crippling Poison, https://wotlkdb.com/?spell=57116, 3.0076, 14.35, 17.3576, 121
Glyph of Curse of Exhaustion, https://wotlkdb.com/?spell=58338, 3.0074, 15.0025, 18.0099, 120
Glyph of Souls, https://wotlkdb.com/?spell=58341, 2.9401, 14.35, 17.2901, 120.5
Glyph of Death's Embrace, https://wotlkdb.com/?spell=57215, 2.875, 12.125, 15, 123.7
Glyph of Corpse Explosion, https://wotlkdb.com/?spell=57229, 2.8749, 12.125, 14.9999, 123.7
Glyph of Flash of Light, https://wotlkdb.com/?spell=57026, 2.8249, 12.125, 14.9499, 123.3
Glyph of Dispersion, https://wotlkdb.com/?spell=64280, 2.8096, 12.5, 15.3096, 122.5
Glyph of Heart Strike, https://wotlkdb.com/?spell=57208, 2.7567, 14.35, 17.1067, 119.2
Glyph of Wyvern Sting, https://wotlkdb.com/?spell=57014, 2.6852, 14.35, 17.0352, 118.7
Glyph of Steady Shot, https://wotlkdb.com/?spell=57011, 2.6536, 14.35, 17.0036, 118.5
Glyph of Feral Spirit, https://wotlkdb.com/?spell=64288, 2.5803, 12.5, 15.0803, 120.6
Glyph of Frost Nova, https://wotlkdb.com/?spell=56976, 2.5485, 7.4515, 10, 134.2
Glyph of Serpent Sting, https://wotlkdb.com/?spell=57009, 2.5485, 7.4515, 10, 134.2
Glyph of Corruption, https://wotlkdb.com/?spell=57259, 2.5485, 7.4515, 10, 134.2
Glyph of Raptor Strike, https://wotlkdb.com/?spell=64246, 2.5485, 7.4515, 10, 134.2
Glyph of Hunter's Mark, https://wotlkdb.com/?spell=57004, 2.5484, 7.4515, 9.9999, 134.2
Glyph of Explosive Shot, https://wotlkdb.com/?spell=64273, 2.5379, 12.5, 15.0379, 120.3
Glyph of Flame Shock, https://wotlkdb.com/?spell=57239, 2.5235, 7.4515, 9.975, 133.9
Glyph of Blood Tap, https://wotlkdb.com/?spell=57209, 2.5031, 12.5, 15.0031, 120
Glyph of Haunt, https://wotlkdb.com/?spell=64291, 2.4999, 12.5, 14.9999, 120
Glyph of Dancing Rune Weapon, https://wotlkdb.com/?spell=64297, 2.4999, 12.5, 14.9999, 120
Glyph of Metamorphosis, https://wotlkdb.com/?spell=64318, 2.4999, 12.5, 14.9999, 120
Glyph of Vampiric Blood, https://wotlkdb.com/?spell=57227, 2.4998, 12.5, 14.9998, 120
Glyph of Living Bomb, https://wotlkdb.com/?spell=64275, 2.4998, 12.5, 14.9998, 120
Glyph of Hammer of the Righteous, https://wotlkdb.com/?spell=64278, 2.4998, 12.5, 14.9998, 120
Glyph of Divine Storm, https://wotlkdb.com/?spell=64279, 2.4997, 12.5, 14.9997, 120
Glyph of Penance, https://wotlkdb.com/?spell=64282, 2.4997, 12.5, 14.9997, 120
Glyph of Shadow Dance, https://wotlkdb.com/?spell=64286, 2.4997, 12.5, 14.9997, 120
Glyph of Bladestorm, https://wotlkdb.com/?spell=64295, 2.4997, 12.5, 14.9997, 120
Glyph of Hunger for Blood, https://wotlkdb.com/?spell=64284, 2.4996, 12.5, 14.9996, 120
Glyph of Shockwave, https://wotlkdb.com/?spell=64296, 2.4996, 12.5, 14.9996, 120
Glyph of Howling Blast, https://wotlkdb.com/?spell=64300, 2.4994, 12.5, 14.9994, 120
Glyph of Hammer of Justice, https://wotlkdb.com/?spell=57027, 2.4985, 7.4515, 9.95, 133.5
Glyph of the Ghoul, https://wotlkdb.com/?spell=57222, 2.4887, 12.5, 14.9887, 119.9
Glyph of Beacon of Light, https://wotlkdb.com/?spell=64277, 2.45, 12.5, 14.95, 119.6
Glyph of Chimera Shot, https://wotlkdb.com/?spell=64271, 2.4499, 12.5, 14.9499, 119.6
Glyph of Unholy Blight, https://wotlkdb.com/?spell=64299, 2.4498, 12.5, 14.9498, 119.6
Glyph of Wild Growth, https://wotlkdb.com/?spell=64270, 2.3498, 12.5, 14.8498, 118.8
Glyph of Renewed Life, https://wotlkdb.com/?spell=58330, 2.3275, 15.0025, 17.33, 115.5
Glyph of Sinister Strike, https://wotlkdb.com/?spell=57131, 2.15, 10.85, 13, 119.8
Glyph of Seal of Wisdom, https://wotlkdb.com/?spell=57035, 1.9581, 14.35, 16.3081, 113.6
Glyph of Plague Strike, https://wotlkdb.com/?spell=57221, 1.8749, 12.125, 13.9999, 115.5
Glyph of Felguard, https://wotlkdb.com/?spell=57263, 1.5805, 14.35, 15.9305, 111
Glyph of Innervate, https://wotlkdb.com/?spell=56947, 1.549, 14.35, 15.899, 110.8
Glyph of Death Strike, https://wotlkdb.com/?spell=59340, 1.5, 12.5, 14, 112
Glyph of Hungering Cold, https://wotlkdb.com/?spell=64298, 1.4995, 12.5, 13.9995, 112
Glyph of Fire Nova, https://wotlkdb.com/?spell=57238, 1.4887, 9.5113, 11, 115.7
Glyph of Icebound Fortitude, https://wotlkdb.com/?spell=57218, 1.4065, 14.35, 15.7565, 109.8
Glyph of Unstable Affliction, https://wotlkdb.com/?spell=57276, 1.4029, 14.35, 15.7529, 109.8
Glyph of Whirlwind, https://wotlkdb.com/?spell=57172, 1.3998, 12.5, 13.8998, 111.2
Glyph of Chaos Bolt, https://wotlkdb.com/?spell=64294, 1.3995, 12.5, 13.8995, 111.2
Glyph of Maul, https://wotlkdb.com/?spell=56961, 1.3185, 7.4515, 8.77, 117.7
Glyph of Bestial Wrath, https://wotlkdb.com/?spell=56999, 1.1741, 14.35, 15.5241, 108.2
Glyph of Lesser Healing Wave, https://wotlkdb.com/?spell=57244, 1.1725, 10.85, 12.0225, 110.8
Glyph of Blast Wave, https://wotlkdb.com/?spell=56990, 1.0788, 14.35, 15.4288, 107.5
Glyph of Chain Heal, https://wotlkdb.com/?spell=57232, 0.9861, 14.35, 15.3361, 106.9
Glyph of Water Elemental, https://wotlkdb.com/?spell=56989, 0.9845, 14.35, 15.3345, 106.9
Glyph of Blocking, https://wotlkdb.com/?spell=57152, 0.7864, 14.35, 15.1364, 105.5
Glyph of Devastate, https://wotlkdb.com/?spell=57155, 0.7424, 14.35, 15.0924, 105.2
Glyph of Mangle, https://wotlkdb.com/?spell=56950, 0.714, 14.35, 15.064, 105
Glyph of Shadow, https://wotlkdb.com/?spell=57193, 0.6724, 14.35, 15.0224, 104.7
Glyph of Prayer of Healing, https://wotlkdb.com/?spell=57195, 0.6636, 14.35, 15.0136, 104.6
Glyph of Molten Armor, https://wotlkdb.com/?spell=56986, 0.6627, 14.35, 15.0127, 104.6
Glyph of Command, https://wotlkdb.com/?spell=68166, 0.6612, 14.35, 15.0112, 104.6
Glyph of Vigor, https://wotlkdb.com/?spell=57130, 0.6573, 14.35, 15.0073, 104.6
Glyph of Fireball, https://wotlkdb.com/?spell=56975, 0.65, 14.35, 15, 104.5
Glyph of Volley, https://wotlkdb.com/?spell=57013, 0.65, 14.35, 15, 104.5
Glyph of Ghostly Strike, https://wotlkdb.com/?spell=57124, 0.65, 14.35, 15, 104.5
Glyph of Preparation, https://wotlkdb.com/?spell=57127, 0.65, 14.35, 15, 104.5
Glyph of Mortal Strike, https://wotlkdb.com/?spell=57160, 0.65, 14.35, 15, 104.5
Glyph of Taunt, https://wotlkdb.com/?spell=57169, 0.65, 14.35, 15, 104.5
Glyph of Circle of Healing, https://wotlkdb.com/?spell=57181, 0.65, 14.35, 15, 104.5
Glyph of Lightwell, https://wotlkdb.com/?spell=57189, 0.65, 14.35, 15, 104.5
Glyph of Death and Decay, https://wotlkdb.com/?spell=57214, 0.65, 14.35, 15, 104.5
Glyph of Lava, https://wotlkdb.com/?spell=57234, 0.65, 14.35, 15, 104.5
Glyph of Fire Elemental Totem, https://wotlkdb.com/?spell=57237, 0.65, 14.35, 15, 104.5
Glyph of Felhunter, https://wotlkdb.com/?spell=57264, 0.65, 14.35, 15, 104.5
Glyph of Shadowfiend, https://wotlkdb.com/?spell=58322, 0.65, 14.35, 15, 104.5
Glyph of Kill Shot, https://wotlkdb.com/?spell=64304, 0.65, 14.35, 15, 104.5
Glyph of Mind Sear, https://wotlkdb.com/?spell=64309, 0.65, 14.35, 15, 104.5
Glyph of Nourish, https://wotlkdb.com/?spell=64313, 0.65, 14.35, 15, 104.5
Glyph of Growl, https://wotlkdb.com/?spell=56944, 0.6499, 14.35, 14.9999, 104.5
Glyph of Seal of Light, https://wotlkdb.com/?spell=57034, 0.6499, 14.35, 14.9999, 104.5
Glyph of Last Stand, https://wotlkdb.com/?spell=57166, 0.6499, 14.35, 14.9999, 104.5
Glyph of Shadow Word: Death, https://wotlkdb.com/?spell=57199, 0.6499, 14.35, 14.9999, 104.5
Glyph of Thunderstorm, https://wotlkdb.com/?spell=57253, 0.6499, 14.35, 14.9999, 104.5
Glyph of Conflagrate, https://wotlkdb.com/?spell=57258, 0.6499, 14.35, 14.9999, 104.5
Glyph of Immolate, https://wotlkdb.com/?spell=57268, 0.6499, 14.35, 14.9999, 104.5
Glyph of Shadowflame, https://wotlkdb.com/?spell=64311, 0.6498, 14.35, 14.9998, 104.5
Glyph of Quick Decay, https://wotlkdb.com/?spell=71102, 0.6498, 14.35, 14.9998, 104.5
Glyph of Obliterate, https://wotlkdb.com/?spell=57220, 0.6494, 14.35, 14.9994, 104.5
Glyph of Seal of Vengeance, https://wotlkdb.com/?spell=59561, 0.6494, 14.35, 14.9994, 104.5
Glyph of Frostfire, https://wotlkdb.com/?spell=61677, 0.6494, 14.35, 14.9994, 104.5
Glyph of Divine Plea, https://wotlkdb.com/?spell=64305, 0.6487, 14.35, 14.9987, 104.5
Glyph of Remove Curse, https://wotlkdb.com/?spell=56988, 0.6, 14.35, 14.95, 104.2
Glyph of Tricks of the Trade, https://wotlkdb.com/?spell=64310, 0.5999, 14.35, 14.9499, 104.2
Glyph of Demonic Circle, https://wotlkdb.com/?spell=64317, 0.5999, 14.35, 14.9499, 104.2
Glyph of Savage Roar, https://wotlkdb.com/?spell=64307, 0.5998, 14.35, 14.9498, 104.2
Glyph of Dark Command, https://wotlkdb.com/?spell=57212, 0.5294, 14.35, 14.8794, 103.7
Scroll of Strength, https://wotlkdb.com/?spell=58484, 0.5185, 0.5015, 1.02, 203.4
Glyph of Thunder, https://wotlkdb.com/?spell=64287, 0.4999, 12.5, 12.9999, 104
Glyph of Arcane Shot, https://wotlkdb.com/?spell=56995, 0.4896, 9.5003, 9.9899, 105.2
Glyph of Lightning Bolt, https://wotlkdb.com/?spell=57245, 0.4887, 9.5113, 10, 105.1
Scroll of Spirit, https://wotlkdb.com/?spell=48116, 0.3885, 0.2515, 0.64, 254.5
Glyph of Earthliving Weapon, https://wotlkdb.com/?spell=57236, 0.3749, 12.125, 12.4999, 103.1
Glyph of Dash, https://wotlkdb.com/?spell=59315, 0.2019, 15.0025, 15.2044, 101.3
Glyph of Snake Trap, https://wotlkdb.com/?spell=57010, 0.1997, 14.35, 14.5497, 101.4
Glyph of Challenging Roar, https://wotlkdb.com/?spell=58287, 0.1768, 15.0025, 15.1793, 101.2
Glyph of Starfire, https://wotlkdb.com/?spell=56959, 0.16, 10.85, 11.01, 101.5
Scroll of Stamina, https://wotlkdb.com/?spell=45382, 0.1445, 0.2515, 0.396, 157.5
Glyph of Levitate, https://wotlkdb.com/?spell=58319, -0.0025, 15.0025, 15, 100
Glyph of Water Walking, https://wotlkdb.com/?spell=58333, -0.0025, 15.0025, 15, 100
Glyph of Righteous Defense, https://wotlkdb.com/?spell=57032, -0.0026, 15.0025, 14.9999, 100
Glyph of the Wise, https://wotlkdb.com/?spell=58316, -0.0026, 15.0025, 14.9999, 100
Glyph of Astral Recall, https://wotlkdb.com/?spell=58329, -0.0526, 15.0025, 14.9499, 99.6
Glyph of Feign Death, https://wotlkdb.com/?spell=58302, -0.0538, 15.0025, 14.9487, 99.6
Scroll of Agility, https://wotlkdb.com/?spell=58472, -0.0635, 0.5015, 0.438, 87.3
Snowfall Ink, https://wotlkdb.com/?spell=57716, -0.2, 10, 9.8, 98
Scroll of Intellect, https://wotlkdb.com/?spell=48114, -0.2478, 0.2515, 0.0037, 1.5
Glyph of Enslave Demon, https://wotlkdb.com/?spell=58339, -0.3061, 15.0025, 14.6964, 98
Glyph of Polymorph, https://wotlkdb.com/?spell=56987, -0.35, 14.35, 14, 97.6
Glyph of Bloodthirst, https://wotlkdb.com/?spell=57153, -0.3501, 14.35, 13.9999, 97.6
Glyph of the Hawk, https://wotlkdb.com/?spell=57006, -0.3503, 14.35, 13.9997, 97.6
Glyph of Seal of Righteousness, https://wotlkdb.com/?spell=59560, -0.3506, 14.35, 13.9994, 97.6
Glyph of Avenging Wrath, https://wotlkdb.com/?spell=57021, -0.4502, 14.35, 13.8998, 96.9
Glyph of Incinerate, https://wotlkdb.com/?spell=57257, -0.5, 12.5, 12, 96
Glyph of Rune Tap, https://wotlkdb.com/?spell=59338, -0.5001, 12.5, 11.9999, 96
Glyph of Expose Armor, https://wotlkdb.com/?spell=57121, -0.5115, 9.5113, 8.9998, 94.6
Glyph of Riptide, https://wotlkdb.com/?spell=64289, -0.5501, 12.5, 11.9499, 95.6
Scroll of Recall, https://wotlkdb.com/?spell=48248, -0.5715, 2.5515, 1.98, 77.6
Fire Eater's Guide, https://wotlkdb.com/?spell=59489, -0.6995, 25.6995, 25, 97.3
Hunter's Ink, https://wotlkdb.com/?spell=57703, -0.702, 0.8, 0.098, 12.3
Glyph of Cleaving, https://wotlkdb.com/?spell=57154, -0.85, 10.85, 10, 92.2
Glyph of Spiritual Attunement, https://wotlkdb.com/?spell=57022, -0.9515, 7.4515, 6.5, 87.2
Dawnstar Ink, https://wotlkdb.com/?spell=57706, -1.113, 1.206, 0.093, 7.7
Glyph of Shield of Righteousness, https://wotlkdb.com/?spell=64308, -1.35, 14.35, 13, 90.6
Glyph of Intervene, https://wotlkdb.com/?spell=57159, -1.55, 14.35, 12.8, 89.2
Glyph of Fade, https://wotlkdb.com/?spell=57184, -1.5613, 9.5113, 7.95, 83.6
Glyph of Avenger's Shield, https://wotlkdb.com/?spell=57019, -1.5801, 14.35, 12.7699, 89
Weapon Vellum II, https://wotlkdb.com/?spell=59488, -1.6249, 11.5749, 9.95, 86
Glyph of Adrenaline Rush, https://wotlkdb.com/?spell=57112, -1.8, 14.35, 12.55, 87.5
Hellfire Tome, https://wotlkdb.com/?spell=59495, -1.8215, 41.8214, 39.9999, 95.6
Glyph of Evocation, https://wotlkdb.com/?spell=56974, -2.0026, 15.0025, 12.9999, 86.7
Armor Vellum, https://wotlkdb.com/?spell=52739, -2.0915, 2.553, 0.4615, 18.1
Glyph of Spirit of Redemption, https://wotlkdb.com/?spell=57202, -2.3501, 14.35, 11.9999, 83.6
Glyph of Elemental Mastery, https://wotlkdb.com/?spell=57250, -2.3502, 14.35, 11.9998, 83.6
Fiery Ink, https://wotlkdb.com/?spell=57710, -2.4691, 3.069, 0.5999, 19.5
Glyph of Regrowth, https://wotlkdb.com/?spell=56954, -2.47, 14.35, 11.88, 82.8
Glyph of Ice Armor, https://wotlkdb.com/?spell=56978, -2.4715, 7.4515, 4.98, 66.8
Glyph of Frenzied Regeneration, https://wotlkdb.com/?spell=56943, -2.5, 12.5, 10, 80
Glyph of Arcane Blast, https://wotlkdb.com/?spell=56991, -2.5, 12.5, 10, 80
Glyph of Shadow Word: Pain, https://wotlkdb.com/?spell=57192, -2.5, 12.5, 10, 80
Glyph of Windfury Weapon, https://wotlkdb.com/?spell=57252, -2.5002, 12.5, 9.9998, 80
Glyph of Guardian Spirit, https://wotlkdb.com/?spell=64281, -2.5003, 12.5, 9.9997, 80
Glyph of Wrath, https://wotlkdb.com/?spell=56963, -2.5119, 7.4515, 4.9396, 66.3
Glyph of Arcane Barrage, https://wotlkdb.com/?spell=64276, -2.5503, 12.5, 9.9497, 79.6
Armor Vellum II, https://wotlkdb.com/?spell=59499, -2.735, 10.75, 8.015, 74.6
Glyph of Smite, https://wotlkdb.com/?spell=57201, -2.85, 10.85, 8, 73.7
Glyph of Aimed Shot, https://wotlkdb.com/?spell=56994, -3.0026, 15.0025, 11.9999, 80
Glyph of Mind Flay, https://wotlkdb.com/?spell=57200, -3.0026, 15.0025, 11.9999, 80
Glyph of Death Coil, https://wotlkdb.com/?spell=57261, -3.35, 14.35, 11, 76.7
Glyph of Enraged Regeneration, https://wotlkdb.com/?spell=64312, -3.35, 14.35, 11, 76.7
Glyph of Aspect of the Viper, https://wotlkdb.com/?spell=56998, -3.3501, 14.35, 10.9999, 76.7
Glyph of Water Mastery, https://wotlkdb.com/?spell=57251, -3.4433, 22.325, 18.8817, 84.6
Glyph of Seal of Command, https://wotlkdb.com/?spell=57033, -3.47, 12.5, 9.03, 72.2
Glyph of Rapid Charge, https://wotlkdb.com/?spell=57162, -3.4715, 7.4515, 3.98, 53.4
Glyph of Arcane Explosion, https://wotlkdb.com/?spell=56968, -3.5116, 9.5003, 5.9887, 63
Glyph of Imp, https://wotlkdb.com/?spell=57269, -3.5117, 9.5113, 5.9996, 63.1
Glyph of Flametongue Weapon, https://wotlkdb.com/?spell=57240, -3.5613, 9.5113, 5.95, 62.6
Tome of the Dawn, https://wotlkdb.com/?spell=59475, -3.5876, 19.5876, 16, 81.7
Glyph of Searing Pain, https://wotlkdb.com/?spell=57270, -3.8502, 10.85, 6.9998, 64.5
Glyph of Survival Instincts, https://wotlkdb.com/?spell=65245, -3.8515, 13.8515, 10, 72.2
Glyph of Overpower, https://wotlkdb.com/?spell=57161, -4.0027, 15.0025, 10.9998, 73.3
Royal Ink, https://wotlkdb.com/?spell=57708, -4.0635, 4.1924, 0.1289, 3.1
Darkflame Ink, https://wotlkdb.com/?spell=57714, -4.2018, 4.3387, 0.1369, 3.2
Glyph of Curse of Agony, https://wotlkdb.com/?spell=57260, -4.35, 14.35, 10, 69.7
Scroll of Recall III, https://wotlkdb.com/?spell=60337, -4.35, 14.35, 10, 69.7
Glyph of Chain Lightning, https://wotlkdb.com/?spell=57233, -4.3501, 14.35, 9.9999, 69.7
Glyph of Mirror Image, https://wotlkdb.com/?spell=64314, -4.3501, 14.35, 9.9999, 69.7
Glyph of Chains of Ice, https://wotlkdb.com/?spell=57211, -4.4, 14.35, 9.95, 69.3
Glyph of the Beast, https://wotlkdb.com/?spell=56996, -4.4001, 14.35, 9.9499, 69.3
Glyph of Rapid Rejuvenation, https://wotlkdb.com/?spell=71015, -4.4001, 14.35, 9.9499, 69.3
Glyph of Disease, https://wotlkdb.com/?spell=64267, -4.4485, 22.325, 17.8765, 80.1
Glyph of Holy Nova, https://wotlkdb.com/?spell=57187, -4.4777, 12.5, 8.0223, 64.2
Glyph of Healing Touch, https://wotlkdb.com/?spell=56945, -4.5714, 9.5113, 4.9399, 51.9
Glyph of Insect Swarm, https://wotlkdb.com/?spell=56948, -5.0025, 15.0025, 10, 66.7
Glyph of Renew, https://wotlkdb.com/?spell=57197, -5.0025, 15.0025, 10, 66.7
Glyph of Explosive Trap, https://wotlkdb.com/?spell=64253, -5.0027, 15.0025, 9.9998, 66.7
Glyph of Blade Flurry, https://wotlkdb.com/?spell=57115, -5.3502, 14.35, 8.9998, 62.7
Mystic Tome, https://wotlkdb.com/?spell=58565, -5.4051, 15.405, 9.9999, 64.9
Glyph of Inner Fire, https://wotlkdb.com/?spell=57188, -5.5115, 9.5113, 3.9998, 42.1
Glyph of Fear, https://wotlkdb.com/?spell=57262, -5.5125, 9.5113, 3.9988, 42
Scroll of Intellect II, https://wotlkdb.com/?spell=50598, -5.7065, 7.4515, 1.745, 23.4
Royal Guide of Escape Routes, https://wotlkdb.com/?spell=59486, -5.7495, 30.7495, 25, 81.3
