Name, Link, Profit, Cost, Sell, ROI %
Fire Eater's Guide, https://wotlkdb.com/?spell=59489, 1454.2731, 16.8669, 1471.14, 8722.1
Rituals of the New Moon, https://wotlkdb.com/?spell=64051, 339.3, 158.7, 498, 313.8
Book of Stars, https://wotlkdb.com/?spell=59490, 283.133, 16.8669, 299.9999, 1778.6
Glyph of Curse of Exhaustion, https://wotlkdb.com/?spell=58338, 187.0748, 12.125, 199.1998, 1642.9
Glyph of Frost Armor, https://wotlkdb.com/?spell=58306, 185.7485, 9.5515, 195.3, 2044.7
Glyph of Bestial Wrath, https://wotlkdb.com/?spell=56999, 178.1285, 16, 194.1285, 1213.3
Glyph of Trueshot Aura, https://wotlkdb.com/?spell=57012, 173.3895, 16, 189.3895, 1183.7
Glyph of Corpse Explosion, https://wotlkdb.com/?spell=57229, 172.8541, 15.125, 187.9791, 1242.8
Iron-bound Tome, https://wotlkdb.com/?spell=59497, 154.05, 145.45, 299.5, 205.9
Faces of Doom, https://wotlkdb.com/?spell=59498, 153.55, 145.45, 299, 205.6
Glyph of Avenging Wrath, https://wotlkdb.com/?spell=57021, 133.5, 16, 149.5, 934.4
Glyph of Volley, https://wotlkdb.com/?spell=57013, 129.9396, 16, 145.9396, 912.1
Glyph of Scare Beast, https://wotlkdb.com/?spell=58298, 109.3864, 9.5515, 118.9379, 1245.2
Glyph of Flametongue Weapon, https://wotlkdb.com/?spell=57240, 104.6626, 14.9624, 119.625, 799.5
Glyph of Cloak of Shadows, https://wotlkdb.com/?spell=64303, 104.5, 15.5, 120, 774.2
Glyph of Polymorph, https://wotlkdb.com/?spell=56987, 103.5793, 16, 119.5793, 747.4
Certificate of Ownership, https://wotlkdb.com/?spell=59387, 88.1971, 10.8029, 99, 916.4
Glyph of Fire Blast, https://wotlkdb.com/?spell=57719, 79.7897, 16, 95.7897, 598.7
Glyph of Healing Wave, https://wotlkdb.com/?spell=57243, 72.0798, 16, 88.0798, 550.5
Glyph of Curse of Agony, https://wotlkdb.com/?spell=57260, 71.05, 16, 87.05, 544.1
Glyph of Distract, https://wotlkdb.com/?spell=58324, 70.0275, 14.9624, 84.9899, 568
Glyph of Enslave Demon, https://wotlkdb.com/?spell=58339, 58.7634, 12.125, 70.8884, 584.6
Glyph of Raptor Strike, https://wotlkdb.com/?spell=64246, 50.038, 9.5515, 59.5895, 623.9
Hellfire Tome, https://wotlkdb.com/?spell=59495, 44.7, 80.3, 125, 155.7
Glyph of Soul Link, https://wotlkdb.com/?spell=64250, 34.6486, 14.9514, 49.6, 331.7
Glyph of Enduring Victory, https://wotlkdb.com/?spell=58347, 34.4895, 15.5, 49.9895, 322.5
Glyph of Dark Command, https://wotlkdb.com/?spell=57212, 33.9434, 16, 49.9434, 312.1
Glyph of Souls, https://wotlkdb.com/?spell=58341, 33.8714, 16, 49.8714, 311.7
Glyph of Water Elemental, https://wotlkdb.com/?spell=56989, 32.6678, 16, 48.6678, 304.2
Glyph of Frostbolt, https://wotlkdb.com/?spell=56977, 31.0122, 16, 47.0122, 293.8
Glyph of Ghostly Strike, https://wotlkdb.com/?spell=57124, 28.8274, 16, 44.8274, 280.2
Glyph of Holy Wrath, https://wotlkdb.com/?spell=59559, 27.9395, 16, 43.9395, 274.6
Glyph of the Beast, https://wotlkdb.com/?spell=56996, 27.9084, 16, 43.9084, 274.4
Glyph of Mana Tide Totem, https://wotlkdb.com/?spell=57247, 27.8517, 16, 43.8517, 274.1
Glyph of Innervate, https://wotlkdb.com/?spell=56947, 23.9, 16, 39.9, 249.4
Glyph of Shocking, https://wotlkdb.com/?spell=57235, 23.8871, 16, 39.8871, 249.3
Glyph of Explosive Shot, https://wotlkdb.com/?spell=64273, 19.3337, 15.5, 34.8337, 224.7
Glyph of Lifebloom, https://wotlkdb.com/?spell=56949, 18.969, 16, 34.969, 218.6
Glyph of Spirit of Redemption, https://wotlkdb.com/?spell=57202, 18.6, 16, 34.6, 216.3
Glyph of Vigilance, https://wotlkdb.com/?spell=64255, 18.5373, 5.4077, 23.945, 442.8
Glyph of the Pack, https://wotlkdb.com/?spell=58297, 18.1858, 5.4077, 23.5935, 436.3
Glyph of Safe Fall, https://wotlkdb.com/?spell=58327, 18.0343, 5.4077, 23.442, 433.5
Glyph of Ice Barrier, https://wotlkdb.com/?spell=64257, 17.9791, 5.5202, 23.4993, 425.7
Glyph of Insect Swarm, https://wotlkdb.com/?spell=56948, 17.775, 12.125, 29.9, 246.6
Glyph of Rip, https://wotlkdb.com/?spell=56956, 17.6791, 5.4077, 23.0868, 426.9
Glyph of Barkskin, https://wotlkdb.com/?spell=64256, 17.6748, 5.5202, 23.195, 420.2
Glyph of Holy Shock, https://wotlkdb.com/?spell=64254, 17.2922, 5.4077, 22.6999, 419.8
Glyph of Cleaving, https://wotlkdb.com/?spell=57154, 17.1797, 5.5202, 22.6999, 411.2
Glyph of Pick Pocket, https://wotlkdb.com/?spell=58326, 15.6969, 9.5515, 25.2484, 264.3
Glyph of Spell Reflection, https://wotlkdb.com/?spell=64302, 15.4897, 15.5, 30.9897, 199.9
Glyph of Heart Strike, https://wotlkdb.com/?spell=57208, 15.432, 16, 31.432, 196.5
Glyph of Resonating Power, https://wotlkdb.com/?spell=57164, 15.2495, 16, 31.2495, 195.3
Glyph of Victory Rush, https://wotlkdb.com/?spell=57170, 14.9896, 16, 30.9896, 193.7
Glyph of Arcane Intellect, https://wotlkdb.com/?spell=58303, 14.2835, 9.5515, 23.835, 249.5
Glyph of Blessing of Might, https://wotlkdb.com/?spell=58314, 13.913, 9.5515, 23.4645, 245.7
Glyph of Typhoon, https://wotlkdb.com/?spell=56965, 13.8865, 16, 29.8865, 186.8
Glyph of Lay on Hands, https://wotlkdb.com/?spell=58313, 13.8781, 9.5515, 23.4296, 245.3
Glyph of Battle, https://wotlkdb.com/?spell=58342, 13.7219, 9.5515, 23.2734, 243.7
Glyph of Thunder Clap, https://wotlkdb.com/?spell=58346, 13.7134, 9.5515, 23.2649, 243.6
Glyph of the Wild, https://wotlkdb.com/?spell=58296, 13.652, 9.5515, 23.2035, 242.9
Glyph of Charge, https://wotlkdb.com/?spell=58344, 13.538, 9.5515, 23.0895, 241.7
Glyph of Chain Lightning, https://wotlkdb.com/?spell=57233, 13.4581, 16, 29.4581, 184.1
Glyph of Blurred Speed, https://wotlkdb.com/?spell=58323, 13.4483, 9.5515, 22.9998, 240.8
Glyph of Thorns, https://wotlkdb.com/?spell=58289, 13.3881, 9.5515, 22.9396, 240.2
Glyph of Slow Fall, https://wotlkdb.com/?spell=58308, 13.3879, 9.5515, 22.9394, 240.2
Glyph of Fortitude, https://wotlkdb.com/?spell=58318, 13.3821, 9.5515, 22.9336, 240.1
Glyph of Mend Pet, https://wotlkdb.com/?spell=58301, 13.275, 9.5515, 22.8265, 239
Glyph of Drain Soul, https://wotlkdb.com/?spell=58337, 13.2603, 9.5515, 22.8118, 238.8
Glyph of Blessing of Wisdom, https://wotlkdb.com/?spell=58312, 13.2326, 9.5515, 22.7841, 238.5
Glyph of Bloodrage, https://wotlkdb.com/?spell=58343, 13.2098, 9.5515, 22.7613, 238.3
Glyph of Water Mastery, https://wotlkdb.com/?spell=57251, 13.1578, 15.125, 28.2828, 187
Glyph of Life Tap, https://wotlkdb.com/?spell=64248, 12.9377, 9.5515, 22.4892, 235.5
Glyph of Mind Control, https://wotlkdb.com/?spell=57191, 12.8, 16, 28.8, 180
Glyph of Riptide, https://wotlkdb.com/?spell=64289, 12.4897, 15.5, 27.9897, 180.6
Glyph of Consecration, https://wotlkdb.com/?spell=57023, 12.4798, 5.5202, 18, 326.1
Glyph of Revive Pet, https://wotlkdb.com/?spell=58299, 12.4484, 9.5515, 21.9999, 230.3
Glyph of Sinister Strike, https://wotlkdb.com/?spell=57131, 12.4298, 5.5202, 17.95, 325.2
Glyph of Stoneclaw Totem, https://wotlkdb.com/?spell=64247, 12.1769, 9.5515, 21.7284, 227.5
Glyph of Blast Wave, https://wotlkdb.com/?spell=56990, 11.9692, 16, 27.9692, 174.8
Glyph of Water Walking, https://wotlkdb.com/?spell=58333, 11.6539, 12.125, 23.7789, 196.1
Glyph of Challenging Roar, https://wotlkdb.com/?spell=58287, 11.5496, 12.125, 23.6746, 195.3
Glyph of Scorch, https://wotlkdb.com/?spell=56982, 11.4798, 5.5202, 17, 308
Glyph of Disengage, https://wotlkdb.com/?spell=57001, 11.4796, 5.5202, 16.9998, 308
Glyph of Mirror Image, https://wotlkdb.com/?spell=64314, 11.4339, 16, 27.4339, 171.5
Glyph of Renewed Life, https://wotlkdb.com/?spell=58330, 11.3334, 12.125, 23.4584, 193.5
Warrior Glyph 21, https://wotlkdb.com/?spell=57173, 11.0706, 6.9294, 18, 259.8
Warrior Glyph 22, https://wotlkdb.com/?spell=57174, 11.0706, 6.9294, 18, 259.8
Warrior Glyph 23, https://wotlkdb.com/?spell=57175, 11.0706, 6.9294, 18, 259.8
Warrior Glyph 25, https://wotlkdb.com/?spell=57176, 11.0706, 6.9294, 18, 259.8
Warrior Glyph 24, https://wotlkdb.com/?spell=57180, 11.0706, 6.9294, 18, 259.8
Death Knight Glyph 25, https://wotlkdb.com/?spell=57231, 11.0706, 6.9294, 18, 259.8
Glyph of Shadow Protection, https://wotlkdb.com/?spell=58321, 11.0705, 12.125, 23.1955, 191.3
Glyph of Explosive Trap, https://wotlkdb.com/?spell=64253, 11.054, 12.125, 23.179, 191.2
Glyph of Entangling Roots, https://wotlkdb.com/?spell=48121, 11.0281, 14.9514, 25.9795, 173.8
Glyph of Levitate, https://wotlkdb.com/?spell=58319, 10.8003, 12.125, 22.9253, 189.1
Glyph of the Wise, https://wotlkdb.com/?spell=58316, 10.6732, 12.125, 22.7982, 188
Glyph of Feign Death, https://wotlkdb.com/?spell=58302, 10.4649, 12.125, 22.5899, 186.3
Glyph of Rejuvenation, https://wotlkdb.com/?spell=56955, 10.4485, 9.5515, 20, 209.4
Glyph of Serpent Sting, https://wotlkdb.com/?spell=57009, 10.4485, 9.5515, 20, 209.4
Glyph of the Penguin, https://wotlkdb.com/?spell=58310, 10.4484, 9.5515, 19.9999, 209.4
Glyph of Fading, https://wotlkdb.com/?spell=58317, 10.4383, 9.5515, 19.9898, 209.3
Glyph of Possessed Strength, https://wotlkdb.com/?spell=58300, 10.2383, 9.5515, 19.7898, 207.2
Armor Vellum II, https://wotlkdb.com/?spell=59499, 9.5298, 5.4202, 14.95, 275.8
Glyph of Starfire, https://wotlkdb.com/?spell=56959, 9.4798, 5.5202, 15, 271.7
Glyph of Healing Stream Totem, https://wotlkdb.com/?spell=57242, 9.4798, 5.5202, 15, 271.7
Glyph of Lesser Healing Wave, https://wotlkdb.com/?spell=57244, 9.4798, 5.5202, 15, 271.7
Glyph of Astral Recall, https://wotlkdb.com/?spell=58329, 9.095, 12.125, 21.22, 175
Glyph of Unending Breath, https://wotlkdb.com/?spell=58336, 9.0278, 14.9514, 23.9792, 160.4
Glyph of Pick Lock, https://wotlkdb.com/?spell=58325, 8.9682, 14.9514, 23.9196, 160
Glyph of Frost Ward, https://wotlkdb.com/?spell=58307, 8.9326, 14.9624, 23.895, 159.7
Glyph of Fire Ward, https://wotlkdb.com/?spell=58305, 8.8686, 14.9514, 23.82, 159.3
Glyph of Unburdened Rebirth, https://wotlkdb.com/?spell=58288, 8.8669, 14.9514, 23.8183, 159.3
Glyph of Pestilence, https://wotlkdb.com/?spell=57230, 8.764, 15.125, 23.889, 157.9
Glyph of Ghost Wolf, https://wotlkdb.com/?spell=59326, 8.7472, 14.9514, 23.6986, 158.5
Glyph of Raise Dead, https://wotlkdb.com/?spell=57228, 8.6742, 15.125, 23.7992, 157.4
Glyph of Kilrogg, https://wotlkdb.com/?spell=58340, 8.6611, 14.9624, 23.6235, 157.9
Glyph of Death's Embrace, https://wotlkdb.com/?spell=57215, 8.6244, 15.125, 23.7494, 157
Glyph of Shackle Undead, https://wotlkdb.com/?spell=58320, 8.557, 14.9514, 23.5084, 157.2
Glyph of Shield Wall, https://wotlkdb.com/?spell=64252, 8.5469, 14.9624, 23.5093, 157.1
Glyph of Vanish, https://wotlkdb.com/?spell=58328, 8.4873, 14.9624, 23.4497, 156.7
Glyph of Killing Spree, https://wotlkdb.com/?spell=64285, 8.3841, 15.5, 23.8841, 154.1
Glyph of Haunt, https://wotlkdb.com/?spell=64291, 8.2793, 15.5, 23.7793, 153.4
Glyph of Horn of Winter, https://wotlkdb.com/?spell=57217, 8.2634, 15.5, 23.7634, 153.3
Glyph of Divine Storm, https://wotlkdb.com/?spell=64279, 8.2501, 15.5, 23.7501, 153.2
Glyph of Bladestorm, https://wotlkdb.com/?spell=64295, 8.1893, 15.5, 23.6893, 152.8
Glyph of Chaos Bolt, https://wotlkdb.com/?spell=64294, 8.1283, 15.5, 23.6283, 152.4
Glyph of Water Breathing, https://wotlkdb.com/?spell=58331, 8.1224, 14.9624, 23.0848, 154.3
Glyph of Shadow Dance, https://wotlkdb.com/?spell=64286, 8.0789, 15.5, 23.5789, 152.1
Glyph of Metamorphosis, https://wotlkdb.com/?spell=64318, 8.05, 15.5, 23.55, 151.9
Glyph of Water Shield, https://wotlkdb.com/?spell=58332, 8.0452, 14.9514, 22.9966, 153.8
Glyph of Mortal Strike, https://wotlkdb.com/?spell=57160, 7.9691, 16, 23.9691, 149.8
Glyph of Rupture, https://wotlkdb.com/?spell=57128, 7.9597, 16, 23.9597, 149.7
Glyph of Growl, https://wotlkdb.com/?spell=56944, 7.9173, 16, 23.9173, 149.5
Glyph of Dash, https://wotlkdb.com/?spell=59315, 7.875, 12.125, 20, 164.9
Glyph of Chimera Shot, https://wotlkdb.com/?spell=64271, 7.8585, 15.5, 23.3585, 150.7
Glyph of Aquatic Form, https://wotlkdb.com/?spell=58286, 7.858, 14.9514, 22.8094, 152.6
Glyph of Last Stand, https://wotlkdb.com/?spell=57166, 7.8574, 16, 23.8574, 149.1
Glyph of Sense Undead, https://wotlkdb.com/?spell=58315, 7.8532, 14.9514, 22.8046, 152.5
Glyph of Prayer of Healing, https://wotlkdb.com/?spell=57195, 7.8528, 16, 23.8528, 149.1
Glyph of Blessing of Kings, https://wotlkdb.com/?spell=58311, 7.8526, 14.9514, 22.804, 152.5
Glyph of Penance, https://wotlkdb.com/?spell=64282, 7.8444, 15.5, 23.3444, 150.6
Glyph of Mutilate, https://wotlkdb.com/?spell=64260, 7.8435, 15.125, 22.9685, 151.9
Glyph of Anti-Magic Shell, https://wotlkdb.com/?spell=57207, 7.8399, 16, 23.8399, 149
Glyph of Devastate, https://wotlkdb.com/?spell=57155, 7.8289, 16, 23.8289, 148.9
Glyph of Dancing Rune Weapon, https://wotlkdb.com/?spell=64297, 7.8193, 15.5, 23.3193, 150.4
Glyph of Command, https://wotlkdb.com/?spell=68166, 7.7497, 16, 23.7497, 148.4
Glyph of Chain Heal, https://wotlkdb.com/?spell=57232, 7.7484, 16, 23.7484, 148.4
Glyph of Swiftmend, https://wotlkdb.com/?spell=56960, 7.7381, 16, 23.7381, 148.4
Glyph of Blood Tap, https://wotlkdb.com/?spell=57209, 7.7349, 15.5, 23.2349, 149.9
Glyph of Blocking, https://wotlkdb.com/?spell=57152, 7.7299, 16, 23.7299, 148.3
Glyph of Seal of Vengeance, https://wotlkdb.com/?spell=59561, 7.7186, 16, 23.7186, 148.2
Glyph of Mind Sear, https://wotlkdb.com/?spell=64309, 7.7, 16, 23.7, 148.1
Glyph of Living Bomb, https://wotlkdb.com/?spell=64275, 7.6999, 15.5, 23.1999, 149.7
Glyph of Lava, https://wotlkdb.com/?spell=57234, 7.6891, 16, 23.6891, 148.1
Glyph of Salvation, https://wotlkdb.com/?spell=64251, 7.6875, 14.9624, 22.6499, 151.4
Glyph of Felhunter, https://wotlkdb.com/?spell=57264, 7.6, 16, 23.6, 147.5
Glyph of Tricks of the Trade, https://wotlkdb.com/?spell=64310, 7.5999, 16, 23.5999, 147.5
Glyph of Conflagrate, https://wotlkdb.com/?spell=57258, 7.5796, 16, 23.5796, 147.4
Glyph of Adrenaline Rush, https://wotlkdb.com/?spell=57112, 7.5789, 16, 23.5789, 147.4
Glyph of Shadowfiend, https://wotlkdb.com/?spell=58322, 7.578, 16, 23.578, 147.4
Glyph of Beacon of Light, https://wotlkdb.com/?spell=64277, 7.5431, 15.5, 23.0431, 148.7
Midnight Ink, https://wotlkdb.com/?spell=53462, 7.535, 2.015, 9.55, 473.9
Glyph of Dark Death, https://wotlkdb.com/?spell=64266, 7.535, 15.125, 22.66, 149.8
Glyph of Shadow, https://wotlkdb.com/?spell=57193, 7.5214, 16, 23.5214, 147
Glyph of Siphon Life, https://wotlkdb.com/?spell=57273, 7.5182, 16, 23.5182, 147
Glyph of Disease, https://wotlkdb.com/?spell=64267, 7.475, 15.125, 22.6, 149.4
Glyph of Shockwave, https://wotlkdb.com/?spell=64296, 7.4461, 15.5, 22.9461, 148
Glyph of Exorcism, https://wotlkdb.com/?spell=57025, 7.4398, 15.125, 22.5648, 149.2
Glyph of Shield of Righteousness, https://wotlkdb.com/?spell=64308, 7.3892, 16, 23.3892, 146.2
Glyph of Shadowflame, https://wotlkdb.com/?spell=64311, 7.3733, 16, 23.3733, 146.1
Glyph of Dispersion, https://wotlkdb.com/?spell=64280, 7.3449, 15.5, 22.8449, 147.4
Glyph of Howling Blast, https://wotlkdb.com/?spell=64300, 7.3407, 15.5, 22.8407, 147.4
Glyph of Thunderstorm, https://wotlkdb.com/?spell=57253, 7.3363, 16, 23.3363, 145.9
Glyph of Immolate, https://wotlkdb.com/?spell=57268, 7.3248, 16, 23.3248, 145.8
Glyph of Wild Growth, https://wotlkdb.com/?spell=64270, 7.25, 15.5, 22.75, 146.8
Glyph of Rending, https://wotlkdb.com/?spell=57163, 7.2386, 14.9624, 22.201, 148.4
Glyph of Obliterate, https://wotlkdb.com/?spell=57220, 7.2104, 16, 23.2104, 145.1
Glyph of Flash Heal, https://wotlkdb.com/?spell=57186, 7.1641, 14.9624, 22.1265, 147.9
Glyph of Berserk, https://wotlkdb.com/?spell=64268, 7.05, 15.5, 22.55, 145.5
Glyph of Divine Plea, https://wotlkdb.com/?spell=64305, 7.0499, 16, 23.0499, 144.1
Glyph of Eviscerate, https://wotlkdb.com/?spell=57120, 7.0376, 14.9624, 22, 147
Glyph of Moonfire, https://wotlkdb.com/?spell=56951, 7.0275, 14.9624, 21.9899, 147
Shimmering Ink, https://wotlkdb.com/?spell=57711, 7, 8, 15, 187.5
Glyph of Enraged Regeneration, https://wotlkdb.com/?spell=64312, 6.9894, 16, 22.9894, 143.7
Glyph of Molten Armor, https://wotlkdb.com/?spell=56986, 6.9791, 16, 22.9791, 143.6
Glyph of Circle of Healing, https://wotlkdb.com/?spell=57181, 6.9647, 16, 22.9647, 143.5
Glyph of Unstable Affliction, https://wotlkdb.com/?spell=57276, 6.95, 16, 22.95, 143.4
Lion's Ink, https://wotlkdb.com/?spell=57704, 6.9499, 8, 14.9499, 186.9
Glyph of Fade, https://wotlkdb.com/?spell=57184, 6.9413, 14.9624, 21.9037, 146.4
Glyph of Seal of Light, https://wotlkdb.com/?spell=57034, 6.9144, 16, 22.9144, 143.2
Glyph of Sprint, https://wotlkdb.com/?spell=57133, 6.8986, 15.125, 22.0236, 145.6
Glyph of Quick Decay, https://wotlkdb.com/?spell=71102, 6.8985, 16, 22.8985, 143.1
Glyph of Preparation, https://wotlkdb.com/?spell=57127, 6.8876, 16, 22.8876, 143
Glyph of Earth Shield, https://wotlkdb.com/?spell=64261, 6.8867, 15.125, 22.0117, 145.5
Glyph of Fireball, https://wotlkdb.com/?spell=56975, 6.8347, 16, 22.8347, 142.7
Glyph of Gouge, https://wotlkdb.com/?spell=57125, 6.8148, 12.125, 18.9398, 156.2
Glyph of Felguard, https://wotlkdb.com/?spell=57263, 6.7895, 16, 22.7895, 142.4
Glyph of Seal of Righteousness, https://wotlkdb.com/?spell=59560, 6.7248, 16, 22.7248, 142
Glyph of the Ghoul, https://wotlkdb.com/?spell=57222, 6.4648, 15.5, 21.9648, 141.7
Glyph of Stormstrike, https://wotlkdb.com/?spell=57248, 6.4597, 16, 22.4597, 140.4
Glyph of Vigor, https://wotlkdb.com/?spell=57130, 6.4241, 16, 22.4241, 140.2
Glyph of Hungering Cold, https://wotlkdb.com/?spell=64298, 6.3886, 15.5, 21.8886, 141.2
Glyph of Wyvern Sting, https://wotlkdb.com/?spell=57014, 6.2, 16, 22.2, 138.8
Jadefire Ink, https://wotlkdb.com/?spell=57707, 6.1125, 6, 12.1125, 201.9
Glyph of Hemorrhage, https://wotlkdb.com/?spell=57126, 6, 16, 22, 137.5
Glyph of Bloodthirst, https://wotlkdb.com/?spell=57153, 6, 16, 22, 137.5
Glyph of Savage Roar, https://wotlkdb.com/?spell=64307, 6, 16, 22, 137.5
Glyph of Rune Strike, https://wotlkdb.com/?spell=57223, 5.9485, 16, 21.9485, 137.2
Glyph of Survival Instincts, https://wotlkdb.com/?spell=65245, 5.9105, 15.5015, 21.412, 138.1
Glyph of Aimed Shot, https://wotlkdb.com/?spell=56994, 5.875, 12.125, 18, 148.5
Glyph of Nourish, https://wotlkdb.com/?spell=64313, 5.844, 16, 21.844, 136.5
Glyph of Avenger's Shield, https://wotlkdb.com/?spell=57019, 5.812, 16, 21.812, 136.3
Glyph of Mending, https://wotlkdb.com/?spell=56997, 5.7875, 14.9624, 20.7499, 138.7
Glyph of Heroic Strike, https://wotlkdb.com/?spell=57158, 5.5485, 9.5515, 15.1, 158.1
Ink of the Sea, https://wotlkdb.com/?spell=57715, 5.47, 10.03, 15.5, 154.5
Glyph of Unholy Blight, https://wotlkdb.com/?spell=64299, 5.3548, 15.5, 20.8548, 134.5
Weapon Vellum II, https://wotlkdb.com/?spell=59488, 5.3395, 6.6105, 11.95, 180.8
Glyph of Death and Decay, https://wotlkdb.com/?spell=57214, 5.272, 16, 21.272, 133
Glyph of Deep Freeze, https://wotlkdb.com/?spell=64274, 5.2539, 15.5, 20.7539, 133.9
Glyph of Frostfire, https://wotlkdb.com/?spell=61677, 5.232, 16, 21.232, 132.7
Glyph of Kill Shot, https://wotlkdb.com/?spell=64304, 5.172, 16, 21.172, 132.3
Glyph of Arcane Missiles, https://wotlkdb.com/?spell=56971, 5.0376, 14.9624, 20, 133.7
Glyph of Hamstring, https://wotlkdb.com/?spell=57157, 5.0376, 14.9624, 20, 133.7
Glyph of Fire Nova, https://wotlkdb.com/?spell=57238, 5.0375, 14.9624, 19.9999, 133.7
Glyph of Arcane Barrage, https://wotlkdb.com/?spell=64276, 5.0246, 15.5, 20.5246, 132.4
Glyph of Fan of Knives, https://wotlkdb.com/?spell=64315, 5, 16, 21, 131.3
Glyph of Hammer of Wrath, https://wotlkdb.com/?spell=57028, 4.9999, 16, 20.9999, 131.2
Ethereal Ink, https://wotlkdb.com/?spell=57713, 4.985, 10.015, 15, 149.8
Glyph of Frost Strike, https://wotlkdb.com/?spell=57216, 4.875, 15.125, 20, 132.2
Glyph of Icy Touch, https://wotlkdb.com/?spell=57219, 4.875, 15.125, 20, 132.2
Glyph of Invisibility, https://wotlkdb.com/?spell=56983, 4.8694, 16, 20.8694, 130.4
Glyph of Plague Strike, https://wotlkdb.com/?spell=57221, 4.7445, 15.125, 19.8695, 131.4
Glyph of Hammer of the Righteous, https://wotlkdb.com/?spell=64278, 4.52, 15.5, 20.02, 129.2
Glyph of Arcane Blast, https://wotlkdb.com/?spell=56991, 4.5, 15.5, 20, 129
Glyph of Vampiric Blood, https://wotlkdb.com/?spell=57227, 4.5, 15.5, 20, 129
Glyph of Whirlwind, https://wotlkdb.com/?spell=57172, 4.4999, 15.5, 19.9999, 129
Glyph of Incinerate, https://wotlkdb.com/?spell=57257, 4.4999, 15.5, 19.9999, 129
Glyph of Shadow Word: Pain, https://wotlkdb.com/?spell=57192, 4.4998, 15.5, 19.9998, 129
Glyph of Thunder, https://wotlkdb.com/?spell=64287, 4.4899, 15.5, 19.9899, 129
Glyph of Blink, https://wotlkdb.com/?spell=56973, 4.4099, 14.9624, 19.3723, 129.5
Glyph of Hunger for Blood, https://wotlkdb.com/?spell=64284, 4.3763, 15.5, 19.8763, 128.2
Glyph of Steady Shot, https://wotlkdb.com/?spell=57011, 4.0999, 16, 20.0999, 125.6
Glyph of Holy Light, https://wotlkdb.com/?spell=57029, 4.0376, 14.9624, 19, 127
Glyph of Judgement, https://wotlkdb.com/?spell=57030, 4.0376, 14.9624, 19, 127
Glyph of Expose Armor, https://wotlkdb.com/?spell=57121, 4.0376, 14.9624, 19, 127
Glyph of Aspect of the Viper, https://wotlkdb.com/?spell=56998, 3.9999, 16, 19.9999, 125
Glyph of Regrowth, https://wotlkdb.com/?spell=56954, 3.9898, 16, 19.9898, 124.9
Glyph of Mangle, https://wotlkdb.com/?spell=56950, 3.95, 16, 19.95, 124.7
Glyph of Starfall, https://wotlkdb.com/?spell=56958, 3.95, 16, 19.95, 124.7
Glyph of Lightwell, https://wotlkdb.com/?spell=57189, 3.9494, 16, 19.9494, 124.7
Glyph of Mana Gem, https://wotlkdb.com/?spell=56985, 3.875, 15.125, 19, 125.6
Glyph of Execution, https://wotlkdb.com/?spell=57156, 3.775, 15.125, 18.9, 125
Glyph of Fear, https://wotlkdb.com/?spell=57262, 3.5173, 14.9624, 18.4797, 123.5
Glyph of Dispel Magic, https://wotlkdb.com/?spell=57183, 3.4798, 5.5202, 9, 163
Glyph of Eternal Water, https://wotlkdb.com/?spell=71101, 3.4489, 15.5, 18.9489, 122.3
Glyph of Slice and Dice, https://wotlkdb.com/?spell=57132, 3.4298, 5.5202, 8.95, 162.1
Glyph of Shadow Word: Death, https://wotlkdb.com/?spell=57199, 3.2599, 16, 19.2599, 120.4
Glyph of Inner Fire, https://wotlkdb.com/?spell=57188, 3.0376, 14.9624, 18, 120.3
Glyph of Lightning Bolt, https://wotlkdb.com/?spell=57245, 3.0376, 14.9624, 18, 120.3
Glyph of Rapid Rejuvenation, https://wotlkdb.com/?spell=71015, 3, 16, 19, 118.8
Glyph of Turn Evil, https://wotlkdb.com/?spell=57036, 2.9999, 16, 18.9999, 118.7
Glyph of Mind Flay, https://wotlkdb.com/?spell=57200, 2.8975, 12.125, 15.0225, 123.9
Glyph of Icy Veins, https://wotlkdb.com/?spell=56981, 2.8974, 12.125, 15.0224, 123.9
Glyph of Righteous Defense, https://wotlkdb.com/?spell=57032, 2.875, 12.125, 15, 123.7
Glyph of Overpower, https://wotlkdb.com/?spell=57161, 2.875, 12.125, 15, 123.7
Glyph of Renew, https://wotlkdb.com/?spell=57197, 2.875, 12.125, 15, 123.7
Glyph of Shred, https://wotlkdb.com/?spell=56957, 2.875, 15.125, 18, 119
Glyph of Flash of Light, https://wotlkdb.com/?spell=57026, 2.875, 15.125, 18, 119
Glyph of Sweeping Strikes, https://wotlkdb.com/?spell=57168, 2.5, 15.5, 18, 116.1
Glyph of Rune Tap, https://wotlkdb.com/?spell=59338, 2.5, 15.5, 18, 116.1
Glyph of Feral Spirit, https://wotlkdb.com/?spell=64288, 2.5, 15.5, 18, 116.1
Glyph of Guardian Spirit, https://wotlkdb.com/?spell=64281, 2.4999, 15.5, 17.9999, 116.1
Glyph of Crusader Strike, https://wotlkdb.com/?spell=57024, 2.4798, 5.5202, 8, 144.9
Glyph of Death Strike, https://wotlkdb.com/?spell=59340, 2.45, 15.5, 17.95, 115.8
Ink of the Sky, https://wotlkdb.com/?spell=57712, 2.4083, 3.6667, 6.075, 165.7
Glyph of Earthliving Weapon, https://wotlkdb.com/?spell=57236, 2.3649, 15.125, 17.4899, 115.6
Glyph of Seal of Wisdom, https://wotlkdb.com/?spell=57035, 1.9999, 16, 17.9999, 112.5
Glyph of Chains of Ice, https://wotlkdb.com/?spell=57211, 1.9399, 16, 17.9399, 112.1
Glyph of Elemental Mastery, https://wotlkdb.com/?spell=57250, 1.9394, 16, 17.9394, 112.1
Glyph of Icebound Fortitude, https://wotlkdb.com/?spell=57218, 1.8882, 16, 17.8882, 111.8
Glyph of Totem of Wrath, https://wotlkdb.com/?spell=64262, 1.8749, 15.125, 16.9999, 112.4
Glyph of Seal of Command, https://wotlkdb.com/?spell=57033, 1.4999, 15.5, 16.9999, 109.7
Glyph of Snake Trap, https://wotlkdb.com/?spell=57010, 1.4495, 16, 17.4495, 109.1
Glyph of Backstab, https://wotlkdb.com/?spell=57114, 1.4485, 9.5515, 11, 115.2
Glyph of Flame Shock, https://wotlkdb.com/?spell=57239, 1.4485, 9.5515, 11, 115.2
Glyph of Demonic Circle, https://wotlkdb.com/?spell=64317, 1.2, 16, 17.2, 107.5
Glyph of Health Funnel, https://wotlkdb.com/?spell=57265, 1.0376, 14.9624, 16, 106.9
Glyph of Death Coil, https://wotlkdb.com/?spell=57261, 0.9999, 16, 16.9999, 106.2
Glyph of Mocking Blow, https://wotlkdb.com/?spell=58345, 0.9985, 14.9514, 15.9499, 106.7
Glyph of Remove Curse, https://wotlkdb.com/?spell=56988, 0.7994, 16, 16.7994, 105
Glyph of Ice Block, https://wotlkdb.com/?spell=56979, 0.5023, 5.5202, 6.0225, 109.1
Hunter's Ink, https://wotlkdb.com/?spell=57703, 0.4938, 0.9062, 1.4, 154.5
Glyph of Maul, https://wotlkdb.com/?spell=56961, 0.4485, 9.5515, 10, 104.7
Royal Ink, https://wotlkdb.com/?spell=57708, 0.4, 0.5, 0.9, 180
Glyph of Deadly Throw, https://wotlkdb.com/?spell=57117, 0.3999, 16, 16.3999, 102.5
Glyph of Hammer of Justice, https://wotlkdb.com/?spell=57027, 0.3984, 9.5515, 9.9499, 104.2
Scroll of Intellect, https://wotlkdb.com/?spell=48114, 0.3732, 0.519, 0.8922, 171.9
Glyph of Power Word: Shield, https://wotlkdb.com/?spell=57194, 0.3485, 9.5515, 9.9, 103.6
Glyph of Frenzied Regeneration, https://wotlkdb.com/?spell=56943, 0.3, 15.5, 15.8, 101.9
Glyph of Frost Nova, https://wotlkdb.com/?spell=56976, 0.2485, 9.5515, 9.8, 102.6
Glyph of Hex, https://wotlkdb.com/?spell=64316, -0.0002, 16, 15.9998, 100
Glyph of Taunt, https://wotlkdb.com/?spell=57169, -0.1, 16, 15.9, 99.4
Glyph of Pain Suppression, https://wotlkdb.com/?spell=64259, -0.125, 15.125, 15, 99.2
Glyph of Mass Dispel, https://wotlkdb.com/?spell=57190, -0.2501, 16, 15.7499, 98.4
Scroll of Stamina, https://wotlkdb.com/?spell=45382, -0.4195, 0.519, 0.0995, 19.2
Scroll of Spirit, https://wotlkdb.com/?spell=48116, -0.4195, 0.519, 0.0995, 19.2
Darkflame Ink, https://wotlkdb.com/?spell=57714, -0.4299, 5.4799, 5.05, 92.2
Dawnstar Ink, https://wotlkdb.com/?spell=57706, -0.58, 1.33, 0.75, 56.4
Glyph of Spiritual Attunement, https://wotlkdb.com/?spell=57022, -0.7765, 9.5515, 8.775, 91.9
