Glyph of the Beast, https://wotlkdb.com/?spell=56996, -6.5501, 16.5, 9.9499, 60.3
Glyph of Chains of Ice, https://wotlkdb.com/?spell=57211, -6.5501, 16.5, 9.9499, 60.3
Glyph of Rapid Rejuvenation, https://wotlkdb.com/?spell=71015, -6.5501, 16.5, 9.9499, 60.3
Glyph of Spirit of Redemption, https://wotlkdb.com/?spell=57202, -6.5503, 16.5, 9.9497, 60.3
Glyph of Scorch, https://wotlkdb.com/?spell=56982, -6.575, 15.525, 8.95, 57.6
Glyph of Healthstone, https://wotlkdb.com/?spell=57266, -6.7516, 7.4515, 0.6999, 9.4
Glyph of Pain Suppression, https://wotlkdb.com/?spell=64259, -6.7611, 21.125, 14.3639, 68
Glyph of Hamstring, https://wotlkdb.com/?spell=57157, -6.9629, 16.5125, 9.5496, 57.8
Scroll of Agility II, https://wotlkdb.com/?spell=58473, -7.0515, 7.4515, 0.4, 5.4
Scroll of Strength II, https://wotlkdb.com/?spell=58485, -7.0865, 7.4515, 0.365, 4.9
Glyph of Frost Strike, https://wotlkdb.com/?spell=57216, -7.125, 21.125, 14, 66.3
Glyph of Earth Shield, https://wotlkdb.com/?spell=64261, -7.1254, 21.125, 13.9996, 66.3
Scroll of Spirit II, https://wotlkdb.com/?spell=50605, -7.1515, 7.4515, 0.3, 4
Glyph of Spell Reflection, https://wotlkdb.com/?spell=64302, -7.4006, 12.45, 5.0494, 40.6
Glyph of Seal of Command, https://wotlkdb.com/?spell=57033, -7.4502, 12.45, 4.9998, 40.2
Glyph of Victory Rush, https://wotlkdb.com/?spell=57170, -7.55, 16.5, 8.95, 54.2
Glyph of Expose Armor, https://wotlkdb.com/?spell=57121, -7.6129, 16.5125, 8.8996, 53.9
Glyph of Ambush, https://wotlkdb.com/?spell=57113, -7.6902, 12.45, 4.7598, 38.2
Royal Ink, https://wotlkdb.com/?spell=57708, -7.9155, 8, 0.0845, 1.1
Glyph of Icy Veins, https://wotlkdb.com/?spell=56981, -8.2873, 15.2873, 7, 45.8
Glyph of Sweeping Strikes, https://wotlkdb.com/?spell=57168, -8.4502, 12.45, 3.9998, 32.1
Glyph of Berserk, https://wotlkdb.com/?spell=64268, -8.4502, 12.45, 3.9998, 32.1
Glyph of Succubus, https://wotlkdb.com/?spell=57275, -8.4701, 12.45, 3.9799, 32
Glyph of Blade Flurry, https://wotlkdb.com/?spell=57115, -8.5002, 16.5, 7.9998, 48.5
Glyph of Blink, https://wotlkdb.com/?spell=56973, -8.5127, 16.5125, 7.9998, 48.4
Glyph of Lesser Healing Wave, https://wotlkdb.com/?spell=57244, -8.5752, 15.525, 6.9498, 44.8
Glyph of Scourge Imprisonment, https://wotlkdb.com/?spell=57198, -8.6007, 16.5, 7.8993, 47.9
Glyph of Shred, https://wotlkdb.com/?spell=56957, -8.6752, 21.125, 12.4498, 58.9
Jadefire Ink, https://wotlkdb.com/?spell=57707, -8.7252, 24, 15.2748, 63.6
Glyph of Mass Dispel, https://wotlkdb.com/?spell=57190, -8.8, 16.5, 7.7, 46.7
Fire Eater's Guide, https://wotlkdb.com/?spell=59489, -8.8, 33.8, 25, 74
Glyph of Execution, https://wotlkdb.com/?spell=57156, -9.11, 21.125, 12.015, 56.9
Glyph of Howl of Terror, https://wotlkdb.com/?spell=57267, -9.5, 16.5, 7, 42.4
Armor Vellum III, https://wotlkdb.com/?spell=59500, -9.5, 17, 7.5, 44.1
Weapon Vellum II, https://wotlkdb.com/?spell=59488, -9.75, 16, 6.25, 39.1
Glyph of Scourge Strike, https://wotlkdb.com/?spell=57224, -10.45, 12.45, 2, 16.1
Glyph of Imp, https://wotlkdb.com/?spell=57269, -10.513, 16.5125, 5.9995, 36.3
Glyph of Smite, https://wotlkdb.com/?spell=57201, -10.525, 15.525, 5, 32.2
Glyph of Arcane Explosion, https://wotlkdb.com/?spell=56968, -10.5521, 16.5015, 5.9494, 36.1
Glyph of Feint, https://wotlkdb.com/?spell=57122, -10.5751, 12.075, 1.4999, 12.4
Glyph of Deterrence, https://wotlkdb.com/?spell=57000, -10.6946, 15.4125, 4.7179, 30.6
Glyph of Rake, https://wotlkdb.com/?spell=56952, -10.9503, 12.45, 1.4997, 12
Glyph of Frost Trap, https://wotlkdb.com/?spell=57003, -11.2504, 12.45, 1.1996, 9.6
Scroll of Agility VI, https://wotlkdb.com/?spell=58481, -11.4171, 12.2, 0.7829, 6.4
Glyph of Unbreakable Armor, https://wotlkdb.com/?spell=57226, -11.4501, 12.45, 0.9999, 8
Glyph of Arcane Power, https://wotlkdb.com/?spell=56972, -11.515, 12.45, 0.935, 7.5
Glyph of Lifebloom, https://wotlkdb.com/?spell=56949, -11.525, 16.5, 4.975, 30.2
Glyph of Healing Touch, https://wotlkdb.com/?spell=56945, -11.5726, 16.5125, 4.9399, 29.9
Scroll of Intellect VI, https://wotlkdb.com/?spell=50602, -11.71, 12.2, 0.49, 4
Scroll of Strength VI, https://wotlkdb.com/?spell=58489, -12.1763, 12.2, 0.0237, 0.2
Glyph of Blood Strike, https://wotlkdb.com/?spell=59339, -12.25, 12.45, 0.2, 1.6
Glyph of Gouge, https://wotlkdb.com/?spell=57125, -12.2873, 15.2873, 3, 19.6
Weapon Vellum, https://wotlkdb.com/?spell=52840, -12.353, 22.353, 10, 44.7
Glyph of Mana Tide Totem, https://wotlkdb.com/?spell=57247, -12.5201, 16.5, 3.9799, 24.1
Glyph of Fear, https://wotlkdb.com/?spell=57262, -12.5527, 16.5125, 3.9598, 24
Glyph of Ice Block, https://wotlkdb.com/?spell=56979, -12.5651, 15.525, 2.9599, 19.1
Ink of the Sky, https://wotlkdb.com/?spell=57712, -12.7776, 13.0275, 0.2499, 1.9
Glyph of Revenge, https://wotlkdb.com/?spell=57165, -12.8174, 15.2873, 2.4699, 16.2
Glyph of Searing Pain, https://wotlkdb.com/?spell=57270, -13.0251, 15.525, 2.4999, 16.1
Glyph of Shadow Bolt, https://wotlkdb.com/?spell=57271, -13.2875, 15.2873, 1.9998, 13.1
Glyph of Immolation Trap, https://wotlkdb.com/?spell=57005, -14.0526, 16.5125, 2.4599, 14.9
Glyph of Cleansing, https://wotlkdb.com/?spell=57020, -14.2674, 15.2873, 1.0199, 6.7
Glyph of Rebirth, https://wotlkdb.com/?spell=56953, -14.2874, 15.2873, 0.9999, 6.5
Glyph of Multi-Shot, https://wotlkdb.com/?spell=57007, -14.2874, 15.2873, 0.9999, 6.5
Glyph of Frost Shock, https://wotlkdb.com/?spell=57241, -14.2874, 15.2873, 0.9999, 6.5
Glyph of Voidwalker, https://wotlkdb.com/?spell=57277, -14.2973, 15.2873, 0.99, 6.5
Glyph of Lava Lash, https://wotlkdb.com/?spell=57249, -14.3274, 15.2873, 0.9599, 6.3
Glyph of Entangling Roots, https://wotlkdb.com/?spell=48121, -14.4058, 16.5015, 2.0957, 12.7
Glyph of Bone Shield, https://wotlkdb.com/?spell=57210, -14.4282, 21.125, 6.6968, 31.7
Scroll of Strength III, https://wotlkdb.com/?spell=58486, -14.4298, 15.2998, 0.87, 5.7
Glyph of Sap, https://wotlkdb.com/?spell=57129, -14.4474, 15.2873, 0.8399, 5.5
Glyph of Ice Lance, https://wotlkdb.com/?spell=56980, -14.4778, 16.5, 2.0222, 12.3
Scroll of Recall III, https://wotlkdb.com/?spell=60337, -14.5, 16.5, 2, 12.1
Glyph of Strangulate, https://wotlkdb.com/?spell=57225, -14.5203, 16.5, 1.9797, 12
Glyph of Crusader Strike, https://wotlkdb.com/?spell=57024, -14.5753, 15.525, 0.9497, 6.1
Glyph of Barbaric Insults, https://wotlkdb.com/?spell=57151, -14.585, 15.525, 0.94, 6.1
Glyph of Divinity, https://wotlkdb.com/?spell=57031, -14.5926, 16.5125, 1.9199, 11.6
Glyph of Dispel Magic, https://wotlkdb.com/?spell=57183, -14.6851, 15.525, 0.8399, 5.4
Scroll of Intellect IV, https://wotlkdb.com/?spell=50600, -14.7, 15.65, 0.95, 6.1
Scroll of Strength IV, https://wotlkdb.com/?spell=58487, -14.775, 15.65, 0.875, 5.6
Scroll of Intellect III, https://wotlkdb.com/?spell=50599, -14.8098, 15.2998, 0.49, 3.2
Glyph of Health Funnel, https://wotlkdb.com/?spell=57265, -14.8129, 16.5125, 1.6996, 10.3
Scroll of Agility IV, https://wotlkdb.com/?spell=58478, -14.9, 15.65, 0.75, 4.8
Celestial Ink, https://wotlkdb.com/?spell=57709, -15, 30.4, 15.4, 50.7
Scroll of Agility III, https://wotlkdb.com/?spell=58476, -15.0098, 15.2998, 0.29, 1.9
Scroll of Spirit IV, https://wotlkdb.com/?spell=50607, -15.015, 15.65, 0.635, 4.1
Glyph of Soulstone, https://wotlkdb.com/?spell=57274, -15.0451, 15.525, 0.4799, 3.1
Scroll of Stamina III, https://wotlkdb.com/?spell=50614, -15.1753, 15.2998, 0.1245, 0.8
Scroll of Spirit III, https://wotlkdb.com/?spell=50606, -15.1803, 15.2998, 0.1195, 0.8
Scroll of Recall II, https://wotlkdb.com/?spell=60336, -15.3551, 15.4125, 0.0574, 0.4
Glyph of Garrote, https://wotlkdb.com/?spell=57123, -15.483, 16.5125, 1.0295, 6.2
Glyph of Sunder Armor, https://wotlkdb.com/?spell=57167, -15.493, 16.5125, 1.0195, 6.2
Scroll of Stamina IV, https://wotlkdb.com/?spell=50616, -15.53, 15.65, 0.12, 0.8
Scroll of Agility VIII, https://wotlkdb.com/?spell=58483, -16.01, 17, 0.99, 5.8
Scroll of Strength VIII, https://wotlkdb.com/?spell=58491, -16.01, 17, 0.99, 5.8
Scroll of Spirit VIII, https://wotlkdb.com/?spell=50611, -16.0101, 17, 0.9899, 5.8
Scroll of Intellect VIII, https://wotlkdb.com/?spell=50604, -16.02, 17, 0.98, 5.8
Scroll of Stamina VIII, https://wotlkdb.com/?spell=50620, -16.02, 17, 0.98, 5.8
Glyph of Monsoon, https://wotlkdb.com/?spell=64258, -16.6254, 21.125, 4.4996, 21.3
Scroll of Intellect VII, https://wotlkdb.com/?spell=50603, -16.897, 17, 0.103, 0.6
Scroll of Strength VII, https://wotlkdb.com/?spell=58490, -16.9127, 17, 0.0873, 0.5
Scroll of Agility VII, https://wotlkdb.com/?spell=58482, -16.9345, 17, 0.0655, 0.4
Scroll of Stamina VII, https://wotlkdb.com/?spell=50619, -16.9598, 17, 0.0402, 0.2
Scroll of Spirit VII, https://wotlkdb.com/?spell=50610, -16.9746, 17, 0.0254, 0.1
Glyph of Shadowburn, https://wotlkdb.com/?spell=57272, -18.3851, 21.125, 2.7399, 13
Glyph of Death Grip, https://wotlkdb.com/?spell=57213, -18.7252, 21.125, 2.3998, 11.4
Ethereal Ink, https://wotlkdb.com/?spell=57713, -19.25, 31.2, 11.95, 38.3
Tome of Kings, https://wotlkdb.com/?spell=59484, -19.5971, 31.0971, 11.5, 37
Scroll of Stamina V, https://wotlkdb.com/?spell=50617, -19.61, 21.25, 1.64, 7.7
Glyph of Freezing Trap, https://wotlkdb.com/?spell=57002, -20.1251, 21.125, 0.9999, 4.7
Glyph of Fear Ward, https://wotlkdb.com/?spell=57185, -20.1551, 21.125, 0.9699, 4.6
Scroll of Intellect V, https://wotlkdb.com/?spell=50601, -20.75, 21.25, 0.5, 2.4
Scroll of Stamina VI, https://wotlkdb.com/?spell=50618, -20.75, 21.25, 0.5, 2.4
Scroll of Agility V, https://wotlkdb.com/?spell=58480, -20.76, 21.25, 0.49, 2.3
Scroll of Strength V, https://wotlkdb.com/?spell=58488, -20.76, 21.25, 0.49, 2.3
Scroll of Spirit VI, https://wotlkdb.com/?spell=50609, -20.8001, 21.25, 0.4499, 2.1
Scroll of Spirit V, https://wotlkdb.com/?spell=50608, -20.96, 21.25, 0.29, 1.4
Weapon Vellum III, https://wotlkdb.com/?spell=59501, -21.1, 49, 27.9, 56.9
Book of Clever Tricks, https://wotlkdb.com/?spell=59496, -21.7094, 41.6594, 19.95, 47.9
Royal Guide of Escape Routes, https://wotlkdb.com/?spell=59486, -22.0971, 31.0971, 9, 28.9
Book of Survival, https://wotlkdb.com/?spell=59478, -23.5075, 33.5075, 10, 29.8
Tome of the Dawn, https://wotlkdb.com/?spell=59475, -24.5175, 33.5075, 8.99, 26.8
Book of Stars, https://wotlkdb.com/?spell=59490, -32.8, 33.8, 1, 3
Stormbound Tome, https://wotlkdb.com/?spell=59493, -85.9842, 86.1242, 0.14, 0.2
Manual of Clouds, https://wotlkdb.com/?spell=59494, -87.1092, 87.2492, 0.14, 0.2
