Glyph of Deterrence, https://wotlkdb.com/?spell=57000, -1.5125, 4.0125, 2.5, 62.3
Glyph of Smite, https://wotlkdb.com/?spell=57201, -1.6251, 4.125, 2.4999, 60.6
Glyph of Growl, https://wotlkdb.com/?spell=56944, -2, 16, 14, 87.5
Glyph of Maul, https://wotlkdb.com/?spell=56961, -2.0015, 12.0015, 10, 83.3
Glyph of Spiritual Attunement, https://wotlkdb.com/?spell=57022, -2.0015, 12.0015, 10, 83.3
Glyph of Hammer of Justice, https://wotlkdb.com/?spell=57027, -2.0516, 12.0015, 9.9499, 82.9
Glyph of Searing Pain, https://wotlkdb.com/?spell=57270, -2.145, 4.125, 1.98, 48
Glyph of Frost Nova, https://wotlkdb.com/?spell=56976, -2.2015, 12.0015, 9.8, 81.7
Fiery Ink, https://wotlkdb.com/?spell=57710, -2.2249, 3.2049, 0.98, 30.6
Darkflame Ink, https://wotlkdb.com/?spell=57714, -2.39, 2.97, 0.58, 19.5
Glyph of Barbaric Insults, https://wotlkdb.com/?spell=57151, -2.625, 4.125, 1.5, 36.4
Glyph of Thunderstorm, https://wotlkdb.com/?spell=57253, -2.65, 16, 13.35, 83.4
Armor Vellum III, https://wotlkdb.com/?spell=59500, -2.8, 16.5, 13.7, 83
Armor Vellum, https://wotlkdb.com/?spell=52739, -2.9344, 3.863, 0.9286, 24
Scroll of Recall II, https://wotlkdb.com/?spell=60336, -3.0125, 4.0125, 1, 24.9
Glyph of Shadow Word: Death, https://wotlkdb.com/?spell=57199, -3.1, 16, 12.9, 80.6
Scroll of Recall, https://wotlkdb.com/?spell=48248, -3.2465, 3.8615, 0.615, 15.9
Scroll of Agility IV, https://wotlkdb.com/?spell=58478, -3.27, 4.25, 0.98, 23.1
Scroll of Agility III, https://wotlkdb.com/?spell=58476, -3.275, 8.025, 4.75, 59.2
Scroll of Strength IV, https://wotlkdb.com/?spell=58487, -3.38, 4.25, 0.87, 20.5
Scroll of Spirit IV, https://wotlkdb.com/?spell=50607, -3.5425, 4.25, 0.7075, 16.6
Glyph of Soulstone, https://wotlkdb.com/?spell=57274, -3.635, 4.125, 0.49, 11.9
Scroll of Stamina IV, https://wotlkdb.com/?spell=50616, -3.74, 4.25, 0.51, 12
Glyph of Rune Tap, https://wotlkdb.com/?spell=59338, -3.89, 16.49, 12.6, 76.4
Glyph of Mirror Image, https://wotlkdb.com/?spell=64314, -4, 16, 12, 75
Scroll of Intellect IV, https://wotlkdb.com/?spell=50600, -4.13, 4.25, 0.12, 2.8
Ivory Ink, https://wotlkdb.com/?spell=52738, -4.4825, 5, 0.5175, 10.4
Glyph of Rake, https://wotlkdb.com/?spell=56952, -4.49, 16.49, 12, 72.8
Glyph of Seal of Command, https://wotlkdb.com/?spell=57033, -4.49, 16.49, 12, 72.8
Stormbound Tome, https://wotlkdb.com/?spell=59493, -4.925, 79.925, 75, 93.8
Glyph of Sunder Armor, https://wotlkdb.com/?spell=57167, -5.0125, 10.0125, 5, 49.9
Glyph of Hunter's Mark, https://wotlkdb.com/?spell=57004, -5.0265, 12.0015, 6.975, 58.1
Scroll of Stamina III, https://wotlkdb.com/?spell=50614, -5.045, 8.025, 2.98, 37.1
Glyph of Garrote, https://wotlkdb.com/?spell=57123, -5.0525, 10.0125, 4.96, 49.5
Glyph of Multi-Shot, https://wotlkdb.com/?spell=57007, -5.1525, 8.0125, 2.86, 35.7
Glyph of Mass Dispel, https://wotlkdb.com/?spell=57190, -5.3, 16, 10.7, 66.9
Glyph of Crippling Poison, https://wotlkdb.com/?spell=57116, -5.95, 16, 10.05, 62.8
Celestial Ink, https://wotlkdb.com/?spell=57709, -5.9998, 9.9998, 4, 40
Glyph of Scourge Imprisonment, https://wotlkdb.com/?spell=57198, -6, 16, 10, 62.5
Glyph of Chains of Ice, https://wotlkdb.com/?spell=57211, -6, 16, 10, 62.5
Glyph of Icebound Fortitude, https://wotlkdb.com/?spell=57218, -6, 16, 10, 62.5
Glyph of Felhunter, https://wotlkdb.com/?spell=57264, -6.0375, 16, 9.9625, 62.3
Scroll of Strength III, https://wotlkdb.com/?spell=58486, -6.045, 8.025, 1.98, 24.7
Moonglow Ink, https://wotlkdb.com/?spell=52843, -6.14, 10, 3.86, 38.6
Glyph of Monsoon, https://wotlkdb.com/?spell=64258, -6.225, 14.075, 7.85, 55.8
Book of Clever Tricks, https://wotlkdb.com/?spell=59496, -6.45, 56.45, 50, 88.6
Glyph of Holy Nova, https://wotlkdb.com/?spell=57187, -6.49, 16.49, 10, 60.6
Glyph of Death Strike, https://wotlkdb.com/?spell=59340, -6.49, 16.49, 10, 60.6
Glyph of Sap, https://wotlkdb.com/?spell=57129, -6.5125, 8.0125, 1.5, 18.7
Glyph of Rapid Fire, https://wotlkdb.com/?spell=57008, -6.8, 16.49, 9.69, 58.8
Tome of Kings, https://wotlkdb.com/?spell=59484, -6.875, 19.875, 13, 65.4
Glyph of Invisibility, https://wotlkdb.com/?spell=56983, -6.98, 16, 9.02, 56.4
Glyph of Wyvern Sting, https://wotlkdb.com/?spell=57014, -7, 16, 9, 56.3
Scroll of Recall III, https://wotlkdb.com/?spell=60337, -7, 16, 9, 56.3
Glyph of Cleansing, https://wotlkdb.com/?spell=57020, -7.0125, 8.0125, 1, 12.5
Glyph of Lava Lash, https://wotlkdb.com/?spell=57249, -7.0125, 8.0125, 1, 12.5
Glyph of Voidwalker, https://wotlkdb.com/?spell=57277, -7.0125, 8.0125, 1, 12.5
Glyph of Lightning Shield, https://wotlkdb.com/?spell=57246, -7.0215, 12.0015, 4.98, 41.5
Glyph of Bone Shield, https://wotlkdb.com/?spell=57210, -7.075, 14.075, 7, 49.7
Scroll of Spirit III, https://wotlkdb.com/?spell=50606, -7.125, 8.025, 0.9, 11.2
Glyph of Frost Shock, https://wotlkdb.com/?spell=57241, -7.1325, 8.0125, 0.88, 11
Snowfall Ink, https://wotlkdb.com/?spell=57716, -7.27, 16.96, 9.69, 57.1
Glyph of Ambush, https://wotlkdb.com/?spell=57113, -7.44, 16.49, 9.05, 54.9
Glyph of Windfury Weapon, https://wotlkdb.com/?spell=57252, -7.44, 16.49, 9.05, 54.9
Glyph of Shadow Bolt, https://wotlkdb.com/?spell=57271, -7.5125, 8.0125, 0.5, 6.2
Scroll of Intellect III, https://wotlkdb.com/?spell=50599, -7.845, 8.025, 0.18, 2.2
Glyph of Howl of Terror, https://wotlkdb.com/?spell=57267, -8, 16, 8, 50
Glyph of Focus, https://wotlkdb.com/?spell=62162, -8, 16, 8, 50
Glyph of Fire Elemental Totem, https://wotlkdb.com/?spell=57237, -8.0001, 16, 7.9999, 50
Glyph of Healthstone, https://wotlkdb.com/?spell=57266, -8.0015, 12.0015, 4, 33.3
Glyph of Claw, https://wotlkdb.com/?spell=67600, -8.0015, 12.0015, 4, 33.3
Glyph of Imp, https://wotlkdb.com/?spell=57269, -8.0125, 10.0125, 2, 20
Glyph of Immolation Trap, https://wotlkdb.com/?spell=57005, -8.0325, 10.0125, 1.98, 19.8
Glyph of Divinity, https://wotlkdb.com/?spell=57031, -8.9625, 10.0125, 1.05, 10.5
Glyph of Mind Control, https://wotlkdb.com/?spell=57191, -9, 16, 7, 43.8
Glyph of Evasion, https://wotlkdb.com/?spell=57119, -9.0015, 12.0015, 3, 25
Glyph of Corruption, https://wotlkdb.com/?spell=57259, -9.0015, 12.0015, 3, 25
Royal Guide of Escape Routes, https://wotlkdb.com/?spell=59486, -9.875, 19.875, 10, 50.3
Glyph of Rapid Charge, https://wotlkdb.com/?spell=57162, -10.0015, 12.0015, 2, 16.7
Glyph of Fear Ward, https://wotlkdb.com/?spell=57185, -10.0951, 14.075, 3.9799, 28.3
Tome of the Dawn, https://wotlkdb.com/?spell=59475, -10.325, 23.875, 13.55, 56.8
Glyph of Blood Strike, https://wotlkdb.com/?spell=59339, -10.49, 16.49, 6, 36.4
Glyph of Hymn of Hope, https://wotlkdb.com/?spell=64283, -10.715, 16.49, 5.775, 35
Scroll of Intellect II, https://wotlkdb.com/?spell=50598, -11.0115, 12.0015, 0.99, 8.2
Glyph of Freezing Trap, https://wotlkdb.com/?spell=57002, -11.0751, 14.075, 2.9999, 21.3
Glyph of Psychic Scream, https://wotlkdb.com/?spell=57196, -11.3615, 12.0015, 0.64, 5.3
Glyph of Scourge Strike, https://wotlkdb.com/?spell=57224, -11.49, 16.49, 5, 30.3
Glyph of Unbreakable Armor, https://wotlkdb.com/?spell=57226, -11.51, 16.49, 4.98, 30.2
Scroll of Stamina II, https://wotlkdb.com/?spell=50612, -11.7215, 12.0015, 0.28, 2.3
Scroll of Agility II, https://wotlkdb.com/?spell=58473, -11.8015, 12.0015, 0.2, 1.7
Scroll of Spirit II, https://wotlkdb.com/?spell=50605, -11.8535, 12.0015, 0.148, 1.2
Scroll of Strength II, https://wotlkdb.com/?spell=58485, -11.9015, 12.0015, 0.1, 0.8
Twilight Tome, https://wotlkdb.com/?spell=64053, -12.48, 112.48, 100, 88.9
Glyph of Feint, https://wotlkdb.com/?spell=57122, -12.4898, 16.115, 3.6252, 22.5
Scroll of Stamina VI, https://wotlkdb.com/?spell=50618, -12.72, 14.2, 1.48, 10.4
Scroll of Strength V, https://wotlkdb.com/?spell=58488, -13.22, 14.2, 0.98, 6.9
Scroll of Spirit V, https://wotlkdb.com/?spell=50608, -13.35, 14.2, 0.85, 6
Glyph of Arcane Power, https://wotlkdb.com/?spell=56972, -13.51, 16.49, 2.98, 18.1
Scroll of Stamina V, https://wotlkdb.com/?spell=50617, -13.65, 14.2, 0.55, 3.9
Scroll of Intellect V, https://wotlkdb.com/?spell=50601, -13.66, 14.2, 0.54, 3.8
Scroll of Agility V, https://wotlkdb.com/?spell=58480, -14.1005, 14.2, 0.0995, 0.7
Scroll of Spirit VI, https://wotlkdb.com/?spell=50609, -14.1637, 14.2, 0.0363, 0.3
Glyph of Mage Armor, https://wotlkdb.com/?spell=56984, -14.49, 16.49, 2, 12.1
Scroll of Agility VIII, https://wotlkdb.com/?spell=58483, -14.5, 16.5, 2, 12.1
Scroll of Intellect VIII, https://wotlkdb.com/?spell=50604, -14.58, 16.5, 1.92, 11.6
Glyph of Strangulate, https://wotlkdb.com/?spell=57225, -15.12, 16, 0.88, 5.5
Scroll of Stamina VIII, https://wotlkdb.com/?spell=50620, -15.25, 16.5, 1.25, 7.6
Scroll of Agility VI, https://wotlkdb.com/?spell=58481, -15.59, 16.24, 0.65, 4
Scroll of Spirit VIII, https://wotlkdb.com/?spell=50611, -16, 16.5, 0.5, 3
Scroll of Strength VI, https://wotlkdb.com/?spell=58489, -16.02, 16.24, 0.22, 1.4
Scroll of Intellect VI, https://wotlkdb.com/?spell=50602, -16.19, 16.24, 0.05, 0.3
Scroll of Strength VIII, https://wotlkdb.com/?spell=58491, -16.28, 16.5, 0.22, 1.3
Scroll of Strength VII, https://wotlkdb.com/?spell=58490, -16.4105, 16.5, 0.0895, 0.5
Scroll of Stamina VII, https://wotlkdb.com/?spell=50619, -16.4612, 16.5, 0.0388, 0.2
Scroll of Agility VII, https://wotlkdb.com/?spell=58482, -16.4664, 16.5, 0.0336, 0.2
Scroll of Intellect VII, https://wotlkdb.com/?spell=50603, -16.473, 16.5, 0.027, 0.2
Scroll of Spirit VII, https://wotlkdb.com/?spell=50610, -16.4753, 16.5, 0.0247, 0.1
Weapon Vellum III, https://wotlkdb.com/?spell=59501, -19.2, 47.5, 28.3, 59.6
Book of Survival, https://wotlkdb.com/?spell=59478, -23.275, 23.875, 0.6, 2.5
Mystic Tome, https://wotlkdb.com/?spell=58565, -29.015, 39.015, 10, 25.6
Weapon Vellum, https://wotlkdb.com/?spell=52840, -29.053, 36.003, 6.95, 19.3
Manual of Clouds, https://wotlkdb.com/?spell=59494, -61.05, 81.05, 20, 24.7
