Name, Link, Profit, Cost, Sell, ROI %
Delicate Eternium Ring, https://wotlkdb.com/?spell=31060, 2354.9064, 504.98, 2859.8864, 566.3
Heavy Felsteel Ring, https://wotlkdb.com/?spell=31058, 1234.393, 480.675, 1715.068, 356.8
Teardrop Crimson Spinel, https://wotlkdb.com/?spell=39710, 687.05, 12.95, 700, 5405.4
Delicate Crimson Spinel, https://wotlkdb.com/?spell=39706, 437.05, 12.95, 450, 3474.9
Runed Crimson Spinel, https://wotlkdb.com/?spell=39711, 437.05, 12.95, 450, 3474.9
Mystical Skyfire Diamond, https://wotlkdb.com/?spell=32872, 403.25, 129.75, 533, 410.8
Blazing Citrine Ring, https://wotlkdb.com/?spell=25617, 350.3248, 12.4286, 362.7534, 2918.7
Bold Crimson Spinel, https://wotlkdb.com/?spell=39705, 336.8, 12.95, 349.75, 2700.8
Powerful Earthstorm Diamond, https://wotlkdb.com/?spell=32866, 301, 99, 400, 404
Titanium Spellshock Ring, https://wotlkdb.com/?spell=56498, 266.7465, 829.5, 1096.2465, 132.2
Titanium Earthguard Ring, https://wotlkdb.com/?spell=56497, 263.5801, 736.1664, 999.7465, 135.8
Titanium Frostguard Ring, https://wotlkdb.com/?spell=58954, 248.8034, 496.2, 745.0034, 150.1
Savage Titanium Ring, https://wotlkdb.com/?spell=58492, 233.2463, 575.6, 808.8463, 140.5
Windfire Band, https://wotlkdb.com/?spell=58149, 228.0764, 321.8, 549.8764, 170.9
Titanium Spellshock Necklace, https://wotlkdb.com/?spell=56501, 203.4264, 895.5, 1098.9264, 122.7
Titanium Earthguard Chain, https://wotlkdb.com/?spell=56500, 180.7397, 779.4996, 960.2393, 123.2
Ring of Northern Tears, https://wotlkdb.com/?spell=58150, 172.9801, 119, 291.9801, 245.4
Effulgent Skyflare Diamond, https://wotlkdb.com/?spell=55384, 147.4768, 49.4, 196.8768, 398.5
Savage Titanium Band, https://wotlkdb.com/?spell=58507, 142.6464, 575.6, 718.2464, 124.8
Ring of Earthen Might, https://wotlkdb.com/?spell=58147, 132.3136, 112.6666, 244.9802, 217.4
Resplendent Monarch Topaz, https://wotlkdb.com/?spell=53978, 118.8764, 79, 197.8764, 250.5
Lucent Monarch Topaz, https://wotlkdb.com/?spell=53981, 118.8763, 79, 197.8763, 250.5
Veiled Monarch Topaz, https://wotlkdb.com/?spell=53985, 118.7527, 79, 197.7527, 250.3
Glimmering Monarch Topaz, https://wotlkdb.com/?spell=53993, 115.7499, 79, 194.7499, 246.5
Ring of Scarlet Shadows, https://wotlkdb.com/?spell=58148, 104.25, 325.75, 430, 132
Glinting Monarch Topaz, https://wotlkdb.com/?spell=53980, 97.75, 79, 176.75, 223.7
The Aquamarine Ward, https://wotlkdb.com/?spell=26887, 94.5001, 5.4999, 100, 1818.2
Precise Cardinal Ruby, https://wotlkdb.com/?spell=66450, 93, 225, 318, 141.3
Trenchant Earthsiege Diamond, https://wotlkdb.com/?spell=55403, 83.625, 116.375, 200, 171.9
Invigorating Earthsiege Diamond, https://wotlkdb.com/?spell=55404, 83.625, 116.375, 200, 171.9
Prismatic Black Diamond, https://wotlkdb.com/?spell=62941, 74.8355, 0.1645, 75, 45592.7
Runed Cardinal Ruby, https://wotlkdb.com/?spell=66446, 74, 225, 299, 132.9
Delicate Cardinal Ruby, https://wotlkdb.com/?spell=66448, 71.3, 225, 296.3, 131.7
Fractured Cardinal Ruby, https://wotlkdb.com/?spell=66451, 69.75, 225, 294.75, 131
Bold Cardinal Ruby, https://wotlkdb.com/?spell=66447, 69, 225, 294, 130.7
Bright Cardinal Ruby, https://wotlkdb.com/?spell=66449, 69, 225, 294, 130.7
Radiant Forest Emerald, https://wotlkdb.com/?spell=54012, 66.8901, 4.5099, 71.4, 1583.2
Jagged Forest Emerald, https://wotlkdb.com/?spell=53996, 66.5838, 4.5099, 71.0937, 1576.4
Sundered Forest Emerald, https://wotlkdb.com/?spell=54008, 65.4901, 4.5099, 70, 1552.1
Opaque Forest Emerald, https://wotlkdb.com/?spell=54010, 64.2165, 4.5099, 68.7264, 1523.9
Empowered Monarch Topaz, https://wotlkdb.com/?spell=53990, 63.5427, 79, 142.5427, 180.4
Bronze Band of Force, https://wotlkdb.com/?spell=37818, 62.5175, 17.4825, 80, 457.6
Lambent Forest Emerald, https://wotlkdb.com/?spell=54009, 61.243, 4.5099, 65.7529, 1458
Subtle Scarlet Ruby, https://wotlkdb.com/?spell=53948, 60.5015, 129.75, 190.2515, 146.6
Vivid Forest Emerald, https://wotlkdb.com/?spell=53997, 59.9465, 4.5099, 64.4564, 1429.2
Runed Mana Band, https://wotlkdb.com/?spell=64727, 56.9565, 115.8, 172.7565, 149.2
Moonsoul Crown, https://wotlkdb.com/?spell=25321, 56.3233, 43.6767, 100, 229
Energized Eye of Zul, https://wotlkdb.com/?spell=66442, 54.9501, 88.7999, 143.75, 161.9
Flashing Scarlet Ruby, https://wotlkdb.com/?spell=53949, 53.0029, 129.75, 182.7529, 140.9
Vivid Eye of Zul, https://wotlkdb.com/?spell=66429, 50.9501, 88.7999, 139.75, 157.4
Delicate Scarlet Ruby, https://wotlkdb.com/?spell=53945, 50.1265, 129.75, 179.8765, 138.6
Rigid Autumn's Glow, https://wotlkdb.com/?spell=53958, 50.0029, 114.75, 164.7529, 143.6
Stark Ametrine, https://wotlkdb.com/?spell=66587, 50, 200, 250, 125
Lucent Ametrine, https://wotlkdb.com/?spell=66585, 49.4999, 200, 249.4999, 124.7
Luminous Ametrine, https://wotlkdb.com/?spell=66566, 48.7499, 200, 248.7499, 124.4
Wicked Moonstone Ring, https://wotlkdb.com/?spell=25323, 47.2011, 102.7989, 150, 145.9
Deadly Ametrine, https://wotlkdb.com/?spell=66568, 46, 200, 246, 123
Accurate Ametrine, https://wotlkdb.com/?spell=66576, 46, 200, 246, 123
Etched Ametrine, https://wotlkdb.com/?spell=66572, 45.99, 200, 245.99, 123
Luminous Monarch Topaz, https://wotlkdb.com/?spell=53983, 45.7428, 79, 124.7428, 157.9
Fierce Ametrine, https://wotlkdb.com/?spell=66583, 45, 200, 245, 122.5
Sky Sapphire Amulet, https://wotlkdb.com/?spell=64726, 44.2765, 121.6, 165.8765, 136.4
Revitalizing Skyflare Diamond, https://wotlkdb.com/?spell=55407, 43.75, 49.4, 93.15, 188.6
Flashing Cardinal Ruby, https://wotlkdb.com/?spell=66453, 43.737, 225, 268.737, 119.4
Veiled Ametrine, https://wotlkdb.com/?spell=66570, 42.7498, 200, 242.7498, 121.4
Misty Eye of Zul, https://wotlkdb.com/?spell=66435, 42.2001, 88.7999, 131, 147.5
Shining Eye of Zul, https://wotlkdb.com/?spell=66437, 41.1999, 88.7999, 129.9998, 146.4
Shattered Eye of Zul, https://wotlkdb.com/?spell=66443, 40.9501, 88.7999, 129.75, 146.1
Champion's Ametrine, https://wotlkdb.com/?spell=66579, 38.9996, 200, 238.9996, 119.5
Deft Ametrine, https://wotlkdb.com/?spell=66584, 38.75, 200, 238.75, 119.4
Golden Ring of Power, https://wotlkdb.com/?spell=34955, 38.5124, 11.4876, 50, 435.3
Glimmering Ametrine, https://wotlkdb.com/?spell=66578, 37.75, 200, 237.75, 118.9
Pristine Ametrine, https://wotlkdb.com/?spell=66573, 36.9999, 200, 236.9999, 118.5
Wicked Ametrine, https://wotlkdb.com/?spell=66577, 36.9999, 200, 236.9999, 118.5
Stalwart Ametrine, https://wotlkdb.com/?spell=66581, 36.5, 200, 236.5, 118.3
Forceful Eye of Zul, https://wotlkdb.com/?spell=66434, 35.7001, 88.7999, 124.5, 140.2
Intricate Forest Emerald, https://wotlkdb.com/?spell=54006, 35.3666, 4.5099, 39.8765, 884.2
Potent Ametrine, https://wotlkdb.com/?spell=66569, 35.125, 200, 235.125, 117.6
Empowered Ametrine, https://wotlkdb.com/?spell=66580, 34.9898, 200, 234.9898, 117.5
Mystic King's Amber, https://wotlkdb.com/?spell=66505, 34.5, 210, 244.5, 116.4
Enduring Eye of Zul, https://wotlkdb.com/?spell=66338, 34.2001, 88.7999, 123, 138.5
Resolute Ametrine, https://wotlkdb.com/?spell=66586, 34, 200, 234, 117
Chaotic Skyflare Diamond, https://wotlkdb.com/?spell=55389, 33.4768, 49.4, 82.8768, 167.8
Enigmatic Skyflare Diamond, https://wotlkdb.com/?spell=55393, 33.4768, 49.4, 82.8768, 167.8
Rigid King's Amber, https://wotlkdb.com/?spell=66501, 33.25, 210, 243.25, 115.8
Jagged Eye of Zul, https://wotlkdb.com/?spell=66431, 32.9501, 88.7999, 121.75, 137.1
Tense Eye of Zul, https://wotlkdb.com/?spell=66438, 32.917, 88.7999, 121.7169, 137.1
Durable Ametrine, https://wotlkdb.com/?spell=66571, 32.7499, 200, 232.7499, 116.4
Ember Skyflare Diamond, https://wotlkdb.com/?spell=55392, 32.2436, 49.4, 81.6436, 165.3
Guardian's Dreadstone, https://wotlkdb.com/?spell=66561, 32, 113, 145, 128.3
Subtle Cardinal Ruby, https://wotlkdb.com/?spell=66452, 31.125, 225, 256.125, 113.8
Steady Eye of Zul, https://wotlkdb.com/?spell=66428, 30.9501, 88.7999, 119.75, 134.9
Energized Forest Emerald, https://wotlkdb.com/?spell=54011, 30.3666, 4.5099, 34.8765, 773.3
Glowing Twilight Opal, https://wotlkdb.com/?spell=53965, 29.8529, 4.9, 34.7529, 709.2
Brilliant King's Amber, https://wotlkdb.com/?spell=66503, 29.75, 210, 239.75, 114.2
Turbid Forest Emerald, https://wotlkdb.com/?spell=54005, 29.3666, 4.5099, 33.8765, 751.2
Solid Majestic Zircon, https://wotlkdb.com/?spell=66497, 29.2501, 134.9999, 164.25, 121.7
Reckless Ametrine, https://wotlkdb.com/?spell=66574, 29, 200, 229, 114.5
Intricate Eye of Zul, https://wotlkdb.com/?spell=66440, 28.9501, 88.7999, 117.75, 132.6
Smooth King's Amber, https://wotlkdb.com/?spell=66502, 28.75, 210, 238.75, 113.7
Ruby Crown of Restoration, https://wotlkdb.com/?spell=26878, 28.0068, 81.9932, 110, 134.2
Stormy Majestic Zircon, https://wotlkdb.com/?spell=66499, 27.7501, 134.9999, 162.75, 120.6
Forceful Forest Emerald, https://wotlkdb.com/?spell=54001, 27.3666, 4.5099, 31.8765, 706.8
Smooth Autumn's Glow, https://wotlkdb.com/?spell=53957, 27.1265, 114.75, 141.8765, 123.6
Puissant Twilight Opal, https://wotlkdb.com/?spell=53973, 27.0999, 4.9, 31.9999, 653.1
Lustrous Sky Sapphire, https://wotlkdb.com/?spell=53954, 27.0765, 7.8, 34.8765, 447.1
Royal Dreadstone, https://wotlkdb.com/?spell=66558, 27, 113, 140, 123.9
Shifting Twilight Opal, https://wotlkdb.com/?spell=53963, 26.9, 4.9, 31.8, 649
Quick King's Amber, https://wotlkdb.com/?spell=66506, 26, 210, 236, 112.4
Resplendent Ametrine, https://wotlkdb.com/?spell=66582, 25.375, 200, 225.375, 112.7
Sovereign Twilight Opal, https://wotlkdb.com/?spell=53962, 25.0999, 4.9, 29.9999, 612.2
Glinting Ametrine, https://wotlkdb.com/?spell=66575, 24.9999, 200, 224.9999, 112.5
Inscribed Ametrine, https://wotlkdb.com/?spell=66567, 24.9998, 200, 224.9998, 112.5
Thick King's Amber, https://wotlkdb.com/?spell=66504, 24.75, 210, 234.75, 111.8
Bold Scarlet Ruby, https://wotlkdb.com/?spell=53830, 24.1265, 129.75, 153.8765, 118.6
Defender's Twilight Opal, https://wotlkdb.com/?spell=53972, 24.1, 4.9, 29, 591.8
Balanced Dreadstone, https://wotlkdb.com/?spell=66553, 24, 113, 137, 121.2
Lambent Eye of Zul, https://wotlkdb.com/?spell=66439, 23.1866, 88.7999, 111.9865, 126.1
Forlorn Skyflare Diamond, https://wotlkdb.com/?spell=55387, 21.4768, 49.4, 70.8768, 143.5
Dazzling Eye of Zul, https://wotlkdb.com/?spell=66430, 21.2, 88.7999, 109.9999, 123.9
Seer's Eye of Zul, https://wotlkdb.com/?spell=66433, 20.2001, 88.7999, 109, 122.7
Enchanted Tear, https://wotlkdb.com/?spell=56531, 20.08, 9.92, 30, 302.4
Royal Twilight Opal, https://wotlkdb.com/?spell=53967, 19.9765, 4.9, 24.8765, 507.7
Potent Monarch Topaz, https://wotlkdb.com/?spell=53984, 19.7527, 79, 98.7527, 125
Opaque Eye of Zul, https://wotlkdb.com/?spell=66444, 19.2, 88.7999, 107.9999, 121.6
Mysterious Dreadstone, https://wotlkdb.com/?spell=66562, 17.9998, 113, 130.9998, 115.9
Enduring Forest Emerald, https://wotlkdb.com/?spell=53998, 17.7666, 4.5099, 22.2765, 493.9
Crystal Chalcedony Amulet, https://wotlkdb.com/?spell=58142, 17.575, 12.425, 30, 241.4
Mercurial Adamantite, https://wotlkdb.com/?spell=38068, 17.4, 82.6, 100, 121.1
Gem Studded Band, https://wotlkdb.com/?spell=26896, 17.3234, 22.6766, 40, 176.4
Glowing Dreadstone, https://wotlkdb.com/?spell=66555, 16.75, 113, 129.75, 114.8
Tense Forest Emerald, https://wotlkdb.com/?spell=54013, 16.3666, 4.5099, 20.8765, 462.9
Wicked Monarch Topaz, https://wotlkdb.com/?spell=53988, 15.8764, 79, 94.8764, 120.1
Seer's Forest Emerald, https://wotlkdb.com/?spell=54002, 15.8666, 4.5099, 20.3765, 451.8
Sovereign Dreadstone, https://wotlkdb.com/?spell=66554, 15.75, 113, 128.75, 113.9
Nightmare Tear, https://wotlkdb.com/?spell=68253, 15.2499, 124.75, 139.9999, 112.2
Runed Scarlet Ruby, https://wotlkdb.com/?spell=53946, 15, 129.75, 144.75, 111.6
Tenuous Twilight Opal, https://wotlkdb.com/?spell=53964, 14.9765, 4.9, 19.8765, 405.6
Regal Twilight Opal, https://wotlkdb.com/?spell=53971, 14.9765, 4.9, 19.8765, 405.6
Mysterious Twilight Opal, https://wotlkdb.com/?spell=53968, 14.8529, 4.9, 19.7529, 403.1
Band of Natural Fire, https://wotlkdb.com/?spell=26916, 14.1167, 5.7932, 19.9099, 343.7
Timeless Eye of Zul, https://wotlkdb.com/?spell=66432, 13.4501, 88.7999, 102.25, 115.1
Resplendent Huge Citrine, https://wotlkdb.com/?spell=53875, 13.275, 1.9399, 15.2149, 784.3
Reckless Huge Citrine, https://wotlkdb.com/?spell=53885, 13.0101, 1.9399, 14.95, 770.7
Guardian's Twilight Opal, https://wotlkdb.com/?spell=53974, 12.9765, 4.9, 17.8765, 364.8
Mysterious Shadow Crystal, https://wotlkdb.com/?spell=53865, 12.66, 0.64, 13.3, 2078.1
Infused Twilight Opal, https://wotlkdb.com/?spell=53970, 11.9, 4.9, 16.8, 342.9
Solid Sky Sapphire, https://wotlkdb.com/?spell=53952, 11.2, 7.8, 19, 243.6
Impassive Skyflare Diamond, https://wotlkdb.com/?spell=55388, 10.6, 49.4, 60, 121.5
Radiant Eye of Zul, https://wotlkdb.com/?spell=66441, 10.2, 88.7999, 98.9999, 111.5
Sundered Eye of Zul, https://wotlkdb.com/?spell=66436, 10.1001, 88.7999, 98.9, 111.4
Turbid Eye of Zul, https://wotlkdb.com/?spell=66445, 10.0999, 88.7999, 98.8998, 111.4
Purified Twilight Opal, https://wotlkdb.com/?spell=53966, 10.09, 4.9, 14.99, 305.9
Vivid Dark Jade, https://wotlkdb.com/?spell=53917, 9.7552, 5.45, 15.2052, 279
Shadow Crystal Focusing Lens, https://wotlkdb.com/?spell=56206, 9.36, 0.64, 10, 1562.5
Stormy Sky Sapphire, https://wotlkdb.com/?spell=53955, 9.0765, 7.8, 16.8765, 216.4
Inscribed Monarch Topaz, https://wotlkdb.com/?spell=53975, 9, 79, 88, 111.4
Puissant Dreadstone, https://wotlkdb.com/?spell=66563, 9, 113, 122, 108
Shifting Dreadstone, https://wotlkdb.com/?spell=66557, 8.6249, 113, 121.6249, 107.6
Emerald Choker, https://wotlkdb.com/?spell=64725, 8.4703, 66.5297, 75, 112.7
Defender's Shadow Crystal, https://wotlkdb.com/?spell=53869, 8.36, 0.64, 9, 1406.3
Stoneguard Band, https://wotlkdb.com/?spell=58145, 8.3334, 6.6666, 15, 225
Regal Dreadstone, https://wotlkdb.com/?spell=66559, 7.75, 113, 120.75, 106.9
Sun Rock Ring, https://wotlkdb.com/?spell=56194, 7.3, 2.7, 10, 370.4
Defender's Dreadstone, https://wotlkdb.com/?spell=66560, 7.25, 113, 120.25, 106.4
Bloodstone Band, https://wotlkdb.com/?spell=56193, 7.2401, 2.7599, 10, 362.3
Deadly Huge Citrine, https://wotlkdb.com/?spell=53877, 7.06, 1.9399, 8.9999, 463.9
Jade Dagger Pendant, https://wotlkdb.com/?spell=56195, 6.7669, 18.1131, 24.88, 137.4
Crystal Citrine Necklace, https://wotlkdb.com/?spell=58141, 6.7601, 2.7399, 9.5, 346.7
Steady Forest Emerald, https://wotlkdb.com/?spell=54000, 6.4801, 4.5099, 10.99, 243.7
Teardrop Living Ruby, https://wotlkdb.com/?spell=31087, 6.08, 3.82, 9.9, 259.2
Fierce Monarch Topaz, https://wotlkdb.com/?spell=54019, 6, 79, 85, 107.6
Thick Sun Crystal, https://wotlkdb.com/?spell=53855, 5.85, 1.9, 7.75, 407.9
Shattered Forest Emerald, https://wotlkdb.com/?spell=54014, 5.4801, 4.5099, 9.99, 221.5
Dream Signet, https://wotlkdb.com/?spell=56197, 5.3551, 74.6349, 79.99, 107.2
Fractured Scarlet Ruby, https://wotlkdb.com/?spell=53950, 5.25, 129.75, 135, 104
Fel Iron Blood Ring, https://wotlkdb.com/?spell=31048, 5.01, 4.99, 10, 200.4
Durable Huge Citrine, https://wotlkdb.com/?spell=53884, 4.6679, 1.9399, 6.6078, 340.6
Opaque Dark Jade, https://wotlkdb.com/?spell=53929, 4.55, 5.45, 10, 183.5
Runed Blood Garnet, https://wotlkdb.com/?spell=28906, 4.5032, 1, 5.5032, 550.3
Blood Sun Necklace, https://wotlkdb.com/?spell=56196, 4.2818, 20.7182, 25, 120.7
Bold Bloodstone, https://wotlkdb.com/?spell=53831, 4.0401, 1.9599, 6, 306.1
Rigid Sun Crystal, https://wotlkdb.com/?spell=53854, 4, 1.9, 5.9, 310.5
Potent Huge Citrine, https://wotlkdb.com/?spell=53882, 3.9601, 1.9399, 5.9, 304.1
Pristine Huge Citrine, https://wotlkdb.com/?spell=53887, 3.9601, 1.9399, 5.9, 304.1
Subtle Bloodstone, https://wotlkdb.com/?spell=53843, 3.7901, 1.9599, 5.75, 293.4
Shifting Shadow Crystal, https://wotlkdb.com/?spell=53860, 3.61, 0.64, 4.25, 664.1
Runed Bloodstone, https://wotlkdb.com/?spell=53834, 3.5901, 1.9599, 5.55, 283.2
Purified Shadow Crystal, https://wotlkdb.com/?spell=53863, 3.36, 0.64, 4, 625
Timeless Forest Emerald, https://wotlkdb.com/?spell=53995, 3.2901, 4.5099, 7.8, 173
Purified Shadow Pearl, https://wotlkdb.com/?spell=41429, 3.27, 1.73, 5, 289
Glowing Shadow Crystal, https://wotlkdb.com/?spell=53862, 3.11, 0.64, 3.75, 585.9
Stark Huge Citrine, https://wotlkdb.com/?spell=53889, 3.0601, 1.9399, 5, 257.7
Luminous Huge Citrine, https://wotlkdb.com/?spell=53881, 3.0401, 1.9399, 4.98, 256.7
Lucent Huge Citrine, https://wotlkdb.com/?spell=53879, 3.0101, 1.9399, 4.95, 255.2
Fractured Bloodstone, https://wotlkdb.com/?spell=53845, 3, 1.9599, 4.9599, 253.1
Mithril Filigree, https://wotlkdb.com/?spell=25615, 2.9, 8.1, 11, 135.8
Etched Huge Citrine, https://wotlkdb.com/?spell=53873, 2.8864, 1.9399, 4.8263, 248.8
Bright Bloodstone, https://wotlkdb.com/?spell=53835, 2.7301, 1.9599, 4.69, 239.3
Citrine Pendant of Golden Healing, https://wotlkdb.com/?spell=25622, 2.6849, 9.3151, 12, 128.8
Flashing Bloodstone, https://wotlkdb.com/?spell=53844, 2.6254, 1.9599, 4.5853, 234
Brilliant Dawnstone, https://wotlkdb.com/?spell=31096, 2.5695, 1.9305, 4.5, 233.1
Misty Forest Emerald, https://wotlkdb.com/?spell=54003, 2.4901, 4.5099, 7, 155.2
Shining Forest Emerald, https://wotlkdb.com/?spell=54004, 2.4801, 4.5099, 6.99, 155
Veiled Huge Citrine, https://wotlkdb.com/?spell=53883, 2.3683, 1.9399, 4.3082, 222.1
Balanced Shadow Crystal, https://wotlkdb.com/?spell=53866, 2.36, 0.64, 3, 468.8
Royal Shadow Crystal, https://wotlkdb.com/?spell=53864, 2.34, 0.64, 2.98, 465.6
Guardian's Shadow Crystal, https://wotlkdb.com/?spell=53871, 2.3399, 0.64, 2.9799, 465.6
Fierce Huge Citrine, https://wotlkdb.com/?spell=53876, 2.1851, 1.9399, 4.125, 212.6
Mystic Sun Crystal, https://wotlkdb.com/?spell=53857, 2.08, 1.9, 3.98, 209.5
Delicate Bloodstone, https://wotlkdb.com/?spell=53832, 2.0401, 1.9599, 4, 204.1
Potent Flame Spessarite, https://wotlkdb.com/?spell=28915, 1.83, 1.98, 3.81, 192.4
Relentless Earthsiege Diamond, https://wotlkdb.com/?spell=55400, 1.615, 116.375, 117.99, 101.4
Thundering Skyflare Diamond, https://wotlkdb.com/?spell=55395, 1.6, 49.4, 51, 103.2
Tense Dark Jade, https://wotlkdb.com/?spell=53932, 1.55, 5.45, 7, 128.4
Regal Shadow Crystal, https://wotlkdb.com/?spell=53868, 1.42, 0.64, 2.06, 321.9
Sovereign Shadow Crystal, https://wotlkdb.com/?spell=53859, 1.36, 0.64, 2, 312.5
Puissant Shadow Crystal, https://wotlkdb.com/?spell=53870, 1.36, 0.64, 2, 312.5
Seer's Dark Jade, https://wotlkdb.com/?spell=53921, 1.35, 5.45, 6.8, 124.8
Brilliant Sun Crystal, https://wotlkdb.com/?spell=53852, 1.1, 1.9, 3, 157.9
Quick Sun Crystal, https://wotlkdb.com/?spell=53856, 1.1, 1.9, 3, 157.9
Balanced Twilight Opal, https://wotlkdb.com/?spell=53969, 1.0999, 4.9, 5.9999, 122.4
Smooth Dawnstone, https://wotlkdb.com/?spell=31097, 1.0695, 1.9305, 3, 155.4
Rigid Dawnstone, https://wotlkdb.com/?spell=31098, 1.0695, 1.9305, 3, 155.4
Gleaming Dawnstone, https://wotlkdb.com/?spell=31099, 1.0695, 1.9305, 3, 155.4
Thick Dawnstone, https://wotlkdb.com/?spell=31100, 1.0695, 1.9305, 3, 155.4
Mystic Dawnstone, https://wotlkdb.com/?spell=31101, 1.0695, 1.9305, 3, 155.4
Stone of Blades, https://wotlkdb.com/?spell=42591, 1.0695, 1.9305, 3, 155.4
Blood of Amber, https://wotlkdb.com/?spell=42592, 1.0695, 1.9305, 3, 155.4
Facet of Eternity, https://wotlkdb.com/?spell=42593, 1.0695, 1.9305, 3, 155.4
Quick Dawnstone, https://wotlkdb.com/?spell=46403, 1.0695, 1.9305, 3, 155.4
Inscribed Huge Citrine, https://wotlkdb.com/?spell=53872, 1.0601, 1.9399, 3, 154.6
Precise Bloodstone, https://wotlkdb.com/?spell=54017, 1.0301, 1.9599, 2.99, 152.6
Inscribed Pyrestone, https://wotlkdb.com/?spell=39733, 1, 5, 6, 120
Potent Pyrestone, https://wotlkdb.com/?spell=39734, 1, 5, 6, 120
Luminous Pyrestone, https://wotlkdb.com/?spell=39735, 1, 5, 6, 120
Glinting Pyrestone, https://wotlkdb.com/?spell=39736, 1, 5, 6, 120
Veiled Pyrestone, https://wotlkdb.com/?spell=39737, 1, 5, 6, 120
Wicked Pyrestone, https://wotlkdb.com/?spell=39738, 1, 5, 6, 120
Enduring Seaspray Emerald, https://wotlkdb.com/?spell=39739, 1, 5, 6, 120
Radiant Seaspray Emerald, https://wotlkdb.com/?spell=39740, 1, 5, 6, 120
Dazzling Seaspray Emerald, https://wotlkdb.com/?spell=39741, 1, 5, 6, 120
Jagged Seaspray Emerald, https://wotlkdb.com/?spell=39742, 1, 5, 6, 120
Reckless Pyrestone, https://wotlkdb.com/?spell=47055, 1, 5, 6, 120
Accurate Monarch Topaz, https://wotlkdb.com/?spell=53994, 0.9998, 79, 79.9998, 101.3
Shining Dark Jade, https://wotlkdb.com/?spell=53923, 0.8833, 5.45, 6.3333, 116.2
Reckless Monarch Topaz, https://wotlkdb.com/?spell=53987, 0.8764, 79, 79.8764, 101.1
Infused Shadow Crystal, https://wotlkdb.com/?spell=53867, 0.86, 0.64, 1.5, 234.4
Deft Huge Citrine, https://wotlkdb.com/?spell=53880, 0.8101, 1.9399, 2.75, 141.8
Inscribed Noble Topaz, https://wotlkdb.com/?spell=31106, 0.7437, 2.2563, 3, 133
Potent Noble Topaz, https://wotlkdb.com/?spell=31107, 0.7437, 2.2563, 3, 133
Luminous Noble Topaz, https://wotlkdb.com/?spell=31108, 0.7437, 2.2563, 3, 133
Glinting Noble Topaz, https://wotlkdb.com/?spell=31109, 0.7437, 2.2563, 3, 133
Veiled Noble Topaz, https://wotlkdb.com/?spell=39470, 0.7437, 2.2563, 3, 133
Wicked Noble Topaz, https://wotlkdb.com/?spell=39471, 0.7437, 2.2563, 3, 133
Reckless Noble Topaz, https://wotlkdb.com/?spell=46404, 0.7437, 2.2563, 3, 133
Golden Draenite Ring, https://wotlkdb.com/?spell=31049, 0.7206, 12.7898, 13.5104, 105.6
Smooth Sun Crystal, https://wotlkdb.com/?spell=53853, 0.6, 1.9, 2.5, 131.6
Sovereign Nightseye, https://wotlkdb.com/?spell=31102, 0.5, 2.5, 3, 120
Shifting Nightseye, https://wotlkdb.com/?spell=31103, 0.5, 2.5, 3, 120
Glowing Nightseye, https://wotlkdb.com/?spell=31104, 0.5, 2.5, 3, 120
Royal Nightseye, https://wotlkdb.com/?spell=31105, 0.5, 2.5, 3, 120
Infused Nightseye, https://wotlkdb.com/?spell=39462, 0.5, 2.5, 3, 120
Regal Nightseye, https://wotlkdb.com/?spell=46803, 0.5, 2.5, 3, 120
Wicked Huge Citrine, https://wotlkdb.com/?spell=53886, 0.0601, 1.9399, 2, 103.1
Stalwart Huge Citrine, https://wotlkdb.com/?spell=53890, 0.0601, 1.9399, 2, 103.1
Glimmering Huge Citrine, https://wotlkdb.com/?spell=53891, 0.0601, 1.9399, 2, 103.1
Resolute Huge Citrine, https://wotlkdb.com/?spell=53893, 0.0601, 1.9399, 2, 103.1
Champion's Huge Citrine, https://wotlkdb.com/?spell=53874, 0.0401, 1.9399, 1.98, 102.1
Glinting Huge Citrine, https://wotlkdb.com/?spell=53878, 0.0401, 1.9399, 1.98, 102.1
Enduring Talasite, https://wotlkdb.com/?spell=31110, 0.02, 2.98, 3, 100.7
Radiant Talasite, https://wotlkdb.com/?spell=31111, 0.02, 2.98, 3, 100.7
Dazzling Talasite, https://wotlkdb.com/?spell=31112, 0.02, 2.98, 3, 100.7
Jagged Talasite, https://wotlkdb.com/?spell=31113, 0.02, 2.98, 3, 100.7
Steady Talasite, https://wotlkdb.com/?spell=43493, 0.02, 2.98, 3, 100.7
Forceful Talasite, https://wotlkdb.com/?spell=46405, 0.02, 2.98, 3, 100.7
Enduring Deep Peridot, https://wotlkdb.com/?spell=28918, 0.0001, 0.9999, 1, 100
Lustrous Star of Elune, https://wotlkdb.com/?spell=31094, 0, 3, 3, 100
Stormy Star of Elune, https://wotlkdb.com/?spell=31095, 0, 3, 3, 100
Sparkling Star of Elune, https://wotlkdb.com/?spell=31149, 0, 3, 3, 100
Falling Star, https://wotlkdb.com/?spell=42590, 0, 3, 3, 100
Dazzling Forest Emerald, https://wotlkdb.com/?spell=54007, -0.0099, 4.5099, 4.5, 99.8
Rough Stone Statue, https://wotlkdb.com/?spell=32259, -0.0367, 0.0392, 0.0025, 6.4
Coarse Stone Statue, https://wotlkdb.com/?spell=32801, -0.105, 0.12, 0.015, 12.5
Tenuous Shadow Crystal, https://wotlkdb.com/?spell=53861, -0.13, 0.64, 0.51, 79.7
Bold Blood Garnet, https://wotlkdb.com/?spell=28905, -0.15, 1, 0.85, 85
Bright Blood Garnet, https://wotlkdb.com/?spell=34590, -0.2, 1, 0.8, 80
Dazzling Deep Peridot, https://wotlkdb.com/?spell=28924, -0.2499, 0.9999, 0.75, 75
Dense Stone Statue, https://wotlkdb.com/?spell=32809, -0.285, 0.385, 0.1, 26
Amulet of Truesight, https://wotlkdb.com/?spell=63743, -0.3192, 3.2792, 2.96, 90.3
Jagged Deep Peridot, https://wotlkdb.com/?spell=28917, -0.3349, 0.9999, 0.665, 66.5
Accurate Huge Citrine, https://wotlkdb.com/?spell=53892, -0.4399, 1.9399, 1.5, 77.3
Misty Dark Jade, https://wotlkdb.com/?spell=53922, -0.45, 5.45, 5, 91.7
Steady Dark Jade, https://wotlkdb.com/?spell=53919, -0.4501, 5.45, 4.9999, 91.7
Teardrop Blood Garnet, https://wotlkdb.com/?spell=28903, -0.53, 1, 0.47, 47
Earthshadow Ring, https://wotlkdb.com/?spell=58143, -0.5328, 4.6133, 4.0805, 88.5
Royal Shadow Draenite, https://wotlkdb.com/?spell=28927, -0.5625, 1.5625, 1, 64
Shifting Shadow Draenite, https://wotlkdb.com/?spell=28933, -0.5625, 1.5625, 1, 64
Radiant Deep Peridot, https://wotlkdb.com/?spell=28916, -0.6199, 0.9999, 0.38, 38
Solid Stone Statue, https://wotlkdb.com/?spell=32808, -0.645, 0.745, 0.1, 13.4
Sovereign Shadowsong Amethyst, https://wotlkdb.com/?spell=39727, -0.6969, 6.6969, 6, 89.6
Shifting Shadowsong Amethyst, https://wotlkdb.com/?spell=39728, -0.6969, 6.6969, 6, 89.6
Balanced Shadowsong Amethyst, https://wotlkdb.com/?spell=39729, -0.6969, 6.6969, 6, 89.6
Infused Shadowsong Amethyst, https://wotlkdb.com/?spell=39730, -0.6969, 6.6969, 6, 89.6
Glowing Shadowsong Amethyst, https://wotlkdb.com/?spell=39731, -0.6969, 6.6969, 6, 89.6
Royal Shadowsong Amethyst, https://wotlkdb.com/?spell=39732, -0.6969, 6.6969, 6, 89.6
Purified Shadowsong Amethyst, https://wotlkdb.com/?spell=48789, -0.6969, 6.6969, 6, 89.6
Glowing Shadow Draenite, https://wotlkdb.com/?spell=28925, -0.7325, 1.5625, 0.83, 53.1
Delicate Blood Garnet, https://wotlkdb.com/?spell=28907, -0.75, 1, 0.25, 25
Brilliant Lionseye, https://wotlkdb.com/?spell=39719, -0.7763, 6.7763, 6, 88.5
Smooth Lionseye, https://wotlkdb.com/?spell=39720, -0.7763, 6.7763, 6, 88.5
Rigid Lionseye, https://wotlkdb.com/?spell=39721, -0.7763, 6.7763, 6, 88.5
Gleaming Lionseye, https://wotlkdb.com/?spell=39722, -0.7763, 6.7763, 6, 88.5
Thick Lionseye, https://wotlkdb.com/?spell=39723, -0.7763, 6.7763, 6, 88.5
Mystic Lionseye, https://wotlkdb.com/?spell=39724, -0.7763, 6.7763, 6, 88.5
Great Lionseye, https://wotlkdb.com/?spell=39725, -0.7763, 6.7763, 6, 88.5
Quick Lionseye, https://wotlkdb.com/?spell=47056, -0.7763, 6.7763, 6, 88.5
Bold Living Ruby, https://wotlkdb.com/?spell=31084, -0.82, 3.82, 3, 78.5
