Name, Link, Profit, Cost, Sell, ROI %
Brutal Earthstorm Diamond, https://wotlkdb.com/?spell=32869, 3538.8433, 80, 3618.8433, 4523.6
Ring of Scarlet Shadows, https://wotlkdb.com/?spell=58148, 679.2, 285.8, 965, 337.6
Titanium Earthguard Chain, https://wotlkdb.com/?spell=56500, 624, 698, 1322, 189.4
Titanium Frostguard Ring, https://wotlkdb.com/?spell=58954, 570.5835, 425.42, 996.0035, 234.1
Titanium Impact Band, https://wotlkdb.com/?spell=56496, 570.2288, 977.66, 1547.8888, 158.3
Savage Titanium Ring, https://wotlkdb.com/?spell=58492, 553.74, 505.76, 1059.5, 209.5
Titanium Earthguard Ring, https://wotlkdb.com/?spell=56497, 538.5, 659.5, 1198, 181.7
Titanium Impact Choker, https://wotlkdb.com/?spell=56499, 517.39, 1180.64, 1698.03, 143.8
Gem Studded Band, https://wotlkdb.com/?spell=26896, 450.0726, 68.9998, 519.0724, 752.3
Powerful Earthstorm Diamond, https://wotlkdb.com/?spell=32866, 420, 80, 500, 625
Ring of Earthen Might, https://wotlkdb.com/?spell=58147, 404.6, 115.4, 520, 450.6
Titanium Spellshock Ring, https://wotlkdb.com/?spell=56498, 398.3, 720.7, 1119, 155.3
Titanium Spellshock Necklace, https://wotlkdb.com/?spell=56501, 392.6, 784.4, 1177, 150.1
Ring of Northern Tears, https://wotlkdb.com/?spell=58150, 391.1828, 116.8172, 508, 434.9
Savage Titanium Band, https://wotlkdb.com/?spell=58507, 343.24, 505.76, 849, 167.9
Citrine Pendant of Golden Healing, https://wotlkdb.com/?spell=25622, 342.9533, 11.6049, 354.5582, 3055.2
Ruby Crown of Restoration, https://wotlkdb.com/?spell=26878, 334.044, 161.22, 495.264, 307.2
Effulgent Skyflare Diamond, https://wotlkdb.com/?spell=55384, 214.6, 85, 299.6, 352.5
Windfire Band, https://wotlkdb.com/?spell=58149, 170.42, 279.58, 450, 161
Bronze Band of Force, https://wotlkdb.com/?spell=37818, 150.905, 16.845, 167.75, 995.8
Trenchant Earthsiege Diamond, https://wotlkdb.com/?spell=55403, 96.9, 114.5, 211.4, 184.6
Moonsoul Crown, https://wotlkdb.com/?spell=25321, 85.277, 13.723, 99, 721.4
Mercurial Adamantite, https://wotlkdb.com/?spell=38068, 81.77, 66.98, 148.75, 222.1
Runed Mana Band, https://wotlkdb.com/?spell=64727, 79.85, 120.9, 200.75, 166
Puissant Twilight Opal, https://wotlkdb.com/?spell=53973, 77.1, 7, 84.1, 1201.4
Jagged Forest Emerald, https://wotlkdb.com/?spell=53996, 75.26, 2.99, 78.25, 2617.1
Sky Sapphire Amulet, https://wotlkdb.com/?spell=64726, 75.0999, 134.9, 209.9999, 155.7
Forceful Forest Emerald, https://wotlkdb.com/?spell=54001, 72.01, 2.99, 75, 2508.4
Royal Twilight Opal, https://wotlkdb.com/?spell=53967, 71.65, 7, 78.65, 1123.6
Radiant Eye of Zul, https://wotlkdb.com/?spell=66441, 70.85, 80, 150.85, 188.6
Impassive Skyflare Diamond, https://wotlkdb.com/?spell=55388, 70.75, 85, 155.75, 183.2
Forceful Eye of Zul, https://wotlkdb.com/?spell=66434, 70, 80, 150, 187.5
Jagged Eye of Zul, https://wotlkdb.com/?spell=66431, 68.4, 80, 148.4, 185.5
Delicate Scarlet Ruby, https://wotlkdb.com/?spell=53945, 67, 101.5, 168.5, 166
Radiant Forest Emerald, https://wotlkdb.com/?spell=54012, 66.01, 2.99, 69, 2307.7
Enigmatic Skyflare Diamond, https://wotlkdb.com/?spell=55393, 65, 85, 150, 176.5
Revitalizing Skyflare Diamond, https://wotlkdb.com/?spell=55407, 65, 85, 150, 176.5
Emerald Choker, https://wotlkdb.com/?spell=64725, 62.33, 62.42, 124.75, 199.9
Band of Natural Fire, https://wotlkdb.com/?spell=26916, 62.26, 7.74, 70, 904.4
Shattered Eye of Zul, https://wotlkdb.com/?spell=66443, 60.5576, 80, 140.5576, 175.7
Opaque Forest Emerald, https://wotlkdb.com/?spell=54010, 59.81, 2.99, 62.8, 2100.3
Timeless Eye of Zul, https://wotlkdb.com/?spell=66432, 59.2, 80, 139.2, 174
Shifting Twilight Opal, https://wotlkdb.com/?spell=53963, 58, 7, 65, 928.6
Infused Nightseye, https://wotlkdb.com/?spell=39462, 57.08, 2.92, 60, 2054.8
Sundered Eye of Zul, https://wotlkdb.com/?spell=66436, 56.4532, 80, 136.4532, 170.6
Infused Dreadstone, https://wotlkdb.com/?spell=66564, 55.4, 99.6, 155, 155.6
Misty Eye of Zul, https://wotlkdb.com/?spell=66435, 55, 80, 135, 168.8
Lambent Eye of Zul, https://wotlkdb.com/?spell=66439, 54.875, 80, 134.875, 168.6
Golden Ring of Power, https://wotlkdb.com/?spell=34955, 54.1901, 5.8099, 60, 1032.7
Lustrous Sky Sapphire, https://wotlkdb.com/?spell=53954, 53.47, 14, 67.47, 481.9
Delicate Living Ruby, https://wotlkdb.com/?spell=31085, 47.6832, 2.96, 50.6432, 1710.9
Regal Dreadstone, https://wotlkdb.com/?spell=66559, 47.3999, 99.6, 146.9999, 147.6
Energized Forest Emerald, https://wotlkdb.com/?spell=54011, 47.01, 2.99, 50, 1672.2
Vivid Forest Emerald, https://wotlkdb.com/?spell=53997, 45.4675, 2.99, 48.4575, 1620.7
Guardian's Dreadstone, https://wotlkdb.com/?spell=66561, 45.4, 99.6, 145, 145.6
Shifting Dreadstone, https://wotlkdb.com/?spell=66557, 45.3996, 99.6, 144.9996, 145.6
Stark Monarch Topaz, https://wotlkdb.com/?spell=53991, 42.975, 62.15, 105.125, 169.1
Lambent Forest Emerald, https://wotlkdb.com/?spell=54009, 42.01, 2.99, 45, 1505
Scarlet Signet, https://wotlkdb.com/?spell=64728, 41.6, 208.4, 250, 120
Eternal Earthsiege Diamond, https://wotlkdb.com/?spell=55398, 41.5, 114.5, 156, 136.2
Precise Cardinal Ruby, https://wotlkdb.com/?spell=66450, 40.9999, 210, 250.9999, 119.5
Sovereign Twilight Opal, https://wotlkdb.com/?spell=53962, 40, 7, 47, 671.4
Vivid Eye of Zul, https://wotlkdb.com/?spell=66429, 39.9999, 80, 119.9999, 150
Flashing Cardinal Ruby, https://wotlkdb.com/?spell=66453, 39.55, 210, 249.55, 118.8
Jade Dagger Pendant, https://wotlkdb.com/?spell=56195, 38.67, 16.23, 54.9, 338.3
Bold Scarlet Ruby, https://wotlkdb.com/?spell=53830, 38.5, 101.5, 140, 137.9
Flashing Scarlet Ruby, https://wotlkdb.com/?spell=53949, 38.5, 101.5, 140, 137.9
Fractured Scarlet Ruby, https://wotlkdb.com/?spell=53950, 38.5, 101.5, 140, 137.9
Steady Eye of Zul, https://wotlkdb.com/?spell=66428, 38.25, 80, 118.25, 147.8
Defender's Twilight Opal, https://wotlkdb.com/?spell=53972, 38, 7, 45, 642.9
Regal Twilight Opal, https://wotlkdb.com/?spell=53971, 37.9, 7, 44.9, 641.4
Fierce Ametrine, https://wotlkdb.com/?spell=66583, 37.88, 186.12, 224, 120.4
Stark Ametrine, https://wotlkdb.com/?spell=66587, 37.88, 186.12, 224, 120.4
Sovereign Dreadstone, https://wotlkdb.com/?spell=66554, 37.1, 99.6, 136.7, 137.2
Beaming Earthsiege Diamond, https://wotlkdb.com/?spell=55405, 37.05, 114.5, 151.55, 132.4
Forlorn Skyflare Diamond, https://wotlkdb.com/?spell=55387, 37, 85, 122, 143.5
Necklace of the Deep, https://wotlkdb.com/?spell=40514, 36.4102, 63.3898, 99.8, 157.4
Runed Blood Garnet, https://wotlkdb.com/?spell=28906, 36.05, 0.95, 37, 3894.7
Tense Eye of Zul, https://wotlkdb.com/?spell=66438, 36, 80, 116, 145
Glinting Monarch Topaz, https://wotlkdb.com/?spell=53980, 35.85, 62.15, 98, 157.7
Seer's Eye of Zul, https://wotlkdb.com/?spell=66433, 35, 80, 115, 143.8
Intricate Eye of Zul, https://wotlkdb.com/?spell=66440, 34.625, 80, 114.625, 143.3
Inscribed Noble Topaz, https://wotlkdb.com/?spell=31106, 34.585, 2.54, 37.125, 1461.6
Puissant Dreadstone, https://wotlkdb.com/?spell=66563, 34.3418, 99.6, 133.9418, 134.5
Enduring Eye of Zul, https://wotlkdb.com/?spell=66338, 33.9999, 80, 113.9999, 142.5
Enduring Talasite, https://wotlkdb.com/?spell=31110, 33.5, 1.5, 35, 2333.3
Opaque Eye of Zul, https://wotlkdb.com/?spell=66444, 32.88, 80, 112.88, 141.1
Resolute Ametrine, https://wotlkdb.com/?spell=66586, 32.76, 186.12, 218.88, 117.6
Reckless Monarch Topaz, https://wotlkdb.com/?spell=53987, 32.15, 62.15, 94.3, 151.7
Nightmare Tear, https://wotlkdb.com/?spell=68253, 32.1, 109.9, 142, 129.2
Turbid Eye of Zul, https://wotlkdb.com/?spell=66445, 32, 80, 112, 140
Intricate Forest Emerald, https://wotlkdb.com/?spell=54006, 31.01, 2.99, 34, 1137.1
Mystic Sun Crystal, https://wotlkdb.com/?spell=53857, 30.8201, 1.1799, 32, 2712.1
Invigorating Earthsiege Diamond, https://wotlkdb.com/?spell=55404, 30.5, 114.5, 145, 126.6
Stormy Majestic Zircon, https://wotlkdb.com/?spell=66499, 30.1199, 128, 158.1199, 123.5
Royal Dreadstone, https://wotlkdb.com/?spell=66558, 30.1, 99.6, 129.7, 130.2
Tense Forest Emerald, https://wotlkdb.com/?spell=54013, 30.01, 2.99, 33, 1103.7
Mysterious Twilight Opal, https://wotlkdb.com/?spell=53968, 30, 7, 37, 528.6
Purified Dreadstone, https://wotlkdb.com/?spell=66556, 29.4, 99.6, 129, 129.5
Dazzling Eye of Zul, https://wotlkdb.com/?spell=66430, 28.75, 80, 108.75, 135.9
Wicked Monarch Topaz, https://wotlkdb.com/?spell=53988, 27.35, 62.15, 89.5, 144
Enduring Forest Emerald, https://wotlkdb.com/?spell=53998, 27.01, 2.99, 30, 1003.3
Resplendent Monarch Topaz, https://wotlkdb.com/?spell=53978, 26.851, 62.15, 89.001, 143.2
Luminous Monarch Topaz, https://wotlkdb.com/?spell=53983, 26.85, 62.15, 89, 143.2
Potent Monarch Topaz, https://wotlkdb.com/?spell=53984, 26.85, 62.15, 89, 143.2
Ember Skyflare Diamond, https://wotlkdb.com/?spell=55392, 26.75, 85, 111.75, 131.5
Seer's Forest Emerald, https://wotlkdb.com/?spell=54002, 26.71, 2.99, 29.7, 993.3
Crystal Citrine Necklace, https://wotlkdb.com/?spell=58141, 26.11, 1.89, 28, 1481.5
Stormy Sky Sapphire, https://wotlkdb.com/?spell=53955, 26, 14, 40, 285.7
Bold Cardinal Ruby, https://wotlkdb.com/?spell=66447, 25.9999, 210, 235.9999, 112.4
Sundered Forest Emerald, https://wotlkdb.com/?spell=54008, 25.81, 2.99, 28.8, 963.2
Wicked Moonstone Ring, https://wotlkdb.com/?spell=25323, 25.54, 24.46, 50, 204.4
Defender's Dreadstone, https://wotlkdb.com/?spell=66560, 25.3499, 99.6, 124.9499, 125.5
Dream Signet, https://wotlkdb.com/?spell=56197, 24.56, 75.44, 100, 132.6
Smooth King's Amber, https://wotlkdb.com/?spell=66502, 24.2499, 189.75, 213.9999, 112.8
Guardian's Twilight Opal, https://wotlkdb.com/?spell=53974, 24, 7, 31, 442.9
Shining Eye of Zul, https://wotlkdb.com/?spell=66437, 23.9999, 80, 103.9999, 130
Mystic Autumn's Glow, https://wotlkdb.com/?spell=53960, 23.6, 99.9, 123.5, 123.6
Stalwart Ametrine, https://wotlkdb.com/?spell=66581, 23.54, 186.12, 209.66, 112.6
Subtle Scarlet Ruby, https://wotlkdb.com/?spell=53948, 23.5, 101.5, 125, 123.2
Resplendent Ametrine, https://wotlkdb.com/?spell=66582, 23.38, 186.12, 209.5, 112.6
Accurate Ametrine, https://wotlkdb.com/?spell=66576, 23.3299, 186.12, 209.4499, 112.5
Solid Sky Sapphire, https://wotlkdb.com/?spell=53952, 22.99, 14, 36.99, 264.2
Veiled Ametrine, https://wotlkdb.com/?spell=66570, 22.7688, 186.12, 208.8888, 112.2
Fractured Cardinal Ruby, https://wotlkdb.com/?spell=66451, 22.75, 210, 232.75, 110.8
Defender's Shadow Crystal, https://wotlkdb.com/?spell=53869, 22.43, 0.57, 23, 4035.1
Misty Forest Emerald, https://wotlkdb.com/?spell=54003, 22.01, 2.99, 25, 836.1
Thick King's Amber, https://wotlkdb.com/?spell=66504, 22, 189.75, 211.75, 111.6
Tenuous Twilight Opal, https://wotlkdb.com/?spell=53964, 21.9, 7, 28.9, 412.9
Durable Huge Citrine, https://wotlkdb.com/?spell=53884, 21.5364, 0.99, 22.5264, 2275.4
Steady Forest Emerald, https://wotlkdb.com/?spell=54000, 21.26, 2.99, 24.25, 811
Resplendent Huge Citrine, https://wotlkdb.com/?spell=53875, 21.01, 0.99, 22, 2222.2
Lucent Huge Citrine, https://wotlkdb.com/?spell=53879, 21.01, 0.99, 22, 2222.2
Etched Ametrine, https://wotlkdb.com/?spell=66572, 20.8798, 186.12, 206.9998, 111.2
Balanced Dreadstone, https://wotlkdb.com/?spell=66553, 20.35, 99.6, 119.95, 120.4
Rigid Autumn's Glow, https://wotlkdb.com/?spell=53958, 20.1, 99.9, 120, 120.1
Energized Eye of Zul, https://wotlkdb.com/?spell=66442, 20, 80, 100, 125
Runed Cardinal Ruby, https://wotlkdb.com/?spell=66446, 19.9999, 210, 229.9999, 109.5
Tenuous Dreadstone, https://wotlkdb.com/?spell=66565, 19.4, 99.6, 119, 119.5
Empowered Huge Citrine, https://wotlkdb.com/?spell=53888, 19.01, 0.99, 20, 2020.2
Empowered Ametrine, https://wotlkdb.com/?spell=66580, 18.88, 186.12, 205, 110.1
Quick King's Amber, https://wotlkdb.com/?spell=66506, 18.75, 189.75, 208.5, 109.9
Runed Scarlet Ruby, https://wotlkdb.com/?spell=53946, 18.25, 101.5, 119.75, 118
Rigid King's Amber, https://wotlkdb.com/?spell=66501, 18.25, 189.75, 208, 109.6
Bloodstone Band, https://wotlkdb.com/?spell=56193, 18.11, 1.89, 20, 1058.2
Deadly Ametrine, https://wotlkdb.com/?spell=66568, 17.8799, 186.12, 203.9999, 109.6
Deadly Monarch Topaz, https://wotlkdb.com/?spell=53979, 17.85, 62.15, 80, 128.7
Infused Twilight Opal, https://wotlkdb.com/?spell=53970, 17.8, 7, 24.8, 354.3
Shattered Forest Emerald, https://wotlkdb.com/?spell=54014, 17.01, 2.99, 20, 668.9
Shattered Dark Jade, https://wotlkdb.com/?spell=53933, 17, 5, 22, 440
Veiled Monarch Topaz, https://wotlkdb.com/?spell=53985, 16.85, 62.15, 79, 127.1
Accurate Monarch Topaz, https://wotlkdb.com/?spell=53994, 15.85, 62.15, 78, 125.5
Potent Ametrine, https://wotlkdb.com/?spell=66569, 15.63, 186.12, 201.75, 108.4
Glinting Ametrine, https://wotlkdb.com/?spell=66575, 15.63, 186.12, 201.75, 108.4
Vivid Dark Jade, https://wotlkdb.com/?spell=53917, 15, 5, 20, 400
Seer's Dark Jade, https://wotlkdb.com/?spell=53921, 15, 5, 20, 400
Insightful Earthsiege Diamond, https://wotlkdb.com/?spell=55396, 14.5, 114.5, 129, 112.7
Turbid Forest Emerald, https://wotlkdb.com/?spell=54005, 14.01, 2.99, 17, 568.6
Mysterious Shadow Crystal, https://wotlkdb.com/?spell=53865, 13.43, 0.57, 14, 2456.1
Reckless Ametrine, https://wotlkdb.com/?spell=66574, 13.38, 186.12, 199.5, 107.2
Champion's Ametrine, https://wotlkdb.com/?spell=66579, 13.38, 186.12, 199.5, 107.2
Mystic King's Amber, https://wotlkdb.com/?spell=66505, 13.25, 189.75, 203, 107
Glimmering Ametrine, https://wotlkdb.com/?spell=66578, 13.13, 186.12, 199.25, 107.1
Purified Twilight Opal, https://wotlkdb.com/?spell=53966, 13, 7, 20, 285.7
Lustrous Majestic Zircon, https://wotlkdb.com/?spell=66500, 13, 128, 141, 110.2
Inscribed Ametrine, https://wotlkdb.com/?spell=66567, 12.88, 186.12, 199, 106.9
Empowered Monarch Topaz, https://wotlkdb.com/?spell=53990, 12.85, 62.15, 75, 120.7
Sparkling Majestic Zircon, https://wotlkdb.com/?spell=66498, 12.8275, 128, 140.8275, 110
Wicked Ametrine, https://wotlkdb.com/?spell=66577, 12.58, 186.12, 198.7, 106.8
Shadow Jade Focusing Lens, https://wotlkdb.com/?spell=56208, 12.18, 5.57, 17.75, 318.7
Bright Crimson Spinel, https://wotlkdb.com/?spell=39712, 12.0499, 7.95, 19.9999, 251.6
Enchanted Tear, https://wotlkdb.com/?spell=56531, 11.96, 9.94, 21.9, 220.3
Glowing Dreadstone, https://wotlkdb.com/?spell=66555, 11.4, 99.6, 111, 111.4
Azure Moonstone Ring, https://wotlkdb.com/?spell=31050, 11.3, 8.7, 20, 229.9
Subtle Bloodstone, https://wotlkdb.com/?spell=53843, 11.01, 0.99, 12, 1212.1
Mithril Filigree, https://wotlkdb.com/?spell=25615, 10.95, 8, 18.95, 236.9
Deft Ametrine, https://wotlkdb.com/?spell=66584, 10.63, 186.12, 196.75, 105.7
Blood Sun Necklace, https://wotlkdb.com/?spell=56196, 10.5002, 24.4998, 35, 142.9
Delicate Cardinal Ruby, https://wotlkdb.com/?spell=66448, 10.15, 210, 220.15, 104.8
Quick Autumn's Glow, https://wotlkdb.com/?spell=53961, 10.1, 99.9, 110, 110.1
Brilliant King's Amber, https://wotlkdb.com/?spell=66503, 10, 189.75, 199.75, 105.3
Crystal Chalcedony Amulet, https://wotlkdb.com/?spell=58142, 9.6719, 17.8, 27.4719, 154.3
Glowing Twilight Opal, https://wotlkdb.com/?spell=53965, 8.95, 7, 15.95, 227.9
Sun Rock Ring, https://wotlkdb.com/?spell=56194, 8.9201, 2.0799, 11, 528.9
Mysterious Dreadstone, https://wotlkdb.com/?spell=66562, 8.9, 99.6, 108.5, 108.9
Luminous Ametrine, https://wotlkdb.com/?spell=66566, 8.88, 186.12, 195, 104.8
Rigid Sun Crystal, https://wotlkdb.com/?spell=53854, 8.8001, 1.1799, 9.98, 845.8
Reckless Huge Citrine, https://wotlkdb.com/?spell=53885, 8.702, 0.99, 9.692, 979
Shining Forest Emerald, https://wotlkdb.com/?spell=54004, 8.01, 2.99, 11, 367.9
Pristine Ametrine, https://wotlkdb.com/?spell=66573, 7.88, 186.12, 194, 104.2
Resolute Monarch Topaz, https://wotlkdb.com/?spell=54023, 7.75, 62.15, 69.9, 112.5
Precise Bloodstone, https://wotlkdb.com/?spell=54017, 7.51, 0.99, 8.5, 858.6
Smooth Dawnstone, https://wotlkdb.com/?spell=31097, 7.27, 2.68, 9.95, 371.3
Gleaming Dawnstone, https://wotlkdb.com/?spell=31099, 7.27, 2.68, 9.95, 371.3
Glinting Pyrestone, https://wotlkdb.com/?spell=39736, 7.2299, 7.77, 14.9999, 193
Deadly Huge Citrine, https://wotlkdb.com/?spell=53877, 7.01, 0.99, 8, 808.1
Stalwart Huge Citrine, https://wotlkdb.com/?spell=53890, 6.96, 0.99, 7.95, 803
Quick Sun Crystal, https://wotlkdb.com/?spell=53856, 6.6201, 1.1799, 7.8, 661.1
Stoneguard Band, https://wotlkdb.com/?spell=58145, 6.4999, 8.5, 14.9999, 176.5
Steady Dark Jade, https://wotlkdb.com/?spell=53919, 6, 5, 11, 220
Luminous Huge Citrine, https://wotlkdb.com/?spell=53881, 5.96, 0.99, 6.95, 702
Lucent Ametrine, https://wotlkdb.com/?spell=66585, 5.63, 186.12, 191.75, 103
Austere Earthsiege Diamond, https://wotlkdb.com/?spell=55401, 5.5, 114.5, 120, 104.8
Bright Cardinal Ruby, https://wotlkdb.com/?spell=66449, 5.25, 210, 215.25, 102.5
Shadow Crystal Focusing Lens, https://wotlkdb.com/?spell=56206, 5.0862, 0.57, 5.6562, 992.3
Chaotic Skyflare Diamond, https://wotlkdb.com/?spell=55389, 5, 85, 90, 105.9
Purified Shadow Pearl, https://wotlkdb.com/?spell=41429, 4.6765, 0.3235, 5, 1545.6
Jagged Talasite, https://wotlkdb.com/?spell=31113, 4.5, 1.5, 6, 400
Tenuous Shadow Crystal, https://wotlkdb.com/?spell=53861, 4.41, 0.57, 4.98, 873.7
Regal Shadow Crystal, https://wotlkdb.com/?spell=53868, 4.39, 0.57, 4.96, 870.2
Guardian's Shadow Crystal, https://wotlkdb.com/?spell=53871, 4.31, 0.57, 4.88, 856.1
Luminous Noble Topaz, https://wotlkdb.com/?spell=31108, 4.21, 2.54, 6.75, 265.7
Stormy Chalcedony, https://wotlkdb.com/?spell=53943, 4.1, 16.9, 21, 124.3
Shining Dark Jade, https://wotlkdb.com/?spell=53923, 4, 5, 9, 180
Lambent Dark Jade, https://wotlkdb.com/?spell=53928, 4, 5, 9, 180
Opaque Dark Jade, https://wotlkdb.com/?spell=53929, 4, 5, 9, 180
Resolute Huge Citrine, https://wotlkdb.com/?spell=53893, 3.89, 0.99, 4.88, 492.9
Purified Shadow Crystal, https://wotlkdb.com/?spell=53863, 3.2058, 0.57, 3.7758, 662.4
Bright Bloodstone, https://wotlkdb.com/?spell=53835, 3.01, 0.99, 4, 404
Fractured Bloodstone, https://wotlkdb.com/?spell=53845, 3.01, 0.99, 4, 404
Forceful Dark Jade, https://wotlkdb.com/?spell=53920, 2.95, 5, 7.95, 159
Smooth Sun Crystal, https://wotlkdb.com/?spell=53853, 2.9201, 1.1799, 4.1, 347.5
Fierce Huge Citrine, https://wotlkdb.com/?spell=53876, 2.91, 0.99, 3.9, 393.9
Thick Sun Crystal, https://wotlkdb.com/?spell=53855, 2.7801, 1.1799, 3.96, 335.6
Solid Majestic Zircon, https://wotlkdb.com/?spell=66497, 2.75, 128, 130.75, 102.1
Etched Huge Citrine, https://wotlkdb.com/?spell=53873, 2.51, 0.99, 3.5, 353.5
Enchanted Pearl, https://wotlkdb.com/?spell=56530, 2.4832, 2.5168, 5, 198.7
Delicate Bloodstone, https://wotlkdb.com/?spell=53832, 2.46, 0.99, 3.45, 348.5
Dazzling Deep Peridot, https://wotlkdb.com/?spell=28924, 2.38, 0.62, 3, 483.9
Runed Bloodstone, https://wotlkdb.com/?spell=53834, 2.2967, 0.99, 3.2867, 332
Brilliant Lionseye, https://wotlkdb.com/?spell=39719, 2.02, 3.98, 6, 150.8
Smooth Lionseye, https://wotlkdb.com/?spell=39720, 2.02, 3.98, 6, 150.8
Rigid Lionseye, https://wotlkdb.com/?spell=39721, 2.02, 3.98, 6, 150.8
Gleaming Lionseye, https://wotlkdb.com/?spell=39722, 2.02, 3.98, 6, 150.8
Thick Lionseye, https://wotlkdb.com/?spell=39723, 2.02, 3.98, 6, 150.8
Mystic Lionseye, https://wotlkdb.com/?spell=39724, 2.02, 3.98, 6, 150.8
Great Lionseye, https://wotlkdb.com/?spell=39725, 2.02, 3.98, 6, 150.8
Quick Lionseye, https://wotlkdb.com/?spell=47056, 2.02, 3.98, 6, 150.8
Fel Iron Blood Ring, https://wotlkdb.com/?spell=31048, 2.02, 6.88, 8.9, 129.4
Champion's Huge Citrine, https://wotlkdb.com/?spell=53874, 1.99, 0.99, 2.98, 301
Veiled Huge Citrine, https://wotlkdb.com/?spell=53883, 1.99, 0.99, 2.98, 301
Infused Shadow Crystal, https://wotlkdb.com/?spell=53867, 1.91, 0.57, 2.48, 435.1
Pristine Huge Citrine, https://wotlkdb.com/?spell=53887, 1.69, 0.99, 2.68, 270.7
Timeless Forest Emerald, https://wotlkdb.com/?spell=53995, 1.65, 2.99, 4.64, 155.2
Dazzling Forest Emerald, https://wotlkdb.com/?spell=54007, 1.51, 2.99, 4.5, 150.5
Potent Huge Citrine, https://wotlkdb.com/?spell=53882, 1.5, 0.99, 2.49, 251.5
Radiant Talasite, https://wotlkdb.com/?spell=31111, 1.5, 1.5, 3, 200
Dazzling Talasite, https://wotlkdb.com/?spell=31112, 1.5, 1.5, 3, 200
Steady Talasite, https://wotlkdb.com/?spell=43493, 1.5, 1.5, 3, 200
Forceful Talasite, https://wotlkdb.com/?spell=46405, 1.5, 1.5, 3, 200
Flashing Bloodstone, https://wotlkdb.com/?spell=53844, 1.47, 0.99, 2.46, 248.5
Glinting Huge Citrine, https://wotlkdb.com/?spell=53878, 1.46, 0.99, 2.45, 247.5
Glowing Shadow Crystal, https://wotlkdb.com/?spell=53862, 1.43, 0.57, 2, 350.9
Balanced Shadow Crystal, https://wotlkdb.com/?spell=53866, 1.43, 0.57, 2, 350.9
Puissant Shadow Crystal, https://wotlkdb.com/?spell=53870, 1.43, 0.57, 2, 350.9
Royal Shadow Crystal, https://wotlkdb.com/?spell=53864, 1.41, 0.57, 1.98, 347.4
Sovereign Shadow Crystal, https://wotlkdb.com/?spell=53859, 1.33, 0.57, 1.9, 333.3
Enduring Seaspray Emerald, https://wotlkdb.com/?spell=39739, 1.3, 4.7, 6, 127.7
Radiant Seaspray Emerald, https://wotlkdb.com/?spell=39740, 1.3, 4.7, 6, 127.7
Dazzling Seaspray Emerald, https://wotlkdb.com/?spell=39741, 1.3, 4.7, 6, 127.7
Jagged Seaspray Emerald, https://wotlkdb.com/?spell=39742, 1.3, 4.7, 6, 127.7
Stark Huge Citrine, https://wotlkdb.com/?spell=53889, 1.26, 0.99, 2.25, 227.3
Lustrous Star of Elune, https://wotlkdb.com/?spell=31094, 1.0201, 1.9799, 3, 151.5
Stormy Star of Elune, https://wotlkdb.com/?spell=31095, 1.0201, 1.9799, 3, 151.5
Sparkling Star of Elune, https://wotlkdb.com/?spell=31149, 1.0201, 1.9799, 3, 151.5
Falling Star, https://wotlkdb.com/?spell=42590, 1.0201, 1.9799, 3, 151.5
Accurate Huge Citrine, https://wotlkdb.com/?spell=53892, 1.01, 0.99, 2, 202
Inscribed Huge Citrine, https://wotlkdb.com/?spell=53872, 0.97, 0.99, 1.96, 198
Glimmering Huge Citrine, https://wotlkdb.com/?spell=53891, 0.9595, 0.99, 1.9495, 196.9
Shifting Shadow Crystal, https://wotlkdb.com/?spell=53860, 0.93, 0.57, 1.5, 263.2
Lucent Monarch Topaz, https://wotlkdb.com/?spell=53981, 0.85, 62.15, 63, 101.4
Energized Dark Jade, https://wotlkdb.com/?spell=53930, 0.84, 5, 5.84, 116.8
Brilliant Sun Crystal, https://wotlkdb.com/?spell=53852, 0.8201, 1.1799, 2, 169.5
Wicked Noble Topaz, https://wotlkdb.com/?spell=39471, 0.6179, 2.54, 3.1579, 124.3
Potent Noble Topaz, https://wotlkdb.com/?spell=31107, 0.46, 2.54, 3, 118.1
Glinting Noble Topaz, https://wotlkdb.com/?spell=31109, 0.46, 2.54, 3, 118.1
Veiled Noble Topaz, https://wotlkdb.com/?spell=39470, 0.46, 2.54, 3, 118.1
Reckless Noble Topaz, https://wotlkdb.com/?spell=46404, 0.46, 2.54, 3, 118.1
Elegant Silver Ring, https://wotlkdb.com/?spell=25280, 0.4167, 2.0833, 2.5, 120
Bold Bloodstone, https://wotlkdb.com/?spell=53831, 0.414, 0.99, 1.404, 141.8
Wicked Huge Citrine, https://wotlkdb.com/?spell=53886, 0.38, 0.99, 1.37, 138.4
Brilliant Dawnstone, https://wotlkdb.com/?spell=31096, 0.32, 2.68, 3, 111.9
Rigid Dawnstone, https://wotlkdb.com/?spell=31098, 0.32, 2.68, 3, 111.9
Thick Dawnstone, https://wotlkdb.com/?spell=31100, 0.32, 2.68, 3, 111.9
Mystic Dawnstone, https://wotlkdb.com/?spell=31101, 0.32, 2.68, 3, 111.9
Stone of Blades, https://wotlkdb.com/?spell=42591, 0.32, 2.68, 3, 111.9
Blood of Amber, https://wotlkdb.com/?spell=42592, 0.32, 2.68, 3, 111.9
Facet of Eternity, https://wotlkdb.com/?spell=42593, 0.32, 2.68, 3, 111.9
Quick Dawnstone, https://wotlkdb.com/?spell=46403, 0.32, 2.68, 3, 111.9
Enduring Deep Peridot, https://wotlkdb.com/?spell=28918, 0.13, 0.62, 0.75, 121
Sovereign Nightseye, https://wotlkdb.com/?spell=31102, 0.08, 2.92, 3, 102.7
Shifting Nightseye, https://wotlkdb.com/?spell=31103, 0.08, 2.92, 3, 102.7
Glowing Nightseye, https://wotlkdb.com/?spell=31104, 0.08, 2.92, 3, 102.7
Royal Nightseye, https://wotlkdb.com/?spell=31105, 0.08, 2.92, 3, 102.7
Regal Nightseye, https://wotlkdb.com/?spell=46803, 0.08, 2.92, 3, 102.7
Bold Living Ruby, https://wotlkdb.com/?spell=31084, 0.04, 2.96, 3, 101.4
Teardrop Living Ruby, https://wotlkdb.com/?spell=31087, 0.04, 2.96, 3, 101.4
Runed Living Ruby, https://wotlkdb.com/?spell=31088, 0.04, 2.96, 3, 101.4
Bright Living Ruby, https://wotlkdb.com/?spell=31089, 0.04, 2.96, 3, 101.4
Subtle Living Ruby, https://wotlkdb.com/?spell=31090, 0.04, 2.96, 3, 101.4
Flashing Living Ruby, https://wotlkdb.com/?spell=31091, 0.04, 2.96, 3, 101.4
Don Julio's Heart, https://wotlkdb.com/?spell=42558, 0.04, 2.96, 3, 101.4
Kailee's Rose, https://wotlkdb.com/?spell=42588, 0.04, 2.96, 3, 101.4
Crimson Sun, https://wotlkdb.com/?spell=42589, 0.04, 2.96, 3, 101.4
Potent Flame Spessarite, https://wotlkdb.com/?spell=28915, 0.02, 1.98, 2, 101
Deft Huge Citrine, https://wotlkdb.com/?spell=53880, 0.01, 0.99, 1, 101
Bold Blood Garnet, https://wotlkdb.com/?spell=28905, -0.01, 0.95, 0.94, 98.9
Bright Blood Garnet, https://wotlkdb.com/?spell=34590, -0.03, 0.95, 0.92, 96.8
Jagged Deep Peridot, https://wotlkdb.com/?spell=28917, -0.05, 0.62, 0.57, 91.9
Rough Stone Statue, https://wotlkdb.com/?spell=32259, -0.0567, 0.0592, 0.0025, 4.2
Coarse Stone Statue, https://wotlkdb.com/?spell=32801, -0.2242, 0.2392, 0.015, 6.3
Radiant Deep Peridot, https://wotlkdb.com/?spell=28916, -0.36, 0.62, 0.26, 41.9
Solid Azure Moonstone, https://wotlkdb.com/?spell=28950, -0.67, 1.55, 0.88, 56.8
Teardrop Blood Garnet, https://wotlkdb.com/?spell=28903, -0.7, 0.95, 0.25, 26.3
Delicate Blood Garnet, https://wotlkdb.com/?spell=28907, -0.7, 0.95, 0.25, 26.3
Solid Empyrean Sapphire, https://wotlkdb.com/?spell=39715, -0.875, 6.875, 6, 87.3
Sparkling Empyrean Sapphire, https://wotlkdb.com/?spell=39716, -0.875, 6.875, 6, 87.3
Lustrous Empyrean Sapphire, https://wotlkdb.com/?spell=39717, -0.875, 6.875, 6, 87.3
Stormy Empyrean Sapphire, https://wotlkdb.com/?spell=39718, -0.875, 6.875, 6, 87.3
Dense Stone Statue, https://wotlkdb.com/?spell=32809, -0.885, 0.985, 0.1, 10.2
Purified Jaggal Pearl, https://wotlkdb.com/?spell=41420, -0.9332, 5.9837, 5.0505, 84.4
Amulet of Truesight, https://wotlkdb.com/?spell=63743, -0.9495, 6, 5.0505, 84.2
Sparkling Azure Moonstone, https://wotlkdb.com/?spell=28953, -1, 1.55, 0.55, 35.5
Stormy Azure Moonstone, https://wotlkdb.com/?spell=28955, -1.12, 1.55, 0.43, 27.7
Glowing Shadow Draenite, https://wotlkdb.com/?spell=28925, -1.16, 1.91, 0.75, 39.3
