Name, Link, Profit, Cost, Sell, ROI %
Brutal Earthstorm Diamond, https://wotlkdb.com/?spell=32869, 3538.8433, 80, 3618.8433, 4523.6
Ring of Scarlet Shadows, https://wotlkdb.com/?spell=58148, 693.6, 271.4, 965, 355.6
Titanium Earthguard Ring, https://wotlkdb.com/?spell=56497, 639.5, 658.5, 1298, 197.1
Titanium Earthguard Chain, https://wotlkdb.com/?spell=56500, 625.5, 696.5, 1322, 189.8
Titanium Impact Band, https://wotlkdb.com/?spell=56496, 589.4288, 958.46, 1547.8888, 161.5
Titanium Frostguard Ring, https://wotlkdb.com/?spell=58954, 570.5835, 425.42, 996.0035, 234.1
Titanium Impact Choker, https://wotlkdb.com/?spell=56499, 517.39, 1180.64, 1698.03, 143.8
Titanium Spellshock Necklace, https://wotlkdb.com/?spell=56501, 516.4, 755.6, 1272, 168.3
Gem Studded Band, https://wotlkdb.com/?spell=26896, 453.5928, 65.4796, 519.0724, 792.7
Ring of Earthen Might, https://wotlkdb.com/?spell=58147, 425.2037, 114.9, 540.1037, 470.1
Powerful Earthstorm Diamond, https://wotlkdb.com/?spell=32866, 420, 80, 500, 625
Titanium Spellshock Ring, https://wotlkdb.com/?spell=56498, 398.3, 720.7, 1119, 155.3
Ring of Northern Tears, https://wotlkdb.com/?spell=58150, 391.1828, 116.8172, 508, 434.9
Savage Titanium Band, https://wotlkdb.com/?spell=58507, 343.24, 505.76, 849, 167.9
Citrine Pendant of Golden Healing, https://wotlkdb.com/?spell=25622, 342.4733, 12.0849, 354.5582, 2933.9
Ruby Crown of Restoration, https://wotlkdb.com/?spell=26878, 339.6304, 155.6336, 495.264, 318.2
Effulgent Skyflare Diamond, https://wotlkdb.com/?spell=55384, 214.6, 85, 299.6, 352.5
Savage Titanium Ring, https://wotlkdb.com/?spell=58492, 181.24, 505.76, 687, 135.8
Windfire Band, https://wotlkdb.com/?spell=58149, 170.42, 279.58, 450, 161
Bronze Band of Force, https://wotlkdb.com/?spell=37818, 150.205, 17.545, 167.75, 956.1
Trenchant Earthsiege Diamond, https://wotlkdb.com/?spell=55403, 96.9, 114.5, 211.4, 184.6
Runed Mana Band, https://wotlkdb.com/?spell=64727, 87.1, 120.9, 208, 172
Moonsoul Crown, https://wotlkdb.com/?spell=25321, 85.5701, 14.4299, 100, 693
Sky Sapphire Amulet, https://wotlkdb.com/?spell=64726, 83.0999, 126.9, 209.9999, 165.5
Mercurial Adamantite, https://wotlkdb.com/?spell=38068, 83.02, 66.98, 150, 223.9
Jagged Forest Emerald, https://wotlkdb.com/?spell=53996, 75.26, 2.99, 78.25, 2617.1
Forceful Eye of Zul, https://wotlkdb.com/?spell=66434, 74.75, 80, 154.75, 193.4
Forceful Forest Emerald, https://wotlkdb.com/?spell=54001, 72.01, 2.99, 75, 2508.4
Royal Twilight Opal, https://wotlkdb.com/?spell=53967, 71.65, 7, 78.65, 1123.6
Radiant Eye of Zul, https://wotlkdb.com/?spell=66441, 70.85, 80, 150.85, 188.6
Impassive Skyflare Diamond, https://wotlkdb.com/?spell=55388, 70.75, 85, 155.75, 183.2
Jagged Eye of Zul, https://wotlkdb.com/?spell=66431, 68.4, 80, 148.4, 185.5
Delicate Scarlet Ruby, https://wotlkdb.com/?spell=53945, 67, 101.5, 168.5, 166
Radiant Forest Emerald, https://wotlkdb.com/?spell=54012, 66.01, 2.99, 69, 2307.7
Enigmatic Skyflare Diamond, https://wotlkdb.com/?spell=55393, 65, 85, 150, 176.5
Revitalizing Skyflare Diamond, https://wotlkdb.com/?spell=55407, 65, 85, 150, 176.5
Timeless Eye of Zul, https://wotlkdb.com/?spell=66432, 63.625, 80, 143.625, 179.5
Puissant Twilight Opal, https://wotlkdb.com/?spell=53973, 63, 7, 70, 1000
Band of Natural Fire, https://wotlkdb.com/?spell=26916, 62.18, 7.82, 70, 895.1
Emerald Choker, https://wotlkdb.com/?spell=64725, 62.08, 62.42, 124.5, 199.5
Opaque Forest Emerald, https://wotlkdb.com/?spell=54010, 60.91, 2.99, 63.9, 2137.1
Shattered Eye of Zul, https://wotlkdb.com/?spell=66443, 60.5576, 80, 140.5576, 175.7
Shifting Twilight Opal, https://wotlkdb.com/?spell=53963, 58, 7, 65, 928.6
Lustrous Sky Sapphire, https://wotlkdb.com/?spell=53954, 57.47, 10, 67.47, 674.7
Infused Nightseye, https://wotlkdb.com/?spell=39462, 57.08, 2.92, 60, 2054.8
Opaque Eye of Zul, https://wotlkdb.com/?spell=66444, 56.75, 80, 136.75, 170.9
Sundered Eye of Zul, https://wotlkdb.com/?spell=66436, 56.4532, 80, 136.4532, 170.6
Lambent Eye of Zul, https://wotlkdb.com/?spell=66439, 55.66, 80, 135.66, 169.6
Golden Ring of Power, https://wotlkdb.com/?spell=34955, 53.2212, 6.7788, 60, 885.1
Regal Dreadstone, https://wotlkdb.com/?spell=66559, 49.1499, 99.6, 148.7499, 149.3
Delicate Living Ruby, https://wotlkdb.com/?spell=31085, 47.8432, 2.8, 50.6432, 1808.7
Necklace of the Deep, https://wotlkdb.com/?spell=40514, 47.2052, 52.5948, 99.8, 189.8
Energized Forest Emerald, https://wotlkdb.com/?spell=54011, 47.01, 2.99, 50, 1672.2
Vivid Forest Emerald, https://wotlkdb.com/?spell=53997, 45.4675, 2.99, 48.4575, 1620.7
Guardian's Dreadstone, https://wotlkdb.com/?spell=66561, 45.4, 99.6, 145, 145.6
Misty Eye of Zul, https://wotlkdb.com/?spell=66435, 45, 80, 125, 156.3
Infused Dreadstone, https://wotlkdb.com/?spell=66564, 44.4, 99.6, 144, 144.6
Stark Monarch Topaz, https://wotlkdb.com/?spell=53991, 42.975, 62.15, 105.125, 169.1
Lambent Forest Emerald, https://wotlkdb.com/?spell=54009, 42.01, 2.99, 45, 1505
Scarlet Signet, https://wotlkdb.com/?spell=64728, 41.6, 208.4, 250, 120
Eternal Earthsiege Diamond, https://wotlkdb.com/?spell=55398, 41.5, 114.5, 156, 136.2
Precise Cardinal Ruby, https://wotlkdb.com/?spell=66450, 40.9999, 210, 250.9999, 119.5
Vivid Eye of Zul, https://wotlkdb.com/?spell=66429, 39.9999, 80, 119.9999, 150
Flashing Cardinal Ruby, https://wotlkdb.com/?spell=66453, 39.55, 210, 249.55, 118.8
Jade Dagger Pendant, https://wotlkdb.com/?spell=56195, 38.92, 15.98, 54.9, 343.6
Bold Scarlet Ruby, https://wotlkdb.com/?spell=53830, 38.5, 101.5, 140, 137.9
Flashing Scarlet Ruby, https://wotlkdb.com/?spell=53949, 38.5, 101.5, 140, 137.9
Steady Eye of Zul, https://wotlkdb.com/?spell=66428, 38.25, 80, 118.25, 147.8
Defender's Twilight Opal, https://wotlkdb.com/?spell=53972, 38, 7, 45, 642.9
Regal Twilight Opal, https://wotlkdb.com/?spell=53971, 37.9, 7, 44.9, 641.4
Puissant Dreadstone, https://wotlkdb.com/?spell=66563, 37.15, 99.6, 136.75, 137.3
Beaming Earthsiege Diamond, https://wotlkdb.com/?spell=55405, 37.05, 114.5, 151.55, 132.4
Forlorn Skyflare Diamond, https://wotlkdb.com/?spell=55387, 37, 85, 122, 143.5
Reckless Monarch Topaz, https://wotlkdb.com/?spell=53987, 36.85, 62.15, 99, 159.3
Runed Blood Garnet, https://wotlkdb.com/?spell=28906, 36.05, 0.95, 37, 3894.7
Tense Eye of Zul, https://wotlkdb.com/?spell=66438, 36, 80, 116, 145
Glinting Monarch Topaz, https://wotlkdb.com/?spell=53980, 35.85, 62.15, 98, 157.7
Fierce Ametrine, https://wotlkdb.com/?spell=66583, 35.75, 189.75, 225.5, 118.8
Seer's Eye of Zul, https://wotlkdb.com/?spell=66433, 35, 80, 115, 143.8
Intricate Eye of Zul, https://wotlkdb.com/?spell=66440, 34.625, 80, 114.625, 143.3
Inscribed Noble Topaz, https://wotlkdb.com/?spell=31106, 34.585, 2.54, 37.125, 1461.6
Stark Ametrine, https://wotlkdb.com/?spell=66587, 34.25, 189.75, 224, 118.1
Enduring Talasite, https://wotlkdb.com/?spell=31110, 33.5, 1.5, 35, 2333.3
Fractured Scarlet Ruby, https://wotlkdb.com/?spell=53950, 33.5, 101.5, 135, 133
Sovereign Dreadstone, https://wotlkdb.com/?spell=66554, 33.1499, 99.6, 132.7499, 133.3
Thick King's Amber, https://wotlkdb.com/?spell=66504, 32.75, 189.75, 222.5, 117.3
Nightmare Tear, https://wotlkdb.com/?spell=68253, 32.1, 109.9, 142, 129.2
Stormy Sky Sapphire, https://wotlkdb.com/?spell=53955, 32, 10, 42, 420
Mysterious Twilight Opal, https://wotlkdb.com/?spell=53968, 31.88, 7, 38.88, 555.4
Intricate Forest Emerald, https://wotlkdb.com/?spell=54006, 31.01, 2.99, 34, 1137.1
Mystic Sun Crystal, https://wotlkdb.com/?spell=53857, 30.82, 1.18, 32, 2711.9
Invigorating Earthsiege Diamond, https://wotlkdb.com/?spell=55404, 30.5, 114.5, 145, 126.6
Defender's Dreadstone, https://wotlkdb.com/?spell=66560, 30.2998, 99.6, 129.8998, 130.4
Royal Dreadstone, https://wotlkdb.com/?spell=66558, 30.1, 99.6, 129.7, 130.2
Tense Forest Emerald, https://wotlkdb.com/?spell=54013, 30.01, 2.99, 33, 1103.7
Sovereign Twilight Opal, https://wotlkdb.com/?spell=53962, 30, 7, 37, 528.6
Purified Dreadstone, https://wotlkdb.com/?spell=66556, 29.4, 99.6, 129, 129.5
Resolute Ametrine, https://wotlkdb.com/?spell=66586, 29.13, 189.75, 218.88, 115.4
Dazzling Eye of Zul, https://wotlkdb.com/?spell=66430, 28.75, 80, 108.75, 135.9
Shifting Dreadstone, https://wotlkdb.com/?spell=66557, 28.525, 99.6, 128.125, 128.6
Wicked Monarch Topaz, https://wotlkdb.com/?spell=53988, 27.35, 62.15, 89.5, 144
Enduring Forest Emerald, https://wotlkdb.com/?spell=53998, 27.01, 2.99, 30, 1003.3
Resplendent Monarch Topaz, https://wotlkdb.com/?spell=53978, 26.851, 62.15, 89.001, 143.2
Luminous Monarch Topaz, https://wotlkdb.com/?spell=53983, 26.85, 62.15, 89, 143.2
Potent Monarch Topaz, https://wotlkdb.com/?spell=53984, 26.85, 62.15, 89, 143.2
Ember Skyflare Diamond, https://wotlkdb.com/?spell=55392, 26.75, 85, 111.75, 131.5
Seer's Forest Emerald, https://wotlkdb.com/?spell=54002, 26.71, 2.99, 29.7, 993.3
Balanced Dreadstone, https://wotlkdb.com/?spell=66553, 26.3499, 99.6, 125.9499, 126.5
Smooth King's Amber, https://wotlkdb.com/?spell=66502, 26.2499, 189.75, 215.9999, 113.8
Bold Cardinal Ruby, https://wotlkdb.com/?spell=66447, 25.9999, 210, 235.9999, 112.4
Sundered Forest Emerald, https://wotlkdb.com/?spell=54008, 25.81, 2.99, 28.8, 963.2
Wicked Moonstone Ring, https://wotlkdb.com/?spell=25323, 25.5511, 24.4489, 50, 204.5
Solid Sky Sapphire, https://wotlkdb.com/?spell=53952, 25, 10, 35, 350
Guardian's Twilight Opal, https://wotlkdb.com/?spell=53974, 24, 7, 31, 442.9
Shining Eye of Zul, https://wotlkdb.com/?spell=66437, 23.9999, 80, 103.9999, 130
Dream Signet, https://wotlkdb.com/?spell=56197, 23.6601, 76.3399, 100, 131
Subtle Scarlet Ruby, https://wotlkdb.com/?spell=53948, 23.5, 101.5, 125, 123.2
Fractured Cardinal Ruby, https://wotlkdb.com/?spell=66451, 22.75, 210, 232.75, 110.8
Defender's Shadow Crystal, https://wotlkdb.com/?spell=53869, 22.36, 0.64, 23, 3593.8
Misty Forest Emerald, https://wotlkdb.com/?spell=54003, 22.01, 2.99, 25, 836.1
Tenuous Twilight Opal, https://wotlkdb.com/?spell=53964, 21.9, 7, 28.9, 412.9
Durable Huge Citrine, https://wotlkdb.com/?spell=53884, 21.5364, 0.99, 22.5264, 2275.4
Steady Forest Emerald, https://wotlkdb.com/?spell=54000, 21.26, 2.99, 24.25, 811
Resplendent Huge Citrine, https://wotlkdb.com/?spell=53875, 21.01, 0.99, 22, 2222.2
Lucent Huge Citrine, https://wotlkdb.com/?spell=53879, 21.01, 0.99, 22, 2222.2
Tenuous Dreadstone, https://wotlkdb.com/?spell=66565, 20.4, 99.6, 120, 120.5
Resplendent Ametrine, https://wotlkdb.com/?spell=66582, 20.1999, 189.75, 209.9499, 110.6
Energized Eye of Zul, https://wotlkdb.com/?spell=66442, 20, 80, 100, 125
Turbid Eye of Zul, https://wotlkdb.com/?spell=66445, 20, 80, 100, 125
Runed Cardinal Ruby, https://wotlkdb.com/?spell=66446, 19.9999, 210, 229.9999, 109.5
Stalwart Ametrine, https://wotlkdb.com/?spell=66581, 19.91, 189.75, 209.66, 110.5
Accurate Ametrine, https://wotlkdb.com/?spell=66576, 19.6999, 189.75, 209.4499, 110.4
Veiled Ametrine, https://wotlkdb.com/?spell=66570, 19.1388, 189.75, 208.8888, 110.1
Empowered Huge Citrine, https://wotlkdb.com/?spell=53888, 19.01, 0.99, 20, 2020.2
Etched Ametrine, https://wotlkdb.com/?spell=66572, 19, 189.75, 208.75, 110
Quick King's Amber, https://wotlkdb.com/?spell=66506, 18.75, 189.75, 208.5, 109.9
Mystic Autumn's Glow, https://wotlkdb.com/?spell=53960, 18.5001, 104.9999, 123.5, 117.6
Runed Scarlet Ruby, https://wotlkdb.com/?spell=53946, 18.25, 101.5, 119.75, 118
Rigid King's Amber, https://wotlkdb.com/?spell=66501, 18.25, 189.75, 208, 109.6
Bloodstone Band, https://wotlkdb.com/?spell=56193, 18.11, 1.89, 20, 1058.2
Crystal Citrine Necklace, https://wotlkdb.com/?spell=58141, 18.06, 1.89, 19.95, 1055.6
Reckless Ametrine, https://wotlkdb.com/?spell=66574, 18, 189.75, 207.75, 109.5
Infused Twilight Opal, https://wotlkdb.com/?spell=53970, 17.8, 7, 24.8, 354.3
Shattered Forest Emerald, https://wotlkdb.com/?spell=54014, 17.01, 2.99, 20, 668.9
Shattered Dark Jade, https://wotlkdb.com/?spell=53933, 17, 5, 22, 440
Veiled Monarch Topaz, https://wotlkdb.com/?spell=53985, 16.85, 62.15, 79, 127.1
Lustrous Majestic Zircon, https://wotlkdb.com/?spell=66500, 16, 125, 141, 112.8
Stalwart Monarch Topaz, https://wotlkdb.com/?spell=53992, 15.85, 62.15, 78, 125.5
Accurate Monarch Topaz, https://wotlkdb.com/?spell=53994, 15.85, 62.15, 78, 125.5
Sparkling Majestic Zircon, https://wotlkdb.com/?spell=66498, 15.8275, 125, 140.8275, 112.7
Rigid Autumn's Glow, https://wotlkdb.com/?spell=53958, 15.0001, 104.9999, 120, 114.3
Vivid Dark Jade, https://wotlkdb.com/?spell=53917, 15, 5, 20, 400
Seer's Dark Jade, https://wotlkdb.com/?spell=53921, 15, 5, 20, 400
Mysterious Dreadstone, https://wotlkdb.com/?spell=66562, 14.9, 99.6, 114.5, 115
Turbid Forest Emerald, https://wotlkdb.com/?spell=54005, 14.01, 2.99, 17, 568.6
Mysterious Shadow Crystal, https://wotlkdb.com/?spell=53865, 13.36, 0.64, 14, 2187.5
Mystic King's Amber, https://wotlkdb.com/?spell=66505, 13.25, 189.75, 203, 107
Potent Ametrine, https://wotlkdb.com/?spell=66569, 13.25, 189.75, 203, 107
Purified Twilight Opal, https://wotlkdb.com/?spell=53966, 13, 7, 20, 285.7
Deadly Monarch Topaz, https://wotlkdb.com/?spell=53979, 12.85, 62.15, 75, 120.7
Empowered Monarch Topaz, https://wotlkdb.com/?spell=53990, 12.85, 62.15, 75, 120.7
Blood Sun Necklace, https://wotlkdb.com/?spell=56196, 12.65, 22.35, 35, 156.6
Shadow Jade Focusing Lens, https://wotlkdb.com/?spell=56208, 12.11, 5.64, 17.75, 314.7
Bright Crimson Spinel, https://wotlkdb.com/?spell=39712, 12.0499, 7.95, 19.9999, 251.6
Enduring Eye of Zul, https://wotlkdb.com/?spell=66338, 12, 80, 92, 115
Crystal Chalcedony Amulet, https://wotlkdb.com/?spell=58142, 11.5719, 15.9, 27.4719, 172.8
Enchanted Tear, https://wotlkdb.com/?spell=56531, 11.56, 9.94, 21.5, 216.3
Glowing Dreadstone, https://wotlkdb.com/?spell=66555, 11.4, 99.6, 111, 111.4
Azure Moonstone Ring, https://wotlkdb.com/?spell=31050, 11.3, 8.7, 20, 229.9
Subtle Bloodstone, https://wotlkdb.com/?spell=53843, 11.1312, 0.99, 12.1212, 1224.4
Mithril Filigree, https://wotlkdb.com/?spell=25615, 10.95, 8, 18.95, 236.9
Insightful Earthsiege Diamond, https://wotlkdb.com/?spell=55396, 10.5, 114.5, 125, 109.2
Delicate Cardinal Ruby, https://wotlkdb.com/?spell=66448, 10.15, 210, 220.15, 104.8
Brilliant King's Amber, https://wotlkdb.com/?spell=66503, 10, 189.75, 199.75, 105.3
Wicked Ametrine, https://wotlkdb.com/?spell=66577, 9.9997, 189.75, 199.7497, 105.3
Champion's Ametrine, https://wotlkdb.com/?spell=66579, 9.75, 189.75, 199.5, 105.1
Glimmering Ametrine, https://wotlkdb.com/?spell=66578, 9.5, 189.75, 199.25, 105
Inscribed Ametrine, https://wotlkdb.com/?spell=66567, 9.25, 189.75, 199, 104.9
Glowing Twilight Opal, https://wotlkdb.com/?spell=53965, 8.95, 7, 15.95, 227.9
Sun Rock Ring, https://wotlkdb.com/?spell=56194, 8.92, 2.08, 11, 528.8
Deft Ametrine, https://wotlkdb.com/?spell=66584, 8.75, 189.75, 198.5, 104.6
Reckless Huge Citrine, https://wotlkdb.com/?spell=53885, 8.702, 0.99, 9.692, 979
Glinting Ametrine, https://wotlkdb.com/?spell=66575, 8.5, 189.75, 198.25, 104.5
Deadly Ametrine, https://wotlkdb.com/?spell=66568, 8.2499, 189.75, 197.9999, 104.3
Shining Forest Emerald, https://wotlkdb.com/?spell=54004, 8.01, 2.99, 11, 367.9
Rigid Sun Crystal, https://wotlkdb.com/?spell=53854, 7.77, 1.18, 8.95, 758.5
Resolute Monarch Topaz, https://wotlkdb.com/?spell=54023, 7.75, 62.15, 69.9, 112.5
Precise Bloodstone, https://wotlkdb.com/?spell=54017, 7.51, 0.99, 8.5, 858.6
Smooth Dawnstone, https://wotlkdb.com/?spell=31097, 7.27, 2.68, 9.95, 371.3
Gleaming Dawnstone, https://wotlkdb.com/?spell=31099, 7.27, 2.68, 9.95, 371.3
Heavy Silver Ring, https://wotlkdb.com/?spell=25305, 7.2696, 12.1554, 19.425, 159.8
Glinting Pyrestone, https://wotlkdb.com/?spell=39736, 7.0999, 7.9, 14.9999, 189.9
Deadly Huge Citrine, https://wotlkdb.com/?spell=53877, 7.01, 0.99, 8, 808.1
Tenuous Shadow Crystal, https://wotlkdb.com/?spell=53861, 7, 0.64, 7.64, 1193.8
Stoneguard Band, https://wotlkdb.com/?spell=58145, 6.9999, 8, 14.9999, 187.5
Empowered Ametrine, https://wotlkdb.com/?spell=66580, 6.9999, 189.75, 196.7499, 103.7
Stalwart Huge Citrine, https://wotlkdb.com/?spell=53890, 6.96, 0.99, 7.95, 803
Quick Sun Crystal, https://wotlkdb.com/?spell=53856, 6.72, 1.18, 7.9, 669.5
Pristine Huge Citrine, https://wotlkdb.com/?spell=53887, 6.36, 0.99, 7.35, 742.4
Steady Dark Jade, https://wotlkdb.com/?spell=53919, 6, 5, 11, 220
Stormy Chalcedony, https://wotlkdb.com/?spell=53943, 6, 15, 21, 140
Luminous Huge Citrine, https://wotlkdb.com/?spell=53881, 5.96, 0.99, 6.95, 702
Lucent Ametrine, https://wotlkdb.com/?spell=66585, 5.95, 189.75, 195.7, 103.1
Solid Majestic Zircon, https://wotlkdb.com/?spell=66497, 5.75, 125, 130.75, 104.6
Austere Earthsiege Diamond, https://wotlkdb.com/?spell=55401, 5.5, 114.5, 120, 104.8
Luminous Ametrine, https://wotlkdb.com/?spell=66566, 5.25, 189.75, 195, 102.8
Bright Cardinal Ruby, https://wotlkdb.com/?spell=66449, 5.25, 210, 215.25, 102.5
Shadow Crystal Focusing Lens, https://wotlkdb.com/?spell=56206, 5.0162, 0.64, 5.6562, 883.8
Quick Autumn's Glow, https://wotlkdb.com/?spell=53961, 5.0001, 104.9999, 110, 104.8
Chaotic Skyflare Diamond, https://wotlkdb.com/?spell=55389, 5, 85, 90, 105.9
Purified Shadow Pearl, https://wotlkdb.com/?spell=41429, 4.6765, 0.3235, 5, 1545.6
Jagged Talasite, https://wotlkdb.com/?spell=31113, 4.5, 1.5, 6, 400
Regal Shadow Crystal, https://wotlkdb.com/?spell=53868, 4.36, 0.64, 5, 781.3
Pristine Ametrine, https://wotlkdb.com/?spell=66573, 4.25, 189.75, 194, 102.2
Guardian's Shadow Crystal, https://wotlkdb.com/?spell=53871, 4.24, 0.64, 4.88, 762.5
Luminous Noble Topaz, https://wotlkdb.com/?spell=31108, 4.21, 2.54, 6.75, 265.7
Shining Dark Jade, https://wotlkdb.com/?spell=53923, 4, 5, 9, 180
Lambent Dark Jade, https://wotlkdb.com/?spell=53928, 4, 5, 9, 180
Opaque Dark Jade, https://wotlkdb.com/?spell=53929, 4, 5, 9, 180
Resolute Huge Citrine, https://wotlkdb.com/?spell=53893, 3.89, 0.99, 4.88, 492.9
Golden Draenite Ring, https://wotlkdb.com/?spell=31049, 3.12, 16.88, 20, 118.5
Bright Bloodstone, https://wotlkdb.com/?spell=53835, 3.01, 0.99, 4, 404
Fractured Bloodstone, https://wotlkdb.com/?spell=53845, 3.01, 0.99, 4, 404
Forceful Dark Jade, https://wotlkdb.com/?spell=53920, 3, 5, 8, 160
Smooth Sun Crystal, https://wotlkdb.com/?spell=53853, 2.92, 1.18, 4.1, 347.5
Fierce Huge Citrine, https://wotlkdb.com/?spell=53876, 2.91, 0.99, 3.9, 393.9
Thick Sun Crystal, https://wotlkdb.com/?spell=53855, 2.78, 1.18, 3.96, 335.6
Etched Huge Citrine, https://wotlkdb.com/?spell=53873, 2.51, 0.99, 3.5, 353.5
Brilliant Lionseye, https://wotlkdb.com/?spell=39719, 2.5, 3.5, 6, 171.4
Smooth Lionseye, https://wotlkdb.com/?spell=39720, 2.5, 3.5, 6, 171.4
Rigid Lionseye, https://wotlkdb.com/?spell=39721, 2.5, 3.5, 6, 171.4
Gleaming Lionseye, https://wotlkdb.com/?spell=39722, 2.5, 3.5, 6, 171.4
Thick Lionseye, https://wotlkdb.com/?spell=39723, 2.5, 3.5, 6, 171.4
Mystic Lionseye, https://wotlkdb.com/?spell=39724, 2.5, 3.5, 6, 171.4
Great Lionseye, https://wotlkdb.com/?spell=39725, 2.5, 3.5, 6, 171.4
Quick Lionseye, https://wotlkdb.com/?spell=47056, 2.5, 3.5, 6, 171.4
Enchanted Pearl, https://wotlkdb.com/?spell=56530, 2.4832, 2.5168, 5, 198.7
Delicate Bloodstone, https://wotlkdb.com/?spell=53832, 2.42, 0.99, 3.41, 344.4
Dazzling Deep Peridot, https://wotlkdb.com/?spell=28924, 2.38, 0.62, 3, 483.9
Purified Shadow Crystal, https://wotlkdb.com/?spell=53863, 2.36, 0.64, 3, 468.8
Fel Iron Blood Ring, https://wotlkdb.com/?spell=31048, 2.02, 6.88, 8.9, 129.4
Champion's Huge Citrine, https://wotlkdb.com/?spell=53874, 1.99, 0.99, 2.98, 301
Veiled Huge Citrine, https://wotlkdb.com/?spell=53883, 1.99, 0.99, 2.98, 301
Runed Bloodstone, https://wotlkdb.com/?spell=53834, 1.98, 0.99, 2.97, 300
Lucent Monarch Topaz, https://wotlkdb.com/?spell=53981, 1.85, 62.15, 64, 103
Infused Shadow Crystal, https://wotlkdb.com/?spell=53867, 1.84, 0.64, 2.48, 387.5
Timeless Forest Emerald, https://wotlkdb.com/?spell=53995, 1.65, 2.99, 4.64, 155.2
Dazzling Forest Emerald, https://wotlkdb.com/?spell=54007, 1.51, 2.99, 4.5, 150.5
Potent Huge Citrine, https://wotlkdb.com/?spell=53882, 1.5, 0.99, 2.49, 251.5
Radiant Talasite, https://wotlkdb.com/?spell=31111, 1.5, 1.5, 3, 200
Dazzling Talasite, https://wotlkdb.com/?spell=31112, 1.5, 1.5, 3, 200
Steady Talasite, https://wotlkdb.com/?spell=43493, 1.5, 1.5, 3, 200
Forceful Talasite, https://wotlkdb.com/?spell=46405, 1.5, 1.5, 3, 200
Flashing Bloodstone, https://wotlkdb.com/?spell=53844, 1.49, 0.99, 2.48, 250.5
Glinting Huge Citrine, https://wotlkdb.com/?spell=53878, 1.46, 0.99, 2.45, 247.5
Glowing Shadow Crystal, https://wotlkdb.com/?spell=53862, 1.36, 0.64, 2, 312.5
Balanced Shadow Crystal, https://wotlkdb.com/?spell=53866, 1.36, 0.64, 2, 312.5
Enduring Seaspray Emerald, https://wotlkdb.com/?spell=39739, 1.3, 4.7, 6, 127.7
Radiant Seaspray Emerald, https://wotlkdb.com/?spell=39740, 1.3, 4.7, 6, 127.7
Dazzling Seaspray Emerald, https://wotlkdb.com/?spell=39741, 1.3, 4.7, 6, 127.7
Jagged Seaspray Emerald, https://wotlkdb.com/?spell=39742, 1.3, 4.7, 6, 127.7
Stark Huge Citrine, https://wotlkdb.com/?spell=53889, 1.26, 0.99, 2.25, 227.3
Royal Shadow Crystal, https://wotlkdb.com/?spell=53864, 1.09, 0.64, 1.73, 270.3
Lustrous Star of Elune, https://wotlkdb.com/?spell=31094, 1.0201, 1.9799, 3, 151.5
Stormy Star of Elune, https://wotlkdb.com/?spell=31095, 1.0201, 1.9799, 3, 151.5
Sparkling Star of Elune, https://wotlkdb.com/?spell=31149, 1.0201, 1.9799, 3, 151.5
Falling Star, https://wotlkdb.com/?spell=42590, 1.0201, 1.9799, 3, 151.5
Accurate Huge Citrine, https://wotlkdb.com/?spell=53892, 1.01, 0.99, 2, 202
Inscribed Huge Citrine, https://wotlkdb.com/?spell=53872, 0.97, 0.99, 1.96, 198
Glimmering Huge Citrine, https://wotlkdb.com/?spell=53891, 0.9595, 0.99, 1.9495, 196.9
Shifting Shadow Crystal, https://wotlkdb.com/?spell=53860, 0.86, 0.64, 1.5, 234.4
Energized Dark Jade, https://wotlkdb.com/?spell=53930, 0.84, 5, 5.84, 116.8
Brilliant Sun Crystal, https://wotlkdb.com/?spell=53852, 0.82, 1.18, 2, 169.5
Wicked Noble Topaz, https://wotlkdb.com/?spell=39471, 0.6179, 2.54, 3.1579, 124.3
Puissant Shadow Crystal, https://wotlkdb.com/?spell=53870, 0.5, 0.64, 1.14, 178.1
Potent Noble Topaz, https://wotlkdb.com/?spell=31107, 0.46, 2.54, 3, 118.1
Glinting Noble Topaz, https://wotlkdb.com/?spell=31109, 0.46, 2.54, 3, 118.1
Veiled Noble Topaz, https://wotlkdb.com/?spell=39470, 0.46, 2.54, 3, 118.1
Reckless Noble Topaz, https://wotlkdb.com/?spell=46404, 0.46, 2.54, 3, 118.1
Elegant Silver Ring, https://wotlkdb.com/?spell=25280, 0.4167, 2.0833, 2.5, 120
Bold Bloodstone, https://wotlkdb.com/?spell=53831, 0.414, 0.99, 1.404, 141.8
Wicked Huge Citrine, https://wotlkdb.com/?spell=53886, 0.38, 0.99, 1.37, 138.4
Brilliant Dawnstone, https://wotlkdb.com/?spell=31096, 0.32, 2.68, 3, 111.9
Rigid Dawnstone, https://wotlkdb.com/?spell=31098, 0.32, 2.68, 3, 111.9
Thick Dawnstone, https://wotlkdb.com/?spell=31100, 0.32, 2.68, 3, 111.9
Mystic Dawnstone, https://wotlkdb.com/?spell=31101, 0.32, 2.68, 3, 111.9
Stone of Blades, https://wotlkdb.com/?spell=42591, 0.32, 2.68, 3, 111.9
Blood of Amber, https://wotlkdb.com/?spell=42592, 0.32, 2.68, 3, 111.9
Facet of Eternity, https://wotlkdb.com/?spell=42593, 0.32, 2.68, 3, 111.9
Quick Dawnstone, https://wotlkdb.com/?spell=46403, 0.32, 2.68, 3, 111.9
Sovereign Shadow Crystal, https://wotlkdb.com/?spell=53859, 0.315, 0.64, 0.955, 149.2
Bold Living Ruby, https://wotlkdb.com/?spell=31084, 0.2, 2.8, 3, 107.1
Teardrop Living Ruby, https://wotlkdb.com/?spell=31087, 0.2, 2.8, 3, 107.1
Runed Living Ruby, https://wotlkdb.com/?spell=31088, 0.2, 2.8, 3, 107.1
Bright Living Ruby, https://wotlkdb.com/?spell=31089, 0.2, 2.8, 3, 107.1
Subtle Living Ruby, https://wotlkdb.com/?spell=31090, 0.2, 2.8, 3, 107.1
Flashing Living Ruby, https://wotlkdb.com/?spell=31091, 0.2, 2.8, 3, 107.1
Don Julio's Heart, https://wotlkdb.com/?spell=42558, 0.2, 2.8, 3, 107.1
Kailee's Rose, https://wotlkdb.com/?spell=42588, 0.2, 2.8, 3, 107.1
Crimson Sun, https://wotlkdb.com/?spell=42589, 0.2, 2.8, 3, 107.1
Purified Jaggal Pearl, https://wotlkdb.com/?spell=41420, 0.1463, 4.9042, 5.0505, 103
Enduring Deep Peridot, https://wotlkdb.com/?spell=28918, 0.13, 0.62, 0.75, 121
Sovereign Nightseye, https://wotlkdb.com/?spell=31102, 0.08, 2.92, 3, 102.7
Shifting Nightseye, https://wotlkdb.com/?spell=31103, 0.08, 2.92, 3, 102.7
Glowing Nightseye, https://wotlkdb.com/?spell=31104, 0.08, 2.92, 3, 102.7
Royal Nightseye, https://wotlkdb.com/?spell=31105, 0.08, 2.92, 3, 102.7
Regal Nightseye, https://wotlkdb.com/?spell=46803, 0.08, 2.92, 3, 102.7
Potent Flame Spessarite, https://wotlkdb.com/?spell=28915, 0.02, 1.98, 2, 101
Deft Huge Citrine, https://wotlkdb.com/?spell=53880, 0.01, 0.99, 1, 101
Bold Blood Garnet, https://wotlkdb.com/?spell=28905, -0.01, 0.95, 0.94, 98.9
Truesilver Healing Ring, https://wotlkdb.com/?spell=26885, -0.0198, 2.5198, 2.5, 99.2
Jagged Deep Peridot, https://wotlkdb.com/?spell=28917, -0.05, 0.62, 0.57, 91.9
Bright Blood Garnet, https://wotlkdb.com/?spell=34590, -0.06, 0.95, 0.89, 93.7
Rough Stone Statue, https://wotlkdb.com/?spell=32259, -0.0847, 0.0872, 0.0025, 2.9
Subtle Cardinal Ruby, https://wotlkdb.com/?spell=66452, -0.3, 210, 209.7, 99.9
Radiant Deep Peridot, https://wotlkdb.com/?spell=28916, -0.36, 0.62, 0.26, 41.9
Coarse Stone Statue, https://wotlkdb.com/?spell=32801, -0.3834, 0.3984, 0.015, 3.8
Sovereign Shadowsong Amethyst, https://wotlkdb.com/?spell=39727, -0.6666, 6.6666, 6, 90
Shifting Shadowsong Amethyst, https://wotlkdb.com/?spell=39728, -0.6666, 6.6666, 6, 90
Balanced Shadowsong Amethyst, https://wotlkdb.com/?spell=39729, -0.6666, 6.6666, 6, 90
Infused Shadowsong Amethyst, https://wotlkdb.com/?spell=39730, -0.6666, 6.6666, 6, 90
Glowing Shadowsong Amethyst, https://wotlkdb.com/?spell=39731, -0.6666, 6.6666, 6, 90
Royal Shadowsong Amethyst, https://wotlkdb.com/?spell=39732, -0.6666, 6.6666, 6, 90
Purified Shadowsong Amethyst, https://wotlkdb.com/?spell=48789, -0.6666, 6.6666, 6, 90
Solid Azure Moonstone, https://wotlkdb.com/?spell=28950, -0.67, 1.55, 0.88, 56.8
