Wicked Pyrestone, https://wotlkdb.com/?spell=39738, -1, 7, 6, 85.7
Reckless Pyrestone, https://wotlkdb.com/?spell=47055, -1, 7, 6, 85.7
Pendant of the Agate Shield, https://wotlkdb.com/?spell=25610, -1.01, 6.96, 5.95, 85.5
Bright Blood Garnet, https://wotlkdb.com/?spell=34590, -1.105, 1.48, 0.375, 25.3
Inscribed Flame Spessarite, https://wotlkdb.com/?spell=28910, -1.11, 1.98, 0.87, 43.9
Solid Azure Moonstone, https://wotlkdb.com/?spell=28950, -1.13, 1.98, 0.85, 42.9
Earthshadow Ring, https://wotlkdb.com/?spell=58143, -1.1795, 5.26, 4.0805, 77.6
Teardrop Blood Garnet, https://wotlkdb.com/?spell=28903, -1.23, 1.48, 0.25, 16.9
Delicate Blood Garnet, https://wotlkdb.com/?spell=28907, -1.23, 1.48, 0.25, 16.9
Glinting Flame Spessarite, https://wotlkdb.com/?spell=28914, -1.29, 1.98, 0.69, 34.8
Solid Stone Statue, https://wotlkdb.com/?spell=32808, -1.329, 1.429, 0.1, 7
Sparkling Azure Moonstone, https://wotlkdb.com/?spell=28953, -1.41, 1.98, 0.57, 28.8
Inlaid Malachite Ring, https://wotlkdb.com/?spell=25283, -1.4846, 3.53, 2.0454, 57.9
Stormy Azure Moonstone, https://wotlkdb.com/?spell=28955, -1.55, 1.98, 0.43, 21.7
Amulet of Truesight, https://wotlkdb.com/?spell=63743, -1.5504, 5.5504, 4, 72.1
Forceful Seaspray Emerald, https://wotlkdb.com/?spell=47053, -1.7, 4.7, 3, 63.8
Steady Seaspray Emerald, https://wotlkdb.com/?spell=47054, -1.7, 4.7, 3, 63.8
Sovereign Shadowsong Amethyst, https://wotlkdb.com/?spell=39727, -1.725, 7.725, 6, 77.7
Shifting Shadowsong Amethyst, https://wotlkdb.com/?spell=39728, -1.725, 7.725, 6, 77.7
Balanced Shadowsong Amethyst, https://wotlkdb.com/?spell=39729, -1.725, 7.725, 6, 77.7
Infused Shadowsong Amethyst, https://wotlkdb.com/?spell=39730, -1.725, 7.725, 6, 77.7
Glowing Shadowsong Amethyst, https://wotlkdb.com/?spell=39731, -1.725, 7.725, 6, 77.7
Royal Shadowsong Amethyst, https://wotlkdb.com/?spell=39732, -1.725, 7.725, 6, 77.7
Purified Shadowsong Amethyst, https://wotlkdb.com/?spell=48789, -1.725, 7.725, 6, 77.7
Luminous Flame Spessarite, https://wotlkdb.com/?spell=28912, -1.73, 1.98, 0.25, 12.6
Lustrous Azure Moonstone, https://wotlkdb.com/?spell=28957, -1.73, 1.98, 0.25, 12.6
Radiant Dark Jade, https://wotlkdb.com/?spell=53931, -2, 5, 3, 60
Delicate Crimson Spinel, https://wotlkdb.com/?spell=39706, -2.05, 8.05, 6, 74.5
Teardrop Crimson Spinel, https://wotlkdb.com/?spell=39710, -2.05, 8.05, 6, 74.5
Runed Crimson Spinel, https://wotlkdb.com/?spell=39711, -2.05, 8.05, 6, 74.5
Subtle Crimson Spinel, https://wotlkdb.com/?spell=39713, -2.05, 8.05, 6, 74.5
Flashing Crimson Spinel, https://wotlkdb.com/?spell=39714, -2.05, 8.05, 6, 74.5
Ring of Silver Might, https://wotlkdb.com/?spell=25317, -2.082, 3.3334, 1.2514, 37.5
Jagged Dark Jade, https://wotlkdb.com/?spell=53916, -2.2, 5, 2.8, 56
Truesilver Healing Ring, https://wotlkdb.com/?spell=26885, -2.3676, 3.5276, 1.16, 32.9
Primal Stone Statue, https://wotlkdb.com/?spell=32810, -2.58, 2.98, 0.4, 13.4
Tigerseye Band, https://wotlkdb.com/?spell=32179, -2.73, 5.73, 3, 52.4
Malachite Pendant, https://wotlkdb.com/?spell=32178, -2.77, 5.77, 3, 52
Sparkling Sky Sapphire, https://wotlkdb.com/?spell=53953, -2.96, 7.95, 4.99, 62.8
Ring of Twilight Shadows, https://wotlkdb.com/?spell=25318, -2.98, 4.96, 1.98, 39.9
Vivid Dark Jade, https://wotlkdb.com/?spell=53917, -3, 5, 2, 40
Energized Dark Jade, https://wotlkdb.com/?spell=53930, -3, 5, 2, 40
Solid Bronze Ring, https://wotlkdb.com/?spell=25490, -3.01, 4, 0.99, 24.8
Enduring Dark Jade, https://wotlkdb.com/?spell=53918, -3.1, 5, 1.9, 38
Intricate Dark Jade, https://wotlkdb.com/?spell=53925, -3.2, 5, 1.8, 36
Golden Draenite Ring, https://wotlkdb.com/?spell=31049, -3.9, 23.9, 20, 83.7
Purified Jaggal Pearl, https://wotlkdb.com/?spell=41420, -3.9832, 9.0337, 5.0505, 55.9
Misty Dark Jade, https://wotlkdb.com/?spell=53922, -4, 5, 1, 20
Sundered Dark Jade, https://wotlkdb.com/?spell=53927, -4.01, 5, 0.99, 19.8
Timeless Dark Jade, https://wotlkdb.com/?spell=53894, -4.025, 5, 0.975, 19.5
Dazzling Dark Jade, https://wotlkdb.com/?spell=53926, -4.25, 5, 0.75, 15
Simple Pearl Ring, https://wotlkdb.com/?spell=25284, -4.45, 7.43, 2.98, 40.1
Ornate Tigerseye Necklace, https://wotlkdb.com/?spell=26928, -4.47, 8.43, 3.96, 47
Turbid Dark Jade, https://wotlkdb.com/?spell=53924, -4.5, 5, 0.5, 10
Tense Dark Jade, https://wotlkdb.com/?spell=53932, -4.5, 5, 0.5, 10
Figurine - Golden Hare, https://wotlkdb.com/?spell=26873, -4.932, 5.082, 0.15, 3
Amulet of the Moon, https://wotlkdb.com/?spell=25339, -4.9465, 5.1, 0.1535, 3
Heavy Silver Ring, https://wotlkdb.com/?spell=25305, -6.3534, 10.3434, 3.99, 38.6
Aquamarine Signet, https://wotlkdb.com/?spell=26874, -6.6501, 9.65, 2.9999, 31.1
Heavy Stone Statue, https://wotlkdb.com/?spell=32807, -6.82, 6.88, 0.06, 0.9
Glimmering Monarch Topaz, https://wotlkdb.com/?spell=53993, -7.15, 62.15, 55, 88.5
Citrine Ring of Rapid Healing, https://wotlkdb.com/?spell=25621, -7.891, 9.131, 1.24, 13.6
The Aquamarine Ward, https://wotlkdb.com/?spell=26887, -7.9, 12.9, 5, 38.8
Lustrous Majestic Zircon, https://wotlkdb.com/?spell=66500, -8.75, 149.75, 141, 94.2
Gleaming Golden Draenite, https://wotlkdb.com/?spell=28944, -8.9, 9.95, 1.05, 10.6
Smooth Golden Draenite, https://wotlkdb.com/?spell=34069, -8.96, 9.95, 0.99, 9.9
Braided Copper Ring, https://wotlkdb.com/?spell=25493, -8.96, 9.96, 1, 10
Rigid Golden Draenite, https://wotlkdb.com/?spell=28948, -9.16, 9.95, 0.79, 7.9
Heavy Jade Ring, https://wotlkdb.com/?spell=36524, -9.2, 10.2, 1, 9.8
Brilliant Golden Draenite, https://wotlkdb.com/?spell=28938, -9.4, 9.95, 0.55, 5.5
Thick Golden Draenite, https://wotlkdb.com/?spell=28947, -9.575, 9.95, 0.375, 3.8
Jade Ring of Slaying, https://wotlkdb.com/?spell=58144, -9.64, 14.64, 5, 34.2
Mysterious Dreadstone, https://wotlkdb.com/?spell=66562, -9.81, 99.8, 89.99, 90.2
Woven Copper Ring, https://wotlkdb.com/?spell=26925, -9.935, 10.935, 1, 9.1
Solid Chalcedony, https://wotlkdb.com/?spell=53934, -10, 15, 5, 33.3
Shadowmight Ring, https://wotlkdb.com/?spell=58146, -10.6375, 30.04, 19.4025, 64.6
Stormy Majestic Zircon, https://wotlkdb.com/?spell=66499, -10.7501, 149.75, 138.9999, 92.8
Blazing Citrine Ring, https://wotlkdb.com/?spell=25617, -11.131, 21.1309, 9.9999, 47.3
Inscribed Monarch Topaz, https://wotlkdb.com/?spell=53975, -12.25, 62.15, 49.9, 80.3
Golden Dragon Ring, https://wotlkdb.com/?spell=25613, -12.4, 14.9, 2.5, 16.8
Lustrous Chalcedony, https://wotlkdb.com/?spell=53941, -12.52, 15, 2.48, 16.5
Heavy Copper Ring, https://wotlkdb.com/?spell=26926, -12.86, 13.86, 1, 7.2
Scarlet Signet, https://wotlkdb.com/?spell=64728, -13.265, 223.015, 209.75, 94.1
Sparkling Chalcedony, https://wotlkdb.com/?spell=53940, -14, 15, 1, 6.7
Gloom Band, https://wotlkdb.com/?spell=25287, -15.0145, 17.92, 2.9055, 16.2
Subtle Cardinal Ruby, https://wotlkdb.com/?spell=66452, -15.135, 220, 204.865, 93.1
Precise Scarlet Ruby, https://wotlkdb.com/?spell=53951, -17.215, 117.215, 100, 85.3
Deft Monarch Topaz, https://wotlkdb.com/?spell=53982, -17.25, 62.15, 44.9, 72.2
Silver Rose Pendant, https://wotlkdb.com/?spell=25614, -19.0157, 19.2934, 0.2777, 1.4
Durable Monarch Topaz, https://wotlkdb.com/?spell=53986, -22.15, 62.15, 40, 64.4
Figurine - Truesilver Crab, https://wotlkdb.com/?spell=26881, -22.6852, 22.8352, 0.15, 0.7
Fierce Monarch Topaz, https://wotlkdb.com/?spell=54019, -27.15, 62.15, 35, 56.3
Red Ring of Destruction, https://wotlkdb.com/?spell=36525, -27.95, 33.95, 6, 17.7
Champion's Monarch Topaz, https://wotlkdb.com/?spell=53977, -29.25, 62.15, 32.9, 52.9
Onslaught Ring, https://wotlkdb.com/?spell=26907, -29.9499, 37.9499, 8, 21.1
Sapphire Pendant of Winter Night, https://wotlkdb.com/?spell=26908, -30.36, 35.32, 4.96, 14
Stalwart Monarch Topaz, https://wotlkdb.com/?spell=53992, -31.25, 62.15, 30.9, 49.7
Simple Opal Ring, https://wotlkdb.com/?spell=26902, -31.61, 33.05, 1.44, 4.4
Ruby Pendant of Fire, https://wotlkdb.com/?spell=26883, -31.9973, 33.95, 1.9527, 5.8
Etched Monarch Topaz, https://wotlkdb.com/?spell=53976, -32.15, 62.15, 30, 48.3
Flashing Cardinal Ruby, https://wotlkdb.com/?spell=66453, -35, 220, 185, 84.1
Smooth Autumn's Glow, https://wotlkdb.com/?spell=53957, -38, 98, 60, 61.2
Engraved Truesilver Ring, https://wotlkdb.com/?spell=25620, -38.6936, 40.6936, 2, 4.9
Jade Pendant of Blasting, https://wotlkdb.com/?spell=25618, -43.6516, 43.9998, 0.3482, 0.8
Brilliant Autumn's Glow, https://wotlkdb.com/?spell=53956, -48, 98, 50, 51
Bracing Earthsiege Diamond, https://wotlkdb.com/?spell=55397, -48, 118, 70, 59.3
Pristine Monarch Topaz, https://wotlkdb.com/?spell=53989, -49.15, 62.15, 13, 20.9
Figurine - Ruby Serpent, https://wotlkdb.com/?spell=26900, -49.4952, 49.6452, 0.15, 0.3
Figurine - Truesilver Boar, https://wotlkdb.com/?spell=26882, -54.1842, 54.3342, 0.15, 0.3
Destructive Skyflare Diamond, https://wotlkdb.com/?spell=55390, -58.525, 79, 20.475, 25.9
Aquamarine Pendant of the Warrior, https://wotlkdb.com/?spell=26876, -60.4497, 61.9497, 1.5, 2.4
Figurine - Crimson Serpent, https://wotlkdb.com/?spell=46777, -64.24, 65.74, 1.5, 2.3
Tireless Skyflare Diamond, https://wotlkdb.com/?spell=55386, -69, 79, 10, 12.7
Diamond Focus Ring, https://wotlkdb.com/?spell=36526, -70.35, 72.85, 2.5, 3.4
Swift Skyflare Diamond, https://wotlkdb.com/?spell=55394, -72, 79, 7, 8.9
Bright Scarlet Ruby, https://wotlkdb.com/?spell=53947, -72.09, 117.215, 45.125, 38.5
Brilliant Pearl Band, https://wotlkdb.com/?spell=41414, -73.05, 83, 9.95, 12
Figurine - Black Pearl Panther, https://wotlkdb.com/?spell=26875, -83.65, 83.8, 0.15, 0.2
Bold Dragon's Eye, https://wotlkdb.com/?spell=56049, -98.875, 100, 1.125, 1.1
Delicate Dragon's Eye, https://wotlkdb.com/?spell=56052, -98.875, 100, 1.125, 1.1
Runed Dragon's Eye, https://wotlkdb.com/?spell=56053, -98.875, 100, 1.125, 1.1
Bright Dragon's Eye, https://wotlkdb.com/?spell=56054, -98.875, 100, 1.125, 1.1
Subtle Dragon's Eye, https://wotlkdb.com/?spell=56055, -98.875, 100, 1.125, 1.1
Flashing Dragon's Eye, https://wotlkdb.com/?spell=56056, -98.875, 100, 1.125, 1.1
Brilliant Dragon's Eye, https://wotlkdb.com/?spell=56074, -98.875, 100, 1.125, 1.1
Fractured Dragon's Eye, https://wotlkdb.com/?spell=56076, -98.875, 100, 1.125, 1.1
Lustrous Dragon's Eye, https://wotlkdb.com/?spell=56077, -98.875, 100, 1.125, 1.1
Mystic Dragon's Eye, https://wotlkdb.com/?spell=56079, -98.875, 100, 1.125, 1.1
Precise Dragon's Eye, https://wotlkdb.com/?spell=56081, -98.875, 100, 1.125, 1.1
Quick Dragon's Eye, https://wotlkdb.com/?spell=56083, -98.875, 100, 1.125, 1.1
Rigid Dragon's Eye, https://wotlkdb.com/?spell=56084, -98.875, 100, 1.125, 1.1
Smooth Dragon's Eye, https://wotlkdb.com/?spell=56085, -98.875, 100, 1.125, 1.1
Solid Dragon's Eye, https://wotlkdb.com/?spell=56086, -98.875, 100, 1.125, 1.1
Sparkling Dragon's Eye, https://wotlkdb.com/?spell=56087, -98.875, 100, 1.125, 1.1
Stormy Dragon's Eye, https://wotlkdb.com/?spell=56088, -98.875, 100, 1.125, 1.1
Thick Dragon's Eye, https://wotlkdb.com/?spell=56089, -98.875, 100, 1.125, 1.1
Persistent Earthsiege Diamond, https://wotlkdb.com/?spell=55402, -100, 118, 18, 15.3
Powerful Earthsiege Diamond, https://wotlkdb.com/?spell=55399, -100.05, 118, 17.95, 15.2
Figurine - Living Ruby Serpent, https://wotlkdb.com/?spell=31081, -100.74, 102.24, 1.5, 1.5
Figurine - Jade Owl, https://wotlkdb.com/?spell=26872, -101.2372, 101.3872, 0.15, 0.1
Sapphire Owl, https://wotlkdb.com/?spell=56202, -116.6393, 124.69, 8.0507, 6.5
Glowing Thorium Band, https://wotlkdb.com/?spell=34960, -129.6995, 134.75, 5.0505, 3.7
Thick Adamantite Necklace, https://wotlkdb.com/?spell=31051, -140.1, 170, 29.9, 17.6
Bracing Earthstorm Diamond, https://wotlkdb.com/?spell=32867, -147.75, 150.75, 3, 2
Tenacious Earthstorm Diamond, https://wotlkdb.com/?spell=32868, -147.75, 150.75, 3, 2
Insightful Earthstorm Diamond, https://wotlkdb.com/?spell=32870, -147.75, 150.75, 3, 2
Relentless Earthstorm Diamond, https://wotlkdb.com/?spell=39961, -147.75, 150.75, 3, 2
Eternal Earthstorm Diamond, https://wotlkdb.com/?spell=46597, -147.75, 150.75, 3, 2
Heavy Adamantite Ring, https://wotlkdb.com/?spell=31052, -150, 165, 15, 9.1
Figurine - Talasite Owl, https://wotlkdb.com/?spell=31082, -151.94, 153.44, 1.5, 1
Emerald Lion Ring, https://wotlkdb.com/?spell=34961, -170.95, 180.95, 10, 5.5
Twilight Serpent, https://wotlkdb.com/?spell=56201, -173.8993, 181.95, 8.0507, 4.4
Figurine - Shadowsong Panther, https://wotlkdb.com/?spell=46778, -177.39, 178.89, 1.5, 0.8
Living Emerald Pendant, https://wotlkdb.com/?spell=26911, -198.6297, 199.88, 1.2503, 0.6
Enigmatic Skyfire Diamond, https://wotlkdb.com/?spell=32874, -199, 499, 300, 60.1
Emerald Boar, https://wotlkdb.com/?spell=56203, -220.9443, 228.995, 8.0507, 3.5
Monarch Crab, https://wotlkdb.com/?spell=59759, -225.0393, 233.09, 8.0507, 3.5
Figurine - Nightseye Panther, https://wotlkdb.com/?spell=31083, -243.671, 245.171, 1.5, 0.6
Figurine - Dark Iron Scorpid, https://wotlkdb.com/?spell=26914, -255.7, 257.2, 1.5, 0.6
Ring of Arcane Shielding, https://wotlkdb.com/?spell=37855, -284.4963, 288.2, 3.7037, 1.3
Pendant of Withering, https://wotlkdb.com/?spell=31064, -289.033, 292.98, 3.947, 1.3
Pendant of Shadow's End, https://wotlkdb.com/?spell=31065, -305.873, 309.82, 3.947, 1.3
Necklace of the Diamond Tower, https://wotlkdb.com/?spell=26915, -322.9782, 325.5, 2.5218, 0.8
Figurine - Seaspray Albatross, https://wotlkdb.com/?spell=46779, -329.1, 330.6, 1.5, 0.5
Braided Eternium Chain, https://wotlkdb.com/?spell=31070, -368, 491, 123, 25.1
Figurine - Emerald Owl, https://wotlkdb.com/?spell=26909, -383.425, 383.8, 0.375, 0.1
Pendant of Thawing, https://wotlkdb.com/?spell=31063, -386.583, 390.53, 3.947, 1
Figurine - Felsteel Boar, https://wotlkdb.com/?spell=31079, -387.68, 388.88, 1.2, 0.3
Ruby Hare, https://wotlkdb.com/?spell=56199, -430.1793, 438.23, 8.0507, 1.8
Figurine - Black Diamond Crab, https://wotlkdb.com/?spell=26912, -434.82, 436.32, 1.5, 0.3
Pendant of Frozen Flame, https://wotlkdb.com/?spell=31062, -451.573, 455.52, 3.947, 0.9
Destructive Skyfire Diamond, https://wotlkdb.com/?spell=32871, -496, 499, 3, 0.6
Mystical Skyfire Diamond, https://wotlkdb.com/?spell=32872, -496, 499, 3, 0.6
Swift Skyfire Diamond, https://wotlkdb.com/?spell=32873, -496, 499, 3, 0.6
Thundering Skyfire Diamond, https://wotlkdb.com/?spell=39963, -496, 499, 3, 0.6
Chaotic Skyfire Diamond, https://wotlkdb.com/?spell=44794, -496, 499, 3, 0.6
Ember Skyfire Diamond, https://wotlkdb.com/?spell=46601, -496, 499, 3, 0.6
The Black Pearl, https://wotlkdb.com/?spell=41415, -519.36, 640.36, 121, 18.9
Pendant of the Null Rune, https://wotlkdb.com/?spell=31066, -526.753, 530.7, 3.947, 0.7
Arcanite Sword Pendant, https://wotlkdb.com/?spell=26918, -537.2082, 539.7996, 2.5914, 0.5
Thick Felsteel Necklace, https://wotlkdb.com/?spell=31067, -569.5878, 573.5, 3.9122, 0.7
Blazing Eternium Band, https://wotlkdb.com/?spell=31061, -649.8382, 653.82, 3.9818, 0.6
Figurine - Dawnstone Crab, https://wotlkdb.com/?spell=31080, -661.3, 662.8, 1.5, 0.2
Embrace of the Dawn, https://wotlkdb.com/?spell=31072, -666.9182, 670.9, 3.9818, 0.6
Heavy Felsteel Ring, https://wotlkdb.com/?spell=31058, -729.7963, 733.5, 3.7037, 0.5
Living Ruby Pendant, https://wotlkdb.com/?spell=31068, -746.96, 781.96, 35, 4.5
Khorium Band of Shadows, https://wotlkdb.com/?spell=31053, -787.3625, 791.24, 3.8775, 0.5
Delicate Eternium Ring, https://wotlkdb.com/?spell=31060, -801.5878, 805.5, 3.9122, 0.5
Khorium Inferno Band, https://wotlkdb.com/?spell=31055, -947.7028, 951.615, 3.9122, 0.4
Khorium Band of Leaves, https://wotlkdb.com/?spell=31056, -972.553, 976.5, 3.947, 0.4
Amulet of Flowing Life, https://wotlkdb.com/?spell=46126, -979.3645, 988.2, 8.8355, 0.9
Khorium Band of Frost, https://wotlkdb.com/?spell=31054, -1045.1878, 1049.1, 3.9122, 0.4
Arcane Khorium Band, https://wotlkdb.com/?spell=31057, -1049.4682, 1053.45, 3.9818, 0.4
Hard Khorium Band, https://wotlkdb.com/?spell=46124, -1154.998, 5154.998, 4000, 77.6
Figurine - Empyrean Tortoise, https://wotlkdb.com/?spell=46775, -1262, 1263.5, 1.5, 0.1
Figurine - Khorium Boar, https://wotlkdb.com/?spell=46776, -1274.64, 1275.84, 1.2, 0.1
Pendant of Sunfire, https://wotlkdb.com/?spell=46125, -1955.5645, 1964.4, 8.8355, 0.4
Crown of the Sea Witch, https://wotlkdb.com/?spell=41418, -2675.4043, 2678.08, 2.6757, 0.1
Hard Khorium Choker, https://wotlkdb.com/?spell=46127, -3301.9645, 3310.8, 8.8355, 0.3
Ring of Flowing Life, https://wotlkdb.com/?spell=46123, -4328.9744, 4335, 6.0256, 0.1
Loop of Forged Power, https://wotlkdb.com/?spell=46122, -4727.9744, 4734, 6.0256, 0.1
