Solid Stone Statue, https://wotlkdb.com/?spell=32808, -0.9, 1, 0.1, 10
Lustrous Azure Moonstone, https://wotlkdb.com/?spell=28957, -1, 1.25, 0.25, 20
Inscribed Flame Spessarite, https://wotlkdb.com/?spell=28910, -1.04, 1.44, 0.4, 27.8
Glinting Flame Spessarite, https://wotlkdb.com/?spell=28914, -1.081, 1.44, 0.359, 24.9
Pendant of the Agate Shield, https://wotlkdb.com/?spell=25610, -1.26, 5.16, 3.9, 75.6
Glowing Shadow Draenite, https://wotlkdb.com/?spell=28925, -1.2767, 1.6667, 0.39, 23.4
Earthshadow Ring, https://wotlkdb.com/?spell=58143, -1.2795, 5.36, 4.0805, 76.1
Sovereign Shadow Draenite, https://wotlkdb.com/?spell=28936, -1.3167, 1.6667, 0.35, 21
Royal Shadow Draenite, https://wotlkdb.com/?spell=28927, -1.4035, 1.6667, 0.2632, 15.8
Infused Shadow Draenite, https://wotlkdb.com/?spell=39458, -1.4167, 1.6667, 0.25, 15
Tenuous Twilight Opal, https://wotlkdb.com/?spell=53964, -1.6288, 8.6288, 7, 81.1
Stormy Majestic Zircon, https://wotlkdb.com/?spell=66499, -1.63, 142.5, 140.87, 98.9
Brilliant Lionseye, https://wotlkdb.com/?spell=39719, -1.7, 7.7, 6, 77.9
Smooth Lionseye, https://wotlkdb.com/?spell=39720, -1.7, 7.7, 6, 77.9
Rigid Lionseye, https://wotlkdb.com/?spell=39721, -1.7, 7.7, 6, 77.9
Gleaming Lionseye, https://wotlkdb.com/?spell=39722, -1.7, 7.7, 6, 77.9
Thick Lionseye, https://wotlkdb.com/?spell=39723, -1.7, 7.7, 6, 77.9
Mystic Lionseye, https://wotlkdb.com/?spell=39724, -1.7, 7.7, 6, 77.9
Great Lionseye, https://wotlkdb.com/?spell=39725, -1.7, 7.7, 6, 77.9
Quick Lionseye, https://wotlkdb.com/?spell=47056, -1.7, 7.7, 6, 77.9
Mysterious Twilight Opal, https://wotlkdb.com/?spell=53968, -1.7288, 8.6288, 6.9, 80
The Aquamarine Ward, https://wotlkdb.com/?spell=26887, -1.841, 11.8, 9.959, 84.4
Purified Jaggal Pearl, https://wotlkdb.com/?spell=41420, -1.8508, 6.8508, 5, 73
Deft Ametrine, https://wotlkdb.com/?spell=66584, -1.995, 200, 198.005, 99
Malachite Pendant, https://wotlkdb.com/?spell=32178, -2, 5, 3, 60
Forceful Seaspray Emerald, https://wotlkdb.com/?spell=47053, -2, 5, 3, 60
Steady Seaspray Emerald, https://wotlkdb.com/?spell=47054, -2, 5, 3, 60
Enduring Dark Jade, https://wotlkdb.com/?spell=53918, -2.0001, 7, 4.9999, 71.4
Enchanted Pearl, https://wotlkdb.com/?spell=56530, -2.06, 2.96, 0.9, 30.4
Ring of Twilight Shadows, https://wotlkdb.com/?spell=25318, -2.2, 3.99, 1.79, 44.9
Shadow Jade Focusing Lens, https://wotlkdb.com/?spell=56208, -2.68, 7.68, 5, 65.1
Delicate Crimson Spinel, https://wotlkdb.com/?spell=39706, -2.95, 8.95, 6, 67
Runed Crimson Spinel, https://wotlkdb.com/?spell=39711, -2.95, 8.95, 6, 67
Subtle Crimson Spinel, https://wotlkdb.com/?spell=39713, -2.95, 8.95, 6, 67
Flashing Crimson Spinel, https://wotlkdb.com/?spell=39714, -2.95, 8.95, 6, 67
Inlaid Malachite Ring, https://wotlkdb.com/?spell=25283, -3, 4, 1, 25
Shining Dark Jade, https://wotlkdb.com/?spell=53923, -3, 7, 4, 57.1
Energized Dark Jade, https://wotlkdb.com/?spell=53930, -3, 7, 4, 57.1
Dark Jade Focusing Lens, https://wotlkdb.com/?spell=56205, -3.02, 7, 3.98, 56.9
Simple Pearl Ring, https://wotlkdb.com/?spell=25284, -3.1401, 7.14, 3.9999, 56
Solid Bronze Ring, https://wotlkdb.com/?spell=25490, -3.2, 4.06, 0.86, 21.2
Tigerseye Band, https://wotlkdb.com/?spell=32179, -3.5055, 5.96, 2.4545, 41.2
Truesilver Healing Ring, https://wotlkdb.com/?spell=26885, -3.76, 5.24, 1.48, 28.2
Balanced Twilight Opal, https://wotlkdb.com/?spell=53969, -3.8919, 8.6288, 4.7369, 54.9
Radiant Dark Jade, https://wotlkdb.com/?spell=53931, -4, 7, 3, 42.9
Amulet of the Moon, https://wotlkdb.com/?spell=25339, -4.1053, 4.2588, 0.1535, 3.6
Tense Eye of Zul, https://wotlkdb.com/?spell=66438, -4.2, 79, 74.8, 94.7
Radiant Eye of Zul, https://wotlkdb.com/?spell=66441, -4.2, 79, 74.8, 94.7
Heavy Silver Ring, https://wotlkdb.com/?spell=25305, -4.2094, 19.2094, 15, 78.1
Primal Stone Statue, https://wotlkdb.com/?spell=32810, -4.6, 5, 0.4, 8
Elegant Silver Ring, https://wotlkdb.com/?spell=25280, -5, 7, 2, 28.6
Jagged Dark Jade, https://wotlkdb.com/?spell=53916, -5, 7, 2, 28.6
Vivid Dark Jade, https://wotlkdb.com/?spell=53917, -5, 7, 2, 28.6
Forceful Dark Jade, https://wotlkdb.com/?spell=53920, -5, 7, 2, 28.6
Sundered Dark Jade, https://wotlkdb.com/?spell=53927, -5, 7, 2, 28.6
Lambent Dark Jade, https://wotlkdb.com/?spell=53928, -5.02, 7, 1.98, 28.3
Misty Dark Jade, https://wotlkdb.com/?spell=53922, -5.5, 7, 1.5, 21.4
Defender's Dreadstone, https://wotlkdb.com/?spell=66560, -5.75, 129.75, 124, 95.6
Timeless Dark Jade, https://wotlkdb.com/?spell=53894, -6, 7, 1, 14.3
Intricate Dark Jade, https://wotlkdb.com/?spell=53925, -6.01, 7, 0.99, 14.1
Dazzling Dark Jade, https://wotlkdb.com/?spell=53926, -6.11, 7, 0.89, 12.7
Bracing Earthsiege Diamond, https://wotlkdb.com/?spell=55397, -6.2, 105, 98.8, 94.1
Turbid Dark Jade, https://wotlkdb.com/?spell=53924, -6.5, 7, 0.5, 7.1
Tense Dark Jade, https://wotlkdb.com/?spell=53932, -6.5, 7, 0.5, 7.1
Braided Copper Ring, https://wotlkdb.com/?spell=25493, -7, 8, 1, 12.5
Ornate Tigerseye Necklace, https://wotlkdb.com/?spell=26928, -7.92, 9.92, 2, 20.2
Woven Copper Ring, https://wotlkdb.com/?spell=26925, -8.0001, 9, 0.9999, 11.1
Aquamarine Signet, https://wotlkdb.com/?spell=26874, -8.0096, 13.9996, 5.99, 42.8
Golden Draenite Ring, https://wotlkdb.com/?spell=31049, -8.1, 27, 18.9, 70
Sparkling Sky Sapphire, https://wotlkdb.com/?spell=53953, -8.2, 12.7, 4.5, 35.4
Brilliant Golden Draenite, https://wotlkdb.com/?spell=28938, -8.96, 10, 1.04, 10.4
Smooth Golden Draenite, https://wotlkdb.com/?spell=34069, -9.2, 10, 0.8, 8
Figurine - Golden Hare, https://wotlkdb.com/?spell=26873, -9.33, 9.48, 0.15, 1.6
Gleaming Golden Draenite, https://wotlkdb.com/?spell=28944, -9.5, 10, 0.5, 5
Thick Golden Draenite, https://wotlkdb.com/?spell=28947, -9.56, 10, 0.44, 4.4
Rigid Golden Draenite, https://wotlkdb.com/?spell=28948, -9.6, 10, 0.4, 4
Crystal Chalcedony Amulet, https://wotlkdb.com/?spell=58142, -9.6264, 19.6264, 10, 51
Moonsoul Crown, https://wotlkdb.com/?spell=25321, -9.7682, 34.7682, 25, 71.9
Heavy Copper Ring, https://wotlkdb.com/?spell=26926, -11, 12, 1, 8.3
Destructive Skyflare Diamond, https://wotlkdb.com/?spell=55390, -11, 70, 59, 84.3
Wicked Monarch Topaz, https://wotlkdb.com/?spell=53988, -11.417, 86.317, 74.9, 86.8
Heavy Stone Statue, https://wotlkdb.com/?spell=32807, -11.94, 12, 0.06, 0.5
Gloom Band, https://wotlkdb.com/?spell=25287, -12.62, 14.12, 1.5, 10.6
Solid Chalcedony, https://wotlkdb.com/?spell=53934, -12.75, 19.5, 6.75, 34.6
Ring of Silver Might, https://wotlkdb.com/?spell=25317, -12.8032, 14, 1.1968, 8.5
Jade Ring of Slaying, https://wotlkdb.com/?spell=58144, -13, 18, 5, 27.8
Citrine Ring of Rapid Healing, https://wotlkdb.com/?spell=25621, -14.4567, 15.79, 1.3333, 8.4
Heavy Jade Ring, https://wotlkdb.com/?spell=36524, -16.03, 17.03, 1, 5.9
Inscribed Monarch Topaz, https://wotlkdb.com/?spell=53975, -16.317, 86.317, 70, 81.1
Red Ring of Destruction, https://wotlkdb.com/?spell=36525, -16.875, 19.875, 3, 15.1
Sparkling Chalcedony, https://wotlkdb.com/?spell=53940, -17.15, 19.5, 2.35, 12.1
Lustrous Chalcedony, https://wotlkdb.com/?spell=53941, -17.5, 19.5, 2, 10.3
Shadowmight Ring, https://wotlkdb.com/?spell=58146, -17.9, 33.9, 16, 47.2
Sparkling Majestic Zircon, https://wotlkdb.com/?spell=66498, -18.25, 142.5, 124.25, 87.2
Golden Dragon Ring, https://wotlkdb.com/?spell=25613, -18.6, 19.85, 1.25, 6.3
Ruby Pendant of Fire, https://wotlkdb.com/?spell=26883, -18.875, 19.875, 1, 5
Thick Autumn's Glow, https://wotlkdb.com/?spell=53959, -18.95, 99, 80.05, 80.9
Onslaught Ring, https://wotlkdb.com/?spell=26907, -22.58, 27.58, 5, 18.1
Etched Monarch Topaz, https://wotlkdb.com/?spell=53976, -26.317, 86.317, 60, 69.5
Fierce Monarch Topaz, https://wotlkdb.com/?spell=54019, -26.317, 86.317, 60, 69.5
Figurine - Ruby Serpent, https://wotlkdb.com/?spell=26900, -26.322, 26.472, 0.15, 0.6
Figurine - Truesilver Crab, https://wotlkdb.com/?spell=26881, -26.7696, 26.9196, 0.15, 0.6
Sapphire Pendant of Winter Night, https://wotlkdb.com/?spell=26908, -27.25, 32.25, 5, 15.5
Engraved Truesilver Ring, https://wotlkdb.com/?spell=25620, -31.9801, 33.52, 1.5399, 4.6
Silver Rose Pendant, https://wotlkdb.com/?spell=25614, -32.9923, 33.27, 0.2777, 0.8
Brilliant Autumn's Glow, https://wotlkdb.com/?spell=53956, -38.1, 99, 60.9, 61.5
Mysterious Dreadstone, https://wotlkdb.com/?spell=66562, -39.8501, 129.75, 89.8999, 69.3
Jade Pendant of Blasting, https://wotlkdb.com/?spell=25618, -42.5018, 42.85, 0.3482, 0.8
Figurine - Truesilver Boar, https://wotlkdb.com/?spell=26882, -43.1794, 43.3294, 0.15, 0.3
Simple Opal Ring, https://wotlkdb.com/?spell=26902, -43.7999, 44.7999, 1, 2.2
Champion's Monarch Topaz, https://wotlkdb.com/?spell=53977, -46.3171, 86.317, 39.9999, 46.3
Brilliant Pearl Band, https://wotlkdb.com/?spell=41414, -47.96, 62.96, 15, 23.8
Aquamarine Pendant of the Warrior, https://wotlkdb.com/?spell=26876, -49.35, 51.35, 2, 3.9
Empowered Monarch Topaz, https://wotlkdb.com/?spell=53990, -56.317, 86.317, 30, 34.8
Deft Monarch Topaz, https://wotlkdb.com/?spell=53982, -56.417, 86.317, 29.9, 34.6
Swift Skyflare Diamond, https://wotlkdb.com/?spell=55394, -62, 70, 8, 11.4
Tireless Skyflare Diamond, https://wotlkdb.com/?spell=55386, -64, 70, 6, 8.6
Figurine - Crimson Serpent, https://wotlkdb.com/?spell=46777, -64.32, 65.82, 1.5, 2.3
Diamond Focus Ring, https://wotlkdb.com/?spell=36526, -68.2, 69.7, 1.5, 2.2
Bright Scarlet Ruby, https://wotlkdb.com/?spell=53947, -70, 120, 50, 41.7
Flashing Cardinal Ruby, https://wotlkdb.com/?spell=66453, -70.75, 269.75, 199, 73.8
Persistent Earthsiege Diamond, https://wotlkdb.com/?spell=55402, -71.1, 105, 33.9, 32.3
Powerful Earthsiege Diamond, https://wotlkdb.com/?spell=55399, -76, 105, 29, 27.6
Pristine Monarch Topaz, https://wotlkdb.com/?spell=53989, -80.317, 86.317, 6, 7
Figurine - Black Pearl Panther, https://wotlkdb.com/?spell=26875, -83.6496, 83.7996, 0.15, 0.2
Figurine - Jade Owl, https://wotlkdb.com/?spell=26872, -109.19, 109.34, 0.15, 0.1
Figurine - Living Ruby Serpent, https://wotlkdb.com/?spell=31081, -114.6306, 116.1306, 1.5, 1.3
Glowing Thorium Band, https://wotlkdb.com/?spell=34960, -119.6, 129.6, 10, 7.7
Bold Dragon's Eye, https://wotlkdb.com/?spell=56049, -136.875, 138, 1.125, 0.8
Delicate Dragon's Eye, https://wotlkdb.com/?spell=56052, -136.875, 138, 1.125, 0.8
Runed Dragon's Eye, https://wotlkdb.com/?spell=56053, -136.875, 138, 1.125, 0.8
Bright Dragon's Eye, https://wotlkdb.com/?spell=56054, -136.875, 138, 1.125, 0.8
Subtle Dragon's Eye, https://wotlkdb.com/?spell=56055, -136.875, 138, 1.125, 0.8
Flashing Dragon's Eye, https://wotlkdb.com/?spell=56056, -136.875, 138, 1.125, 0.8
Brilliant Dragon's Eye, https://wotlkdb.com/?spell=56074, -136.875, 138, 1.125, 0.8
Fractured Dragon's Eye, https://wotlkdb.com/?spell=56076, -136.875, 138, 1.125, 0.8
Lustrous Dragon's Eye, https://wotlkdb.com/?spell=56077, -136.875, 138, 1.125, 0.8
Mystic Dragon's Eye, https://wotlkdb.com/?spell=56079, -136.875, 138, 1.125, 0.8
Precise Dragon's Eye, https://wotlkdb.com/?spell=56081, -136.875, 138, 1.125, 0.8
Quick Dragon's Eye, https://wotlkdb.com/?spell=56083, -136.875, 138, 1.125, 0.8
Rigid Dragon's Eye, https://wotlkdb.com/?spell=56084, -136.875, 138, 1.125, 0.8
Smooth Dragon's Eye, https://wotlkdb.com/?spell=56085, -136.875, 138, 1.125, 0.8
Solid Dragon's Eye, https://wotlkdb.com/?spell=56086, -136.875, 138, 1.125, 0.8
Sparkling Dragon's Eye, https://wotlkdb.com/?spell=56087, -136.875, 138, 1.125, 0.8
Stormy Dragon's Eye, https://wotlkdb.com/?spell=56088, -136.875, 138, 1.125, 0.8
Thick Dragon's Eye, https://wotlkdb.com/?spell=56089, -136.875, 138, 1.125, 0.8
Emerald Lion Ring, https://wotlkdb.com/?spell=34961, -139.85, 149.8, 9.95, 6.6
Sapphire Owl, https://wotlkdb.com/?spell=56202, -140.3493, 148.4, 8.0507, 5.4
Bracing Earthstorm Diamond, https://wotlkdb.com/?spell=32867, -147, 150, 3, 2
Tenacious Earthstorm Diamond, https://wotlkdb.com/?spell=32868, -147, 150, 3, 2
Insightful Earthstorm Diamond, https://wotlkdb.com/?spell=32870, -147, 150, 3, 2
Relentless Earthstorm Diamond, https://wotlkdb.com/?spell=39961, -147, 150, 3, 2
Eternal Earthstorm Diamond, https://wotlkdb.com/?spell=46597, -147, 150, 3, 2
Living Emerald Pendant, https://wotlkdb.com/?spell=26911, -155.8637, 157.114, 1.2503, 0.8
Thick Adamantite Necklace, https://wotlkdb.com/?spell=31051, -159.75, 189.75, 30, 15.8
Heavy Adamantite Ring, https://wotlkdb.com/?spell=31052, -162.35, 184.75, 22.4, 12.1
Figurine - Talasite Owl, https://wotlkdb.com/?spell=31082, -166.3792, 167.8792, 1.5, 0.9
Enigmatic Skyfire Diamond, https://wotlkdb.com/?spell=32874, -199, 499, 300, 60.1
Twilight Serpent, https://wotlkdb.com/?spell=56201, -213.5239, 221.5746, 8.0507, 3.6
Figurine - Shadowsong Panther, https://wotlkdb.com/?spell=46778, -235.9, 237.4, 1.5, 0.6
Emerald Boar, https://wotlkdb.com/?spell=56203, -239.9493, 248, 8.0507, 3.2
Figurine - Dark Iron Scorpid, https://wotlkdb.com/?spell=26914, -246.05, 247.55, 1.5, 0.6
Monarch Crab, https://wotlkdb.com/?spell=59759, -287.5833, 295.634, 8.0507, 2.7
Ring of Arcane Shielding, https://wotlkdb.com/?spell=37855, -309.4947, 313.1984, 3.7037, 1.2
Pendant of Withering, https://wotlkdb.com/?spell=31064, -316.6536, 320.6006, 3.947, 1.2
Necklace of the Diamond Tower, https://wotlkdb.com/?spell=26915, -328.4782, 331, 2.5218, 0.8
Pendant of Shadow's End, https://wotlkdb.com/?spell=31065, -331.7736, 335.7206, 3.947, 1.2
Figurine - Nightseye Panther, https://wotlkdb.com/?spell=31083, -342.98, 344.48, 1.5, 0.4
Figurine - Seaspray Albatross, https://wotlkdb.com/?spell=46779, -351.6984, 353.1984, 1.5, 0.4
Figurine - Emerald Owl, https://wotlkdb.com/?spell=26909, -361.545, 361.92, 0.375, 0.1
The Black Pearl, https://wotlkdb.com/?spell=41415, -384.98, 719.98, 335, 46.5
Heavy Felsteel Ring, https://wotlkdb.com/?spell=31058, -426.2106, 825.2106, 399, 48.4
Braided Eternium Chain, https://wotlkdb.com/?spell=31070, -426.25, 549.25, 123, 22.4
Figurine - Felsteel Boar, https://wotlkdb.com/?spell=31079, -445.6424, 446.8424, 1.2, 0.3
Ruby Hare, https://wotlkdb.com/?spell=56199, -448.9493, 457, 8.0507, 1.8
Pendant of Thawing, https://wotlkdb.com/?spell=31063, -482.5636, 486.5106, 3.947, 0.8
Destructive Skyfire Diamond, https://wotlkdb.com/?spell=32871, -496, 499, 3, 0.6
Swift Skyfire Diamond, https://wotlkdb.com/?spell=32873, -496, 499, 3, 0.6
Thundering Skyfire Diamond, https://wotlkdb.com/?spell=39963, -496, 499, 3, 0.6
Chaotic Skyfire Diamond, https://wotlkdb.com/?spell=44794, -496, 499, 3, 0.6
Ember Skyfire Diamond, https://wotlkdb.com/?spell=46601, -496, 499, 3, 0.6
Figurine - Black Diamond Crab, https://wotlkdb.com/?spell=26912, -529.9572, 531.4572, 1.5, 0.3
Arcanite Sword Pendant, https://wotlkdb.com/?spell=26918, -534.2086, 536.8, 2.5914, 0.5
Pendant of Frozen Flame, https://wotlkdb.com/?spell=31062, -577.8886, 581.8356, 3.947, 0.7
Pendant of the Null Rune, https://wotlkdb.com/?spell=31066, -585.212, 589.159, 3.947, 0.7
Thick Felsteel Necklace, https://wotlkdb.com/?spell=31067, -641.5484, 645.4606, 3.9122, 0.6
Figurine - Dawnstone Crab, https://wotlkdb.com/?spell=31080, -682.46, 683.96, 1.5, 0.2
Blazing Eternium Band, https://wotlkdb.com/?spell=31061, -728.9782, 732.96, 3.9818, 0.5
Embrace of the Dawn, https://wotlkdb.com/?spell=31072, -745.0182, 749, 3.9818, 0.5
Living Ruby Pendant, https://wotlkdb.com/?spell=31068, -787.73, 822.73, 35, 4.3
Khorium Band of Shadows, https://wotlkdb.com/?spell=31053, -856.6925, 860.57, 3.8775, 0.5
Delicate Eternium Ring, https://wotlkdb.com/?spell=31060, -899.8378, 903.75, 3.9122, 0.4
Khorium Inferno Band, https://wotlkdb.com/?spell=31055, -1038.0578, 1041.97, 3.9122, 0.4
Khorium Band of Leaves, https://wotlkdb.com/?spell=31056, -1059.053, 1063, 3.947, 0.4
Amulet of Flowing Life, https://wotlkdb.com/?spell=46126, -1099.6645, 1108.5, 8.8355, 0.8
Arcane Khorium Band, https://wotlkdb.com/?spell=31057, -1148.7176, 1152.6994, 3.9818, 0.3
Khorium Band of Frost, https://wotlkdb.com/?spell=31054, -1181.0453, 1184.9575, 3.9122, 0.3
Figurine - Empyrean Tortoise, https://wotlkdb.com/?spell=46775, -1299.2688, 1300.7688, 1.5, 0.1
Figurine - Khorium Boar, https://wotlkdb.com/?spell=46776, -1328.8, 1330, 1.2, 0.1
Hard Khorium Choker, https://wotlkdb.com/?spell=46127, -2002.4143, 2011.2498, 8.8355, 0.4
Pendant of Sunfire, https://wotlkdb.com/?spell=46125, -2188.3477, 2197.1832, 8.8355, 0.4
Crown of the Sea Witch, https://wotlkdb.com/?spell=41418, -2771.6643, 2774.34, 2.6757, 0.1
Ring of Flowing Life, https://wotlkdb.com/?spell=46123, -3669.2076, 3675.2332, 6.0256, 0.2
Loop of Forged Power, https://wotlkdb.com/?spell=46122, -4185.2076, 4191.2332, 6.0256, 0.1
