Teardrop Blood Garnet, https://wotlkdb.com/?spell=28903, -0.7, 0.95, 0.25, 26.3
Delicate Blood Garnet, https://wotlkdb.com/?spell=28907, -0.7, 0.95, 0.25, 26.3
Inlaid Malachite Ring, https://wotlkdb.com/?spell=25283, -0.76, 5.76, 5, 86.8
Solid Empyrean Sapphire, https://wotlkdb.com/?spell=39715, -0.875, 6.875, 6, 87.3
Sparkling Empyrean Sapphire, https://wotlkdb.com/?spell=39716, -0.875, 6.875, 6, 87.3
Lustrous Empyrean Sapphire, https://wotlkdb.com/?spell=39717, -0.875, 6.875, 6, 87.3
Stormy Empyrean Sapphire, https://wotlkdb.com/?spell=39718, -0.875, 6.875, 6, 87.3
Dense Stone Statue, https://wotlkdb.com/?spell=32809, -0.885, 0.985, 0.1, 10.2
Sparkling Azure Moonstone, https://wotlkdb.com/?spell=28953, -1, 1.55, 0.55, 35.5
Intricate Dark Jade, https://wotlkdb.com/?spell=53925, -1, 5, 4, 80
Glowing Shadow Draenite, https://wotlkdb.com/?spell=28925, -1.01, 1.91, 0.9, 47.1
Stormy Azure Moonstone, https://wotlkdb.com/?spell=28955, -1.12, 1.55, 0.43, 27.7
Earthshadow Ring, https://wotlkdb.com/?spell=58143, -1.1995, 5.28, 4.0805, 77.3
Solid Stone Statue, https://wotlkdb.com/?spell=32808, -1.29, 1.39, 0.1, 7.2
Lustrous Azure Moonstone, https://wotlkdb.com/?spell=28957, -1.3, 1.55, 0.25, 16.1
Amulet of Truesight, https://wotlkdb.com/?spell=63743, -1.4287, 6.4792, 5.0505, 77.9
Inscribed Flame Spessarite, https://wotlkdb.com/?spell=28910, -1.43, 1.98, 0.55, 27.8
Precise Scarlet Ruby, https://wotlkdb.com/?spell=53951, -1.5, 101.5, 100, 98.5
Sovereign Shadow Draenite, https://wotlkdb.com/?spell=28936, -1.52, 1.91, 0.39, 20.4
Royal Shadow Draenite, https://wotlkdb.com/?spell=28927, -1.6468, 1.91, 0.2632, 13.8
Shifting Shadow Draenite, https://wotlkdb.com/?spell=28933, -1.66, 1.91, 0.25, 13.1
Infused Shadow Draenite, https://wotlkdb.com/?spell=39458, -1.66, 1.91, 0.25, 13.1
Glinting Flame Spessarite, https://wotlkdb.com/?spell=28914, -1.69, 1.98, 0.29, 14.6
Forceful Seaspray Emerald, https://wotlkdb.com/?spell=47053, -1.7, 4.7, 3, 63.8
Steady Seaspray Emerald, https://wotlkdb.com/?spell=47054, -1.7, 4.7, 3, 63.8
Luminous Flame Spessarite, https://wotlkdb.com/?spell=28912, -1.73, 1.98, 0.25, 12.6
Inscribed Pyrestone, https://wotlkdb.com/?spell=39733, -1.9, 7.9, 6, 75.9
Potent Pyrestone, https://wotlkdb.com/?spell=39734, -1.9, 7.9, 6, 75.9
Luminous Pyrestone, https://wotlkdb.com/?spell=39735, -1.9, 7.9, 6, 75.9
Veiled Pyrestone, https://wotlkdb.com/?spell=39737, -1.9, 7.9, 6, 75.9
Wicked Pyrestone, https://wotlkdb.com/?spell=39738, -1.9, 7.9, 6, 75.9
Reckless Pyrestone, https://wotlkdb.com/?spell=47055, -1.9, 7.9, 6, 75.9
Bold Crimson Spinel, https://wotlkdb.com/?spell=39705, -1.95, 7.95, 6, 75.5
Delicate Crimson Spinel, https://wotlkdb.com/?spell=39706, -1.95, 7.95, 6, 75.5
Teardrop Crimson Spinel, https://wotlkdb.com/?spell=39710, -1.95, 7.95, 6, 75.5
Runed Crimson Spinel, https://wotlkdb.com/?spell=39711, -1.95, 7.95, 6, 75.5
Subtle Crimson Spinel, https://wotlkdb.com/?spell=39713, -1.95, 7.95, 6, 75.5
Flashing Crimson Spinel, https://wotlkdb.com/?spell=39714, -1.95, 7.95, 6, 75.5
Enduring Dark Jade, https://wotlkdb.com/?spell=53918, -2, 5, 3, 60
Balanced Twilight Opal, https://wotlkdb.com/?spell=53969, -2.02, 7, 4.98, 71.1
Jagged Dark Jade, https://wotlkdb.com/?spell=53916, -2.2, 5, 2.8, 56
Ring of Silver Might, https://wotlkdb.com/?spell=25317, -2.2166, 4.1666, 1.95, 46.8
Primal Stone Statue, https://wotlkdb.com/?spell=32810, -2.58, 2.98, 0.4, 13.4
Pendant of the Agate Shield, https://wotlkdb.com/?spell=25610, -2.9399, 7.9399, 5, 63
Tigerseye Band, https://wotlkdb.com/?spell=32179, -2.975, 5.975, 3, 50.2
Ring of Twilight Shadows, https://wotlkdb.com/?spell=25318, -2.98, 3.98, 1, 25.1
Dark Jade Focusing Lens, https://wotlkdb.com/?spell=56205, -3, 5, 2, 40
Solid Bronze Ring, https://wotlkdb.com/?spell=25490, -3.01, 4, 0.99, 24.8
Misty Dark Jade, https://wotlkdb.com/?spell=53922, -4, 5, 1, 20
Dazzling Dark Jade, https://wotlkdb.com/?spell=53926, -4.01, 5, 0.99, 19.8
Sundered Dark Jade, https://wotlkdb.com/?spell=53927, -4.01, 5, 0.99, 19.8
Timeless Dark Jade, https://wotlkdb.com/?spell=53894, -4.025, 5, 0.975, 19.5
Stormy Majestic Zircon, https://wotlkdb.com/?spell=66499, -4.12, 125, 120.88, 96.7
Radiant Dark Jade, https://wotlkdb.com/?spell=53931, -4.2501, 5, 0.7499, 15
Turbid Dark Jade, https://wotlkdb.com/?spell=53924, -4.5, 5, 0.5, 10
Tense Dark Jade, https://wotlkdb.com/?spell=53932, -4.5, 5, 0.5, 10
Simple Pearl Ring, https://wotlkdb.com/?spell=25284, -4.79, 7.77, 2.98, 38.4
Malachite Pendant, https://wotlkdb.com/?spell=32178, -4.9, 6.88, 1.98, 28.8
Amulet of the Moon, https://wotlkdb.com/?spell=25339, -4.9443, 5.0978, 0.1535, 3
Gleaming Golden Draenite, https://wotlkdb.com/?spell=28944, -4.96, 5.95, 0.99, 16.6
Smooth Golden Draenite, https://wotlkdb.com/?spell=34069, -4.96, 5.95, 0.99, 16.6
Thick Golden Draenite, https://wotlkdb.com/?spell=28947, -5.0194, 5.95, 0.9306, 15.6
Brilliant Golden Draenite, https://wotlkdb.com/?spell=28938, -5.07, 5.95, 0.88, 14.8
Rigid Golden Draenite, https://wotlkdb.com/?spell=28948, -5.385, 5.95, 0.565, 9.5
Sparkling Sky Sapphire, https://wotlkdb.com/?spell=53953, -5.5, 10, 4.5, 45
Shadowmight Ring, https://wotlkdb.com/?spell=58146, -5.5975, 25, 19.4025, 77.6
Durable Ametrine, https://wotlkdb.com/?spell=66571, -6.7501, 189.75, 182.9999, 96.4
Heavy Stone Statue, https://wotlkdb.com/?spell=32807, -6.82, 6.88, 0.06, 0.9
Ornate Tigerseye Necklace, https://wotlkdb.com/?spell=26928, -6.95, 8.95, 2, 22.3
Glimmering Monarch Topaz, https://wotlkdb.com/?spell=53993, -7.15, 62.15, 55, 88.5
Relentless Earthsiege Diamond, https://wotlkdb.com/?spell=55400, -7.5, 114.5, 107, 93.4
Aquamarine Signet, https://wotlkdb.com/?spell=26874, -7.67, 9.65, 1.98, 20.5
Figurine - Golden Hare, https://wotlkdb.com/?spell=26873, -7.6848, 7.8348, 0.15, 1.9
Heavy Jade Ring, https://wotlkdb.com/?spell=36524, -7.7, 8.7, 1, 11.5
Braided Copper Ring, https://wotlkdb.com/?spell=25493, -8, 10, 2, 20
Thundering Skyflare Diamond, https://wotlkdb.com/?spell=55395, -8.7, 85, 76.3, 89.8
Citrine Ring of Rapid Healing, https://wotlkdb.com/?spell=25621, -8.9799, 10.9799, 2, 18.2
Jade Ring of Slaying, https://wotlkdb.com/?spell=58144, -9, 14, 5, 35.7
Woven Copper Ring, https://wotlkdb.com/?spell=26925, -10, 11, 1, 9.1
Solid Chalcedony, https://wotlkdb.com/?spell=53934, -10.02, 15, 4.98, 33.2
The Aquamarine Ward, https://wotlkdb.com/?spell=26887, -10.45, 15.45, 5, 32.4
Golden Dragon Ring, https://wotlkdb.com/?spell=25613, -11.1251, 13.125, 1.9999, 15.2
Blazing Citrine Ring, https://wotlkdb.com/?spell=25617, -11.93, 21.9299, 9.9999, 45.6
Etched Monarch Topaz, https://wotlkdb.com/?spell=53976, -12.35, 62.15, 49.8, 80.1
Heavy Copper Ring, https://wotlkdb.com/?spell=26926, -13, 14, 1, 7.1
Sparkling Chalcedony, https://wotlkdb.com/?spell=53940, -14, 15, 1, 6.7
Lustrous Chalcedony, https://wotlkdb.com/?spell=53941, -14, 15, 1, 6.7
Gloom Band, https://wotlkdb.com/?spell=25287, -14.0745, 16.98, 2.9055, 17.1
Figurine - Truesilver Crab, https://wotlkdb.com/?spell=26881, -16.5896, 16.7396, 0.15, 0.9
Deft Monarch Topaz, https://wotlkdb.com/?spell=53982, -17.15, 62.15, 45, 72.4
Silver Rose Pendant, https://wotlkdb.com/?spell=25614, -19.3288, 19.6065, 0.2777, 1.4
Durable Monarch Topaz, https://wotlkdb.com/?spell=53986, -22.15, 62.15, 40, 64.4
Truesilver Commander's Ring, https://wotlkdb.com/?spell=34959, -25.3895, 66.3895, 41, 61.8
Fierce Monarch Topaz, https://wotlkdb.com/?spell=54019, -27.15, 62.15, 35, 56.3
Champion's Monarch Topaz, https://wotlkdb.com/?spell=53977, -29.25, 62.15, 32.9, 52.9
Sapphire Pendant of Winter Night, https://wotlkdb.com/?spell=26908, -30.86, 35.82, 4.96, 13.8
Onslaught Ring, https://wotlkdb.com/?spell=26907, -31.3609, 37.3609, 6, 16.1
Thick Autumn's Glow, https://wotlkdb.com/?spell=53959, -34.9999, 104.9999, 70, 66.7
Red Ring of Destruction, https://wotlkdb.com/?spell=36525, -36.5, 42.5, 6, 14.1
Engraved Truesilver Ring, https://wotlkdb.com/?spell=25620, -36.7099, 38.7099, 2, 5.2
Inscribed Monarch Topaz, https://wotlkdb.com/?spell=53975, -37.15, 62.15, 25, 40.2
Ruby Pendant of Fire, https://wotlkdb.com/?spell=26883, -37.52, 42.5, 4.98, 11.7
Brilliant Pearl Band, https://wotlkdb.com/?spell=41414, -40.014, 49.964, 9.95, 19.9
Jade Pendant of Blasting, https://wotlkdb.com/?spell=25618, -40.0518, 40.4, 0.3482, 0.9
Bracing Earthsiege Diamond, https://wotlkdb.com/?spell=55397, -44.5, 114.5, 70, 61.1
Smooth Autumn's Glow, https://wotlkdb.com/?spell=53957, -44.9999, 104.9999, 60, 57.1
Brilliant Autumn's Glow, https://wotlkdb.com/?spell=53956, -54.9999, 104.9999, 50, 47.6
Pristine Monarch Topaz, https://wotlkdb.com/?spell=53989, -55.65, 62.15, 6.5, 10.5
Bright Scarlet Ruby, https://wotlkdb.com/?spell=53947, -56.375, 101.5, 45.125, 44.5
Aquamarine Pendant of the Warrior, https://wotlkdb.com/?spell=26876, -57.3, 58.8, 1.5, 2.6
Figurine - Ruby Serpent, https://wotlkdb.com/?spell=26900, -61.8098, 61.9598, 0.15, 0.2
Simple Opal Ring, https://wotlkdb.com/?spell=26902, -62.06, 63.5, 1.44, 2.3
Figurine - Crimson Serpent, https://wotlkdb.com/?spell=46777, -64.04, 65.54, 1.5, 2.3
Destructive Skyflare Diamond, https://wotlkdb.com/?spell=55390, -64.525, 85, 20.475, 24.1
Figurine - Truesilver Boar, https://wotlkdb.com/?spell=26882, -66.6486, 66.7986, 0.15, 0.2
Diamond Focus Ring, https://wotlkdb.com/?spell=36526, -72.9, 75.4, 2.5, 3.3
Bracing Earthstorm Diamond, https://wotlkdb.com/?spell=32867, -77, 80, 3, 3.8
Tenacious Earthstorm Diamond, https://wotlkdb.com/?spell=32868, -77, 80, 3, 3.8
Insightful Earthstorm Diamond, https://wotlkdb.com/?spell=32870, -77, 80, 3, 3.8
Relentless Earthstorm Diamond, https://wotlkdb.com/?spell=39961, -77, 80, 3, 3.8
Eternal Earthstorm Diamond, https://wotlkdb.com/?spell=46597, -77, 80, 3, 3.8
Tireless Skyflare Diamond, https://wotlkdb.com/?spell=55386, -77.2, 85, 7.8, 9.2
Swift Skyflare Diamond, https://wotlkdb.com/?spell=55394, -78, 85, 7, 8.2
Powerful Earthsiege Diamond, https://wotlkdb.com/?spell=55399, -79.6, 114.5, 34.9, 30.5
Figurine - Black Pearl Panther, https://wotlkdb.com/?spell=26875, -83.65, 83.8, 0.15, 0.2
Figurine - Jade Owl, https://wotlkdb.com/?spell=26872, -91.2298, 91.3798, 0.15, 0.2
Persistent Earthsiege Diamond, https://wotlkdb.com/?spell=55402, -96.5, 114.5, 18, 15.7
Bold Dragon's Eye, https://wotlkdb.com/?spell=56049, -98.775, 99.9, 1.125, 1.1
Delicate Dragon's Eye, https://wotlkdb.com/?spell=56052, -98.775, 99.9, 1.125, 1.1
Runed Dragon's Eye, https://wotlkdb.com/?spell=56053, -98.775, 99.9, 1.125, 1.1
Bright Dragon's Eye, https://wotlkdb.com/?spell=56054, -98.775, 99.9, 1.125, 1.1
Subtle Dragon's Eye, https://wotlkdb.com/?spell=56055, -98.775, 99.9, 1.125, 1.1
Flashing Dragon's Eye, https://wotlkdb.com/?spell=56056, -98.775, 99.9, 1.125, 1.1
Brilliant Dragon's Eye, https://wotlkdb.com/?spell=56074, -98.775, 99.9, 1.125, 1.1
Fractured Dragon's Eye, https://wotlkdb.com/?spell=56076, -98.775, 99.9, 1.125, 1.1
Lustrous Dragon's Eye, https://wotlkdb.com/?spell=56077, -98.775, 99.9, 1.125, 1.1
Mystic Dragon's Eye, https://wotlkdb.com/?spell=56079, -98.775, 99.9, 1.125, 1.1
Precise Dragon's Eye, https://wotlkdb.com/?spell=56081, -98.775, 99.9, 1.125, 1.1
Quick Dragon's Eye, https://wotlkdb.com/?spell=56083, -98.775, 99.9, 1.125, 1.1
Rigid Dragon's Eye, https://wotlkdb.com/?spell=56084, -98.775, 99.9, 1.125, 1.1
Smooth Dragon's Eye, https://wotlkdb.com/?spell=56085, -98.775, 99.9, 1.125, 1.1
Solid Dragon's Eye, https://wotlkdb.com/?spell=56086, -98.775, 99.9, 1.125, 1.1
Sparkling Dragon's Eye, https://wotlkdb.com/?spell=56087, -98.775, 99.9, 1.125, 1.1
Stormy Dragon's Eye, https://wotlkdb.com/?spell=56088, -98.775, 99.9, 1.125, 1.1
Thick Dragon's Eye, https://wotlkdb.com/?spell=56089, -98.775, 99.9, 1.125, 1.1
Figurine - Living Ruby Serpent, https://wotlkdb.com/?spell=31081, -100.42, 101.92, 1.5, 1.5
Emerald Lion Ring, https://wotlkdb.com/?spell=34961, -107.5, 115.5, 8, 6.9
Living Emerald Pendant, https://wotlkdb.com/?spell=26911, -118.0737, 119.324, 1.2503, 1
Sapphire Owl, https://wotlkdb.com/?spell=56202, -121.8393, 129.89, 8.0507, 6.2
Thick Adamantite Necklace, https://wotlkdb.com/?spell=31051, -130.1, 160, 29.9, 18.7
Glowing Thorium Band, https://wotlkdb.com/?spell=34960, -132.2495, 137.3, 5.0505, 3.7
Heavy Adamantite Ring, https://wotlkdb.com/?spell=31052, -140.0001, 155, 14.9999, 9.7
Destructive Skyfire Diamond, https://wotlkdb.com/?spell=32871, -147, 150, 3, 2
Mystical Skyfire Diamond, https://wotlkdb.com/?spell=32872, -147, 150, 3, 2
Swift Skyfire Diamond, https://wotlkdb.com/?spell=32873, -147, 150, 3, 2
Enigmatic Skyfire Diamond, https://wotlkdb.com/?spell=32874, -147, 150, 3, 2
Thundering Skyfire Diamond, https://wotlkdb.com/?spell=39963, -147, 150, 3, 2
Chaotic Skyfire Diamond, https://wotlkdb.com/?spell=44794, -147, 150, 3, 2
Ember Skyfire Diamond, https://wotlkdb.com/?spell=46601, -147, 150, 3, 2
Figurine - Talasite Owl, https://wotlkdb.com/?spell=31082, -168.1, 169.6, 1.5, 0.9
Twilight Serpent, https://wotlkdb.com/?spell=56201, -174.9993, 183.05, 8.0507, 4.4
Emerald Boar, https://wotlkdb.com/?spell=56203, -206.3293, 214.38, 8.0507, 3.8
Monarch Crab, https://wotlkdb.com/?spell=59759, -226.1393, 234.19, 8.0507, 3.4
Figurine - Shadowsong Panther, https://wotlkdb.com/?spell=46778, -226.9532, 228.4532, 1.5, 0.7
Figurine - Dark Iron Scorpid, https://wotlkdb.com/?spell=26914, -260.1, 261.6, 1.5, 0.6
Pendant of Withering, https://wotlkdb.com/?spell=31064, -285.493, 289.44, 3.947, 1.4
Figurine - Emerald Owl, https://wotlkdb.com/?spell=26909, -302.869, 303.244, 0.375, 0.1
Pendant of Shadow's End, https://wotlkdb.com/?spell=31065, -306.513, 310.46, 3.947, 1.3
Ring of Arcane Shielding, https://wotlkdb.com/?spell=37855, -318.4963, 322.2, 3.7037, 1.1
Figurine - Nightseye Panther, https://wotlkdb.com/?spell=31083, -323.12, 324.62, 1.5, 0.5
Necklace of the Diamond Tower, https://wotlkdb.com/?spell=26915, -328.0782, 330.6, 2.5218, 0.8
Braided Eternium Chain, https://wotlkdb.com/?spell=31070, -338, 461, 123, 26.7
Figurine - Seaspray Albatross, https://wotlkdb.com/?spell=46779, -363.1, 364.6, 1.5, 0.4
Pendant of Thawing, https://wotlkdb.com/?spell=31063, -376.583, 380.53, 3.947, 1
Figurine - Felsteel Boar, https://wotlkdb.com/?spell=31079, -386.62, 387.82, 1.2, 0.3
Ruby Hare, https://wotlkdb.com/?spell=56199, -406.8492, 414.8999, 8.0507, 1.9
Pendant of Frozen Flame, https://wotlkdb.com/?spell=31062, -441.573, 445.52, 3.947, 0.9
The Black Pearl, https://wotlkdb.com/?spell=41415, -479.2898, 600.2898, 121, 20.2
Figurine - Dawnstone Crab, https://wotlkdb.com/?spell=31080, -527.66, 529.16, 1.5, 0.3
Figurine - Black Diamond Crab, https://wotlkdb.com/?spell=26912, -535.38, 536.88, 1.5, 0.3
Thick Felsteel Necklace, https://wotlkdb.com/?spell=31067, -539.5878, 543.5, 3.9122, 0.7
Pendant of the Null Rune, https://wotlkdb.com/?spell=31066, -550.753, 554.7, 3.947, 0.7
Arcanite Sword Pendant, https://wotlkdb.com/?spell=26918, -550.7806, 553.372, 2.5914, 0.5
Blazing Eternium Band, https://wotlkdb.com/?spell=31061, -609.8382, 613.82, 3.9818, 0.6
Living Ruby Pendant, https://wotlkdb.com/?spell=31068, -617.8, 652.8, 35, 5.4
Embrace of the Dawn, https://wotlkdb.com/?spell=31072, -618.9182, 622.9, 3.9818, 0.6
Heavy Felsteel Ring, https://wotlkdb.com/?spell=31058, -689.7963, 693.5, 3.7037, 0.5
Khorium Band of Shadows, https://wotlkdb.com/?spell=31053, -697.2925, 701.17, 3.8775, 0.6
Delicate Eternium Ring, https://wotlkdb.com/?spell=31060, -751.5878, 755.5, 3.9122, 0.5
Khorium Inferno Band, https://wotlkdb.com/?spell=31055, -848.2028, 852.115, 3.9122, 0.5
Khorium Band of Leaves, https://wotlkdb.com/?spell=31056, -878.753, 882.7, 3.947, 0.4
Amulet of Flowing Life, https://wotlkdb.com/?spell=46126, -919.3645, 928.2, 8.8355, 1
Khorium Band of Frost, https://wotlkdb.com/?spell=31054, -945.6878, 949.6, 3.9122, 0.4
Arcane Khorium Band, https://wotlkdb.com/?spell=31057, -962.7182, 966.7, 3.9818, 0.4
Figurine - Empyrean Tortoise, https://wotlkdb.com/?spell=46775, -1028.33, 1029.83, 1.5, 0.1
Figurine - Khorium Boar, https://wotlkdb.com/?spell=46776, -1038.44, 1039.64, 1.2, 0.1
Hard Khorium Band, https://wotlkdb.com/?spell=46124, -1199.9495, 5199.9495, 4000, 76.9
Pendant of Sunfire, https://wotlkdb.com/?spell=46125, -1835.6395, 1844.475, 8.8355, 0.5
Crown of the Sea Witch, https://wotlkdb.com/?spell=41418, -2195.6037, 2198.2794, 2.6757, 0.1
Hard Khorium Choker, https://wotlkdb.com/?spell=46127, -3301.9645, 3310.8, 8.8355, 0.3
Ring of Flowing Life, https://wotlkdb.com/?spell=46123, -4311.9239, 4317.9495, 6.0256, 0.1
Loop of Forged Power, https://wotlkdb.com/?spell=46122, -4672.9239, 4678.9495, 6.0256, 0.1
