Name, Link, Profit, Cost, Sell, ROI %
Teardrop Crimson Spinel, https://wotlkdb.com/?spell=39710, 5991.1, 8.9, 6000, 67415.7
Brutal Earthstorm Diamond, https://wotlkdb.com/?spell=32869, 3468.8433, 150, 3618.8433, 2412.6
Ruby Crown of Restoration, https://wotlkdb.com/?spell=26878, 680.9322, 86.1158, 767.048, 890.7
Ring of Scarlet Shadows, https://wotlkdb.com/?spell=58148, 569.7999, 314.7, 884.4999, 281.1
Savage Titanium Band, https://wotlkdb.com/?spell=58507, 569.2537, 564, 1133.2537, 200.9
Gem Studded Band, https://wotlkdb.com/?spell=26896, 480.2368, 34.1, 514.3368, 1508.3
Savage Titanium Ring, https://wotlkdb.com/?spell=58492, 461.1, 564, 1025.1, 181.8
Powerful Earthstorm Diamond, https://wotlkdb.com/?spell=32866, 450, 150, 600, 400
Titanium Spellshock Ring, https://wotlkdb.com/?spell=56498, 448.2, 900.8, 1349, 149.8
Titanium Spellshock Necklace, https://wotlkdb.com/?spell=56501, 435.59, 959.4, 1394.99, 145.4
Titanium Earthguard Chain, https://wotlkdb.com/?spell=56500, 415.1, 861, 1276.1, 148.2
Band of Natural Fire, https://wotlkdb.com/?spell=26916, 356.4586, 5.24, 361.6986, 6902.6
Blazing Citrine Ring, https://wotlkdb.com/?spell=25617, 355.9484, 14.08, 370.0284, 2628
Citrine Pendant of Golden Healing, https://wotlkdb.com/?spell=25622, 348.345, 7.055, 355.4, 5037.6
Necklace of the Deep, https://wotlkdb.com/?spell=40514, 333.8, 61.95, 395.75, 638.8
Titanium Frostguard Ring, https://wotlkdb.com/?spell=58954, 326.5035, 495.5, 822.0035, 165.9
Ring of Earthen Might, https://wotlkdb.com/?spell=58147, 286.1037, 110, 396.1037, 360.1
Ring of Northern Tears, https://wotlkdb.com/?spell=58150, 256.57, 113.42, 369.99, 326.2
Bold Crimson Spinel, https://wotlkdb.com/?spell=39705, 224.1, 8.9, 233, 2618
Windfire Band, https://wotlkdb.com/?spell=58149, 221.8337, 318.45, 540.2837, 169.7
Titanium Earthguard Ring, https://wotlkdb.com/?spell=56497, 215.8, 813, 1028.8, 126.5
Titanium Impact Choker, https://wotlkdb.com/?spell=56499, 203.3, 1475.7, 1679, 113.8
Titanium Impact Band, https://wotlkdb.com/?spell=56496, 189.4499, 1200.6, 1390.0499, 115.8
Hard Khorium Band, https://wotlkdb.com/?spell=46124, 163.578, 4835.422, 4999, 103.4
Runed Mana Band, https://wotlkdb.com/?spell=64727, 126, 124, 250, 201.6
Glimmering Ametrine, https://wotlkdb.com/?spell=66578, 109.7499, 229.75, 339.4999, 147.8
Dream Signet, https://wotlkdb.com/?spell=56197, 93.7, 76.3, 170, 222.8
Forlorn Skyflare Diamond, https://wotlkdb.com/?spell=55387, 93.35, 74.9, 168.25, 224.6
Trenchant Earthsiege Diamond, https://wotlkdb.com/?spell=55403, 87.6499, 123.75, 211.3999, 170.8
Forceful Eye of Zul, https://wotlkdb.com/?spell=66434, 74.75, 69, 143.75, 208.3
Accurate Monarch Topaz, https://wotlkdb.com/?spell=53994, 72.6, 82.4, 155, 188.1
Shining Eye of Zul, https://wotlkdb.com/?spell=66437, 70.75, 69, 139.75, 202.5
Sky Sapphire Amulet, https://wotlkdb.com/?spell=64726, 70.75, 129.25, 200, 154.7
Effulgent Skyflare Diamond, https://wotlkdb.com/?spell=55384, 70.1, 74.9, 145, 193.6
Sundered Forest Emerald, https://wotlkdb.com/?spell=54008, 69.0538, 5.95, 75.0038, 1260.6
Emerald Choker, https://wotlkdb.com/?spell=64725, 68.15, 68.85, 137, 199
Enigmatic Skyflare Diamond, https://wotlkdb.com/?spell=55393, 67.5999, 74.9, 142.4999, 190.3
Jade Dagger Pendant, https://wotlkdb.com/?spell=56195, 67.15, 19.8, 86.95, 439.1
Jagged Eye of Zul, https://wotlkdb.com/?spell=66431, 66.25, 69, 135.25, 196
Jagged Forest Emerald, https://wotlkdb.com/?spell=53996, 66.239, 5.95, 72.189, 1213.3
Stark Ametrine, https://wotlkdb.com/?spell=66587, 65.25, 229.75, 295, 128.4
Lambent Forest Emerald, https://wotlkdb.com/?spell=54009, 63.2303, 5.95, 69.1803, 1162.7
Vivid Eye of Zul, https://wotlkdb.com/?spell=66429, 60.9998, 69, 129.9998, 188.4
Truesilver Commander's Ring, https://wotlkdb.com/?spell=34959, 60.3718, 39.6282, 100, 252.3
Fractured Scarlet Ruby, https://wotlkdb.com/?spell=53950, 60, 120, 180, 150
Accurate Ametrine, https://wotlkdb.com/?spell=66576, 59.75, 229.75, 289.5, 126
Seer's Forest Emerald, https://wotlkdb.com/?spell=54002, 59.05, 5.95, 65, 1092.4
Turbid Eye of Zul, https://wotlkdb.com/?spell=66445, 58.75, 69, 127.75, 185.1
Delicate Scarlet Ruby, https://wotlkdb.com/?spell=53945, 58, 120, 178, 148.3
Veiled Monarch Topaz, https://wotlkdb.com/?spell=53985, 57.5999, 82.4, 139.9999, 169.9
Infused Nightseye, https://wotlkdb.com/?spell=39462, 57.02, 2.98, 60, 2013.4
Blood Sun Necklace, https://wotlkdb.com/?spell=56196, 56.45, 23.55, 80, 339.7
Revitalizing Skyflare Diamond, https://wotlkdb.com/?spell=55407, 54.85, 74.9, 129.75, 173.2
Luminous Ametrine, https://wotlkdb.com/?spell=66566, 54.7499, 229.75, 284.4999, 123.8
Shifting Twilight Opal, https://wotlkdb.com/?spell=53963, 54.65, 11, 65.65, 596.8
Lustrous Sky Sapphire, https://wotlkdb.com/?spell=53954, 54.375, 13.625, 68, 499.1
Sundered Eye of Zul, https://wotlkdb.com/?spell=66436, 54, 69, 123, 178.3
Durable Monarch Topaz, https://wotlkdb.com/?spell=53986, 52.6, 82.4, 135, 163.8
Luminous Monarch Topaz, https://wotlkdb.com/?spell=53983, 52.465, 82.4, 134.865, 163.7
Rigid King's Amber, https://wotlkdb.com/?spell=66501, 52.4499, 240, 292.4499, 121.9
Glinting Noble Topaz, https://wotlkdb.com/?spell=31109, 52.02, 2.98, 55, 1845.6
Etched Ametrine, https://wotlkdb.com/?spell=66572, 51.25, 229.75, 281, 122.3
Pristine Ametrine, https://wotlkdb.com/?spell=66573, 51.24, 229.75, 280.99, 122.3
Rigid Autumn's Glow, https://wotlkdb.com/?spell=53958, 50, 110, 160, 145.5
Lucent Ametrine, https://wotlkdb.com/?spell=66585, 49.25, 229.75, 279, 121.4
Smooth King's Amber, https://wotlkdb.com/?spell=66502, 49, 240, 289, 120.4
Infused Twilight Opal, https://wotlkdb.com/?spell=53970, 48.8499, 11, 59.8499, 544.1
Radiant Forest Emerald, https://wotlkdb.com/?spell=54012, 48.05, 5.95, 54, 907.6
Delicate Living Ruby, https://wotlkdb.com/?spell=31085, 47.0532, 3.59, 50.6432, 1410.7
Nightmare Tear, https://wotlkdb.com/?spell=68253, 46.7, 142.3, 189, 132.8
Lambent Eye of Zul, https://wotlkdb.com/?spell=66439, 44.25, 69, 113.25, 164.1
Royal Dreadstone, https://wotlkdb.com/?spell=66558, 44.2499, 119, 163.2499, 137.2
Vivid Forest Emerald, https://wotlkdb.com/?spell=53997, 44.0499, 5.95, 49.9999, 840.3
Bold Scarlet Ruby, https://wotlkdb.com/?spell=53830, 44, 120, 164, 136.7
Regal Dreadstone, https://wotlkdb.com/?spell=66559, 42.75, 119, 161.75, 135.9
Brilliant King's Amber, https://wotlkdb.com/?spell=66503, 42.75, 240, 282.75, 117.8
Deadly Monarch Topaz, https://wotlkdb.com/?spell=53979, 42.6, 82.4, 125, 151.7
Misty Eye of Zul, https://wotlkdb.com/?spell=66435, 41.75, 69, 110.75, 160.5
Enduring Eye of Zul, https://wotlkdb.com/?spell=66338, 41, 69, 110, 159.4
Mystic King's Amber, https://wotlkdb.com/?spell=66505, 41, 240, 281, 117.1
Subtle Cardinal Ruby, https://wotlkdb.com/?spell=66452, 40.5, 266.75, 307.25, 115.2
Veiled Ametrine, https://wotlkdb.com/?spell=66570, 40.25, 229.75, 270, 117.5
Fierce Ametrine, https://wotlkdb.com/?spell=66583, 40.25, 229.75, 270, 117.5
Shifting Dreadstone, https://wotlkdb.com/?spell=66557, 40, 119, 159, 133.6
Thick King's Amber, https://wotlkdb.com/?spell=66504, 40, 240, 280, 116.7
Forceful Forest Emerald, https://wotlkdb.com/?spell=54001, 39.8499, 5.95, 45.7999, 769.7
Quick King's Amber, https://wotlkdb.com/?spell=66506, 39, 240, 279, 116.3
Deadly Ametrine, https://wotlkdb.com/?spell=66568, 38.5, 229.75, 268.25, 116.8
Enchanted Tear, https://wotlkdb.com/?spell=56531, 37.24, 12.76, 50, 391.8
Purified Dreadstone, https://wotlkdb.com/?spell=66556, 36.9999, 119, 155.9999, 131.1
Resplendent Ametrine, https://wotlkdb.com/?spell=66582, 36.95, 229.75, 266.7, 116.1
Wicked Ametrine, https://wotlkdb.com/?spell=66577, 36.5, 229.75, 266.25, 115.9
Golden Ring of Power, https://wotlkdb.com/?spell=34955, 36.3644, 8.08, 44.4444, 550.1
Flashing Scarlet Ruby, https://wotlkdb.com/?spell=53949, 34.9999, 120, 154.9999, 129.2
Solid Sky Sapphire, https://wotlkdb.com/?spell=53952, 34.275, 13.625, 47.9, 351.6
Inscribed Noble Topaz, https://wotlkdb.com/?spell=31106, 34.145, 2.98, 37.125, 1245.8
Steady Forest Emerald, https://wotlkdb.com/?spell=54000, 34.05, 5.95, 40, 672.3
Enduring Forest Emerald, https://wotlkdb.com/?spell=53998, 34.0498, 5.95, 39.9998, 672.3
Steady Eye of Zul, https://wotlkdb.com/?spell=66428, 33.9999, 69, 102.9999, 149.3
Mercurial Adamantite, https://wotlkdb.com/?spell=38068, 33.2698, 82.7552, 116.025, 140.2
Precise Cardinal Ruby, https://wotlkdb.com/?spell=66450, 33.2499, 266.75, 299.9999, 112.5
Energized Forest Emerald, https://wotlkdb.com/?spell=54011, 33.0401, 5.95, 38.9901, 655.3
Bright Cardinal Ruby, https://wotlkdb.com/?spell=66449, 33, 266.75, 299.75, 112.4
Glimmering Monarch Topaz, https://wotlkdb.com/?spell=53993, 32.35, 82.4, 114.75, 139.3
Enduring Talasite, https://wotlkdb.com/?spell=31110, 32.2, 2.8, 35, 1250
Balanced Dreadstone, https://wotlkdb.com/?spell=66553, 32, 119, 151, 126.9
Tenuous Dreadstone, https://wotlkdb.com/?spell=66565, 32, 119, 151, 126.9
Potent Monarch Topaz, https://wotlkdb.com/?spell=53984, 31.675, 82.4, 114.075, 138.4
Energized Eye of Zul, https://wotlkdb.com/?spell=66442, 31.5, 69, 100.5, 145.7
Invigorating Earthsiege Diamond, https://wotlkdb.com/?spell=55404, 31.2499, 123.75, 154.9999, 125.3
Mystic Sun Crystal, https://wotlkdb.com/?spell=53857, 30.52, 1.48, 32, 2162.2
Subtle Scarlet Ruby, https://wotlkdb.com/?spell=53948, 30, 120, 150, 125
Opaque Eye of Zul, https://wotlkdb.com/?spell=66444, 29.9, 69, 98.9, 143.3
Inscribed Ametrine, https://wotlkdb.com/?spell=66567, 29.75, 229.75, 259.5, 112.9
Guardian's Dreadstone, https://wotlkdb.com/?spell=66561, 29.6996, 119, 148.6996, 125
Infused Dreadstone, https://wotlkdb.com/?spell=66564, 29.5, 119, 148.5, 124.8
Seer's Eye of Zul, https://wotlkdb.com/?spell=66433, 28.9, 69, 97.9, 141.9
Shattered Eye of Zul, https://wotlkdb.com/?spell=66443, 28.9, 69, 97.9, 141.9
Royal Twilight Opal, https://wotlkdb.com/?spell=53967, 28.8999, 11, 39.8999, 362.7
Empowered Ametrine, https://wotlkdb.com/?spell=66580, 28.7013, 229.75, 258.4513, 112.5
Delicate Cardinal Ruby, https://wotlkdb.com/?spell=66448, 28.25, 266.75, 295, 110.6
Glowing Twilight Opal, https://wotlkdb.com/?spell=53965, 28, 11, 39, 354.5
Dazzling Eye of Zul, https://wotlkdb.com/?spell=66430, 27.5, 69, 96.5, 139.9
Lucent Monarch Topaz, https://wotlkdb.com/?spell=53981, 27.35, 82.4, 109.75, 133.2
Mysterious Twilight Opal, https://wotlkdb.com/?spell=53968, 26.95, 11, 37.95, 345
Sovereign Dreadstone, https://wotlkdb.com/?spell=66554, 26.73, 119, 145.73, 122.5
Defender's Shadow Crystal, https://wotlkdb.com/?spell=53869, 26.2576, 0.65, 26.9076, 4139.6
Intricate Forest Emerald, https://wotlkdb.com/?spell=54006, 26.05, 5.95, 32, 537.8
Eternal Earthsiege Diamond, https://wotlkdb.com/?spell=55398, 25.4999, 123.75, 149.2499, 120.6
Crystal Chalcedony Amulet, https://wotlkdb.com/?spell=58142, 23.79, 16.11, 39.9, 247.7
Ember Skyflare Diamond, https://wotlkdb.com/?spell=55392, 23.3, 74.9, 98.2, 131.1
Reckless Monarch Topaz, https://wotlkdb.com/?spell=53987, 23.15, 82.4, 105.55, 128.1
Quick Autumn's Glow, https://wotlkdb.com/?spell=53961, 23, 110, 133, 120.9
Puissant Dreadstone, https://wotlkdb.com/?spell=66563, 23, 119, 142, 119.3
Glinting Monarch Topaz, https://wotlkdb.com/?spell=53980, 22.6, 82.4, 105, 127.4
Shattered Forest Emerald, https://wotlkdb.com/?spell=54014, 22.0499, 5.95, 27.9999, 470.6
Runed Cardinal Ruby, https://wotlkdb.com/?spell=66446, 21.25, 266.75, 288, 108
Stormy Sky Sapphire, https://wotlkdb.com/?spell=53955, 21.225, 13.625, 34.85, 255.8
Sovereign Twilight Opal, https://wotlkdb.com/?spell=53962, 21, 11, 32, 290.9
Tense Forest Emerald, https://wotlkdb.com/?spell=54013, 20.9, 5.95, 26.85, 451.3
Durable Huge Citrine, https://wotlkdb.com/?spell=53884, 20.6264, 1.9, 22.5264, 1185.6
Durable Ametrine, https://wotlkdb.com/?spell=66571, 20.2499, 229.75, 249.9999, 108.8
Resplendent Huge Citrine, https://wotlkdb.com/?spell=53875, 20.1, 1.9, 22, 1157.9
Lucent Huge Citrine, https://wotlkdb.com/?spell=53879, 20.1, 1.9, 22, 1157.9
Misty Forest Emerald, https://wotlkdb.com/?spell=54003, 19.95, 5.95, 25.9, 435.3
Puissant Twilight Opal, https://wotlkdb.com/?spell=53973, 19, 11, 30, 272.7
Glowing Dreadstone, https://wotlkdb.com/?spell=66555, 18.75, 119, 137.75, 115.8
Potent Ametrine, https://wotlkdb.com/?spell=66569, 18.75, 229.75, 248.5, 108.2
Timeless Eye of Zul, https://wotlkdb.com/?spell=66432, 18.5, 69, 87.5, 126.8
Bronze Band of Force, https://wotlkdb.com/?spell=37818, 18.3805, 11.7695, 30.15, 256.2
Opaque Forest Emerald, https://wotlkdb.com/?spell=54010, 18.27, 5.95, 24.22, 407.1
Wicked Moonstone Ring, https://wotlkdb.com/?spell=25323, 18.2505, 31.7495, 50, 157.5
Fractured Cardinal Ruby, https://wotlkdb.com/?spell=66451, 18.25, 266.75, 285, 106.8
Empowered Huge Citrine, https://wotlkdb.com/?spell=53888, 18.1, 1.9, 20, 1052.6
Crystal Citrine Necklace, https://wotlkdb.com/?spell=58141, 17.84, 3.06, 20.9, 683
Sun Rock Ring, https://wotlkdb.com/?spell=56194, 17.3599, 2.64, 19.9999, 757.6
Bold Cardinal Ruby, https://wotlkdb.com/?spell=66447, 17.2499, 266.75, 283.9999, 106.5
Wicked Monarch Topaz, https://wotlkdb.com/?spell=53988, 16.8, 82.4, 99.2, 120.4
Chaotic Skyflare Diamond, https://wotlkdb.com/?spell=55389, 16.1, 74.9, 91, 121.5
Shattered Dark Jade, https://wotlkdb.com/?spell=53933, 16, 6, 22, 366.7
Insightful Earthsiege Diamond, https://wotlkdb.com/?spell=55396, 15, 123.75, 138.75, 112.1
Seer's Dark Jade, https://wotlkdb.com/?spell=53921, 14, 6, 20, 333.3
Purified Twilight Opal, https://wotlkdb.com/?spell=53966, 14, 11, 25, 227.3
Defender's Twilight Opal, https://wotlkdb.com/?spell=53972, 14, 11, 25, 227.3
Tenuous Twilight Opal, https://wotlkdb.com/?spell=53964, 13.7999, 11, 24.7999, 225.5
Regal Twilight Opal, https://wotlkdb.com/?spell=53971, 12.9999, 11, 23.9999, 218.2
Mystic Dawnstone, https://wotlkdb.com/?spell=31101, 12.2282, 2.7718, 15, 541.2
Dazzling Talasite, https://wotlkdb.com/?spell=31112, 12.2, 2.8, 15, 535.7
Turbid Forest Emerald, https://wotlkdb.com/?spell=54005, 12.05, 5.95, 18, 302.5
Bright Crimson Spinel, https://wotlkdb.com/?spell=39712, 11.0999, 8.9, 19.9999, 224.7
Intricate Eye of Zul, https://wotlkdb.com/?spell=66440, 11, 69, 80, 115.9
Tense Eye of Zul, https://wotlkdb.com/?spell=66438, 10.9, 69, 79.9, 115.8
Radiant Eye of Zul, https://wotlkdb.com/?spell=66441, 10.8, 69, 79.8, 115.7
Shadow Crystal Focusing Lens, https://wotlkdb.com/?spell=56206, 10.7575, 0.65, 11.4075, 1755
Mysterious Dreadstone, https://wotlkdb.com/?spell=66562, 10.7499, 119, 129.7499, 109
Fel Iron Blood Ring, https://wotlkdb.com/?spell=31048, 10.6, 9.4, 20, 212.8
Glinting Pyrestone, https://wotlkdb.com/?spell=39736, 10.0199, 4.98, 14.9999, 301.2
Stormy Majestic Zircon, https://wotlkdb.com/?spell=66499, 10.0001, 139.9999, 150, 107.1
Impassive Skyflare Diamond, https://wotlkdb.com/?spell=55388, 9.7, 74.9, 84.6, 113
Luminous Huge Citrine, https://wotlkdb.com/?spell=53881, 9.05, 1.9, 10.95, 576.3
Defender's Dreadstone, https://wotlkdb.com/?spell=66560, 8.3749, 119, 127.3749, 107
Precise Bloodstone, https://wotlkdb.com/?spell=54017, 8.3599, 1.64, 9.9999, 609.8
Potent Huge Citrine, https://wotlkdb.com/?spell=53882, 8.1, 1.9, 10, 526.3
Veiled Huge Citrine, https://wotlkdb.com/?spell=53883, 8.05, 1.9, 9.95, 523.7
Shifting Shadow Draenite, https://wotlkdb.com/?spell=28933, 7.97, 0.98, 8.95, 913.3
Stoneguard Band, https://wotlkdb.com/?spell=58145, 7.95, 8, 15.95, 199.4
Champion's Ametrine, https://wotlkdb.com/?spell=66579, 7.6073, 229.75, 237.3573, 103.3
Smooth Dawnstone, https://wotlkdb.com/?spell=31097, 7.1782, 2.7718, 9.95, 359
Gleaming Dawnstone, https://wotlkdb.com/?spell=31099, 7.1782, 2.7718, 9.95, 359
Shining Forest Emerald, https://wotlkdb.com/?spell=54004, 7.175, 5.95, 13.125, 220.6
Flashing Bloodstone, https://wotlkdb.com/?spell=53844, 6.86, 1.64, 8.5, 518.3
Rigid Sun Crystal, https://wotlkdb.com/?spell=53854, 6.47, 1.48, 7.95, 537.2
Quick Sun Crystal, https://wotlkdb.com/?spell=53856, 6.47, 1.48, 7.95, 537.2
Austere Earthsiege Diamond, https://wotlkdb.com/?spell=55401, 6.25, 123.75, 130, 105.1
Stormy Chalcedony, https://wotlkdb.com/?spell=53943, 6.05, 14.95, 21, 140.5
Reckless Huge Citrine, https://wotlkdb.com/?spell=53885, 6.02, 1.9, 7.92, 416.8
Wicked Noble Topaz, https://wotlkdb.com/?spell=39471, 5.9088, 2.98, 8.8888, 298.3
Delicate Blood Garnet, https://wotlkdb.com/?spell=28907, 5.75, 1.25, 7, 560
Solid Majestic Zircon, https://wotlkdb.com/?spell=66497, 5.5555, 139.9999, 145.5554, 104
Thick Sun Crystal, https://wotlkdb.com/?spell=53855, 5.52, 1.48, 7, 473
Fractured Bloodstone, https://wotlkdb.com/?spell=53845, 5.36, 1.64, 7, 426.8
Glinting Ametrine, https://wotlkdb.com/?spell=66575, 5.2499, 229.75, 234.9999, 102.3
Delicate Bloodstone, https://wotlkdb.com/?spell=53832, 5.13, 1.64, 6.77, 412.8
Steady Dark Jade, https://wotlkdb.com/?spell=53919, 5, 6, 11, 183.3
Subtle Bloodstone, https://wotlkdb.com/?spell=53843, 4.86, 1.64, 6.5, 396.3
Mysterious Shadow Crystal, https://wotlkdb.com/?spell=53865, 4.35, 0.65, 5, 769.2
Puissant Shadow Crystal, https://wotlkdb.com/?spell=53870, 4.3499, 0.65, 4.9999, 769.2
Bold Bloodstone, https://wotlkdb.com/?spell=53831, 4.31, 1.64, 5.95, 362.8
Bloodstone Band, https://wotlkdb.com/?spell=56193, 4.2, 2.8, 7, 250
Luminous Flame Spessarite, https://wotlkdb.com/?spell=28912, 4, 1, 5, 500
Luminous Noble Topaz, https://wotlkdb.com/?spell=31108, 3.77, 2.98, 6.75, 226.5
Potent Flame Spessarite, https://wotlkdb.com/?spell=28915, 3.69, 1, 4.69, 469
Stark Monarch Topaz, https://wotlkdb.com/?spell=53991, 3.5999, 82.4, 85.9999, 104.4
Runed Blood Garnet, https://wotlkdb.com/?spell=28906, 3.5, 1.25, 4.75, 380
Resolute Huge Citrine, https://wotlkdb.com/?spell=53893, 3.365, 1.9, 5.265, 277.1
Royal Shadow Crystal, https://wotlkdb.com/?spell=53864, 3.35, 0.65, 4, 615.4
Jagged Talasite, https://wotlkdb.com/?spell=31113, 3.2, 2.8, 6, 214.3
Stalwart Huge Citrine, https://wotlkdb.com/?spell=53890, 3.1, 1.9, 5, 263.2
Deadly Huge Citrine, https://wotlkdb.com/?spell=53877, 3.05, 1.9, 4.95, 260.5
Opaque Dark Jade, https://wotlkdb.com/?spell=53929, 3, 6, 9, 150
Guardian's Twilight Opal, https://wotlkdb.com/?spell=53974, 3, 11, 14, 127.3
Fierce Huge Citrine, https://wotlkdb.com/?spell=53876, 2.82, 1.9, 4.72, 248.4
Brilliant Sun Crystal, https://wotlkdb.com/?spell=53852, 2.52, 1.48, 4, 270.3
Runed Bloodstone, https://wotlkdb.com/?spell=53834, 2.2507, 1.64, 3.8907, 237.2
Dazzling Deep Peridot, https://wotlkdb.com/?spell=28924, 2.06, 0.94, 3, 319.1
Purified Shadow Pearl, https://wotlkdb.com/?spell=41429, 1.8092, 1.1808, 2.99, 253.2
Solid Empyrean Sapphire, https://wotlkdb.com/?spell=39715, 1.5556, 4.4444, 6, 135
Sparkling Empyrean Sapphire, https://wotlkdb.com/?spell=39716, 1.5556, 4.4444, 6, 135
Lustrous Empyrean Sapphire, https://wotlkdb.com/?spell=39717, 1.5556, 4.4444, 6, 135
Stormy Empyrean Sapphire, https://wotlkdb.com/?spell=39718, 1.5556, 4.4444, 6, 135
The Aquamarine Ward, https://wotlkdb.com/?spell=26887, 1.3896, 8.48, 9.8696, 116.4
Sovereign Shadow Crystal, https://wotlkdb.com/?spell=53859, 1.3, 0.65, 1.95, 300
Purified Shadow Crystal, https://wotlkdb.com/?spell=53863, 1.2805, 0.65, 1.9305, 297
Mystic Autumn's Glow, https://wotlkdb.com/?spell=53960, 1.125, 110, 111.125, 101
Etched Huge Citrine, https://wotlkdb.com/?spell=53873, 1.0999, 1.9, 2.9999, 157.9
Amulet of Truesight, https://wotlkdb.com/?spell=63743, 1.08, 3.92, 5, 127.6
Pendant of the Agate Shield, https://wotlkdb.com/?spell=25610, 1.02, 4.88, 5.9, 120.9
Inscribed Pyrestone, https://wotlkdb.com/?spell=39733, 1.02, 4.98, 6, 120.5
Potent Pyrestone, https://wotlkdb.com/?spell=39734, 1.02, 4.98, 6, 120.5
Luminous Pyrestone, https://wotlkdb.com/?spell=39735, 1.02, 4.98, 6, 120.5
Veiled Pyrestone, https://wotlkdb.com/?spell=39737, 1.02, 4.98, 6, 120.5
Wicked Pyrestone, https://wotlkdb.com/?spell=39738, 1.02, 4.98, 6, 120.5
Reckless Pyrestone, https://wotlkdb.com/?spell=47055, 1.02, 4.98, 6, 120.5
Enduring Seaspray Emerald, https://wotlkdb.com/?spell=39739, 1, 5, 6, 120
Radiant Seaspray Emerald, https://wotlkdb.com/?spell=39740, 1, 5, 6, 120
Dazzling Seaspray Emerald, https://wotlkdb.com/?spell=39741, 1, 5, 6, 120
Jagged Seaspray Emerald, https://wotlkdb.com/?spell=39742, 1, 5, 6, 120
Relentless Earthsiege Diamond, https://wotlkdb.com/?spell=55400, 1, 123.75, 124.75, 100.8
Guardian's Shadow Crystal, https://wotlkdb.com/?spell=53871, 0.85, 0.65, 1.5, 230.8
Stark Huge Citrine, https://wotlkdb.com/?spell=53889, 0.4755, 1.9, 2.3755, 125
Regal Shadow Crystal, https://wotlkdb.com/?spell=53868, 0.45, 0.65, 1.1, 169.2
Shifting Shadow Crystal, https://wotlkdb.com/?spell=53860, 0.4, 0.65, 1.05, 161.5
Tenuous Shadow Crystal, https://wotlkdb.com/?spell=53861, 0.36, 0.65, 1.01, 155.4
Infused Shadow Crystal, https://wotlkdb.com/?spell=53867, 0.36, 0.65, 1.01, 155.4
Bright Bloodstone, https://wotlkdb.com/?spell=53835, 0.36, 1.64, 2, 122
Glowing Shadow Crystal, https://wotlkdb.com/?spell=53862, 0.34, 0.65, 0.99, 152.3
Deft Huge Citrine, https://wotlkdb.com/?spell=53880, 0.32, 1.9, 2.22, 116.8
Brilliant Dawnstone, https://wotlkdb.com/?spell=31096, 0.2282, 2.7718, 3, 108.2
Rigid Dawnstone, https://wotlkdb.com/?spell=31098, 0.2282, 2.7718, 3, 108.2
Thick Dawnstone, https://wotlkdb.com/?spell=31100, 0.2282, 2.7718, 3, 108.2
Stone of Blades, https://wotlkdb.com/?spell=42591, 0.2282, 2.7718, 3, 108.2
Blood of Amber, https://wotlkdb.com/?spell=42592, 0.2282, 2.7718, 3, 108.2
Facet of Eternity, https://wotlkdb.com/?spell=42593, 0.2282, 2.7718, 3, 108.2
Quick Dawnstone, https://wotlkdb.com/?spell=46403, 0.2282, 2.7718, 3, 108.2
Mithril Filigree, https://wotlkdb.com/?spell=25615, 0.2066, 12.7934, 13, 101.6
Radiant Talasite, https://wotlkdb.com/?spell=31111, 0.2, 2.8, 3, 107.1
Steady Talasite, https://wotlkdb.com/?spell=43493, 0.2, 2.8, 3, 107.1
Forceful Talasite, https://wotlkdb.com/?spell=46405, 0.2, 2.8, 3, 107.1
Balanced Shadow Crystal, https://wotlkdb.com/?spell=53866, 0.16, 0.65, 0.81, 124.6
Glimmering Huge Citrine, https://wotlkdb.com/?spell=53891, 0.1, 1.9, 2, 105.3
Accurate Huge Citrine, https://wotlkdb.com/?spell=53892, 0.1, 1.9, 2, 105.3
Champion's Huge Citrine, https://wotlkdb.com/?spell=53874, 0.08, 1.9, 1.98, 104.2
Inscribed Huge Citrine, https://wotlkdb.com/?spell=53872, 0.05, 1.9, 1.95, 102.6
Sovereign Nightseye, https://wotlkdb.com/?spell=31102, 0.02, 2.98, 3, 100.7
Shifting Nightseye, https://wotlkdb.com/?spell=31103, 0.02, 2.98, 3, 100.7
Glowing Nightseye, https://wotlkdb.com/?spell=31104, 0.02, 2.98, 3, 100.7
Royal Nightseye, https://wotlkdb.com/?spell=31105, 0.02, 2.98, 3, 100.7
Potent Noble Topaz, https://wotlkdb.com/?spell=31107, 0.02, 2.98, 3, 100.7
Veiled Noble Topaz, https://wotlkdb.com/?spell=39470, 0.02, 2.98, 3, 100.7
Reckless Noble Topaz, https://wotlkdb.com/?spell=46404, 0.02, 2.98, 3, 100.7
Regal Nightseye, https://wotlkdb.com/?spell=46803, 0.02, 2.98, 3, 100.7
Lustrous Majestic Zircon, https://wotlkdb.com/?spell=66500, 0.0001, 139.9999, 140, 100
Rough Stone Statue, https://wotlkdb.com/?spell=32259, -0.0023, 0.0048, 0.0025, 52.1
Lustrous Star of Elune, https://wotlkdb.com/?spell=31094, -0.01, 3.01, 3, 99.7
Stormy Star of Elune, https://wotlkdb.com/?spell=31095, -0.01, 3.01, 3, 99.7
Sparkling Star of Elune, https://wotlkdb.com/?spell=31149, -0.01, 3.01, 3, 99.7
Falling Star, https://wotlkdb.com/?spell=42590, -0.01, 3.01, 3, 99.7
Coarse Stone Statue, https://wotlkdb.com/?spell=32801, -0.0338, 0.0488, 0.015, 30.7
Teardrop Blood Garnet, https://wotlkdb.com/?spell=28903, -0.27, 1.25, 0.98, 78.4
Bold Blood Garnet, https://wotlkdb.com/?spell=28905, -0.27, 1.25, 0.98, 78.4
Smooth Sun Crystal, https://wotlkdb.com/?spell=53853, -0.355, 1.48, 1.125, 76
Bright Blood Garnet, https://wotlkdb.com/?spell=34590, -0.36, 1.25, 0.89, 71.2
Dense Stone Statue, https://wotlkdb.com/?spell=32809, -0.402, 0.502, 0.1, 19.9
Enduring Deep Peridot, https://wotlkdb.com/?spell=28918, -0.44, 0.94, 0.5, 53.2
Glowing Shadow Draenite, https://wotlkdb.com/?spell=28925, -0.48, 0.98, 0.5, 51
Inscribed Flame Spessarite, https://wotlkdb.com/?spell=28910, -0.5, 1, 0.5, 50
Radiant Deep Peridot, https://wotlkdb.com/?spell=28916, -0.5649, 0.94, 0.3751, 39.9
Bold Living Ruby, https://wotlkdb.com/?spell=31084, -0.59, 3.59, 3, 83.6
Teardrop Living Ruby, https://wotlkdb.com/?spell=31087, -0.59, 3.59, 3, 83.6
Runed Living Ruby, https://wotlkdb.com/?spell=31088, -0.59, 3.59, 3, 83.6
Bright Living Ruby, https://wotlkdb.com/?spell=31089, -0.59, 3.59, 3, 83.6
Subtle Living Ruby, https://wotlkdb.com/?spell=31090, -0.59, 3.59, 3, 83.6
Flashing Living Ruby, https://wotlkdb.com/?spell=31091, -0.59, 3.59, 3, 83.6
Don Julio's Heart, https://wotlkdb.com/?spell=42558, -0.59, 3.59, 3, 83.6
Kailee's Rose, https://wotlkdb.com/?spell=42588, -0.59, 3.59, 3, 83.6
Crimson Sun, https://wotlkdb.com/?spell=42589, -0.59, 3.59, 3, 83.6
Jagged Deep Peridot, https://wotlkdb.com/?spell=28917, -0.65, 0.94, 0.29, 30.9
Solid Stone Statue, https://wotlkdb.com/?spell=32808, -0.663, 0.763, 0.1, 13.1
Glinting Flame Spessarite, https://wotlkdb.com/?spell=28914, -0.71, 1, 0.29, 29
Royal Shadow Draenite, https://wotlkdb.com/?spell=28927, -0.7168, 0.98, 0.2632, 26.9
Sovereign Shadow Draenite, https://wotlkdb.com/?spell=28936, -0.73, 0.98, 0.25, 25.5
Infused Shadow Draenite, https://wotlkdb.com/?spell=39458, -0.73, 0.98, 0.25, 25.5
Purified Jaggal Pearl, https://wotlkdb.com/?spell=41420, -0.7308, 5.7308, 5, 87.2
Wicked Huge Citrine, https://wotlkdb.com/?spell=53886, -0.775, 1.9, 1.125, 59.2
Pristine Huge Citrine, https://wotlkdb.com/?spell=53887, -0.775, 1.9, 1.125, 59.2
Thundering Skyflare Diamond, https://wotlkdb.com/?spell=55395, -0.9, 74.9, 74, 98.8
Glinting Huge Citrine, https://wotlkdb.com/?spell=53878, -0.91, 1.9, 0.99, 52.1
Timeless Forest Emerald, https://wotlkdb.com/?spell=53995, -0.95, 5.95, 5, 84
Ring of Twilight Shadows, https://wotlkdb.com/?spell=25318, -0.9698, 2.9498, 1.98, 67.1
Enchanted Pearl, https://wotlkdb.com/?spell=56530, -0.98, 2.94, 1.96, 66.7
Runed Scarlet Ruby, https://wotlkdb.com/?spell=53946, -1, 120, 119, 99.2
Solid Bronze Ring, https://wotlkdb.com/?spell=25490, -1.0196, 1.9996, 0.98, 49
