Delicate Living Ruby, https://wotlkdb.com/?spell=31085, -0.82, 3.82, 3, 78.5
Runed Living Ruby, https://wotlkdb.com/?spell=31088, -0.82, 3.82, 3, 78.5
Bright Living Ruby, https://wotlkdb.com/?spell=31089, -0.82, 3.82, 3, 78.5
Subtle Living Ruby, https://wotlkdb.com/?spell=31090, -0.82, 3.82, 3, 78.5
Flashing Living Ruby, https://wotlkdb.com/?spell=31091, -0.82, 3.82, 3, 78.5
Don Julio's Heart, https://wotlkdb.com/?spell=42558, -0.82, 3.82, 3, 78.5
Kailee's Rose, https://wotlkdb.com/?spell=42588, -0.82, 3.82, 3, 78.5
Crimson Sun, https://wotlkdb.com/?spell=42589, -0.82, 3.82, 3, 78.5
Malachite Pendant, https://wotlkdb.com/?spell=32178, -0.9398, 4.28, 3.3402, 78
Sovereign Shadow Draenite, https://wotlkdb.com/?spell=28936, -1.2225, 1.5625, 0.34, 21.8
Stormy Azure Moonstone, https://wotlkdb.com/?spell=28955, -1.24, 1.98, 0.74, 37.4
Truesilver Healing Ring, https://wotlkdb.com/?spell=26885, -1.2498, 2.8198, 1.57, 55.7
Infused Shadow Draenite, https://wotlkdb.com/?spell=39458, -1.3125, 1.5625, 0.25, 16
Empowered Huge Citrine, https://wotlkdb.com/?spell=53888, -1.4399, 1.9399, 0.5, 25.8
Turbid Dark Jade, https://wotlkdb.com/?spell=53924, -1.45, 5.45, 4, 73.4
Energized Dark Jade, https://wotlkdb.com/?spell=53930, -1.45, 5.45, 4, 73.4
Shattered Dark Jade, https://wotlkdb.com/?spell=53933, -1.45, 5.45, 4, 73.4
Enchanted Pearl, https://wotlkdb.com/?spell=56530, -1.5, 2.5, 1, 40
Solid Azure Moonstone, https://wotlkdb.com/?spell=28950, -1.53, 1.98, 0.45, 22.7
Sparkling Azure Moonstone, https://wotlkdb.com/?spell=28953, -1.5801, 1.98, 0.3999, 20.2
Inscribed Flame Spessarite, https://wotlkdb.com/?spell=28910, -1.59, 1.98, 0.39, 19.7
Glinting Flame Spessarite, https://wotlkdb.com/?spell=28914, -1.6144, 1.98, 0.3656, 18.5
Luminous Flame Spessarite, https://wotlkdb.com/?spell=28912, -1.73, 1.98, 0.25, 12.6
Lustrous Azure Moonstone, https://wotlkdb.com/?spell=28957, -1.73, 1.98, 0.25, 12.6
Forceful Seaspray Emerald, https://wotlkdb.com/?spell=47053, -2, 5, 3, 60
Steady Seaspray Emerald, https://wotlkdb.com/?spell=47054, -2, 5, 3, 60
Tigerseye Band, https://wotlkdb.com/?spell=32179, -2.06, 3.06, 1, 32.7
Stark Monarch Topaz, https://wotlkdb.com/?spell=53991, -2.1236, 79, 76.8764, 97.3
Purified Jaggal Pearl, https://wotlkdb.com/?spell=41420, -2.1745, 7.73, 5.5555, 71.9
Azure Moonstone Ring, https://wotlkdb.com/?spell=31050, -2.1787, 7.9499, 5.7712, 72.6
Primal Stone Statue, https://wotlkdb.com/?spell=32810, -2.2, 2.6, 0.4, 15.4
Aquamarine Signet, https://wotlkdb.com/?spell=26874, -2.22, 7.22, 5, 69.3
Ornate Tigerseye Necklace, https://wotlkdb.com/?spell=26928, -2.78, 6.78, 4, 59
Dark Jade Focusing Lens, https://wotlkdb.com/?spell=56205, -3.07, 5.45, 2.38, 43.7
Sparkling Sky Sapphire, https://wotlkdb.com/?spell=53953, -3.3, 7.8, 4.5, 57.7
Simple Pearl Ring, https://wotlkdb.com/?spell=25284, -3.3024, 7.2624, 3.96, 54.5
Braided Copper Ring, https://wotlkdb.com/?spell=25493, -3.4, 4.6, 1.2, 26.1
Forceful Dark Jade, https://wotlkdb.com/?spell=53920, -3.45, 5.45, 2, 36.7
Radiant Dark Jade, https://wotlkdb.com/?spell=53931, -3.6501, 5.45, 1.7999, 33
Ring of Twilight Shadows, https://wotlkdb.com/?spell=25318, -3.8, 5.24, 1.44, 27.5
Brilliant Golden Draenite, https://wotlkdb.com/?spell=28938, -3.8999, 4.8999, 1, 20.4
Gleaming Golden Draenite, https://wotlkdb.com/?spell=28944, -3.8999, 4.8999, 1, 20.4
Lambent Dark Jade, https://wotlkdb.com/?spell=53928, -3.97, 5.45, 1.48, 27.2
Amulet of the Moon, https://wotlkdb.com/?spell=25339, -3.987, 4.1405, 0.1535, 3.7
Rigid Golden Draenite, https://wotlkdb.com/?spell=28948, -3.9999, 4.8999, 0.9, 18.4
Pendant of the Agate Shield, https://wotlkdb.com/?spell=25610, -4.0139, 5.9939, 1.98, 33
Smooth Golden Draenite, https://wotlkdb.com/?spell=34069, -4.1499, 4.8999, 0.75, 15.3
Solid Bronze Ring, https://wotlkdb.com/?spell=25490, -4.28, 6, 1.72, 28.7
Shadow Jade Focusing Lens, https://wotlkdb.com/?spell=56208, -4.34, 6.09, 1.75, 28.7
Thick Golden Draenite, https://wotlkdb.com/?spell=28947, -4.3999, 4.8999, 0.5, 10.2
Timeless Dark Jade, https://wotlkdb.com/?spell=53894, -4.45, 5.45, 1, 18.3
Intricate Dark Jade, https://wotlkdb.com/?spell=53925, -4.45, 5.45, 1, 18.3
Enduring Dark Jade, https://wotlkdb.com/?spell=53918, -4.46, 5.45, 0.99, 18.2
Deadly Monarch Topaz, https://wotlkdb.com/?spell=53979, -4.55, 79, 74.45, 94.2
Quick Autumn's Glow, https://wotlkdb.com/?spell=53961, -4.75, 114.75, 110, 95.9
Sundered Dark Jade, https://wotlkdb.com/?spell=53927, -4.94, 5.45, 0.51, 9.4
Jagged Dark Jade, https://wotlkdb.com/?spell=53916, -4.95, 5.45, 0.5, 9.2
Dazzling Dark Jade, https://wotlkdb.com/?spell=53926, -4.95, 5.45, 0.5, 9.2
Woven Copper Ring, https://wotlkdb.com/?spell=26925, -5.0598, 6.08, 1.0202, 16.8
Inlaid Malachite Ring, https://wotlkdb.com/?spell=25283, -5.92, 6.92, 1, 14.5
Sparkling Majestic Zircon, https://wotlkdb.com/?spell=66498, -6, 134.9999, 128.9999, 95.6
Stormy Chalcedony, https://wotlkdb.com/?spell=53943, -6.645, 11.625, 4.98, 42.8
Precise Scarlet Ruby, https://wotlkdb.com/?spell=53951, -6.75, 129.75, 123, 94.8
Bright Crimson Spinel, https://wotlkdb.com/?spell=39712, -6.95, 12.95, 6, 46.3
Subtle Crimson Spinel, https://wotlkdb.com/?spell=39713, -6.95, 12.95, 6, 46.3
Flashing Crimson Spinel, https://wotlkdb.com/?spell=39714, -6.95, 12.95, 6, 46.3
Lustrous Majestic Zircon, https://wotlkdb.com/?spell=66500, -6.9999, 134.9999, 128, 94.8
Solid Empyrean Sapphire, https://wotlkdb.com/?spell=39715, -7, 13, 6, 46.2
Sparkling Empyrean Sapphire, https://wotlkdb.com/?spell=39716, -7, 13, 6, 46.2
Lustrous Empyrean Sapphire, https://wotlkdb.com/?spell=39717, -7, 13, 6, 46.2
Stormy Empyrean Sapphire, https://wotlkdb.com/?spell=39718, -7, 13, 6, 46.2
Heavy Stone Statue, https://wotlkdb.com/?spell=32807, -7.78, 7.84, 0.06, 0.8
Elegant Silver Ring, https://wotlkdb.com/?spell=25280, -7.95, 9.95, 2, 20.1
Citrine Ring of Rapid Healing, https://wotlkdb.com/?spell=25621, -8.0136, 9.5286, 1.515, 15.9
Purified Dreadstone, https://wotlkdb.com/?spell=66556, -8.5, 113, 104.5, 92.5
Solid Chalcedony, https://wotlkdb.com/?spell=53934, -8.625, 11.625, 3, 25.8
Figurine - Golden Hare, https://wotlkdb.com/?spell=26873, -8.7072, 8.8572, 0.15, 1.7
Jade Ring of Slaying, https://wotlkdb.com/?spell=58144, -9.2333, 14.2333, 5, 35.1
Austere Earthsiege Diamond, https://wotlkdb.com/?spell=55401, -9.375, 116.375, 107, 91.9
Heavy Copper Ring, https://wotlkdb.com/?spell=26926, -9.52, 10.52, 1, 9.5
Golden Dragon Ring, https://wotlkdb.com/?spell=25613, -9.6, 12.6, 3, 23.8
Sparkling Chalcedony, https://wotlkdb.com/?spell=53940, -9.625, 11.625, 2, 17.2
Gloom Band, https://wotlkdb.com/?spell=25287, -9.6825, 10.8625, 1.18, 10.9
Heavy Jade Ring, https://wotlkdb.com/?spell=36524, -10.291, 11.3925, 1.1015, 9.7
Lustrous Chalcedony, https://wotlkdb.com/?spell=53941, -10.625, 11.625, 1, 8.6
Heavy Silver Ring, https://wotlkdb.com/?spell=25305, -10.953, 25.9529, 14.9999, 57.8
Insightful Earthsiege Diamond, https://wotlkdb.com/?spell=55396, -11.375, 116.375, 105, 90.2
Sapphire Pendant of Winter Night, https://wotlkdb.com/?spell=26908, -11.7199, 15.7199, 4, 25.4
Etched Monarch Topaz, https://wotlkdb.com/?spell=53976, -12.3334, 79, 66.6666, 84.4
Mystic Autumn's Glow, https://wotlkdb.com/?spell=53960, -14.7501, 114.75, 99.9999, 87.1
Jade Pendant of Blasting, https://wotlkdb.com/?spell=25618, -16.6667, 28, 11.3333, 40.5
Tenuous Dreadstone, https://wotlkdb.com/?spell=66565, -17, 113, 96, 85
Infused Dreadstone, https://wotlkdb.com/?spell=66564, -17.1, 113, 95.9, 84.9
Ring of Silver Might, https://wotlkdb.com/?spell=25317, -17.34, 19.9, 2.56, 12.9
Beaming Earthsiege Diamond, https://wotlkdb.com/?spell=55405, -17.8982, 116.375, 98.4768, 84.6
Shadowmight Ring, https://wotlkdb.com/?spell=58146, -18.3333, 33.3333, 15, 45
Engraved Truesilver Ring, https://wotlkdb.com/?spell=25620, -20.9099, 22.4099, 1.5, 6.7
Onslaught Ring, https://wotlkdb.com/?spell=26907, -22.0498, 32.8998, 10.85, 33
Red Ring of Destruction, https://wotlkdb.com/?spell=36525, -23.4999, 25.9999, 2.5, 9.6
Ruby Pendant of Fire, https://wotlkdb.com/?spell=26883, -24.0699, 25.9999, 1.93, 7.4
Simple Opal Ring, https://wotlkdb.com/?spell=26902, -26.7599, 27.9999, 1.24, 4.4
Destructive Skyflare Diamond, https://wotlkdb.com/?spell=55390, -28.5, 49.4, 20.9, 42.3
Durable Monarch Topaz, https://wotlkdb.com/?spell=53986, -29.0001, 79, 49.9999, 63.3
Aquamarine Pendant of the Warrior, https://wotlkdb.com/?spell=26876, -31.5, 34.5, 3, 8.7
Figurine - Truesilver Crab, https://wotlkdb.com/?spell=26881, -32.5096, 32.6596, 0.15, 0.5
Stalwart Monarch Topaz, https://wotlkdb.com/?spell=53992, -35.56, 79, 43.44, 55
Silver Rose Pendant, https://wotlkdb.com/?spell=25614, -35.6387, 35.9164, 0.2777, 0.8
Scarlet Signet, https://wotlkdb.com/?spell=64728, -35.75, 235.75, 200, 84.8
Bracing Earthsiege Diamond, https://wotlkdb.com/?spell=55397, -36.375, 116.375, 80, 68.7
Truesilver Commander's Ring, https://wotlkdb.com/?spell=34959, -39.0869, 48.0869, 9, 18.7
Resolute Monarch Topaz, https://wotlkdb.com/?spell=54023, -40.1, 79, 38.9, 49.2
Tireless Skyflare Diamond, https://wotlkdb.com/?spell=55386, -40.4, 49.4, 9, 18.2
Diamond Focus Ring, https://wotlkdb.com/?spell=36526, -42.3874, 44.8999, 2.5125, 5.6
Figurine - Black Pearl Panther, https://wotlkdb.com/?spell=26875, -42.57, 42.72, 0.15, 0.4
Swift Skyflare Diamond, https://wotlkdb.com/?spell=55394, -43.4, 49.4, 6, 12.1
Titanium Impact Band, https://wotlkdb.com/?spell=56496, -43.6, 1133.1, 1089.5, 96.2
Necklace of the Deep, https://wotlkdb.com/?spell=40514, -44.2797, 69.2797, 25, 36.1
Champion's Monarch Topaz, https://wotlkdb.com/?spell=53977, -45.1, 79, 33.9, 42.9
Deft Monarch Topaz, https://wotlkdb.com/?spell=53982, -45.6667, 79, 33.3333, 42.2
Figurine - Ruby Serpent, https://wotlkdb.com/?spell=26900, -45.736, 45.886, 0.15, 0.3
Brilliant Pearl Band, https://wotlkdb.com/?spell=41414, -46.96, 61.96, 15, 24.2
Brilliant Autumn's Glow, https://wotlkdb.com/?spell=53956, -47.75, 114.75, 67, 58.4
Figurine - Truesilver Boar, https://wotlkdb.com/?spell=26882, -52.2854, 52.4354, 0.15, 0.3
Ring of Arcane Shielding, https://wotlkdb.com/?spell=37855, -61.56, 161.56, 100, 61.9
Bright Scarlet Ruby, https://wotlkdb.com/?spell=53947, -63.75, 129.75, 66, 50.9
Pristine Monarch Topaz, https://wotlkdb.com/?spell=53989, -69, 79, 10, 12.7
Figurine - Crimson Serpent, https://wotlkdb.com/?spell=46777, -70.24, 71.74, 1.5, 2.1
Powerful Earthsiege Diamond, https://wotlkdb.com/?spell=55399, -71.375, 116.375, 45, 38.7
Eternal Earthsiege Diamond, https://wotlkdb.com/?spell=55398, -71.495, 116.375, 44.88, 38.6
Figurine - Jade Owl, https://wotlkdb.com/?spell=26872, -73.2698, 73.4198, 0.15, 0.2
Thick Autumn's Glow, https://wotlkdb.com/?spell=53959, -74.75, 114.75, 40, 34.9
Glowing Thorium Band, https://wotlkdb.com/?spell=34960, -75.7999, 85.7999, 10, 11.7
Thick Adamantite Necklace, https://wotlkdb.com/?spell=31051, -87.75, 112.75, 25, 22.2
Emerald Lion Ring, https://wotlkdb.com/?spell=34961, -89.7998, 99.7997, 9.9999, 10
Figurine - Living Ruby Serpent, https://wotlkdb.com/?spell=31081, -89.815, 91.315, 1.5, 1.6
Figurine - Talasite Owl, https://wotlkdb.com/?spell=31082, -90.22, 91.72, 1.5, 1.6
Bracing Earthstorm Diamond, https://wotlkdb.com/?spell=32867, -96, 99, 3, 3
Tenacious Earthstorm Diamond, https://wotlkdb.com/?spell=32868, -96, 99, 3, 3
Brutal Earthstorm Diamond, https://wotlkdb.com/?spell=32869, -96, 99, 3, 3
Insightful Earthstorm Diamond, https://wotlkdb.com/?spell=32870, -96, 99, 3, 3
Relentless Earthstorm Diamond, https://wotlkdb.com/?spell=39961, -96, 99, 3, 3
Eternal Earthstorm Diamond, https://wotlkdb.com/?spell=46597, -96, 99, 3, 3
Heavy Adamantite Ring, https://wotlkdb.com/?spell=31052, -96.375, 106.375, 10, 9.4
Persistent Earthsiege Diamond, https://wotlkdb.com/?spell=55402, -106.425, 116.375, 9.95, 8.5
Bold Dragon's Eye, https://wotlkdb.com/?spell=56049, -113.625, 114.75, 1.125, 1
Delicate Dragon's Eye, https://wotlkdb.com/?spell=56052, -113.625, 114.75, 1.125, 1
Runed Dragon's Eye, https://wotlkdb.com/?spell=56053, -113.625, 114.75, 1.125, 1
Bright Dragon's Eye, https://wotlkdb.com/?spell=56054, -113.625, 114.75, 1.125, 1
Subtle Dragon's Eye, https://wotlkdb.com/?spell=56055, -113.625, 114.75, 1.125, 1
Flashing Dragon's Eye, https://wotlkdb.com/?spell=56056, -113.625, 114.75, 1.125, 1
Brilliant Dragon's Eye, https://wotlkdb.com/?spell=56074, -113.625, 114.75, 1.125, 1
Fractured Dragon's Eye, https://wotlkdb.com/?spell=56076, -113.625, 114.75, 1.125, 1
Lustrous Dragon's Eye, https://wotlkdb.com/?spell=56077, -113.625, 114.75, 1.125, 1
Mystic Dragon's Eye, https://wotlkdb.com/?spell=56079, -113.625, 114.75, 1.125, 1
Precise Dragon's Eye, https://wotlkdb.com/?spell=56081, -113.625, 114.75, 1.125, 1
Quick Dragon's Eye, https://wotlkdb.com/?spell=56083, -113.625, 114.75, 1.125, 1
Rigid Dragon's Eye, https://wotlkdb.com/?spell=56084, -113.625, 114.75, 1.125, 1
Smooth Dragon's Eye, https://wotlkdb.com/?spell=56085, -113.625, 114.75, 1.125, 1
Solid Dragon's Eye, https://wotlkdb.com/?spell=56086, -113.625, 114.75, 1.125, 1
Sparkling Dragon's Eye, https://wotlkdb.com/?spell=56087, -113.625, 114.75, 1.125, 1
Stormy Dragon's Eye, https://wotlkdb.com/?spell=56088, -113.625, 114.75, 1.125, 1
Thick Dragon's Eye, https://wotlkdb.com/?spell=56089, -113.625, 114.75, 1.125, 1
Sapphire Owl, https://wotlkdb.com/?spell=56202, -118.0592, 126.1099, 8.0507, 6.4
Destructive Skyfire Diamond, https://wotlkdb.com/?spell=32871, -126.75, 129.75, 3, 2.3
Swift Skyfire Diamond, https://wotlkdb.com/?spell=32873, -126.75, 129.75, 3, 2.3
Enigmatic Skyfire Diamond, https://wotlkdb.com/?spell=32874, -126.75, 129.75, 3, 2.3
Thundering Skyfire Diamond, https://wotlkdb.com/?spell=39963, -126.75, 129.75, 3, 2.3
Chaotic Skyfire Diamond, https://wotlkdb.com/?spell=44794, -126.75, 129.75, 3, 2.3
Ember Skyfire Diamond, https://wotlkdb.com/?spell=46601, -126.75, 129.75, 3, 2.3
Living Emerald Pendant, https://wotlkdb.com/?spell=26911, -128.6291, 129.8794, 1.2503, 1
Twilight Serpent, https://wotlkdb.com/?spell=56201, -186.7493, 194.8, 8.0507, 4.1
Pendant of Withering, https://wotlkdb.com/?spell=31064, -187.508, 191.455, 3.947, 2.1
Pendant of Shadow's End, https://wotlkdb.com/?spell=31065, -190.448, 194.395, 3.947, 2
Figurine - Shadowsong Panther, https://wotlkdb.com/?spell=46778, -199.8138, 201.3138, 1.5, 0.7
Figurine - Seaspray Albatross, https://wotlkdb.com/?spell=46779, -199.94, 201.44, 1.5, 0.7
Emerald Boar, https://wotlkdb.com/?spell=56203, -236.7191, 244.7698, 8.0507, 3.3
Monarch Crab, https://wotlkdb.com/?spell=59759, -260.4592, 268.5099, 8.0507, 3
The Black Pearl, https://wotlkdb.com/?spell=41415, -275.275, 400.5, 125.225, 31.3
Necklace of the Diamond Tower, https://wotlkdb.com/?spell=26915, -279.278, 281.7998, 2.5218, 0.9
Figurine - Nightseye Panther, https://wotlkdb.com/?spell=31083, -280.48, 281.98, 1.5, 0.5
Pendant of Thawing, https://wotlkdb.com/?spell=31063, -283.1876, 287.1346, 3.947, 1.4
Titanium Impact Choker, https://wotlkdb.com/?spell=56499, -298.9001, 1398.9, 1099.9999, 78.6
Braided Eternium Chain, https://wotlkdb.com/?spell=31070, -306.013, 309.96, 3.947, 1.3
Figurine - Dark Iron Scorpid, https://wotlkdb.com/?spell=26914, -306.5, 308, 1.5, 0.5
Embrace of the Dawn, https://wotlkdb.com/?spell=31072, -319.1598, 419.7598, 100.6, 24
Pendant of the Null Rune, https://wotlkdb.com/?spell=31066, -328.328, 332.275, 3.947, 1.2
Pendant of Frozen Flame, https://wotlkdb.com/?spell=31062, -332.6674, 336.6144, 3.947, 1.2
Figurine - Felsteel Boar, https://wotlkdb.com/?spell=31079, -333.9, 335.1, 1.2, 0.4
Figurine - Emerald Owl, https://wotlkdb.com/?spell=26909, -334.9244, 335.2994, 0.375, 0.1
Thick Felsteel Necklace, https://wotlkdb.com/?spell=31067, -376.7628, 380.675, 3.9122, 1
Blazing Eternium Band, https://wotlkdb.com/?spell=31061, -408.9782, 412.96, 3.9818, 1
Ruby Hare, https://wotlkdb.com/?spell=56199, -472.1993, 480.25, 8.0507, 1.7
Figurine - Black Diamond Crab, https://wotlkdb.com/?spell=26912, -503.958, 505.458, 1.5, 0.3
Figurine - Dawnstone Crab, https://wotlkdb.com/?spell=31080, -521.9606, 523.4606, 1.5, 0.3
Arcanite Sword Pendant, https://wotlkdb.com/?spell=26918, -538.8086, 541.4, 2.5914, 0.5
Khorium Band of Shadows, https://wotlkdb.com/?spell=31053, -547.5925, 551.47, 3.8775, 0.7
Living Ruby Pendant, https://wotlkdb.com/?spell=31068, -599.9078, 603.82, 3.9122, 0.6
Amulet of Flowing Life, https://wotlkdb.com/?spell=46126, -621.1645, 630, 8.8355, 1.4
Khorium Inferno Band, https://wotlkdb.com/?spell=31055, -648.3378, 652.25, 3.9122, 0.6
Khorium Band of Leaves, https://wotlkdb.com/?spell=31056, -651.933, 655.88, 3.947, 0.6
Arcane Khorium Band, https://wotlkdb.com/?spell=31057, -702.8682, 706.85, 3.9818, 0.6
Khorium Band of Frost, https://wotlkdb.com/?spell=31054, -722.5575, 726.4697, 3.9122, 0.5
Figurine - Khorium Boar, https://wotlkdb.com/?spell=46776, -1029.6, 1030.8, 1.2, 0.1
Figurine - Empyrean Tortoise, https://wotlkdb.com/?spell=46775, -1036.083, 1037.583, 1.5, 0.1
Pendant of Sunfire, https://wotlkdb.com/?spell=46125, -1269.0145, 1277.85, 8.8355, 0.7
Crown of the Sea Witch, https://wotlkdb.com/?spell=41418, -2028.8243, 2031.5, 2.6757, 0.1
Ring of Flowing Life, https://wotlkdb.com/?spell=46123, -4458.174, 4464.1996, 6.0256, 0.1
Hard Khorium Choker, https://wotlkdb.com/?spell=46127, -4808.3539, 4817.1894, 8.8355, 0.2
Loop of Forged Power, https://wotlkdb.com/?spell=46122, -5018.974, 5024.9996, 6.0256, 0.1
Hard Khorium Band, https://wotlkdb.com/?spell=46124, -5318.974, 5324.9996, 6.0256, 0.1
