Name, Link, Profit, Cost, Sell, ROI %
Brutal Earthstorm Diamond, https://wotlkdb.com/?spell=32869, 3468.8433, 150, 3618.8433, 2412.6
Ring of Scarlet Shadows, https://wotlkdb.com/?spell=58148, 579.0401, 309.4599, 888.5, 287.1
Titanium Earthguard Chain, https://wotlkdb.com/?spell=56500, 524.04, 729.96, 1254, 171.8
Savage Titanium Band, https://wotlkdb.com/?spell=58507, 511.3337, 570.92, 1082.2537, 189.6
Gem Studded Band, https://wotlkdb.com/?spell=26896, 489.4952, 29.314, 518.8092, 1769.8
Ring of Earthen Might, https://wotlkdb.com/?spell=58147, 411.6437, 113.46, 525.1037, 462.8
Titanium Frostguard Ring, https://wotlkdb.com/?spell=58954, 406.8435, 475.16, 882.0035, 185.6
Savage Titanium Ring, https://wotlkdb.com/?spell=58492, 392.08, 570.92, 963, 168.7
Ruby Crown of Restoration, https://wotlkdb.com/?spell=26878, 391.032, 104.232, 495.264, 475.2
Powerful Earthstorm Diamond, https://wotlkdb.com/?spell=32866, 350, 150, 500, 333.3
Citrine Pendant of Golden Healing, https://wotlkdb.com/?spell=25622, 346.1, 9.3, 355.4, 3821.5
Titanium Earthguard Ring, https://wotlkdb.com/?spell=56497, 311.04, 685.96, 997, 145.3
Ring of Northern Tears, https://wotlkdb.com/?spell=58150, 303.72, 118.28, 422, 356.8
Titanium Impact Band, https://wotlkdb.com/?spell=56496, 288.09, 1081.96, 1370.05, 126.6
Titanium Spellshock Ring, https://wotlkdb.com/?spell=56498, 243.3288, 785.56, 1028.8888, 131
Titanium Impact Choker, https://wotlkdb.com/?spell=56499, 239.04, 1359.96, 1599, 117.6
Titanium Spellshock Necklace, https://wotlkdb.com/?spell=56501, 233.64, 843.36, 1077, 127.7
Bold Crimson Spinel, https://wotlkdb.com/?spell=39705, 227, 6, 233, 3883.3
Windfire Band, https://wotlkdb.com/?spell=58149, 199.8237, 322.46, 522.2837, 162
Sky Sapphire Amulet, https://wotlkdb.com/?spell=64726, 135.415, 130.96, 266.375, 203.4
Trenchant Earthsiege Diamond, https://wotlkdb.com/?spell=55403, 110.4999, 123.5, 233.9999, 189.5
Forlorn Skyflare Diamond, https://wotlkdb.com/?spell=55387, 92.75, 72, 164.75, 228.8
Lambent Eye of Zul, https://wotlkdb.com/?spell=66439, 92.4375, 69, 161.4375, 234
Forceful Eye of Zul, https://wotlkdb.com/?spell=66434, 88.5375, 69, 157.5375, 228.3
Bronze Band of Force, https://wotlkdb.com/?spell=37818, 88.0052, 12.2448, 100.25, 818.7
Effulgent Skyflare Diamond, https://wotlkdb.com/?spell=55384, 81.65, 72, 153.65, 213.4
Emerald Choker, https://wotlkdb.com/?spell=64725, 81.42, 73.58, 155, 210.7
Enigmatic Skyflare Diamond, https://wotlkdb.com/?spell=55393, 80.9999, 72, 152.9999, 212.5
Shining Eye of Zul, https://wotlkdb.com/?spell=66437, 79.75, 69, 148.75, 215.6
Radiant Eye of Zul, https://wotlkdb.com/?spell=66441, 79, 69, 148, 214.5
Nightmare Tear, https://wotlkdb.com/?spell=68253, 75.3749, 115.625, 190.9999, 165.2
Necklace of the Deep, https://wotlkdb.com/?spell=40514, 74.2222, 13.7778, 88, 638.7
Royal Twilight Opal, https://wotlkdb.com/?spell=53967, 73.2499, 8, 81.2499, 1015.6
Golden Ring of Power, https://wotlkdb.com/?spell=34955, 72.384, 16.456, 88.84, 539.9
Shifting Twilight Opal, https://wotlkdb.com/?spell=53963, 72, 8, 80, 1000
Precise Cardinal Ruby, https://wotlkdb.com/?spell=66450, 70.75, 240, 310.75, 129.5
Tenuous Dreadstone, https://wotlkdb.com/?spell=66565, 70.0278, 122.2222, 192.25, 157.3
Timeless Eye of Zul, https://wotlkdb.com/?spell=66432, 69.2562, 69, 138.2562, 200.4
Jagged Forest Emerald, https://wotlkdb.com/?spell=53996, 68.0538, 6.95, 75.0038, 1079.2
Guardian's Twilight Opal, https://wotlkdb.com/?spell=53974, 67, 8, 75, 937.5
Tense Eye of Zul, https://wotlkdb.com/?spell=66438, 66.9999, 69, 135.9999, 197.1
Radiant Forest Emerald, https://wotlkdb.com/?spell=54012, 66.4, 6.95, 73.35, 1055.4
Revitalizing Skyflare Diamond, https://wotlkdb.com/?spell=55407, 65.75, 72, 137.75, 191.3
Turbid Eye of Zul, https://wotlkdb.com/?spell=66445, 64.5, 69, 133.5, 193.5
Vivid Eye of Zul, https://wotlkdb.com/?spell=66429, 64, 69, 133, 192.8
Opaque Eye of Zul, https://wotlkdb.com/?spell=66444, 63.9907, 69, 132.9907, 192.7
Sundered Eye of Zul, https://wotlkdb.com/?spell=66436, 63.2, 69, 132.2, 191.6
Energized Forest Emerald, https://wotlkdb.com/?spell=54011, 62.98, 6.95, 69.93, 1006.2
Infused Dreadstone, https://wotlkdb.com/?spell=66564, 62.5278, 122.2222, 184.75, 151.2
Puissant Twilight Opal, https://wotlkdb.com/?spell=53973, 62.1, 8, 70.1, 876.3
Forceful Forest Emerald, https://wotlkdb.com/?spell=54001, 61.0499, 6.95, 67.9999, 978.4
Thick King's Amber, https://wotlkdb.com/?spell=66504, 61, 229.75, 290.75, 126.6
Band of Natural Fire, https://wotlkdb.com/?spell=26916, 60.768, 9.232, 70, 758.2
Misty Eye of Zul, https://wotlkdb.com/?spell=66435, 60.75, 69, 129.75, 188
Jagged Eye of Zul, https://wotlkdb.com/?spell=66431, 60, 69, 129, 187
Lucent Ametrine, https://wotlkdb.com/?spell=66585, 59.5, 200, 259.5, 129.8
Subtle Cardinal Ruby, https://wotlkdb.com/?spell=66452, 59.375, 240, 299.375, 124.7
Stark Ametrine, https://wotlkdb.com/?spell=66587, 58.25, 200, 258.25, 129.1
Lustrous Sky Sapphire, https://wotlkdb.com/?spell=53954, 57.15, 12.75, 69.9, 548.2
Infused Nightseye, https://wotlkdb.com/?spell=39462, 56.98, 3.02, 60, 1986.8
Glowing Twilight Opal, https://wotlkdb.com/?spell=53965, 52.9999, 8, 60.9999, 762.5
Steady Forest Emerald, https://wotlkdb.com/?spell=54000, 52.05, 6.95, 59, 848.9
Fierce Ametrine, https://wotlkdb.com/?spell=66583, 52, 200, 252, 126
Steady Eye of Zul, https://wotlkdb.com/?spell=66428, 50.5, 69, 119.5, 173.2
Jade Dagger Pendant, https://wotlkdb.com/?spell=56195, 49.9249, 20.075, 69.9999, 348.7
Energized Eye of Zul, https://wotlkdb.com/?spell=66442, 47.7499, 69, 116.7499, 169.2
Delicate Living Ruby, https://wotlkdb.com/?spell=31085, 47.6432, 3, 50.6432, 1688.1
Runed Mana Band, https://wotlkdb.com/?spell=64727, 47.54, 121.46, 169, 139.1
Luminous Ametrine, https://wotlkdb.com/?spell=66566, 47, 200, 247, 123.5
Opaque Forest Emerald, https://wotlkdb.com/?spell=54010, 46.95, 6.95, 53.9, 775.5
Blood Sun Necklace, https://wotlkdb.com/?spell=56196, 44.2801, 25.5199, 69.8, 273.5
Royal Dreadstone, https://wotlkdb.com/?spell=66558, 43.7778, 122.2222, 166, 135.8
Shattered Eye of Zul, https://wotlkdb.com/?spell=66443, 43.7499, 69, 112.7499, 163.4
Veiled Monarch Topaz, https://wotlkdb.com/?spell=53985, 42.75, 72, 114.75, 159.4
Mercurial Adamantite, https://wotlkdb.com/?spell=38068, 42, 83, 125, 150.6
Enduring Eye of Zul, https://wotlkdb.com/?spell=66338, 41, 69, 110, 159.4
Regal Dreadstone, https://wotlkdb.com/?spell=66559, 40.7778, 122.2222, 163, 133.4
Runed Cardinal Ruby, https://wotlkdb.com/?spell=66446, 40, 240, 280, 116.7
Glinting Ametrine, https://wotlkdb.com/?spell=66575, 39.75, 200, 239.75, 119.9
Bright Cardinal Ruby, https://wotlkdb.com/?spell=66449, 39.75, 240, 279.75, 116.6
Accurate Ametrine, https://wotlkdb.com/?spell=66576, 39.5, 200, 239.5, 119.8
Fractured Scarlet Ruby, https://wotlkdb.com/?spell=53950, 39.0001, 110.9999, 150, 135.1
Etched Ametrine, https://wotlkdb.com/?spell=66572, 38.9999, 200, 238.9999, 119.5
Lambent Forest Emerald, https://wotlkdb.com/?spell=54009, 38.05, 6.95, 45, 647.5
Mysterious Twilight Opal, https://wotlkdb.com/?spell=53968, 38, 8, 46, 575
Dazzling Eye of Zul, https://wotlkdb.com/?spell=66430, 37.8799, 69, 106.8799, 154.9
Deadly Monarch Topaz, https://wotlkdb.com/?spell=53979, 37.75, 72, 109.75, 152.4
Infused Twilight Opal, https://wotlkdb.com/?spell=53970, 37, 8, 45, 562.5
Runed Blood Garnet, https://wotlkdb.com/?spell=28906, 36.02, 0.98, 37, 3775.5
Inscribed Noble Topaz, https://wotlkdb.com/?spell=31106, 34.165, 2.96, 37.125, 1254.2
Flashing Scarlet Ruby, https://wotlkdb.com/?spell=53949, 34.0001, 110.9999, 145, 130.6
Defender's Twilight Opal, https://wotlkdb.com/?spell=53972, 34, 8, 42, 525
Accurate Monarch Topaz, https://wotlkdb.com/?spell=53994, 33.9, 72, 105.9, 147.1
Reckless Monarch Topaz, https://wotlkdb.com/?spell=53987, 33.55, 72, 105.55, 146.6
Enduring Talasite, https://wotlkdb.com/?spell=31110, 33, 2, 35, 1750
Wicked Ametrine, https://wotlkdb.com/?spell=66577, 33, 200, 233, 116.5
Seer's Forest Emerald, https://wotlkdb.com/?spell=54002, 32.85, 6.95, 39.8, 572.7
Vivid Forest Emerald, https://wotlkdb.com/?spell=53997, 32.05, 6.95, 39, 561.2
Blazing Citrine Ring, https://wotlkdb.com/?spell=25617, 31.5963, 19.36, 50.9563, 263.2
Ember Skyflare Diamond, https://wotlkdb.com/?spell=55392, 31.5, 72, 103.5, 143.8
Mystic Sun Crystal, https://wotlkdb.com/?spell=53857, 30.5, 1.5, 32, 2133.3
Sovereign Twilight Opal, https://wotlkdb.com/?spell=53962, 30, 8, 38, 475
Veiled Ametrine, https://wotlkdb.com/?spell=66570, 30, 200, 230, 115
Bold Cardinal Ruby, https://wotlkdb.com/?spell=66447, 30, 240, 270, 112.5
Seer's Eye of Zul, https://wotlkdb.com/?spell=66433, 29.9, 69, 98.9, 143.3
Resplendent Ametrine, https://wotlkdb.com/?spell=66582, 29.76, 200, 229.76, 114.9
Delicate Scarlet Ruby, https://wotlkdb.com/?spell=53945, 29.5751, 110.9999, 140.575, 126.6
Bold Scarlet Ruby, https://wotlkdb.com/?spell=53830, 29, 110.9999, 139.9999, 126.1
Resolute Ametrine, https://wotlkdb.com/?spell=66586, 28.9562, 200, 228.9562, 114.5
Tense Forest Emerald, https://wotlkdb.com/?spell=54013, 28.05, 6.95, 35, 503.6
Chaotic Skyflare Diamond, https://wotlkdb.com/?spell=55389, 28, 72, 100, 138.9
Inscribed Ametrine, https://wotlkdb.com/?spell=66567, 28, 200, 228, 114
Potent Ametrine, https://wotlkdb.com/?spell=66569, 28, 200, 228, 114
Durable Ametrine, https://wotlkdb.com/?spell=66571, 28, 200, 228, 114
Empowered Ametrine, https://wotlkdb.com/?spell=66580, 27.75, 200, 227.75, 113.9
Potent Monarch Topaz, https://wotlkdb.com/?spell=53984, 27.5, 72, 99.5, 138.2
Enduring Forest Emerald, https://wotlkdb.com/?spell=53998, 27.05, 6.95, 34, 489.2
Tenuous Twilight Opal, https://wotlkdb.com/?spell=53964, 26.6999, 8, 34.6999, 433.7
Defender's Shadow Crystal, https://wotlkdb.com/?spell=53869, 26.2876, 0.62, 26.9076, 4339.9
Guardian's Dreadstone, https://wotlkdb.com/?spell=66561, 26.2776, 122.2222, 148.4998, 121.5
Glinting Monarch Topaz, https://wotlkdb.com/?spell=53980, 26, 72, 98, 136.1
Fractured Cardinal Ruby, https://wotlkdb.com/?spell=66451, 26, 240, 266, 110.8
Sparkling Majestic Zircon, https://wotlkdb.com/?spell=66498, 25.7499, 140, 165.7499, 118.4
Glimmering Ametrine, https://wotlkdb.com/?spell=66578, 25, 200, 225, 112.5
Rigid Autumn's Glow, https://wotlkdb.com/?spell=53958, 24.5, 119.75, 144.25, 120.5
Purified Twilight Opal, https://wotlkdb.com/?spell=53966, 24, 8, 32, 400
Inscribed Monarch Topaz, https://wotlkdb.com/?spell=53975, 23.75, 72, 95.75, 133
Solid Sky Sapphire, https://wotlkdb.com/?spell=53952, 23.25, 12.75, 36, 282.4
Shattered Forest Emerald, https://wotlkdb.com/?spell=54014, 23.05, 6.95, 30, 431.7
Crystal Chalcedony Amulet, https://wotlkdb.com/?spell=58142, 22.7901, 17.1099, 39.9, 233.2
Sundered Forest Emerald, https://wotlkdb.com/?spell=54008, 21.85, 6.95, 28.8, 414.4
Stormy Sky Sapphire, https://wotlkdb.com/?spell=53955, 21.85, 12.75, 34.6, 271.4
Glowing Dreadstone, https://wotlkdb.com/?spell=66555, 21.6528, 122.2222, 143.875, 117.7
Insightful Earthsiege Diamond, https://wotlkdb.com/?spell=55396, 21.5, 123.5, 145, 117.4
Invigorating Earthsiege Diamond, https://wotlkdb.com/?spell=55404, 21.5, 123.5, 145, 117.4
Durable Huge Citrine, https://wotlkdb.com/?spell=53884, 21.4264, 1.1, 22.5264, 2047.9
Wicked Moonstone Ring, https://wotlkdb.com/?spell=25323, 21.0945, 28.9055, 50, 173
Intricate Eye of Zul, https://wotlkdb.com/?spell=66440, 20.9999, 69, 89.9999, 130.4
Resplendent Huge Citrine, https://wotlkdb.com/?spell=53875, 20.9, 1.1, 22, 2000
Lucent Huge Citrine, https://wotlkdb.com/?spell=53879, 20.9, 1.1, 22, 2000
Thundering Skyflare Diamond, https://wotlkdb.com/?spell=55395, 20.8999, 72, 92.8999, 129
Balanced Dreadstone, https://wotlkdb.com/?spell=66553, 20.7778, 122.2222, 143, 117
Delicate Cardinal Ruby, https://wotlkdb.com/?spell=66448, 20.44, 240, 260.44, 108.5
Runed Scarlet Ruby, https://wotlkdb.com/?spell=53946, 20.0001, 110.9999, 131, 118
Mysterious Shadow Crystal, https://wotlkdb.com/?spell=53865, 19.38, 0.62, 20, 3225.8
Reckless Ametrine, https://wotlkdb.com/?spell=66574, 19.1999, 200, 219.1999, 109.6
Delicate Blood Garnet, https://wotlkdb.com/?spell=28907, 19.02, 0.98, 20, 2040.8
Lustrous Majestic Zircon, https://wotlkdb.com/?spell=66500, 19, 140, 159, 113.6
Empowered Huge Citrine, https://wotlkdb.com/?spell=53888, 18.9, 1.1, 20, 1818.2
Crystal Citrine Necklace, https://wotlkdb.com/?spell=58141, 18.49, 1.46, 19.95, 1366.4
Luminous Flame Spessarite, https://wotlkdb.com/?spell=28912, 18.128, 1.872, 20, 1068.4
Intricate Forest Emerald, https://wotlkdb.com/?spell=54006, 18.05, 6.95, 25, 359.7
Impassive Skyflare Diamond, https://wotlkdb.com/?spell=55388, 18, 72, 90, 125
Stormy Majestic Zircon, https://wotlkdb.com/?spell=66499, 18, 140, 158, 112.9
Luminous Monarch Topaz, https://wotlkdb.com/?spell=53983, 17, 72, 89, 123.6
Puissant Dreadstone, https://wotlkdb.com/?spell=66563, 16.7778, 122.2222, 139, 113.7
Pristine Ametrine, https://wotlkdb.com/?spell=66573, 16.4999, 200, 216.4999, 108.2
Quick Autumn's Glow, https://wotlkdb.com/?spell=53961, 16.25, 119.75, 136, 113.6
Regal Twilight Opal, https://wotlkdb.com/?spell=53971, 15.9, 8, 23.9, 298.8
Purified Dreadstone, https://wotlkdb.com/?spell=66556, 15.7778, 122.2222, 138, 112.9
Shattered Dark Jade, https://wotlkdb.com/?spell=53933, 15.0625, 6.9375, 22, 317.1
Deadly Ametrine, https://wotlkdb.com/?spell=66568, 15, 200, 215, 107.5
Rigid King's Amber, https://wotlkdb.com/?spell=66501, 14.75, 229.75, 244.5, 106.4
Sun Rock Ring, https://wotlkdb.com/?spell=56194, 14.715, 1.86, 16.575, 891.1
Shining Forest Emerald, https://wotlkdb.com/?spell=54004, 14.175, 6.95, 21.125, 304
Subtle Scarlet Ruby, https://wotlkdb.com/?spell=53948, 14.0001, 110.9999, 125, 112.6
Bright Crimson Spinel, https://wotlkdb.com/?spell=39712, 13.9999, 6, 19.9999, 333.3
Seer's Dark Jade, https://wotlkdb.com/?spell=53921, 13.0625, 6.9375, 20, 288.3
Turbid Forest Emerald, https://wotlkdb.com/?spell=54005, 13.05, 6.95, 20, 287.8
Stalwart Ametrine, https://wotlkdb.com/?spell=66581, 13, 200, 213, 106.5
Defender's Dreadstone, https://wotlkdb.com/?spell=66560, 12.7778, 122.2222, 135, 110.5
Azure Moonstone Ring, https://wotlkdb.com/?spell=31050, 12.5767, 8.3233, 20.9, 251.1
Glinting Pyrestone, https://wotlkdb.com/?spell=39736, 11.9999, 3, 14.9999, 500
Truesilver Commander's Ring, https://wotlkdb.com/?spell=34959, 11.139, 49.611, 60.75, 122.5
Smooth King's Amber, https://wotlkdb.com/?spell=66502, 10.2499, 229.75, 239.9999, 104.5
Empowered Monarch Topaz, https://wotlkdb.com/?spell=53990, 10, 72, 82, 113.9
Solid Majestic Zircon, https://wotlkdb.com/?spell=66497, 10, 140, 150, 107.1
Resolute Huge Citrine, https://wotlkdb.com/?spell=53893, 9.675, 1.1, 10.775, 979.5
Enchanted Tear, https://wotlkdb.com/?spell=56531, 9.1725, 10.8275, 20, 184.7
The Aquamarine Ward, https://wotlkdb.com/?spell=26887, 8.8421, 6.45, 15.2921, 237.1
Smooth Dawnstone, https://wotlkdb.com/?spell=31097, 8.41, 1.54, 9.95, 646.1
Gleaming Dawnstone, https://wotlkdb.com/?spell=31099, 8.41, 1.54, 9.95, 646.1
Champion's Ametrine, https://wotlkdb.com/?spell=66579, 8, 200, 208, 104
Deft Ametrine, https://wotlkdb.com/?spell=66584, 8, 200, 208, 104
Quick King's Amber, https://wotlkdb.com/?spell=66506, 8, 229.75, 237.75, 103.5
Bloodstone Band, https://wotlkdb.com/?spell=56193, 7.845, 2.13, 9.975, 468.3
Shifting Dreadstone, https://wotlkdb.com/?spell=66557, 7.7776, 122.2222, 129.9998, 106.4
Dream Signet, https://wotlkdb.com/?spell=56197, 7.57, 78.43, 86, 109.7
Golden Draenite Ring, https://wotlkdb.com/?spell=31049, 7.5167, 18.4833, 26, 140.7
Stoneguard Band, https://wotlkdb.com/?spell=58145, 7, 8, 15, 187.5
Sovereign Dreadstone, https://wotlkdb.com/?spell=66554, 6.7778, 122.2222, 129, 105.5
Misty Forest Emerald, https://wotlkdb.com/?spell=54003, 5.0499, 6.95, 11.9999, 172.7
Stormy Chalcedony, https://wotlkdb.com/?spell=53943, 4.2501, 16.7499, 21, 125.4
Steady Dark Jade, https://wotlkdb.com/?spell=53919, 4.0625, 6.9375, 11, 158.6
Purified Shadow Pearl, https://wotlkdb.com/?spell=41429, 4.0222, 0.9778, 5, 511.4
Jagged Talasite, https://wotlkdb.com/?spell=31113, 4, 2, 6, 300
Reckless Huge Citrine, https://wotlkdb.com/?spell=53885, 3.9, 1.1, 5, 454.5
Potent Huge Citrine, https://wotlkdb.com/?spell=53882, 3.88, 1.1, 4.98, 452.7
Deadly Huge Citrine, https://wotlkdb.com/?spell=53877, 3.85, 1.1, 4.95, 450
Luminous Noble Topaz, https://wotlkdb.com/?spell=31108, 3.79, 2.96, 6.75, 228
Luminous Huge Citrine, https://wotlkdb.com/?spell=53881, 3.6775, 1.1, 4.7775, 434.3
Purified Jaggal Pearl, https://wotlkdb.com/?spell=41420, 3.5505, 1.5, 5.0505, 336.7
Rigid Sun Crystal, https://wotlkdb.com/?spell=53854, 3.48, 1.5, 4.98, 332
Brilliant Sun Crystal, https://wotlkdb.com/?spell=53852, 3.45, 1.5, 4.95, 330
Smooth Sun Crystal, https://wotlkdb.com/?spell=53853, 3.4, 1.5, 4.9, 326.7
Shadow Crystal Focusing Lens, https://wotlkdb.com/?spell=56206, 3.38, 0.62, 4, 645.2
Precise Bloodstone, https://wotlkdb.com/?spell=54017, 3.23, 1.77, 5, 282.5
Subtle Bloodstone, https://wotlkdb.com/?spell=53843, 3.19, 1.77, 4.96, 280.2
Fractured Bloodstone, https://wotlkdb.com/?spell=53845, 3.18, 1.77, 4.95, 279.7
Royal Shadow Crystal, https://wotlkdb.com/?spell=53864, 3.13, 0.62, 3.75, 604.8
Sovereign Shadow Crystal, https://wotlkdb.com/?spell=53859, 3.06, 0.62, 3.68, 593.5
Inscribed Pyrestone, https://wotlkdb.com/?spell=39733, 3, 3, 6, 200
Potent Pyrestone, https://wotlkdb.com/?spell=39734, 3, 3, 6, 200
Luminous Pyrestone, https://wotlkdb.com/?spell=39735, 3, 3, 6, 200
Veiled Pyrestone, https://wotlkdb.com/?spell=39737, 3, 3, 6, 200
Wicked Pyrestone, https://wotlkdb.com/?spell=39738, 3, 3, 6, 200
Reckless Pyrestone, https://wotlkdb.com/?spell=47055, 3, 3, 6, 200
Mithril Filigree, https://wotlkdb.com/?spell=25615, 3, 13.9, 16.9, 121.6
Resolute Monarch Topaz, https://wotlkdb.com/?spell=54023, 3, 72, 75, 104.2
Veiled Huge Citrine, https://wotlkdb.com/?spell=53883, 2.9, 1.1, 4, 363.6
Fierce Huge Citrine, https://wotlkdb.com/?spell=53876, 2.89, 1.1, 3.99, 362.7
Stark Monarch Topaz, https://wotlkdb.com/?spell=53991, 2.8, 72, 74.8, 103.9
Delicate Bloodstone, https://wotlkdb.com/?spell=53832, 2.78, 1.77, 4.55, 257.1
Inscribed Huge Citrine, https://wotlkdb.com/?spell=53872, 2.7, 1.1, 3.8, 345.5
Fel Iron Blood Ring, https://wotlkdb.com/?spell=31048, 2.6067, 6.2933, 8.9, 141.4
Quick Sun Crystal, https://wotlkdb.com/?spell=53856, 2.5, 1.5, 4, 266.7
Stalwart Huge Citrine, https://wotlkdb.com/?spell=53890, 2.45, 1.1, 3.55, 322.7
Puissant Shadow Crystal, https://wotlkdb.com/?spell=53870, 2.3798, 0.62, 2.9998, 483.8
Glowing Shadow Crystal, https://wotlkdb.com/?spell=53862, 2.3099, 0.62, 2.9299, 472.6
Bold Bloodstone, https://wotlkdb.com/?spell=53831, 2.21, 1.77, 3.98, 224.9
Runed Bloodstone, https://wotlkdb.com/?spell=53834, 2.12, 1.77, 3.89, 219.8
Opaque Dark Jade, https://wotlkdb.com/?spell=53929, 2.0625, 6.9375, 9, 129.7
Dazzling Deep Peridot, https://wotlkdb.com/?spell=28924, 2, 1, 3, 300
Brilliant Dawnstone, https://wotlkdb.com/?spell=31096, 1.46, 1.54, 3, 194.8
Rigid Dawnstone, https://wotlkdb.com/?spell=31098, 1.46, 1.54, 3, 194.8
Thick Dawnstone, https://wotlkdb.com/?spell=31100, 1.46, 1.54, 3, 194.8
Mystic Dawnstone, https://wotlkdb.com/?spell=31101, 1.46, 1.54, 3, 194.8
Stone of Blades, https://wotlkdb.com/?spell=42591, 1.46, 1.54, 3, 194.8
Blood of Amber, https://wotlkdb.com/?spell=42592, 1.46, 1.54, 3, 194.8
Facet of Eternity, https://wotlkdb.com/?spell=42593, 1.46, 1.54, 3, 194.8
Quick Dawnstone, https://wotlkdb.com/?spell=46403, 1.46, 1.54, 3, 194.8
Solid Empyrean Sapphire, https://wotlkdb.com/?spell=39715, 1.4, 4.6, 6, 130.4
Sparkling Empyrean Sapphire, https://wotlkdb.com/?spell=39716, 1.4, 4.6, 6, 130.4
Lustrous Empyrean Sapphire, https://wotlkdb.com/?spell=39717, 1.4, 4.6, 6, 130.4
Stormy Empyrean Sapphire, https://wotlkdb.com/?spell=39718, 1.4, 4.6, 6, 130.4
Purified Shadow Crystal, https://wotlkdb.com/?spell=53863, 1.3799, 0.62, 1.9999, 322.6
Infused Shadow Crystal, https://wotlkdb.com/?spell=53867, 1.37, 0.62, 1.99, 321
Shifting Shadow Crystal, https://wotlkdb.com/?spell=53860, 1.36, 0.62, 1.98, 319.4
Enchanted Pearl, https://wotlkdb.com/?spell=56530, 1.25, 2.73, 3.98, 145.8
Bright Bloodstone, https://wotlkdb.com/?spell=53835, 1.23, 1.77, 3, 169.5
Flashing Bloodstone, https://wotlkdb.com/?spell=53844, 1.23, 1.77, 3, 169.5
Enduring Seaspray Emerald, https://wotlkdb.com/?spell=39739, 1.125, 4.875, 6, 123.1
Radiant Seaspray Emerald, https://wotlkdb.com/?spell=39740, 1.125, 4.875, 6, 123.1
Dazzling Seaspray Emerald, https://wotlkdb.com/?spell=39741, 1.125, 4.875, 6, 123.1
Jagged Seaspray Emerald, https://wotlkdb.com/?spell=39742, 1.125, 4.875, 6, 123.1
Deft Huge Citrine, https://wotlkdb.com/?spell=53880, 1.12, 1.1, 2.22, 201.8
Radiant Talasite, https://wotlkdb.com/?spell=31111, 1, 2, 3, 150
Dazzling Talasite, https://wotlkdb.com/?spell=31112, 1, 2, 3, 150
Steady Talasite, https://wotlkdb.com/?spell=43493, 1, 2, 3, 150
Forceful Talasite, https://wotlkdb.com/?spell=46405, 1, 2, 3, 150
Brilliant Lionseye, https://wotlkdb.com/?spell=39719, 1, 5, 6, 120
Smooth Lionseye, https://wotlkdb.com/?spell=39720, 1, 5, 6, 120
Rigid Lionseye, https://wotlkdb.com/?spell=39721, 1, 5, 6, 120
Gleaming Lionseye, https://wotlkdb.com/?spell=39722, 1, 5, 6, 120
Thick Lionseye, https://wotlkdb.com/?spell=39723, 1, 5, 6, 120
Mystic Lionseye, https://wotlkdb.com/?spell=39724, 1, 5, 6, 120
Great Lionseye, https://wotlkdb.com/?spell=39725, 1, 5, 6, 120
Quick Lionseye, https://wotlkdb.com/?spell=47056, 1, 5, 6, 120
Timeless Forest Emerald, https://wotlkdb.com/?spell=53995, 1, 6.95, 7.95, 114.4
Pristine Huge Citrine, https://wotlkdb.com/?spell=53887, 0.88, 1.1, 1.98, 180
Glinting Huge Citrine, https://wotlkdb.com/?spell=53878, 0.8399, 1.1, 1.9399, 176.4
Accurate Huge Citrine, https://wotlkdb.com/?spell=53892, 0.82, 1.1, 1.92, 174.5
Glimmering Huge Citrine, https://wotlkdb.com/?spell=53891, 0.79, 1.1, 1.89, 171.8
Thick Sun Crystal, https://wotlkdb.com/?spell=53855, 0.5, 1.5, 2, 133.3
Wicked Huge Citrine, https://wotlkdb.com/?spell=53886, 0.45, 1.1, 1.55, 140.9
Truesilver Healing Ring, https://wotlkdb.com/?spell=26885, 0.406, 2.594, 3, 115.7
Tenuous Shadow Crystal, https://wotlkdb.com/?spell=53861, 0.39, 0.62, 1.01, 162.9
Regal Shadow Crystal, https://wotlkdb.com/?spell=53868, 0.37, 0.62, 0.99, 159.7
Champion's Huge Citrine, https://wotlkdb.com/?spell=53874, 0.3399, 1.1, 1.4399, 130.9
Guardian's Shadow Crystal, https://wotlkdb.com/?spell=53871, 0.33, 0.62, 0.95, 153.2
Etched Huge Citrine, https://wotlkdb.com/?spell=53873, 0.3, 1.1, 1.4, 127.3
Stark Huge Citrine, https://wotlkdb.com/?spell=53889, 0.3, 1.1, 1.4, 127.3
Mystic King's Amber, https://wotlkdb.com/?spell=66505, 0.2499, 229.75, 229.9999, 100.1
Balanced Shadow Crystal, https://wotlkdb.com/?spell=53866, 0.2088, 0.62, 0.8288, 133.7
Wicked Noble Topaz, https://wotlkdb.com/?spell=39471, 0.1979, 2.96, 3.1579, 106.7
Potent Flame Spessarite, https://wotlkdb.com/?spell=28915, 0.128, 1.872, 2, 106.8
Potent Noble Topaz, https://wotlkdb.com/?spell=31107, 0.04, 2.96, 3, 101.4
Glinting Noble Topaz, https://wotlkdb.com/?spell=31109, 0.04, 2.96, 3, 101.4
Veiled Noble Topaz, https://wotlkdb.com/?spell=39470, 0.04, 2.96, 3, 101.4
Reckless Noble Topaz, https://wotlkdb.com/?spell=46404, 0.04, 2.96, 3, 101.4
Teardrop Blood Garnet, https://wotlkdb.com/?spell=28903, 0.02, 0.98, 1, 102
Lustrous Star of Elune, https://wotlkdb.com/?spell=31094, 0.02, 2.98, 3, 100.7
Stormy Star of Elune, https://wotlkdb.com/?spell=31095, 0.02, 2.98, 3, 100.7
Sparkling Star of Elune, https://wotlkdb.com/?spell=31149, 0.02, 2.98, 3, 100.7
Falling Star, https://wotlkdb.com/?spell=42590, 0.02, 2.98, 3, 100.7
Bold Blood Garnet, https://wotlkdb.com/?spell=28905, 0.01, 0.98, 0.99, 101
Bright Blood Garnet, https://wotlkdb.com/?spell=34590, 0, 0.98, 0.98, 100
Bold Living Ruby, https://wotlkdb.com/?spell=31084, 0, 3, 3, 100
Teardrop Living Ruby, https://wotlkdb.com/?spell=31087, 0, 3, 3, 100
Runed Living Ruby, https://wotlkdb.com/?spell=31088, 0, 3, 3, 100
Bright Living Ruby, https://wotlkdb.com/?spell=31089, 0, 3, 3, 100
Subtle Living Ruby, https://wotlkdb.com/?spell=31090, 0, 3, 3, 100
Flashing Living Ruby, https://wotlkdb.com/?spell=31091, 0, 3, 3, 100
Don Julio's Heart, https://wotlkdb.com/?spell=42558, 0, 3, 3, 100
Kailee's Rose, https://wotlkdb.com/?spell=42588, 0, 3, 3, 100
Crimson Sun, https://wotlkdb.com/?spell=42589, 0, 3, 3, 100
Delicate Crimson Spinel, https://wotlkdb.com/?spell=39706, 0, 6, 6, 100
Teardrop Crimson Spinel, https://wotlkdb.com/?spell=39710, 0, 6, 6, 100
Runed Crimson Spinel, https://wotlkdb.com/?spell=39711, 0, 6, 6, 100
Subtle Crimson Spinel, https://wotlkdb.com/?spell=39713, 0, 6, 6, 100
Flashing Crimson Spinel, https://wotlkdb.com/?spell=39714, 0, 6, 6, 100
Rough Stone Statue, https://wotlkdb.com/?spell=32259, -0.0063, 0.0088, 0.0025, 28.4
Sovereign Nightseye, https://wotlkdb.com/?spell=31102, -0.02, 3.02, 3, 99.3
Shifting Nightseye, https://wotlkdb.com/?spell=31103, -0.02, 3.02, 3, 99.3
Glowing Nightseye, https://wotlkdb.com/?spell=31104, -0.02, 3.02, 3, 99.3
Royal Nightseye, https://wotlkdb.com/?spell=31105, -0.02, 3.02, 3, 99.3
Regal Nightseye, https://wotlkdb.com/?spell=46803, -0.02, 3.02, 3, 99.3
Coarse Stone Statue, https://wotlkdb.com/?spell=32801, -0.1426, 0.1576, 0.015, 9.5
Solid Stone Statue, https://wotlkdb.com/?spell=32808, -0.2, 0.3, 0.1, 33.3
Dense Stone Statue, https://wotlkdb.com/?spell=32809, -0.373, 0.473, 0.1, 21.1
Amulet of Truesight, https://wotlkdb.com/?spell=63743, -0.496, 2.376, 1.88, 79.1
Enduring Deep Peridot, https://wotlkdb.com/?spell=28918, -0.5, 1, 0.5, 50
Radiant Deep Peridot, https://wotlkdb.com/?spell=28916, -0.6, 1, 0.4, 40
Sovereign Shadowsong Amethyst, https://wotlkdb.com/?spell=39727, -0.625, 6.625, 6, 90.6
Shifting Shadowsong Amethyst, https://wotlkdb.com/?spell=39728, -0.625, 6.625, 6, 90.6
Balanced Shadowsong Amethyst, https://wotlkdb.com/?spell=39729, -0.625, 6.625, 6, 90.6
Infused Shadowsong Amethyst, https://wotlkdb.com/?spell=39730, -0.625, 6.625, 6, 90.6
Glowing Shadowsong Amethyst, https://wotlkdb.com/?spell=39731, -0.625, 6.625, 6, 90.6
