Ring of Twilight Shadows, https://wotlkdb.com/?spell=25318, -1.37, 4.28, 2.91, 68
Enchanted Pearl, https://wotlkdb.com/?spell=56530, -1.5, 2.5, 1, 40
Earthshadow Ring, https://wotlkdb.com/?spell=58143, -1.6495, 5.73, 4.0805, 71.2
Sovereign Shadow Draenite, https://wotlkdb.com/?spell=28936, -1.66, 2, 0.34, 17
Shining Dark Jade, https://wotlkdb.com/?spell=53923, -1.6667, 5, 3.3333, 66.7
Infused Shadow Draenite, https://wotlkdb.com/?spell=39458, -1.75, 2, 0.25, 12.5
Relentless Earthsiege Diamond, https://wotlkdb.com/?spell=55400, -1.805, 119.795, 117.99, 98.5
Tense Dark Jade, https://wotlkdb.com/?spell=53932, -2, 5, 3, 60
Shattered Dark Jade, https://wotlkdb.com/?spell=53933, -2, 5, 3, 60
Brilliant Lionseye, https://wotlkdb.com/?spell=39719, -2, 8, 6, 75
Smooth Lionseye, https://wotlkdb.com/?spell=39720, -2, 8, 6, 75
Rigid Lionseye, https://wotlkdb.com/?spell=39721, -2, 8, 6, 75
Gleaming Lionseye, https://wotlkdb.com/?spell=39722, -2, 8, 6, 75
Thick Lionseye, https://wotlkdb.com/?spell=39723, -2, 8, 6, 75
Mystic Lionseye, https://wotlkdb.com/?spell=39724, -2, 8, 6, 75
Great Lionseye, https://wotlkdb.com/?spell=39725, -2, 8, 6, 75
Quick Lionseye, https://wotlkdb.com/?spell=47056, -2, 8, 6, 75
Primal Stone Statue, https://wotlkdb.com/?spell=32810, -2.2, 2.6, 0.4, 15.4
Inscribed Flame Spessarite, https://wotlkdb.com/?spell=28910, -2.2925, 2.5625, 0.27, 10.5
Luminous Flame Spessarite, https://wotlkdb.com/?spell=28912, -2.3125, 2.5625, 0.25, 9.8
Glinting Flame Spessarite, https://wotlkdb.com/?spell=28914, -2.3125, 2.5625, 0.25, 9.8
Forceful Seaspray Emerald, https://wotlkdb.com/?spell=47053, -2.9763, 5.9763, 3, 50.2
Steady Seaspray Emerald, https://wotlkdb.com/?spell=47054, -2.9763, 5.9763, 3, 50.2
Bright Crimson Spinel, https://wotlkdb.com/?spell=39712, -2.9999, 8.9999, 6, 66.7
Subtle Crimson Spinel, https://wotlkdb.com/?spell=39713, -2.9999, 8.9999, 6, 66.7
Flashing Crimson Spinel, https://wotlkdb.com/?spell=39714, -2.9999, 8.9999, 6, 66.7
Forceful Dark Jade, https://wotlkdb.com/?spell=53920, -3, 5, 2, 40
Radiant Dark Jade, https://wotlkdb.com/?spell=53931, -3, 5, 2, 40
Solid Empyrean Sapphire, https://wotlkdb.com/?spell=39715, -3, 9, 6, 66.7
Sparkling Empyrean Sapphire, https://wotlkdb.com/?spell=39716, -3, 9, 6, 66.7
Lustrous Empyrean Sapphire, https://wotlkdb.com/?spell=39717, -3, 9, 6, 66.7
Stormy Empyrean Sapphire, https://wotlkdb.com/?spell=39718, -3, 9, 6, 66.7
Inscribed Pyrestone, https://wotlkdb.com/?spell=39733, -3, 9, 6, 66.7
Potent Pyrestone, https://wotlkdb.com/?spell=39734, -3, 9, 6, 66.7
Luminous Pyrestone, https://wotlkdb.com/?spell=39735, -3, 9, 6, 66.7
Glinting Pyrestone, https://wotlkdb.com/?spell=39736, -3, 9, 6, 66.7
Veiled Pyrestone, https://wotlkdb.com/?spell=39737, -3, 9, 6, 66.7
Wicked Pyrestone, https://wotlkdb.com/?spell=39738, -3, 9, 6, 66.7
Reckless Pyrestone, https://wotlkdb.com/?spell=47055, -3, 9, 6, 66.7
Solid Bronze Ring, https://wotlkdb.com/?spell=25490, -3.04, 4.08, 1.04, 25.5
Stark Monarch Topaz, https://wotlkdb.com/?spell=53991, -3.1236, 80, 76.8764, 96.1
Braided Copper Ring, https://wotlkdb.com/?spell=25493, -3.4, 4.6, 1.2, 26.1
Solid Azure Moonstone, https://wotlkdb.com/?spell=28950, -3.48, 3.88, 0.4, 10.3
Stormy Azure Moonstone, https://wotlkdb.com/?spell=28955, -3.49, 3.88, 0.39, 10.1
Lambent Dark Jade, https://wotlkdb.com/?spell=53928, -3.52, 5, 1.48, 29.6
Sparkling Azure Moonstone, https://wotlkdb.com/?spell=28953, -3.58, 3.88, 0.3, 7.7
Lustrous Azure Moonstone, https://wotlkdb.com/?spell=28957, -3.63, 3.88, 0.25, 6.4
Shadow Jade Focusing Lens, https://wotlkdb.com/?spell=56208, -3.84, 5.59, 1.75, 31.3
Timeless Dark Jade, https://wotlkdb.com/?spell=53894, -4, 5, 1, 20
Intricate Dark Jade, https://wotlkdb.com/?spell=53925, -4, 5, 1, 20
Enduring Dark Jade, https://wotlkdb.com/?spell=53918, -4.01, 5, 0.99, 19.8
Sundered Dark Jade, https://wotlkdb.com/?spell=53927, -4.49, 5, 0.51, 10.2
Jagged Dark Jade, https://wotlkdb.com/?spell=53916, -4.5, 5, 0.5, 10
Dazzling Dark Jade, https://wotlkdb.com/?spell=53926, -4.5, 5, 0.5, 10
Aquamarine Signet, https://wotlkdb.com/?spell=26874, -4.5, 9.5, 5, 52.6
Ornate Tigerseye Necklace, https://wotlkdb.com/?spell=26928, -4.76, 8.76, 4, 45.7
Woven Copper Ring, https://wotlkdb.com/?spell=26925, -4.84, 6.84, 2, 29.2
Mystic Autumn's Glow, https://wotlkdb.com/?spell=53960, -5, 100, 95, 95
Emerald Choker, https://wotlkdb.com/?spell=64725, -5.4, 65.4, 60, 91.7
Amulet of the Moon, https://wotlkdb.com/?spell=25339, -5.5145, 5.668, 0.1535, 2.7
Pendant of the Agate Shield, https://wotlkdb.com/?spell=25610, -5.57, 7.55, 1.98, 26.2
Azure Moonstone Ring, https://wotlkdb.com/?spell=31050, -5.9788, 11.75, 5.7712, 49.1
Citrine Ring of Rapid Healing, https://wotlkdb.com/?spell=25621, -6.04, 8, 1.96, 24.5
Simple Pearl Ring, https://wotlkdb.com/?spell=25284, -6.304, 10.264, 3.96, 38.6
Inlaid Malachite Ring, https://wotlkdb.com/?spell=25283, -6.36, 8.36, 2, 23.9
Stormy Chalcedony, https://wotlkdb.com/?spell=53943, -6.645, 11.625, 4.98, 42.8
Heavy Stone Statue, https://wotlkdb.com/?spell=32807, -7.78, 7.84, 0.06, 0.8
Elegant Silver Ring, https://wotlkdb.com/?spell=25280, -7.95, 9.95, 2, 20.1
Figurine - Golden Hare, https://wotlkdb.com/?spell=26873, -8.21, 8.36, 0.15, 1.8
Solid Chalcedony, https://wotlkdb.com/?spell=53934, -8.625, 11.625, 3, 25.8
Truesilver Commander's Ring, https://wotlkdb.com/?spell=34959, -8.69, 36.69, 28, 76.3
Brilliant Golden Draenite, https://wotlkdb.com/?spell=28938, -8.7403, 9.7403, 1, 10.3
Gleaming Golden Draenite, https://wotlkdb.com/?spell=28944, -8.7403, 9.7403, 1, 10.3
Thick Golden Draenite, https://wotlkdb.com/?spell=28947, -8.7503, 9.7403, 0.99, 10.2
Smooth Golden Draenite, https://wotlkdb.com/?spell=34069, -8.7503, 9.7403, 0.99, 10.2
Golden Draenite Ring, https://wotlkdb.com/?spell=31049, -8.9602, 22.4706, 13.5104, 60.1
Potent Monarch Topaz, https://wotlkdb.com/?spell=53984, -9.1236, 80, 70.8764, 88.6
Gloom Band, https://wotlkdb.com/?spell=25287, -9.39, 12.39, 3, 24.2
Rigid Golden Draenite, https://wotlkdb.com/?spell=28948, -9.4103, 9.7403, 0.33, 3.4
Jade Ring of Slaying, https://wotlkdb.com/?spell=58144, -9.55, 14.55, 5, 34.4
Sparkling Chalcedony, https://wotlkdb.com/?spell=53940, -9.625, 11.625, 2, 17.2
Golden Dragon Ring, https://wotlkdb.com/?spell=25613, -9.85, 12.72, 2.87, 22.6
Lustrous Chalcedony, https://wotlkdb.com/?spell=53941, -10.625, 11.625, 1, 8.6
Sparkling Sky Sapphire, https://wotlkdb.com/?spell=53953, -11.5, 16, 4.5, 28.1
Heavy Jade Ring, https://wotlkdb.com/?spell=36524, -11.8185, 12.92, 1.1015, 8.5
Brilliant Autumn's Glow, https://wotlkdb.com/?spell=53956, -12, 100, 88, 88
Heavy Copper Ring, https://wotlkdb.com/?spell=26926, -12.56, 13.56, 1, 7.4
Ring of Silver Might, https://wotlkdb.com/?spell=25317, -15.7914, 19.9, 4.1086, 20.6
Sapphire Pendant of Winter Night, https://wotlkdb.com/?spell=26908, -15.9999, 20.9999, 5, 23.8
Heavy Silver Ring, https://wotlkdb.com/?spell=25305, -16.069, 27.509, 11.44, 41.6
Red Ring of Destruction, https://wotlkdb.com/?spell=36525, -18, 20.9999, 2.9999, 14.3
Ruby Pendant of Fire, https://wotlkdb.com/?spell=26883, -19.0199, 20.9999, 1.98, 9.4
Jade Pendant of Blasting, https://wotlkdb.com/?spell=25618, -20.6667, 32, 11.3333, 35.4
Eternal Earthsiege Diamond, https://wotlkdb.com/?spell=55398, -21.395, 119.795, 98.4, 82.1
Onslaught Ring, https://wotlkdb.com/?spell=26907, -21.4999, 30.4999, 9, 29.5
Shadowmight Ring, https://wotlkdb.com/?spell=58146, -23.5499, 38.5499, 15, 38.9
Simple Opal Ring, https://wotlkdb.com/?spell=26902, -24.0399, 25.9999, 1.96, 7.5
Engraved Truesilver Ring, https://wotlkdb.com/?spell=25620, -24.23, 26.23, 2, 7.6
Accurate Monarch Topaz, https://wotlkdb.com/?spell=53994, -25, 80, 55, 68.8
Necklace of the Deep, https://wotlkdb.com/?spell=40514, -25.815, 55.815, 30, 53.7
Beaming Earthsiege Diamond, https://wotlkdb.com/?spell=55405, -29.928, 119.795, 89.867, 75
Inscribed Monarch Topaz, https://wotlkdb.com/?spell=53975, -30, 80, 50, 62.5
Durable Monarch Topaz, https://wotlkdb.com/?spell=53986, -30.0001, 80, 49.9999, 62.5
Brilliant Pearl Band, https://wotlkdb.com/?spell=41414, -34.48, 49.48, 15, 30.3
Figurine - Ruby Serpent, https://wotlkdb.com/?spell=26900, -36.005, 36.155, 0.15, 0.4
Aquamarine Pendant of the Warrior, https://wotlkdb.com/?spell=26876, -37.5, 40.5, 3, 7.4
Destructive Skyflare Diamond, https://wotlkdb.com/?spell=55390, -38.1, 59, 20.9, 35.4
Silver Rose Pendant, https://wotlkdb.com/?spell=25614, -38.7223, 39, 0.2777, 0.7
Bracing Earthsiege Diamond, https://wotlkdb.com/?spell=55397, -38.7951, 119.795, 80.9999, 67.6
Figurine - Truesilver Crab, https://wotlkdb.com/?spell=26881, -40.77, 40.92, 0.15, 0.4
Diamond Focus Ring, https://wotlkdb.com/?spell=36526, -42.3874, 44.8999, 2.5125, 5.6
Savage Titanium Ring, https://wotlkdb.com/?spell=58492, -43.1, 583.2, 540.1, 92.6
Figurine - Truesilver Boar, https://wotlkdb.com/?spell=26882, -43.37, 43.52, 0.15, 0.3
Figurine - Black Pearl Panther, https://wotlkdb.com/?spell=26875, -44.85, 45, 0.15, 0.3
Champion's Monarch Topaz, https://wotlkdb.com/?spell=53977, -46.1, 80, 33.9, 42.4
Deft Monarch Topaz, https://wotlkdb.com/?spell=53982, -46.6667, 80, 33.3333, 41.7
Scarlet Signet, https://wotlkdb.com/?spell=64728, -49.55, 239.55, 190, 79.3
Etched Monarch Topaz, https://wotlkdb.com/?spell=53976, -50, 80, 30, 37.5
Tireless Skyflare Diamond, https://wotlkdb.com/?spell=55386, -50.5, 59, 8.5, 14.4
Swift Skyflare Diamond, https://wotlkdb.com/?spell=55394, -53, 59, 6, 10.2
Figurine - Crimson Serpent, https://wotlkdb.com/?spell=46777, -62.3398, 63.8398, 1.5, 2.3
Resolute Monarch Topaz, https://wotlkdb.com/?spell=54023, -66.5501, 80, 13.4499, 16.8
Thick Autumn's Glow, https://wotlkdb.com/?spell=53959, -70, 100, 30, 30
Powerful Earthsiege Diamond, https://wotlkdb.com/?spell=55399, -74.795, 119.795, 45, 37.6
Pristine Monarch Topaz, https://wotlkdb.com/?spell=53989, -75, 80, 5, 6.3
Glowing Thorium Band, https://wotlkdb.com/?spell=34960, -75.7999, 85.7999, 10, 11.7
Figurine - Jade Owl, https://wotlkdb.com/?spell=26872, -81.27, 81.42, 0.15, 0.2
Figurine - Living Ruby Serpent, https://wotlkdb.com/?spell=31081, -93.3, 94.8, 1.5, 1.6
Emerald Lion Ring, https://wotlkdb.com/?spell=34961, -93.8499, 103.7999, 9.95, 9.6
Bracing Earthstorm Diamond, https://wotlkdb.com/?spell=32867, -96, 99, 3, 3
Tenacious Earthstorm Diamond, https://wotlkdb.com/?spell=32868, -96, 99, 3, 3
Brutal Earthstorm Diamond, https://wotlkdb.com/?spell=32869, -96, 99, 3, 3
Insightful Earthstorm Diamond, https://wotlkdb.com/?spell=32870, -96, 99, 3, 3
Relentless Earthstorm Diamond, https://wotlkdb.com/?spell=39961, -96, 99, 3, 3
Eternal Earthstorm Diamond, https://wotlkdb.com/?spell=46597, -96, 99, 3, 3
The Black Pearl, https://wotlkdb.com/?spell=41415, -99.715, 499.715, 400, 80
Thick Adamantite Necklace, https://wotlkdb.com/?spell=31051, -102.71, 127.71, 25, 19.6
Persistent Earthsiege Diamond, https://wotlkdb.com/?spell=55402, -104.795, 119.795, 15, 12.5
Bright Scarlet Ruby, https://wotlkdb.com/?spell=53947, -108.7501, 129.75, 20.9999, 16.2
Bold Dragon's Eye, https://wotlkdb.com/?spell=56049, -113.625, 114.75, 1.125, 1
Delicate Dragon's Eye, https://wotlkdb.com/?spell=56052, -113.625, 114.75, 1.125, 1
Runed Dragon's Eye, https://wotlkdb.com/?spell=56053, -113.625, 114.75, 1.125, 1
Bright Dragon's Eye, https://wotlkdb.com/?spell=56054, -113.625, 114.75, 1.125, 1
Subtle Dragon's Eye, https://wotlkdb.com/?spell=56055, -113.625, 114.75, 1.125, 1
Flashing Dragon's Eye, https://wotlkdb.com/?spell=56056, -113.625, 114.75, 1.125, 1
Brilliant Dragon's Eye, https://wotlkdb.com/?spell=56074, -113.625, 114.75, 1.125, 1
Fractured Dragon's Eye, https://wotlkdb.com/?spell=56076, -113.625, 114.75, 1.125, 1
Lustrous Dragon's Eye, https://wotlkdb.com/?spell=56077, -113.625, 114.75, 1.125, 1
Mystic Dragon's Eye, https://wotlkdb.com/?spell=56079, -113.625, 114.75, 1.125, 1
Precise Dragon's Eye, https://wotlkdb.com/?spell=56081, -113.625, 114.75, 1.125, 1
Quick Dragon's Eye, https://wotlkdb.com/?spell=56083, -113.625, 114.75, 1.125, 1
Rigid Dragon's Eye, https://wotlkdb.com/?spell=56084, -113.625, 114.75, 1.125, 1
Smooth Dragon's Eye, https://wotlkdb.com/?spell=56085, -113.625, 114.75, 1.125, 1
Solid Dragon's Eye, https://wotlkdb.com/?spell=56086, -113.625, 114.75, 1.125, 1
Sparkling Dragon's Eye, https://wotlkdb.com/?spell=56087, -113.625, 114.75, 1.125, 1
Stormy Dragon's Eye, https://wotlkdb.com/?spell=56088, -113.625, 114.75, 1.125, 1
Thick Dragon's Eye, https://wotlkdb.com/?spell=56089, -113.625, 114.75, 1.125, 1
Heavy Adamantite Ring, https://wotlkdb.com/?spell=31052, -116.23, 126.23, 10, 7.9
Living Emerald Pendant, https://wotlkdb.com/?spell=26911, -116.4117, 117.662, 1.2503, 1.1
Destructive Skyfire Diamond, https://wotlkdb.com/?spell=32871, -136.9999, 139.9999, 3, 2.1
Swift Skyfire Diamond, https://wotlkdb.com/?spell=32873, -136.9999, 139.9999, 3, 2.1
Enigmatic Skyfire Diamond, https://wotlkdb.com/?spell=32874, -136.9999, 139.9999, 3, 2.1
Thundering Skyfire Diamond, https://wotlkdb.com/?spell=39963, -136.9999, 139.9999, 3, 2.1
Chaotic Skyfire Diamond, https://wotlkdb.com/?spell=44794, -136.9999, 139.9999, 3, 2.1
Ember Skyfire Diamond, https://wotlkdb.com/?spell=46601, -136.9999, 139.9999, 3, 2.1
Sapphire Owl, https://wotlkdb.com/?spell=56202, -137.2493, 145.3, 8.0507, 5.5
Figurine - Talasite Owl, https://wotlkdb.com/?spell=31082, -174.38, 175.88, 1.5, 0.9
Twilight Serpent, https://wotlkdb.com/?spell=56201, -191.7493, 199.8, 8.0507, 4
Figurine - Shadowsong Panther, https://wotlkdb.com/?spell=46778, -210.3738, 211.8738, 1.5, 0.7
Pendant of Withering, https://wotlkdb.com/?spell=31064, -216.003, 219.95, 3.947, 1.8
Pendant of Shadow's End, https://wotlkdb.com/?spell=31065, -218.803, 222.75, 3.947, 1.8
Ring of Arcane Shielding, https://wotlkdb.com/?spell=37855, -229.96, 329.96, 100, 30.3
Emerald Boar, https://wotlkdb.com/?spell=56203, -238.4993, 246.55, 8.0507, 3.3
Monarch Crab, https://wotlkdb.com/?spell=59759, -265.2493, 273.3, 8.0507, 2.9
Necklace of the Diamond Tower, https://wotlkdb.com/?spell=26915, -279.278, 281.7998, 2.5218, 0.9
Figurine - Nightseye Panther, https://wotlkdb.com/?spell=31083, -296.62, 298.12, 1.5, 0.5
Figurine - Dark Iron Scorpid, https://wotlkdb.com/?spell=26914, -303.7, 305.2, 1.5, 0.5
Pendant of Thawing, https://wotlkdb.com/?spell=31063, -310.103, 314.05, 3.947, 1.3
Figurine - Emerald Owl, https://wotlkdb.com/?spell=26909, -322.925, 323.3, 0.375, 0.1
Figurine - Felsteel Boar, https://wotlkdb.com/?spell=31079, -347.96, 349.16, 1.2, 0.3
Pendant of Frozen Flame, https://wotlkdb.com/?spell=31062, -359.003, 362.95, 3.947, 1.1
Figurine - Seaspray Albatross, https://wotlkdb.com/?spell=46779, -370.2926, 371.7926, 1.5, 0.4
Braided Eternium Chain, https://wotlkdb.com/?spell=31070, -380.263, 384.21, 3.947, 1
Embrace of the Dawn, https://wotlkdb.com/?spell=31072, -427.8406, 528.4406, 100.6, 19
Thick Felsteel Necklace, https://wotlkdb.com/?spell=31067, -454.3378, 458.25, 3.9122, 0.9
Ruby Hare, https://wotlkdb.com/?spell=56199, -461.2493, 469.3, 8.0507, 1.7
Figurine - Black Diamond Crab, https://wotlkdb.com/?spell=26912, -488.0772, 489.5772, 1.5, 0.3
Blazing Eternium Band, https://wotlkdb.com/?spell=31061, -507.9782, 511.96, 3.9818, 0.8
Pendant of the Null Rune, https://wotlkdb.com/?spell=31066, -524.803, 528.75, 3.947, 0.7
Arcanite Sword Pendant, https://wotlkdb.com/?spell=26918, -551.3686, 553.96, 2.5914, 0.5
Figurine - Dawnstone Crab, https://wotlkdb.com/?spell=31080, -601.5722, 603.0722, 1.5, 0.2
Khorium Band of Shadows, https://wotlkdb.com/?spell=31053, -651.5525, 655.43, 3.8775, 0.6
Living Ruby Pendant, https://wotlkdb.com/?spell=31068, -683.7378, 687.65, 3.9122, 0.6
Amulet of Flowing Life, https://wotlkdb.com/?spell=46126, -775.5223, 784.3578, 8.8355, 1.1
Khorium Inferno Band, https://wotlkdb.com/?spell=31055, -776.8378, 780.75, 3.9122, 0.5
Khorium Band of Leaves, https://wotlkdb.com/?spell=31056, -780.433, 784.38, 3.947, 0.5
Khorium Band of Frost, https://wotlkdb.com/?spell=31054, -850.1878, 854.1, 3.9122, 0.5
Arcane Khorium Band, https://wotlkdb.com/?spell=31057, -894.5182, 898.5, 3.9818, 0.4
Figurine - Empyrean Tortoise, https://wotlkdb.com/?spell=46775, -1149.833, 1151.333, 1.5, 0.1
Figurine - Khorium Boar, https://wotlkdb.com/?spell=46776, -1155.6, 1156.8, 1.2, 0.1
Pendant of Sunfire, https://wotlkdb.com/?spell=46125, -1542.1642, 1550.9997, 8.8355, 0.6
Crown of the Sea Witch, https://wotlkdb.com/?spell=41418, -2274.2693, 2276.945, 2.6757, 0.1
Ring of Flowing Life, https://wotlkdb.com/?spell=46123, -4754.974, 4760.9996, 6.0256, 0.1
Hard Khorium Choker, https://wotlkdb.com/?spell=46127, -4808.2639, 4817.0994, 8.8355, 0.2
Loop of Forged Power, https://wotlkdb.com/?spell=46122, -5315.774, 5321.7996, 6.0256, 0.1
Hard Khorium Band, https://wotlkdb.com/?spell=46124, -5615.774, 5621.7996, 6.0256, 0.1
