Earthshadow Ring, https://wotlkdb.com/?spell=58143, -1.2695, 5.35, 4.0805, 76.3
Solid Stone Statue, https://wotlkdb.com/?spell=32808, -1.329, 1.429, 0.1, 7
Golden Draenite Ring, https://wotlkdb.com/?spell=31049, -1.4, 21.4, 20, 93.5
Inscribed Flame Spessarite, https://wotlkdb.com/?spell=28910, -1.43, 1.98, 0.55, 27.8
Sparkling Azure Moonstone, https://wotlkdb.com/?spell=28953, -1.43, 1.98, 0.55, 27.8
Sovereign Shadow Draenite, https://wotlkdb.com/?spell=28936, -1.52, 1.91, 0.39, 20.4
Stormy Azure Moonstone, https://wotlkdb.com/?spell=28955, -1.55, 1.98, 0.43, 21.7
Royal Shadow Draenite, https://wotlkdb.com/?spell=28927, -1.6468, 1.91, 0.2632, 13.8
Inscribed Pyrestone, https://wotlkdb.com/?spell=39733, -1.65, 7.65, 6, 78.4
Potent Pyrestone, https://wotlkdb.com/?spell=39734, -1.65, 7.65, 6, 78.4
Luminous Pyrestone, https://wotlkdb.com/?spell=39735, -1.65, 7.65, 6, 78.4
Veiled Pyrestone, https://wotlkdb.com/?spell=39737, -1.65, 7.65, 6, 78.4
Wicked Pyrestone, https://wotlkdb.com/?spell=39738, -1.65, 7.65, 6, 78.4
Reckless Pyrestone, https://wotlkdb.com/?spell=47055, -1.65, 7.65, 6, 78.4
Shifting Shadow Draenite, https://wotlkdb.com/?spell=28933, -1.66, 1.91, 0.25, 13.1
Infused Shadow Draenite, https://wotlkdb.com/?spell=39458, -1.66, 1.91, 0.25, 13.1
Glinting Flame Spessarite, https://wotlkdb.com/?spell=28914, -1.69, 1.98, 0.29, 14.6
Forceful Seaspray Emerald, https://wotlkdb.com/?spell=47053, -1.7, 4.7, 3, 63.8
Steady Seaspray Emerald, https://wotlkdb.com/?spell=47054, -1.7, 4.7, 3, 63.8
Sovereign Shadowsong Amethyst, https://wotlkdb.com/?spell=39727, -1.7, 7.7, 6, 77.9
Shifting Shadowsong Amethyst, https://wotlkdb.com/?spell=39728, -1.7, 7.7, 6, 77.9
Balanced Shadowsong Amethyst, https://wotlkdb.com/?spell=39729, -1.7, 7.7, 6, 77.9
Infused Shadowsong Amethyst, https://wotlkdb.com/?spell=39730, -1.7, 7.7, 6, 77.9
Glowing Shadowsong Amethyst, https://wotlkdb.com/?spell=39731, -1.7, 7.7, 6, 77.9
Royal Shadowsong Amethyst, https://wotlkdb.com/?spell=39732, -1.7, 7.7, 6, 77.9
Purified Shadowsong Amethyst, https://wotlkdb.com/?spell=48789, -1.7, 7.7, 6, 77.9
Luminous Flame Spessarite, https://wotlkdb.com/?spell=28912, -1.73, 1.98, 0.25, 12.6
Lustrous Azure Moonstone, https://wotlkdb.com/?spell=28957, -1.73, 1.98, 0.25, 12.6
Delicate Crimson Spinel, https://wotlkdb.com/?spell=39706, -1.95, 7.95, 6, 75.5
Teardrop Crimson Spinel, https://wotlkdb.com/?spell=39710, -1.95, 7.95, 6, 75.5
Runed Crimson Spinel, https://wotlkdb.com/?spell=39711, -1.95, 7.95, 6, 75.5
Subtle Crimson Spinel, https://wotlkdb.com/?spell=39713, -1.95, 7.95, 6, 75.5
Flashing Crimson Spinel, https://wotlkdb.com/?spell=39714, -1.95, 7.95, 6, 75.5
Intricate Dark Jade, https://wotlkdb.com/?spell=53925, -2, 5, 3, 60
Bright Cardinal Ruby, https://wotlkdb.com/?spell=66449, -2, 217.25, 215.25, 99.1
Balanced Twilight Opal, https://wotlkdb.com/?spell=53969, -2.02, 7, 4.98, 71.1
Jagged Dark Jade, https://wotlkdb.com/?spell=53916, -2.2, 5, 2.8, 56
Primal Stone Statue, https://wotlkdb.com/?spell=32810, -2.6, 3, 0.4, 13.3
Ring of Silver Might, https://wotlkdb.com/?spell=25317, -2.9152, 4.1666, 1.2514, 30
Ring of Twilight Shadows, https://wotlkdb.com/?spell=25318, -2.98, 3.98, 1, 25.1
Dark Jade Focusing Lens, https://wotlkdb.com/?spell=56205, -3, 5, 2, 40
Solid Bronze Ring, https://wotlkdb.com/?spell=25490, -3.01, 4, 0.99, 24.8
Enduring Dark Jade, https://wotlkdb.com/?spell=53918, -3.1, 5, 1.9, 38
Tigerseye Band, https://wotlkdb.com/?spell=32179, -3.4154, 6.4154, 3, 46.8
Dazzling Dark Jade, https://wotlkdb.com/?spell=53926, -3.99, 5, 1.01, 20.2
Misty Dark Jade, https://wotlkdb.com/?spell=53922, -4, 5, 1, 20
Sundered Dark Jade, https://wotlkdb.com/?spell=53927, -4.01, 5, 0.99, 19.8
Timeless Dark Jade, https://wotlkdb.com/?spell=53894, -4.025, 5, 0.975, 19.5
Radiant Dark Jade, https://wotlkdb.com/?spell=53931, -4.2501, 5, 0.7499, 15
Malachite Pendant, https://wotlkdb.com/?spell=32178, -4.2504, 6.2304, 1.98, 31.8
Turbid Dark Jade, https://wotlkdb.com/?spell=53924, -4.5, 5, 0.5, 10
Tense Dark Jade, https://wotlkdb.com/?spell=53932, -4.5, 5, 0.5, 10
Simple Pearl Ring, https://wotlkdb.com/?spell=25284, -5.3752, 8.3552, 2.98, 35.7
Amulet of the Moon, https://wotlkdb.com/?spell=25339, -5.4465, 5.6, 0.1535, 2.7
Sparkling Sky Sapphire, https://wotlkdb.com/?spell=53953, -5.45, 9.95, 4.5, 45.2
Figurine - Golden Hare, https://wotlkdb.com/?spell=26873, -5.7248, 5.8748, 0.15, 2.6
Heavy Stone Statue, https://wotlkdb.com/?spell=32807, -6.82, 6.88, 0.06, 0.9
Glimmering Monarch Topaz, https://wotlkdb.com/?spell=53993, -7, 62, 55, 88.7
Scarlet Signet, https://wotlkdb.com/?spell=64728, -7.15, 216.9, 209.75, 96.7
Ornate Tigerseye Necklace, https://wotlkdb.com/?spell=26928, -7.4956, 9.4956, 2, 21.1
Gleaming Golden Draenite, https://wotlkdb.com/?spell=28944, -7.5125, 8.5625, 1.05, 12.3
Smooth Golden Draenite, https://wotlkdb.com/?spell=34069, -7.5725, 8.5625, 0.99, 11.6
Thick Golden Draenite, https://wotlkdb.com/?spell=28947, -7.6468, 8.5625, 0.9157, 10.7
Aquamarine Signet, https://wotlkdb.com/?spell=26874, -7.67, 9.65, 1.98, 20.5
Heavy Silver Ring, https://wotlkdb.com/?spell=25305, -7.6766, 11.6766, 4, 34.3
Brilliant Golden Draenite, https://wotlkdb.com/?spell=28938, -7.6825, 8.5625, 0.88, 10.3
Rigid Golden Draenite, https://wotlkdb.com/?spell=28948, -7.9975, 8.5625, 0.565, 6.6
Citrine Ring of Rapid Healing, https://wotlkdb.com/?spell=25621, -7.9999, 9.9999, 2, 20
Heavy Jade Ring, https://wotlkdb.com/?spell=36524, -8.2, 9.2, 1, 10.9
Thundering Skyflare Diamond, https://wotlkdb.com/?spell=55395, -8.7, 85, 76.3, 89.8
Solid Chalcedony, https://wotlkdb.com/?spell=53934, -9.15, 16.9, 7.75, 45.9
Jade Ring of Slaying, https://wotlkdb.com/?spell=58144, -9.25, 14.25, 5, 35.1
Mysterious Dreadstone, https://wotlkdb.com/?spell=66562, -9.61, 99.6, 89.99, 90.4
Braided Copper Ring, https://wotlkdb.com/?spell=25493, -9.8808, 10.8808, 1, 9.2
Precise Scarlet Ruby, https://wotlkdb.com/?spell=53951, -10, 110, 100, 90.9
The Aquamarine Ward, https://wotlkdb.com/?spell=26887, -10.45, 15.45, 5, 32.4
Shadowmight Ring, https://wotlkdb.com/?spell=58146, -10.6475, 30.05, 19.4025, 64.6
Woven Copper Ring, https://wotlkdb.com/?spell=26925, -10.9334, 11.9334, 1, 8.4
Blazing Citrine Ring, https://wotlkdb.com/?spell=25617, -10.95, 20.9499, 9.9999, 47.7
Subtle Cardinal Ruby, https://wotlkdb.com/?spell=66452, -11.375, 217.25, 205.875, 94.8
Etched Monarch Topaz, https://wotlkdb.com/?spell=53976, -12.2, 62, 49.8, 80.3
Stalwart Monarch Topaz, https://wotlkdb.com/?spell=53992, -12.25, 62, 49.75, 80.2
Golden Dragon Ring, https://wotlkdb.com/?spell=25613, -12.5658, 14.0058, 1.44, 10.3
Heavy Copper Ring, https://wotlkdb.com/?spell=26926, -14.0912, 15.0912, 1, 6.6
Gloom Band, https://wotlkdb.com/?spell=25287, -15.4553, 18.3608, 2.9055, 15.8
Sparkling Chalcedony, https://wotlkdb.com/?spell=53940, -15.9, 16.9, 1, 5.9
Lustrous Chalcedony, https://wotlkdb.com/?spell=53941, -15.9, 16.9, 1, 5.9
Figurine - Truesilver Crab, https://wotlkdb.com/?spell=26881, -16.2652, 16.4152, 0.15, 0.9
Deft Monarch Topaz, https://wotlkdb.com/?spell=53982, -17.1, 62, 44.9, 72.4
Silver Rose Pendant, https://wotlkdb.com/?spell=25614, -19.3489, 19.6266, 0.2777, 1.4
Durable Monarch Topaz, https://wotlkdb.com/?spell=53986, -22, 62, 40, 64.5
Onslaught Ring, https://wotlkdb.com/?spell=26907, -24.361, 30.361, 6, 19.8
Truesilver Commander's Ring, https://wotlkdb.com/?spell=34959, -25.0812, 66.0812, 41, 62
Fierce Monarch Topaz, https://wotlkdb.com/?spell=54019, -27, 62, 35, 56.5
Champion's Monarch Topaz, https://wotlkdb.com/?spell=53977, -29.1, 62, 32.9, 53.1
Thick Autumn's Glow, https://wotlkdb.com/?spell=53959, -29.9, 99.9, 70, 70.1
Sapphire Pendant of Winter Night, https://wotlkdb.com/?spell=26908, -30.86, 35.82, 4.96, 13.8
Engraved Truesilver Ring, https://wotlkdb.com/?spell=25620, -36.5938, 38.5938, 2, 5.2
Inscribed Monarch Topaz, https://wotlkdb.com/?spell=53975, -37, 62, 25, 40.3
Red Ring of Destruction, https://wotlkdb.com/?spell=36525, -37.5, 43.5, 6, 13.8
Smooth Autumn's Glow, https://wotlkdb.com/?spell=53957, -39.9, 99.9, 60, 60.1
Jade Pendant of Blasting, https://wotlkdb.com/?spell=25618, -40.0518, 40.4, 0.3482, 0.9
Ruby Pendant of Fire, https://wotlkdb.com/?spell=26883, -41.5473, 43.5, 1.9527, 4.5
Bracing Earthsiege Diamond, https://wotlkdb.com/?spell=55397, -44.5, 114.5, 70, 61.1
Brilliant Pearl Band, https://wotlkdb.com/?spell=41414, -48.65, 58.6, 9.95, 17
Brilliant Autumn's Glow, https://wotlkdb.com/?spell=53956, -49.9, 99.9, 50, 50.1
Simple Opal Ring, https://wotlkdb.com/?spell=26902, -52.96, 54.4, 1.44, 2.6
Pristine Monarch Topaz, https://wotlkdb.com/?spell=53989, -55.5, 62, 6.5, 10.5
Aquamarine Pendant of the Warrior, https://wotlkdb.com/?spell=26876, -57.3, 58.8, 1.5, 2.6
Figurine - Ruby Serpent, https://wotlkdb.com/?spell=26900, -63.5548, 63.7048, 0.15, 0.2
Figurine - Crimson Serpent, https://wotlkdb.com/?spell=46777, -64.04, 65.54, 1.5, 2.3
Destructive Skyflare Diamond, https://wotlkdb.com/?spell=55390, -64.525, 85, 20.475, 24.1
Bright Scarlet Ruby, https://wotlkdb.com/?spell=53947, -64.875, 110, 45.125, 41
Figurine - Truesilver Boar, https://wotlkdb.com/?spell=26882, -68.1842, 68.3342, 0.15, 0.2
Diamond Focus Ring, https://wotlkdb.com/?spell=36526, -72.9, 75.4, 2.5, 3.3
Bracing Earthstorm Diamond, https://wotlkdb.com/?spell=32867, -77, 80, 3, 3.8
Tenacious Earthstorm Diamond, https://wotlkdb.com/?spell=32868, -77, 80, 3, 3.8
Insightful Earthstorm Diamond, https://wotlkdb.com/?spell=32870, -77, 80, 3, 3.8
Relentless Earthstorm Diamond, https://wotlkdb.com/?spell=39961, -77, 80, 3, 3.8
Eternal Earthstorm Diamond, https://wotlkdb.com/?spell=46597, -77, 80, 3, 3.8
Tireless Skyflare Diamond, https://wotlkdb.com/?spell=55386, -77.2, 85, 7.8, 9.2
Swift Skyflare Diamond, https://wotlkdb.com/?spell=55394, -77.5, 85, 7.5, 8.8
Powerful Earthsiege Diamond, https://wotlkdb.com/?spell=55399, -79.6, 114.5, 34.9, 30.5
Figurine - Black Pearl Panther, https://wotlkdb.com/?spell=26875, -83.65, 83.8, 0.15, 0.2
Figurine - Jade Owl, https://wotlkdb.com/?spell=26872, -90.9976, 91.1476, 0.15, 0.2
Persistent Earthsiege Diamond, https://wotlkdb.com/?spell=55402, -96.5, 114.5, 18, 15.7
Bold Dragon's Eye, https://wotlkdb.com/?spell=56049, -98.775, 99.9, 1.125, 1.1
Delicate Dragon's Eye, https://wotlkdb.com/?spell=56052, -98.775, 99.9, 1.125, 1.1
Runed Dragon's Eye, https://wotlkdb.com/?spell=56053, -98.775, 99.9, 1.125, 1.1
Bright Dragon's Eye, https://wotlkdb.com/?spell=56054, -98.775, 99.9, 1.125, 1.1
Subtle Dragon's Eye, https://wotlkdb.com/?spell=56055, -98.775, 99.9, 1.125, 1.1
Flashing Dragon's Eye, https://wotlkdb.com/?spell=56056, -98.775, 99.9, 1.125, 1.1
Brilliant Dragon's Eye, https://wotlkdb.com/?spell=56074, -98.775, 99.9, 1.125, 1.1
Fractured Dragon's Eye, https://wotlkdb.com/?spell=56076, -98.775, 99.9, 1.125, 1.1
Lustrous Dragon's Eye, https://wotlkdb.com/?spell=56077, -98.775, 99.9, 1.125, 1.1
Mystic Dragon's Eye, https://wotlkdb.com/?spell=56079, -98.775, 99.9, 1.125, 1.1
Precise Dragon's Eye, https://wotlkdb.com/?spell=56081, -98.775, 99.9, 1.125, 1.1
Quick Dragon's Eye, https://wotlkdb.com/?spell=56083, -98.775, 99.9, 1.125, 1.1
Rigid Dragon's Eye, https://wotlkdb.com/?spell=56084, -98.775, 99.9, 1.125, 1.1
Smooth Dragon's Eye, https://wotlkdb.com/?spell=56085, -98.775, 99.9, 1.125, 1.1
Solid Dragon's Eye, https://wotlkdb.com/?spell=56086, -98.775, 99.9, 1.125, 1.1
Sparkling Dragon's Eye, https://wotlkdb.com/?spell=56087, -98.775, 99.9, 1.125, 1.1
Stormy Dragon's Eye, https://wotlkdb.com/?spell=56088, -98.775, 99.9, 1.125, 1.1
Thick Dragon's Eye, https://wotlkdb.com/?spell=56089, -98.775, 99.9, 1.125, 1.1
Figurine - Living Ruby Serpent, https://wotlkdb.com/?spell=31081, -100.74, 102.24, 1.5, 1.5
Emerald Lion Ring, https://wotlkdb.com/?spell=34961, -108.5, 115.5, 7, 6.1
Living Emerald Pendant, https://wotlkdb.com/?spell=26911, -118.0737, 119.324, 1.2503, 1
Sapphire Owl, https://wotlkdb.com/?spell=56202, -121.7393, 129.79, 8.0507, 6.2
Thick Adamantite Necklace, https://wotlkdb.com/?spell=31051, -128.85, 158.75, 29.9, 18.8
Glowing Thorium Band, https://wotlkdb.com/?spell=34960, -132.2495, 137.3, 5.0505, 3.7
Heavy Adamantite Ring, https://wotlkdb.com/?spell=31052, -138.7501, 153.75, 14.9999, 9.8
Destructive Skyfire Diamond, https://wotlkdb.com/?spell=32871, -147, 150, 3, 2
Mystical Skyfire Diamond, https://wotlkdb.com/?spell=32872, -147, 150, 3, 2
Swift Skyfire Diamond, https://wotlkdb.com/?spell=32873, -147, 150, 3, 2
Enigmatic Skyfire Diamond, https://wotlkdb.com/?spell=32874, -147, 150, 3, 2
Thundering Skyfire Diamond, https://wotlkdb.com/?spell=39963, -147, 150, 3, 2
Chaotic Skyfire Diamond, https://wotlkdb.com/?spell=44794, -147, 150, 3, 2
Ember Skyfire Diamond, https://wotlkdb.com/?spell=46601, -147, 150, 3, 2
Figurine - Talasite Owl, https://wotlkdb.com/?spell=31082, -168.94, 170.44, 1.5, 0.9
Twilight Serpent, https://wotlkdb.com/?spell=56201, -174.8493, 182.9, 8.0507, 4.4
Emerald Boar, https://wotlkdb.com/?spell=56203, -214.8293, 222.88, 8.0507, 3.6
Monarch Crab, https://wotlkdb.com/?spell=59759, -225.8393, 233.89, 8.0507, 3.4
Figurine - Shadowsong Panther, https://wotlkdb.com/?spell=46778, -234.54, 236.04, 1.5, 0.6
Figurine - Dark Iron Scorpid, https://wotlkdb.com/?spell=26914, -266.3, 267.8, 1.5, 0.6
Pendant of Withering, https://wotlkdb.com/?spell=31064, -285.383, 289.33, 3.947, 1.4
Figurine - Emerald Owl, https://wotlkdb.com/?spell=26909, -302.869, 303.244, 0.375, 0.1
Pendant of Shadow's End, https://wotlkdb.com/?spell=31065, -306.023, 309.97, 3.947, 1.3
Ring of Arcane Shielding, https://wotlkdb.com/?spell=37855, -318.4963, 322.2, 3.7037, 1.1
Necklace of the Diamond Tower, https://wotlkdb.com/?spell=26915, -328.0782, 330.6, 2.5218, 0.8
Figurine - Nightseye Panther, https://wotlkdb.com/?spell=31083, -329.5, 331, 1.5, 0.5
Braided Eternium Chain, https://wotlkdb.com/?spell=31070, -334.25, 457.25, 123, 26.9
Figurine - Seaspray Albatross, https://wotlkdb.com/?spell=46779, -363.1, 364.6, 1.5, 0.4
Pendant of Thawing, https://wotlkdb.com/?spell=31063, -375.333, 379.28, 3.947, 1
Figurine - Felsteel Boar, https://wotlkdb.com/?spell=31079, -386.7, 387.9, 1.2, 0.3
Ruby Hare, https://wotlkdb.com/?spell=56199, -418.7493, 426.8, 8.0507, 1.9
Pendant of Frozen Flame, https://wotlkdb.com/?spell=31062, -440.323, 444.27, 3.947, 0.9
The Black Pearl, https://wotlkdb.com/?spell=41415, -474.36, 595.36, 121, 20.3
Arcanite Sword Pendant, https://wotlkdb.com/?spell=26918, -509.2086, 511.8, 2.5914, 0.5
Figurine - Black Diamond Crab, https://wotlkdb.com/?spell=26912, -535.4, 536.9, 1.5, 0.3
Thick Felsteel Necklace, https://wotlkdb.com/?spell=31067, -535.8378, 539.75, 3.9122, 0.7
Figurine - Dawnstone Crab, https://wotlkdb.com/?spell=31080, -536.75, 538.25, 1.5, 0.3
Pendant of the Null Rune, https://wotlkdb.com/?spell=31066, -549.503, 553.45, 3.947, 0.7
Blazing Eternium Band, https://wotlkdb.com/?spell=31061, -604.8382, 608.82, 3.9818, 0.7
Living Ruby Pendant, https://wotlkdb.com/?spell=31068, -616.71, 651.71, 35, 5.4
Embrace of the Dawn, https://wotlkdb.com/?spell=31072, -619.1432, 623.125, 3.9818, 0.6
Heavy Felsteel Ring, https://wotlkdb.com/?spell=31058, -684.7963, 688.5, 3.7037, 0.5
Khorium Band of Shadows, https://wotlkdb.com/?spell=31053, -694.1125, 697.99, 3.8775, 0.6
Delicate Eternium Ring, https://wotlkdb.com/?spell=31060, -745.3378, 749.25, 3.9122, 0.5
Khorium Inferno Band, https://wotlkdb.com/?spell=31055, -843.2028, 847.115, 3.9122, 0.5
Khorium Band of Leaves, https://wotlkdb.com/?spell=31056, -873.753, 877.7, 3.947, 0.4
Amulet of Flowing Life, https://wotlkdb.com/?spell=46126, -911.8645, 920.7, 8.8355, 1
Khorium Band of Frost, https://wotlkdb.com/?spell=31054, -940.6878, 944.6, 3.9122, 0.4
Arcane Khorium Band, https://wotlkdb.com/?spell=31057, -957.7182, 961.7, 3.9818, 0.4
Figurine - Empyrean Tortoise, https://wotlkdb.com/?spell=46775, -1024.2, 1025.7, 1.5, 0.1
Figurine - Khorium Boar, https://wotlkdb.com/?spell=46776, -1038.1, 1039.3, 1.2, 0.1
Hard Khorium Band, https://wotlkdb.com/?spell=46124, -1044.9975, 5044.9975, 4000, 79.3
Pendant of Sunfire, https://wotlkdb.com/?spell=46125, -1820.5645, 1829.4, 8.8355, 0.5
Crown of the Sea Witch, https://wotlkdb.com/?spell=41418, -2212.4043, 2215.08, 2.6757, 0.1
Hard Khorium Choker, https://wotlkdb.com/?spell=46127, -3301.9645, 3310.8, 8.8355, 0.3
Ring of Flowing Life, https://wotlkdb.com/?spell=46123, -4256.9739, 4262.9995, 6.0256, 0.1
Loop of Forged Power, https://wotlkdb.com/?spell=46122, -4617.9739, 4623.9995, 6.0256, 0.1
