Royal Shadowsong Amethyst, https://wotlkdb.com/?spell=39732, -0.625, 6.625, 6, 90.6
Purified Shadowsong Amethyst, https://wotlkdb.com/?spell=48789, -0.625, 6.625, 6, 90.6
Stormy Azure Moonstone, https://wotlkdb.com/?spell=28955, -0.665, 1.495, 0.83, 55.5
Jagged Deep Peridot, https://wotlkdb.com/?spell=28917, -0.7368, 1, 0.2632, 26.3
Brilliant King's Amber, https://wotlkdb.com/?spell=66503, -0.7438, 229.75, 229.0062, 99.7
Glowing Shadow Draenite, https://wotlkdb.com/?spell=28925, -0.86, 1.96, 1.1, 56.1
Solid Bronze Ring, https://wotlkdb.com/?spell=25490, -0.9997, 1.9996, 0.9999, 50
Precise Scarlet Ruby, https://wotlkdb.com/?spell=53951, -0.9999, 110.9999, 110, 99.1
Heavy Stone Statue, https://wotlkdb.com/?spell=32807, -1.016, 1.076, 0.06, 5.6
Pendant of the Agate Shield, https://wotlkdb.com/?spell=25610, -1.0401, 6.04, 4.9999, 82.8
Solid Azure Moonstone, https://wotlkdb.com/?spell=28950, -1.055, 1.495, 0.44, 29.4
Sparkling Azure Moonstone, https://wotlkdb.com/?spell=28953, -1.075, 1.495, 0.42, 28.1
Earthshadow Ring, https://wotlkdb.com/?spell=58143, -1.1595, 5.24, 4.0805, 77.9
Lustrous Azure Moonstone, https://wotlkdb.com/?spell=28957, -1.245, 1.495, 0.25, 16.7
Ring of Twilight Shadows, https://wotlkdb.com/?spell=25318, -1.3248, 2.3248, 1, 43
Mysterious Dreadstone, https://wotlkdb.com/?spell=66562, -1.4727, 122.2222, 120.7495, 98.8
Glinting Flame Spessarite, https://wotlkdb.com/?spell=28914, -1.482, 1.872, 0.39, 20.8
Sovereign Shadow Draenite, https://wotlkdb.com/?spell=28936, -1.6, 1.96, 0.36, 18.4
Inscribed Flame Spessarite, https://wotlkdb.com/?spell=28910, -1.6088, 1.872, 0.2632, 14.1
Royal Shadow Draenite, https://wotlkdb.com/?spell=28927, -1.6968, 1.96, 0.2632, 13.4
Shifting Shadow Draenite, https://wotlkdb.com/?spell=28933, -1.71, 1.96, 0.25, 12.8
Infused Shadow Draenite, https://wotlkdb.com/?spell=39458, -1.71, 1.96, 0.25, 12.8
Forceful Seaspray Emerald, https://wotlkdb.com/?spell=47053, -1.875, 4.875, 3, 61.5
Steady Seaspray Emerald, https://wotlkdb.com/?spell=47054, -1.875, 4.875, 3, 61.5
Resplendent Monarch Topaz, https://wotlkdb.com/?spell=53978, -2.1, 72, 69.9, 97.1
Simple Pearl Ring, https://wotlkdb.com/?spell=25284, -2.285, 5.285, 3, 56.8
Dazzling Forest Emerald, https://wotlkdb.com/?spell=54007, -2.45, 6.95, 4.5, 64.7
Shadow Jade Focusing Lens, https://wotlkdb.com/?spell=56208, -2.5575, 7.5575, 5, 66.2
Primal Stone Statue, https://wotlkdb.com/?spell=32810, -2.6, 3, 0.4, 13.3
Amulet of the Moon, https://wotlkdb.com/?spell=25339, -2.7785, 2.932, 0.1535, 5.2
Shining Dark Jade, https://wotlkdb.com/?spell=53923, -2.9375, 6.9375, 4, 57.7
Forceful Dark Jade, https://wotlkdb.com/?spell=53920, -2.9575, 6.9375, 3.98, 57.4
Inlaid Malachite Ring, https://wotlkdb.com/?spell=25283, -3.0146, 5.06, 2.0454, 40.4
Balanced Twilight Opal, https://wotlkdb.com/?spell=53969, -3.02, 8, 4.98, 62.3
Dark Jade Focusing Lens, https://wotlkdb.com/?spell=56205, -3.375, 6.9375, 3.5625, 51.4
Austere Earthsiege Diamond, https://wotlkdb.com/?spell=55401, -3.5, 123.5, 120, 97.2
Malachite Pendant, https://wotlkdb.com/?spell=32178, -3.56, 6.56, 3, 45.7
Misty Dark Jade, https://wotlkdb.com/?spell=53922, -3.7375, 6.9375, 3.2, 46.1
Tigerseye Band, https://wotlkdb.com/?spell=32179, -3.8, 5.8, 2, 34.5
Jagged Dark Jade, https://wotlkdb.com/?spell=53916, -3.9375, 6.9375, 3, 43.2
Radiant Dark Jade, https://wotlkdb.com/?spell=53931, -3.9575, 6.9375, 2.98, 43
Vivid Dark Jade, https://wotlkdb.com/?spell=53917, -4.9375, 6.9375, 2, 28.8
Enduring Dark Jade, https://wotlkdb.com/?spell=53918, -4.9375, 6.9375, 2, 28.8
Energized Dark Jade, https://wotlkdb.com/?spell=53930, -4.9375, 6.9375, 2, 28.8
Lambent Dark Jade, https://wotlkdb.com/?spell=53928, -4.9575, 6.9375, 1.98, 28.5
Intricate Dark Jade, https://wotlkdb.com/?spell=53925, -5.1375, 6.9375, 1.8, 25.9
Beaming Earthsiege Diamond, https://wotlkdb.com/?spell=55405, -5.5, 123.5, 118, 95.5
Sundered Dark Jade, https://wotlkdb.com/?spell=53927, -5.9375, 6.9375, 1, 14.4
Timeless Dark Jade, https://wotlkdb.com/?spell=53894, -5.9575, 6.9375, 0.98, 14.1
Flashing Cardinal Ruby, https://wotlkdb.com/?spell=66453, -6, 240, 234, 97.5
Smooth Golden Draenite, https://wotlkdb.com/?spell=34069, -6.085, 7.075, 0.99, 14
Thick Golden Draenite, https://wotlkdb.com/?spell=28947, -6.095, 7.075, 0.98, 13.9
Dazzling Dark Jade, https://wotlkdb.com/?spell=53926, -6.2375, 6.9375, 0.7, 10.1
Gleaming Golden Draenite, https://wotlkdb.com/?spell=28944, -6.2451, 7.075, 0.8299, 11.7
Rigid Golden Draenite, https://wotlkdb.com/?spell=28948, -6.305, 7.075, 0.77, 10.9
Turbid Dark Jade, https://wotlkdb.com/?spell=53924, -6.4375, 6.9375, 0.5, 7.2
Tense Dark Jade, https://wotlkdb.com/?spell=53932, -6.4375, 6.9375, 0.5, 7.2
Brilliant Golden Draenite, https://wotlkdb.com/?spell=28938, -6.525, 7.075, 0.55, 7.8
Ornate Tigerseye Necklace, https://wotlkdb.com/?spell=26928, -6.54, 8.54, 2, 23.4
Glimmering Monarch Topaz, https://wotlkdb.com/?spell=53993, -7.1, 72, 64.9, 90.1
Sparkling Sky Sapphire, https://wotlkdb.com/?spell=53953, -7.77, 12.75, 4.98, 39.1
Aquamarine Signet, https://wotlkdb.com/?spell=26874, -7.84, 10.84, 3, 27.7
Elegant Silver Ring, https://wotlkdb.com/?spell=25280, -7.8999, 9.8999, 2, 20.2
Wicked Monarch Topaz, https://wotlkdb.com/?spell=53988, -8, 72, 64, 88.9
Mystic Autumn's Glow, https://wotlkdb.com/?spell=53960, -8.625, 119.75, 111.125, 92.8
Lucent Monarch Topaz, https://wotlkdb.com/?spell=53981, -9, 72, 63, 87.5
Braided Copper Ring, https://wotlkdb.com/?spell=25493, -9.02, 10, 0.98, 9.8
Gloom Band, https://wotlkdb.com/?spell=25287, -9.225, 14.165, 4.94, 34.9
Relentless Earthsiege Diamond, https://wotlkdb.com/?spell=55400, -9.5, 123.5, 114, 92.3
Brilliant Pearl Band, https://wotlkdb.com/?spell=41414, -9.55, 19.5, 9.95, 51
Woven Copper Ring, https://wotlkdb.com/?spell=26925, -9.97, 10.97, 1, 9.1
Figurine - Golden Hare, https://wotlkdb.com/?spell=26873, -10.77, 10.92, 0.15, 1.4
Solid Chalcedony, https://wotlkdb.com/?spell=53934, -11.7999, 16.7499, 4.95, 29.6
Fierce Monarch Topaz, https://wotlkdb.com/?spell=54019, -12, 72, 60, 83.3
Jade Ring of Slaying, https://wotlkdb.com/?spell=58144, -12.875, 17.875, 5, 28
Heavy Copper Ring, https://wotlkdb.com/?spell=26926, -12.88, 13.88, 1, 7.2
Heavy Jade Ring, https://wotlkdb.com/?spell=36524, -13.29, 14.29, 1, 7
Sparkling Chalcedony, https://wotlkdb.com/?spell=53940, -13.7499, 16.7499, 3, 17.9
Lustrous Chalcedony, https://wotlkdb.com/?spell=53941, -13.7499, 16.7499, 3, 17.9
Citrine Ring of Rapid Healing, https://wotlkdb.com/?spell=25621, -14.36, 16.36, 2, 12.2
Onslaught Ring, https://wotlkdb.com/?spell=26907, -16.5, 24.5, 8, 32.7
Ring of Silver Might, https://wotlkdb.com/?spell=25317, -17.8098, 19.7998, 1.99, 10.1
Moonsoul Crown, https://wotlkdb.com/?spell=25321, -18.0216, 43.1716, 25.15, 58.3
Red Ring of Destruction, https://wotlkdb.com/?spell=36525, -18.35, 27.35, 9, 32.9
Golden Dragon Ring, https://wotlkdb.com/?spell=25613, -18.97, 21.95, 2.98, 13.6
Shadowmight Ring, https://wotlkdb.com/?spell=58146, -19.1, 35, 15.9, 45.4
Sapphire Pendant of Winter Night, https://wotlkdb.com/?spell=26908, -20.6214, 26.3214, 5.7, 21.7
Bright Scarlet Ruby, https://wotlkdb.com/?spell=53947, -20.9999, 110.9999, 90, 81.1
Heavy Silver Ring, https://wotlkdb.com/?spell=25305, -21.8958, 25.8858, 3.99, 15.4
Champion's Monarch Topaz, https://wotlkdb.com/?spell=53977, -22, 72, 50, 69.4
Eternal Earthsiege Diamond, https://wotlkdb.com/?spell=55398, -22.75, 123.5, 100.75, 81.6
Ruby Pendant of Fire, https://wotlkdb.com/?spell=26883, -25.36, 27.35, 1.99, 7.3
Figurine - Truesilver Crab, https://wotlkdb.com/?spell=26881, -29.878, 30.028, 0.15, 0.5
Durable Monarch Topaz, https://wotlkdb.com/?spell=53986, -32, 72, 40, 55.6
Engraved Truesilver Ring, https://wotlkdb.com/?spell=25620, -33.097, 34.097, 1, 2.9
Bracing Earthsiege Diamond, https://wotlkdb.com/?spell=55397, -33.6, 123.5, 89.9, 72.8
Brilliant Autumn's Glow, https://wotlkdb.com/?spell=53956, -33.9, 119.75, 85.85, 71.7
Silver Rose Pendant, https://wotlkdb.com/?spell=25614, -38.3521, 38.6298, 0.2777, 0.7
Etched Monarch Topaz, https://wotlkdb.com/?spell=53976, -42, 72, 30, 41.7
Thick Autumn's Glow, https://wotlkdb.com/?spell=53959, -42.75, 119.75, 77, 64.3
Jade Pendant of Blasting, https://wotlkdb.com/?spell=25618, -43.4018, 43.75, 0.3482, 0.8
Destructive Skyflare Diamond, https://wotlkdb.com/?spell=55390, -44.1, 72, 27.9, 38.8
Simple Opal Ring, https://wotlkdb.com/?spell=26902, -45.2699, 48.2699, 3, 6.2
Figurine - Ruby Serpent, https://wotlkdb.com/?spell=26900, -46.2436, 46.3936, 0.15, 0.3
Aquamarine Pendant of the Warrior, https://wotlkdb.com/?spell=26876, -46.7, 51.7, 5, 9.7
Deft Monarch Topaz, https://wotlkdb.com/?spell=53982, -52, 72, 20, 27.8
Diamond Focus Ring, https://wotlkdb.com/?spell=36526, -56.97, 60.95, 3.98, 6.5
Stalwart Monarch Topaz, https://wotlkdb.com/?spell=53992, -57, 72, 15, 20.8
Pristine Monarch Topaz, https://wotlkdb.com/?spell=53989, -58.7298, 72, 13.2702, 18.4
Figurine - Truesilver Boar, https://wotlkdb.com/?spell=26882, -59.38, 59.53, 0.15, 0.3
Smooth Autumn's Glow, https://wotlkdb.com/?spell=53957, -59.75, 119.75, 60, 50.1
Swift Skyflare Diamond, https://wotlkdb.com/?spell=55394, -60.05, 72, 11.95, 16.6
Figurine - Crimson Serpent, https://wotlkdb.com/?spell=46777, -62.82, 64.32, 1.5, 2.3
Tireless Skyflare Diamond, https://wotlkdb.com/?spell=55386, -63.55, 72, 8.45, 11.7
Scarlet Signet, https://wotlkdb.com/?spell=64728, -65.4599, 216.4599, 151, 69.8
Figurine - Black Pearl Panther, https://wotlkdb.com/?spell=26875, -81.25, 81.4, 0.15, 0.2
Thick Adamantite Necklace, https://wotlkdb.com/?spell=31051, -98.3, 138.3, 40, 28.9
Figurine - Living Ruby Serpent, https://wotlkdb.com/?spell=31081, -101.66, 103.16, 1.5, 1.5
Persistent Earthsiege Diamond, https://wotlkdb.com/?spell=55402, -102.6, 123.5, 20.9, 16.9
Glowing Thorium Band, https://wotlkdb.com/?spell=34960, -104.45, 116.45, 12, 10.3
Bold Dragon's Eye, https://wotlkdb.com/?spell=56049, -104.5, 105.625, 1.125, 1.1
Delicate Dragon's Eye, https://wotlkdb.com/?spell=56052, -104.5, 105.625, 1.125, 1.1
Runed Dragon's Eye, https://wotlkdb.com/?spell=56053, -104.5, 105.625, 1.125, 1.1
Bright Dragon's Eye, https://wotlkdb.com/?spell=56054, -104.5, 105.625, 1.125, 1.1
Subtle Dragon's Eye, https://wotlkdb.com/?spell=56055, -104.5, 105.625, 1.125, 1.1
Flashing Dragon's Eye, https://wotlkdb.com/?spell=56056, -104.5, 105.625, 1.125, 1.1
Brilliant Dragon's Eye, https://wotlkdb.com/?spell=56074, -104.5, 105.625, 1.125, 1.1
Fractured Dragon's Eye, https://wotlkdb.com/?spell=56076, -104.5, 105.625, 1.125, 1.1
Lustrous Dragon's Eye, https://wotlkdb.com/?spell=56077, -104.5, 105.625, 1.125, 1.1
Mystic Dragon's Eye, https://wotlkdb.com/?spell=56079, -104.5, 105.625, 1.125, 1.1
Precise Dragon's Eye, https://wotlkdb.com/?spell=56081, -104.5, 105.625, 1.125, 1.1
Quick Dragon's Eye, https://wotlkdb.com/?spell=56083, -104.5, 105.625, 1.125, 1.1
Rigid Dragon's Eye, https://wotlkdb.com/?spell=56084, -104.5, 105.625, 1.125, 1.1
Smooth Dragon's Eye, https://wotlkdb.com/?spell=56085, -104.5, 105.625, 1.125, 1.1
Solid Dragon's Eye, https://wotlkdb.com/?spell=56086, -104.5, 105.625, 1.125, 1.1
Sparkling Dragon's Eye, https://wotlkdb.com/?spell=56087, -104.5, 105.625, 1.125, 1.1
Stormy Dragon's Eye, https://wotlkdb.com/?spell=56088, -104.5, 105.625, 1.125, 1.1
Thick Dragon's Eye, https://wotlkdb.com/?spell=56089, -104.5, 105.625, 1.125, 1.1
Powerful Earthsiege Diamond, https://wotlkdb.com/?spell=55399, -108.5001, 123.5, 14.9999, 12.1
Figurine - Jade Owl, https://wotlkdb.com/?spell=26872, -113.764, 113.914, 0.15, 0.1
Heavy Adamantite Ring, https://wotlkdb.com/?spell=31052, -116.65, 131.65, 15, 11.4
Sapphire Owl, https://wotlkdb.com/?spell=56202, -129.8593, 137.91, 8.0507, 5.8
Emerald Lion Ring, https://wotlkdb.com/?spell=34961, -136.4701, 144.47, 7.9999, 5.5
Figurine - Talasite Owl, https://wotlkdb.com/?spell=31082, -145.9996, 147.4996, 1.5, 1
Bracing Earthstorm Diamond, https://wotlkdb.com/?spell=32867, -147, 150, 3, 2
Tenacious Earthstorm Diamond, https://wotlkdb.com/?spell=32868, -147, 150, 3, 2
Insightful Earthstorm Diamond, https://wotlkdb.com/?spell=32870, -147, 150, 3, 2
Relentless Earthstorm Diamond, https://wotlkdb.com/?spell=39961, -147, 150, 3, 2
Eternal Earthstorm Diamond, https://wotlkdb.com/?spell=46597, -147, 150, 3, 2
Living Emerald Pendant, https://wotlkdb.com/?spell=26911, -157.3697, 158.62, 1.2503, 0.8
Twilight Serpent, https://wotlkdb.com/?spell=56201, -185.4093, 193.46, 8.0507, 4.2
Enigmatic Skyfire Diamond, https://wotlkdb.com/?spell=32874, -199, 499, 300, 60.1
Emerald Boar, https://wotlkdb.com/?spell=56203, -222.3092, 230.3599, 8.0507, 3.5
Figurine - Shadowsong Panther, https://wotlkdb.com/?spell=46778, -234.91, 236.41, 1.5, 0.6
Pendant of Withering, https://wotlkdb.com/?spell=31064, -243.2902, 247.2372, 3.947, 1.6
Monarch Crab, https://wotlkdb.com/?spell=59759, -248.3593, 256.41, 8.0507, 3.1
Pendant of Shadow's End, https://wotlkdb.com/?spell=31065, -255.4338, 259.3808, 3.947, 1.5
Braided Eternium Chain, https://wotlkdb.com/?spell=31070, -263.5, 386.5, 123, 31.8
Ring of Arcane Shielding, https://wotlkdb.com/?spell=37855, -271.7955, 275.4992, 3.7037, 1.3
Figurine - Dark Iron Scorpid, https://wotlkdb.com/?spell=26914, -284.9662, 286.4662, 1.5, 0.5
Figurine - Seaspray Albatross, https://wotlkdb.com/?spell=46779, -318.2492, 319.7492, 1.5, 0.5
Necklace of the Diamond Tower, https://wotlkdb.com/?spell=26915, -322.0448, 324.5666, 2.5218, 0.8
Figurine - Nightseye Panther, https://wotlkdb.com/?spell=31083, -335.33, 336.83, 1.5, 0.4
Figurine - Emerald Owl, https://wotlkdb.com/?spell=26909, -369.0516, 369.4266, 0.375, 0.1
The Black Pearl, https://wotlkdb.com/?spell=41415, -379.4778, 500.4778, 121, 24.2
Figurine - Felsteel Boar, https://wotlkdb.com/?spell=31079, -388.76, 389.96, 1.2, 0.3
Pendant of Thawing, https://wotlkdb.com/?spell=31063, -415.7926, 419.7396, 3.947, 0.9
Figurine - Black Diamond Crab, https://wotlkdb.com/?spell=26912, -424.9262, 426.4262, 1.5, 0.4
Ruby Hare, https://wotlkdb.com/?spell=56199, -439.1591, 447.2098, 8.0507, 1.8
Thick Felsteel Necklace, https://wotlkdb.com/?spell=31067, -465.0878, 469, 3.9122, 0.8
Pendant of the Null Rune, https://wotlkdb.com/?spell=31066, -479.0522, 482.9992, 3.947, 0.8
Destructive Skyfire Diamond, https://wotlkdb.com/?spell=32871, -496, 499, 3, 0.6
Mystical Skyfire Diamond, https://wotlkdb.com/?spell=32872, -496, 499, 3, 0.6
Swift Skyfire Diamond, https://wotlkdb.com/?spell=32873, -496, 499, 3, 0.6
Thundering Skyfire Diamond, https://wotlkdb.com/?spell=39963, -496, 499, 3, 0.6
Chaotic Skyfire Diamond, https://wotlkdb.com/?spell=44794, -496, 499, 3, 0.6
Ember Skyfire Diamond, https://wotlkdb.com/?spell=46601, -496, 499, 3, 0.6
Figurine - Dawnstone Crab, https://wotlkdb.com/?spell=31080, -509.88, 511.38, 1.5, 0.3
Blazing Eternium Band, https://wotlkdb.com/?spell=31061, -510.6782, 514.66, 3.9818, 0.8
Pendant of Frozen Flame, https://wotlkdb.com/?spell=31062, -512.2124, 516.1594, 3.947, 0.8
Embrace of the Dawn, https://wotlkdb.com/?spell=31072, -521.6682, 525.65, 3.9818, 0.8
Living Ruby Pendant, https://wotlkdb.com/?spell=31068, -573, 608, 35, 5.8
Heavy Felsteel Ring, https://wotlkdb.com/?spell=31058, -590.2963, 594, 3.7037, 0.6
Arcanite Sword Pendant, https://wotlkdb.com/?spell=26918, -596.435, 599.0264, 2.5914, 0.4
Khorium Band of Shadows, https://wotlkdb.com/?spell=31053, -612.3075, 616.185, 3.8775, 0.6
Delicate Eternium Ring, https://wotlkdb.com/?spell=31060, -626.8378, 630.75, 3.9122, 0.6
Khorium Inferno Band, https://wotlkdb.com/?spell=31055, -738.4578, 742.37, 3.9122, 0.5
Khorium Band of Leaves, https://wotlkdb.com/?spell=31056, -755.4534, 759.4004, 3.947, 0.5
Amulet of Flowing Life, https://wotlkdb.com/?spell=46126, -770.4145, 779.25, 8.8355, 1.1
Arcane Khorium Band, https://wotlkdb.com/?spell=31057, -835.0179, 838.9997, 3.9818, 0.5
Khorium Band of Frost, https://wotlkdb.com/?spell=31054, -883.0875, 886.9997, 3.9122, 0.4
Hard Khorium Band, https://wotlkdb.com/?spell=46124, -967.222, 4967.222, 4000, 80.5
Figurine - Empyrean Tortoise, https://wotlkdb.com/?spell=46775, -976.94, 978.44, 1.5, 0.2
Figurine - Khorium Boar, https://wotlkdb.com/?spell=46776, -988.8, 990, 1.2, 0.1
Pendant of Sunfire, https://wotlkdb.com/?spell=46125, -1522.9645, 1531.8, 8.8355, 0.6
Crown of the Sea Witch, https://wotlkdb.com/?spell=41418, -1958.7577, 1961.4334, 2.6757, 0.1
Hard Khorium Choker, https://wotlkdb.com/?spell=46127, -3335.2975, 3344.133, 8.8355, 0.3
Ring of Flowing Life, https://wotlkdb.com/?spell=46123, -3890.5324, 3896.558, 6.0256, 0.2
Loop of Forged Power, https://wotlkdb.com/?spell=46122, -4425.1964, 4431.222, 6.0256, 0.1
